id,conversation_id,created_at,date,time,timezone,user_id,username,name,place,tweet,language,mentions,urls,photos,replies_count,retweets_count,likes_count,hashtags,cashtags,link,retweet,quote_url,video,thumbnail,near,geo,source,user_rt_id,user_rt,retweet_id,reply_to,retweet_date,translate,trans_src,trans_dest
1157285258489946113,1157285258489946113,2019-08-02 10:41:21 -0300,2019-08-02,10:41:21,-300,108736394,afonso_motta,Afonso Motta,,"A gente percebe que um governo não vai bem quando a prioridade do seu ministro da Educação, @AbrahamWeint, após um corte que chega a R$ 6,2 bilhões na área, é implicar com um painel de mosaico do educador Paulo Freire.  @PDT_Nacional @PDTnaCamara   https://t.co/Wt8Ea6iCre",pt,"[{'screen_name': 'abrahamweint', 'name': 'abraham weintraub', 'id': '1120399498692497408'}, {'screen_name': 'pdt_nacional', 'name': 'pdt 12', 'id': '180500907'}, {'screen_name': 'pdtnacamara', 'name': 'pdt na câmara', 'id': '481498341'}]",['https://oglobo.globo.com/sociedade/e-ou-nao-feio-de-doer-escreve-abraham-weintraub-sobre-mural-de-paulo-freire-23848197'],[],6,1,6,[],[],https://twitter.com/afonso_motta/status/1157285258489946113,False,,0,,,,,,,,[],,,,
1157284584842768384,1157284584842768384,2019-08-02 10:38:40 -0300,2019-08-02,10:38:40,-300,108736394,afonso_motta,Afonso Motta,,"Importante vitória do PDT e, acima de tudo, da democracia! @ggreenwald @TheInterceptBr @PDTnaCamara @PDT_Nacional",pt,"[{'screen_name': 'ggreenwald', 'name': 'glenn greenwald', 'id': '16076032'}, {'screen_name': 'theinterceptbr', 'name': 'the intercept brasil', 'id': '751454653011951616'}, {'screen_name': 'pdtnacamara', 'name': 'pdt na câmara', 'id': '481498341'}, {'screen_name': 'pdt_nacional', 'name': 'pdt 12', 'id': '180500907'}]",[],[],1,0,2,[],[],https://twitter.com/afonso_motta/status/1157284584842768384,False,https://twitter.com/CarlosLupiPDT/status/1157045231981932544,0,,,,,,,,[],,,,
1156598035721461762,1156598035721461762,2019-07-31 13:10:34 -0300,2019-07-31,13:10:34,-300,108736394,afonso_motta,Afonso Motta,,Confira 5 pontos da reforma da Previdência que vão tirar dinheiro do seu bolso. #PressãoPelaAposentadoria  https://t.co/ftXZVXfZlR,pt,[],['http://bit.ly/2YuDkyp'],[],2,0,0,['pressãopelaaposentadoria'],[],https://twitter.com/afonso_motta/status/1156598035721461762,False,,0,,,,,,,,[],,,,
1156579761252175872,1156579761252175872,2019-07-31 11:57:57 -0300,2019-07-31,11:57:57,-300,108736394,afonso_motta,Afonso Motta,,"São R$ 348 milhões a menos p/a Educação no novo corte feito por Bolsonaro. O bloqueio total já soma R$ 1,4 bi. O maior corte ficou no Ministério da Cidadania, seguido da Educação, o maior sinal do que é prioridade para esse desgoverno. Lamentável!  https://t.co/O6cSWqmfYp",pt,[],['https://tinyurl.com/yybxvfcj'],[],0,0,0,[],[],https://twitter.com/afonso_motta/status/1156579761252175872,False,,0,,,,,,,,[],,,,
1156575333971386370,1156575333971386370,2019-07-31 11:40:22 -0300,2019-07-31,11:40:22,-300,108736394,afonso_motta,Afonso Motta,,"Bolsonaro ataca de novo direitos dos trabalhadores. Ao sugerir adaptar leis sobre trabalho escravo e alterar normas de segurança e saúde p/garantir mais ""competitividade"", Bolsonaro fere acordos com a OIT e a Constituição! #QuartaFeiraSemBolsonaro   https://t.co/74GJoYh3Iz",pt,[],['https://tinyurl.com/y6omzpfb'],[],0,1,3,['quartafeirasembolsonaro'],[],https://twitter.com/afonso_motta/status/1156575333971386370,False,,0,,,,,,,,[],,,,
1148656745084051456,1148656731041542147,2019-07-09 15:14:43 -0300,2019-07-09,15:14:43,-300,108736394,afonso_motta,Afonso Motta,,"Estamos posicionados. Vamos aparecer na telinha dizendo não, mas contamos com as companheiras e companheiros para nesta hora estarmos juntos e coesos. Somos Trabalhistas, seguidores de Brizola, Jango e Getúlio. Abraço, Deputado Afonso Motta #ReformaNão",pt,[],[],[],11,5,43,['reformanão'],[],https://twitter.com/afonso_motta/status/1148656745084051456,False,,0,,,,,,,,[],,,,
1148656743410524160,1148656731041542147,2019-07-09 15:14:43 -0300,2019-07-09,15:14:43,-300,108736394,afonso_motta,Afonso Motta,,"Portanto é chegado aquele momento de exposição, resistência e coragem onde vamos declarar o nosso voto. Não podemos nos intimidar nem cair no lugar comum daqueles que vivem na pós verdade, ameaçando a democracia e impondo o retrocesso. #ReformaNão",pt,[],[],[],1,5,25,['reformanão'],[],https://twitter.com/afonso_motta/status/1148656743410524160,False,,0,,,,,,,,[],,,,
1148656741246275585,1148656731041542147,2019-07-09 15:14:42 -0300,2019-07-09,15:14:42,-300,108736394,afonso_motta,Afonso Motta,,"6. Até agora contribuímos muito para que o projeto do governo fosse alterado para melhor. BPC, trabalhadores rurais, melhorias nas regras para os professores aumento de contribuições para os bancos e ainda vamos votar para incluir os estados e municípios. #ReformaNão",pt,[],[],[],1,4,16,['reformanão'],[],https://twitter.com/afonso_motta/status/1148656741246275585,False,,0,,,,,,,,[],,,,
1148656739656589312,1148656731041542147,2019-07-09 15:14:42 -0300,2019-07-09,15:14:42,-300,108736394,afonso_motta,Afonso Motta,,"5. A reforma não é tudo, sua derrota não vai levar o país para o caos como dizem. Os fundos para o ajuste fiscal poderiam também sair de uma justa reforma fiscal que tribute a renda e especialmente o capital financeiro; #ReformaNão",pt,[],[],[],1,7,23,['reformanão'],[],https://twitter.com/afonso_motta/status/1148656739656589312,False,,0,,,,,,,,[],,,,
1148656738054393857,1148656731041542147,2019-07-09 15:14:42 -0300,2019-07-09,15:14:42,-300,108736394,afonso_motta,Afonso Motta,,"4. A economia de aproximadamente 1 trilhão em 10 anos que a reforma poderá gerar, ninguém sabe ao certo, vai sair quase que na totalidade do Regime Geral da Previdência, significando que os que menos ganham serão penalizados; #ReformaNão",pt,[],[],[],3,8,21,['reformanão'],[],https://twitter.com/afonso_motta/status/1148656738054393857,False,,0,,,,,,,,[],,,,
1148656736301211650,1148656731041542147,2019-07-09 15:14:41 -0300,2019-07-09,15:14:41,-300,108736394,afonso_motta,Afonso Motta,,3. Não acreditamos no fiscalismo como solução para a previdência em detrimento da dignidade humana e do direito protetivo universal que é a aposentadoria para quem trabalha e contribui uma vida inteira. Nós ficamos ao lado dos trabalhadores e da dignidade humana; #ReformaNão,pt,[],[],[],1,5,20,['reformanão'],[],https://twitter.com/afonso_motta/status/1148656736301211650,False,,0,,,,,,,,[],,,,
1148656734615085056,1148656731041542147,2019-07-09 15:14:41 -0300,2019-07-09,15:14:41,-300,108736394,afonso_motta,Afonso Motta,,"2. Somos contra a proposta apresentada pelo Governo Bolsonaro e fechamos questão contra a aprovação. Muitas razões para este posicionamento como a desconstitucionalização total dos direitos, que agora e no futuro poderão ser alterados por lei ordinária; #ReformaNão",pt,[],[],[],16,22,71,['reformanão'],[],https://twitter.com/afonso_motta/status/1148656734615085056,False,,0,,,,,,,,[],,,,
1148656731041542147,1148656731041542147,2019-07-09 15:14:40 -0300,2019-07-09,15:14:40,-300,108736394,afonso_motta,Afonso Motta,,"A nossa Bancada, junto com a Executiva Nacional do PDT, temos o seguinte entendimento: 1. Não somos contra qualquer reforma da previdência. A nossa disposição foi participar ativamente do debate como estamos fazendo ainda agora em todos os espaços democráticos. #ReformaNão",pt,[],[],[],16,22,104,['reformanão'],[],https://twitter.com/afonso_motta/status/1148656731041542147,False,,0,,,,,,,,[],,,,
1148646370338844678,1148646370338844678,2019-07-09 14:33:30 -0300,2019-07-09,14:33:30,-300,108736394,afonso_motta,Afonso Motta,,"Hoje se inicia no plenário da Câmara a votação da Reforma da Previdência. Já manifestamos nossa posição contrária por entender que não combate privilégios, retira direitos e representa uma verdadeira afronta à dignidade do povo. Por isso, eu e o PDT votaremos NÃO à essa Reforma!  https://t.co/Grstw1wKul",pt,[],[],['https://pbs.twimg.com/media/D_DPyGUXsAMowG8.jpg'],18,25,137,[],[],https://twitter.com/afonso_motta/status/1148646370338844678,False,,1,https://pbs.twimg.com/media/D_DPyGUXsAMowG8.jpg,,,,,,,[],,,,
1146416355366834176,1146416355366834176,2019-07-03 10:52:13 -0300,2019-07-03,10:52:13,-300,108736394,afonso_motta,Afonso Motta,,Mudaram tudo para não mudar nada: novo texto da Previdência mantém retrocessos e retira direitos. #AReformaTeEngana #EssaReformaNao  https://t.co/zE2u83rqEe,pt,[],[],['https://pbs.twimg.com/media/D-jjXmFXoAI_-Tc.jpg'],63,5,23,"['areformateengana', 'essareformanao']",[],https://twitter.com/afonso_motta/status/1146416355366834176,False,,1,https://pbs.twimg.com/media/D-jjXmFXoAI_-Tc.jpg,,,,,,,[],,,,
1138106143576875008,1138106143576875008,2019-06-10 12:30:24 -0300,2019-06-10,12:30:24,-300,108736394,afonso_motta,Afonso Motta,,"Fruto do reconhecimento do trabalho realizado no Plenário,Comissões e Frentes Parlamentares.Sempre prezei pelo respeito de opiniões e acolhimento de sugestões nas articulações.Isso só foi possível pela indicação da Bancada pedetista p/atuar como vice-líder e coordenador da CCJ",pt,[],[],[],1,1,3,[],[],https://twitter.com/afonso_motta/status/1138106143576875008,False,https://twitter.com/afonso_motta/status/1138105363134386176,0,,,,,,,,[],,,,
1138105363134386176,1138105363134386176,2019-06-10 12:27:18 -0300,2019-06-10,12:27:18,-300,108736394,afonso_motta,Afonso Motta,,"Fui apontado pelo DIAP como um dos 100 políticos mais influentes do Congresso Nacional e um dos 36 ""cabeças"" da Câmara dos Deputados. Do RS, apenas seis deputados figuram na lista. Figuro ainda como um dos 29 parlamentares ""articuladores"" que trabalham pelo consenso e diálogo  https://t.co/92rJlyHLOm",pt,[],[],['https://pbs.twimg.com/media/D8tbW_PX4AADGW2.jpg'],0,0,2,[],[],https://twitter.com/afonso_motta/status/1138105363134386176,False,,1,https://pbs.twimg.com/media/D8tbW_PX4AADGW2.jpg,,,,,,,[],,,,
1135940296871747585,1135940296871747585,2019-06-04 13:04:06 -0300,2019-06-04,13:04:06,-300,108736394,afonso_motta,Afonso Motta,,A reforma da Previdência de Bolsonaro será o caminho para o fim da Previdência pública e da seguridade social. #QueReformaÉEssa  @PDTnaCamara @PDT_Nacional  https://t.co/aIhpIXKhBk,pt,"[{'screen_name': 'pdtnacamara', 'name': 'pdt na câmara', 'id': '481498341'}, {'screen_name': 'pdt_nacional', 'name': 'pdt 12', 'id': '180500907'}]",[],['https://pbs.twimg.com/media/D8Ord-7XUAAUhBJ.jpg'],6,2,4,['quereformaéessa'],[],https://twitter.com/afonso_motta/status/1135940296871747585,False,,1,https://pbs.twimg.com/media/D8Ord-7XUAAUhBJ.jpg,,,,,,,[],,,,
1135913730762395648,1135913730762395648,2019-06-04 11:18:32 -0300,2019-06-04,11:18:32,-300,108736394,afonso_motta,Afonso Motta,,Essa reforma da Previdência dificulta o acesso e reduz o valor da aposentadoria. É o trabalhador que vai pagar essa conta! #QueReformaÉEssa @eduardomoreira @PDTnaCamara @PDT_Nacional @PDTRS  https://t.co/x3cmKPRddF,pt,"[{'screen_name': 'eduardomoreira', 'name': 'eduardo moreira', 'id': '65749516'}, {'screen_name': 'pdtnacamara', 'name': 'pdt na câmara', 'id': '481498341'}, {'screen_name': 'pdt_nacional', 'name': 'pdt 12', 'id': '180500907'}, {'screen_name': 'pdtrs', 'name': 'pdt rs', 'id': '59824125'}]",[],[],1,2,3,['quereformaéessa'],[],https://twitter.com/afonso_motta/status/1135913730762395648,False,,1,https://pbs.twimg.com/ext_tw_video_thumb/1135912893919064065/pu/img/-tEhiG-c_120YXp6.jpg,,,,,,,[],,,,
1031565524541603840,1031565524541603840,2018-08-20 12:36:01 -0300,2018-08-20,12:36:01,-300,108736394,afonso_motta,Afonso Motta,,Reativando nossa conta! Abraço a todos.,pt,[],[],[],21,1,3,[],[],https://twitter.com/afonso_motta/status/1031565524541603840,False,,0,,,,,,,,[],,,,
1010265715419607041,1010265715419607041,2018-06-22 17:58:11 -0300,2018-06-22,17:58:11,-300,108736394,afonso_motta,Afonso Motta,,A sua contribuição é muito importante para alcançarmos o nosso objetivo. Acesse  https://t.co/QmYwQDMpaj e faça a sua doação. #SomosTodosPDT  https://t.co/eiayvsY9Cr,pt,[],['http://doacaolegal.com.br/pdt/afonso-motta'],['https://pbs.twimg.com/media/DgUvTbJXcAUFbVx.jpg'],4,0,1,['somostodospdt'],[],https://twitter.com/afonso_motta/status/1010265715419607041,False,,1,https://pbs.twimg.com/media/DgUvTbJXcAUFbVx.jpg,,,,,,,[],,,,
1006971850189168641,1006971850189168641,2018-06-13 15:49:32 -0300,2018-06-13,15:49:32,-300,108736394,afonso_motta,Afonso Motta,,A sua contribuição é muito importante para alcançarmos o nosso objetivo. Acesse  https://t.co/QmYwQDMpaj e faça a sua doação. #SomosTodosPDT  https://t.co/B8Aj4FHU8X,pt,[],['http://doacaolegal.com.br/pdt/afonso-motta'],['https://pbs.twimg.com/media/Dfl7jO4WsAAOTnk.jpg'],0,1,3,['somostodospdt'],[],https://twitter.com/afonso_motta/status/1006971850189168641,False,,1,https://pbs.twimg.com/media/Dfl7jO4WsAAOTnk.jpg,,,,,,,[],,,,
1005448214873608192,1005448214873608192,2018-06-09 10:55:09 -0300,2018-06-09,10:55:09,-300,108736394,afonso_motta,Afonso Motta,,"Deputado Afonso Motta fez a indicação de tratores, retroescavadeiras e rolos compactadores aos municípios: - Amaral Ferrador - Braga - Caiçara - Capivari do Sul - Ernestina - F. Varela - Gentil - Maquiné - Mariano Moro - R. do Sul - São F. de Assis - São V. do Sul - Três de Maio  https://t.co/VfU19mk1Zk",pt,[],[],['https://pbs.twimg.com/media/DfQRPlxWkAApzll.jpg'],1,0,4,[],[],https://twitter.com/afonso_motta/status/1005448214873608192,False,,1,https://pbs.twimg.com/media/DfQRPlxWkAApzll.jpg,,,,,,,[],,,,
1000790726647705600,1000790726647705600,2018-05-27 14:27:57 -0300,2018-05-27,14:27:57,-300,108736394,afonso_motta,Afonso Motta,,#AfonsoMotta  https://t.co/wfZ28VAIAG,und,[],[],['https://pbs.twimg.com/media/DeOF1shXcAAye6c.jpg'],0,1,3,['afonsomotta'],[],https://twitter.com/afonso_motta/status/1000790726647705600,False,,1,https://pbs.twimg.com/media/DeOF1shXcAAye6c.jpg,,,,,,,[],,,,
988906889781145600,988906889781145600,2018-04-24 19:25:50 -0300,2018-04-24,19:25:50,-300,108736394,afonso_motta,Afonso Motta,,"O Deputado Afonso Motta esteve hoje (24/04), na Marcha dos Vereadores que reúne vereadores de todo país aqui em Brasília. #afonsomotta #marchadosvereadores #municipalismo  https://t.co/8AAVMLeJdK",pt,[],[],['https://pbs.twimg.com/media/DblNjzJW0AAmupA.jpg'],0,0,3,"['afonsomotta', 'marchadosvereadores', 'municipalismo']",[],https://twitter.com/afonso_motta/status/988906889781145600,False,,1,https://pbs.twimg.com/media/DblNjzJW0AAmupA.jpg,,,,,,,[],,,,
988460321860964359,988460321860964359,2018-04-23 13:51:20 -0300,2018-04-23,13:51:20,-300,108736394,afonso_motta,Afonso Motta,,"Democracia, Educação em Tempo Integral, Direitos e Garantias dos Trabalhadores e Direcionamento das Politicas Públicas para os que mais precisam.  #afonsomotta #reformapolitica  https://t.co/dADiInfBuP",pt,[],[],['https://pbs.twimg.com/media/Dbe3alnW4AEIrJ3.jpg'],0,0,2,"['afonsomotta', 'reformapolitica']",[],https://twitter.com/afonso_motta/status/988460321860964359,False,,1,https://pbs.twimg.com/media/Dbe3alnW4AEIrJ3.jpg,,,,,,,[],,,,
976182690574684160,976182690574684160,2018-03-20 16:44:24 -0300,2018-03-20,16:44:24,-300,108736394,afonso_motta,Afonso Motta,,"MEMORIAL OSWALDO ARANHA  O Deputado Afonso Motta esteve no Ministério da Cultura com o Ministro Sérgio Sá Leitão, entregando o pedido do memorial Oswaldo Aranha para enquadramento na Lei Rouanet. O requerimento foi firmado pelo coordenador do memorial, Doutor Adão Faraco.  https://t.co/yRpntkjVB3",pt,[],[],['https://pbs.twimg.com/media/DYwY2_JWAAIEJq1.jpg'],0,1,1,[],[],https://twitter.com/afonso_motta/status/976182690574684160,False,,1,https://pbs.twimg.com/media/DYwY2_JWAAIEJq1.jpg,,,,,,,[],,,,
956848019802083328,956848019802083328,2018-01-26 09:15:19 -0200,2018-01-26,09:15:19,-300,108736394,afonso_motta,Afonso Motta,,#afonsomotta #erechim  https://t.co/0wPUEsfW2V,und,[],[],['https://pbs.twimg.com/media/DUdoMUNXcAE-dOD.jpg'],0,0,2,"['afonsomotta', 'erechim']",[],https://twitter.com/afonso_motta/status/956848019802083328,False,,1,https://pbs.twimg.com/media/DUdoMUNXcAE-dOD.jpg,,,,,,,[],,,,
955378317523406849,955378317523406849,2018-01-22 07:55:15 -0200,2018-01-22,07:55:15,-300,108736394,afonso_motta,Afonso Motta,,#afonsomotta #brizola  https://t.co/QIpfmSfNuC,und,[],[],['https://pbs.twimg.com/media/DUIvf4WXcAAlVri.jpg'],0,1,8,"['afonsomotta', 'brizola']",[],https://twitter.com/afonso_motta/status/955378317523406849,False,,1,https://pbs.twimg.com/media/DUIvf4WXcAAlVri.jpg,,,,,,,[],,,,
1530573813842432000,1530573813842432000,2022-05-28 12:36:48 -0300,2022-05-28,12:36:48,-300,108736394,afonso_motta,Afonso Motta,,"A inflação corroe o rendimento dos brasileiros! Para 58%, a economia está no caminho errado. No RS, a avaliação é a mesma. E não é para menos!O poder de compra caiu 21% nos últimos 3 anos.Sem um projeto nacional de desenvolvimento, o Brasil não vai avançar! https://t.co/4guk4VD8Cn",pt,[],['https://www.poder360.com.br/poderdata/poderdata-para-58-economia-do-brasil-esta-no-caminho-errado/'],[],1,0,1,[],[],https://twitter.com/afonso_motta/status/1530573813842432000,False,,0,,,,,,,,[],,,,
1527068745860059136,1527068745860059136,2022-05-18 20:28:55 -0300,2022-05-18,20:28:55,-300,108736394,afonso_motta,Afonso Motta,,"TCU aprovou a privatização da Eletrobras, estratégica p/o país. Além de representar piora dos serviços e aumento de tarifas, estatais cumprem função social importante de garantir acesso em localidades vulneráveis, onde o mercado não tem interesse.Grande perda p/o Estado e o povo!  https://t.co/dvgnG2SwsU",pt,[],[],['https://pbs.twimg.com/media/FTE87lUXEAEky2l.jpg'],1,3,6,[],[],https://twitter.com/afonso_motta/status/1527068745860059136,False,,1,https://pbs.twimg.com/media/FTE87lUXEAEky2l.jpg,,,,,,,[],,,,
1541512582074404869,1541512582074404869,2022-06-27 17:03:34 -0300,2022-06-27,17:03:34,-300,108736394,afonso_motta,Afonso Motta,,"Segundo SBPC, o maior fundo de financiamento da Ciência Nacional está bloqueado em mais de 44%. Com sucessivos e brutais cortes, muitas universidades estão a ponto de fecharem as portas. Não aceitamos que educação e ciência fiquem em segundo plano, pois são essenciais p/o Brasil!  https://t.co/A9pVPKA47B",pt,[],[],['https://pbs.twimg.com/media/FWSNhdVXEAEMNAN.jpg'],1,3,9,[],[],https://twitter.com/afonso_motta/status/1541512582074404869,False,,1,https://pbs.twimg.com/media/FWSNhdVXEAEMNAN.jpg,,,,,,,[],,,,
1541117652541870080,1541117652541870080,2022-06-26 14:54:15 -0300,2022-06-26,14:54:15,-300,108736394,afonso_motta,Afonso Motta,,"Grande tristeza e pesar c/a partida precoce do vereador Mauro Zacher, nosso amigo, parceiro de tantas caminhadas nessa luta por um Rio Grande e um Brasil mais desenvolvido. Toda a nossa solidariedade à esposa Anete, aos filhos Léo e Martina, à mãe Sandra, aos familiares e amigos  https://t.co/wcXMDOOHWK",pt,[],[],['https://pbs.twimg.com/media/FWMmVlWXoAIU_lH.jpg'],3,3,19,[],[],https://twitter.com/afonso_motta/status/1541117652541870080,False,,1,https://pbs.twimg.com/media/FWMmVlWXoAIU_lH.jpg,,,,,,,[],,,,
1539333831710457857,1539333831710457857,2022-06-21 16:45:59 -0300,2022-06-21,16:45:59,-300,108736394,afonso_motta,Afonso Motta,,"🌹18 anos sem Brizola! Inspiração é o fundamento de quem tem causa! E Brizola, não há dúvidas, é a síntese das nossas causas!  #BrizolaVive  https://t.co/SMiBNxWd5c",pt,[],[],[],3,4,16,['brizolavive'],[],https://twitter.com/afonso_motta/status/1539333831710457857,False,,1,https://pbs.twimg.com/ext_tw_video_thumb/1539333699388510210/pu/img/PqRGkOh4_cNCNZCz.jpg,,,,,,,[],,,,
1534938884387360768,1534938884387360768,2022-06-09 13:42:02 -0300,2022-06-09,13:42:02,-300,108736394,afonso_motta,Afonso Motta,,"Dados mostram que valor por aluno de alimentação no ensino médio e fundamental não chega a R$ 0,36! Com a alta da inflação e cortes na educação, o repasse do governo não garante alimentação digna p/alunos da rede pública. Educação precisa ser prioridade na agenda nacional!  https://t.co/92S24uHa8r",pt,[],[],['https://pbs.twimg.com/media/FU0yxdvX0AILreE.jpg'],1,2,8,[],[],https://twitter.com/afonso_motta/status/1534938884387360768,False,,1,https://pbs.twimg.com/media/FU0yxdvX0AILreE.jpg,,,,,,,[],,,,
