id,conversation_id,created_at,date,time,timezone,user_id,username,name,place,tweet,language,mentions,urls,photos,replies_count,retweets_count,likes_count,hashtags,cashtags,link,retweet,quote_url,video,thumbnail,near,geo,source,user_rt_id,user_rt,retweet_id,reply_to,retweet_date,translate,trans_src,trans_dest
1523131993181106181,1522587638519283712,2022-05-07 23:45:40 -03,2022-05-07,23:45:40,-300,267467458,aureoribeirorj,Aureo Ribeiro,,@AlexSan79430408 @nogueiralarissa Vamos nessa!🚀,pt,[],[],[],0,0,1,[],[],https://twitter.com/AureoRibeiroRJ/status/1523131993181106181,False,,0,,,,,,,,"[{'screen_name': 'AlexSan79430408', 'name': 'Alex Santos', 'id': '1521194015072428032'}, {'screen_name': 'nogueiralarissa', 'name': 'Larissa Nogueira', 'id': '55646080'}]",,,,
1520817038909972481,1520817038909972481,2022-05-01 14:26:52 -03,2022-05-01,14:26:52,-300,267467458,aureoribeirorj,Aureo Ribeiro,,"Infelizmente 35,9% de jovens nem estudam nem trabalham no Brasil.  Neste Dia do Trabalho, é preciso refletir. Por isso levanto e defendo a bandeira do empreendedorismo, e da geração de emprego e renda. Nossos jovens precisam de capacitação, de oportunidades e de incentivo.  https://t.co/3cPXZZSsYG",pt,[],[],[],1,2,13,[],[],https://twitter.com/AureoRibeiroRJ/status/1520817038909972481,False,,1,https://pbs.twimg.com/ext_tw_video_thumb/1520816924162236416/pu/img/zNW06-WtRXWb4Gyv.jpg,,,,,,,[],,,,
1519814945524826118,1519814945524826118,2022-04-28 20:04:54 -03,2022-04-28,20:04:54,-300,267467458,aureoribeirorj,Aureo Ribeiro,,"No período mais difícil da pandemia muitos professores buscaram, por conta própria, uma qualificação e até mesmo equipamentos para conseguir dar aula pela internet. Neste #DiadaEducação, é fundamental refletir: que país pensamos para o futuro sem investir em educação?#Educação  https://t.co/7Uw6iwL33L",pt,[],[],[],0,3,11,"['diadaeducação', 'educação']",[],https://twitter.com/AureoRibeiroRJ/status/1519814945524826118,False,,1,https://pbs.twimg.com/ext_tw_video_thumb/1519814848644845569/pu/img/SF4LIEPffA6sT8Ex.jpg,,,,,,,[],,,,
1519140925662195713,1519140925662195713,2022-04-26 23:26:35 -03,2022-04-26,23:26:35,-300,267467458,aureoribeirorj,Aureo Ribeiro,,"Mais um passo importante para o desenvolvimento do nosso país! O PL de Criptoeconomia foi aprovado no @SenadoFederal.  Agradeço ao @irajasenador, relator do projeto, pelo trabalho realizado.  Seguimos! #Cripto #Criptoeconomia #Bitcoin #Litecoin #Ethereum  https://t.co/sce7N8JSRq",pt,"[{'screen_name': 'senadofederal', 'name': 'senado federal', 'id': '40095953'}, {'screen_name': 'irajasenador', 'name': 'irajá', 'id': '259707478'}]",[],[],6,4,15,"['cripto', 'criptoeconomia', 'bitcoin', 'litecoin', 'ethereum']",[],https://twitter.com/AureoRibeiroRJ/status/1519140925662195713,False,,1,https://pbs.twimg.com/ext_tw_video_thumb/1519140861237514240/pu/img/zjHs09ru-HKxotvY.jpg,,,,,,,[],,,,
1519072959444492293,1519072959444492293,2022-04-26 18:56:31 -03,2022-04-26,18:56:31,-300,267467458,aureoribeirorj,Aureo Ribeiro,,"Ver Duque de Caxias sendo protagonista de algo tão importante como o Carnaval, que gera renda para tantos trabalhadores, nos traz alegria.",pt,[],[],[],0,2,11,[],[],https://twitter.com/AureoRibeiroRJ/status/1519072959444492293,False,,0,,,,,,,,[],,,,
1518964105872355330,1518964105872355330,2022-04-26 11:43:58 -03,2022-04-26,11:43:58,-300,267467458,aureoribeirorj,Aureo Ribeiro,,Ainda não conhece meu trabalho pela criptoeconomia? Ou conhece alguém que tenha interesse neste tema? Convido a acessar  https://t.co/AL0SZBni6k e participar! O diálogo é fundamental para avançarmos cada vez mais!  #AureoRibeiroPelaCriptoeconomia #Criptoeconomia #Criptomoedas  https://t.co/7R1dFhd4B1,pt,[],['http://deputadoaureo.com.br/zap'],[],0,1,10,"['aureoribeiropelacriptoeconomia', 'criptoeconomia', 'criptomoedas']",[],https://twitter.com/AureoRibeiroRJ/status/1518964105872355330,False,,1,https://pbs.twimg.com/ext_tw_video_thumb/1518963712958291968/pu/img/IwEBjQJiU7JfZ2nY.jpg,,,,,,,[],,,,
1518636397317525509,1518636397317525509,2022-04-25 14:01:46 -03,2022-04-25,14:01:46,-300,267467458,aureoribeirorj,Aureo Ribeiro,,"Não se faz política sem diálogo, é fundamental conversar com as pessoas e entender na ponta as necessidades de cada cidade do nosso Estado. Por isso, sua participação é muito importante. Faça parte da minha lista de transmissão através do link:  https://t.co/AL0SZBni6k. 😉👍  https://t.co/TbLsWGFnaj",pt,[],['http://deputadoaureo.com.br/zap'],['https://pbs.twimg.com/media/FRNGH3yXsAM4RqS.jpg'],0,1,8,[],[],https://twitter.com/AureoRibeiroRJ/status/1518636397317525509,False,,1,https://pbs.twimg.com/media/FRNGH3yXsAM4RqS.jpg,,,,,,,[],,,,
1516525488818339848,1516525488818339848,2022-04-19 18:13:46 -03,2022-04-19,18:13:46,-300,267467458,aureoribeirorj,Aureo Ribeiro,, https://t.co/efhtmmJh2t,und,[],[],['https://pbs.twimg.com/media/FQvH5ByWQAkC4nQ.jpg'],2,1,12,[],[],https://twitter.com/AureoRibeiroRJ/status/1516525488818339848,False,,1,https://pbs.twimg.com/media/FQvH5ByWQAkC4nQ.jpg,,,,,,,[],,,,
1513908847961849868,1513908847961849868,2022-04-12 12:56:11 -03,2022-04-12,12:56:11,-300,267467458,aureoribeirorj,Aureo Ribeiro,,"""Sem dinheiro para o gás"", disse a jovem Angélica, de 26 anos, que morreu após tentar cozinhar com álcool. Muito triste e de se lamentar que o #CustoBrasil, e todas as dificuldades com os preços altos, tem feito as pessoas colocarem as necessidades à frente da vida.",pt,[],[],[],0,1,5,['custobrasil'],[],https://twitter.com/AureoRibeiroRJ/status/1513908847961849868,False,,0,,,,,,,,[],,,,
1511817577344999438,1511817577344999438,2022-04-06 18:26:13 -03,2022-04-06,18:26:13,-300,267467458,aureoribeirorj,Aureo Ribeiro,,"A pandemia escancarou a necessidade de democratizar os recursos da cultura, afinal, são mais de 5 milhões de empregos diretos e indiretos gerados pelo setor.  Vetar a #LeiPauloGustavo é um retrocesso. Deveríamos investir na geração de emprego, renda e oportunidades.  https://t.co/rXI1SgwQ4W",pt,[],[],[],6,2,8,['leipaulogustavo'],[],https://twitter.com/AureoRibeiroRJ/status/1511817577344999438,False,,1,https://pbs.twimg.com/ext_tw_video_thumb/1511816420274888715/pu/img/_pe_VPfGpurzlI6T.jpg,,,,,,,[],,,,
1508499407712534531,1508499407712534531,2022-03-28 14:41:00 -03,2022-03-28,14:41:00,-300,267467458,aureoribeirorj,Aureo Ribeiro,,"Infelizmente, a evasão escolar cresceu muito durante a pandemia.   Como combater isso? O que cada agente político pode fazer para melhorar a educação da sua cidade?  Corre lá no meu canal no Youtube e assista o 3º Ep. da websérie:  https://t.co/4Noc0ZWR5y.  https://t.co/xVlUYYUDTi",pt,[],['https://youtu.be/quVt0e6YLmI'],[],2,1,9,[],[],https://twitter.com/AureoRibeiroRJ/status/1508499407712534531,False,,1,https://pbs.twimg.com/ext_tw_video_thumb/1508499225071472642/pu/img/RQJ24O7JxXg7Fonx.jpg,,,,,,,[],,,,
1507052126714871810,1507052126714871810,2022-03-24 14:50:01 -03,2022-03-24,14:50:01,-300,267467458,aureoribeirorj,Aureo Ribeiro,,"Encaramos a missão de democratizar o acesso à cultura por todo o estado do Rio de Janeiro. Vimos isso acontecer através da Lei Aldir Blanc, em que os recursos foram descentralizados  E por que não tornar essa política pública permanente?  #Cultura #EconomiaCriativa  https://t.co/Q59vxrSxIz",pt,[],[],[],0,3,8,"['cultura', 'economiacriativa']",[],https://twitter.com/AureoRibeiroRJ/status/1507052126714871810,False,,1,https://pbs.twimg.com/ext_tw_video_thumb/1507052060642099202/pu/img/jcAl1XQWc0RRoQIS.jpg,,,,,,,[],,,,
1506968325489844227,1506968325489844227,2022-03-24 09:17:01 -03,2022-03-24,09:17:01,-300,267467458,aureoribeirorj,Aureo Ribeiro,,Já estou aqui no fórum Regulação das Moedas Digitais promovido pelo @valoreconomico e @MercadoBitcoin.  Assista pelo Youtube:  https://t.co/e8oBWrNBPN  #MoedaDigital #Bitcoin #Litecoin #Ethereum #Economia #Finança #Criptoeconomia  https://t.co/EeUJsjn8TM,pt,"[{'screen_name': 'valoreconomico', 'name': 'valor econômico', 'id': '32529120'}, {'screen_name': 'mercadobitcoin', 'name': 'mercado bitcoin', 'id': '321345004'}]",['https://www.youtube.com/watch?v=QdsDpt1ZPic'],['https://pbs.twimg.com/media/FOnTspmXEAIDfJ8.jpg'],0,2,10,"['moedadigital', 'bitcoin', 'litecoin', 'ethereum', 'economia', 'finança', 'criptoeconomia']",[],https://twitter.com/AureoRibeiroRJ/status/1506968325489844227,False,,1,https://pbs.twimg.com/media/FOnTspmXEAIDfJ8.jpg,,,,,,,[],,,,
1506700878350364685,1506700878350364685,2022-03-23 15:34:17 -03,2022-03-23,15:34:17,-300,267467458,aureoribeirorj,Aureo Ribeiro,,"Na urgência de um atendimento, eles estão lá sempre em defesa da vida, fundamentais no dia a dia de qualquer cidade. Por isso, temos que valorizá-los! Votei a favor do PL 2564, que regulamenta o piso salarial dos profissionais da enfermagem. #AprovaPL2564",pt,[],[],[],1,1,5,['aprovapl2564'],[],https://twitter.com/AureoRibeiroRJ/status/1506700878350364685,False,,0,,,,,,,,[],,,,
1506370804338114563,1506370804338114563,2022-03-22 17:42:41 -03,2022-03-22,17:42:41,-300,267467458,aureoribeirorj,Aureo Ribeiro,,"Se em 2015 esse mercado das criptomoedas era muito desconhecido, hoje a gente já vê essa tecnologia avançar e ser presente na vida das pessoas. Assista o vídeo! 😉  Entre para o meu canal:  https://t.co/xGy7mD8TUv  #AureoRibeiro #Criptoeconomia #Cripto #Economia #Bitcoin #Exchange  https://t.co/Ut8o8IirLH",pt,[],['https://t.me/AureoRibeiroCriptomoedas'],[],1,2,5,"['aureoribeiro', 'criptoeconomia', 'cripto', 'economia', 'bitcoin', 'exchange']",[],https://twitter.com/AureoRibeiroRJ/status/1506370804338114563,False,,1,https://pbs.twimg.com/ext_tw_video_thumb/1506370082519371776/pu/img/79egMiFQJZMRMLeW.jpg,,,,,,,[],,,,
1506025546156806148,1506025546156806148,2022-03-21 18:50:45 -03,2022-03-21,18:50:45,-300,267467458,aureoribeirorj,Aureo Ribeiro,,"Uma educação mais inclusiva e acessível não significa só garantir a presença dos alunos com deficiência em sala de aula. Inclusão é um direito, não é um favor. E segregar os alunos com deficiência não é o caminho para que a gente tenha uma educação de qualidade e com equidade.",pt,[],[],[],0,2,9,[],[],https://twitter.com/AureoRibeiroRJ/status/1506025546156806148,False,,0,,,,,,,,[],,,,
1505982796585746432,1505982796585746432,2022-03-21 16:00:53 -03,2022-03-21,16:00:53,-300,267467458,aureoribeirorj,Aureo Ribeiro,,Segundo episódio no ar! O que um prefeito pode fazer? E um vereador? E um deputado federal? De uma coisa eu sei: o conhecimento é algo que ninguém pode tirar de você! Corre lá no meu canal no Youtube:  https://t.co/qbcyKAXRqI  #AureoRibeiroPeloRiodeJaneiro  #Investimentos #Emendas  https://t.co/7O3nzUrxbq,pt,[],['https://youtu.be/bDB0v7sRgxU'],[],0,2,5,"['aureoribeiropeloriodejaneiro', 'investimentos', 'emendas']",[],https://twitter.com/AureoRibeiroRJ/status/1505982796585746432,False,,1,https://pbs.twimg.com/ext_tw_video_thumb/1505982659956203521/pu/img/zcGBRsiSrWeoFSis.jpg,,,,,,,[],,,,
1503810361933324290,1503810361933324290,2022-03-15 16:08:24 -03,2022-03-15,16:08:24,-300,267467458,aureoribeirorj,Aureo Ribeiro,,"Infelizmente, não temos muito o que celebrar neste Dia do Consumidor. Com tudo caro, o poder de compra do brasileiro segue prejudicado e o empreendedor não consegue manter seu negócio. Que a tecnologia nos ajude a movimentar a economia, gerar empregos e vencer este Custo Brasil!",pt,[],[],[],2,1,10,[],[],https://twitter.com/AureoRibeiroRJ/status/1503810361933324290,False,,0,,,,,,,,[],,,,
1503802801113104387,1503802118918049802,2022-03-15 15:38:21 -03,2022-03-15,15:38:21,-300,267467458,aureoribeirorj,Aureo Ribeiro,,"@claudiocastroRJ Muito bom, governador! Esse é o primeiro passo para reconstruir a cidade imperial e ajudar as dezenas de famílias afetadas.",pt,[],[],[],0,0,1,[],[],https://twitter.com/AureoRibeiroRJ/status/1503802801113104387,False,,0,,,,,,,,"[{'screen_name': 'claudiocastroRJ', 'name': 'Cláudio Castro', 'id': '74792468'}]",,,,
1503436792263020546,1503436792263020546,2022-03-14 15:23:58 -03,2022-03-14,15:23:58,-300,267467458,aureoribeirorj,Aureo Ribeiro,,O que um deputado federal pode fazer por você? Como os investimentos que conseguimos em Brasília vão parar na sua cidade? O primeiro episódio está no ar! Corre lá no meu canal no Youtube:  https://t.co/MbdBjpa15O  #AureoRibeiroPeloRiodeJaneiro #RiodeJaneiro #Investimentos #Emendas  https://t.co/zgsVysQAvY,pt,[],['https://youtu.be/7uxLpnXEAyU'],[],1,1,2,"['aureoribeiropeloriodejaneiro', 'riodejaneiro', 'investimentos', 'emendas']",[],https://twitter.com/AureoRibeiroRJ/status/1503436792263020546,False,,1,https://pbs.twimg.com/ext_tw_video_thumb/1503436629196906502/pu/img/XPnIq1I251KXjSlq.jpg,,,,,,,[],,,,
1497200485656317963,1497200483148173315,2022-02-25 10:23:07 -03,2022-02-25,10:23:07,-300,267467458,aureoribeirorj,Aureo Ribeiro,,Apresentar outro Projeto de Lei agora parece apenas para postergar e tirar o protagonismo do Poder que tem a prerrogativa de legislar: o Congresso Nacional. Além de atrasar mais ainda uma regulamentação que quer oferecer maior segurança jurídica a quem quer investir em criptos.,pt,[],[],[],2,0,6,[],[],https://twitter.com/AureoRibeiroRJ/status/1497200485656317963,False,,0,,,,,,,,[],,,,
1497200483148173315,1497200483148173315,2022-02-25 10:23:06 -03,2022-02-25,10:23:06,-300,267467458,aureoribeirorj,Aureo Ribeiro,,"O @BancoCentralBR participou da tramitação do meu Projeto de Lei 2303, de 2015, e foi uma das instituições que revisou antes da entrega do relatório pelo relator. Ora, se o BC tivesse algo a acrescentar, seria naquele momento, não? +",pt,"[{'screen_name': 'bancocentralbr', 'name': 'banco central br', 'id': '222157159'}]",[],[],4,1,8,[],[],https://twitter.com/AureoRibeiroRJ/status/1497200483148173315,False,,0,,,,,,,,[],,,,
1496548720514584584,1496548720514584584,2022-02-23 15:13:14 -03,2022-02-23,15:13:14,-300,267467458,aureoribeirorj,Aureo Ribeiro,,"Chega de retrocessos! Vamos incentivar a geração de emprego e renda através da Cultura, por isso voto favorável à #LeiPauloGustavo. Precisamos democratizar os recursos e tornar permanente esses investimentos. Valorizar a Cultura é investir em milhões de empregos no Brasil.",pt,[],[],[],0,4,12,['leipaulogustavo'],[],https://twitter.com/AureoRibeiroRJ/status/1496548720514584584,False,,0,,,,,,,,[],,,,
1494395267193397249,1494395267193397249,2022-02-17 16:36:10 -03,2022-02-17,16:36:10,-300,267467458,aureoribeirorj,Aureo Ribeiro,,"Vetar a Lei Paulo Gustavo é um imenso retrocesso para o futuro de oportunidades e de geração de emprego e renda que queremos. É uma covardia com fazedores de cultura, artistas e todas as pessoas impactadas pela cultura. Não vamos aceitar esse absurdo!  #SancionaLeiPauloGustavo",pt,[],[],[],1,2,9,['sancionaleipaulogustavo'],[],https://twitter.com/AureoRibeiroRJ/status/1494395267193397249,False,,0,,,,,,,,[],,,,
1494394431683846154,1493307276303773707,2022-02-17 16:32:51 -03,2022-02-17,16:32:51,-300,267467458,aureoribeirorj,Aureo Ribeiro,,"@Roberto61557540 @gresmangueira Oi, Roberto! Pode enviar uma DM?",pt,[],[],[],0,0,0,[],[],https://twitter.com/AureoRibeiroRJ/status/1494394431683846154,False,,0,,,,,,,,"[{'screen_name': 'Roberto61557540', 'name': 'Roberto Félix', 'id': '1487446481019838468'}, {'screen_name': 'gresmangueira', 'name': 'Estação Primeira de Mangueira', 'id': '68775969'}]",,,,
1494049579070894100,1494049579070894100,2022-02-16 17:42:32 -03,2022-02-16,17:42:32,-300,267467458,aureoribeirorj,Aureo Ribeiro,,"Infelizmente, um cenário de guerra em Petrópolis. Muito triste ver como a cidade está com todos os problemas causados pelas chuvas. Estamos trabalhando para vencer os desafios e cuidar dos moradores. Minha solidariedade a todos petropolitanos.  #SOSPetrópolis #Petrópolis  https://t.co/4bcbiA5W8o",pt,[],[],[],1,1,8,"['sospetrópolis', 'petrópolis']",[],https://twitter.com/AureoRibeiroRJ/status/1494049579070894100,False,,1,https://pbs.twimg.com/ext_tw_video_thumb/1494049489086296068/pu/img/ETad3j4j6oIRfbAa.jpg,,,,,,,[],,,,
1493721503627718656,1493721503627718656,2022-02-15 19:58:53 -03,2022-02-15,19:58:53,-300,267467458,aureoribeirorj,Aureo Ribeiro,,Presente no Ato Nacional em prol da aprovação da #LeiPauloGustavo #AprovaLeiPauloGustavo #Cultura  @solidariedadeBR  https://t.co/yghj1H21HM,pt,"[{'screen_name': 'solidariedadebr', 'name': 'solidariedade', 'id': '1855295581'}]",[],['https://pbs.twimg.com/media/FLrDyNwXEAQnLmz.jpg'],4,3,9,"['leipaulogustavo', 'aprovaleipaulogustavo', 'cultura']",[],https://twitter.com/AureoRibeiroRJ/status/1493721503627718656,False,,1,https://pbs.twimg.com/media/FLrDyNwXEAQnLmz.jpg,,,,,,,[],,,,
1493591697296605189,1493591697296605189,2022-02-15 11:23:04 -03,2022-02-15,11:23:04,-300,267467458,aureoribeirorj,Aureo Ribeiro,,"Se não tiver um plano de retomada e de investimento para salvar os pequenos empresários, aqueles que geram emprego e renda, nós vamos ter um cenário muito pior do que estamos vivendo. É fundamental dar apoio e incentivo para vencer os desafios e gerar oportunidades.  https://t.co/jdTEJ7A9qI",pt,[],[],['https://pbs.twimg.com/media/FLpMV_wX0AEcfVQ.jpg'],1,2,12,[],[],https://twitter.com/AureoRibeiroRJ/status/1493591697296605189,False,,1,https://pbs.twimg.com/media/FLpMV_wX0AEcfVQ.jpg,,,,,,,[],,,,
1493307276303773707,1493307276303773707,2022-02-14 16:32:53 -03,2022-02-14,16:32:53,-300,267467458,aureoribeirorj,Aureo Ribeiro,,"O Carnaval vai muito além da festa e da folia. É também geração de emprego, renda e oportunidades. É a valorização da nossa cultura e de toda economia criativa.  #Cultura #EconomiaCriativa #AureoRibeiroPelaCultura #Carnaval @gresmangueira  https://t.co/EM1pZKjrOE",pt,"[{'screen_name': 'gresmangueira', 'name': 'estação primeira de mangueira', 'id': '68775969'}]",[],[],1,3,8,"['cultura', 'economiacriativa', 'aureoribeiropelacultura', 'carnaval']",[],https://twitter.com/AureoRibeiroRJ/status/1493307276303773707,False,,1,https://pbs.twimg.com/ext_tw_video_thumb/1493307165251182594/pu/img/bLwk9VYQzNJZJKHw.jpg,,,,,,,[],,,,
1492203405112225792,1492203405112225792,2022-02-11 15:26:30 -03,2022-02-11,15:26:30,-300,267467458,aureoribeirorj,Aureo Ribeiro,,Mais de 6 milhões de alunos não tiveram acesso à internet para estudar durante a pandemia. É fundamental pensar em soluções para amenizar a evasão escolar e gerar oportunidades.  Educação é um direito de todos! Acesse o link:  https://t.co/MaNQijZ6cg e deixe sua opinião! #Educação,pt,[],['https://opine.deputadoaureo.com.br/reforco-escolar/'],[],2,2,7,['educação'],[],https://twitter.com/AureoRibeiroRJ/status/1492203405112225792,False,,0,,,,,,,,[],,,,
1484238134888079360,1484238129305432065,2022-01-20 15:55:21 -03,2022-01-20,15:55:21,-300,267467458,aureoribeirorj,Aureo Ribeiro,,"Aliás, você, que tem interesse em criptomoedas, já assistiu a minha websérie? Clique no link:  https://t.co/XRaaNFRfJ7 e confira, em três episódios, um pouco sobre esse mercado e o que fazemos para que as pessoas não percam seu dinheiro em possíveis golpes.",pt,[],['http://t.ly/hKpo'],[],0,2,5,[],[],https://twitter.com/AureoRibeiroRJ/status/1484238134888079360,False,,0,,,,,,,,[],,,,
1484238132488937477,1484238129305432065,2022-01-20 15:55:21 -03,2022-01-20,15:55:21,-300,267467458,aureoribeirorj,Aureo Ribeiro,,Fico feliz e honrado de ter sido reconhecido pelo @BrCointelegraph e fazer parte das 50 personalidades mais relevantes do país quando o assunto é criptomoedas. Fruto do nosso trabalho e que não seria a mesma coisa sem a sua participação.+,pt,"[{'screen_name': 'brcointelegraph', 'name': 'cointelegraph brasil', 'id': '914663722970435584'}]",[],[],3,0,7,[],[],https://twitter.com/AureoRibeiroRJ/status/1484238132488937477,False,,0,,,,,,,,[],,,,
1484238129305432065,1484238129305432065,2022-01-20 15:55:20 -03,2022-01-20,15:55:20,-300,267467458,aureoribeirorj,Aureo Ribeiro,,Você que acompanha o nosso trabalho sabe do nosso compromisso em entender mais esse mercado e pensar em soluções para que haja segurança jurídica ao pequeno investidor brasileiro.+  https://t.co/3WLUOzhanI,pt,[],[],['https://pbs.twimg.com/media/FJkSovxWYAEanNu.jpg'],4,2,8,[],[],https://twitter.com/AureoRibeiroRJ/status/1484238129305432065,False,,1,https://pbs.twimg.com/media/FJkSovxWYAEanNu.jpg,,,,,,,[],,,,
1473381745315790859,1473381739296923653,2021-12-21 16:55:56 -03,2021-12-21,16:55:56,-300,267467458,aureoribeirorj,Aureo Ribeiro,,"Juntos podemos fazer a diferença no Natal de muita gente que sofreu com o impacto do Custo Brasil e ainda somar forças para valorizar o comércio local, a retomada da nossa economia e incentivar o empreendedorismo e a geração de emprego, renda e oportunidades!",pt,[],[],[],0,0,3,[],[],https://twitter.com/AureoRibeiroRJ/status/1473381745315790859,False,,0,,,,,,,,[],,,,
1473381742451081217,1473381739296923653,2021-12-21 16:55:56 -03,2021-12-21,16:55:56,-300,267467458,aureoribeirorj,Aureo Ribeiro,,"Se você ainda não comprou aquele presente para dar no Natal, está na dúvida e não sabe o que comprar, tenho uma sugestão pra você: que tal valorizar os pequenos empreendedores da sua cidade? Ou mesmo comprar no comércio do seu bairro? +",pt,[],[],[],1,0,4,[],[],https://twitter.com/AureoRibeiroRJ/status/1473381742451081217,False,,0,,,,,,,,[],,,,
1473381739296923653,1473381739296923653,2021-12-21 16:55:55 -03,2021-12-21,16:55:55,-300,267467458,aureoribeirorj,Aureo Ribeiro,,"A pandemia trouxe uma realidade muito nova para todos nós. Vimos esse impacto através do Custo Brasil, do desemprego, além do fechamento de pequenas empresas. Pontos estes que prejudicaram bastante, inclusive, os pequenos empreendedores e o comércio local. +",pt,[],[],[],1,1,5,[],[],https://twitter.com/AureoRibeiroRJ/status/1473381739296923653,False,,0,,,,,,,,[],,,,
1468970692183949322,1468736408689025028,2021-12-09 12:47:59 -03,2021-12-09,12:47:59,-300,267467458,aureoribeirorj,Aureo Ribeiro,,"@DaveDeveloper1 @ajubrito @tvcamara @RadioCamara Continuará operando, agora com mais segurança jurídica e mais, com reconhecimento desse ativo por parte dos órgãos oficiais para atos de transacionamentos.",pt,[],[],[],2,0,0,[],[],https://twitter.com/AureoRibeiroRJ/status/1468970692183949322,False,,0,,,,,,,,"[{'screen_name': 'DaveDeveloper1', 'name': 'Dave Developer', 'id': '1335324967978799104'}, {'screen_name': 'ajubrito', 'name': 'Alex Brito', 'id': '116041830'}, {'screen_name': 'tvcamara', 'name': 'TV Câmara', 'id': '39336282'}, {'screen_name': 'RadioCamara', 'name': 'Rádio Câmara', 'id': '36390281'}]",,,,
1468959500707131402,1468736408689025028,2021-12-09 12:03:31 -03,2021-12-09,12:03:31,-300,267467458,aureoribeirorj,Aureo Ribeiro,,"@ajubrito @tvcamara @RadioCamara Oi, Alex! O projeto foi apresentado em 2015, mas ele foi modificado ao longo do tempo, acompanhando a situação global das possibilidades das criptos.  Nesses 6 anos debatemos, ouvimos especialistas, visitamos países e várias outras ações. Leia o parecer:  https://t.co/ssCRj1ebSQ.",pt,[],['https://www.camara.leg.br/proposicoesWeb/prop_mostrarintegra?codteor=2121603&filename=Tramitacao-PL+2303/2015'],[],3,0,0,[],[],https://twitter.com/AureoRibeiroRJ/status/1468959500707131402,False,,0,,,,,,,,"[{'screen_name': 'ajubrito', 'name': 'Alex Brito', 'id': '116041830'}, {'screen_name': 'tvcamara', 'name': 'TV Câmara', 'id': '39336282'}, {'screen_name': 'RadioCamara', 'name': 'Rádio Câmara', 'id': '36390281'}]",,,,
1468958811645833221,1468785040671014918,2021-12-09 12:00:47 -03,2021-12-09,12:00:47,-300,267467458,aureoribeirorj,Aureo Ribeiro,,"@Pokemon66659980 Tratamos de vários assuntos urgentes e importantes aqui na Câmara. A regulamentação das criptos é um deles, afinal, quando há mais de 4 milhões de pessoas lesadas no país, nós precisamos dar atenção.",pt,[],[],[],45,0,3,[],[],https://twitter.com/AureoRibeiroRJ/status/1468958811645833221,False,,0,,,,,,,,[],,,,
1468958144931852300,1468736408689025028,2021-12-09 11:58:08 -03,2021-12-09,11:58:08,-300,267467458,aureoribeirorj,Aureo Ribeiro,,"@Fbartitos @tvcamara @RadioCamara Oi, Felipe.  Pra quem entende o mínimo de economia, percebeu ao declarar imposto de renda, viu que já havia campo para declaração de criptomoedas. Ou seja, já é tributado. rsrsrs o PL NÃO trata de tributação.  Por isso te convido a ler o projeto:  https://t.co/ssCRj1ebSQ.",pt,[],['https://www.camara.leg.br/proposicoesWeb/prop_mostrarintegra?codteor=2121603&filename=Tramitacao-PL+2303/2015'],[],3,0,0,[],[],https://twitter.com/AureoRibeiroRJ/status/1468958144931852300,False,,0,,,,,,,,"[{'screen_name': 'Fbartitos', 'name': 'Felipe Bastos Barbosa', 'id': '1465661026066743299'}, {'screen_name': 'tvcamara', 'name': 'TV Câmara', 'id': '39336282'}, {'screen_name': 'RadioCamara', 'name': 'Rádio Câmara', 'id': '36390281'}]",,,,
1468957526704025605,1468736408689025028,2021-12-09 11:55:40 -03,2021-12-09,11:55:40,-300,267467458,aureoribeirorj,Aureo Ribeiro,,"@ZeDfps_ @tvcamara @RadioCamara O Governo tem que fiscalizar as empresas e separar o joio do trigo. É por isso que milhões de brasileiros estão sendo lesados, enganados e roubados por empresas fraudulentas que operam no país.",pt,[],[],[],22,0,0,[],[],https://twitter.com/AureoRibeiroRJ/status/1468957526704025605,False,,0,,,,,,,,"[{'screen_name': 'ZeDfps_', 'name': 'Claudio Araujo ✪', 'id': '2877229125'}, {'screen_name': 'tvcamara', 'name': 'TV Câmara', 'id': '39336282'}, {'screen_name': 'RadioCamara', 'name': 'Rádio Câmara', 'id': '36390281'}]",,,,
