id,conversation_id,created_at,date,time,timezone,user_id,username,name,place,tweet,language,mentions,urls,photos,replies_count,retweets_count,likes_count,hashtags,cashtags,link,retweet,quote_url,video,thumbnail,near,geo,source,user_rt_id,user_rt,retweet_id,reply_to,retweet_date,translate,trans_src,trans_dest
1390715180112388100,1390715180112388100,2021-05-07 14:08:31 -0300,2021-05-07,14:08:31,-300,267467458,aureoribeirorj,Aureo Ribeiro,,"Prorrogar o auxílio emergencial para os fazedores de cultura é essencial para continuar a fazer a diferença na vida das pessoas.  O texto seguiu para sanção do presidente @jairbolsonaro.  #ProrrogaLeiAldirBlancJá, acesse o link e vote:  https://t.co/mbF3VLbrWM  Compartilhem! 👍🏻",pt,"[{'screen_name': 'jairbolsonaro', 'name': 'jair m. bolsonaro', 'id': '128372940'}]",['https://opine.deputadoaureo.com.br/prorrogaaldirblanc/'],[],2,1,6,['prorrogaleialdirblancjá'],[],https://twitter.com/AureoRibeiroRJ/status/1390715180112388100,False,,0,,,,,,,,[],,,,
1390384401964576777,1390384401964576777,2021-05-06 16:14:08 -0300,2021-05-06,16:14:08,-300,267467458,aureoribeirorj,Aureo Ribeiro,,"O auxílio emergencial foi importante na vida de milhões de brasileiros, inclusive para trabalhadores do setor cultural. Precisamos apoiar a prorrogação do benefício.   Clique no link abaixo e saiba mais sobre a importância de prorrogar a Lei Aldir Blanc.   https://t.co/pXJTcdYbvO",pt,[],['http://deputadoaureo.com.br/noticias/auxilio-emergencial-para-a-cultura-sera-prorrogado/'],[],5,2,6,[],[],https://twitter.com/AureoRibeiroRJ/status/1390384401964576777,False,,0,,,,,,,,[],,,,
1389564820396118019,1389564820396118019,2021-05-04 09:57:24 -0300,2021-05-04,09:57:24,-300,267467458,aureoribeirorj,Aureo Ribeiro,,A Comissão de Fiscalização Financeira e Controle começou.  Acompanhe através do Youtube:  https://t.co/nYrHwk3Mkj  https://t.co/kQ0HkTDD8C,pt,[],['https://youtu.be/SSltOnjUqO4'],['https://pbs.twimg.com/media/E0i51gnWUAE6E0R.jpg'],3,2,8,[],[],https://twitter.com/AureoRibeiroRJ/status/1389564820396118019,False,,1,https://pbs.twimg.com/media/E0i51gnWUAE6E0R.jpg,,,,,,,[],,,,
1388231461577318407,1388231461577318407,2021-04-30 17:39:07 -0300,2021-04-30,17:39:07,-300,267467458,aureoribeirorj,Aureo Ribeiro,,Protocolei hoje o relatório ao Projeto de Lei sobre Pesquisa Clínica com Seres Humanos e seu Sistema Nacional de Ética. Meu voto é pelo desenvolvimento científico do Brasil! Luto por um país com Saúde de qualidade e estamos no caminho! O PL segue para a CCJ. #VivaACiência,pt,[],[],[],6,2,10,['vivaaciência'],[],https://twitter.com/AureoRibeiroRJ/status/1388231461577318407,False,,0,,,,,,,,[],,,,
1387476858900557826,1387476858900557826,2021-04-28 15:40:35 -0300,2021-04-28,15:40:35,-300,267467458,aureoribeirorj,Aureo Ribeiro,,"Aprovamos hoje, na Comissão de Fiscalização Financeira e Controle, onde estou presidente, o convite aos Ministros da Infraestrutura, Meio Ambiente, Justiça e Saúde para prestar esclarecimentos sobre suas administrações, em especial durante a pandemia.  Siga acompanhando.  https://t.co/ll2toUAmlK",pt,[],[],['https://pbs.twimg.com/media/E0FO2PvWUAg0j12.jpg'],2,3,12,[],[],https://twitter.com/AureoRibeiroRJ/status/1387476858900557826,False,,1,https://pbs.twimg.com/media/E0FO2PvWUAg0j12.jpg,,,,,,,[],,,,
1387420653565927427,1387420653565927427,2021-04-28 11:57:15 -0300,2021-04-28,11:57:15,-300,267467458,aureoribeirorj,Aureo Ribeiro,,A vacina é a única arma e solução para combater a pandemia e ter a normalidade de volta.  #VacinaçãoemMassa  https://t.co/u2t2PGKhZc,pt,[],[],['https://pbs.twimg.com/media/E0EbulnXoAImlsp.jpg'],0,2,10,['vacinaçãoemmassa'],[],https://twitter.com/AureoRibeiroRJ/status/1387420653565927427,False,,1,https://pbs.twimg.com/media/E0EbulnXoAImlsp.jpg,,,,,,,[],,,,
1387388292811956224,1387388292811956224,2021-04-28 09:48:40 -0300,2021-04-28,09:48:40,-300,267467458,aureoribeirorj,Aureo Ribeiro,,Começamos os trabalhos. Acompanhe através do Youtube da @camaradeputados:  https://t.co/aSC1nXnS8c  #ComissãodeFiscalizaçãoFinanceiraeControle  https://t.co/K6mixwGyoV,pt,"[{'screen_name': 'camaradeputados', 'name': 'câmara dos deputados', 'id': '61843152'}]",['http://youtu.be/XW9LxzlcKlw'],['https://pbs.twimg.com/media/E0D-SzZWEAEfrjd.jpg'],0,1,5,['comissãodefiscalizaçãofinanceiraecontrole'],[],https://twitter.com/AureoRibeiroRJ/status/1387388292811956224,False,,1,https://pbs.twimg.com/media/E0D-SzZWEAEfrjd.jpg,,,,,,,[],,,,
1385262997602508800,1385262997602508800,2021-04-22 13:03:30 -0300,2021-04-22,13:03:30,-300,267467458,aureoribeirorj,Aureo Ribeiro,,Acabo de apresentar um projeto de lei na @camaradeputados para que vítimas e o MP possam utilizar gravações ambientais como provas para condenar criminosos. O Brasil precisa deixar de ser o país da impunidade!  Leia mais em:  https://t.co/JbiRthSP2C @o_antagonista @solidariedadeBR  https://t.co/F4vuRM6sTt,pt,"[{'screen_name': 'camaradeputados', 'name': 'câmara dos deputados', 'id': '61843152'}, {'screen_name': 'o_antagonista', 'name': 'o antagonista', 'id': '2880932962'}, {'screen_name': 'solidariedadebr', 'name': 'solidariedade', 'id': '1855295581'}]",['https://www.oantagonista.com/brasil/deputado-vai-tentar-derrubar-impedimento-do-uso-de-gravacoes-contra-criminosos/'],['https://pbs.twimg.com/media/EzlxWmEWEAME_KY.jpg'],1,1,7,[],[],https://twitter.com/AureoRibeiroRJ/status/1385262997602508800,False,,1,https://pbs.twimg.com/media/EzlxWmEWEAME_KY.jpg,,,,,,,[],,,,
1384577846149095424,1384577828088320003,2021-04-20 15:40:57 -0300,2021-04-20,15:40:57,-300,267467458,aureoribeirorj,Aureo Ribeiro,,Sem contar que garante também a renda para quem aluga os imóveis. É fundamental minimizar o impacto financeiro da pandemia no bolso dos cidadãos.  #AureoRibeiro,pt,[],[],[],1,0,9,['aureoribeiro'],[],https://twitter.com/AureoRibeiroRJ/status/1384577846149095424,False,,0,,,,,,,,[],,,,
1384577839303962633,1384577828088320003,2021-04-20 15:40:55 -0300,2021-04-20,15:40:55,-300,267467458,aureoribeirorj,Aureo Ribeiro,,"A ideia, com esse projeto, é fazer com que mais pessoas consigam manter seus contratos de locação e, assim, garantir abrigo tanto para pessoa física quanto para pessoa jurídica.+",pt,[],[],[],1,0,8,[],[],https://twitter.com/AureoRibeiroRJ/status/1384577839303962633,False,,0,,,,,,,,[],,,,
1384577834291769344,1384577828088320003,2021-04-20 15:40:54 -0300,2021-04-20,15:40:54,-300,267467458,aureoribeirorj,Aureo Ribeiro,,"Por isso, apresentei na Câmara dos Deputados o Projeto de Lei 1447/21, que pretende impedir o reajuste dos aluguéis residenciais e comerciais até o dia 31 de dezembro de 2022, como medida de combate e enfrentamento da crise econômica decorrente da pandemia.+",pt,[],[],[],1,0,2,[],[],https://twitter.com/AureoRibeiroRJ/status/1384577834291769344,False,,0,,,,,,,,[],,,,
1384577830391099393,1384577828088320003,2021-04-20 15:40:53 -0300,2021-04-20,15:40:53,-300,267467458,aureoribeirorj,Aureo Ribeiro,,"O dinheiro do aluguel é essencial na renda familiar, seja residencial, para manter a moradia e com os reajustes de imobiliárias, seja também no comércio, com a dificuldade de empreendedores de seguirem com o próprio negócio e manter as contas em dia, como o aluguel de sua loja.+",pt,[],[],[],1,0,2,[],[],https://twitter.com/AureoRibeiroRJ/status/1384577830391099393,False,,0,,,,,,,,[],,,,
1384577828088320003,1384577828088320003,2021-04-20 15:40:53 -0300,2021-04-20,15:40:53,-300,267467458,aureoribeirorj,Aureo Ribeiro,,"Os problemas causados pela pandemia, com a dificuldade de emprego e de gerar renda, foram determinantes no aumento do número de moradores de rua em praticamente todos os municípios do nosso Estado. Ainda mais quando o assunto é pagar aluguel.+",pt,[],[],[],5,2,10,[],[],https://twitter.com/AureoRibeiroRJ/status/1384577828088320003,False,,0,,,,,,,,[],,,,
1384487509770518530,1384487509770518530,2021-04-20 09:41:59 -0300,2021-04-20,09:41:59,-300,267467458,aureoribeirorj,Aureo Ribeiro,,"Começamos os trabalhos! Audiência pública na CFFC com o Controlador Geral da União, Wagner do Rosário, para debater os gastos com as férias do Presidente da República. O valor foi superior a 1,4 milhões de reais.  https://t.co/xuEszd9cnu",pt,[],[],['https://pbs.twimg.com/media/EzawDNcWQAElSQN.jpg'],4,2,11,[],[],https://twitter.com/AureoRibeiroRJ/status/1384487509770518530,False,,1,https://pbs.twimg.com/media/EzawDNcWQAElSQN.jpg,,,,,,,[],,,,
1384284754829144072,1384284754829144072,2021-04-19 20:16:18 -0300,2021-04-19,20:16:18,-300,267467458,aureoribeirorj,Aureo Ribeiro,,"Apresentei hoje, na @camaradeputados, um Projeto de Decreto Legislativo (PDL) contra a privatização do @CorreiosBR. O projeto susta o decreto que incluiu o Correios na lista de desestatização.",pt,"[{'screen_name': 'camaradeputados', 'name': 'câmara dos deputados', 'id': '61843152'}, {'screen_name': 'correiosbr', 'name': 'correios', 'id': '3254323396'}]",[],[],3,2,7,[],[],https://twitter.com/AureoRibeiroRJ/status/1384284754829144072,False,,0,,,,,,,,[],,,,
1384270708574879754,1384270708574879754,2021-04-19 19:20:30 -0300,2021-04-19,19:20:30,-300,267467458,aureoribeirorj,Aureo Ribeiro,,O que você acha sobre a privatização do Correios?👇🏻,pt,[],[],[],4,3,4,[],[],https://twitter.com/AureoRibeiroRJ/status/1384270708574879754,False,,0,,,,,,,,[],,,,
1384155151984848897,1384155151984848897,2021-04-19 11:41:19 -0300,2021-04-19,11:41:19,-300,267467458,aureoribeirorj,Aureo Ribeiro,,"Agradeço a Aliança Pesquisa Clínica Brasil, @Interfarma_ e @Abracro pelo apoio técnico na construção de meu voto ao PL7082/2017, que sou relator na CCJ. Nosso objetivo é tornar o Brasil referência no assunto de pesquisa, isso significa investimento e desenvolvimento para o país!",pt,"[{'screen_name': 'interfarma_', 'name': 'interfarma', 'id': '3364688704'}, {'screen_name': 'abracro', 'name': 'abracro', 'id': '545179992'}]",[],[],1,2,6,[],[],https://twitter.com/AureoRibeiroRJ/status/1384155151984848897,False,,0,,,,,,,,[],,,,
1383048230976503809,1383048230976503809,2021-04-16 10:22:48 -0300,2021-04-16,10:22:48,-300,267467458,aureoribeirorj,Aureo Ribeiro,,"Hoje, às 11h, estarei ao vivo na @radiotupi, no programa do Francisco Barbosa, e você é o meu convidado(a).  Acompanhe pelo Youtube da rádio e não esqueça de compartilhar com os amigos.  https://t.co/O2JUN5hWCK",pt,"[{'screen_name': 'radiotupi', 'name': 'rádio tupi', 'id': '38244535'}]",[],['https://pbs.twimg.com/media/EzGTB90WYAQeywu.jpg'],2,2,5,[],[],https://twitter.com/AureoRibeiroRJ/status/1383048230976503809,False,,1,https://pbs.twimg.com/media/EzGTB90WYAQeywu.jpg,,,,,,,[],,,,
1382815314732269576,1382815314732269576,2021-04-15 18:57:17 -0300,2021-04-15,18:57:17,-300,267467458,aureoribeirorj,Aureo Ribeiro,,Aprovamos na @camaradeputados o projeto que torna maior a pena para casos de abandono de incapaz e maus tratados a idosos.,pt,"[{'screen_name': 'camaradeputados', 'name': 'câmara dos deputados', 'id': '61843152'}]",[],[],0,1,6,[],[],https://twitter.com/AureoRibeiroRJ/status/1382815314732269576,False,,0,,,,,,,,[],,,,
1381390717260546050,1381390714173591562,2021-04-11 20:36:26 -0300,2021-04-11,20:36:26,-300,267467458,aureoribeirorj,Aureo Ribeiro,,"Por aqui continuo trabalhando e torcendo para que todos os brasileiros sejam vacinados o mais rápido possível e voltemos as nossas rotinas aos poucos, inclusive para acompanhar alguns jogos. 🙏🏻",pt,[],[],[],0,0,3,[],[],https://twitter.com/AureoRibeiroRJ/status/1381390717260546050,False,,0,,,,,,,,[],,,,
1381390714173591562,1381390714173591562,2021-04-11 20:36:25 -0300,2021-04-11,20:36:25,-300,267467458,aureoribeirorj,Aureo Ribeiro,,"Mais uma vez deu a lógica! Segue o líder, pois estamos em outro patamar. Mengão bi-campeão da Supercopa do Brasil. ❤️🖤  Foto de quando podíamos assistir um jogo assim, com estádio lotado e muita festa.+  https://t.co/4RMgItfCcq",pt,[],[],['https://pbs.twimg.com/media/EyuvhsOWgAASFNM.jpg'],3,0,5,[],[],https://twitter.com/AureoRibeiroRJ/status/1381390714173591562,False,,1,https://pbs.twimg.com/media/EyuvhsOWgAASFNM.jpg,,,,,,,[],,,,
1377361161679732736,1375086059554537473,2021-03-31 17:44:25 -0300,2021-03-31,17:44:25,-300,267467458,aureoribeirorj,Aureo Ribeiro,,"@wandolm @Gilliard_jorge @ArthurLira_ @rpsenador @policiafederal @AtlasQuantum Oi, Wando! Tudo bem?  São mais de 4 milhões de pessoas lesadas no Brasil, segundo a ABCripto. Dei entrada no pedido para abertura de uma CPI para investigar esses golpes.  Estou ansioso para que o presidente olhe para essa pauta. Precisamos de mobilização.  Contem comigo. Abraço!",pt,[],[],[],2,7,9,[],[],https://twitter.com/AureoRibeiroRJ/status/1377361161679732736,False,,0,,,,,,,,"[{'screen_name': 'wandolm', 'name': 'Wando Linhares', 'id': '151629804'}, {'screen_name': 'Gilliard_jorge', 'name': 'Gilliard  Jorge', 'id': '900567356270837761'}, {'screen_name': 'ArthurLira_', 'name': 'Arthur Lira', 'id': '1086390169970884613'}, {'screen_name': 'rpsenador', 'name': 'Rodrigo Pacheco Vardi', 'id': '1522686068482527233'}, {'screen_name': 'policiafederal', 'name': 'Polícia Federal', 'id': '106714016'}, {'screen_name': 'AtlasQuantum', 'name': 'Atlas Quantum', 'id': '737672401761280000'}]",,,,
1377361159754375168,1375544003681259521,2021-03-31 17:44:25 -0300,2021-03-31,17:44:25,-300,267467458,aureoribeirorj,Aureo Ribeiro,,@Sindguapor_RJ @jairbolsonaro @AmendoncaMJSP @capitaoXaugusto @depgurgel @FlavioBolsonaro 👏🏻,und,[],[],[],0,0,0,[],[],https://twitter.com/AureoRibeiroRJ/status/1377361159754375168,False,,0,,,,,,,,"[{'screen_name': 'Sindguapor_RJ', 'name': 'SINDGUAPOR-RJ', 'id': '974815868864679938'}, {'screen_name': 'jairbolsonaro', 'name': 'Jair M. Bolsonaro', 'id': '128372940'}, {'screen_name': 'depgurgel', 'name': 'Dep. Federal Gurgel', 'id': '245320150'}, {'screen_name': 'FlavioBolsonaro', 'name': 'Flavio Bolsonaro', 'id': '40053694'}]",,,,
1377361156940066816,1377361144373895168,2021-03-31 17:44:24 -0300,2021-03-31,17:44:24,-300,267467458,aureoribeirorj,Aureo Ribeiro,,"se arriscam todos os dias em meio ao coronavírus, é necessário entender onde está sendo gasto o dinheiro público e se é da forma que você, cidadão contribuinte, merece.",pt,[],[],[],1,1,7,[],[],https://twitter.com/AureoRibeiroRJ/status/1377361156940066816,False,,0,,,,,,,,[],,,,
1377361152250769410,1377361144373895168,2021-03-31 17:44:23 -0300,2021-03-31,17:44:23,-300,267467458,aureoribeirorj,Aureo Ribeiro,,"Convidamos o Ministro da Defesa, para vir à Comissão e que nos esclareça quais são as prioridades desse governo.  Enquanto milhões de famílias passam fome, saem de casa cedo todos os dias para trabalhar e levar sustento para dentro de casa, +",pt,[],[],[],3,0,7,[],[],https://twitter.com/AureoRibeiroRJ/status/1377361152250769410,False,,0,,,,,,,,[],,,,
1377361149767905284,1377361144373895168,2021-03-31 17:44:22 -0300,2021-03-31,17:44:22,-300,267467458,aureoribeirorj,Aureo Ribeiro,,"Por isso, o trabalho da Comissão de Fiscalização Financeira e Controle é importante para levar transparência e esclarecer fatos como gastos superfaturados de picanha, cerveja, filé, salmão e bacalhau feitos pelas Forças Armadas.+",pt,[],[],[],1,0,3,[],[],https://twitter.com/AureoRibeiroRJ/status/1377361149767905284,False,,0,,,,,,,,[],,,,
1377361144373895168,1377361144373895168,2021-03-31 17:44:21 -0300,2021-03-31,17:44:21,-300,267467458,aureoribeirorj,Aureo Ribeiro,,"No momento em que o país tem mais de 14 milhões de pessoas desempregadas, que falta comida na mesa das famílias e que não há previsão de vacinar toda a população, cada ação do Governo Federal é fundamental para amenizar a crise e ajudar o seu povo. +  https://t.co/n8pxlohpXb",pt,[],[],[],5,5,15,[],[],https://twitter.com/AureoRibeiroRJ/status/1377361144373895168,False,,1,https://pbs.twimg.com/ext_tw_video_thumb/1377360495284457472/pu/img/NNxzOZJUFSSh7Tkf.jpg,,,,,,,[],,,,
1377278760060395529,1377278757975769094,2021-03-31 12:16:59 -0300,2021-03-31,12:16:59,-300,267467458,aureoribeirorj,Aureo Ribeiro,,"Aprovamos hoje o convite para os Ministros da Saúde, Economia e Defesa, além do vice presidente da Caixa Econômica para prestar esclarecimentos.  Nosso mandato e presidência seguem firmes na defesa dos interesses do povo brasileiro!",pt,[],[],[],0,0,6,[],[],https://twitter.com/AureoRibeiroRJ/status/1377278760060395529,False,,0,,,,,,,,[],,,,
1377278757975769094,1377278757975769094,2021-03-31 12:16:59 -0300,2021-03-31,12:16:59,-300,267467458,aureoribeirorj,Aureo Ribeiro,,"Sob minha presidência, a Comissão de Fiscalização e Controle da @camaradeputados atuará de forma independente, seguindo competências constitucionais.  Acompanharemos de perto os trabalhos do Governo Federal, para que os recursos públicos sejam empregados corretamente!",pt,"[{'screen_name': 'camaradeputados', 'name': 'câmara dos deputados', 'id': '61843152'}]",[],[],1,1,7,[],[],https://twitter.com/AureoRibeiroRJ/status/1377278757975769094,False,,0,,,,,,,,[],,,,
1374899692744675334,1374888017974992899,2021-03-24 22:43:25 -0300,2021-03-24,22:43:25,-300,267467458,aureoribeirorj,Aureo Ribeiro,,"@miorela @ArthurLira_ @rpsenador @policiafederal Oi, Nita! Tudo bem?  São mais de 4 milhões de pessoas lesadas no Brasil, segundo a ABCripto. Dei entrada no pedido para abertura de uma CPI para investigar esses golpes.  Estou ansioso para que o presidente olhe para essa pauta.  Contem comigo. Grande abraço!",pt,[],[],[],0,1,2,[],[],https://twitter.com/AureoRibeiroRJ/status/1374899692744675334,False,,0,,,,,,,,"[{'screen_name': 'miorela', 'name': 'Nita', 'id': '97544891'}, {'screen_name': 'ArthurLira_', 'name': 'Arthur Lira', 'id': '1086390169970884613'}, {'screen_name': 'rpsenador', 'name': 'Rodrigo Pacheco', 'id': '762786918086180864'}, {'screen_name': 'policiafederal', 'name': 'Polícia Federal', 'id': '106714016'}]",,,,
1374899331371782148,1374889289335644161,2021-03-24 22:41:59 -0300,2021-03-24,22:41:59,-300,267467458,aureoribeirorj,Aureo Ribeiro,,"@elsonnicolas @ArthurLira_ @rpsenador @policiafederal Oi, Elson! Beleza?  São mais de 4 milhões de pessoas lesadas no Brasil, segundo a ABCripto. Dei entrada no pedido para abertura de uma CPI para investigar esses golpes.  Estou ansioso para que o presidente olhe para essa pauta.  Contem comigo. Abraço!",pt,[],[],[],0,0,3,[],[],https://twitter.com/AureoRibeiroRJ/status/1374899331371782148,False,,0,,,,,,,,"[{'screen_name': 'elsonnicolas', 'name': 'Elson dos Santos', 'id': '70998009'}, {'screen_name': 'ArthurLira_', 'name': 'Arthur Lira', 'id': '1086390169970884613'}, {'screen_name': 'rpsenador', 'name': 'Rodrigo Pacheco', 'id': '762786918086180864'}, {'screen_name': 'policiafederal', 'name': 'Polícia Federal', 'id': '106714016'}]",,,,
1374898698044510212,1374890337773223937,2021-03-24 22:39:28 -0300,2021-03-24,22:39:28,-300,267467458,aureoribeirorj,Aureo Ribeiro,,"@lexrms @ArthurLira_ @rpsenador @PF Oi, Leo! Beleza?  Sou autor de um projeto do segmento, para regulamentar a criptoeconomia no Brasil, e também fiz pedido para abertura de uma CPI para investigar esses golpes.  Estou ansioso para que o presidente olhe para essa pauta.  Contem comigo. Abraço!",pt,[],[],[],2,6,7,[],[],https://twitter.com/AureoRibeiroRJ/status/1374898698044510212,False,,0,,,,,,,,"[{'screen_name': 'lexrms', 'name': 'Leo Steinmann', 'id': '16917886'}, {'screen_name': 'ArthurLira_', 'name': 'Arthur Lira', 'id': '1086390169970884613'}, {'screen_name': 'rpsenador', 'name': 'Rodrigo Pacheco Vardi', 'id': '1522686068482527233'}, {'screen_name': 'PF', 'name': 'ParodyFang', 'id': '2778491'}]",,,,
1374898451331305473,1374893805699276803,2021-03-24 22:38:29 -0300,2021-03-24,22:38:29,-300,267467458,aureoribeirorj,Aureo Ribeiro,,"@fagreis @ArthurLira_ @rpsenador @policiafederal @AtlasQuantum Oi, Fernando! Tudo bem?  Sou autor de um projeto do segmento, para regulamentar a criptoeconomia no Brasil, e também fiz pedido para abertura de uma CPI para investigar esses golpes.  Estou ansioso para que o presidente olhe para essa pauta.  Contem comigo. Grande abraço!",pt,[],[],[],0,5,8,[],[],https://twitter.com/AureoRibeiroRJ/status/1374898451331305473,False,,0,,,,,,,,"[{'screen_name': 'fagreis', 'name': 'Fernando Reis', 'id': '1247006708699992064'}, {'screen_name': 'ArthurLira_', 'name': 'Arthur Lira', 'id': '1086390169970884613'}, {'screen_name': 'rpsenador', 'name': 'Rodrigo Pacheco', 'id': '762786918086180864'}, {'screen_name': 'policiafederal', 'name': 'Polícia Federal', 'id': '106714016'}, {'screen_name': 'AtlasQuantum', 'name': 'Atlas Quantum', 'id': '737672401761280000'}]",,,,
1374743953111650309,1374743953111650309,2021-03-24 12:24:34 -0300,2021-03-24,12:24:34,-300,267467458,aureoribeirorj,Aureo Ribeiro,,"Hoje a Comissão de Fiscalização e Controle aprovou um requerimento de minha autoria para convidar o ministro da saúde para prestar esclarecimentos sobre o combate da pandemia. Os brasileiros precisam saber, claramente, as medidas tomadas para socorrer o nosso povo. #VacinaJá",pt,[],[],[],1,1,7,['vacinajá'],[],https://twitter.com/AureoRibeiroRJ/status/1374743953111650309,False,,0,,,,,,,,[],,,,
1374544253456691200,1374544253456691200,2021-03-23 23:11:02 -0300,2021-03-23,23:11:02,-300,267467458,aureoribeirorj,Aureo Ribeiro,,"Hoje aprovamos na @camaradeputados a ampliação do teste do pezinho! Dessa forma o Sistema Único de Saúde (SUS) conseguirá diagnosticar mais mais de 50 doenças, incluída as 6 que já conseguimos detectar.  Um grande avanço para saúde e qualidade de vida das nossas crianças!",pt,"[{'screen_name': 'camaradeputados', 'name': 'câmara dos deputados', 'id': '61843152'}]",[],[],0,3,11,[],[],https://twitter.com/AureoRibeiroRJ/status/1374544253456691200,False,,0,,,,,,,,[],,,,
1374364005494558724,1374013902607020037,2021-03-23 11:14:48 -0300,2021-03-23,11:14:48,-300,267467458,aureoribeirorj,Aureo Ribeiro,,@claudiocastroRJ @SaudeGovRJ @PCERJ @cbmerjoficial 👏🏻🙏🏻,und,[],[],[],0,0,1,[],[],https://twitter.com/AureoRibeiroRJ/status/1374364005494558724,False,,0,,,,,,,,"[{'screen_name': 'claudiocastroRJ', 'name': 'Cláudio Castro', 'id': '74792468'}, {'screen_name': 'SaudeGovRJ', 'name': 'Secretaria de Estado de Saúde', 'id': '110758774'}, {'screen_name': 'PCERJ', 'name': 'Polícia Civil RJ', 'id': '2230413180'}, {'screen_name': 'cbmerjoficial', 'name': 'Bombeiros RJ', 'id': '4730986876'}]",,,,
1374363962054180867,1374363947260907522,2021-03-23 11:14:37 -0300,2021-03-23,11:14:37,-300,267467458,aureoribeirorj,Aureo Ribeiro,,"Da Câmara dos Deputados, sigo o trabalho focado na geração de emprego e oportunidade para todos. A qualificação é fundamental para que mais pessoas tenham oportunidade de gerar renda com o próprio negócio. Contem comigo para incentivar o empreendedorismo.",pt,[],[],[],0,1,5,[],[],https://twitter.com/AureoRibeiroRJ/status/1374363962054180867,False,,0,,,,,,,,[],,,,
1374363959197892609,1374363947260907522,2021-03-23 11:14:36 -0300,2021-03-23,11:14:36,-300,267467458,aureoribeirorj,Aureo Ribeiro,,"Você, que tem seu empreendimento, ou que conhece alguém que tenha, passou por todos esses conhecimentos antes de começar? Empreender exige preparo. +",pt,[],[],[],1,1,5,[],[],https://twitter.com/AureoRibeiroRJ/status/1374363959197892609,False,,0,,,,,,,,[],,,,
1374363956173799433,1374363947260907522,2021-03-23 11:14:36 -0300,2021-03-23,11:14:36,-300,267467458,aureoribeirorj,Aureo Ribeiro,,"Por exemplo: gerenciar equipe, controlar fluxo de caixa, negociar com fornecedores e parceiros, analisar o mercado, diminuir custos de forma inteligente e desenvolver estratégias de marketing... +",pt,[],[],[],1,0,3,[],[],https://twitter.com/AureoRibeiroRJ/status/1374363956173799433,False,,0,,,,,,,,[],,,,
1374363953401331719,1374363947260907522,2021-03-23 11:14:35 -0300,2021-03-23,11:14:35,-300,267467458,aureoribeirorj,Aureo Ribeiro,,"Mas a burocracia, a alta carga tributária, a falta de incentivo e os problemas de infraestrutura pesam contra o empreendedor. Sem falar da qualificação, já que muitos começam a tocar o próprio negócio mesmo sem ter conhecimentos importantes de gestão. +",pt,[],[],[],1,0,2,[],[],https://twitter.com/AureoRibeiroRJ/status/1374363953401331719,False,,0,,,,,,,,[],,,,
1374363947260907522,1374363947260907522,2021-03-23 11:14:34 -0300,2021-03-23,11:14:34,-300,267467458,aureoribeirorj,Aureo Ribeiro,,"É verdade que empreender nunca foi tarefa fácil no Brasil, mas apesar das dificuldades, ainda é uma forte tendência. Principalmente nesse momento de crise em que o desemprego cresce e as pessoas buscam por alternativas para gerar renda. +",pt,[],[],[],2,2,6,[],[],https://twitter.com/AureoRibeiroRJ/status/1374363947260907522,False,,0,,,,,,,,[],,,,
1373032876317536256,1373032876317536256,2021-03-19 19:05:22 -0300,2021-03-19,19:05:22,-300,267467458,aureoribeirorj,Aureo Ribeiro,,"Agradeço a @inifiocruz, em nome da diretora Valdilea Veloso, pela disposição e sugestões ao PL sobre o Sistema Nacional de Ética em Pesquisa Clínica com Seres Humanos, do qual sou relator. O Brasil como uma referência em desenvolvimento científico, esse é o nosso objetivo!",pt,"[{'screen_name': 'inifiocruz', 'name': 'ini/fiocruz', 'id': '1602070944'}]",[],[],2,2,6,[],[],https://twitter.com/AureoRibeiroRJ/status/1373032876317536256,False,,0,,,,,,,,[],,,,
1372308958665445387,1372308958665445387,2021-03-17 19:08:46 -0300,2021-03-17,19:08:46,-300,267467458,aureoribeirorj,Aureo Ribeiro,,"Hoje tivemos a primeira reunião da Comissão de Fiscalização e Controle sob minha presidência. Aprovamos importantes matérias, dentre elas o ato de fiscalização sobre o Programa Nacional de Alimentação Escolar (PNAE).  #Educação é a prioridade do nosso mandato! #AureoRibeiro  https://t.co/6h3tJd984N",pt,[],[],['https://pbs.twimg.com/media/EwtruFlWQAQuXQ-.jpg'],4,3,8,"['educação', 'aureoribeiro']",[],https://twitter.com/AureoRibeiroRJ/status/1372308958665445387,False,,1,https://pbs.twimg.com/media/EwtruFlWQAQuXQ-.jpg,,,,,,,[],,,,
