id,conversation_id,created_at,date,time,timezone,user_id,username,name,place,tweet,language,mentions,urls,photos,replies_count,retweets_count,likes_count,hashtags,cashtags,link,retweet,quote_url,video,thumbnail,near,geo,source,user_rt_id,user_rt,retweet_id,reply_to,retweet_date,translate,trans_src,trans_dest
1046716602258001920,1046716602258001920,2018-10-01 08:00:59 -0300,2018-10-01,08:00:59,-300,267467458,aureoribeirorj,Aureo Ribeiro,,No dia 7 você vai votar 7733 e mandar de volta para Brasília o deputado federal que votou CONTRA a Reforma Trabalhista e A FAVOR dos trabalhadores e trabalhadoras desse país. Nós não aceitamos nenhum direito a...  https://t.co/9axxHw3FQu,pt,[],['https://www.facebook.com/aureodeputado/videos/285970128677721/'],[],0,0,0,[],[],https://twitter.com/AureoRibeiroRJ/status/1046716602258001920,False,,0,,,,,,,,[],,,,
1046504997356273664,1046504997356273664,2018-09-30 18:00:09 -0300,2018-09-30,18:00:09,-300,267467458,aureoribeirorj,Aureo Ribeiro,,"Tem muita gente que me segue nas redes sociais, uma galera que acompanha o meu mandato há anos, mas não sabe exatamente onde e como tudo começou. 😱 Então, resolvi fazer um vídeo me apresentando. 😉 Eu comecei a...  https://t.co/W2BApKAm2M",pt,[],['https://www.facebook.com/aureodeputado/videos/2196428880594058/'],[],0,0,0,[],[],https://twitter.com/AureoRibeiroRJ/status/1046504997356273664,False,,0,,,,,,,,[],,,,
1046503234901331970,1046503234901331970,2018-09-30 17:53:08 -0300,2018-09-30,17:53:08,-300,267467458,aureoribeirorj,Aureo Ribeiro,,"Tem muita gente que me segue nas redes sociais, uma galera que acompanha o meu mandato há anos, mas não sabe exatamente onde e como tudo começou. 😱 Então, resolvi fazer um vídeo me apresentando. 😉 Eu...  https://t.co/YEHy7BMQan",pt,[],['https://www.facebook.com/DeputadoFederalAureo/videos/2658951650785302/'],[],0,0,0,[],[],https://twitter.com/AureoRibeiroRJ/status/1046503234901331970,False,,0,,,,,,,,[],,,,
1046451213691219968,1046451213691219968,2018-09-30 14:26:26 -0300,2018-09-30,14:26:26,-300,267467458,aureoribeirorj,Aureo Ribeiro,,"Meu amigo e minha amiga, eu conto com você! Falta apenas uma semana para a eleição e sabemos que muita gente ainda não tem candidato. Por isso, precisamos intensificar as nossas ações. Verifique se os seus...  https://t.co/H4alNJpaoy",pt,[],['https://www.facebook.com/DeputadoFederalAureo/videos/2658674870812980/'],[],0,1,4,[],[],https://twitter.com/AureoRibeiroRJ/status/1046451213691219968,False,,0,,,,,,,,[],,,,
1046450783145938944,1046450783145938944,2018-09-30 14:24:43 -0300,2018-09-30,14:24:43,-300,267467458,aureoribeirorj,Aureo Ribeiro,,"Meu amigo e minha amiga, eu conto com você! Falta apenas uma semana para a eleição e sabemos que muita gente ainda não tem candidato. Por isso, precisamos intensificar as nossas ações. Verifique se os seus...  https://t.co/vkCTA1q75S",pt,[],['https://www.facebook.com/aureodeputado/videos/2184162691841670/'],[],0,0,0,[],[],https://twitter.com/AureoRibeiroRJ/status/1046450783145938944,False,,0,,,,,,,,[],,,,
1046386877530624001,1046386877530624001,2018-09-30 10:10:47 -0300,2018-09-30,10:10:47,-300,267467458,aureoribeirorj,Aureo Ribeiro,,"Esse ano você vai votar para deputado federal AUREO 7733 ✌🏻, para deputado estadual, para senador (duas vagas), para governador e para presidente. Você já pesquisou e escolheu todos os seus representantes?...  https://t.co/51dPHXc8Lm",pt,[],['https://www.facebook.com/DeputadoFederalAureo/videos/2658274237519710/'],[],0,0,0,[],[],https://twitter.com/AureoRibeiroRJ/status/1046386877530624001,False,,0,,,,,,,,[],,,,
1046379595916869632,1046379595916869632,2018-09-30 09:41:51 -0300,2018-09-30,09:41:51,-300,267467458,aureoribeirorj,Aureo Ribeiro,,"Esse ano você vai votar para deputado federal AUREO 7733 ✌🏻, para deputado estadual, para senador (duas vagas), para governador e para presidente. Você já pesquisou e escolheu todos os seus representantes? Já...  https://t.co/I49jkFF0BQ",pt,[],['https://www.facebook.com/aureodeputado/videos/2055056147891897/'],[],0,0,0,[],[],https://twitter.com/AureoRibeiroRJ/status/1046379595916869632,False,,0,,,,,,,,[],,,,
1046001524026081280,1046001524026081280,2018-09-29 08:39:31 -0300,2018-09-29,08:39:31,-300,267467458,aureoribeirorj,Aureo Ribeiro,,Faltam 8⃣ dias para votar 7⃣7⃣3⃣3⃣ e confirmar ✔. Você já tem as informações da sua zona e seção eleitoral? Não deixe tudo para a última hora. 🕗 Organize tudo com antecedência para votar com tranquilidade!...  https://t.co/RvLRUVXvor,pt,[],['https://www.facebook.com/DeputadoFederalAureo/videos/2656338744379926/'],[],0,0,0,[],[],https://twitter.com/AureoRibeiroRJ/status/1046001524026081280,False,,0,,,,,,,,[],,,,
1045999184556564480,1045999184556564480,2018-09-29 08:30:13 -0300,2018-09-29,08:30:13,-300,267467458,aureoribeirorj,Aureo Ribeiro,,Faltam 8⃣ dias para votar 7⃣7⃣3⃣3⃣ e confirmar ✔. Você já tem as informações da sua zona e seção eleitoral? Não deixe tudo para a última hora. 🕗 Organize tudo com antecedência para votar com tranquilidade! Está...  https://t.co/WhabbI9d6G,pt,[],['https://www.facebook.com/aureodeputado/videos/1658882264223341/'],[],0,0,1,[],[],https://twitter.com/AureoRibeiroRJ/status/1045999184556564480,False,,0,,,,,,,,[],,,,
1045709270472433664,1045709270472433664,2018-09-28 13:18:13 -0300,2018-09-28,13:18:13,-300,267467458,aureoribeirorj,Aureo Ribeiro,,Eu sou o Aureo:  https://t.co/Ssfhjm9VkF via @YouTube,pt,"[{'screen_name': 'youtube', 'name': 'youtube', 'id': '10228272'}]",['http://youtu.be/65vOv1LzzUU?a'],[],0,0,0,[],[],https://twitter.com/AureoRibeiroRJ/status/1045709270472433664,False,,0,,,,,,,,[],,,,
1045707934808735744,1045707934808735744,2018-09-28 13:12:54 -0300,2018-09-28,13:12:54,-300,267467458,aureoribeirorj,Aureo Ribeiro,,Eu trabalho por você:  https://t.co/1nUf4yWiAT via @YouTube,pt,"[{'screen_name': 'youtube', 'name': 'youtube', 'id': '10228272'}]",['http://youtu.be/GAHVelgpp6s?a'],[],0,0,0,[],[],https://twitter.com/AureoRibeiroRJ/status/1045707934808735744,False,,0,,,,,,,,[],,,,
1045704956408401920,1045704956408401920,2018-09-28 13:01:04 -0300,2018-09-28,13:01:04,-300,267467458,aureoribeirorj,Aureo Ribeiro,,Contra as reformas:  https://t.co/vQXjp7Y381 via @YouTube,es,"[{'screen_name': 'youtube', 'name': 'youtube', 'id': '10228272'}]",['http://youtu.be/JnKtqR532c4?a'],[],0,0,0,[],[],https://twitter.com/AureoRibeiroRJ/status/1045704956408401920,False,,0,,,,,,,,[],,,,
1045680587103711234,1045680587103711234,2018-09-28 11:24:14 -0300,2018-09-28,11:24:14,-300,267467458,aureoribeirorj,Aureo Ribeiro,,Desesperança:  https://t.co/ecKbNkt7a2 via @YouTube,ca,"[{'screen_name': 'youtube', 'name': 'youtube', 'id': '10228272'}]",['http://youtu.be/zsfjiRY2BJc?a'],[],0,0,0,[],[],https://twitter.com/AureoRibeiroRJ/status/1045680587103711234,False,,0,,,,,,,,[],,,,
1045661559371026433,1045661559371026433,2018-09-28 10:08:37 -0300,2018-09-28,10:08:37,-300,267467458,aureoribeirorj,Aureo Ribeiro,,"Faltam 9 dias para apertar 7733 e dar mais um voto de confiança ao deputado federal que apresentou mais de 300 projetos de lei na Câmara dos Deputados. 📃🖋 Foram propostas na área da saúde, da educação, da...  https://t.co/HoQAc7ApPo",pt,[],['https://www.facebook.com/DeputadoFederalAureo/videos/2654643921216075/'],[],0,0,1,[],[],https://twitter.com/AureoRibeiroRJ/status/1045661559371026433,False,,0,,,,,,,,[],,,,
1045636958716932096,1045636958716932096,2018-09-28 08:30:52 -0300,2018-09-28,08:30:52,-300,267467458,aureoribeirorj,Aureo Ribeiro,,"Faltam 9 dias para apertar 7733 e dar mais um voto de confiança ao deputado federal que apresentou mais de 300 projetos de lei na Câmara dos Deputados. 📃🖋 Foram propostas na área da saúde, da educação, da...  https://t.co/UjaEcsbI74",pt,[],['https://www.facebook.com/aureodeputado/videos/1464361930333158/'],[],0,0,0,[],[],https://twitter.com/AureoRibeiroRJ/status/1045636958716932096,False,,0,,,,,,,,[],,,,
1045448578787872769,1045448578787872769,2018-09-27 20:02:19 -0300,2018-09-27,20:02:19,-300,267467458,aureoribeirorj,Aureo Ribeiro,,"O #PéNaEstrada da nossa campanha está atingindo todas as regiões do estado. Ontem visitei Volta Redonda e pude caminhar ao lado de pessoas que querem o bem para o povo. Em Itaboraí, já na parte da noite,...  https://t.co/wvavulAB5X",pt,[],['https://www.facebook.com/DeputadoFederalAureo/posts/2653670814646719'],[],0,0,0,['pénaestrada'],[],https://twitter.com/AureoRibeiroRJ/status/1045448578787872769,False,,0,,,,,,,,[],,,,
1045359458665164800,1045359458665164800,2018-09-27 14:08:11 -0300,2018-09-27,14:08:11,-300,267467458,aureoribeirorj,Aureo Ribeiro,,"O voto é a arma mais importante da democracia e terceirizar esse direito é se tornar parte do problema, não a solução. Votar consciente é a melhor estratégia contra a desesperança, o desemprego, a...  https://t.co/SCodl5SxrE",pt,[],['https://www.facebook.com/DeputadoFederalAureo/videos/2653214944692306/'],[],0,0,0,[],[],https://twitter.com/AureoRibeiroRJ/status/1045359458665164800,False,,0,,,,,,,,[],,,,
1045357431520460806,1045357431520460806,2018-09-27 14:00:08 -0300,2018-09-27,14:00:08,-300,267467458,aureoribeirorj,Aureo Ribeiro,,"O voto é a arma mais importante da democracia e terceirizar esse direito é se tornar parte do problema, não a solução. Votar consciente é a melhor estratégia contra a desesperança, o desemprego, a corrupção e a...  https://t.co/ssDNHbiNTB",pt,[],['https://www.facebook.com/aureodeputado/videos/2194790234129405/'],[],0,0,0,[],[],https://twitter.com/AureoRibeiroRJ/status/1045357431520460806,False,,0,,,,,,,,[],,,,
1045292432286519296,1045292432286519296,2018-09-27 09:41:51 -0300,2018-09-27,09:41:51,-300,267467458,aureoribeirorj,Aureo Ribeiro,,"Aureo Publicado por Fernanda Martins · 1 h ·  ⏰ Está chegando a hora de apertar 7⃣7⃣3⃣3⃣ e confirmar! ✅ Faltam apenas 🔟 dias, por isso precisamos mobilizar nossos amigos e parentes e expandir ainda mais a...  https://t.co/IEMVhl6UEY",pt,[],['https://www.facebook.com/DeputadoFederalAureo/videos/2652815184732282/'],[],0,0,0,[],[],https://twitter.com/AureoRibeiroRJ/status/1045292432286519296,False,,0,,,,,,,,[],,,,
1045266853344538625,1045266853344538625,2018-09-27 08:00:12 -0300,2018-09-27,08:00:12,-300,267467458,aureoribeirorj,Aureo Ribeiro,,"⏰ Está chegando a hora de apertar 7⃣7⃣3⃣3⃣ e confirmar! ✅ Faltam apenas 🔟 dias, por isso precisamos mobilizar nossos amigos e parentes e expandir ainda mais a #FamiliaAureo. Marque aqui aquele amigo do peito que...  https://t.co/RFSgacliMh",pt,[],['https://www.facebook.com/aureodeputado/videos/284927378786625/'],[],0,0,0,['familiaaureo'],[],https://twitter.com/AureoRibeiroRJ/status/1045266853344538625,False,,0,,,,,,,,[],,,,
1045089588660850689,1045089588660850689,2018-09-26 20:15:49 -0300,2018-09-26,20:15:49,-300,267467458,aureoribeirorj,Aureo Ribeiro,,"A droga tem destruído milhares de famílias todos os dias e dificilmente você nunca ouviu uma história parecida. Esse drama se alastra, por isso tenho trabalhado pela implantação de políticas públicas de...  https://t.co/0U415VRVRu",pt,[],['https://www.facebook.com/DeputadoFederalAureo/videos/2651872108159923/'],[],0,0,0,[],[],https://twitter.com/AureoRibeiroRJ/status/1045089588660850689,False,,0,,,,,,,,[],,,,
1045076056535957506,1045076056535957506,2018-09-26 19:22:03 -0300,2018-09-26,19:22:03,-300,267467458,aureoribeirorj,Aureo Ribeiro,,"A droga tem destruído milhares de famílias todos os dias e dificilmente você nunca ouviu uma história parecida. Esse drama se alastra, por isso tenho trabalhado pela implantação de políticas públicas de prevenção...  https://t.co/PlCcBrGy6I",pt,[],['https://www.facebook.com/aureodeputado/videos/310181746434567/'],[],0,0,0,[],[],https://twitter.com/AureoRibeiroRJ/status/1045076056535957506,False,,0,,,,,,,,[],,,,
1044382800600813568,1044382800600813568,2018-09-24 21:27:18 -0300,2018-09-24,21:27:18,-300,267467458,aureoribeirorj,Aureo Ribeiro,,Aí João! Valeu!!  https://t.co/R4Mxef8uco,pt,[],['https://www.facebook.com/aureodeputado/posts/1961553150557635'],[],0,0,0,[],[],https://twitter.com/AureoRibeiroRJ/status/1044382800600813568,False,,0,,,,,,,,[],,,,
1044271115206443008,1044271115206443008,2018-09-24 14:03:30 -0300,2018-09-24,14:03:30,-300,267467458,aureoribeirorj,Aureo Ribeiro,,"O João da Grande Rio, escola de samba de Duque de Caxias, me apoia porque sabe que comigo não tem enrolação. Compositor que é, o sambista resolveu fazer uma musiquinha para deixar isso ainda mais claro. 🎶🎵...  https://t.co/T15O3rBD7e",pt,[],['https://www.facebook.com/DeputadoFederalAureo/videos/2647867268560407/'],[],0,0,0,[],[],https://twitter.com/AureoRibeiroRJ/status/1044271115206443008,False,,0,,,,,,,,[],,,,
1044262097553686528,1044262097553686528,2018-09-24 13:27:40 -0300,2018-09-24,13:27:40,-300,267467458,aureoribeirorj,Aureo Ribeiro,,"O João da Grande Rio, escola de samba de Duque de Caxias, me apoia porque sabe que comigo não tem enrolação. Compositor que é, o sambista resolveu fazer uma musiquinha para deixar isso ainda mais claro. 🎶🎵 Se...  https://t.co/oL1naGeTlQ",pt,[],['https://www.facebook.com/aureodeputado/videos/2168908453368032/'],[],0,0,0,[],[],https://twitter.com/AureoRibeiroRJ/status/1044262097553686528,False,,0,,,,,,,,[],,,,
1044003784098271232,1044003784098271232,2018-09-23 20:21:13 -0300,2018-09-23,20:21:13,-300,267467458,aureoribeirorj,Aureo Ribeiro,,"Faltam 14 dias dias pro dia 7 de outubro e estamos como? #tamojunto Junto da dona de casa, do trabalhador da cidade e do trabalhador do campo.  Estamos numa grande corrente porque a gente sabe que o que está dando...  https://t.co/HvunSIRsAK",pt,[],['https://www.facebook.com/aureodeputado/videos/270332570262965/'],[],0,0,0,['tamojunto'],[],https://twitter.com/AureoRibeiroRJ/status/1044003784098271232,False,,0,,,,,,,,[],,,,
1044003783494258689,1044003783494258689,2018-09-23 20:21:13 -0300,2018-09-23,20:21:13,-300,267467458,aureoribeirorj,Aureo Ribeiro,,"Faltam 14 dias dias pro dia 7 de outubro e estamos como? #tamojunto Junto da dona de casa, do trabalhador da cidade e do trabalhador do campo.  Estamos numa grande corrente porque a gente sabe que o que...  https://t.co/cdueJSzkpg",pt,[],['https://www.facebook.com/DeputadoFederalAureo/videos/2646590948688039/'],[],0,1,2,['tamojunto'],[],https://twitter.com/AureoRibeiroRJ/status/1044003783494258689,False,,0,,,,,,,,[],,,,
1044002147392782338,1044002147392782338,2018-09-23 20:14:43 -0300,2018-09-23,20:14:43,-300,267467458,aureoribeirorj,Aureo Ribeiro,,"Faltam 14 dias dias pro dia 7 de outubro e estamos como? #tamojunto Junto da dona de casa, do trabalhador da cidade e do trabalhador do campo.  Estamos numa grande corrente porque a gente sabe que o que está dando...  https://t.co/JexTTpa92L",pt,[],['https://www.facebook.com/aureodeputado/videos/505422786594125/'],[],0,0,0,['tamojunto'],[],https://twitter.com/AureoRibeiroRJ/status/1044002147392782338,False,,0,,,,,,,,[],,,,
1043898527015886848,1043898527015886848,2018-09-23 13:22:58 -0300,2018-09-23,13:22:58,-300,267467458,aureoribeirorj,Aureo Ribeiro,,"Estar em cada cidade, em todas as regiões, receber o carinho do povo e entender qual é a necessidade real das pessoas. Essa é a minha política! Por onde passo, descubro novos amigos e apoiadores criativos....  https://t.co/4DU22uny67",pt,[],['https://www.facebook.com/DeputadoFederalAureo/videos/2646041528742981/'],[],0,0,1,[],[],https://twitter.com/AureoRibeiroRJ/status/1043898527015886848,False,,0,,,,,,,,[],,,,
1043894963015159809,1043894963015159809,2018-09-23 13:08:48 -0300,2018-09-23,13:08:48,-300,267467458,aureoribeirorj,Aureo Ribeiro,,"Estar em cada cidade, em todas as regiões, receber o carinho do povo e entender qual é a necessidade real das pessoas. Essa é a minha política! Por onde passo, descubro novos amigos e apoiadores criativos. 😁 Por...  https://t.co/BpjayT5bKy",pt,[],['https://www.facebook.com/aureodeputado/videos/306378339960248/'],[],0,0,2,[],[],https://twitter.com/AureoRibeiroRJ/status/1043894963015159809,False,,0,,,,,,,,[],,,,
1043631368285118464,1043631368285118464,2018-09-22 19:41:22 -0300,2018-09-22,19:41:22,-300,267467458,aureoribeirorj,Aureo Ribeiro,,"Hoje o dia foi sensacional! O bairro Pilar, em Caxias, mostrou que também é #FamiliaAureo. Fizemos uma caminhada super animada falando tudo o que a gente já fez pela nossa cidade e pelo nosso estado. Quero...  https://t.co/wvK3xUOktA",pt,[],['https://www.facebook.com/aureodeputado/videos/525430591215200/'],[],0,0,0,['familiaaureo'],[],https://twitter.com/AureoRibeiroRJ/status/1043631368285118464,False,,0,,,,,,,,[],,,,
1043522285972287488,1043522285972287488,2018-09-22 12:27:55 -0300,2018-09-22,12:27:55,-300,267467458,aureoribeirorj,Aureo Ribeiro,,I posted a new video to Facebook  https://t.co/g5dhAQbJbr,en,[],['https://www.facebook.com/aureodeputado/videos/704610526585650/'],[],0,0,0,[],[],https://twitter.com/AureoRibeiroRJ/status/1043522285972287488,False,,0,,,,,,,,[],,,,
1043509789744074752,1043509789744074752,2018-09-22 11:38:16 -0300,2018-09-22,11:38:16,-300,267467458,aureoribeirorj,Aureo Ribeiro,,"Começa agora a Arrancada 45 no Pilar, Caxias  https://t.co/Mxng6OykCq",pt,[],['https://www.facebook.com/aureodeputado/videos/983524148521063/'],[],0,0,0,[],[],https://twitter.com/AureoRibeiroRJ/status/1043509789744074752,False,,0,,,,,,,,[],,,,
1043486699135885312,1043486699135885312,2018-09-22 10:06:30 -0300,2018-09-22,10:06:30,-300,267467458,aureoribeirorj,Aureo Ribeiro,,"Faltam apenas 15 dias para votar 7⃣7⃣3⃣3⃣. Vamos juntos de casa em casa, com sorriso no rosto e o coração cheio de esperança. Tem gente séria trabalhando por você e sua família, viabilizando recursos para...  https://t.co/0JWoyA7irc",pt,[],['https://www.facebook.com/DeputadoFederalAureo/videos/2643826928964441/'],[],0,0,1,[],[],https://twitter.com/AureoRibeiroRJ/status/1043486699135885312,False,,0,,,,,,,,[],,,,
1043471156437835777,1043471156437835777,2018-09-22 09:04:45 -0300,2018-09-22,09:04:45,-300,267467458,aureoribeirorj,Aureo Ribeiro,,Faltam apenas 1⃣5⃣ dias para votar 7⃣7⃣3⃣3⃣. Vamos juntos de casa em casa com sorriso no rosto e o coração cheio de esperança.  Um Rio de Janeiro mais justo é possível! 💪🏽 #VamosJuntos  https://t.co/QMQoTidBbZ,pt,[],['https://www.facebook.com/DeputadoFederalAureo/videos/2643740905639710/'],[],0,0,1,['vamosjuntos'],[],https://twitter.com/AureoRibeiroRJ/status/1043471156437835777,False,,0,,,,,,,,[],,,,
1043165044954091521,1043165044954091521,2018-09-21 12:48:22 -0300,2018-09-21,12:48:22,-300,267467458,aureoribeirorj,Aureo Ribeiro,,"Seguindo a caminhada pelas ruas de Duque de Caxias, levo as nossas propostas e melhorias para cidade. No Jardim Primavera, mostrei todo trabalho prestado para a cidade, como as verbas para o Hospital do Olho...  https://t.co/3J8lSeSaKh",pt,[],['https://www.facebook.com/DeputadoFederalAureo/posts/2642230725790728'],[],0,0,1,[],[],https://twitter.com/AureoRibeiroRJ/status/1043165044954091521,False,,0,,,,,,,,[],,,,
1042548389609656320,1042548389609656320,2018-09-19 19:58:00 -0300,2018-09-19,19:58:00,-300,267467458,aureoribeirorj,Aureo Ribeiro,,"Eu passo por muitas cidades e sempre recebo muito carinho. São muitas selfies, abraços e troca de ideias com o povo nas ruas. Eu gosto muito desse contato e tenho o maior prazer em tirar fotos com as...  https://t.co/bIAiMsNHM6",pt,[],['https://www.facebook.com/DeputadoFederalAureo/videos/2639215126092288/'],[],0,0,3,[],[],https://twitter.com/AureoRibeiroRJ/status/1042548389609656320,False,,0,,,,,,,,[],,,,
1042544509215752192,1042544509215752192,2018-09-19 19:42:35 -0300,2018-09-19,19:42:35,-300,267467458,aureoribeirorj,Aureo Ribeiro,,"Eu passo por muitas cidades e sempre recebo muito carinho. São muitas selfies, abraços e troca de ideias com o povo nas ruas. Eu gosto muito desse contato e tenho o maior prazer em tirar fotos com as pessoas. ♥...  https://t.co/upQGzuoxyw",pt,[],['https://www.facebook.com/aureodeputado/videos/551323558648756/'],[],0,2,4,[],[],https://twitter.com/AureoRibeiroRJ/status/1042544509215752192,False,,0,,,,,,,,[],,,,
1042406930080251904,1042406930080251904,2018-09-19 10:35:53 -0300,2018-09-19,10:35:53,-300,267467458,aureoribeirorj,Aureo Ribeiro,,"Seguimos caminhando e conversando com a população sobre o nosso trabalho. A gente gosta do olho no olho e do compromisso. Itatiaia, mais uma vez obrigado pelo carinho.  🗓 Faltam 18 dias! #Aureo7733",pt,[],[],[],0,0,2,['aureo7733'],[],https://twitter.com/AureoRibeiroRJ/status/1042406930080251904,False,,0,,,,,,,,[],,,,
1042036417101094914,1042036417101094914,2018-09-18 10:03:36 -0300,2018-09-18,10:03:36,-300,267467458,aureoribeirorj,Aureo Ribeiro,,"O sonho de toda mãe é poder aproveitar cada segundo da licença-maternidade ao lado do seu bebê, e geralmente é assim. Mas existem casos em que o recém-nascido precisa de maiores cuidados hospitalares, e as...  https://t.co/rrybv0BZz9",pt,[],['https://www.facebook.com/DeputadoFederalAureo/videos/2636758043004663/'],[],0,0,1,[],[],https://twitter.com/AureoRibeiroRJ/status/1042036417101094914,False,,0,,,,,,,,[],,,,
1042020436924661761,1042020436924661761,2018-09-18 09:00:06 -0300,2018-09-18,09:00:06,-300,267467458,aureoribeirorj,Aureo Ribeiro,,"O sonho de toda mãe é poder aproveitar cada segundo da licença-maternidade ao lado do seu bebê, e geralmente é assim. Mas existem casos em que o recém-nascido precisa de maiores cuidados hospitalares, e as mamães...  https://t.co/D7ZkCCjusD",pt,[],['https://www.facebook.com/aureodeputado/videos/335771557217667/'],[],0,0,1,[],[],https://twitter.com/AureoRibeiroRJ/status/1042020436924661761,False,,0,,,,,,,,[],,,,
1041839513222361088,1041839513222361088,2018-09-17 21:01:11 -0300,2018-09-17,21:01:11,-300,267467458,aureoribeirorj,Aureo Ribeiro,,"O dia 7 de outubro está chegando. Por isso, vamos conversar com nossos amigos e familiares e contar sobre os mais de 300 projetos de lei que apresentei na Câmara dos Deputados. Projetos que melhoram a vida...  https://t.co/DkOlj2Hvcz",pt,[],['https://www.facebook.com/DeputadoFederalAureo/videos/2635869733093494/'],[],0,0,2,[],[],https://twitter.com/AureoRibeiroRJ/status/1041839513222361088,False,,0,,,,,,,,[],,,,
1041837722233647104,1041837722233647104,2018-09-17 20:54:04 -0300,2018-09-17,20:54:04,-300,267467458,aureoribeirorj,Aureo Ribeiro,,"O dia 7 de outubro está chegando. Por isso, vamos conversar com nossos amigos e familiares e contar sobre os mais de 300 projetos de lei que apresentei na Câmara dos Deputados. Projetos que melhoram a vida de...  https://t.co/SvN2abuoEH",pt,[],['https://www.facebook.com/aureodeputado/videos/2150054861936890/'],[],0,1,3,[],[],https://twitter.com/AureoRibeiroRJ/status/1041837722233647104,False,,0,,,,,,,,[],,,,
1041687416010993664,1041687416010993664,2018-09-17 10:56:48 -0300,2018-09-17,10:56:48,-300,267467458,aureoribeirorj,Aureo Ribeiro,,"Tem muita gente que me segue nas redes sociais, uma galera que me acompanha há anos, mas não sabe como tudo começou. 😱  Então, resolvi fazer um video me apresentando. 😉 É bem rapidinho! Confere aí alguns episódios marcantes da minha vida. ▶  https://t.co/7DsoLFZlYX",pt,[],['https://www.facebook.com/DeputadoFederalAureo/videos/2635089016504899/'],[],0,0,2,[],[],https://twitter.com/AureoRibeiroRJ/status/1041687416010993664,False,,0,,,,,,,,[],,,,
1041347242488152065,1041347242488152065,2018-09-16 12:25:04 -0300,2018-09-16,12:25:04,-300,267467458,aureoribeirorj,Aureo Ribeiro,,"A campanha da #FamíliaAureo esteve na Vila São Luis. Falamos sobre nossas propostas, sobre as realizações e tudo que conquistamos. #VamosJuntosSeguirEmFrente gastando sola de sapato e chegando em todos os...  https://t.co/OqSIEQGFuy",pt,[],['https://www.facebook.com/DeputadoFederalAureo/posts/2633480066665794'],[],0,1,3,"['famíliaaureo', 'vamosjuntosseguiremfrente']",[],https://twitter.com/AureoRibeiroRJ/status/1041347242488152065,False,,0,,,,,,,,[],,,,
1041055872305258497,1041055872305258497,2018-09-15 17:07:16 -0300,2018-09-15,17:07:16,-300,267467458,aureoribeirorj,Aureo Ribeiro,,"A melhor parte do meu trabalho é o carinho que recebo nas ruas. O abraço, a troca de ideias e a simpatia das pessoas não têm preço. Sigo com disposição para enfrentar os desafios e lutar por um Rio de...  https://t.co/Hc25594pvf",pt,[],['https://www.facebook.com/DeputadoFederalAureo/posts/2632042356809565'],[],0,1,2,[],[],https://twitter.com/AureoRibeiroRJ/status/1041055872305258497,False,,0,,,,,,,,[],,,,
1040960422684315648,1040960422684315648,2018-09-15 10:47:59 -0300,2018-09-15,10:47:59,-300,267467458,aureoribeirorj,Aureo Ribeiro,,"Ontem foi dia de caminhar pelo distrito de Santa Clara, em Porciúncula. Dia de rever amigos e de conversar com as donas de casa, os trabalhadores, gente de luta que quer uma cidade melhor. Conheci a Dona...  https://t.co/n7rOQpLsaI",pt,[],['https://www.facebook.com/DeputadoFederalAureo/posts/2631499343530533'],[],0,0,2,[],[],https://twitter.com/AureoRibeiroRJ/status/1040960422684315648,False,,0,,,,,,,,[],,,,
1040734278777069569,1040734278777069569,2018-09-14 19:49:22 -0300,2018-09-14,19:49:22,-300,267467458,aureoribeirorj,Aureo Ribeiro,,"A Dona Beth, do Gramacho, voltou à enxergar após uma cirurgia realizada no Hospital do Olho. 🏥 Existem muitas Donas Beths por aí, gente que não pode fazer coisas simples, como brincar com os netos ou...  https://t.co/m10NjEqBIw",pt,[],['https://www.facebook.com/DeputadoFederalAureo/videos/2630345386979262/'],[],0,0,2,[],[],https://twitter.com/AureoRibeiroRJ/status/1040734278777069569,False,,0,,,,,,,,[],,,,
