id,conversation_id,created_at,date,time,timezone,user_id,username,name,place,tweet,language,mentions,urls,photos,replies_count,retweets_count,likes_count,hashtags,cashtags,link,retweet,quote_url,video,thumbnail,near,geo,source,user_rt_id,user_rt,retweet_id,reply_to,retweet_date,translate,trans_src,trans_dest
1177395127356207105,1177395124680241152,2019-09-26 22:30:47 -0300,2019-09-26,22:30:47,-300,267467458,aureoribeirorj,Aureo Ribeiro,,"É isso que ouço de diversas pessoas que utilizam o celular para trabalhar, estudar, se comunicar e também se entreter. Uma das minhas principais bandeiras como deputado federal é em prol das pessoas com deficiência e para dar maior independência aos deficientes auditivos e/ou",pt,[],[],[],2,0,2,[],[],https://twitter.com/AureoRibeiroRJ/status/1177395127356207105,False,,0,,,,,,,,[],,,,
1177395124680241152,1177395124680241152,2019-09-26 22:30:47 -0300,2019-09-26,22:30:47,-300,267467458,aureoribeirorj,Aureo Ribeiro,,"O avanço tecnológico coloca à disposição das pessoas aplicativos e funções, através de smartphones, que facilitam o dia-a-dia do cidadão. Eles se tornaram mais que acessórios, eles viraram a extensão do nosso corpo.  https://t.co/bVwSlO93CL",pt,[],[],['https://pbs.twimg.com/tweet_video_thumb/EFbymU7WwAAQS4_.jpg'],1,1,4,[],[],https://twitter.com/AureoRibeiroRJ/status/1177395124680241152,False,,1,https://pbs.twimg.com/tweet_video_thumb/EFbymU7WwAAQS4_.jpg,,,,,,,[],,,,
1176840801801912325,1176840795682496514,2019-09-25 09:48:06 -0300,2019-09-25,09:48:06,-300,267467458,aureoribeirorj,Aureo Ribeiro,,"Esse é um passo importante para o desenvolvimento do Brasil, das transações financeiras e, principalmente, para a economia brasileira.   Assine a nossa petição eletrônica e apoie a CPI das moedas virtuais. 👇🏻   https://t.co/jzBH4QxhNx",pt,[],['https://opine.deputadoaureo.com.br/peticao-eletronica-moedas-virtuais/'],[],0,0,4,[],[],https://twitter.com/AureoRibeiroRJ/status/1176840801801912325,False,,0,,,,,,,,[],,,,
1176840800124252160,1176840795682496514,2019-09-25 09:48:06 -0300,2019-09-25,09:48:06,-300,267467458,aureoribeirorj,Aureo Ribeiro,,É por isso que estamos discutindo e debatendo o assunto na Comissão Especial de Regulação das Moedas Virtuais aqui na Câmara dos Deputados. A regulação é uma forma de combater crimes e de proteger consumidores e investidores.,pt,[],[],[],4,0,5,[],[],https://twitter.com/AureoRibeiroRJ/status/1176840800124252160,False,,0,,,,,,,,[],,,,
1176840798106767360,1176840795682496514,2019-09-25 09:48:05 -0300,2019-09-25,09:48:05,-300,267467458,aureoribeirorj,Aureo Ribeiro,,"Segundo dados da McAfee, empresa especializada em segurança da informação, o número de tentativas de golpes com criptomoedas cresceram cerca de 86% em 2019. Somente no segundo trimestre desde ano surgiram 2,5 milhões de novas pragas para roubo de criptomoedas.",pt,[],[],[],1,0,1,[],[],https://twitter.com/AureoRibeiroRJ/status/1176840798106767360,False,,0,,,,,,,,[],,,,
1176840795682496514,1176840795682496514,2019-09-25 09:48:04 -0300,2019-09-25,09:48:04,-300,267467458,aureoribeirorj,Aureo Ribeiro,,"Milhares de brasileiros são vítimas de golpes financeiros e esquemas fraudulentos com moedas virtuais. Usuários e investidores são atraídos com o discurso de ganhos elevados em um curto espaço de tempo e assim país começa a entrar em um cenário macabro, economicamente falando.  https://t.co/ttKQEWAOPk",pt,[],[],['https://pbs.twimg.com/media/EFT6doIXkAArm5f.jpg'],2,0,5,[],[],https://twitter.com/AureoRibeiroRJ/status/1176840795682496514,False,,1,https://pbs.twimg.com/media/EFT6doIXkAArm5f.jpg,,,,,,,[],,,,
1174394202840543237,1174394202840543237,2019-09-18 15:46:11 -0300,2019-09-18,15:46:11,-300,267467458,aureoribeirorj,Aureo Ribeiro,,Já estamos prontos para começar a audiência pública na Comissão Especial das moedas virtuais. Aguardando a finalização da audiência anterior ao nosso trabalho para iniciarmos.,pt,[],[],[],0,0,3,[],[],https://twitter.com/AureoRibeiroRJ/status/1174394202840543237,False,,0,,,,,,,,[],,,,
1174393566803767298,1174393289518268416,2019-09-18 15:43:40 -0300,2019-09-18,15:43:40,-300,267467458,aureoribeirorj,Aureo Ribeiro,,Parte 2.  https://t.co/WmZV6YomyC,es,[],[],[],0,0,3,[],[],https://twitter.com/AureoRibeiroRJ/status/1174393566803767298,False,,1,https://pbs.twimg.com/ext_tw_video_thumb/1174393453398151174/pu/img/7n5lc1_jw0jWNt3I.jpg,,,,,,,[],,,,
1174393289518268416,1174393289518268416,2019-09-18 15:42:34 -0300,2019-09-18,15:42:34,-300,267467458,aureoribeirorj,Aureo Ribeiro,,Parte 1.  https://t.co/KHnSKm6gVg,es,[],[],[],1,0,4,[],[],https://twitter.com/AureoRibeiroRJ/status/1174393289518268416,False,,1,https://pbs.twimg.com/ext_tw_video_thumb/1174393155388682254/pu/img/Cj31WdLaujpbb6lz.jpg,,,,,,,[],,,,
1173763516005793793,1173763510800650240,2019-09-16 22:00:04 -0300,2019-09-16,22:00:04,-300,267467458,aureoribeirorj,Aureo Ribeiro,,O país está evoluindo e é fundamental que todas as pessoas tenham acesso e conhecimento sobre que estamos debatendo na Câmara dos Deputados. Acompanhe aqui um pouco do nosso trabalho e participe.  Assista em seguida:,pt,[],[],[],0,0,3,[],[],https://twitter.com/AureoRibeiroRJ/status/1173763516005793793,False,,0,,,,,,,,[],,,,
1173763514848206848,1173763510800650240,2019-09-16 22:00:04 -0300,2019-09-16,22:00:04,-300,267467458,aureoribeirorj,Aureo Ribeiro,,"Tive a oportunidade de falar um pouco sobre a atuação do mandato em defesa dos usuários de criptomoedas durante Seminário da Abrajogo, que debateu sobre a regulamentação de jogos online no Brasil.",pt,[],[],[],1,0,4,[],[],https://twitter.com/AureoRibeiroRJ/status/1173763514848206848,False,,0,,,,,,,,[],,,,
1173763513682210817,1173763510800650240,2019-09-16 22:00:03 -0300,2019-09-16,22:00:03,-300,267467458,aureoribeirorj,Aureo Ribeiro,,"É por isso que estou convocando na Câmara dos Deputados uma Comissão Parlamentar de Inquérito (CPI), para apurar sobre fraudes com uso de moedas virtuais no país.",pt,[],[],[],1,0,2,[],[],https://twitter.com/AureoRibeiroRJ/status/1173763513682210817,False,,0,,,,,,,,[],,,,
1173763510800650240,1173763510800650240,2019-09-16 22:00:03 -0300,2019-09-16,22:00:03,-300,267467458,aureoribeirorj,Aureo Ribeiro,,As moedas virtuais vieram para ficar e é fundamental criar mecanismos que defendam os usuários de criptomoedas e quem quer usar este tipo de ativo.,pt,[],[],[],3,0,6,[],[],https://twitter.com/AureoRibeiroRJ/status/1173763510800650240,False,,0,,,,,,,,[],,,,
1172626854601252870,1172626854601252870,2019-09-13 18:43:23 -0300,2019-09-13,18:43:23,-300,267467458,aureoribeirorj,Aureo Ribeiro,,"Defendendo o consumidor aqui na Câmara dos Deputados, em Brasília.",pt,[],[],[],0,0,3,[],[],https://twitter.com/AureoRibeiroRJ/status/1172626854601252870,False,https://twitter.com/solidariedadeBR/status/1172530770273083392,0,,,,,,,,[],,,,
1172626496562896897,1172626485213048832,2019-09-13 18:41:57 -0300,2019-09-13,18:41:57,-300,267467458,aureoribeirorj,Aureo Ribeiro,,"Esse é o Brasil com educação e oportunidades que queremos. Continue acompanhando o nosso trabalho. Mande sua sugestão, pois o nosso mandato é participativo.  #AureoRibeiro #Educação #AureoRibeiroporSãoSebastiãoDoAlto",pt,[],[],[],0,0,6,"['aureoribeiro', 'educação', 'aureoribeiroporsãosebastiãodoalto']",[],https://twitter.com/AureoRibeiroRJ/status/1172626496562896897,False,,0,,,,,,,,[],,,,
1172626494063042560,1172626485213048832,2019-09-13 18:41:57 -0300,2019-09-13,18:41:57,-300,267467458,aureoribeirorj,Aureo Ribeiro,,"Acredito que ações efetivas para a educação precisam ser incentivadas, principalmente quando falamos de tecnologia para melhorar a pedagogia de ensino, facilitando e desenvolvendo as práticas dentro de sala de aula.  #AureoRibeiro #Educação #AureoRibeiroporSãoSebastiãoDoAlto",pt,[],[],[],1,0,5,"['aureoribeiro', 'educação', 'aureoribeiroporsãosebastiãodoalto']",[],https://twitter.com/AureoRibeiroRJ/status/1172626494063042560,False,,0,,,,,,,,[],,,,
1172626492167196674,1172626485213048832,2019-09-13 18:41:56 -0300,2019-09-13,18:41:56,-300,267467458,aureoribeirorj,Aureo Ribeiro,,"Foi uma emenda que trabalhamos muito para liberar e atender ao anseio da secretaria municipal de educação, do prefeito Tavinho Rodrigues, dos professores e também dos alunos.  #AureoRibeiro #Educação #AureoRibeiroporSãoSebastiãoDoAlto",pt,[],[],[],1,0,1,"['aureoribeiro', 'educação', 'aureoribeiroporsãosebastiãodoalto']",[],https://twitter.com/AureoRibeiroRJ/status/1172626492167196674,False,,0,,,,,,,,[],,,,
1172626489415786498,1172626485213048832,2019-09-13 18:41:56 -0300,2019-09-13,18:41:56,-300,267467458,aureoribeirorj,Aureo Ribeiro,,Hoje a rede municipal de ensino de São Sebastião do Alto recebeu mais de mil tablets para compor o ensino escolar das nossas crianças no município.  #AureoRibeiro #Educação #AureoRibeiroporSãoSebastiãoDoAlto,pt,[],[],[],1,0,1,"['aureoribeiro', 'educação', 'aureoribeiroporsãosebastiãodoalto']",[],https://twitter.com/AureoRibeiroRJ/status/1172626489415786498,False,,0,,,,,,,,[],,,,
1172626485213048832,1172626485213048832,2019-09-13 18:41:55 -0300,2019-09-13,18:41:55,-300,267467458,aureoribeirorj,Aureo Ribeiro,,Você que acompanha o nosso mandato e a atuação que temos no estado do Rio de Janeiro sabe da nossa luta pela educação escolar.  #AureoRibeiro #Educação #AureoRibeiroporSãoSebastiãoDoAlto  https://t.co/MnRjOXMtVy,pt,[],[],[],1,2,6,"['aureoribeiro', 'educação', 'aureoribeiroporsãosebastiãodoalto']",[],https://twitter.com/AureoRibeiroRJ/status/1172626485213048832,False,,1,https://pbs.twimg.com/ext_tw_video_thumb/1172626420671143938/pu/img/1xSaP8uP3AAaBisQ.jpg,,,,,,,[],,,,
1172152109413871617,1172152109413871617,2019-09-12 11:16:55 -0300,2019-09-12,11:16:55,-300,267467458,aureoribeirorj,Aureo Ribeiro,,Participação do @felipeneto na Audiência Pública sobre as mudanças dos direitos autorais que pode influenciar a internet no Brasil.  #AureoRibeiro  https://t.co/V4hkpiWcg7,pt,"[{'screen_name': 'felipeneto', 'name': 'felipe neto 🦉', 'id': '14128609'}]",[],[],0,0,3,['aureoribeiro'],[],https://twitter.com/AureoRibeiroRJ/status/1172152109413871617,False,,1,https://pbs.twimg.com/ext_tw_video_thumb/1172151973518467074/pu/img/CykKo0WWgu6CdR5I.jpg,,,,,,,[],,,,
1172144179130052608,1172144168879251457,2019-09-12 10:45:24 -0300,2019-09-12,10:45:24,-300,267467458,aureoribeirorj,Aureo Ribeiro,,Foram convidados: 1. Representante do @googlebrasil; 2. Representante do Comitê Gestor de Internet no Brasil; 3. O youtuber @felipeneto; 4. Representante da Federação Internacional da Indústria Fonográfica.,pt,"[{'screen_name': 'googlebrasil', 'name': 'google brasil', 'id': '41909879'}, {'screen_name': 'felipeneto', 'name': 'felipe neto 🦉', 'id': '14128609'}]",[],[],0,0,4,[],[],https://twitter.com/AureoRibeiroRJ/status/1172144179130052608,False,,0,,,,,,,,[],,,,
1172144176760262657,1172144168879251457,2019-09-12 10:45:23 -0300,2019-09-12,10:45:23,-300,267467458,aureoribeirorj,Aureo Ribeiro,,Requeri a realização de uma audiência pública para discutir a polêmica em torno das mudanças nas regras de direitos autorais aprovada pelo parlamento europeu e possíveis efeitos e desdobramentos das mudanças no Brasil.,pt,[],[],[],1,0,4,[],[],https://twitter.com/AureoRibeiroRJ/status/1172144176760262657,False,,0,,,,,,,,[],,,,
1172144174793220096,1172144168879251457,2019-09-12 10:45:23 -0300,2019-09-12,10:45:23,-300,267467458,aureoribeirorj,Aureo Ribeiro,,Os principais críticos da proposta defendem que essas mudanças podem colocar em risco os principais fundamentos da internet como conhecemos hoje.,pt,[],[],[],1,0,1,[],[],https://twitter.com/AureoRibeiroRJ/status/1172144174793220096,False,,0,,,,,,,,[],,,,
1172144172008181761,1172144168879251457,2019-09-12 10:45:22 -0300,2019-09-12,10:45:22,-300,267467458,aureoribeirorj,Aureo Ribeiro,,"Parlamentares europeus afirmam que tal norma representa uma revolução na legislação de direitos autorais. No entanto, o tema é polêmico.",pt,[],[],[],1,0,1,[],[],https://twitter.com/AureoRibeiroRJ/status/1172144172008181761,False,,0,,,,,,,,[],,,,
1172144168879251457,1172144168879251457,2019-09-12 10:45:21 -0300,2019-09-12,10:45:21,-300,267467458,aureoribeirorj,Aureo Ribeiro,,"O Parlamento Europeu aprovou, em março de 2019, mudanças nas regras de direitos autorais que afetará os produtores de conteúdos para internet e as plataformas digitais que agregam esses conteúdos, como Google e Facebook.",pt,[],[],[],1,0,4,[],[],https://twitter.com/AureoRibeiroRJ/status/1172144168879251457,False,,0,,,,,,,,[],,,,
1172142524670107648,1172142524670107648,2019-09-12 10:38:49 -0300,2019-09-12,10:38:49,-300,267467458,aureoribeirorj,Aureo Ribeiro,,"Estamos aqui na Comissão de Defesa do Consumidor para a audiência pública sobre a mudança nas regras de direitos autorais.  O @felipeneto não pôde comparecer, mas enviou sua contribuição para a Comissão.  Felipe, o que você acha? Agradecemos sua contribuição.  #AureoRibeiro  https://t.co/8jnqjxpDZ3",pt,"[{'screen_name': 'felipeneto', 'name': 'felipe neto 🦉', 'id': '14128609'}]",[],['https://pbs.twimg.com/media/EERJaPuXkAIQE5E.jpg'],0,1,3,['aureoribeiro'],[],https://twitter.com/AureoRibeiroRJ/status/1172142524670107648,False,,1,https://pbs.twimg.com/media/EERJaPuXkAIQE5E.jpg,,,,,,,[],,,,
1171220162193870848,1171220162193870848,2019-09-09 21:33:41 -0300,2019-09-09,21:33:41,-300,267467458,aureoribeirorj,Aureo Ribeiro,,Projetos que funcionam. Conheça a história do Davidson no link abaixo.  Um exemplo! 👍🏻   https://t.co/LkzAmOXlmS  https://t.co/c3qjAxsF5v,pt,[],['https://www.facebook.com/187682584611376/posts/2500315723348039?sfns=mo'],['https://pbs.twimg.com/media/EEEChf1XYAACjQz.jpg'],1,1,5,[],[],https://twitter.com/AureoRibeiroRJ/status/1171220162193870848,False,,1,https://pbs.twimg.com/media/EEEChf1XYAACjQz.jpg,,,,,,,[],,,,
1170771654219378688,1170771654219378688,2019-09-08 15:51:28 -0300,2019-09-08,15:51:28,-300,267467458,aureoribeirorj,Aureo Ribeiro,,"Regulação das moedas virtuais em debate na @camaradeputados.  A série de crimes e fraudes e pirâmides dificulta o desenvolvimento e a credibilidade da criptoeconomia no Brasil.  Acesse o link abaixo, leia e compartilhe com os amigos.   https://t.co/Rz9RWOrTki  #moedasvirtuais",pt,"[{'screen_name': 'camaradeputados', 'name': 'câmara dos deputados', 'id': '61843152'}]",['http://deputadoaureo.com.br/noticias/regulacao-das-moedas-virtuais/'],[],0,1,7,['moedasvirtuais'],[],https://twitter.com/AureoRibeiroRJ/status/1170771654219378688,False,,0,,,,,,,,[],,,,
1170348664025493505,1170348658690285569,2019-09-07 11:50:40 -0300,2019-09-07,11:50:40,-300,267467458,aureoribeirorj,Aureo Ribeiro,,Hoje é dia de celebrar uma  importante data: a Independência do Brasil. Somos uma nação que está reescrevendo sua história e é com a sua participação que vamos melhorar o presente e o futuro do país. Brava gente brasileira! #7deSetembro #omandatoénosso #VamosJuntosComAureoRibeiro,pt,[],[],[],0,1,6,"['7desetembro', 'omandatoénosso', 'vamosjuntoscomaureoribeiro']",[],https://twitter.com/AureoRibeiroRJ/status/1170348664025493505,False,,0,,,,,,,,[],,,,
1170348658690285569,1170348658690285569,2019-09-07 11:50:38 -0300,2019-09-07,11:50:38,-300,267467458,aureoribeirorj,Aureo Ribeiro,,Todos temos o sonho de liberdade e independência. E não há melhor caminho do que com equidade de oportunidades para todos os brasileirinhos que nascem nessa terra ainda. #7deSetembro #omandatoénosso #VamosJuntosComAureoRibeiro  https://t.co/LM5RqEg4XM,pt,[],[],['https://pbs.twimg.com/media/ED3p4ZtXkAETzMD.jpg'],1,0,6,"['7desetembro', 'omandatoénosso', 'vamosjuntoscomaureoribeiro']",[],https://twitter.com/AureoRibeiroRJ/status/1170348658690285569,False,,1,https://pbs.twimg.com/media/ED3p4ZtXkAETzMD.jpg,,,,,,,[],,,,
1167548557341200385,1167548557341200385,2019-08-30 18:24:02 -0300,2019-08-30,18:24:02,-300,267467458,aureoribeirorj,Aureo Ribeiro,,"Você já imaginou como seria a sua vida se não existisse a luz elétrica? 💡  A realidade de diversas famílias brasileiras é escolher que conta pagar para não deixar faltar luz em casa, especialmente as que têm orçamento familiar limitado.   https://t.co/ZwnsI6oiS9  #AureoRibeiro",pt,[],['http://deputadoaureo.com.br/noticias/luz-mais-barata/'],[],0,1,5,['aureoribeiro'],[],https://twitter.com/AureoRibeiroRJ/status/1167548557341200385,False,,0,,,,,,,,[],,,,
1166759867811606528,1166759867811606528,2019-08-28 14:10:04 -0300,2019-08-28,14:10:04,-300,267467458,aureoribeirorj,Aureo Ribeiro,, https://t.co/f4QGsd3sOH  https://t.co/nft6S050CC,und,[],['https://opine.deputadoaureo.com.br/criptomoedas/'],['https://pbs.twimg.com/media/EDEp6ZqXoAAlcGI.jpg'],0,0,6,[],[],https://twitter.com/AureoRibeiroRJ/status/1166759867811606528,False,,1,https://pbs.twimg.com/media/EDEp6ZqXoAAlcGI.jpg,,,,,,,[],,,,
1166757692288962560,1166757681811664896,2019-08-28 14:01:25 -0300,2019-08-28,14:01:25,-300,267467458,aureoribeirorj,Aureo Ribeiro,,"Então, se você é a favor ou contra, acesse o link abaixo e participe da nossa enquete.  Acompanhe a audiência pelo portal da Câmara dos Deputados ou no plenário 08, a partir de 14h30.   https://t.co/f4QGsd3sOH  #Bitcoin #Moedasvirtuais #Criptoeconomia",pt,[],['https://opine.deputadoaureo.com.br/criptomoedas/'],[],0,0,5,"['bitcoin', 'moedasvirtuais', 'criptoeconomia']",[],https://twitter.com/AureoRibeiroRJ/status/1166757692288962560,False,,0,,,,,,,,[],,,,
1166757690066030593,1166757681811664896,2019-08-28 14:01:25 -0300,2019-08-28,14:01:25,-300,267467458,aureoribeirorj,Aureo Ribeiro,,• Criação da “Libra” – uma criptomoedas do Facebook; • Regulação do mercado de moedas virtuais; • Ações dos hackers nas corretoras e investidores de moedas virtuais; • A natureza jurídica das moedas virtuais;  #Bitcoin #Moedasvirtuais #Criptoeconomia,pt,[],[],[],1,0,5,"['bitcoin', 'moedasvirtuais', 'criptoeconomia']",[],https://twitter.com/AureoRibeiroRJ/status/1166757690066030593,False,,0,,,,,,,,[],,,,
1166757688375697414,1166757681811664896,2019-08-28 14:01:24 -0300,2019-08-28,14:01:24,-300,267467458,aureoribeirorj,Aureo Ribeiro,,"Debateremos nesta quarta-feira (28), na Comissão Especial, a utilização da criptoeconomia em diferentes setores (veja abaixo).  #Bitcoin #Moedasvirtuais #Criptoeconomia",pt,[],[],[],1,0,1,"['bitcoin', 'moedasvirtuais', 'criptoeconomia']",[],https://twitter.com/AureoRibeiroRJ/status/1166757688375697414,False,,0,,,,,,,,[],,,,
1166757686677049347,1166757681811664896,2019-08-28 14:01:24 -0300,2019-08-28,14:01:24,-300,267467458,aureoribeirorj,Aureo Ribeiro,,"Mas, como todo bom projeto, precisamos chegar a um que traga eficiência e segurança para os seus usuários.  #Bitcoin #Moedasvirtuais #Criptoeconomia",pt,[],[],[],1,0,2,"['bitcoin', 'moedasvirtuais', 'criptoeconomia']",[],https://twitter.com/AureoRibeiroRJ/status/1166757686677049347,False,,0,,,,,,,,[],,,,
1166757685137682432,1166757681811664896,2019-08-28 14:01:24 -0300,2019-08-28,14:01:24,-300,267467458,aureoribeirorj,Aureo Ribeiro,,"Como entusiasta das moedas virtuais, acredito que elas devem ser utilizadas para trazer investimentos e transformar o Brasil em um celeiro de oportunidades. #Bitcoin #Moedasvirtuais #Criptoeconomia",pt,[],[],[],1,0,2,"['bitcoin', 'moedasvirtuais', 'criptoeconomia']",[],https://twitter.com/AureoRibeiroRJ/status/1166757685137682432,False,,0,,,,,,,,[],,,,
1166757681811664896,1166757681811664896,2019-08-28 14:01:23 -0300,2019-08-28,14:01:23,-300,267467458,aureoribeirorj,Aureo Ribeiro,,O mercado de moedas virtuais é uma realidade no mundo inteiro e vários países já estabeleceram algum tipo de regulamentação ou estão discutindo a melhor forma de projeto para a utilização e comercialização da criptoeconomia. #Bitcoin #Moedasvirtuais #Criptoeconomia,pt,[],[],[],1,0,6,"['bitcoin', 'moedasvirtuais', 'criptoeconomia']",[],https://twitter.com/AureoRibeiroRJ/status/1166757681811664896,False,,0,,,,,,,,[],,,,
1164638683376562177,1164638683376562177,2019-08-22 17:41:14 -0300,2019-08-22,17:41:14,-300,267467458,aureoribeirorj,Aureo Ribeiro,,"A deficiência não impede ninguém de ter sonhos. Muito pelo contrário. Sonhar com a inclusão, com a equidade e o fim da discriminação para que todos tenham as mesmas oportunidades é um dever de toda sociedade.  Assista e saiba mais sobre o PL 8525/2017:  https://t.co/Kde5Df3hFT",pt,[],['https://www.youtube.com/watch?v=F88fLWz_5F4'],[],0,1,7,[],[],https://twitter.com/AureoRibeiroRJ/status/1164638683376562177,False,,0,,,,,,,,[],,,,
1163596683051188225,1163596669990162435,2019-08-19 20:40:42 -0300,2019-08-19,20:40:42,-300,267467458,aureoribeirorj,Aureo Ribeiro,,"Entre para a nossa lista de transmissão no WhatsApp, adicione o número no link:  https://t.co/3Bo1URxQXR e mande um “oi”.  #VamosJuntosComAureoRibeiro #AureoRibeiroEmDefesaDaVida",pt,[],['http://bit.ly/FaleComAureo1'],[],0,0,5,"['vamosjuntoscomaureoribeiro', 'aureoribeiroemdefesadavida']",[],https://twitter.com/AureoRibeiroRJ/status/1163596683051188225,False,,0,,,,,,,,[],,,,
1163596679716769797,1163596669990162435,2019-08-19 20:40:41 -0300,2019-08-19,20:40:41,-300,267467458,aureoribeirorj,Aureo Ribeiro,,Pelo texto caberá aos órgãos de saúde e vigilância definirem as categorias e alimentos que deverão respeitar as regras de segurança.  A defesa da vida e a segurança das nossas crianças é uma prioridade. 👦🏻👩🏻  #VamosJuntosComAureoRibeiro #AureoRibeiroEmDefesaDaVida,pt,[],[],[],1,0,4,"['vamosjuntoscomaureoribeiro', 'aureoribeiroemdefesadavida']",[],https://twitter.com/AureoRibeiroRJ/status/1163596679716769797,False,,0,,,,,,,,[],,,,
1163596676873052160,1163596669990162435,2019-08-19 20:40:41 -0300,2019-08-19,20:40:41,-300,267467458,aureoribeirorj,Aureo Ribeiro,,"não tenham partes cortantes ou perfurantes, que sejam facilmente destacadas e engolidas. Também proíbe o uso de componentes tóxicos no material.  #VamosJuntosComAureoRibeiro #AureoRibeiroEmDefesaDaVida",pt,[],[],[],1,0,2,"['vamosjuntoscomaureoribeiro', 'aureoribeiroemdefesadavida']",[],https://twitter.com/AureoRibeiroRJ/status/1163596676873052160,False,,0,,,,,,,,[],,,,
1163596674268372994,1163596669990162435,2019-08-19 20:40:40 -0300,2019-08-19,20:40:40,-300,267467458,aureoribeirorj,Aureo Ribeiro,,"Para evitar que as nossas crianças se machuquem ou até mesmo algo pior, dei o parecer favorável ao projeto de lei 10942/2019, da deputada Renata Abreu, que determina que as embalagens de alimentos infantis +  #VamosJuntosComAureoRibeiro #AureoRibeiroEmDefesaDaVida",pt,[],[],[],1,0,2,"['vamosjuntoscomaureoribeiro', 'aureoribeiroemdefesadavida']",[],https://twitter.com/AureoRibeiroRJ/status/1163596674268372994,False,,0,,,,,,,,[],,,,
1163596669990162435,1163596669990162435,2019-08-19 20:40:39 -0300,2019-08-19,20:40:39,-300,267467458,aureoribeirorj,Aureo Ribeiro,,"Criança coloca tudo na boca. Quem é pai e mãe sabe bem, por isso a gente sempre fica preocupado. Passei isso com o Gabriel e até hoje a Alice tem essa mania e é sempre um susto quando eles pegam algo que não deviam.  #VamosJuntosComAureoRibeiro #AureoRibeiroEmDefesaDaVida  https://t.co/Xwhca7izqm",pt,[],[],['https://pbs.twimg.com/media/ECXs_BmXoAArAS3.jpg'],1,0,8,"['vamosjuntoscomaureoribeiro', 'aureoribeiroemdefesadavida']",[],https://twitter.com/AureoRibeiroRJ/status/1163596669990162435,False,,1,https://pbs.twimg.com/media/ECXs_BmXoAArAS3.jpg,,,,,,,[],,,,
1163448328903897089,1163448328903897089,2019-08-19 10:51:12 -0300,2019-08-19,10:51:12,-300,267467458,aureoribeirorj,Aureo Ribeiro,,@TwitterBrasil como faço para entrar em contato com o suporte?,pt,[],[],[],0,0,0,[],[],https://twitter.com/AureoRibeiroRJ/status/1163448328903897089,False,,0,,,,,,,,[],,,,
1162521417453309952,1162521417453309952,2019-08-16 21:27:59 -0300,2019-08-16,21:27:59,-300,267467458,aureoribeirorj,Aureo Ribeiro,,"Quer saber um pouco mais do trabalho da Casa do Menor? Veja o vídeo completo na minha página, no Facebook. - Acoustic Meditation 2 de Audionautix está licenciada sob uma licença Creative Commons Attribution ( https://t.co/3DO66KRX37) Artista:  https://t.co/9CbgYZzlMu #AureoRibeiro  https://t.co/fozLugxvAE",pt,[],"['https://creativecommons.org/licenses/by/4.0/', 'http://audionautix.com/']",[],0,0,5,['aureoribeiro'],[],https://twitter.com/AureoRibeiroRJ/status/1162521417453309952,False,,1,https://pbs.twimg.com/ext_tw_video_thumb/1162521210368012290/pu/img/ZBu9um925egAr881.jpg,,,,,,,[],,,,
1162141427998109697,1162141427998109697,2019-08-15 20:18:02 -0300,2019-08-15,20:18:02,-300,267467458,aureoribeirorj,Aureo Ribeiro,,"Você que me acompanha sabe da nossa luta para facilitar a abertura de novos negócios e acabar com a burocracia do nosso país. Tivemos um avanço importante aqui na Câmara, com a aprovação da MP 881/2019, conhecida como MP da Liberdade Econômica.  Leia mais:  https://t.co/pVXartgr8e",pt,[],['https://bit.ly/2H8Swap'],[],0,2,6,[],[],https://twitter.com/AureoRibeiroRJ/status/1162141427998109697,False,,0,,,,,,,,[],,,,
1161338774883831809,1161338774883831809,2019-08-13 15:08:35 -0300,2019-08-13,15:08:35,-300,267467458,aureoribeirorj,Aureo Ribeiro,,"Veja os meus seis primeiros meses de mandato em 2019, na Câmara dos Deputados. 🖥  Acesse o link:  https://t.co/QH3YdqERyV  https://t.co/Bo5sZpqQhS",pt,[],['http://deputadoaureo.com.br/noticias/seis-meses-de-trabalho/'],['https://pbs.twimg.com/media/EB3nc-0XUAEiHmZ.jpg'],0,1,4,[],[],https://twitter.com/AureoRibeiroRJ/status/1161338774883831809,False,,1,https://pbs.twimg.com/media/EB3nc-0XUAEiHmZ.jpg,,,,,,,[],,,,
