id,conversation_id,created_at,date,time,timezone,user_id,username,name,place,tweet,language,mentions,urls,photos,replies_count,retweets_count,likes_count,hashtags,cashtags,link,retweet,quote_url,video,thumbnail,near,geo,source,user_rt_id,user_rt,retweet_id,reply_to,retweet_date,translate,trans_src,trans_dest
1521839860033765376,1521839860033765376,2022-05-04 10:11:11 -03,2022-05-04,10:11:11,-300,715890732528222208,depalexsantana,Alex Santana,,"""Assumir um compromisso é ser fiel a uma promessa e entregar-se àquilo que se comprometeu a fazer, seja por si ou pelo outro.""",pt,[],[],[],1,0,0,[],[],https://twitter.com/depalexsantana/status/1521839860033765376,False,,0,,,,,,,,[],,,,
1513603777907015685,1513603777907015685,2022-04-11 16:43:56 -03,2022-04-11,16:43:56,-300,715890732528222208,depalexsantana,Alex Santana,,"FINALMENTE ESTAMOS VOLTANDO A NORMALIDADE APÓS UM PERÍODO DIFÍCIL PARA TODOS. AGORA VAMOS CONTINUAR AVANÇANDO, E MANTENDO OS CUIDADOS NECESSÁRIOS. 🙌🏻",pt,[],[],[],1,0,2,[],[],https://twitter.com/depalexsantana/status/1513603777907015685,False,,0,,,,,,,,[],,,,
1510797898782543879,1510797898782543879,2022-04-03 22:54:22 -03,2022-04-03,22:54:22,-300,715890732528222208,depalexsantana,Alex Santana,,Acabou de publicar uma foto  https://t.co/Rj1ZpiA76v,pt,[],['https://www.instagram.com/p/Cb6VMqzu3oN/?utm_medium=twitter'],[],5,1,1,[],[],https://twitter.com/depalexsantana/status/1510797898782543879,False,,0,,,,,,,,[],,,,
1508941855320424450,1508941855320424450,2022-03-29 19:59:07 -03,2022-03-29,19:59:07,-300,715890732528222208,depalexsantana,Alex Santana,,"Qual é o melhor bairro de Salvador, pra você? em Salvador-Ba  https://t.co/oGfzywXVlx",pt,[],['https://www.instagram.com/p/CbtJKpQrRQv/?utm_medium=twitter'],[],2,0,2,[],[],https://twitter.com/depalexsantana/status/1508941855320424450,False,,0,,,,,,,,[],,,,
1508407334942519297,1508407334942519297,2022-03-28 08:35:08 -03,2022-03-28,08:35:08,-300,715890732528222208,depalexsantana,Alex Santana,,Por aqui a segunda feira começou e o trabalho não para. Semana de excelência à todos!  https://t.co/m2DjWirwK1,pt,[],[],['https://pbs.twimg.com/media/FO7wehAXoAAPrkj.jpg'],2,0,1,[],[],https://twitter.com/depalexsantana/status/1508407334942519297,False,,1,https://pbs.twimg.com/media/FO7wehAXoAAPrkj.jpg,,,,,,,[],,,,
1506968552133349384,1506968552133349384,2022-03-24 09:17:55 -03,2022-03-24,09:17:55,-300,715890732528222208,depalexsantana,Alex Santana,,"Às vezes tudo que precisamos é de um novo começo!  A vida é feita de ciclos. E muitas vezes precisamos encerrar alguns, para que possamos começar uma nova jornada em nossa caminhada!",pt,[],[],[],3,0,0,[],[],https://twitter.com/depalexsantana/status/1506968552133349384,False,,0,,,,,,,,[],,,,
1506960619488038917,1506960619488038917,2022-03-24 08:46:24 -03,2022-03-24,08:46:24,-300,715890732528222208,depalexsantana,Alex Santana,,"Apesar de que não é possível voltar atrás  fazer um novo começo, nos é possível começar hoje com destino a um novo fim.",pt,[],[],[],0,0,2,[],[],https://twitter.com/depalexsantana/status/1506960619488038917,False,,0,,,,,,,,[],,,,
1501280427822170114,1501280427822170114,2022-03-08 16:35:21 -03,2022-03-08,16:35:21,-300,715890732528222208,depalexsantana,Alex Santana,,"Reconhecemos o valor de  todas as mulheres guerreiras, valentes lutadoras, intercessoras, colunas que andam com Jesus. Mulheres que não buscam apenas as rosas do caminho, mas que se dispõem a semear em outros jardins.🌹  Feliz Dia Internacional da Mulher. Parabéns todos os dias!  https://t.co/I0FJrWC7Iv",pt,[],[],['https://pbs.twimg.com/media/FNWegpLWQAQwn6P.jpg'],8,0,2,[],[],https://twitter.com/depalexsantana/status/1501280427822170114,False,,1,https://pbs.twimg.com/media/FNWegpLWQAQwn6P.jpg,,,,,,,[],,,,
1496862484476481537,1496862484476481537,2022-02-24 12:00:01 -03,2022-02-24,12:00:01,-300,715890732528222208,depalexsantana,Alex Santana,,"A guerra nunca foi a solução para os problemas. Ela traz sofrimento aos inocentes, muitas dores e destruição. Putin escolheu um caminho de derramamento de sangue ao atacar a Ucrânia. O diálogo e a diplomacia são melhores do que uma guerra. Oremos pela paz na Ucrânia.",pt,[],[],[],2,0,3,[],[],https://twitter.com/depalexsantana/status/1496862484476481537,False,,0,,,,,,,,[],,,,
1496843314469150721,1496843314469150721,2022-02-24 10:43:50 -03,2022-02-24,10:43:50,-300,715890732528222208,depalexsantana,Alex Santana,,"Porque não temos que lutar contra a carne e o sangue, mas, sim, contra os principados, contra as potestades, contra os príncipes das trevas deste século, contra as hostes espirituais da maldade, nos lugares celestiais. Ef.6.12",pt,[],[],[],1,0,1,[],[],https://twitter.com/depalexsantana/status/1496843314469150721,False,,0,,,,,,,,[],,,,
1494731554194608133,1494731554194608133,2022-02-18 14:52:27 -03,2022-02-18,14:52:27,-300,715890732528222208,depalexsantana,Alex Santana,,"VITÓRIA DA IGREJA!  Foi aprovada, na Câmara dos Deputados, a proposta de emenda do senado, que concede a ISENÇÃO de IPTU para imóveis alugados por Igrejas e templos! Mais uma grande conquista para a Igreja! Sempre avante!",pt,[],[],[],0,0,1,[],[],https://twitter.com/depalexsantana/status/1494731554194608133,False,,0,,,,,,,,[],,,,
1491779575659040771,1491779575659040771,2022-02-10 11:22:21 -03,2022-02-10,11:22:21,-300,715890732528222208,depalexsantana,Alex Santana,,Repudiamos qualquer tentativa de apoio ao nazismo. Continuaremos orando por Israel e pela Paz em Jerusalém. Em apoio à nota de repúdio da Frente Parlamentar Evangélica.  @fpevangelica19,pt,"[{'screen_name': 'fpevangelica19', 'name': 'frente parlamentar evangélica', 'id': '1112758008768024578'}]",[],[],1,0,3,[],[],https://twitter.com/depalexsantana/status/1491779575659040771,False,,0,,,,,,,,[],,,,
1491456748657704964,1491456748657704964,2022-02-09 13:59:33 -03,2022-02-09,13:59:33,-300,715890732528222208,depalexsantana,Alex Santana,,"Venho aqui para parabenizar nosso novo coordenador, Dep. Sostenes Cavalcante, que estará liderando a partir de hoje, a FPE! Que Deus possa abençoar sua nova jornada! Tudo de bom meu irmão!  @DepSostenes",pt,"[{'screen_name': 'depsostenes', 'name': 'sóstenes', 'id': '298308683'}]",[],[],0,0,4,[],[],https://twitter.com/depalexsantana/status/1491456748657704964,False,,0,,,,,,,,[],,,,
1491455436742356992,1491455436742356992,2022-02-09 13:54:20 -03,2022-02-09,13:54:20,-300,715890732528222208,depalexsantana,Alex Santana,,"Inciando o dia participando do primeiro culto e, ceia, da Frente Parlamentar Evangélica de 2022.  Nos reunimos também para escolher o novo líder da bancada evangélica.  Grato à Deus pela vida do nosso líder Cezinha, que liderou a frente nesses ultimos anos.  https://t.co/0VOZIV7dgG",pt,[],[],"['https://pbs.twimg.com/media/FLK2zgMXIAYExX4.jpg', 'https://pbs.twimg.com/media/FLK2ztMXMAcVs38.jpg', 'https://pbs.twimg.com/media/FLK2z94XwAg0ZS4.jpg', 'https://pbs.twimg.com/media/FLK20JlWQAk4Lk6.jpg']",0,0,2,[],[],https://twitter.com/depalexsantana/status/1491455436742356992,False,,1,https://pbs.twimg.com/media/FLK2zgMXIAYExX4.jpg,,,,,,,[],,,,
1464217947346509849,1464217947346509849,2021-11-26 10:02:17 -03,2021-11-26,10:02:17,-300,715890732528222208,depalexsantana,Alex Santana,,"Mas, sejam fortes e não desanimem, pois o trabalho de vocês será recompensado"". 2 Crônicas 15:7  Mais uma sexta começando meus amigos! Vamos à luta que a vitória já é nossa em nome de Jesus! Que Deus abençoe seu final de semana de uma forma grandiosa! Um ótimo dia a todos! 🙏",pt,[],[],[],3,2,4,[],[],https://twitter.com/depalexsantana/status/1464217947346509849,False,,0,,,,,,,,[],,,,
1463179084792569858,1463179084792569858,2021-11-23 13:14:13 -03,2021-11-23,13:14:13,-300,715890732528222208,depalexsantana,Alex Santana,,"Senhor, tu és a minha porção e o meu cálice; és tu que garantes o meu futuro. Salmos 16:5  Deus está no controle de sua vida. Ele tem planos bons para você. O dia de hoje pode ser difícil, mas no fim das lutas Deus tem bênçãos preparadas. Não tenha medo!",pt,[],[],[],0,1,4,[],[],https://twitter.com/depalexsantana/status/1463179084792569858,False,,0,,,,,,,,[],,,,
1460580303441997830,1460580303441997830,2021-11-16 09:07:35 -03,2021-11-16,09:07:35,-300,715890732528222208,depalexsantana,Alex Santana,,"Que o Deus da esperança os encha de toda alegria e paz, por sua confiança nele, para que vocês transbordem de esperança, pelo poder do Espírito Santo. (Rm 15:13)",pt,[],[],[],0,0,3,[],[],https://twitter.com/depalexsantana/status/1460580303441997830,False,,0,,,,,,,,[],,,,
1458079279766511625,1458079279766511625,2021-11-09 11:29:24 -03,2021-11-09,11:29:24,-300,715890732528222208,depalexsantana,Alex Santana,,"Hoje é aniversário de Vitória da Conquista! Gostaria de felicitar essa grande cidade, pelos seus 181 anos de existência. Uma cidade linda! Um grande abraço ao povo dessa cidade que eu amo. Parabéns Vitória da Conquista!👏👏",pt,[],[],[],21,0,3,[],[],https://twitter.com/depalexsantana/status/1458079279766511625,False,,0,,,,,,,,[],,,,
1456345983516872706,1456345983516872706,2021-11-04 16:41:54 -03,2021-11-04,16:41:54,-300,715890732528222208,depalexsantana,Alex Santana,,"UM DIA HISTÓRICO PARA O BRASIL! Está acontecendo nesse momento, o leilão do 5G no Brasil. Até o momento, já foram leiloadas duas faixas de frequência, no total de quatro. Até o final do dia deveremos saber por quais empresas as faixas restantes foram adquiridas. GRANDE DIA!",pt,[],[],[],59,1,3,[],[],https://twitter.com/depalexsantana/status/1456345983516872706,False,,0,,,,,,,,[],,,,
1453833265807298563,1453833265807298563,2021-10-28 18:17:16 -03,2021-10-28,18:17:16,-300,715890732528222208,depalexsantana,Alex Santana,,"O fato de respeitar outras opiniões não me obriga a concordar com elas. Eu sigo o que a Bíblia me diz, eu defendo o que está de acordo com a Bíblia. Não a homofobia, não ao preconceito, Sim a liberdade  de expressão inclusive a dos cristãos.  https://t.co/MjENogecvx",pt,[],[],['https://pbs.twimg.com/media/FC0Npl3aMAAC_jo.jpg'],59,0,3,[],[],https://twitter.com/depalexsantana/status/1453833265807298563,False,,1,https://pbs.twimg.com/media/FC0Npl3aMAAC_jo.jpg,,,,,,,[],,,,
1453463610684960768,1453463610684960768,2021-10-27 17:48:23 -03,2021-10-27,17:48:23,-300,715890732528222208,depalexsantana,Alex Santana,,"E hoje foi dia de reunião da bancada da Bahia, para resolver emendas, em Brasília. Mais um dia de trabalho, para trazer o melhor para o povo do estado o qual represento.  https://t.co/xyN3rS60Ku",pt,[],[],"['https://pbs.twimg.com/media/FCu9bUnXMAUbtM8.jpg', 'https://pbs.twimg.com/media/FCu9cZvXIAIf7mX.jpg']",15,0,1,[],[],https://twitter.com/depalexsantana/status/1453463610684960768,False,,1,https://pbs.twimg.com/media/FCu9bUnXMAUbtM8.jpg,,,,,,,[],,,,
1453147335949697033,1453147335949697033,2021-10-26 20:51:37 -03,2021-10-26,20:51:37,-300,715890732528222208,depalexsantana,Alex Santana,,"Enviei hoje, para o Ministro da Educação, uma indicação que sugere a inclusão dos alunos matriculados no 1º e 2º ano do Ensino Médio, em 2021, no ENEM seriado.  Clique no link para saber mais:  https://t.co/UHzCbAQnFW",pt,[],['https://www.instagram.com/p/CVgod2LLY8e/?utm_medium=copy_link'],[],3,0,1,[],[],https://twitter.com/depalexsantana/status/1453147335949697033,False,,0,,,,,,,,[],,,,
1453002495740022788,1453002495740022788,2021-10-26 11:16:05 -03,2021-10-26,11:16:05,-300,715890732528222208,depalexsantana,Alex Santana,,"Porque sou eu que conheço os planos que tenho para vocês', diz o Senhor, 'planos de fazê-los prosperar e não de causar dano, planos de dar a vocês esperança e um futuro. Jeremias 29:11  Palavra do dia para meditação; Que Deus possa cumprir todas as promessas dele em sua vida! 🙏",pt,[],[],[],3,0,4,[],[],https://twitter.com/depalexsantana/status/1453002495740022788,False,,0,,,,,,,,[],,,,
1451290835929243648,1451290835929243648,2021-10-21 17:54:33 -03,2021-10-21,17:54:33,-300,715890732528222208,depalexsantana,Alex Santana,,Excelente medida adotada pelo Ministério da  Cidadania. Eu tenho certeza que o programa ajudará inúmeras famílias que vivem situações difíceis em nosso país  principalmente pelo atual momento.  @joaoromaneto,pt,"[{'screen_name': 'joaoromaneto', 'name': 'joão roma', 'id': '84141432'}]",[],[],6,0,2,[],[],https://twitter.com/depalexsantana/status/1451290835929243648,False,,0,,,,,,,,[],,,,
1450537146327224329,1450537146327224329,2021-10-19 15:59:40 -03,2021-10-19,15:59:40,-300,715890732528222208,depalexsantana,Alex Santana,,"A Mesa Diretora da Câmara dos Deputados decidiu que os trabalhos presenciais serão retomados a partir da 2ª-feira, 25. Serão tomadas todas as medidas administrativas e sanitárias no retorno das atividades, entre elas, a apresentação da carteira de vacinação.  VIA @camaradeputados",pt,"[{'screen_name': 'camaradeputados', 'name': 'câmara dos deputados', 'id': '61843152'}]",[],[],1,0,4,[],[],https://twitter.com/depalexsantana/status/1450537146327224329,False,,0,,,,,,,,[],,,,
1446564766646996994,1446564766646996994,2021-10-08 16:54:50 -03,2021-10-08,16:54:50,-300,715890732528222208,depalexsantana,Alex Santana,,"Com diversos pratos saborosos e únicos. 🥘🥗🫕  E o principal, o povo Nordestino. O que falar desse povo?! Extremamente receptivo, acolhedor, trabalhador e com uma simplicidade incomparável. Um ótimo dia do Nordestino, meus amigos! 🏜",pt,[],[],[],5,0,3,[],[],https://twitter.com/depalexsantana/status/1446564766646996994,False,,0,,,,,,,,[],,,,
1446564116039151621,1446564116039151621,2021-10-08 16:52:15 -03,2021-10-08,16:52:15,-300,715890732528222208,depalexsantana,Alex Santana,,"Feliz dia do Nordeste para todos nós, que amamos e vivemos nesse lugar maravilhoso que é nossa região!  🏝️ Uma região rica em cultura, costumes, paisagens naturais, praias, pontos turísticos. Além disso, o nordeste é detentor de uma das culturas de culinária mais rica do Brasil!  https://t.co/6rK3QNRjox",pt,[],[],['https://pbs.twimg.com/media/FBM6ZSWXEAACU5M.jpg'],0,0,3,[],[],https://twitter.com/depalexsantana/status/1446564116039151621,False,,1,https://pbs.twimg.com/media/FBM6ZSWXEAACU5M.jpg,,,,,,,[],,,,
1445797410488389632,1445797410488389632,2021-10-06 14:05:38 -03,2021-10-06,14:05:38,-300,715890732528222208,depalexsantana,Alex Santana,,"Parabéns à todos os prefeitos do nosso Brasil, que exercem um papel importantíssimo em nossa sociedade.  https://t.co/X9QxFL9zfi",pt,[],[],['https://pbs.twimg.com/media/FBCBFROVcAQzawB.jpg'],2,0,2,[],[],https://twitter.com/depalexsantana/status/1445797410488389632,False,,1,https://pbs.twimg.com/media/FBCBFROVcAQzawB.jpg,,,,,,,[],,,,
1445150686266765314,1445150686266765314,2021-10-04 19:15:47 -03,2021-10-04,19:15:47,-300,715890732528222208,depalexsantana,Alex Santana,,A única coisa que você não pode perder é a sua conexão com Deus.,pt,[],[],[],1,0,3,[],[],https://twitter.com/depalexsantana/status/1445150686266765314,False,,0,,,,,,,,[],,,,
1443320109381128199,1443320109381128199,2021-09-29 18:01:44 -03,2021-09-29,18:01:44,-300,715890732528222208,depalexsantana,Alex Santana,,Just posted a photo @ Brasil  https://t.co/dMUo5Frv0r,en,[],['https://www.instagram.com/p/CUa32seLtqh/?utm_medium=twitter'],[],0,0,1,[],[],https://twitter.com/depalexsantana/status/1443320109381128199,False,,0,,,,,,,,[],,,,
1443207329806180356,1443207329806180356,2021-09-29 10:33:35 -03,2021-09-29,10:33:35,-300,715890732528222208,depalexsantana,Alex Santana,,"Muitas são as aflições do justo, mas o Senhor o livra de todas. Salmos 34.19  https://t.co/JLTSTfacVp",pt,[],[],['https://pbs.twimg.com/media/FAdNasoXIAUvdMK.jpg'],1,0,4,[],[],https://twitter.com/depalexsantana/status/1443207329806180356,False,,1,https://pbs.twimg.com/media/FAdNasoXIAUvdMK.jpg,,,,,,,[],,,,
1441459510346932224,1441459510346932224,2021-09-24 14:48:22 -03,2021-09-24,14:48:22,-300,715890732528222208,depalexsantana,Alex Santana,,"Triste decisão do STF nesta quinta feira, 23, em proibir missões religiosas em terras indígenas. As igrejas exercem um papel evangelístico de grande valia para sociedade. Inclusive, as tribos indígenas já foram inúmeras vezes  beneficiadas pelos evangélicos.  Lamentável decisão.",pt,[],[],[],2,2,4,[],[],https://twitter.com/depalexsantana/status/1441459510346932224,False,,0,,,,,,,,[],,,,
1437857449860640784,1437846220765007882,2021-09-14 16:15:04 -03,2021-09-14,16:15:04,-300,715890732528222208,depalexsantana,Alex Santana,,"Mais um grande servo que se vai, como Billy Graham, e tantos outros. Mas que continue a servir de exemplo para nós e de inspiração a continuar na caminhada.",pt,[],[],[],0,0,1,[],[],https://twitter.com/depalexsantana/status/1437857449860640784,False,,0,,,,,,,,[],,,,
1437847343815139330,1437846220765007882,2021-09-14 15:34:55 -03,2021-09-14,15:34:55,-300,715890732528222208,depalexsantana,Alex Santana,,"Praticamente inicou a pregação do evangelho na Coreia do Sul, fundou diversas igrejas e chegou a cuidar da maior do mundo, a Yoido Full Gospel Church, que teve centenas de milhares de membros.",pt,[],[],[],1,0,2,[],[],https://twitter.com/depalexsantana/status/1437847343815139330,False,,0,,,,,,,,[],,,,
1437846220765007882,1437846220765007882,2021-09-14 15:30:27 -03,2021-09-14,15:30:27,-300,715890732528222208,depalexsantana,Alex Santana,,"Vale mencionar, hoje o céu recebe mais um servo que terminou a carreira. Pr. ""David"" Yonggi Cho passou ao Senhor, depois de décadas de serviços a igreja. Um homem que deve ter a sua história lembrada.",pt,[],[],[],1,0,5,[],[],https://twitter.com/depalexsantana/status/1437846220765007882,False,,0,,,,,,,,[],,,,
1425545372517244932,1425286860990033922,2021-08-11 16:51:16 -03,2021-08-11,16:51:16,-300,715890732528222208,depalexsantana,Alex Santana,,"@felipeneto Sigo sendo bem diferente do que é  defendido pelo seu grupo, com esses princípios de proteção das coisas escusas e rejeitando a transparência daquilo que modifica a nossa vida, que é o processo de transparência na eleição.",pt,[],[],[],0,0,0,[],[],https://twitter.com/depalexsantana/status/1425545372517244932,False,,0,,,,,,,,"[{'screen_name': 'felipeneto', 'name': 'Felipe Neto 🦉', 'id': '14128609'}]",,,,
1395165347305639937,1395165347305639937,2021-05-19 20:51:54 -03,2021-05-19,20:51:54,-300,715890732528222208,depalexsantana,Alex Santana,,"1 em cada 4 brasileiros ainda não acessou a tecnologia 4G, e agora temos o grande desafio de implantar o 5G no Brasil. Grandes conquistas auxiliadas pelo nosso mandato. Estamos comprometidos em levar uma nova internet para o brasileiro e desenvolver o interior dos nossos estados  https://t.co/F4V8gCoKSX",pt,[],[],['https://pbs.twimg.com/media/E1yffS_X0AAfKVT.jpg'],58,0,6,[],[],https://twitter.com/depalexsantana/status/1395165347305639937,False,,1,https://pbs.twimg.com/media/E1yffS_X0AAfKVT.jpg,,,,,,,[],,,,
1393936599512195073,1393936599512195073,2021-05-16 11:29:18 -03,2021-05-16,11:29:18,-300,715890732528222208,depalexsantana,Alex Santana,,"Triste dia, pois mais uma pessoa vem a falecer nesse tempo. Todos os meus sentimentos a família do prefeito Bruno Covas. Que Cristo Jesus conforte a todos os enlutados.",pt,[],[],[],9,0,2,[],[],https://twitter.com/depalexsantana/status/1393936599512195073,False,,0,,,,,,,,[],,,,
1390307576680796160,1390307576680796160,2021-05-06 11:08:51 -03,2021-05-06,11:08:51,-300,715890732528222208,depalexsantana,Alex Santana,,"Nessa semana estamos na Semana das Comunicações, onde muitas novidades estão sendo trazidas. O 5G começa a ser uma realidade no Brasil. Não só ele, mas muitas outras coisas. O futuro é digital, e precisamos proporcionar isso aos brasileiros.",pt,[],[],[],5,0,4,[],[],https://twitter.com/depalexsantana/status/1390307576680796160,False,,0,,,,,,,,[],,,,
1380481702422851592,1380481702422851592,2021-04-09 08:24:20 -03,2021-04-09,08:24:20,-300,715890732528222208,depalexsantana,Alex Santana,,Triste a decisão do Supremo em formar uma maioria contra as atividades presenciais das igrejas que tanto tem ajudado e mantido nossos brasileiros de pé nesse momento. Resta agora recorrer aos governadores e prefeitos que reconheçam aquilo que os ministros rejeitaram.,pt,[],[],[],10,0,2,[],[],https://twitter.com/depalexsantana/status/1380481702422851592,False,,0,,,,,,,,[],,,,
1379828027316649986,1379828027316649986,2021-04-07 13:06:52 -03,2021-04-07,13:06:52,-300,715890732528222208,depalexsantana,Alex Santana,,"""A justiça é posta de lado, e o direito é afastado, a verdade anda tropeçando no tribunal, e a honestidade não consegue chegar até lá. A verdade desapareceu, e os que procuram ser honestos são perseguidos."" Is 59.14-15  Mais atual do que nunca essa palavra.",pt,[],[],[],1,0,1,[],[],https://twitter.com/depalexsantana/status/1379828027316649986,False,,0,,,,,,,,[],,,,
1379784413593079811,1379781261888270343,2021-04-07 10:13:34 -03,2021-04-07,10:13:34,-300,715890732528222208,depalexsantana,Alex Santana,,"Ao votar pela permissão dessa compra, estamos aumentando a chances de vacinação da nossa população e permitindo que possa ser comprado imunizantes reconhecidos pela Organização Mundial da Saúde. Estamos firmes na luta pela vacinação do Brasil!",pt,[],[],[],2,0,1,[],[],https://twitter.com/depalexsantana/status/1379784413593079811,False,,0,,,,,,,,[],,,,
1379781634510229504,1379781261888270343,2021-04-07 10:02:31 -03,2021-04-07,10:02:31,-300,715890732528222208,depalexsantana,Alex Santana,,"Até então, só estava permitido que as empresas iniciassem seu processo de vacinação próprio após o SUS vacinar os grupos prioritários. Isso significa um impedimento legal para que mais pessoas possam ser vacinadas de uma vez no nosso país.",pt,[],[],[],2,0,1,[],[],https://twitter.com/depalexsantana/status/1379781634510229504,False,,0,,,,,,,,[],,,,
1379781261888270343,1379781261888270343,2021-04-07 10:01:02 -03,2021-04-07,10:01:02,-300,715890732528222208,depalexsantana,Alex Santana,,Aprovamos ontem a noite o texto-base de um projeto que vai permitir as empresas privadas a comprarem vacinas contra a COVID-19 para imunizar seus funcionários. Segue o fio para entender a importância disso:,pt,[],[],[],4,0,1,[],[],https://twitter.com/depalexsantana/status/1379781261888270343,False,,0,,,,,,,,[],,,,
1378482939042877444,1378482939042877444,2021-04-03 20:01:58 -03,2021-04-03,20:01:58,-300,715890732528222208,depalexsantana,Alex Santana,,"Feliz pela decisão do ministro Kassio Nunes em reconhecer a atividade essencial que a igreja promove, e permitir que ela possa estar aberta para a congregação dos irmãos, respeitando os limites sanitários. Nosso trabalho é crucial nesse momento tão desesperançoso.",pt,[],[],[],1,0,1,[],[],https://twitter.com/depalexsantana/status/1378482939042877444,False,,0,,,,,,,,[],,,,
1374076349376303105,1374071565671882752,2021-03-22 16:11:45 -03,2021-03-22,16:11:45,-300,715890732528222208,depalexsantana,Alex Santana,,"Inclusive o Datafolha, em pesquisa, demonstra a força da nossa fé. Nossa crença em Deus é maior que os problemas dessa pandemia. E o crente se firma em Deus, e não na segurança dos homens. Seguimos firmes!",pt,[],[],[],0,0,1,[],[],https://twitter.com/depalexsantana/status/1374076349376303105,False,,0,,,,,,,,[],,,,
1374071565671882752,1374071565671882752,2021-03-22 15:52:44 -03,2021-03-22,15:52:44,-300,715890732528222208,depalexsantana,Alex Santana,,Parabenizo as ações recentes do Governo em buscar garantir mais 138 milhões de doses das vacinas para nossa população. É necessário e vital para que possamos sair dessa crise. Precisamos vacinar nossa população!,pt,[],[],[],4,0,3,[],[],https://twitter.com/depalexsantana/status/1374071565671882752,False,,0,,,,,,,,[],,,,
1351146056717914112,1351145794641006601,2021-01-18 09:34:57 -03,2021-01-18,09:34:57,-300,715890732528222208,depalexsantana,Alex Santana,,"Uma boa notícia nesse início de 2021, após vivermos um ano tão conturbado como foi 2020. Mas, não podemos esquecer que todo o controle está com Deus e por Ele podemos crer no amanhã. Se há uma saída para essa pandemia, foi provida por Ele, amém!",pt,[],[],[],12,0,1,[],[],https://twitter.com/depalexsantana/status/1351146056717914112,False,,0,,,,,,,,[],,,,
1351145922789519363,1351145794641006601,2021-01-18 09:34:25 -03,2021-01-18,09:34:25,-300,715890732528222208,depalexsantana,Alex Santana,,"Enquanto cidadão, estarei participando e tenho fé em Cristo que logo superaremos esse momento difícil.",pt,[],[],[],10,0,1,[],[],https://twitter.com/depalexsantana/status/1351145922789519363,False,,0,,,,,,,,[],,,,
1351145794641006601,1351145794641006601,2021-01-18 09:33:55 -03,2021-01-18,09:33:55,-300,715890732528222208,depalexsantana,Alex Santana,,"Vitória! Tivemos ontem a notícia da aprovação da ANVISA para a vacina CoronaVac. Em breve começaremos a vacinação. Enfatizo a todos a fazerem sua escolha individual e livre, de maneira consciente.",pt,[],[],[],41,0,3,[],[],https://twitter.com/depalexsantana/status/1351145794641006601,False,,0,,,,,,,,[],,,,
1349805877713367041,1349802539806568448,2021-01-14 16:49:34 -03,2021-01-14,16:49:34,-300,715890732528222208,depalexsantana,Alex Santana,,"E sobre pastores que fazem a prática do jogo do bicho, com certeza o excelentíssimo senador não ouviu essa fala de um verdadeiro pastor.",pt,[],[],[],5,0,1,[],[],https://twitter.com/depalexsantana/status/1349805877713367041,False,,0,,,,,,,,[],,,,
1349803151839391745,1349802539806568448,2021-01-14 16:38:44 -03,2021-01-14,16:38:44,-300,715890732528222208,depalexsantana,Alex Santana,,"O Senador Coronel, ao buscar defender suas ideias, mais ofende ao povo religioso, em especial os evangélicos, do que qualquer outra coisa.",pt,[],[],[],1,0,1,[],[],https://twitter.com/depalexsantana/status/1349803151839391745,False,,0,,,,,,,,[],,,,
