id,conversation_id,created_at,date,time,timezone,user_id,username,name,place,tweet,language,mentions,urls,photos,replies_count,retweets_count,likes_count,hashtags,cashtags,link,retweet,quote_url,video,thumbnail,near,geo,source,user_rt_id,user_rt,retweet_id,reply_to,retweet_date,translate,trans_src,trans_dest
1524038881997426690,1524038881997426690,2022-05-10 11:49:19 -03,2022-05-10,11:49:19,-300,37665648,deputadopeninha,Deputado Peninha,,Eu tenho uma PERGUNTA para vocês!👆🏻 @rafapezenti  https://t.co/5kurEDNzzb,pt,"[{'screen_name': 'rafapezenti', 'name': 'rafael pezenti', 'id': '127708617'}]",[],[],0,0,3,[],[],https://twitter.com/deputadopeninha/status/1524038881997426690,False,,1,https://pbs.twimg.com/ext_tw_video_thumb/1524038842768056320/pu/img/0pB0ZLkH5F_frjV7.jpg,,,,,,,[],,,,
1524008991118008325,1523667836182609920,2022-05-10 09:50:32 -03,2022-05-10,09:50:32,-300,37665648,deputadopeninha,Deputado Peninha,,@diogobueno11 😅😅😅,und,[],[],[],0,0,1,[],[],https://twitter.com/deputadopeninha/status/1524008991118008325,False,,0,,,,,,,,"[{'screen_name': 'diogobueno11', 'name': 'Diogo Bueno', 'id': '37540235'}]",,,,
1523667836182609920,1523667836182609920,2022-05-09 11:14:55 -03,2022-05-09,11:14:55,-300,37665648,deputadopeninha,Deputado Peninha,,"SIM, e com muito ORGULHO!  https://t.co/6sxOI2cAMK",pt,[],['https://vegazeta.com.br/deputado-de-sc-e-autor-de-tres-projetos-em-beneficio-de-cacadores/'],[],3,1,17,[],[],https://twitter.com/deputadopeninha/status/1523667836182609920,False,,0,,,,,,,,[],,,,
1522613783708975105,1522346712983130114,2022-05-06 13:26:29 -03,2022-05-06,13:26:29,-300,37665648,deputadopeninha,Deputado Peninha,,@revistaoeste Andar com livros não quer!,pt,[],[],[],0,1,8,[],[],https://twitter.com/deputadopeninha/status/1522613783708975105,False,,0,,,,,,,,"[{'screen_name': 'revistaoeste', 'name': 'Revista Oeste', 'id': '1222939896349970432'}]",,,,
1522613553181642756,1522613553181642756,2022-05-06 13:25:34 -03,2022-05-06,13:25:34,-300,37665648,deputadopeninha,Deputado Peninha,,Por que não anda com livros?  https://t.co/ZiUJi23hA5,pt,[],[],['https://pbs.twimg.com/media/FSFo8_kXMAIHwTM.jpg'],3,3,26,[],[],https://twitter.com/deputadopeninha/status/1522613553181642756,False,,1,https://pbs.twimg.com/media/FSFo8_kXMAIHwTM.jpg,,,,,,,[],,,,
1522214529748201473,1522214529748201473,2022-05-05 10:59:59 -03,2022-05-05,10:59:59,-300,37665648,deputadopeninha,Deputado Peninha,,"#TBT do último sábado, acompanhando o amigo @LucianoHangBr nesta super bike. Aliás, andar de bicicleta é a atividade física que eu pratico todos os dias, sem exceção!  https://t.co/57OSwLIWBR",pt,"[{'screen_name': 'lucianohangbr', 'name': 'luciano hang', 'id': '1385599766558650377'}]",[],[],1,3,14,['tbt'],[],https://twitter.com/deputadopeninha/status/1522214529748201473,False,,1,https://pbs.twimg.com/ext_tw_video_thumb/1522214465919352835/pu/img/bu98U7U3WdYIP9jd.jpg,,,,,,,[],,,,
1521838074006810624,1521838069481193472,2022-05-04 10:04:05 -03,2022-05-04,10:04:05,-300,37665648,deputadopeninha,Deputado Peninha,,Nossas crianças e adolescentes merecem a proteção da lei e da sociedade!  https://t.co/0ceQuVAenY,pt,[],[],['https://pbs.twimg.com/media/FR6nnniXIAE9Jfg.jpg'],0,1,11,[],[],https://twitter.com/deputadopeninha/status/1521838074006810624,False,,1,https://pbs.twimg.com/media/FR6nnniXIAE9Jfg.jpg,,,,,,,[],,,,
1521838069481193472,1521838069481193472,2022-05-04 10:04:04 -03,2022-05-04,10:04:04,-300,37665648,deputadopeninha,Deputado Peninha,,"Aprovamos, na Câmara dos Deputados, a aplicação de PENAS MAIS RÍGIDAS para crimes cometidos contra crianças e adolescentes – a chamada LEI HENRY BOREL. Transformamos em CRIME HEDIONDO o homicídio contra menores de 14 anos. O tempo de cadeia tbem aumentou e pode chegar a 30 anos.",pt,[],[],[],3,2,20,[],[],https://twitter.com/deputadopeninha/status/1521838069481193472,False,,0,,,,,,,,[],,,,
1521610466715447297,1521609983275720704,2022-05-03 18:59:40 -03,2022-05-03,18:59:40,-300,37665648,deputadopeninha,Deputado Peninha,,@benebarbosa_mvb 😂😂😂Eu quero participar. Vamos começar com este:  https://t.co/7veItE515p,pt,[],[],['https://pbs.twimg.com/media/FR3YmVkWUAAs6d5.jpg'],1,2,99,[],[],https://twitter.com/deputadopeninha/status/1521610466715447297,False,,1,https://pbs.twimg.com/media/FR3YmVkWUAAs6d5.jpg,,,,,,,"[{'screen_name': 'benebarbosa_mvb', 'name': 'Bene Barbosa', 'id': '60957484'}]",,,,
1521593953384079360,1521593953384079360,2022-05-03 17:54:02 -03,2022-05-03,17:54:02,-300,37665648,deputadopeninha,Deputado Peninha,,"Agradeço a todos que colaboram com meu mandato, principalmente a POPULAÇÃO CATARINENSE, por cobrar e se fazer presente em minhas ações. Fico muito feliz com o resultado!  https://t.co/cLM12HhjLS",pt,[],[],['https://pbs.twimg.com/media/FR3Joh0XMAMiQs-.jpg'],1,2,20,[],[],https://twitter.com/deputadopeninha/status/1521593953384079360,False,,1,https://pbs.twimg.com/media/FR3Joh0XMAMiQs-.jpg,,,,,,,[],,,,
1521526854716329984,1521526854716329984,2022-05-03 13:27:25 -03,2022-05-03,13:27:25,-300,37665648,deputadopeninha,Deputado Peninha,,"Em apenas UMA SEMANA, Lula disse que: - Policial não é gente - Vai criar uma moeda em comum com Argentina e Venezuela - Vai fechar os clubes de tiro E você achando difícil escolher? O aviso já foi dado.",pt,[],[],[],1,3,22,[],[],https://twitter.com/deputadopeninha/status/1521526854716329984,False,,0,,,,,,,,[],,,,
1521468795646324737,1520725240145485825,2022-05-03 09:36:43 -03,2022-05-03,09:36:43,-300,37665648,deputadopeninha,Deputado Peninha,,"@JRFDuarte71 Abraço, Ricardo.",pt,[],[],[],0,0,1,[],[],https://twitter.com/deputadopeninha/status/1521468795646324737,False,,0,,,,,,,,"[{'screen_name': 'JRFDuarte71', 'name': 'Ricardo Duarte', 'id': '1356928076106629122'}]",,,,
1521134673648398342,1521134673648398342,2022-05-02 11:29:02 -03,2022-05-02,11:29:02,-300,37665648,deputadopeninha,Deputado Peninha,,📢ALÔ CACS: Plano de governo do Lula: acabar com os clubes de tiro do Brasil. 🤦‍♂️  https://t.co/bNj7UZqDz9,pt,[],[],[],1,5,19,[],[],https://twitter.com/deputadopeninha/status/1521134673648398342,False,,1,https://pbs.twimg.com/ext_tw_video_thumb/1521134538101035008/pu/img/U5WHMz7wGBxa2pMi.jpg,,,,,,,[],,,,
1520725240145485825,1520725240145485825,2022-05-01 08:22:05 -03,2022-05-01,08:22:05,-300,37665648,deputadopeninha,Deputado Peninha,,"Parabéns, trabalhadores brasileiros! 🇧🇷  https://t.co/aLzB759wd3",pt,[],[],['https://pbs.twimg.com/media/FRqzimoXMAAHydZ.jpg'],1,0,9,[],[],https://twitter.com/deputadopeninha/status/1520725240145485825,False,,1,https://pbs.twimg.com/media/FRqzimoXMAAHydZ.jpg,,,,,,,[],,,,
1520461148612702211,1520461148612702211,2022-04-30 14:52:41 -03,2022-04-30,14:52:41,-300,37665648,deputadopeninha,Deputado Peninha,,"Estive hoje com o grande amigo @LucianoHangBr na inauguração do Acesso Leste e da ponte Ingomar Bachmann, em Rio do Sul.  Antes de ser empresário, Hang é um homem de coração gigante, o que o torna um grande líder  e um orgulho para SC. Na foto, também o empresário Silvio Prim.  https://t.co/gbeyFe7xXy",pt,"[{'screen_name': 'lucianohangbr', 'name': 'luciano hang', 'id': '1385599766558650377'}]",[],['https://pbs.twimg.com/media/FRnDWcrXIAI7rey.jpg'],0,0,3,[],[],https://twitter.com/deputadopeninha/status/1520461148612702211,False,,1,https://pbs.twimg.com/media/FRnDWcrXIAI7rey.jpg,,,,,,,[],,,,
1524422905328775168,1524422901402943488,2022-05-11 13:15:17 -03,2022-05-11,13:15:17,-300,37665648,deputadopeninha,Deputado Peninha,,Ela passou orientações e na hora ligamos aos prefeitos das principais cidades afetadas para repassar.,pt,[],[],[],0,0,1,[],[],https://twitter.com/deputadopeninha/status/1524422905328775168,False,,0,,,,,,,,[],,,,
1524422901402943488,1524422901402943488,2022-05-11 13:15:16 -03,2022-05-11,13:15:16,-300,37665648,deputadopeninha,Deputado Peninha,,"CHEIAS em SC: Estive na Defesa Civil Nacional, com a secretária substituta, para tratar da agilidade na liberação de recursos aos municípios atingidos. Quem está sem teto tem PRESSA.  https://t.co/pBdTDSuLs4",pt,[],[],['https://pbs.twimg.com/media/FSfWi9ZX0AIrAbt.jpg'],1,0,7,[],[],https://twitter.com/deputadopeninha/status/1524422901402943488,False,,1,https://pbs.twimg.com/media/FSfWi9ZX0AIrAbt.jpg,,,,,,,[],,,,
1524137907958820864,1524137907958820864,2022-05-10 18:22:49 -03,2022-05-10,18:22:49,-300,37665648,deputadopeninha,Deputado Peninha,,O que acharam da ação do padre? 🫢  https://t.co/9g5QFv2H4q,pt,[],"['https://www.em.com.br/app/noticia/nacional/2022/05/09/interna_nacional,1365340/padre-atropela-assaltante-que-furtou-paroquia.shtml']",[],0,0,7,[],[],https://twitter.com/deputadopeninha/status/1524137907958820864,False,,0,,,,,,,,[],,,,
1520032022676312064,1520032022676312064,2022-04-29 10:27:29 -03,2022-04-29,10:27:29,-300,37665648,deputadopeninha,Deputado Peninha,,"EMEDEBISTAS COM BOLSONARO Nesta semana participei do ato de apoio do presidente Bolsonaro, aqui em Brasília. Junto com os colegas deputados do MDB, Osmar Terra (RS) e Otoni de Paula (RJ), reafirmei que estou fechado com o nosso presidente, mais firme do que nunca!  https://t.co/C2xcRHPR4u",pt,[],[],['https://pbs.twimg.com/media/FRg9ETUWQAAKykr.jpg'],1,1,10,[],[],https://twitter.com/deputadopeninha/status/1520032022676312064,False,,1,https://pbs.twimg.com/media/FRg9ETUWQAAKykr.jpg,,,,,,,[],,,,
1519732256444715011,1519732256444715011,2022-04-28 14:36:19 -03,2022-04-28,14:36:19,-300,37665648,deputadopeninha,Deputado Peninha,,"Não é admissível tamanho desrespeito com a tradição e história da Schützenfest, de Jaraguá do Sul. Comparação completamente esdrúxula, ridícula. Espero que sirva para promover ainda mais a maior FESTA DE ATIRADORES DO PAÍS!",pt,[],[],[],5,4,28,[],[],https://twitter.com/deputadopeninha/status/1519732256444715011,False,https://twitter.com/jeanwyllys_real/status/1519375212009111552,0,,,,,,,,[],,,,
1519727114882273285,1519517524269969409,2022-04-28 14:15:54 -03,2022-04-28,14:15:54,-300,37665648,deputadopeninha,Deputado Peninha,,@jairbolsonaro Legítima defesa para todos JÁ!,pt,[],[],[],0,0,8,[],[],https://twitter.com/deputadopeninha/status/1519727114882273285,False,,0,,,,,,,,"[{'screen_name': 'jairbolsonaro', 'name': 'Jair M. Bolsonaro', 'id': '128372940'}]",,,,
1519675670703529984,1519675564998762497,2022-04-28 10:51:28 -03,2022-04-28,10:51:28,-300,37665648,deputadopeninha,Deputado Peninha,,@LucianoHangBr  @jairbolsonaro,und,"[{'screen_name': 'jairbolsonaro', 'name': 'jair m. bolsonaro', 'id': '128372940'}]",[],[],0,0,3,[],[],https://twitter.com/deputadopeninha/status/1519675670703529984,False,,0,,,,,,,,[],,,,
1519675564998762497,1519675564998762497,2022-04-28 10:51:03 -03,2022-04-28,10:51:03,-300,37665648,deputadopeninha,Deputado Peninha,,Impossível não se emocionar ao ver a realização de SONHOS! O Seu Walter merece!  https://t.co/7ccR9s4W65,pt,[],[],[],1,2,13,[],[],https://twitter.com/deputadopeninha/status/1519675564998762497,False,,1,https://pbs.twimg.com/ext_tw_video_thumb/1519675524112695296/pu/img/CjvAtTVXA6fOnqfw.jpg,,,,,,,[],,,,
1519431668502872069,1519431668502872069,2022-04-27 18:41:54 -03,2022-04-27,18:41:54,-300,37665648,deputadopeninha,Deputado Peninha,,Não vamos deixar que derrubem a LEI DAS APPs no perímetro urbano. Só é CONTRA quem não conhece a realidade dos municípios brasileiros.  https://t.co/5JjZGe8jN7,pt,[],[],[],0,0,10,[],[],https://twitter.com/deputadopeninha/status/1519431668502872069,False,,1,https://pbs.twimg.com/ext_tw_video_thumb/1519431604346699777/pu/img/FZJynomeupUQKS_K.jpg,,,,,,,[],,,,
1519361345665355779,1519361345665355779,2022-04-27 14:02:27 -03,2022-04-27,14:02:27,-300,37665648,deputadopeninha,Deputado Peninha,,Deu errado para os vagabundos…  https://t.co/JbbeF6dyd4,pt,[],[],['https://pbs.twimg.com/media/FRXbFiFXMAESD-V.jpg'],2,5,26,[],[],https://twitter.com/deputadopeninha/status/1519361345665355779,False,,1,https://pbs.twimg.com/media/FRXbFiFXMAESD-V.jpg,,,,,,,[],,,,
1519309743403290624,1519295905605861377,2022-04-27 10:37:24 -03,2022-04-27,10:37:24,-300,37665648,deputadopeninha,Deputado Peninha,,"@LucianoHangBr @jairbolsonaro Muito bom, Luciano! O Sr. Walter merece e será muito bem recebido pelo PR @jairbolsonaro, com certeza.",pt,"[{'screen_name': 'jairbolsonaro', 'name': 'jair m. bolsonaro', 'id': '128372940'}]",[],[],0,1,35,[],[],https://twitter.com/deputadopeninha/status/1519309743403290624,False,,0,,,,,,,,"[{'screen_name': 'LucianoHangBr', 'name': 'Luciano Hang', 'id': '1385599766558650377'}, {'screen_name': 'jairbolsonaro', 'name': 'Jair M. Bolsonaro', 'id': '128372940'}]",,,,
1519002713027223553,1519002713027223553,2022-04-26 14:17:23 -03,2022-04-26,14:17:23,-300,37665648,deputadopeninha,Deputado Peninha,,Uma das maiores FAKE NEWS já vistas aqui no corredor de exposições da Câmara dos Deputados: centenário do Partido Comunista no Brasil.  https://t.co/7Nonnlk1kh,pt,[],[],[],0,3,11,[],[],https://twitter.com/deputadopeninha/status/1519002713027223553,False,,1,https://pbs.twimg.com/ext_tw_video_thumb/1519002638376964099/pu/img/EdUQpKiaBxJfZwqX.jpg,,,,,,,[],,,,
1518906904390606848,1518906904390606848,2022-04-26 07:56:40 -03,2022-04-26,07:56:40,-300,37665648,deputadopeninha,Deputado Peninha,,"Um obteve refúgio do ex-presidente Lula, o outro indulto de Bolsonaro. Nunca foi tão fácil escolher qual lado apoiar!  https://t.co/iNoyGNdz53",pt,[],[],['https://pbs.twimg.com/media/FRQ9xMoWYAAL7vy.jpg'],0,7,29,[],[],https://twitter.com/deputadopeninha/status/1518906904390606848,False,,1,https://pbs.twimg.com/media/FRQ9xMoWYAAL7vy.jpg,,,,,,,[],,,,
1518672253579411456,1518672253579411456,2022-04-25 16:24:15 -03,2022-04-25,16:24:15,-300,37665648,deputadopeninha,Deputado Peninha,,"O motorista foi mantido refém dentro da cabine. Ao se aproximar de uma rotatória, a vítima percebeu que o caminhão reduziria a velocidade e pulou para fugir dos bandidos. É por essas e outras que eu não admito que defendam bandidos. Vítima da sociedade é o MOTORISTA TRABALHADOR!  https://t.co/eYrtip2z5K",pt,[],[],[],0,0,14,[],[],https://twitter.com/deputadopeninha/status/1518672253579411456,False,,1,https://pbs.twimg.com/ext_tw_video_thumb/1518672232679198720/pu/img/e3vLfNCVqzvTQ7XD.jpg,,,,,,,[],,,,
1518586994305253376,1518586994305253376,2022-04-25 10:45:28 -03,2022-04-25,10:45:28,-300,37665648,deputadopeninha,Deputado Peninha,,"Bom dia, amigos desta rede! Semana de muito trabalho em Brasília, pois temos Marcha de prefeitos e vereadores, portanto muitas lideranças na Capital. Projetos importantes no Congresso Nacional também. Seguimos firme no trabalho🤝🇧🇷",pt,[],[],[],0,0,9,[],[],https://twitter.com/deputadopeninha/status/1518586994305253376,False,,0,,,,,,,,[],,,,
1518208905079369729,1518208905079369729,2022-04-24 09:43:04 -03,2022-04-24,09:43:04,-300,37665648,deputadopeninha,Deputado Peninha,,Quem gosta de um domingo RAIZ?  https://t.co/VEQP3vwXO6,pt,[],[],[],1,3,18,[],[],https://twitter.com/deputadopeninha/status/1518208905079369729,False,,1,https://pbs.twimg.com/ext_tw_video_thumb/1518208858967232512/pu/img/m5bQscL4p8T67UcW.jpg,,,,,,,[],,,,
1517533592037076992,1517533589902143492,2022-04-22 12:59:37 -03,2022-04-22,12:59:37,-300,37665648,deputadopeninha,Deputado Peninha,,"Tanto lutamos p/aprovar este meu projeto no Congresso, atendendo ao pedido dos municípios, para que possam decidir junto com a comunidade sobre as áreas edificáveis. Certamente, estes que estão querendo derrubar a lei NÃO CONHECEM a realidade das cidades brasileiras. LAMENTÁVEL.",pt,[],[],[],0,2,10,[],[],https://twitter.com/deputadopeninha/status/1517533592037076992,False,,0,,,,,,,,[],,,,
1517533589902143492,1517533589902143492,2022-04-22 12:59:36 -03,2022-04-22,12:59:36,-300,37665648,deputadopeninha,Deputado Peninha,,"Parece brincadeira, mas não é: PT, PSol, PSB e Rede Sustentabilidade acionaram o STF (por meio de uma ADI) contra a Lei 14.285/2021 – a LEI DAS APPS NO PERÍMETRO URBANO.",pt,[],[],[],2,1,7,[],[],https://twitter.com/deputadopeninha/status/1517533589902143492,False,,0,,,,,,,,[],,,,
1517175324013907969,1517175324013907969,2022-04-21 13:15:59 -03,2022-04-21,13:15:59,-300,37665648,deputadopeninha,Deputado Peninha,,Bom feriado.  https://t.co/Zkwq3oCy9L,pt,[],[],['https://pbs.twimg.com/media/FQ4W6ULWQAAy8p-.jpg'],0,1,10,[],[],https://twitter.com/deputadopeninha/status/1517175324013907969,False,,1,https://pbs.twimg.com/media/FQ4W6ULWQAAy8p-.jpg,,,,,,,[],,,,
1516852970440335366,1516852970440335366,2022-04-20 15:55:04 -03,2022-04-20,15:55:04,-300,37665648,deputadopeninha,Deputado Peninha,,É FATO!  #agriculturado🇧🇷  https://t.co/krE7rJBnFM,pt,[],[],['https://pbs.twimg.com/media/FQzxvBvWUAUy2pK.jpg'],0,2,9,['agriculturado'],[],https://twitter.com/deputadopeninha/status/1516852970440335366,False,,1,https://pbs.twimg.com/media/FQzxvBvWUAUy2pK.jpg,,,,,,,[],,,,
1516766342782849035,1516766342782849035,2022-04-20 10:10:50 -03,2022-04-20,10:10:50,-300,37665648,deputadopeninha,Deputado Peninha,,"A função do POLÍTICO é facilitar a vida do cidadão. Por isso, eu tenho um recado IMPORTANTE⚠️ @rafapezenti  https://t.co/Ox3s5HomFq",pt,"[{'screen_name': 'rafapezenti', 'name': 'rafael pezenti', 'id': '127708617'}]",[],[],0,1,4,[],[],https://twitter.com/deputadopeninha/status/1516766342782849035,False,,1,https://pbs.twimg.com/ext_tw_video_thumb/1516766220405641231/pu/img/Xl2ZxBkRPmTLnV2D.jpg,,,,,,,[],,,,
1516397227480166406,1516397227480166406,2022-04-19 09:44:06 -03,2022-04-19,09:44:06,-300,37665648,deputadopeninha,Deputado Peninha,,"Lamentável esta perseguição a uma empresa como a Havan, que emprega mais de 22 MIL PESSOAS em todo o Brasil.  O ódio do bem chegou ao EXTREMO!   https://t.co/fjvfgHL6il",pt,[],['https://pleno.news/brasil/cidades/colaboradora-da-havan-e-agredida-por-ex-candidata-a-vereadora-do-pt.html'],[],0,0,6,[],[],https://twitter.com/deputadopeninha/status/1516397227480166406,False,,0,,,,,,,,[],,,,
1516140671199072261,1516140671199072261,2022-04-18 16:44:39 -03,2022-04-18,16:44:39,-300,37665648,deputadopeninha,Deputado Peninha,,"SEGUNDA-FEIRA, você está indo pegar ônibus para ir ao trabalho e se depara COM ESTA CENA. Lamentável.  https://t.co/PXWCrJn1YM",pt,[],[],[],0,0,4,[],[],https://twitter.com/deputadopeninha/status/1516140671199072261,False,,1,https://pbs.twimg.com/ext_tw_video_thumb/1516140625313341443/pu/img/-LLRKXXOyioWBAUL.jpg,,,,,,,[],,,,
1516125785941229568,1516125785941229568,2022-04-18 15:45:30 -03,2022-04-18,15:45:30,-300,37665648,deputadopeninha,Deputado Peninha,,"Enfim, recebemos a tão sonhada notícia: o fim da emergência sanitária no Brasil. O que preocupa agora são as consequências que ficaram e que todos nós estamos sentindo na pele. Hora de focar na recuperação ECONÔMICA. Fome também mata.",pt,[],[],[],0,0,11,[],[],https://twitter.com/deputadopeninha/status/1516125785941229568,False,,0,,,,,,,,[],,,,
1516003590736912387,1516003590736912387,2022-04-18 07:39:56 -03,2022-04-18,07:39:56,-300,37665648,deputadopeninha,Deputado Peninha,,"Noite de TERROR em Guarapuava/PR: bandidos com ARMAMENTO DE GUERRA atacaram um batalhão da PM, incendiaram veículos e fizeram moradores reféns a fim de assaltar uma transportadora de valores.    Mais um exemplo de como funciona o Estatuto do Desarmamento: não para a bandidagem!  https://t.co/BZxwxGJoOC",pt,[],[],[],1,5,23,[],[],https://twitter.com/deputadopeninha/status/1516003590736912387,False,,1,https://pbs.twimg.com/ext_tw_video_thumb/1516003499703689216/pu/img/kx-Mm1P42AQ-C4Vx.jpg,,,,,,,[],,,,
1524422905328775168,1524422901402943488,2022-05-11 13:15:17 -0300,2022-05-11,13:15:17,-300,37665648,deputadopeninha,Deputado Peninha,,Ela passou orientações e na hora ligamos aos prefeitos das principais cidades afetadas para repassar.,pt,[],[],[],0,0,1,[],[],https://twitter.com/deputadopeninha/status/1524422905328775168,False,,0,,,,,,,,[],,,,
1524422901402943488,1524422901402943488,2022-05-11 13:15:16 -0300,2022-05-11,13:15:16,-300,37665648,deputadopeninha,Deputado Peninha,,"CHEIAS em SC: Estive na Defesa Civil Nacional, com a secretária substituta, para tratar da agilidade na liberação de recursos aos municípios atingidos. Quem está sem teto tem PRESSA.  https://t.co/pBdTDSuLs4",pt,[],[],['https://pbs.twimg.com/media/FSfWi9ZX0AIrAbt.jpg'],1,0,8,[],[],https://twitter.com/deputadopeninha/status/1524422901402943488,False,,1,https://pbs.twimg.com/media/FSfWi9ZX0AIrAbt.jpg,,,,,,,[],,,,
1524137907958820864,1524137907958820864,2022-05-10 18:22:49 -0300,2022-05-10,18:22:49,-300,37665648,deputadopeninha,Deputado Peninha,,O que acharam da ação do padre? 🫢  https://t.co/9g5QFv2H4q,pt,[],"['https://www.em.com.br/app/noticia/nacional/2022/05/09/interna_nacional,1365340/padre-atropela-assaltante-que-furtou-paroquia.shtml']",[],0,0,7,[],[],https://twitter.com/deputadopeninha/status/1524137907958820864,False,,0,,,,,,,,[],,,,
1524038881997426690,1524038881997426690,2022-05-10 11:49:19 -0300,2022-05-10,11:49:19,-300,37665648,deputadopeninha,Deputado Peninha,,Eu tenho uma PERGUNTA para vocês!👆🏻 @rafapezenti  https://t.co/5kurEDNzzb,pt,"[{'screen_name': 'rafapezenti', 'name': 'rafael pezenti', 'id': '127708617'}]",[],[],0,0,3,[],[],https://twitter.com/deputadopeninha/status/1524038881997426690,False,,1,https://pbs.twimg.com/ext_tw_video_thumb/1524038842768056320/pu/img/0pB0ZLkH5F_frjV7.jpg,,,,,,,[],,,,
1524008991118008325,1523667836182609920,2022-05-10 09:50:32 -0300,2022-05-10,09:50:32,-300,37665648,deputadopeninha,Deputado Peninha,,@diogobueno11 😅😅😅,und,[],[],[],0,0,1,[],[],https://twitter.com/deputadopeninha/status/1524008991118008325,False,,0,,,,,,,,"[{'screen_name': 'diogobueno11', 'name': 'Diogo Bueno', 'id': '37540235'}]",,,,
1523667836182609920,1523667836182609920,2022-05-09 11:14:55 -0300,2022-05-09,11:14:55,-300,37665648,deputadopeninha,Deputado Peninha,,"SIM, e com muito ORGULHO!  https://t.co/6sxOI2cAMK",pt,[],['https://vegazeta.com.br/deputado-de-sc-e-autor-de-tres-projetos-em-beneficio-de-cacadores/'],[],3,1,17,[],[],https://twitter.com/deputadopeninha/status/1523667836182609920,False,,0,,,,,,,,[],,,,
1522613783708975105,1522346712983130114,2022-05-06 13:26:29 -0300,2022-05-06,13:26:29,-300,37665648,deputadopeninha,Deputado Peninha,,@revistaoeste Andar com livros não quer!,pt,[],[],[],0,1,8,[],[],https://twitter.com/deputadopeninha/status/1522613783708975105,False,,0,,,,,,,,"[{'screen_name': 'revistaoeste', 'name': 'Revista Oeste', 'id': '1222939896349970432'}]",,,,
1522613553181642756,1522613553181642756,2022-05-06 13:25:34 -0300,2022-05-06,13:25:34,-300,37665648,deputadopeninha,Deputado Peninha,,Por que não anda com livros?  https://t.co/ZiUJi23hA5,pt,[],[],['https://pbs.twimg.com/media/FSFo8_kXMAIHwTM.jpg'],3,3,26,[],[],https://twitter.com/deputadopeninha/status/1522613553181642756,False,,1,https://pbs.twimg.com/media/FSFo8_kXMAIHwTM.jpg,,,,,,,[],,,,
1522214529748201473,1522214529748201473,2022-05-05 10:59:59 -0300,2022-05-05,10:59:59,-300,37665648,deputadopeninha,Deputado Peninha,,"#TBT do último sábado, acompanhando o amigo @LucianoHangBr nesta super bike. Aliás, andar de bicicleta é a atividade física que eu pratico todos os dias, sem exceção!  https://t.co/57OSwLIWBR",pt,"[{'screen_name': 'lucianohangbr', 'name': 'luciano hang', 'id': '1385599766558650377'}]",[],[],1,3,14,['tbt'],[],https://twitter.com/deputadopeninha/status/1522214529748201473,False,,1,https://pbs.twimg.com/ext_tw_video_thumb/1522214465919352835/pu/img/bu98U7U3WdYIP9jd.jpg,,,,,,,[],,,,
1521838074006810624,1521838069481193472,2022-05-04 10:04:05 -0300,2022-05-04,10:04:05,-300,37665648,deputadopeninha,Deputado Peninha,,Nossas crianças e adolescentes merecem a proteção da lei e da sociedade!  https://t.co/0ceQuVAenY,pt,[],[],['https://pbs.twimg.com/media/FR6nnniXIAE9Jfg.jpg'],0,1,11,[],[],https://twitter.com/deputadopeninha/status/1521838074006810624,False,,1,https://pbs.twimg.com/media/FR6nnniXIAE9Jfg.jpg,,,,,,,[],,,,
1521838069481193472,1521838069481193472,2022-05-04 10:04:04 -0300,2022-05-04,10:04:04,-300,37665648,deputadopeninha,Deputado Peninha,,"Aprovamos, na Câmara dos Deputados, a aplicação de PENAS MAIS RÍGIDAS para crimes cometidos contra crianças e adolescentes – a chamada LEI HENRY BOREL. Transformamos em CRIME HEDIONDO o homicídio contra menores de 14 anos. O tempo de cadeia tbem aumentou e pode chegar a 30 anos.",pt,[],[],[],3,2,20,[],[],https://twitter.com/deputadopeninha/status/1521838069481193472,False,,0,,,,,,,,[],,,,
1521610466715447297,1521609983275720704,2022-05-03 18:59:40 -0300,2022-05-03,18:59:40,-300,37665648,deputadopeninha,Deputado Peninha,,@benebarbosa_mvb 😂😂😂Eu quero participar. Vamos começar com este:  https://t.co/7veItE515p,pt,[],[],['https://pbs.twimg.com/media/FR3YmVkWUAAs6d5.jpg'],1,2,99,[],[],https://twitter.com/deputadopeninha/status/1521610466715447297,False,,1,https://pbs.twimg.com/media/FR3YmVkWUAAs6d5.jpg,,,,,,,"[{'screen_name': 'benebarbosa_mvb', 'name': 'Bene Barbosa', 'id': '60957484'}]",,,,
1521593953384079360,1521593953384079360,2022-05-03 17:54:02 -0300,2022-05-03,17:54:02,-300,37665648,deputadopeninha,Deputado Peninha,,"Agradeço a todos que colaboram com meu mandato, principalmente a POPULAÇÃO CATARINENSE, por cobrar e se fazer presente em minhas ações. Fico muito feliz com o resultado!  https://t.co/cLM12HhjLS",pt,[],[],['https://pbs.twimg.com/media/FR3Joh0XMAMiQs-.jpg'],1,2,20,[],[],https://twitter.com/deputadopeninha/status/1521593953384079360,False,,1,https://pbs.twimg.com/media/FR3Joh0XMAMiQs-.jpg,,,,,,,[],,,,
1521526854716329984,1521526854716329984,2022-05-03 13:27:25 -0300,2022-05-03,13:27:25,-300,37665648,deputadopeninha,Deputado Peninha,,"Em apenas UMA SEMANA, Lula disse que: - Policial não é gente - Vai criar uma moeda em comum com Argentina e Venezuela - Vai fechar os clubes de tiro E você achando difícil escolher? O aviso já foi dado.",pt,[],[],[],1,2,22,[],[],https://twitter.com/deputadopeninha/status/1521526854716329984,False,,0,,,,,,,,[],,,,
