id,conversation_id,created_at,date,time,timezone,user_id,username,name,place,tweet,language,mentions,urls,photos,replies_count,retweets_count,likes_count,hashtags,cashtags,link,retweet,quote_url,video,thumbnail,near,geo,source,user_rt_id,user_rt,retweet_id,reply_to,retweet_date,translate,trans_src,trans_dest
1425224552884412428,1425145560756072450,2021-08-10 19:36:27 -0300,2021-08-10,19:36:27,-300,37665648,deputadopeninha,Deputado Peninha,,"@NoraMR2019 Para evitar que sejam demolidas casas e estabelecimentos comerciais a menos de 30 metros de cursos d’água nas cidades brasileiras, conforme decisão do STJ. Muitas cidades seriam inviabilizadas.",pt,[],[],[],1,0,0,[],[],https://twitter.com/deputadopeninha/status/1425224552884412428,False,,0,,,,,,,,"[{'screen_name': 'NoraMR2019', 'name': 'NoraMR', 'id': '3229998843'}]",,,,
1425145560756072450,1425145560756072450,2021-08-10 14:22:34 -0300,2021-08-10,14:22:34,-300,37665648,deputadopeninha,Deputado Peninha,,"🚨🚨🚨 ATENÇÃO! Está pautado para hoje o REQUERIMENTO DE URGÊNCIA do projeto 2510, de minha autoria, que dá autonomia para os municípios decidirem sobre as APPs no perímetro urbano.  Importante decisão para as cidades brasileiras!  https://t.co/YJdLYgurR7",pt,[],[],['https://pbs.twimg.com/media/E8ciVEcXsAU8Aew.jpg'],6,2,30,[],[],https://twitter.com/deputadopeninha/status/1425145560756072450,False,,1,https://pbs.twimg.com/media/E8ciVEcXsAU8Aew.jpg,,,,,,,[],,,,
1425078502726983688,1425078502726983688,2021-08-10 09:56:06 -0300,2021-08-10,09:56:06,-300,37665648,deputadopeninha,Deputado Peninha,,Hoje teremos uma pauta muito importante na Câmara dos Deputados e eu reitero: votarei A FAVOR do voto impresso auditável.,pt,[],[],[],1596,2817,22492,[],[],https://twitter.com/deputadopeninha/status/1425078502726983688,False,,0,,,,,,,,[],,,,
1424791517051432963,1424791345193947147,2021-08-09 14:55:43 -0300,2021-08-09,14:55:43,-300,37665648,deputadopeninha,Deputado Peninha,,"Nascida em Nova Trento, Rosamaria foi criada em um lar de muito respeito e integridade. Também deixo aqui meu abraço à FAMÍLIA MONTIBELLER. PARABÉNS, @rosamariavolei! É apenas o início de sua brilhante trajetória.",pt,"[{'screen_name': 'rosamariavolei', 'name': 'rosamaria montibeller', 'id': '1420973669405270016'}]",[],[],0,0,12,[],[],https://twitter.com/deputadopeninha/status/1424791517051432963,False,,0,,,,,,,,[],,,,
1424791345193947147,1424791345193947147,2021-08-09 14:55:02 -0300,2021-08-09,14:55:02,-300,37665648,deputadopeninha,Deputado Peninha,,"Registro toda a minha admiração pela amiga e conterrânea ROSAMARIA, jogadora da seleção feminina de vôlei, time que conquistou a PRATA nas Olimpíadas de Tóquio. 🇧🇷  https://t.co/l4S7dgCaax",pt,[],[],['https://pbs.twimg.com/media/E8XgKsfXEAIBPqg.jpg'],6,0,37,[],[],https://twitter.com/deputadopeninha/status/1424791345193947147,False,,1,https://pbs.twimg.com/media/E8XgKsfXEAIBPqg.jpg,,,,,,,[],,,,
1424370150720032768,1424370150720032768,2021-08-08 11:01:22 -0300,2021-08-08,11:01:22,-300,37665648,deputadopeninha,Deputado Peninha,,Ser PAI é cuidar do tesouro mais valioso que um homem pode ter!  FELIZ DIA DOS PAIS!  https://t.co/PLoy1JpF7h,pt,[],[],['https://pbs.twimg.com/media/E8RhGUXWYAIJPAA.jpg'],0,1,17,[],[],https://twitter.com/deputadopeninha/status/1424370150720032768,False,,1,https://pbs.twimg.com/media/E8RhGUXWYAIJPAA.jpg,,,,,,,[],,,,
1423987601694920709,1423987601694920709,2021-08-07 09:41:15 -0300,2021-08-07,09:41:15,-300,37665648,deputadopeninha,Deputado Peninha,,Notícias que valem a pena. Parabéns ao idoso!   https://t.co/sKlnOdGBwN,pt,[],['https://jornalnoroeste.com.br/noticia/policia/idoso-de-81-anos-mata-assaltante-que-invadiu-sua-casa-no-norte-gaucho'],[],1,2,15,[],[],https://twitter.com/deputadopeninha/status/1423987601694920709,False,,0,,,,,,,,[],,,,
1423643595379286022,1423643595379286022,2021-08-06 10:54:17 -0300,2021-08-06,10:54:17,-300,37665648,deputadopeninha,Deputado Peninha,,"Chegando a Santa Catarina para acompanhar o presidente @jairbolsonaro em sua visita ao nosso Estado.  Na viagem, aproveitei para levantar demandas importantes dos catarinenses: a BR-470, que considero a principal no momento.  https://t.co/XDWaaHPKe8",pt,"[{'screen_name': 'jairbolsonaro', 'name': 'jair m. bolsonaro', 'id': '128372940'}]",[],['https://pbs.twimg.com/media/E8HMTHaXIAg3UkW.jpg'],23,83,515,[],[],https://twitter.com/deputadopeninha/status/1423643595379286022,False,,1,https://pbs.twimg.com/media/E8HMTHaXIAg3UkW.jpg,,,,,,,[],,,,
1423394370867372033,1423394370867372033,2021-08-05 18:23:58 -0300,2021-08-05,18:23:58,-300,37665648,deputadopeninha,Deputado Peninha,,"O endividamento das famílias brasileiras bateu novo recorde, aponta o levantamento da Confederação Nacional do Comércio. Significa que falta o essencial a muitos. Como diziam: ""a economia a gente vê depois"". Chegou a conta.",pt,[],[],[],2,0,5,[],[],https://twitter.com/deputadopeninha/status/1423394370867372033,False,,0,,,,,,,,[],,,,
1423394197130915846,1423394197130915846,2021-08-05 18:23:16 -0300,2021-08-05,18:23:16,-300,37665648,deputadopeninha,Deputado Peninha,,"A participação das mulheres na política É INDISPENSÁVEL e o respeito deve prevalecer acima de tudo. Parabéns, presidente @jairbolsonaro e ministra @DamaresAlves, incansável nesta luta.   https://t.co/uhQoCpzLx2",pt,"[{'screen_name': 'jairbolsonaro', 'name': 'jair m. bolsonaro', 'id': '128372940'}, {'screen_name': 'damaresalves', 'name': 'damares alves', 'id': '1083774484123975680'}]",['https://oglobo.globo.com/brasil/celina/bolsonaro-sanciona-lei-que-que-criminaliza-violencia-politica-contra-mulheres-25141647'],[],0,1,3,[],[],https://twitter.com/deputadopeninha/status/1423394197130915846,False,,0,,,,,,,,[],,,,
1423300939805511681,1423300939805511681,2021-08-05 12:12:42 -0300,2021-08-05,12:12:42,-300,37665648,deputadopeninha,Deputado Peninha,,Voto impresso e auditável: eu apoio!,pt,[],[],[],7,2,34,[],[],https://twitter.com/deputadopeninha/status/1423300939805511681,False,,0,,,,,,,,[],,,,
1423280209864716289,1423280209864716289,2021-08-05 10:50:19 -0300,2021-08-05,10:50:19,-300,37665648,deputadopeninha,Deputado Peninha,,Decisão do STJ sobre APPs cada vez mais próxima de ser revogada.  https://t.co/BenLS7INzL,pt,[],[],['https://pbs.twimg.com/media/E8CBzX4UcA4mYPU.jpg'],1,0,12,[],[],https://twitter.com/deputadopeninha/status/1423280209864716289,False,,1,https://pbs.twimg.com/media/E8CBzX4UcA4mYPU.jpg,,,,,,,[],,,,
1422980906067898368,1422980906067898368,2021-08-04 15:01:00 -0300,2021-08-04,15:01:00,-300,37665648,deputadopeninha,Deputado Peninha,,Policial reage a assalto e bota bandidagem pra correr!  https://t.co/whgQGB3uof,pt,[],[],[],5,2,28,[],[],https://twitter.com/deputadopeninha/status/1422980906067898368,False,,1,https://pbs.twimg.com/ext_tw_video_thumb/1422980799700381703/pu/img/HWqFmoeAsNrvbBiq.jpg,,,,,,,[],,,,
1422912346796826631,1422912346796826631,2021-08-04 10:28:34 -0300,2021-08-04,10:28:34,-300,37665648,deputadopeninha,Deputado Peninha,,"Aprovamos a REGULARIZAÇÃO FUNDIÁRIA de terras da União, que traz legalidade, segurança e dignidade ao pequeno produtor rural. Vitória para os agricultores familiares, que agora podem ter acesso mais fácil ao crédito agrícola e programas do Governo.  #agriculturaforte",pt,[],[],[],0,0,9,['agriculturaforte'],[],https://twitter.com/deputadopeninha/status/1422912346796826631,False,,0,,,,,,,,[],,,,
1422606461255958529,1422606461255958529,2021-08-03 14:13:05 -0300,2021-08-03,14:13:05,-300,37665648,deputadopeninha,Deputado Peninha,,#maisimpostonão  https://t.co/gZpK6bUhgz,und,[],[],['https://pbs.twimg.com/media/E74dB5YWQAIFPxX.jpg'],3,1,19,['maisimpostonão'],[],https://twitter.com/deputadopeninha/status/1422606461255958529,False,,1,https://pbs.twimg.com/media/E74dB5YWQAIFPxX.jpg,,,,,,,[],,,,
1422304856317042688,1422304856317042688,2021-08-02 18:14:37 -0300,2021-08-02,18:14:37,-300,37665648,deputadopeninha,Deputado Peninha,,Quero ver a coragem de falar em “direitos humanos” e “ressocialização” em uma barbárie dessas.   https://t.co/DbwjgKkMv6,pt,[],['https://www.google.com/amp/s/www.gaz.com.br/mae-mata-filho-de-7-anos-e-joga-corpo-no-rio-em-imbe/%3Famp%3D1'],[],1,0,6,[],[],https://twitter.com/deputadopeninha/status/1422304856317042688,False,,0,,,,,,,,[],,,,
1421851782754492423,1421851782754492423,2021-08-01 12:14:16 -0300,2021-08-01,12:14:16,-300,37665648,deputadopeninha,Deputado Peninha,,Bom domingo!  https://t.co/NJnfOoiN70,pt,[],[],['https://pbs.twimg.com/media/E7tupdgXMAE48cp.jpg'],2,0,12,[],[],https://twitter.com/deputadopeninha/status/1421851782754492423,False,,1,https://pbs.twimg.com/media/E7tupdgXMAE48cp.jpg,,,,,,,[],,,,
1421560669820833799,1421560669820833799,2021-07-31 16:57:29 -0300,2021-07-31,16:57:29,-300,37665648,deputadopeninha,Deputado Peninha,,Mais um caso de legítima defesa com sucesso✅   https://t.co/Wdj1POEKMi,pt,[],['https://www.didigalvao.com.br/vitima-reage-e-mata-assaltante-no-agreste-de-pernambuco/'],[],1,2,15,[],[],https://twitter.com/deputadopeninha/status/1421560669820833799,False,,0,,,,,,,,[],,,,
1421105984622243843,1421105573748224005,2021-07-30 10:50:44 -0300,2021-07-30,10:50:44,-300,37665648,deputadopeninha,Deputado Peninha,,Imagem: NSC Total.,pt,[],[],[],0,0,1,[],[],https://twitter.com/deputadopeninha/status/1421105984622243843,False,,0,,,,,,,,[],,,,
1421105573748224005,1421105573748224005,2021-07-30 10:49:06 -0300,2021-07-30,10:49:06,-300,37665648,deputadopeninha,Deputado Peninha,,"Joinville, Itajaí, Florianópolis e Blumenau estão entre as 100 cidades mais ricas do Brasil, conforme levantamento do IBGE baseado no PIB. Santa Catarina é a 6ª maior economia do País! Sempre trabalhei e continuo na luta para que tenhamos o devido retorno de nossos impostos.  https://t.co/A2cU1nyGOC",pt,[],[],['https://pbs.twimg.com/media/E7jH--WWEAYaFYk.jpg'],3,1,8,[],[],https://twitter.com/deputadopeninha/status/1421105573748224005,False,,1,https://pbs.twimg.com/media/E7jH--WWEAYaFYk.jpg,,,,,,,[],,,,
1420826827036233729,1420826827036233729,2021-07-29 16:21:27 -0300,2021-07-29,16:21:27,-300,37665648,deputadopeninha,Deputado Peninha,,"Se o fato é verídico eu não sei, mas que bandido não tem limites eu tenho certeza.  https://t.co/SzN6ja6Pjf",pt,[],[],[],0,2,13,[],[],https://twitter.com/deputadopeninha/status/1420826827036233729,False,,1,https://pbs.twimg.com/ext_tw_video_thumb/1420826784766074885/pu/img/u8W48OjsSz4cm5gA.jpg,,,,,,,[],,,,
1420751947858989070,1420751947858989070,2021-07-29 11:23:55 -0300,2021-07-29,11:23:55,-300,37665648,deputadopeninha,Deputado Peninha,,"Com pouca repercussão na mídia brasileira, eu me questiono onde estão os defensores da liberdade de expressão neste momento.   https://t.co/EEV8FYTLmM",pt,[],['https://revistaoeste.com/mundo/adolescente-cubana-e-condenada-a-8-meses-de-prisao-por-protestar-contra-a-ditadura/'],[],0,2,8,[],[],https://twitter.com/deputadopeninha/status/1420751947858989070,False,,0,,,,,,,,[],,,,
1420388730590933004,1420388730590933004,2021-07-28 11:20:37 -0300,2021-07-28,11:20:37,-300,37665648,deputadopeninha,Deputado Peninha,,"Ex-governador PETISTA…  Para quem ainda não entendeu a lógica do sistema da esquerda, aí está um exemplo.   https://t.co/7bP6IYCihF",pt,[],"['https://www.correiobraziliense.com.br/app/noticia/cidades/2020/07/23/interna_cidadesdf,874679/agnelo-paga-r-3-mil-de-fianca-e-e-liberado-apos-prisao-porte-de-arma.shtml']",[],0,2,11,[],[],https://twitter.com/deputadopeninha/status/1420388730590933004,False,,0,,,,,,,,[],,,,
1420380315177168902,1420380315177168902,2021-07-28 10:47:11 -0300,2021-07-28,10:47:11,-300,37665648,deputadopeninha,Deputado Peninha,,"Preparem os casacos, cobertores...  https://t.co/hC9YgbHXHG",pt,[],['https://www.nsctotal.com.br/noticias/maior-frio-de-sc-em-60-anos-pode-ser-registrado-nesta-semana-veja'],[],0,1,8,[],[],https://twitter.com/deputadopeninha/status/1420380315177168902,False,,0,,,,,,,,[],,,,
1420128756656656386,1420128756656656386,2021-07-27 18:07:34 -0300,2021-07-27,18:07:34,-300,37665648,deputadopeninha,Deputado Peninha,,Brasil competitivo!  https://t.co/0A2km4AJxm,pt,[],['https://www.poder360.com.br/economia/governo-revoga-imposto-de-exportacao-de-armas-e-municoes/'],[],5,3,36,[],[],https://twitter.com/deputadopeninha/status/1420128756656656386,False,,0,,,,,,,,[],,,,
1419993381321773082,1419993381321773082,2021-07-27 09:09:38 -0300,2021-07-27,09:09:38,-300,37665648,deputadopeninha,Deputado Peninha,,Dá gosto assistir às Olimpíadas com tantos talentos! Brasileiros estão dando show...!🇧🇷🏆,pt,[],[],[],0,0,8,[],[],https://twitter.com/deputadopeninha/status/1419993381321773082,False,,0,,,,,,,,[],,,,
1419271681676300290,1419271681676300290,2021-07-25 09:21:52 -0300,2021-07-25,09:21:52,-300,37665648,deputadopeninha,Deputado Peninha,,Que Deus abençoe estes batalhadores! #colonoemotorista  https://t.co/RGb5ZO1tg8,pt,[],[],['https://pbs.twimg.com/media/E7JEEU4XMAExWbk.jpg'],0,0,11,['colonoemotorista'],[],https://twitter.com/deputadopeninha/status/1419271681676300290,False,,1,https://pbs.twimg.com/media/E7JEEU4XMAExWbk.jpg,,,,,,,[],,,,
1418627705600421888,1418627705600421888,2021-07-23 14:42:56 -0300,2021-07-23,14:42:56,-300,37665648,deputadopeninha,Deputado Peninha,,Grande evento de armas em Joinville no mês de agosto!  https://t.co/gLE32mYl9J,pt,[],[],[],1,3,27,[],[],https://twitter.com/deputadopeninha/status/1418627705600421888,False,,1,https://pbs.twimg.com/ext_tw_video_thumb/1418627629478031367/pu/img/_PNqinNfb_Iaa-pG.jpg,,,,,,,[],,,,
1418178482350264322,1418178482350264322,2021-07-22 08:57:53 -0300,2021-07-22,08:57:53,-300,37665648,deputadopeninha,Deputado Peninha,,"A saída temporária dos presídios é um benefício que NUNCA fez sentido. Precisamos aprovar URGENTE o PL 9009/17, de minha autoria, que acaba com isso.  https://t.co/cXy4SDQrxx",pt,[],['https://www.nsctotal.com.br/colunistas/renato-igor/saida-temporaria-140-presos-nao-retornam-as-unidades-prisionais-em-sc'],[],0,2,15,[],[],https://twitter.com/deputadopeninha/status/1418178482350264322,False,,0,,,,,,,,[],,,,
1417840077477195776,1417840077477195776,2021-07-21 10:33:11 -0300,2021-07-21,10:33:11,-300,37665648,deputadopeninha,Deputado Peninha,,Como está seu Estado? Comente aqui.  https://t.co/J99DuFeli9,pt,[],[],['https://pbs.twimg.com/media/E60uCF3XMAMG9aA.jpg'],6,1,10,[],[],https://twitter.com/deputadopeninha/status/1417840077477195776,False,,1,https://pbs.twimg.com/media/E60uCF3XMAMG9aA.jpg,,,,,,,[],,,,
1417468351916425216,1417468351916425216,2021-07-20 09:56:05 -0300,2021-07-20,09:56:05,-300,37665648,deputadopeninha,Deputado Peninha,,Friagem!  https://t.co/ls68wtFzCL,en,[],['https://ndmais.com.br/tempo/fotos-sc-tem-recorde-negativo-do-ano-com-8c-geada-ampla-e-belas-paisagens/'],[],1,0,6,[],[],https://twitter.com/deputadopeninha/status/1417468351916425216,False,,0,,,,,,,,[],,,,
1417460077137698845,1417460077137698845,2021-07-20 09:23:12 -0300,2021-07-20,09:23:12,-300,37665648,deputadopeninha,Deputado Peninha,,"AMIGOS... Não precisamos vê-los todos os dias para saber que existem! Feliz DIA DO AMIGO!  Saudades deste irmão que a vida me deu, e que partiu tão cedo. Este foi um amigo DE VERDADE!  https://t.co/KIigr562Nf",pt,[],[],['https://pbs.twimg.com/media/E6vUbMfXICIHiaj.jpg'],1,0,10,[],[],https://twitter.com/deputadopeninha/status/1417460077137698845,False,,1,https://pbs.twimg.com/media/E6vUbMfXICIHiaj.jpg,,,,,,,[],,,,
1417117380786917376,1417117380786917376,2021-07-19 10:41:27 -0300,2021-07-19,10:41:27,-300,37665648,deputadopeninha,Deputado Peninha,,A verdade sobre a votação da LDO.  https://t.co/MZMW5B0Yyf,pt,[],[],[],3,1,19,[],[],https://twitter.com/deputadopeninha/status/1417117380786917376,False,,1,https://pbs.twimg.com/ext_tw_video_thumb/1417117313011224576/pu/img/EMriuxQqzl9CT8as.jpg,,,,,,,[],,,,
1416040609220120580,1415754172973174787,2021-07-16 11:22:44 -0300,2021-07-16,11:22:44,-300,37665648,deputadopeninha,Deputado Peninha,,@DouglasEsa Concordo.,pt,[],[],[],0,0,0,[],[],https://twitter.com/deputadopeninha/status/1416040609220120580,False,,0,,,,,,,,"[{'screen_name': 'DouglasEsa', 'name': 'Douglas Andrade', 'id': '480310546'}]",,,,
1415754172973174787,1415754172973174787,2021-07-15 16:24:32 -0300,2021-07-15,16:24:32,-300,37665648,deputadopeninha,Deputado Peninha,,"Não vamos colocar meta, vamos deixar a meta aberta, mas quando atingirmos a meta, vamos dobrar a meta.  https://t.co/4fxI5E6BzX",pt,[],['https://g1.globo.com/sp/sao-paulo/noticia/2021/07/15/brasil-dobra-o-numero-de-armas-nas-maos-de-civis-em-apenas-3-anos-aponta-anuario.ghtml?utm_source=twitter&utm_medium=social&utm_campaign=g1'],[],8,0,24,[],[],https://twitter.com/deputadopeninha/status/1415754172973174787,False,,0,,,,,,,,[],,,,
1415699922263937026,1415699922263937026,2021-07-15 12:48:58 -0300,2021-07-15,12:48:58,-300,37665648,deputadopeninha,Deputado Peninha,,"Além de ser paixão nacional, o futebol é fonte de emprego e renda no Brasil!  https://t.co/R0izdav0vr",pt,[],[],['https://pbs.twimg.com/media/E6WTks0XIAU0Mb-.jpg'],4,1,11,[],[],https://twitter.com/deputadopeninha/status/1415699922263937026,False,,1,https://pbs.twimg.com/media/E6WTks0XIAU0Mb-.jpg,,,,,,,[],,,,
1415680079774945291,1415680079774945291,2021-07-15 11:30:07 -0300,2021-07-15,11:30:07,-300,37665648,deputadopeninha,Deputado Peninha,,Importante darmos atenção a este assunto!  https://t.co/oNdLSbLz9K,pt,[],['https://www.blogdoprisco.com.br/peninha-quer-reduzir-casos-de-violencia-contra-mulher-em-santa-catarina/'],[],0,0,6,[],[],https://twitter.com/deputadopeninha/status/1415680079774945291,False,,0,,,,,,,,[],,,,
1415414480226377732,1415414475474231297,2021-07-14 17:54:43 -0300,2021-07-14,17:54:43,-300,37665648,deputadopeninha,Deputado Peninha,,Esteve comigo uma COMITIVA DE GASPAR que quer ampliar o programa de acolhimento das vítimas no município e contarão com apoio da ministra.  https://t.co/9w0wOruQS9,pt,[],[],['https://pbs.twimg.com/media/E6SP4pwWQAgOxKV.jpg'],0,1,9,[],[],https://twitter.com/deputadopeninha/status/1415414480226377732,False,,1,https://pbs.twimg.com/media/E6SP4pwWQAgOxKV.jpg,,,,,,,[],,,,
1415414475474231297,1415414475474231297,2021-07-14 17:54:42 -0300,2021-07-14,17:54:42,-300,37665648,deputadopeninha,Deputado Peninha,,"Preocupado com o aumento dos casos de VIOLÊNCIA CONTRA MULHER em todo o Brasil, estive hoje com a ministra @DamaresAlves. Falamos sobre programas m e ações federais que podem ser levadas as municípios catarinenses para amparar quem é vítima deste tipo de abuso.  https://t.co/uwqjkTHkQq",pt,"[{'screen_name': 'damaresalves', 'name': 'damares alves', 'id': '1083774484123975680'}]",[],['https://pbs.twimg.com/media/E6SPvaQXIAI5fA6.jpg'],1,1,13,[],[],https://twitter.com/deputadopeninha/status/1415414475474231297,False,,1,https://pbs.twimg.com/media/E6SPvaQXIAI5fA6.jpg,,,,,,,[],,,,
1415317618844647434,1415317618844647434,2021-07-14 11:29:50 -0300,2021-07-14,11:29:50,-300,37665648,deputadopeninha,Deputado Peninha,,Desejo melhoras ao presidente @jairbolsonaro. O Brasil precisa de você!,pt,"[{'screen_name': 'jairbolsonaro', 'name': 'jair m. bolsonaro', 'id': '128372940'}]",[],[],0,0,10,[],[],https://twitter.com/deputadopeninha/status/1415317618844647434,False,,0,,,,,,,,[],,,,
1415110348642848772,1415110348642848772,2021-07-13 21:46:13 -0300,2021-07-13,21:46:13,-300,37665648,deputadopeninha,Deputado Peninha,,"Hoje aprovamos o projeto para acabar com os SUPERSALÁRIOS no funcionalismo público (Executivo, Legislativo e Judiciário). A economia é estimada em até R$10 bilhões ao ano. Medida urgente e extremamente necessária em nosso Brasil.🇧🇷",pt,[],[],[],2,4,44,[],[],https://twitter.com/deputadopeninha/status/1415110348642848772,False,,0,,,,,,,,[],,,,
1415028189341028354,1415028187801821185,2021-07-13 16:19:44 -0300,2021-07-13,16:19:44,-300,37665648,deputadopeninha,Deputado Peninha,,"Agradeço ao relator, deputado @depdarcidematos, pelo parecer favorável. Será de grande importância para a cidade e região.",pt,"[{'screen_name': 'depdarcidematos', 'name': 'darci de matos', 'id': '80712669'}]",[],[],6,1,10,[],[],https://twitter.com/deputadopeninha/status/1415028189341028354,False,,0,,,,,,,,[],,,,
1415028187801821185,1415028187801821185,2021-07-13 16:19:44 -0300,2021-07-13,16:19:44,-300,37665648,deputadopeninha,Deputado Peninha,,"Foi aprovado agora a pouco, na Comissão de Cultura, o meu projeto que reconhece Gaspar, no Vale do Itajaí, como Capital Nacional da Moda Infantil.",pt,[],[],[],2,0,16,[],[],https://twitter.com/deputadopeninha/status/1415028187801821185,False,,0,,,,,,,,[],,,,
1414952089248321543,1414951807080615943,2021-07-13 11:17:21 -0300,2021-07-13,11:17:21,-300,37665648,deputadopeninha,Deputado Peninha,, https://t.co/cWxcPgzhLn,und,[],[],[],1,4,12,[],[],https://twitter.com/deputadopeninha/status/1414952089248321543,False,,1,https://pbs.twimg.com/ext_tw_video_thumb/1414951842619011089/pu/img/BXroif2Rf8SAxgBj.jpg,,,,,,,[],,,,
1414951807080615943,1414951807080615943,2021-07-13 11:16:13 -0300,2021-07-13,11:16:13,-300,37665648,deputadopeninha,Deputado Peninha,,Alguém lembra quem queria bloquear o WhatsApp na última eleição?  https://t.co/jGbfcq5hjm,pt,[],[],['https://pbs.twimg.com/media/E6LrKnCXIAo5o5k.jpg'],2,3,31,[],[],https://twitter.com/deputadopeninha/status/1414951807080615943,False,,1,https://pbs.twimg.com/media/E6LrKnCXIAo5o5k.jpg,,,,,,,[],,,,
1414928912262516750,1414928912262516750,2021-07-13 09:45:15 -0300,2021-07-13,09:45:15,-300,37665648,deputadopeninha,Deputado Peninha,,"Mas... ""a economia a gente vê depois"". Sempre defendi que SAÚDE e ECONOMIA deveriam ser tratadas com a mesma importância.  https://t.co/zWZK3ltchU",pt,[],['https://ndmais.com.br/economia-internacional/pandemia-empurra-mais-118-milhoes-de-pessoas-para-a-fome/'],[],1,0,5,[],[],https://twitter.com/deputadopeninha/status/1414928912262516750,False,,0,,,,,,,,[],,,,
1414666856380702724,1414666856380702724,2021-07-12 16:23:56 -0300,2021-07-12,16:23:56,-300,37665648,deputadopeninha,Deputado Peninha,,Força ao povo cubano que quer se ver livre desta tirania.,pt,[],[],[],1,1,20,[],[],https://twitter.com/deputadopeninha/status/1414666856380702724,False,https://twitter.com/bbcbrasil/status/1414645754526900224,0,,,,,,,,[],,,,
1414636988532199428,1414636988532199428,2021-07-12 14:25:15 -0300,2021-07-12,14:25:15,-300,37665648,deputadopeninha,Deputado Peninha,,Informações de que teremos novas portarias do Exército para aquisição de armas de fogo nos próximos dias! Aguardemos. @jairbolsonaro,pt,"[{'screen_name': 'jairbolsonaro', 'name': 'jair m. bolsonaro', 'id': '128372940'}]",[],[],1,2,26,[],[],https://twitter.com/deputadopeninha/status/1414636988532199428,False,,0,,,,,,,,[],,,,
1414588315328733185,1414588313432899586,2021-07-12 11:11:50 -0300,2021-07-12,11:11:50,-300,37665648,deputadopeninha,Deputado Peninha,,"Graças ao @govbr, notícias como esta têm se tornado frequentes🇧🇷",pt,"[{'screen_name': 'govbr', 'name': 'governo do brasil', 'id': '861707648584085504'}]",[],[],1,0,12,[],[],https://twitter.com/deputadopeninha/status/1414588315328733185,False,,0,,,,,,,,[],,,,
1414588313432899586,1414588313432899586,2021-07-12 11:11:50 -0300,2021-07-12,11:11:50,-300,37665648,deputadopeninha,Deputado Peninha,,"A maior apreensão de drogas da história do Brasil foi registrada neste final de semana, em Mato Grosso do Sul. A PRF interceptou um caminho com 36,5 toneladas de maconha.",pt,[],[],[],2,3,23,[],[],https://twitter.com/deputadopeninha/status/1414588313432899586,False,,0,,,,,,,,[],,,,
1414255875833925637,1414255875833925637,2021-07-11 13:10:51 -0300,2021-07-11,13:10:51,-300,37665648,deputadopeninha,Deputado Peninha,,Bom domingo!  https://t.co/9ZskZhz93q,pt,[],['https://www.sonoticiaboa.com.br/2021/07/11/brasil-bate-novo-recorde-vacinacao-24h-estados-previsao/'],[],0,0,8,[],[],https://twitter.com/deputadopeninha/status/1414255875833925637,False,,0,,,,,,,,[],,,,
1413914520817389571,1413914520817389571,2021-07-10 14:34:25 -0300,2021-07-10,14:34:25,-300,37665648,deputadopeninha,Deputado Peninha,,Na torcida pela Seleção Brasileira🇧🇷🇧🇷🇧🇷  https://t.co/8G7DHnTWOd,pt,[],[],['https://pbs.twimg.com/media/E587wHkXIAM2hz4.jpg'],3,1,24,[],[],https://twitter.com/deputadopeninha/status/1413914520817389571,False,,1,https://pbs.twimg.com/media/E587wHkXIAM2hz4.jpg,,,,,,,[],,,,
1413619971922464768,1413619971922464768,2021-07-09 19:03:59 -0300,2021-07-09,19:03:59,-300,37665648,deputadopeninha,Deputado Peninha,,"Manifestação pacífica e ordeira PRÓ-ARMAS em Brasília, hoje.  https://t.co/QhbpnLebzf",pt,[],[],[],1,7,55,[],[],https://twitter.com/deputadopeninha/status/1413619971922464768,False,,1,https://pbs.twimg.com/ext_tw_video_thumb/1413619361563217924/pu/img/RTeoopqmtFaAWRTm.jpg,,,,,,,[],,,,
1413489793238016002,1413489793238016002,2021-07-09 10:26:42 -0300,2021-07-09,10:26:42,-300,37665648,deputadopeninha,Deputado Peninha,,E assim nascem os “lázaros”.   https://t.co/6ZlvJ23c9o,pt,[],['https://www.google.com/amp/s/www.correiobraziliense.com.br/cidades-df/2021/07/amp/4936194-saidao-18-presos-nao-retornaram-para-a-papuda-e-sao-considerados-foragidos.html'],[],1,3,12,[],[],https://twitter.com/deputadopeninha/status/1413489793238016002,False,,0,,,,,,,,[],,,,
1413133574014865416,1413133574014865416,2021-07-08 10:51:13 -0300,2021-07-08,10:51:13,-300,37665648,deputadopeninha,Deputado Peninha,,É URGENTE resolver a situação da BR-470. @jairbolsonaro e @tarcisiogdf    https://t.co/tEmvLPPh3K,pt,"[{'screen_name': 'jairbolsonaro', 'name': 'jair m. bolsonaro', 'id': '128372940'}, {'screen_name': 'tarcisiogdf', 'name': 'tarcísio gomes de freitas', 'id': '1078618844007157761'}]",['https://www.demaisnews.fm.br/2021/07/08/alto-vale-prioridade-de-recursos-para-a-br-470/'],[],6,1,20,[],[],https://twitter.com/deputadopeninha/status/1413133574014865416,False,,0,,,,,,,,[],,,,
