id,conversation_id,created_at,date,time,timezone,user_id,username,name,place,tweet,language,mentions,urls,photos,replies_count,retweets_count,likes_count,hashtags,cashtags,link,retweet,quote_url,video,thumbnail,near,geo,source,user_rt_id,user_rt,retweet_id,reply_to,retweet_date,translate,trans_src,trans_dest
1380852241805025285,1380852241805025285,2021-04-10 08:56:44 -0300,2021-04-10,08:56:44,-300,37665648,deputadopeninha,Deputado Peninha,,"Se for para, de fato, apurar as ações e os gastos de dinheiro público com a pandemia, que seja feito com todos os entes federados. CPI da Covid para investigar o presidente Bolsonaro não tem outro fim que não seja político.",pt,[],[],[],5,9,51,[],[],https://twitter.com/deputadopeninha/status/1380852241805025285,False,,0,,,,,,,,[],,,,
1380614714548490245,1380614714548490245,2021-04-09 17:12:53 -0300,2021-04-09,17:12:53,-300,37665648,deputadopeninha,Deputado Peninha,,A história adora uma repetição...  https://t.co/UgkW838klP,pt,[],[],['https://pbs.twimg.com/media/Eyjtw5tXIAURNVa.jpg'],1,1,9,[],[],https://twitter.com/deputadopeninha/status/1380614714548490245,False,,1,https://pbs.twimg.com/media/Eyjtw5tXIAURNVa.jpg,,,,,,,[],,,,
1380521350725570561,1380521350725570561,2021-04-09 11:01:53 -0300,2021-04-09,11:01:53,-300,37665648,deputadopeninha,Deputado Peninha,,Segue o jogo! 😂😂😂  https://t.co/Q457tSsvIc,pt,[],[],[],2,2,23,[],[],https://twitter.com/deputadopeninha/status/1380521350725570561,False,,1,https://pbs.twimg.com/ext_tw_video_thumb/1380521321206013955/pu/img/o_IwJ1OhXyRQwUkC.jpg,,,,,,,[],,,,
1380145574599663619,1380145574599663619,2021-04-08 10:08:41 -0300,2021-04-08,10:08:41,-300,37665648,deputadopeninha,Deputado Peninha,,⚠️⚠️⚠️  https://t.co/PuJ1j9U6BE,und,[],[],['https://pbs.twimg.com/media/EydDFUdXIAI4Cfb.jpg'],1,4,24,[],[],https://twitter.com/deputadopeninha/status/1380145574599663619,False,,1,https://pbs.twimg.com/media/EydDFUdXIAI4Cfb.jpg,,,,,,,[],,,,
1379923268266831876,1379923268266831876,2021-04-07 19:25:19 -0300,2021-04-07,19:25:19,-300,37665648,deputadopeninha,Deputado Peninha,,"No Dia do Jornalista, expresso minha admiração e respeito a todos os profissionais que informam a população brasileira de maneira isenta e responsável. Um jornalismo sério e transparente é fundamental para o desenvolvimento de uma nação.",pt,[],[],[],2,0,15,[],[],https://twitter.com/deputadopeninha/status/1379923268266831876,False,,0,,,,,,,,[],,,,
1379862291584327681,1379862291584327681,2021-04-07 15:23:01 -0300,2021-04-07,15:23:01,-300,37665648,deputadopeninha,Deputado Peninha,,STF está decidindo sobre a liberação de cultos e missas presenciais. Qual sua opinião?,pt,[],[],[],1,1,13,[],[],https://twitter.com/deputadopeninha/status/1379862291584327681,False,,0,,,,,,,,[],,,,
1379802119411228672,1379802119411228672,2021-04-07 11:23:55 -0300,2021-04-07,11:23:55,-300,37665648,deputadopeninha,Deputado Peninha,,BOLÃO DA SEMANA: Quantos NÃO retornaram?  https://t.co/RqLRvIHYuo,pt,[],['https://revistaoeste.com/brasil/justica-do-maranhao-concedeu-saida-de-pascoa-para-628-presos/'],[],2,0,11,[],[],https://twitter.com/deputadopeninha/status/1379802119411228672,False,,0,,,,,,,,[],,,,
1379792872262791175,1379792872262791175,2021-04-07 10:47:10 -0300,2021-04-07,10:47:10,-300,37665648,deputadopeninha,Deputado Peninha,,"De olho no leilão de aeroportos, dentre eles Navegantes e Joinville...  https://t.co/Ku1kNyo1EK",pt,[],[],['https://pbs.twimg.com/media/EyYCTVEXEAAr9Kj.jpg'],5,1,31,[],[],https://twitter.com/deputadopeninha/status/1379792872262791175,False,,1,https://pbs.twimg.com/media/EyYCTVEXEAAr9Kj.jpg,,,,,,,[],,,,
1379589923783720961,1379589923783720961,2021-04-06 21:20:44 -0300,2021-04-06,21:20:44,-300,37665648,deputadopeninha,Deputado Peninha,,✅Aprovamos o texto-base para que as empresas da iniciativa privada possam adquirir vacinas para imunizar GRATUITAMENTE seus funcionários!,pt,[],[],[],0,1,36,[],[],https://twitter.com/deputadopeninha/status/1379589923783720961,False,,0,,,,,,,,[],,,,
1379506759337975812,1379506759337975812,2021-04-06 15:50:16 -0300,2021-04-06,15:50:16,-300,37665648,deputadopeninha,Deputado Peninha,,"Está na pauta de hoje, para análise dos destaques, o projeto que inclui os CAMINHONEIROS no grupo prioritário de vacinação da Covid-19. O texto-base já foi aprovado. Também é uma vontade do Governo Federal que estes profissionais que rodam o Brasil sejam vacinados o quanto antes.",pt,[],[],[],0,0,22,[],[],https://twitter.com/deputadopeninha/status/1379506759337975812,False,,0,,,,,,,,[],,,,
1379506186421166082,1379497739831156740,2021-04-06 15:47:59 -0300,2021-04-06,15:47:59,-300,37665648,deputadopeninha,Deputado Peninha,,@htsnet  https://t.co/JyTQ9dE89i,und,[],[],['https://pbs.twimg.com/media/EyT9kE4WUAUOVZP.jpg'],1,0,0,[],[],https://twitter.com/deputadopeninha/status/1379506186421166082,False,,1,https://pbs.twimg.com/media/EyT9kE4WUAUOVZP.jpg,,,,,,,[],,,,
1379500730709639173,1379419418183221253,2021-04-06 15:26:18 -0300,2021-04-06,15:26:18,-300,37665648,deputadopeninha,Deputado Peninha,,@risso_julio  https://t.co/tNbg59bXOs,und,[],[],['https://pbs.twimg.com/media/EyT4mflXAAAZ1F5.jpg'],1,0,0,[],[],https://twitter.com/deputadopeninha/status/1379500730709639173,False,,1,https://pbs.twimg.com/media/EyT4mflXAAAZ1F5.jpg,,,,,,,[],,,,
1379419418183221253,1379419418183221253,2021-04-06 10:03:12 -0300,2021-04-06,10:03:12,-300,37665648,deputadopeninha,Deputado Peninha,,Ciro Gomes sugeriu que Lula deveria ser seu vice nas eleições do ano que vem. Aí sim: Brasil rumo à venezualização!,pt,[],[],[],7,2,49,[],[],https://twitter.com/deputadopeninha/status/1379419418183221253,False,,0,,,,,,,,[],,,,
1379142520886677509,1379142520886677509,2021-04-05 15:42:54 -0300,2021-04-05,15:42:54,-300,37665648,deputadopeninha,Deputado Peninha,,Vamos ajudar o Miguel? Link da vaquinha  https://t.co/JUDdLYGJuF  https://t.co/Oehoc1kFNn,pt,[],['http://encurtador.com.br/fDJMP'],['https://pbs.twimg.com/media/EyOyz94W8AEhh0k.jpg'],1,1,8,[],[],https://twitter.com/deputadopeninha/status/1379142520886677509,False,,1,https://pbs.twimg.com/media/EyOyz94W8AEhh0k.jpg,,,,,,,[],,,,
1379077804726353920,1379077804726353920,2021-04-05 11:25:45 -0300,2021-04-05,11:25:45,-300,37665648,deputadopeninha,Deputado Peninha,,"O Ministério da Saúde já enviou 43 milhões de doses da vacina contra Covid-19 aos estados e municípios brasileiros. No entanto, só 20 milhões foram aplicadas até agora. Agilidade na vacinação é fundamental para a retomada.",pt,[],[],[],1,2,27,[],[],https://twitter.com/deputadopeninha/status/1379077804726353920,False,,0,,,,,,,,[],,,,
1379038686411644932,1379038686411644932,2021-04-05 08:50:18 -0300,2021-04-05,08:50:18,-300,37665648,deputadopeninha,Deputado Peninha,,Sobre o aumento do reembolso de saúde aos deputados ⬇️  https://t.co/wGCgTskDtN,pt,[],[],['https://pbs.twimg.com/media/EyNUX7BW8AAxOID.jpg'],2,1,23,[],[],https://twitter.com/deputadopeninha/status/1379038686411644932,False,,1,https://pbs.twimg.com/media/EyNUX7BW8AAxOID.jpg,,,,,,,[],,,,
1378684319342997507,1378684319342997507,2021-04-04 09:22:11 -0300,2021-04-04,09:22:11,-300,37665648,deputadopeninha,Deputado Peninha,,Que a nossa fé seja renovada! Feliz Páscoa a todas as famílias brasileiras🇧🇷  https://t.co/iYAEHOSojt,pt,[],[],['https://pbs.twimg.com/media/EyISE_KWUAIVJsw.jpg'],1,1,20,[],[],https://twitter.com/deputadopeninha/status/1378684319342997507,False,,1,https://pbs.twimg.com/media/EyISE_KWUAIVJsw.jpg,,,,,,,[],,,,
1378317513772126209,1378317513772126209,2021-04-03 09:04:37 -0300,2021-04-03,09:04:37,-300,37665648,deputadopeninha,Deputado Peninha,,"COMBATE AO TRÁFICO: Operação Semana Santa apreende uma tonelada de maconha em Mafra, Santa Catarina - a maior da história da PRF local. Avante, Brasil!  https://t.co/o7ZTTWe9Z3",pt,[],[],[],2,3,17,[],[],https://twitter.com/deputadopeninha/status/1378317513772126209,False,,1,https://pbs.twimg.com/ext_tw_video_thumb/1378317490418241542/pu/img/fgP9iic6adC5ICSR.jpg,,,,,,,[],,,,
1377941050329858055,1377941050329858055,2021-04-02 08:08:41 -0300,2021-04-02,08:08:41,-300,37665648,deputadopeninha,Deputado Peninha,,Que seja um dia de reflexão para todos nós! 🙏🏻  https://t.co/lMqcm58336,pt,[],[],['https://pbs.twimg.com/media/Ex9uE2iXEAArjkr.jpg'],0,0,15,[],[],https://twitter.com/deputadopeninha/status/1377941050329858055,False,,1,https://pbs.twimg.com/media/Ex9uE2iXEAArjkr.jpg,,,,,,,[],,,,
1377710914217123845,1377710914217123845,2021-04-01 16:54:13 -0300,2021-04-01,16:54:13,-300,37665648,deputadopeninha,Deputado Peninha,,Legítima defesa é um DIREITO do cidadão. Parabéns👏🏼👏🏼👏🏼   https://t.co/1MVK1Jk157,pt,[],['http://www.diariocostaesmeralda.com.br/index.php?pg=noticia&id=9204&fbclid=IwAR1bViNl8-9rIhC3JPoKn63UXlFcoO6o21rwbxei93lbL5AVlZ2g6LiuGyY'],[],0,3,25,[],[],https://twitter.com/deputadopeninha/status/1377710914217123845,False,,0,,,,,,,,[],,,,
1377636443405877249,1377636443405877249,2021-04-01 11:58:18 -0300,2021-04-01,11:58:18,-300,37665648,deputadopeninha,Deputado Peninha,,Marque alguém pra cair na pegadinha!  https://t.co/RErMZFuXfM,pt,[],[],['https://pbs.twimg.com/media/Ex5ZCvJWgAM9sA0.jpg'],2,5,48,[],[],https://twitter.com/deputadopeninha/status/1377636443405877249,False,,1,https://pbs.twimg.com/media/Ex5ZCvJWgAM9sA0.jpg,,,,,,,[],,,,
1377590098892632065,1377590098892632065,2021-04-01 08:54:08 -0300,2021-04-01,08:54:08,-300,37665648,deputadopeninha,Deputado Peninha,,Agilidade na vacinação é fundamental neste momento!   https://t.co/HhoW6UnOKB,pt,[],['https://www.google.com/amp/s/www.nsctotal.com.br/noticias/sc-recebe-mais-de-300-mil-doses-da-vacina-contra-covid-19-nesta-quinta%3Famp%3D1'],[],2,0,15,[],[],https://twitter.com/deputadopeninha/status/1377590098892632065,False,,0,,,,,,,,[],,,,
1377360546446540800,1377360546446540800,2021-03-31 17:41:59 -0300,2021-03-31,17:41:59,-300,37665648,deputadopeninha,Deputado Peninha,,O AGRO está em todos os lugares!  https://t.co/7nyHZRvqjb,pt,[],[],['https://pbs.twimg.com/media/Ex1eHVeXAAE9ht5.jpg'],0,1,14,[],[],https://twitter.com/deputadopeninha/status/1377360546446540800,False,,1,https://pbs.twimg.com/media/Ex1eHVeXAAE9ht5.jpg,,,,,,,[],,,,
1377281755128999939,1377281755128999939,2021-03-31 12:28:53 -0300,2021-03-31,12:28:53,-300,37665648,deputadopeninha,Deputado Peninha,,Grande notícia👍🏻   https://t.co/80CHHR6e61,pt,[],['https://g1.globo.com/politica/noticia/2021/03/30/bolsonaro-assina-mp-com-r-53-bilhoes-para-acoes-contra-covid-informa-planalto.ghtml'],[],0,2,14,[],[],https://twitter.com/deputadopeninha/status/1377281755128999939,False,,0,,,,,,,,[],,,,
1377251047635312644,1377251047635312644,2021-03-31 10:26:52 -0300,2021-03-31,10:26:52,-300,37665648,deputadopeninha,Deputado Peninha,,Já havíamos aprovado na Câmara dos Deputados e ontem foram os senadores que deram o ok para o Programa Emergencial de Retomada do Setor de Eventos (Perse)👍,pt,[],[],[],0,0,29,[],[],https://twitter.com/deputadopeninha/status/1377251047635312644,False,,0,,,,,,,,[],,,,
1377020253230804993,1377020253230804993,2021-03-30 19:09:46 -0300,2021-03-30,19:09:46,-300,37665648,deputadopeninha,Deputado Peninha,,"Eu sempre admirei a trajetória e conduta da colega, deputada @carmenzanotto. Tenho certeza que fará um ótimo trabalho frente à Secretaria de Saúde do Estado de SC, principalmente neste momento em que as atenções estão todas voltadas no combate à pandemia.  https://t.co/B5VXkR0zfT",pt,"[{'screen_name': 'carmenzanotto', 'name': 'carmen zanotto 2323', 'id': '109366586'}]",[],['https://pbs.twimg.com/media/ExwontGXEAYgZcK.jpg'],1,1,26,[],[],https://twitter.com/deputadopeninha/status/1377020253230804993,False,,1,https://pbs.twimg.com/media/ExwontGXEAYgZcK.jpg,,,,,,,[],,,,
1376915932979859461,1376915932979859461,2021-03-30 12:15:14 -0300,2021-03-30,12:15:14,-300,37665648,deputadopeninha,Deputado Peninha,,Foi tentar assaltar a “tia” e acabou cheirando o chão.  https://t.co/NBPHX9spCS,pt,[],[],[],0,1,37,[],[],https://twitter.com/deputadopeninha/status/1376915932979859461,False,,1,https://pbs.twimg.com/ext_tw_video_thumb/1376915906606022657/pu/img/vCzBow8hc4bPwxxG.jpg,,,,,,,[],,,,
1376638446886907910,1376638446886907910,2021-03-29 17:52:37 -0300,2021-03-29,17:52:37,-300,37665648,deputadopeninha,Deputado Peninha,,- Reunião com o PR @jairbolsonaro para tratar de VACINAS aos catarinenses e DUPLICAÇÃO DA 470.  -Deus abençoe o nosso Brasil.🙏🏻  https://t.co/ZoGBAfy6A7,pt,"[{'screen_name': 'jairbolsonaro', 'name': 'jair m. bolsonaro', 'id': '128372940'}]",[],['https://pbs.twimg.com/media/ExrNXoRXAAQBWeF.jpg'],2,3,70,[],[],https://twitter.com/deputadopeninha/status/1376638446886907910,False,,1,https://pbs.twimg.com/media/ExrNXoRXAAQBWeF.jpg,,,,,,,[],,,,
1376587087630192647,1376587087630192647,2021-03-29 14:28:32 -0300,2021-03-29,14:28:32,-300,37665648,deputadopeninha,Deputado Peninha,,Conversa com a imprensa nacional antes da reunião com o Presidente @jairbolsonaro e a bancada catarinense.  https://t.co/BPE2xGO4fz,pt,"[{'screen_name': 'jairbolsonaro', 'name': 'jair m. bolsonaro', 'id': '128372940'}]",[],['https://pbs.twimg.com/media/Exqepu2XEAMXWsp.jpg'],2,2,28,[],[],https://twitter.com/deputadopeninha/status/1376587087630192647,False,,1,https://pbs.twimg.com/media/Exqepu2XEAMXWsp.jpg,,,,,,,[],,,,
1376527719626866691,1376527719626866691,2021-03-29 10:32:37 -0300,2021-03-29,10:32:37,-300,37665648,deputadopeninha,Deputado Peninha,,"A Fiocruz recebeu, neste final de semana, insumos suficientes para produzir 12 milhões de doses da vacina Oxford/AstraZeneca. Uma boa notícia para iniciar a semana com fé e esperança. Boa segunda-feira.",pt,[],[],[],0,1,33,[],[],https://twitter.com/deputadopeninha/status/1376527719626866691,False,,0,,,,,,,,[],,,,
1375894693364523010,1375894693364523010,2021-03-27 16:37:12 -0300,2021-03-27,16:37:12,-300,37665648,deputadopeninha,Deputado Peninha,,"Parece brincadeira, mas não é.  https://t.co/JUE4gNyuDx",pt,[],['https://noticias.r7.com/cidades/1-habilitado-sem-bracos-no-am-e-preso-por-tentativa-de-assalto-27032021?fbclid=IwAR2WL6LrJK97bqwz8Sz8kpe6fzRuPv9rGE9-l6rN7Os1CtgYkfyoyIetFaw'],[],3,1,15,[],[],https://twitter.com/deputadopeninha/status/1375894693364523010,False,,0,,,,,,,,[],,,,
1375470480220635137,1375470480220635137,2021-03-26 12:31:32 -0300,2021-03-26,12:31:32,-300,37665648,deputadopeninha,Deputado Peninha,,Boa análise.  https://t.co/V6tasDCJLM,pt,[],[],[],19,5,22,[],[],https://twitter.com/deputadopeninha/status/1375470480220635137,False,,1,https://pbs.twimg.com/ext_tw_video_thumb/1375470404492533763/pu/img/bOyUt36-fy6SSg1G.jpg,,,,,,,[],,,,
1375452804790255622,1375452804790255622,2021-03-26 11:21:17 -0300,2021-03-26,11:21:17,-300,37665648,deputadopeninha,Deputado Peninha,,"Iniciamos a sexta-feira com a notícia de que está em desenvolvimento uma vacina 100% brasileira. Agora vem a fase de testes 1 e 2, com 1.800 pessoas. Torço pelo sucesso e aprovação para podermos vacinar cada vez mais brasileiros.",pt,[],[],[],2,2,24,[],[],https://twitter.com/deputadopeninha/status/1375452804790255622,False,,0,,,,,,,,[],,,,
1375100555425615873,1375100555425615873,2021-03-25 12:01:35 -0300,2021-03-25,12:01:35,-300,37665648,deputadopeninha,Deputado Peninha,,"Se você concorda com CONCURSO PÚBLICO para MINISTROS DO STF, me ajude a compartilhar esta ideia para o Brasil!  https://t.co/uS00QwEM14",pt,[],[],[],9,20,56,[],[],https://twitter.com/deputadopeninha/status/1375100555425615873,False,,1,https://pbs.twimg.com/ext_tw_video_thumb/1375100450949763072/pu/img/sabS_Tm9tewJWQFp.jpg,,,,,,,[],,,,
1374780818648891394,1374780818648891394,2021-03-24 14:51:04 -0300,2021-03-24,14:51:04,-300,37665648,deputadopeninha,Deputado Peninha,,"O Ministério da Saúde já começou a entrega de 2,8 milhões de medicamentos para o kit intubação, utilizado no tratamento dos pacientes de Covid-19. Boa notícia no combate à pandemia!",pt,[],[],[],1,0,19,[],[],https://twitter.com/deputadopeninha/status/1374780818648891394,False,,0,,,,,,,,[],,,,
1374745493742452741,1374745493742452741,2021-03-24 12:30:41 -0300,2021-03-24,12:30:41,-300,37665648,deputadopeninha,Deputado Peninha,,"O que nós precisamos, agora, é ver o preço baixando nas bombas de combustível.   https://t.co/4NfUIxFqDP",pt,[],['https://g1.globo.com/economia/noticia/2021/03/24/petrobras-anuncia-reducao-nos-precos-da-gasolina-e-do-diesel.ghtml?utm_source=push&utm_medium=app&utm_campaign=pushg1'],[],1,1,13,[],[],https://twitter.com/deputadopeninha/status/1374745493742452741,False,,0,,,,,,,,[],,,,
1374723761220550663,1374723761220550663,2021-03-24 11:04:20 -0300,2021-03-24,11:04:20,-300,37665648,deputadopeninha,Deputado Peninha,,"Aprovamos ontem o projeto que amplia a quantidade de doenças rastreadas pelo TESTE DO PEZINHO de 6 para 14. Quanto mais cedo as enfermidades forem detectadas, melhor será a qualidade de vida das crianças e das famílias.",pt,[],[],[],1,0,14,[],[],https://twitter.com/deputadopeninha/status/1374723761220550663,False,,0,,,,,,,,[],,,,
1374489714376372238,1374489714376372238,2021-03-23 19:34:19 -0300,2021-03-23,19:34:19,-300,37665648,deputadopeninha,Deputado Peninha,,Lula: solto. Deputado Daniel Silveira: preso. Comentários com vocês.,pt,[],[],[],8,2,46,[],[],https://twitter.com/deputadopeninha/status/1374489714376372238,False,,0,,,,,,,,[],,,,
1374445231299383308,1374445231299383308,2021-03-23 16:37:33 -0300,2021-03-23,16:37:33,-300,37665648,deputadopeninha,Deputado Peninha,,Placar está em 3X2 para que a condenação de Lula não seja anulada.   https://t.co/YPIjAqaJHf,pt,[],['https://g1.globo.com/politica/noticia/2021/03/23/nunes-marques-vota-contra-acao-de-lula-que-pedia-suspeicao-de-moro-e-anulacao-de-condenacao.ghtml'],[],2,2,19,[],[],https://twitter.com/deputadopeninha/status/1374445231299383308,False,,0,,,,,,,,[],,,,
1374409400283062280,1374409400283062280,2021-03-23 14:15:10 -0300,2021-03-23,14:15:10,-300,37665648,deputadopeninha,Deputado Peninha,,"Parabéns Florianópolis, hoje completando 348 anos. Capital do meu querido e próspero Estado de Santa Catarina, terra de gente trabalhadora e abrigo de belezas naturais que encantam o mundo todo! Que Deus nos abençoe, sempre🙏🏼",pt,[],[],[],2,0,13,[],[],https://twitter.com/deputadopeninha/status/1374409400283062280,False,,0,,,,,,,,[],,,,
1374374108851408902,1374362716094218244,2021-03-23 11:54:56 -0300,2021-03-23,11:54:56,-300,37665648,deputadopeninha,Deputado Peninha,,"@capitaoderrite É cada uma🤦‍♂️ Conte comigo para aprovar seu projeto, deputado.",pt,[],[],[],1,1,8,[],[],https://twitter.com/deputadopeninha/status/1374374108851408902,False,,0,,,,,,,,"[{'screen_name': 'capitaoderrite', 'name': 'Capitão Derrite', 'id': '1081517956964802561'}]",,,,
1374181248097259523,1374181248097259523,2021-03-22 23:08:35 -0300,2021-03-22,23:08:35,-300,37665648,deputadopeninha,Deputado Peninha,,Foi mexer com fogo e acabou queimado🔥   https://t.co/00gkbHjKvo,pt,[],['https://www.metropoles.com/distrito-federal/policial-civil-reage-a-roubo-e-mata-assaltante-no-distrito-federal'],[],18,5,29,[],[],https://twitter.com/deputadopeninha/status/1374181248097259523,False,,0,,,,,,,,[],,,,
1373992399060545537,1373992399060545537,2021-03-22 10:38:10 -0300,2021-03-22,10:38:10,-300,37665648,deputadopeninha,Deputado Peninha,,"Enfim, uma decisão sensata.   https://t.co/lKALbKmzQQ",pt,[],['https://revistaoeste.com/mundo/justica-de-provincia-argentina-torna-o-aborto-inconstitucional/'],[],1,4,34,[],[],https://twitter.com/deputadopeninha/status/1373992399060545537,False,,0,,,,,,,,[],,,,
1373650598940250121,1373620293877518338,2021-03-21 11:59:58 -0300,2021-03-21,11:59:58,-300,37665648,deputadopeninha,Deputado Peninha,,*passos,pt,[],[],[],0,0,4,[],[],https://twitter.com/deputadopeninha/status/1373650598940250121,False,,0,,,,,,,,[],,,,
1373620293877518338,1373620293877518338,2021-03-21 09:59:33 -0300,2021-03-21,09:59:33,-300,37665648,deputadopeninha,Deputado Peninha,,"Hoje é o aniversário do nosso presidente, @jairbolsonaro. Um homem de coragem, que devolveu esperança aos brasileiros.  Deus sempre guie seus psssos para comandar  nosso Brasil amado! 🇧🇷  https://t.co/PHRDjKDyav",pt,"[{'screen_name': 'jairbolsonaro', 'name': 'jair m. bolsonaro', 'id': '128372940'}]",[],['https://pbs.twimg.com/media/ExAUX71WgAALLpc.jpg'],23,13,249,[],[],https://twitter.com/deputadopeninha/status/1373620293877518338,False,,1,https://pbs.twimg.com/media/ExAUX71WgAALLpc.jpg,,,,,,,[],,,,
1373300782284554243,1373300780996816897,2021-03-20 12:49:55 -0300,2021-03-20,12:49:55,-300,37665648,deputadopeninha,Deputado Peninha,,Portaria do Ministério da Saúde:  https://t.co/08zde7nwsE,pt,[],['https://bit.ly/3tztS8s'],[],1,1,5,[],[],https://twitter.com/deputadopeninha/status/1373300782284554243,False,,0,,,,,,,,[],,,,
1373300780996816897,1373300780996816897,2021-03-20 12:49:55 -0300,2021-03-20,12:49:55,-300,37665648,deputadopeninha,Deputado Peninha,,ÓTIMA NOTÍCIA: 104 novos leitos de UTI para Santa Catarina foram anunciados hoje pelo Governo Federal!,pt,[],[],[],5,3,22,[],[],https://twitter.com/deputadopeninha/status/1373300780996816897,False,,0,,,,,,,,[],,,,
1373283516411228162,1373236636272705536,2021-03-20 11:41:19 -0300,2021-03-20,11:41:19,-300,37665648,deputadopeninha,Deputado Peninha,,"@jairbolsonaro @minsaude Presidente, Santa Catarina agradece os 104 leitos. Estamos precisando muito!",pt,[],[],[],1,2,37,[],[],https://twitter.com/deputadopeninha/status/1373283516411228162,False,,0,,,,,,,,"[{'screen_name': 'jairbolsonaro', 'name': 'Jair M. Bolsonaro', 'id': '128372940'}, {'screen_name': 'minsaude', 'name': 'Ministério da Saúde', 'id': '37717107'}]",,,,
1372983896145543171,1372983896145543171,2021-03-19 15:50:44 -0300,2021-03-19,15:50:44,-300,37665648,deputadopeninha,Deputado Peninha,,MAIS VACINAS: Governo Federal assinou contrato com a Pfizer e com a Janssen para entrega de mais 138 milhões de doses aos brasileiros!🇧🇷,pt,[],[],[],4,0,30,[],[],https://twitter.com/deputadopeninha/status/1372983896145543171,False,,0,,,,,,,,[],,,,
1372959489519988741,1372959489519988741,2021-03-19 14:13:45 -0300,2021-03-19,14:13:45,-300,37665648,deputadopeninha,Deputado Peninha,,COVARDES! Espero que levem um processo e paguem cada palavra de desrespeito.  https://t.co/xFoKNWOtim,pt,[],[],[],3,3,31,[],[],https://twitter.com/deputadopeninha/status/1372959489519988741,False,,1,https://pbs.twimg.com/ext_tw_video_thumb/1372959298754650112/pu/img/bWCnSBRX2ejGiuGa.jpg,,,,,,,[],,,,
1372633165257392133,1372627546265825284,2021-03-18 16:37:03 -0300,2021-03-18,16:37:03,-300,37665648,deputadopeninha,Deputado Peninha,,"@majorolimpio Vá com Deus, meu amigo.😢",pt,[],[],[],0,0,7,[],[],https://twitter.com/deputadopeninha/status/1372633165257392133,False,,0,,,,,,,,"[{'screen_name': 'majorolimpio', 'name': 'Major Olimpio', 'id': '94451423'}]",,,,
1372632987582541830,1372632987582541830,2021-03-18 16:36:21 -0300,2021-03-18,16:36:21,-300,37665648,deputadopeninha,Deputado Peninha,,"Muita tristeza com a confirmação do falecimento do amigo senador @majorolimpio. Foi deputado federal comigo e também o levei para Santa Catarina, junto com o presidente Bolsonaro.  Que Deus conforte familiares e amigos.🙏🏼",pt,"[{'screen_name': 'majorolimpio', 'name': 'major olimpio', 'id': '94451423'}]",[],[],2,0,39,[],[],https://twitter.com/deputadopeninha/status/1372632987582541830,False,,0,,,,,,,,[],,,,
1372557337362374675,1372557336158552065,2021-03-18 11:35:44 -0300,2021-03-18,11:35:44,-300,37665648,deputadopeninha,Deputado Peninha,,"Quanto mais rápido os profissionais da educação forem vacinados, mais cedo as aulas retornam à normalidade.",pt,[],[],[],0,1,12,[],[],https://twitter.com/deputadopeninha/status/1372557337362374675,False,,0,,,,,,,,[],,,,
1372557336158552065,1372557336158552065,2021-03-18 11:35:44 -0300,2021-03-18,11:35:44,-300,37665648,deputadopeninha,Deputado Peninha,,"BOA NOTÍCIA: Os professores devem receber a vacina contra Covid-19 a partir de abril, conforme pedido do ministro da Educação @mribeiroMEC.",pt,"[{'screen_name': 'mribeiromec', 'name': 'milton ribeiro', 'id': '1130460100123156480'}]",[],[],2,2,30,[],[],https://twitter.com/deputadopeninha/status/1372557336158552065,False,,0,,,,,,,,[],,,,
1372279314956304387,1372279314956304387,2021-03-17 17:10:59 -0300,2021-03-17,17:10:59,-300,37665648,deputadopeninha,Deputado Peninha,,Direito à defesa SIM.  https://t.co/A9iWC40Fg2,pt,[],[],['https://pbs.twimg.com/media/EwtQwyAXAAAcsEH.jpg'],2,3,18,[],[],https://twitter.com/deputadopeninha/status/1372279314956304387,False,,1,https://pbs.twimg.com/media/EwtQwyAXAAAcsEH.jpg,,,,,,,[],,,,
1372245000734572555,1372245000734572555,2021-03-17 14:54:37 -0300,2021-03-17,14:54:37,-300,37665648,deputadopeninha,Deputado Peninha,,"Aprovamos ontem o projeto do novo marco regulatório do gás que vai gerar milhões de empregos e baixar o preço ao consumidor. O PL foi ao Senado e voltou para a Câmara, onde aprovamos o texto original. Agora, segue para sanção do PR @jairbolsonaro.",pt,"[{'screen_name': 'jairbolsonaro', 'name': 'jair m. bolsonaro', 'id': '128372940'}]",[],[],0,3,31,[],[],https://twitter.com/deputadopeninha/status/1372245000734572555,False,,0,,,,,,,,[],,,,
1372242275271634946,1372242275271634946,2021-03-17 14:43:48 -0300,2021-03-17,14:43:48,-300,37665648,deputadopeninha,Deputado Peninha,,🙏🏻🙏🏻🙏🏻  https://t.co/Ytealr6IT0,und,[],['https://oatlantico.com.br/santa-catarina-recebeu-nesta-quarta-a-maior-remessa-de-vacinas/'],[],2,1,14,[],[],https://twitter.com/deputadopeninha/status/1372242275271634946,False,,0,,,,,,,,[],,,,
