id,conversation_id,created_at,date,time,timezone,user_id,username,name,place,tweet,language,mentions,urls,photos,replies_count,retweets_count,likes_count,hashtags,cashtags,link,retweet,quote_url,video,thumbnail,near,geo,source,user_rt_id,user_rt,retweet_id,reply_to,retweet_date,translate,trans_src,trans_dest
1506398321757274121,1506398319194607621,2022-03-22 19:32:02 -0300,2022-03-22,19:32:02,-300,70542353,enricomisasi,Enrico Misasi,,Você pode acompanhar por aqui:  https://t.co/LqW48L552U  Que tal participar da live deixando alguma sugestão de pergunta?,pt,[],['https://youtu.be/F5vatbVdbsk'],[],0,0,0,[],[],https://twitter.com/enricomisasi/status/1506398321757274121,False,,0,,,,,,,,[],,,,
1506398319194607621,1506398319194607621,2022-03-22 19:32:01 -0300,2022-03-22,19:32:01,-300,70542353,enricomisasi,Enrico Misasi,,"Amanhã, às 18h, vou bater um papo com o amigo e jornalista Carlos Di Franco sobre a política nacional e economia. Vou falar ainda sobre o Marco do Saneamento, Bicentenário da Independência e o projeto do semipresidencialismo que começa a ser discutido na Câmara.  https://t.co/cRxnB1bFgb",pt,[],[],['https://pbs.twimg.com/media/FOfNFHuXEAc19Qf.jpg'],1,1,1,[],[],https://twitter.com/enricomisasi/status/1506398319194607621,False,,1,https://pbs.twimg.com/media/FOfNFHuXEAc19Qf.jpg,,,,,,,[],,,,
1469360157960384516,1469360147919159319,2021-12-10 14:35:35 -0300,2021-12-10,14:35:35,-300,70542353,enricomisasi,Enrico Misasi,,"Claro, o debate nesse sentido tem que ser voltado para 2026, de forma a não ser contaminado por interesses eleitorais.  https://t.co/nOQX2RJJaT",pt,[],[],['https://pbs.twimg.com/media/FGQ3RiVWYAAv1Xx.jpg'],2,0,3,[],[],https://twitter.com/enricomisasi/status/1469360157960384516,False,,1,https://pbs.twimg.com/media/FGQ3RiVWYAAv1Xx.jpg,,,,,,,[],,,,
1469360150272221185,1469360147919159319,2021-12-10 14:35:33 -0300,2021-12-10,14:35:33,-300,70542353,enricomisasi,Enrico Misasi,,"Uma solução seria o semipresidencialismo, que promove a separação entre a chefia de Estado e a chefia de governo, ou seja, distribui melhor o poder institucionalmente. Além disso, faz com que o governo seja fruto de uma base parlamentar, responsável politicamente perante esta.",pt,[],[],[],2,0,3,[],[],https://twitter.com/enricomisasi/status/1469360150272221185,False,,0,,,,,,,,[],,,,
1469360147919159319,1469360147919159319,2021-12-10 14:35:33 -0300,2021-12-10,14:35:33,-300,70542353,enricomisasi,Enrico Misasi,,"Quando analisamos o que está por trás da crise institucional que enfrentamos há décadas, não podemos menosprezar os efeitos do sistema de governo que adotamos, isto é, do presidencialismo em que insistimos desde 1891.",pt,[],[],[],19,0,4,[],[],https://twitter.com/enricomisasi/status/1469360147919159319,False,,0,,,,,,,,[],,,,
1443681641470246914,1443681641470246914,2021-09-30 17:58:20 -0300,2021-09-30,17:58:20,-300,70542353,enricomisasi,Enrico Misasi,,Federações partidárias são mais racionais do que as coligações por dois motivos: (1) manutenção pós-eleição; (2) verticalização. É um bom instituto de transição rumo a uma racionalização do sistema partidário no Brasil.,pt,[],[],[],54,0,1,[],[],https://twitter.com/enricomisasi/status/1443681641470246914,False,,0,,,,,,,,[],,,,
1443345173304512513,1443345173304512513,2021-09-29 19:41:20 -0300,2021-09-29,19:41:20,-300,70542353,enricomisasi,Enrico Misasi,,"O fim da política é o bem comum. Mas o bem comum não é algo abstrato, a ser definido pelos políticos e intelectuais em seus gabinetes. O bem comum, pelo contrário, deve ser descoberto e construído junto às pessoas, conhecendo a realidade de cada um, seus anseios e suas angústias.  https://t.co/Z8H4FpFYrJ",pt,[],[],['https://pbs.twimg.com/media/FAfKwx0X0AINQWw.jpg'],9,0,1,[],[],https://twitter.com/enricomisasi/status/1443345173304512513,False,,1,https://pbs.twimg.com/media/FAfKwx0X0AINQWw.jpg,,,,,,,[],,,,
1272983605028032513,1272983605028032513,2020-06-16 17:05:16 -0300,2020-06-16,17:05:16,-300,70542353,enricomisasi,Enrico Misasi,,"Boa tarde, amigos! Tenho recebido muitos pedidos e decidi atendê-los: a partir de hoje você pode me acompanhar por aqui também. Vamos conversar sobre o nosso trabalho por SP e pelo Brasil.",pt,[],[],[],189,7,39,[],[],https://twitter.com/enricomisasi/status/1272983605028032513,False,,0,,,,,,,,[],,,,
1532847133765902344,1532552124529352722,2022-06-03 19:10:10 -0300,2022-06-03,19:10:10,-300,70542353,enricomisasi,Enrico Misasi,,@mbeltramini247 Fico muito feliz que tenham assistido a entrevista e gostado. Muito obrigado pelo carinho!,pt,[],[],[],0,0,1,[],[],https://twitter.com/enricomisasi/status/1532847133765902344,False,,0,,,,,,,,"[{'screen_name': 'mbeltramini247', 'name': 'Marcos Antonio Beltramini', 'id': '1467314868978130947'}]",,,,
1532547683499614217,1532547683499614217,2022-06-02 23:20:15 -0300,2022-06-02,23:20:15,-300,70542353,enricomisasi,Enrico Misasi,,"Assim foram os bastidores do programa Além da Notícia, na @TVCancaoNova.  Dá pra acompanhar ainda. Liga na TV ou entra em  https://t.co/Ffb5EdFNWK  https://t.co/58uDdbxJHO",pt,"[{'screen_name': 'tvcancaonova', 'name': '@tvcancaonova', 'id': '23442538'}]",['https://tv.cancaonova.com/'],[],0,0,4,[],[],https://twitter.com/enricomisasi/status/1532547683499614217,False,,1,https://pbs.twimg.com/ext_tw_video_thumb/1532547544936587271/pu/img/jsQeuHzHEhhVsPKw.jpg,,,,,,,[],,,,
1530028415574753284,1530009975011024896,2022-05-27 00:29:35 -0300,2022-05-27,00:29:35,-300,70542353,enricomisasi,Enrico Misasi,,@mariaclara_av Somos dois!,pt,[],[],[],0,0,2,[],[],https://twitter.com/enricomisasi/status/1530028415574753284,False,,0,,,,,,,,"[{'screen_name': 'mariaclara_av', 'name': 'Maria Clara Vieira Rousseau', 'id': '173356500'}]",,,,
1529596752571027457,1529524187311837186,2022-05-25 19:54:19 -0300,2022-05-25,19:54:19,-300,70542353,enricomisasi,Enrico Misasi,,@A_SPereira @LucioRenno @unb_oficial 🎯 exatamente.,pt,[],[],[],0,0,0,[],[],https://twitter.com/enricomisasi/status/1529596752571027457,False,,0,,,,,,,,"[{'screen_name': 'A_SPereira', 'name': 'Alessandro Pereira', 'id': '49961209'}, {'screen_name': 'LucioRenno', 'name': 'Lucio Renno', 'id': '886023362429976578'}, {'screen_name': 'unb_oficial', 'name': 'UnB', 'id': '280273819'}]",,,,
1529526754947252224,1529526754947252224,2022-05-25 15:16:10 -0300,2022-05-25,15:16:10,-300,70542353,enricomisasi,Enrico Misasi,,A grande pergunta para os professores hoje é: qual a calibragem na divisão de poderes entre o presidente e um primeiro-ministro? Qual o modelo mais aplicável à realidade brasileira?  https://t.co/mbPVDHKRaR,pt,[],[],[],0,0,0,[],[],https://twitter.com/enricomisasi/status/1529526754947252224,False,,1,https://pbs.twimg.com/ext_tw_video_thumb/1529525374358536193/pu/img/jD381S8ryXiqHfLy.jpg,,,,,,,[],,,,
1529524190335971329,1529524187311837186,2022-05-25 15:05:58 -0300,2022-05-25,15:05:58,-300,70542353,enricomisasi,Enrico Misasi,,"Segundo ele, o que favorece o populismo são, dentre outros fatores, sistemas governos personalistas, com partidos fracos.   Um novo arranjo institucional, com a divisão de chefia de governo e de Estado, tende a gerar a adoção políticas públicas mais moderadas e sem populismo.",pt,[],[],[],0,0,2,[],[],https://twitter.com/enricomisasi/status/1529524190335971329,False,,0,,,,,,,,[],,,,
1529524187311837186,1529524187311837186,2022-05-25 15:05:58 -0300,2022-05-25,15:05:58,-300,70542353,enricomisasi,Enrico Misasi,,"Mais um debate acontecendo no grupo de trabalho que discute o regime semipresidencialista de governo. Aqui, @LucioRenno, professor de Ciência Política na @unb_oficial, apontando algumas características de regimes populistas e centrados no personalismo.  https://t.co/wDcpTpDatG",pt,"[{'screen_name': 'luciorenno', 'name': 'lucio renno', 'id': '886023362429976578'}, {'screen_name': 'unb_oficial', 'name': 'unb', 'id': '280273819'}]",[],['https://pbs.twimg.com/media/FTn2ImfWQAAqdNG.jpg'],2,1,6,[],[],https://twitter.com/enricomisasi/status/1529524187311837186,False,,1,https://pbs.twimg.com/media/FTn2ImfWQAAqdNG.jpg,,,,,,,[],,,,
1527355583174627338,1527355583174627338,2022-05-19 15:28:42 -0300,2022-05-19,15:28:42,-300,70542353,enricomisasi,Enrico Misasi,,"Grande vitória! A votação do PL do #HomeschoolingSIM acabou agora. Foi mantido o texto base que aprovamos ontem, sem nenhuma alteração.  Agora, o projeto vai para o Senado, onde esperamos que seja aprovado sem alterações, para que o texto siga direto para a sanção presidencial.  https://t.co/VsqL6NqYTv",pt,[],[],['https://pbs.twimg.com/media/FTJBfuEX0AAMLjG.jpg'],0,1,4,['homeschoolingsim'],[],https://twitter.com/enricomisasi/status/1527355583174627338,False,,1,https://pbs.twimg.com/media/FTJBfuEX0AAMLjG.jpg,,,,,,,[],,,,
1527271736219246592,1527251604877066240,2022-05-19 09:55:31 -0300,2022-05-19,09:55:31,-300,70542353,enricomisasi,Enrico Misasi,,@mariaclara_av passar*,pt,[],[],[],0,0,0,[],[],https://twitter.com/enricomisasi/status/1527271736219246592,False,,0,,,,,,,,"[{'screen_name': 'mariaclara_av', 'name': 'Maria Clara Vieira Rousseau', 'id': '173356500'}]",,,,
1527271672277094402,1527251604877066240,2022-05-19 09:55:16 -0300,2022-05-19,09:55:16,-300,70542353,enricomisasi,Enrico Misasi,,"@mariaclara_av Ah, sim! Não consegui pesar da página 10 d’A Opção Beneditina.",pt,[],[],[],1,0,1,[],[],https://twitter.com/enricomisasi/status/1527271672277094402,False,,0,,,,,,,,"[{'screen_name': 'mariaclara_av', 'name': 'Maria Clara Vieira Rousseau', 'id': '173356500'}]",,,,
1527257902678933504,1527251604877066240,2022-05-19 09:00:33 -0300,2022-05-19,09:00:33,-300,70542353,enricomisasi,Enrico Misasi,,@mariaclara_av O que aconteceu com ele?,pt,[],[],[],1,0,0,[],[],https://twitter.com/enricomisasi/status/1527257902678933504,False,,0,,,,,,,,"[{'screen_name': 'mariaclara_av', 'name': 'Maria Clara Vieira Rousseau', 'id': '173356500'}]",,,,
1527096607342309377,1527096607342309377,2022-05-18 22:19:37 -0300,2022-05-18,22:19:37,-300,70542353,enricomisasi,Enrico Misasi,,"Agora, tratando de diversos temas no programa Frente a Frente, da @REDEVIDA, com os amigos José Maria Trindade e Denise Rothenburg.  Entre eles, saneamento básico, homeschooling, cenário político atual.   https://t.co/OJD7t1gngx  https://t.co/zGxFBBOtpz",pt,"[{'screen_name': 'redevida', 'name': 'redevida', 'id': '26273418'}]",['https://www.redevida.com.br/ao-vivo'],['https://pbs.twimg.com/media/FTFWQ2rXEAAdhHI.jpg'],0,0,2,[],[],https://twitter.com/enricomisasi/status/1527096607342309377,False,,1,https://pbs.twimg.com/media/FTFWQ2rXEAAdhHI.jpg,,,,,,,[],,,,
1527095027473780736,1527094894807891968,2022-05-18 22:13:21 -0300,2022-05-18,22:13:21,-300,70542353,enricomisasi,Enrico Misasi,,Acompanhe aqui:   https://t.co/OJD7t1gngx,pt,[],['https://www.redevida.com.br/ao-vivo'],[],0,0,0,[],[],https://twitter.com/enricomisasi/status/1527095027473780736,False,,0,,,,,,,,[],,,,
1527093169841659904,1527093169841659904,2022-05-18 22:05:58 -0300,2022-05-18,22:05:58,-300,70542353,enricomisasi,Enrico Misasi,,"Hoje terminamos o dia saboreando uma enorme vitória! A aprovação do texto do homeschooling foi resultado de um trabalho árduo de diálogo, ajustes e mobilização que deu certo.   Aqui está um resumo que mostra a intensidade dos nossos dois dias.  https://t.co/gRwRq5uElJ",pt,[],[],[],0,1,2,[],[],https://twitter.com/enricomisasi/status/1527093169841659904,False,,1,https://pbs.twimg.com/ext_tw_video_thumb/1527092797622431744/pu/img/LCAS1wFecBxyULEy.jpg,,,,,,,[],,,,
1527070993856057346,1527070993856057346,2022-05-18 20:37:51 -0300,2022-05-18,20:37:51,-300,70542353,enricomisasi,Enrico Misasi,,"Vou participar ao vivo, daqui a pouco, às 22h, do Frente a Frente, na @REDEVIDA. Vamos conversar sobre o cenário político atual, homeschooling e diversos outros temas super relevantes para nosso país e nosso estado.   Pode participar pela TV ou aqui  https://t.co/OJD7t1gngx  https://t.co/lDkqmAysMF",pt,"[{'screen_name': 'redevida', 'name': 'redevida', 'id': '26273418'}]",['https://www.redevida.com.br/ao-vivo'],['https://pbs.twimg.com/media/FTE--boWQAAT1Bw.jpg'],1,0,2,[],[],https://twitter.com/enricomisasi/status/1527070993856057346,False,,1,https://pbs.twimg.com/media/FTE--boWQAAT1Bw.jpg,,,,,,,[],,,,
1527039674740514816,1527039674740514816,2022-05-18 18:33:24 -0300,2022-05-18,18:33:24,-300,70542353,enricomisasi,Enrico Misasi,,VITÓRIA!!!   Aprovada a urgência ao PL do Homeschooling!  290 a 144!  O primeiro passo foi dado. Agora é aprovarmos o mérito. Vamos começar a analisar neste momento.  https://t.co/VfyTZUeim8,pt,[],[],[],2,1,7,[],[],https://twitter.com/enricomisasi/status/1527039674740514816,False,,1,https://pbs.twimg.com/ext_tw_video_thumb/1527039536735432705/pu/img/KerO2vP2_zrMNzHa.jpg,,,,,,,[],,,,
1526995928015577088,1526995928015577088,2022-05-18 15:39:34 -0300,2022-05-18,15:39:34,-300,70542353,enricomisasi,Enrico Misasi,,"Já já deve começar a apreciação do primeiro item da pauta do plenário da @camaradeputados: a urgência para o PL da educação domiciliar, #homeschooling.   Estamos com grande expectativa de conseguir vencer essa primeira etapa!  https://t.co/oeaDu4RS1O",pt,"[{'screen_name': 'camaradeputados', 'name': 'câmara dos deputados', 'id': '61843152'}]",[],['https://pbs.twimg.com/media/FTD6HovWIAEyXd2.png'],1,3,4,['homeschooling'],[],https://twitter.com/enricomisasi/status/1526995928015577088,False,,1,https://pbs.twimg.com/media/FTD6HovWIAEyXd2.png,,,,,,,[],,,,
1526943562973192194,1526943562973192194,2022-05-18 12:11:29 -0300,2022-05-18,12:11:29,-300,70542353,enricomisasi,Enrico Misasi,,"Tomei conhecimento agora de um movimento para retirar o Homeschooling da pauta do plenário. Mas é o primeiro item, e estamos atentos para votarmos, ao menos, a urgência.  Milhares de brasileiros precisam de uma resposta do Parlamento brasileiro.  https://t.co/dIjHSI0l60",pt,[],[],[],3,0,3,[],[],https://twitter.com/enricomisasi/status/1526943562973192194,False,,1,https://pbs.twimg.com/ext_tw_video_thumb/1526943090677895169/pu/img/_g9pIS3F2mNJYv1G.jpg,,,,,,,[],,,,
1526759040369545217,1526759040369545217,2022-05-17 23:58:15 -0300,2022-05-17,23:58:15,-300,70542353,enricomisasi,Enrico Misasi,,Ficou para amanhã a apreciação da urgência do projeto de lei da educação domiciliar #homeschooling.  Estaremos novamente atentos!,pt,[],[],[],0,0,2,['homeschooling'],[],https://twitter.com/enricomisasi/status/1526759040369545217,False,,0,,,,,,,,[],,,,
1526717486745284608,1526717486745284608,2022-05-17 21:13:08 -0300,2022-05-17,21:13:08,-300,70542353,enricomisasi,Enrico Misasi,,"Ainda conversando sobre o texto do Homeschooling, para que consigamos construir o melhor para as famílias educadoras.  Nossa expectativa é que a votação da urgência comece em breve aqui no Plenário.  Conversamos sobre alguns pontos e estou confiante que teremos uma vitória.  https://t.co/Tz6Lsmr7LN",pt,[],[],[],0,2,7,[],[],https://twitter.com/enricomisasi/status/1526717486745284608,False,,1,https://pbs.twimg.com/ext_tw_video_thumb/1526717324061036544/pu/img/C6NTivj2XXzQV99n.jpg,,,,,,,[],,,,
1526667452876300290,1526667452876300290,2022-05-17 17:54:19 -0300,2022-05-17,17:54:19,-300,70542353,enricomisasi,Enrico Misasi,,"O plenário hoje está diferente! Conseguimos que as famílias educadoras acompanhassem, lá na galeria do plenário, a votação da urgência do PL da educação domiciliar (homeschooling).  A votação deve começar já já.  https://t.co/OhctXJ6c4K",pt,[],[],"['https://pbs.twimg.com/media/FS_P8jwWUAAHIaG.jpg', 'https://pbs.twimg.com/media/FS_P867WYAI4ZBE.jpg', 'https://pbs.twimg.com/media/FS_P9RGWUAAHhW_.jpg']",0,2,10,[],[],https://twitter.com/enricomisasi/status/1526667452876300290,False,,1,https://pbs.twimg.com/media/FS_P8jwWUAAHIaG.jpg,,,,,,,[],,,,
1542864100258086920,1542864100258086920,2022-07-01 10:34:01 -0300,2022-07-01,10:34:01,-300,70542353,enricomisasi,Enrico Misasi,,"Foi um prazer dividir a mesa com um grande intérprete da nossa história, @aldorebelo! Obrigado pela participação, pelas reflexões, pelo amor ao Brasil!",pt,"[{'screen_name': 'aldorebelo', 'name': 'aldo rebelo', 'id': '34704778'}]",[],[],1,5,48,[],[],https://twitter.com/enricomisasi/status/1542864100258086920,False,https://twitter.com/aldorebelo/status/1542691420624101384,0,,,,,,,,[],,,,
1542863685491761153,1542863685491761153,2022-07-01 10:32:22 -0300,2022-07-01,10:32:22,-300,70542353,enricomisasi,Enrico Misasi,,"O escritor inglês G. K. Chesterton disse certa vez que ""Há uma grande lição na 'Bela e a Fera': tem coisas que precisam ser amadas antes de ser amáveis""  Isso também se aplica à nossa história e ao nosso país. Essa foi uma provocação que trouxe à mesa do seminário do bicentenário  https://t.co/V3P2pgeK7m",pt,[],[],[],0,2,4,[],[],https://twitter.com/enricomisasi/status/1542863685491761153,False,,1,https://pbs.twimg.com/ext_tw_video_thumb/1542862900083277824/pu/img/50g4dbVUqKdkfakF.jpg,,,,,,,[],,,,
1542693163911024640,1542691420624101384,2022-06-30 23:14:46 -0300,2022-06-30,23:14:46,-300,70542353,enricomisasi,Enrico Misasi,,"@aldorebelo Foi extraordinária sua participação, presidente @aldorebelo",pt,"[{'screen_name': 'aldorebelo', 'name': 'aldo rebelo', 'id': '34704778'}]",[],[],0,2,10,[],[],https://twitter.com/enricomisasi/status/1542693163911024640,False,,0,,,,,,,,"[{'screen_name': 'aldorebelo', 'name': 'Aldo Rebelo', 'id': '34704778'}]",,,,
1542616106774544389,1542616106774544389,2022-06-30 18:08:34 -0300,2022-06-30,18:08:34,-300,70542353,enricomisasi,Enrico Misasi,,"Nesta mesa, o sempre presidente da @camaradeputados Aldo Rebelo fez uma verdadeira declaração de amor ao Brasil, com grandes provocações a todos nós.  O que queremos com o evento do bicentenário é valorizar a história do nosso país e reconhecer grandes nomes da nossa trajetória.  https://t.co/uzLAm311XU",pt,"[{'screen_name': 'camaradeputados', 'name': 'câmara dos deputados', 'id': '61843152'}]",[],['https://pbs.twimg.com/media/FWh5LFcWYAEzSv5.jpg'],2,13,75,[],[],https://twitter.com/enricomisasi/status/1542616106774544389,False,,1,https://pbs.twimg.com/media/FWh5LFcWYAEzSv5.jpg,,,,,,,[],,,,
1542315860232110081,1542315860232110081,2022-06-29 22:15:30 -0300,2022-06-29,22:15:30,-300,70542353,enricomisasi,Enrico Misasi,,"É uma enorme honra estar à frente dessa iniciativa. Obrigado pela parceria, @camaradeputados.",pt,"[{'screen_name': 'camaradeputados', 'name': 'câmara dos deputados', 'id': '61843152'}]",[],[],0,2,5,[],[],https://twitter.com/enricomisasi/status/1542315860232110081,False,https://twitter.com/camaradeputados/status/1542177642845290498,0,,,,,,,,[],,,,
1542272593310408704,1542272593310408704,2022-06-29 19:23:34 -0300,2022-06-29,19:23:34,-300,70542353,enricomisasi,Enrico Misasi,,🟢🟡,art,[],[],[],0,1,2,[],[],https://twitter.com/enricomisasi/status/1542272593310408704,False,https://twitter.com/camaradeputados/status/1542251889861033991,0,,,,,,,,[],,,,
1542272225075728385,1542272225075728385,2022-06-29 19:22:07 -0300,2022-06-29,19:22:07,-300,70542353,enricomisasi,Enrico Misasi,,"A partir de hoje, os @CorreiosBR terão um novo selo comemorativo em alusão aos 200 anos da Independência. Tive a honra de participar da obliteração dele, enquanto presidente da Comissão do Bicentenário da Independência do Brasil.  Mais um fato histórico promovido pelo Parlamento.  https://t.co/JmQseah1Mx",pt,"[{'screen_name': 'correiosbr', 'name': 'correios', 'id': '3254323396'}]",[],"['https://pbs.twimg.com/media/FWdAaWmWIAABZiU.jpg', 'https://pbs.twimg.com/media/FWdAakQXkAAYQt5.jpg']",0,2,7,[],[],https://twitter.com/enricomisasi/status/1542272225075728385,False,,1,https://pbs.twimg.com/media/FWdAaWmWIAABZiU.jpg,,,,,,,[],,,,
1542247604729307136,1542247604729307136,2022-06-29 17:44:17 -0300,2022-06-29,17:44:17,-300,70542353,enricomisasi,Enrico Misasi,,"Terceira mesa de hoje se iniciando agora. O tema é José Bonifácio.  Com a palavra, o historiador Jorge Caldeira.  Conduzindo os debates, meu amigo @lafayetteandrad.  https://t.co/spAc3AtyFf",pt,"[{'screen_name': 'lafayetteandrad', 'name': 'lafayette de andrada', 'id': '58880411'}]",[],['https://pbs.twimg.com/media/FWcqBchWIAA54w5.jpg'],0,0,4,[],[],https://twitter.com/enricomisasi/status/1542247604729307136,False,,1,https://pbs.twimg.com/media/FWcqBchWIAA54w5.jpg,,,,,,,[],,,,
1542210850294988800,1542210850294988800,2022-06-29 15:18:14 -0300,2022-06-29,15:18:14,-300,70542353,enricomisasi,Enrico Misasi,,Preciosa lição do Dr. Ives Gandra. Temos um futuro promissor pela frente!  https://t.co/8AfYuJlFlV,pt,[],[],[],0,0,2,[],[],https://twitter.com/enricomisasi/status/1542210850294988800,False,,1,https://pbs.twimg.com/ext_tw_video_thumb/1542210781458096129/pu/img/wkYObB2K8qPbKcBy.jpg,,,,,,,[],,,,
1542146550704504838,1542146550704504838,2022-06-29 11:02:44 -0300,2022-06-29,11:02:44,-300,70542353,enricomisasi,Enrico Misasi,,"Primeira mesa do seminário em andamento, com Eduardo Bueno e Jurandir Malerba.  Muito instigante pensar sobre o papel dessa comissão e em todo o movimento da Independência. Há inúmeros paralelos entre nosso passado e nosso presente.  https://t.co/vlWwMFEM6t",pt,[],[],['https://pbs.twimg.com/media/FWbOHW1WYAMyLYa.jpg'],0,1,5,[],[],https://twitter.com/enricomisasi/status/1542146550704504838,False,,1,https://pbs.twimg.com/media/FWbOHW1WYAMyLYa.jpg,,,,,,,[],,,,
1542102251107409920,1542102251107409920,2022-06-29 08:06:42 -0300,2022-06-29,08:06:42,-300,70542353,enricomisasi,Enrico Misasi,,Finalzinho do recital com o pianista Álvaro Siviero e algumas vozes do coro da @marmilbr.  Não houve quem não se emocionasse!  https://t.co/kZpt3niisR,pt,"[{'screen_name': 'marmilbr', 'name': 'marinha do brasil', 'id': '236354374'}]",[],[],0,2,5,[],[],https://twitter.com/enricomisasi/status/1542102251107409920,False,,1,https://pbs.twimg.com/ext_tw_video_thumb/1542102161395441665/pu/img/1uXuaITzPNSg4234.jpg,,,,,,,[],,,,
1542101774810726400,1542101774810726400,2022-06-29 08:04:48 -0300,2022-06-29,08:04:48,-300,70542353,enricomisasi,Enrico Misasi,,Algumas fotos da nossa abertura das comemorações do Bicentenário da Independência.  Hoje e amanhã teremos o seminário para refletir sobre a nossa história.  https://t.co/ew8w2gnEAX,pt,[],[],"['https://pbs.twimg.com/media/FWalXcNXEAAS0jK.jpg', 'https://pbs.twimg.com/media/FWalX9MWAAcNd3-.jpg', 'https://pbs.twimg.com/media/FWalYYYXwAMRngI.jpg', 'https://pbs.twimg.com/media/FWalYzPXEAYMK8t.jpg']",1,5,8,[],[],https://twitter.com/enricomisasi/status/1542101774810726400,False,,1,https://pbs.twimg.com/media/FWalXcNXEAAS0jK.jpg,,,,,,,[],,,,
1542101273532678150,1542101273532678150,2022-06-29 08:02:49 -0300,2022-06-29,08:02:49,-300,70542353,enricomisasi,Enrico Misasi,,"Obrigado pela presença, @Biakicis. Foi uma bela noite!",pt,"[{'screen_name': 'biakicis', 'name': 'bia kicis', 'id': '357030742'}]",[],[],0,4,3,[],[],https://twitter.com/enricomisasi/status/1542101273532678150,False,https://twitter.com/Biakicis/status/1541916670452695041,0,,,,,,,,[],,,,
1541419451308036097,1541419451308036097,2022-06-27 10:53:30 -0300,2022-06-27,10:53:30,-300,70542353,enricomisasi,Enrico Misasi,,Ouça minha participação na Rádio Câmara hoje sobre o bicentenário:   https://t.co/0rxYmQun2F  https://t.co/9TU5ZoCYpE,pt,[],['https://www.camara.leg.br/radio/programas/890693-dep-enrico-misasi-seminario-discute-processo-que-levou-a-independencia-do-pais/'],['https://pbs.twimg.com/media/FWQ4oFIWAAARNEA.jpg'],1,1,2,[],[],https://twitter.com/enricomisasi/status/1541419451308036097,False,,1,https://pbs.twimg.com/media/FWQ4oFIWAAARNEA.jpg,,,,,,,[],,,,
1541376738554511362,1541376654307725318,2022-06-27 08:03:46 -0300,2022-06-27,08:03:46,-300,70542353,enricomisasi,Enrico Misasi,,Vai ser muito especial poder comemorar o #bicentenário debatendo com a sociedade e rememorando tantos fatos importantes da nossa história. Vamos participar?,pt,[],[],[],0,1,2,['bicentenário'],[],https://twitter.com/enricomisasi/status/1541376738554511362,False,,0,,,,,,,,[],,,,
1541376735756910592,1541376654307725318,2022-06-27 08:03:45 -0300,2022-06-27,08:03:45,-300,70542353,enricomisasi,Enrico Misasi,,"Na quinta, teremos os seguintes temas:  https://t.co/VSr7LreAZl",pt,[],[],"['https://pbs.twimg.com/media/FWQR9ONXEAMsXzp.jpg', 'https://pbs.twimg.com/media/FWQR9ZFXgAAEjcq.jpg', 'https://pbs.twimg.com/media/FWQR9vYXwAIVM3C.jpg', 'https://pbs.twimg.com/media/FWQR-EEXEAAsSGa.jpg']",1,0,1,[],[],https://twitter.com/enricomisasi/status/1541376735756910592,False,,1,https://pbs.twimg.com/media/FWQR9ONXEAMsXzp.jpg,,,,,,,[],,,,
1541376711006330881,1541376654307725318,2022-06-27 08:03:39 -0300,2022-06-27,08:03:39,-300,70542353,enricomisasi,Enrico Misasi,,Ainda na quarta:  https://t.co/JXxD6Y1zBE,pt,[],[],"['https://pbs.twimg.com/media/FWQR8cwXwAIyZdN.jpg', 'https://pbs.twimg.com/media/FWQR8mJXEAAoSjU.jpg']",1,0,0,[],[],https://twitter.com/enricomisasi/status/1541376711006330881,False,,1,https://pbs.twimg.com/media/FWQR8cwXwAIyZdN.jpg,,,,,,,[],,,,
1541376697777487873,1541376654307725318,2022-06-27 08:03:36 -0300,2022-06-27,08:03:36,-300,70542353,enricomisasi,Enrico Misasi,,"Na quarta e quinta, teremos várias mesas com intelectuais.  https://t.co/BTQnJw0XW9",pt,[],[],"['https://pbs.twimg.com/media/FWQR62-WIAEV2is.jpg', 'https://pbs.twimg.com/media/FWQR7TpWYAIpH3d.jpg', 'https://pbs.twimg.com/media/FWQR7q1WIAUzGay.jpg', 'https://pbs.twimg.com/media/FWQR70BXgAMQ8ut.jpg']",1,0,0,[],[],https://twitter.com/enricomisasi/status/1541376697777487873,False,,1,https://pbs.twimg.com/media/FWQR62-WIAEV2is.jpg,,,,,,,[],,,,
