id,conversation_id,created_at,date,time,timezone,user_id,username,name,place,tweet,language,mentions,urls,photos,replies_count,retweets_count,likes_count,hashtags,cashtags,link,retweet,quote_url,video,thumbnail,near,geo,source,user_rt_id,user_rt,retweet_id,reply_to,retweet_date,translate,trans_src,trans_dest
1514004485173088256,1514004482568474631,2022-04-12 19:16:12 -0300,2022-04-12,19:16:12,-300,70542353,enricomisasi,Enrico Misasi,,"Nosso sistema presidencialista (importado dos EUA porque era moda à época) gera crises desde que foi adotado, pela Constituição de 1891. Ainda tivemos mais 5 Constituições (1934, 1937, 1946, 1967 e 1988) e qualquer um consegue perceber claramente nossas crises cíclicas. (2/10)",pt,[],[],[],1,0,0,[],[],https://twitter.com/enricomisasi/status/1514004485173088256,False,,0,,,,,,,,[],,,,
1514004482568474631,1514004482568474631,2022-04-12 19:16:12 -0300,2022-04-12,19:16:12,-300,70542353,enricomisasi,Enrico Misasi,,"Nesta matéria da @folha de hoje, os presidenciáveis considerarem a adoção do semipresidencialismo como golpe...  Mas aqui vou te contar POR QUE NÃO SERIA GOLPE. Segue o fio:    https://t.co/fZeL5V4Vok  (1/10)",pt,"[{'screen_name': 'folha', 'name': 'folha de s.paulo', 'id': '14594813'}]",['https://www1.folha.uol.com.br/poder/2022/04/presidenciaveis-veem-golpe-de-lira-ao-encampar-plano-do-semipresidencialismo.shtml'],[],1,0,1,[],[],https://twitter.com/enricomisasi/status/1514004482568474631,False,,0,,,,,,,,[],,,,
1513577410125606912,1513577404090003459,2022-04-11 14:59:10 -0300,2022-04-11,14:59:10,-300,70542353,enricomisasi,Enrico Misasi,,"Foram realizados anúncios de convênios na área de saúde, educação e infraestrutura, além da entrega de máquinas e caminhões para toda a região. Em nome dos parlamentares, destaquei a importância da unidade entre o estado de São Paulo e os municípios para que todos sejam atendidos  https://t.co/J2VICXSMX9",pt,[],[],"['https://pbs.twimg.com/media/FQFNWFhX0AEWck_.jpg', 'https://pbs.twimg.com/media/FQFNWGqXEAQ_Al9.jpg']",0,0,0,[],[],https://twitter.com/enricomisasi/status/1513577410125606912,False,,1,https://pbs.twimg.com/media/FQFNWFhX0AEWck_.jpg,,,,,,,[],,,,
1513577404090003459,1513577404090003459,2022-04-11 14:59:08 -0300,2022-04-11,14:59:08,-300,70542353,enricomisasi,Enrico Misasi,,Trabalhar por todo o estado de São Paulo sempre foi uma prioridade do nosso mandato. Hoje tive a oportunidade de acompanhar o governador @rodrigogarcia_ em Marília.  https://t.co/mboSWqTISf,pt,"[{'screen_name': 'rodrigogarcia_', 'name': 'rodrigo garcia', 'id': '81158098'}]",[],"['https://pbs.twimg.com/media/FQFNTzXX0AIN0lO.jpg', 'https://pbs.twimg.com/media/FQFNoXwWUA8CGW5.jpg']",3,1,11,[],[],https://twitter.com/enricomisasi/status/1513577404090003459,False,,1,https://pbs.twimg.com/media/FQFNTzXX0AIN0lO.jpg,,,,,,,[],,,,
1513522109527511052,1513522109527511052,2022-04-11 11:19:25 -0300,2022-04-11,11:19:25,-300,70542353,enricomisasi,Enrico Misasi,,Por que os católicos têm menos espaço na política brasileira atualmente? Conversei com a reportagem da @gazetadopovo para ajudar a entender melhor o cenário. O texto traz algumas reflexões e respostas. Recomendo a leitura!   https://t.co/Tk2NJPyuK8,pt,"[{'screen_name': 'gazetadopovo', 'name': 'gazeta do povo', 'id': '15084884'}]",['https://www.gazetadopovo.com.br/ideias/por-que-os-catolicos-perderam-espaco-politico-para-os-evangelicos-no-brasil/'],[],1,1,4,[],[],https://twitter.com/enricomisasi/status/1513522109527511052,False,,0,,,,,,,,[],,,,
1512150806635634700,1512150538565128192,2022-04-07 16:30:21 -0300,2022-04-07,16:30:21,-300,70542353,enricomisasi,Enrico Misasi,,"Façamos a reflexão: se estamos com algum desses sintomas, devemos ligar o sinal de alerta e nos reaproximarmos do sentimento de comunidade, com diálogo, esperança e, sobretudo, superando o individualismo.  Vale a pena pensar!",pt,[],[],[],0,1,3,[],[],https://twitter.com/enricomisasi/status/1512150806635634700,False,,0,,,,,,,,[],,,,
1512150804748288005,1512150538565128192,2022-04-07 16:30:20 -0300,2022-04-07,16:30:20,-300,70542353,enricomisasi,Enrico Misasi,,"Ele começa quando desprezamos a diferença, quando achamos que quem pensa diferente é um inimigo a ser combatido. Se, depois, isso se torna ainda mais intransigente, o caminho para o extremismo está pavimentado.",pt,[],[],[],1,0,3,[],[],https://twitter.com/enricomisasi/status/1512150804748288005,False,,0,,,,,,,,[],,,,
1512150802680459265,1512150538565128192,2022-04-07 16:30:20 -0300,2022-04-07,16:30:20,-300,70542353,enricomisasi,Enrico Misasi,,"Acontece que, quando nos afastamos da democracia, corremos o risco de nos tornarmos autoritários ou, indo mais além, extremistas. O autoritarismo tem início quando estamos convencidos de que todas as soluções estão conosco ou com quem pensa como nós.",pt,[],[],[],1,0,1,[],[],https://twitter.com/enricomisasi/status/1512150802680459265,False,,0,,,,,,,,[],,,,
1512150538565128192,1512150538565128192,2022-04-07 16:29:17 -0300,2022-04-07,16:29:17,-300,70542353,enricomisasi,Enrico Misasi,,"Diante de uma notícia dessas, cabe a reflexão: até que ponto, nós, enquanto sociedade, estamos realmente dispostos a evitar que esse horror se repita? Meu avô viveu em campos de concentração japoneses - um holandês vindo da Indonésia. Lembro, com arrepio, dos relatos que já ouvi.",pt,[],[],[],1,0,3,[],[],https://twitter.com/enricomisasi/status/1512150538565128192,False,https://twitter.com/bbcbrasil/status/1512116390492266502,0,,,,,,,,[],,,,
1511834466750283779,1511834466750283779,2022-04-06 19:33:20 -0300,2022-04-06,19:33:20,-300,70542353,enricomisasi,Enrico Misasi,,DERRUBADO!!! O requerimento de urgência ao PL das fake news não passou no Plenário.  https://t.co/4vtyX5d2HZ,pt,[],[],['https://pbs.twimg.com/media/FPsdb3bWQAYsith.jpg'],2,0,9,[],[],https://twitter.com/enricomisasi/status/1511834466750283779,False,,1,https://pbs.twimg.com/media/FPsdb3bWQAYsith.jpg,,,,,,,[],,,,
1511806538691883010,1511806538691883010,2022-04-06 17:42:21 -0300,2022-04-06,17:42:21,-300,70542353,enricomisasi,Enrico Misasi,,"Começou a sessão! Acabei de apresentar uma emenda ao #PL2630, das fake news. O texto do PL equipara redes sociais e apps de mensagens a meios de comunicação social e abre caminho para censura. Nossa emenda acaba com isso, preservando a liberdade de expressão no ambiente digital.  https://t.co/0QIAMaMOsx",pt,[],[],[],1,2,12,['pl2630'],[],https://twitter.com/enricomisasi/status/1511806538691883010,False,,1,https://pbs.twimg.com/ext_tw_video_thumb/1511806459121700864/pu/img/D3jyH3O8rB54Zvo4.jpg,,,,,,,[],,,,
1511730952413798405,1511730935116488705,2022-04-06 12:42:00 -0300,2022-04-06,12:42:00,-300,70542353,enricomisasi,Enrico Misasi,,"Há muitos outros pontos problemáticos, mas o principal é: o texto atual não ajuda a buscar a verdade, não combate fake news, atrapalha a inovação digital, regula a internet e compromete a liberdade dos brasileiros.",pt,[],[],[],0,3,9,[],[],https://twitter.com/enricomisasi/status/1511730952413798405,False,,0,,,,,,,,[],,,,
1511730950547415048,1511730935116488705,2022-04-06 12:41:59 -0300,2022-04-06,12:41:59,-300,70542353,enricomisasi,Enrico Misasi,,(+) a previsão pode fazer com que grandes grupos de comunicação concentrem a remuneração e que o acesso a informação não seja democrático como é hj. Inverte-se a lógica da internet. França e Austrália já mostraram que isso não deu certo.,pt,[],[],[],1,1,4,[],[],https://twitter.com/enricomisasi/status/1511730950547415048,False,,0,,,,,,,,[],,,,
1511730948492206081,1511730935116488705,2022-04-06 12:41:59 -0300,2022-04-06,12:41:59,-300,70542353,enricomisasi,Enrico Misasi,,"3) O texto pretende remunerar meios de comunicação pelo conteúdo que é veiculado nos mecanismos de busca ou nas redes sociais, mas não define nem mesmo o que é conteúdo jornalístico. Ou seja: um site de fake news poderia ser remunerado.",pt,[],[],[],1,0,4,[],[],https://twitter.com/enricomisasi/status/1511730948492206081,False,,0,,,,,,,,[],,,,
1511730946566938625,1511730935116488705,2022-04-06 12:41:58 -0300,2022-04-06,12:41:58,-300,70542353,enricomisasi,Enrico Misasi,,"2) Alguns artigos preveem que as plataformas tenham que abrir dados empresariais e acabam ferindo o segredo comercial ou desestimulando investimentos e anúncios em redes menores, concentrando o mercado digital.",pt,[],[],[],2,0,4,[],[],https://twitter.com/enricomisasi/status/1511730946566938625,False,,0,,,,,,,,[],,,,
1511730944683741185,1511730935116488705,2022-04-06 12:41:58 -0300,2022-04-06,12:41:58,-300,70542353,enricomisasi,Enrico Misasi,,Isso vai contra a ideia de liberdade que vêm desde o nascimento das redes sociais e da própria internet. E vai contra também a liberdade de expressão e de pensamento dos usuários que expõem suas ideias nas plataformas.,pt,[],[],[],1,0,4,[],[],https://twitter.com/enricomisasi/status/1511730944683741185,False,,0,,,,,,,,[],,,,
1511730942842449925,1511730935116488705,2022-04-06 12:41:58 -0300,2022-04-06,12:41:58,-300,70542353,enricomisasi,Enrico Misasi,,"1) Ele equipara redes sociais, mecanismos de busca e apps de mensagens a meios de comunicação social. Isso responsabiliza as plataformas pelo conteúdo que circula ali. P/ não serem punidas, elas passariam a censurar esse conteúdo.",pt,[],[],[],1,0,4,[],[],https://twitter.com/enricomisasi/status/1511730942842449925,False,,0,,,,,,,,[],,,,
1511730940963393544,1511730935116488705,2022-04-06 12:41:57 -0300,2022-04-06,12:41:57,-300,70542353,enricomisasi,Enrico Misasi,,"Alguns pontos das últimas versões trouxeram avanços importantes, mas outros ainda merecem atenção porque podem impactar gravemente o nosso ecossistema digital, além de comprometer a liberdade, favorecer fake news e estimular #censura:",pt,[],[],[],1,0,4,['censura'],[],https://twitter.com/enricomisasi/status/1511730940963393544,False,,0,,,,,,,,[],,,,
1511730938941775874,1511730935116488705,2022-04-06 12:41:57 -0300,2022-04-06,12:41:57,-300,70542353,enricomisasi,Enrico Misasi,,"Importante ressaltar: buscamos a verdade e o bem comum, e as notícias falsas e a desinformação são uma pedra no sapato da democracia. Não são um fenômeno novo, mas requerem soluções apropriadas que sejam do tamanho do desafio.",pt,[],[],[],1,0,4,[],[],https://twitter.com/enricomisasi/status/1511730938941775874,False,,0,,,,,,,,[],,,,
1511730937083699206,1511730935116488705,2022-04-06 12:41:56 -0300,2022-04-06,12:41:56,-300,70542353,enricomisasi,Enrico Misasi,,"O texto atual tem pontos preocupantes e está completamente diferente do que veio do @senadofederal. No fundo, ele não ajuda a combater as #fakenews. Ele muda de forma substancial o ambiente digital e não deve ter sua urgência aprovada.",pt,"[{'screen_name': 'senadofederal', 'name': 'senado federal', 'id': '40095953'}]",[],[],1,0,4,['fakenews'],[],https://twitter.com/enricomisasi/status/1511730937083699206,False,,0,,,,,,,,[],,,,
1511730935116488705,1511730935116488705,2022-04-06 12:41:56 -0300,2022-04-06,12:41:56,-300,70542353,enricomisasi,Enrico Misasi,,"Hoje a @camaradeputados deve votar a urgência ao #PL2630/20, que está sendo chamado por muitos de #PLdaCensura. Vou votar contra e explico o porquê:",pt,"[{'screen_name': 'camaradeputados', 'name': 'câmara dos deputados', 'id': '61843152'}]",[],[],1,1,5,"['pl2630', 'pldacensura']",[],https://twitter.com/enricomisasi/status/1511730935116488705,False,,0,,,,,,,,[],,,,
1511402707214548993,1511402707214548993,2022-04-05 14:57:40 -0300,2022-04-05,14:57:40,-300,70542353,enricomisasi,Enrico Misasi,,Acabou de começar o Lançamento da Agenda Legislativa do Saneamento - 2022.  Você pode acompanhar aqui:  https://t.co/yIQNOsbcHd,pt,[],['https://www.youtube.com/watch?v=3HGDnQViPNw'],[],0,0,0,[],[],https://twitter.com/enricomisasi/status/1511402707214548993,False,,0,,,,,,,,[],,,,
1511068745720074240,1511068745720074240,2022-04-04 16:50:37 -0300,2022-04-04,16:50:37,-300,70542353,enricomisasi,Enrico Misasi,,Será amanhã! Ainda dá tempo de se inscrever e participar!,pt,[],[],[],0,0,1,[],[],https://twitter.com/enricomisasi/status/1511068745720074240,False,https://twitter.com/AbconSindcon/status/1509507903945859074,0,,,,,,,,[],,,,
1510741520122617865,1510734462325342212,2022-04-03 19:10:21 -0300,2022-04-03,19:10:21,-300,70542353,enricomisasi,Enrico Misasi,,"@rodrigogarcia_ Excelente, governador! 👏🏻👏🏻👏🏻👏🏻",pt,[],[],[],1,0,2,[],[],https://twitter.com/enricomisasi/status/1510741520122617865,False,,0,,,,,,,,"[{'screen_name': 'rodrigogarcia_', 'name': 'Rodrigo Garcia', 'id': '81158098'}]",,,,
1510050450170597381,1510050440913821702,2022-04-01 21:24:17 -0300,2022-04-01,21:24:17,-300,70542353,enricomisasi,Enrico Misasi,,"O próximo passo começa agora, seguindo os mesmos valores que nos trouxeram até aqui. Seguimos fiéis à nossa consciência, trabalhando por aquilo que julgamos ser o bem do Brasil. Mais do que nunca, o Brasil precisa de UNIDADE, e não de divisões.",pt,[],[],[],0,1,1,[],[],https://twitter.com/enricomisasi/status/1510050450170597381,False,,0,,,,,,,,[],,,,
1510050448014819331,1510050440913821702,2022-04-01 21:24:16 -0300,2022-04-01,21:24:16,-300,70542353,enricomisasi,Enrico Misasi,,"Em São Paulo, unidos a centenas de lideranças, vereadores e prefeitos, fizemos muito pelo nosso Estado e pelo Brasil. Mas ainda há muito o que ser feito.   (+)",pt,[],[],[],1,1,1,[],[],https://twitter.com/enricomisasi/status/1510050448014819331,False,,0,,,,,,,,[],,,,
1510050445468868615,1510050440913821702,2022-04-01 21:24:16 -0300,2022-04-01,21:24:16,-300,70542353,enricomisasi,Enrico Misasi,,"Nos últimos dois anos, tive a oportunidade de representar a bancada de deputados federais do PV, me tornando o líder mais jovem da história da Câmara dos Deputados. Foi uma honra e uma grande responsabilidade liderar parlamentares tão qualificados.  (+)",pt,[],[],[],1,0,1,[],[],https://twitter.com/enricomisasi/status/1510050445468868615,False,,0,,,,,,,,[],,,,
1510050443552071682,1510050440913821702,2022-04-01 21:24:15 -0300,2022-04-01,21:24:15,-300,70542353,enricomisasi,Enrico Misasi,,"Quem me conhece, sabe que eu não vim de família política, e, desde que disse o meu SIM para trabalhar pelo bem comum, a escolha pelo Partido Verde se deu pela liberdade na defesa de valores que considero inegociáveis.   (+)",pt,[],[],[],1,1,1,[],[],https://twitter.com/enricomisasi/status/1510050443552071682,False,,0,,,,,,,,[],,,,
1510050440913821702,1510050440913821702,2022-04-01 21:24:15 -0300,2022-04-01,21:24:15,-300,70542353,enricomisasi,Enrico Misasi,,É com o sentimento de dever cumprido que comunico o meu desligamento do Partido Verde e minha filiação ao #MDB.  (+)  https://t.co/s12UJU0Zfh,pt,[],[],['https://pbs.twimg.com/media/FPTG34oXsAc2TM8.jpg'],1,1,6,['mdb'],[],https://twitter.com/enricomisasi/status/1510050440913821702,False,,1,https://pbs.twimg.com/media/FPTG34oXsAc2TM8.jpg,,,,,,,[],,,,
1509625785799397377,1509625771320655882,2022-03-31 17:16:49 -0300,2022-03-31,17:16:49,-300,70542353,enricomisasi,Enrico Misasi,,"(4) de uma limitação drástica das possibilidades de concessão de liminar monocrática,  (5) de maior especificidade dos mandados de injunção,  (6) do esvaziamento completo das competências penais do STF.",pt,[],[],[],1,0,4,[],[],https://twitter.com/enricomisasi/status/1509625785799397377,False,,0,,,,,,,,[],,,,
1509625783458930697,1509625771320655882,2022-03-31 17:16:48 -0300,2022-03-31,17:16:48,-300,70542353,enricomisasi,Enrico Misasi,,"São necessárias algumas reformas. Precisamos (1) da limitação do objeto da ADPF,  (2) do fim do foro privilegiado (que, na verdade, é um mecanismo de submissão do Parlamento ao STF),  (3) do quórum qualificado para a declaração de inconstitucionalidade de emendas constitucionais,",pt,[],[],[],1,0,5,[],[],https://twitter.com/enricomisasi/status/1509625783458930697,False,,0,,,,,,,,[],,,,
1509625781076570114,1509625771320655882,2022-03-31 17:16:48 -0300,2022-03-31,17:16:48,-300,70542353,enricomisasi,Enrico Misasi,,"Não adianta querermos enxugar gelo, tratando dos efeitos e não das causas. É nesse sentido que temos argumentado no Parlamento. Tenho defendido na Câmara uma reforma estruturante da jurisdição constitucional (ou seja, do papel do STF) para frear na raiz o problema do ativismo.",pt,[],[],[],1,0,5,[],[],https://twitter.com/enricomisasi/status/1509625781076570114,False,,0,,,,,,,,[],,,,
1509625778736095236,1509625771320655882,2022-03-31 17:16:47 -0300,2022-03-31,17:16:47,-300,70542353,enricomisasi,Enrico Misasi,,"Além disso, o problema do Supremo Tribunal Federal (STF) não é um problema só de quem ocupa os cargos, é um problema institucional. Está na hora de o Parlamento pensar efetivamente que tipo de STF nós queremos, com quais competências e com quais processos.",pt,[],[],[],1,0,4,[],[],https://twitter.com/enricomisasi/status/1509625778736095236,False,,0,,,,,,,,[],,,,
1509625776328613895,1509625771320655882,2022-03-31 17:16:47 -0300,2022-03-31,17:16:47,-300,70542353,enricomisasi,Enrico Misasi,,"e a interpretação em que se fundamenta a decisão do Supremo Tribunal Federal é frágil do ponto de vista jurídico. Da mesma forma que fui contra a prisão, sou contra impor a tornozeleira eletrônica, já que ela é uma alternativa a uma prisão que nem sequer deveria ter acontecido.",pt,[],[],[],1,0,4,[],[],https://twitter.com/enricomisasi/status/1509625776328613895,False,,0,,,,,,,,[],,,,
1509625773677850635,1509625771320655882,2022-03-31 17:16:46 -0300,2022-03-31,17:16:46,-300,70542353,enricomisasi,Enrico Misasi,,"Reafirmo a minha posição à época. A Constituição Federal é clara: desde a expedição do diploma, os membros do Congresso Nacional não poderão ser presos salvo em flagrante de crime inafiançável. O que o deputado cometeu, não é um crime inafiançável   (+)",pt,[],[],[],1,0,17,[],[],https://twitter.com/enricomisasi/status/1509625773677850635,False,,0,,,,,,,,[],,,,
1509625771320655882,1509625771320655882,2022-03-31 17:16:46 -0300,2022-03-31,17:16:46,-300,70542353,enricomisasi,Enrico Misasi,,"Sobre o caso do #DanielSilveira,  em fevereiro de 2021, quando a Câmara decidiria a respeito da prisão do deputado, votei a favor do relaxamento da prisão, por entender que deve-se respeitar as imunidades parlamentares formais e materiais.   (Segue o 🧶) 👉",pt,[],[],[],1,0,6,['danielsilveira'],[],https://twitter.com/enricomisasi/status/1509625771320655882,False,,0,,,,,,,,[],,,,
1508513219152957447,1508513216955101190,2022-03-28 15:35:52 -0300,2022-03-28,15:35:52,-300,70542353,enricomisasi,Enrico Misasi,,O debate sobre o aborto é geralmente colocado em termos da liberdade da mulher. Pois bem. Mas qual é a autenticidade de uma liberdade de sucumbir ao desespero e à opressão das circunstâncias? Nenhuma.  Escrevi sobre isso em um artigo na @gazetadopovo 👇   https://t.co/qSBrPDDruc.,pt,"[{'screen_name': 'gazetadopovo', 'name': 'gazeta do povo', 'id': '15084884'}]",['https://bit.ly/3tHAuom'],[],1,1,1,[],[],https://twitter.com/enricomisasi/status/1508513219152957447,False,,0,,,,,,,,[],,,,
1508513216955101190,1508513216955101190,2022-03-28 15:35:52 -0300,2022-03-28,15:35:52,-300,70542353,enricomisasi,Enrico Misasi,,"Cheguei a Brasília com o compromisso de trabalhar pela defesa da vida desde a concepção. Além das batalhas que travamos para salvar a vida e a família, tem outro ponto que precisa ser abordado: o aborto é a vitória do desespero.  https://t.co/Ex5DCpZyLA",pt,[],[],['https://pbs.twimg.com/media/FO9QxRLWQAEcZaU.jpg'],1,0,1,[],[],https://twitter.com/enricomisasi/status/1508513216955101190,False,,1,https://pbs.twimg.com/media/FO9QxRLWQAEcZaU.jpg,,,,,,,[],,,,
1507083218931040268,1507083218931040268,2022-03-24 16:53:34 -0300,2022-03-24,16:53:34,-300,70542353,enricomisasi,Enrico Misasi,,"Sério. Se você gosta de história ou quer entender mais sobre a política e a Constituição do país, precisa dar uma olhada nesse novo acervo digital. Está aqui:   https://t.co/b2pHFJo3WG  fácil, fácil para todo mundo acessar de qualquer lugar:  https://t.co/TSRihWyGdK",pt,[],['https://arquivohistorico.camara.leg.br/index.php/congresso-nacional-constituinte-de-1890-1891'],[],1,0,1,[],[],https://twitter.com/enricomisasi/status/1507083218931040268,False,,1,https://pbs.twimg.com/ext_tw_video_thumb/1507081176200138769/pu/img/XXXScSLdZLySaIU2.jpg,,,,,,,[],,,,
1507079123352629253,1507078161624072192,2022-03-24 16:37:17 -0300,2022-03-24,16:37:17,-300,70542353,enricomisasi,Enrico Misasi,, https://t.co/9gk6hp0zWn,und,[],[],['https://pbs.twimg.com/media/FOo4dmHWQAol0q-.jpg'],0,0,1,[],[],https://twitter.com/enricomisasi/status/1507079123352629253,False,,1,https://pbs.twimg.com/media/FOo4dmHWQAol0q-.jpg,,,,,,,[],,,,
1507078175272181763,1507078161624072192,2022-03-24 16:33:31 -0300,2022-03-24,16:33:31,-300,70542353,enricomisasi,Enrico Misasi,,"Será uma oportunidade de olhar para trás e saber o que deu certo e o que deu errado. E essa é uma missão de todos os parlamentares, da academia e da sociedade como um todo.",pt,[],[],[],1,0,0,[],[],https://twitter.com/enricomisasi/status/1507078175272181763,False,,0,,,,,,,,[],,,,
1507078173023952900,1507078161624072192,2022-03-24 16:33:31 -0300,2022-03-24,16:33:31,-300,70542353,enricomisasi,Enrico Misasi,,"Entender essas motivações tem tudo a ver com a discussão que a Câmara faz atualmente sobre o semipresidencialismo. Então, ter esses documentos dá a possibilidade de rememorar os argumentos quando ainda se estava por fazer nossa Carta Constitucional.",pt,[],[],[],1,0,0,[],[],https://twitter.com/enricomisasi/status/1507078173023952900,False,,0,,,,,,,,[],,,,
1507078170821939205,1507078161624072192,2022-03-24 16:33:30 -0300,2022-03-24,16:33:30,-300,70542353,enricomisasi,Enrico Misasi,,"Esses documentos vão nos ajudar a iluminar os motivos dessa decisão e os processos que nos levaram a tomá-la. Até porque, algum tempo depois, Rui Barbosa - o grande artífice intelectual da Constituição de 1890-1891 - deixou de ter tanta predileção pelo presidencialismo.",pt,[],[],[],1,0,0,[],[],https://twitter.com/enricomisasi/status/1507078170821939205,False,,0,,,,,,,,[],,,,
1507078168615825419,1507078161624072192,2022-03-24 16:33:30 -0300,2022-03-24,16:33:30,-300,70542353,enricomisasi,Enrico Misasi,,Algumas características desse período:  1. o positivismo forte dos militares; 2. inspiração constitucional nos Estados Unidos.,pt,[],[],[],1,0,0,[],[],https://twitter.com/enricomisasi/status/1507078168615825419,False,,0,,,,,,,,[],,,,
1507078166241812480,1507078161624072192,2022-03-24 16:33:29 -0300,2022-03-24,16:33:29,-300,70542353,enricomisasi,Enrico Misasi,,"A Constituição de 1890-1891 foi a mais profunda e radical mudança constitucional na História brasileira. Do dia para a noite, em 1989, tivemos uma revolução com a proclamação da República: fomos dormir numa monarquia constitucional e acordamos caminhando para uma República.",pt,[],[],[],1,0,0,[],[],https://twitter.com/enricomisasi/status/1507078166241812480,False,,0,,,,,,,,[],,,,
1507078163951718405,1507078161624072192,2022-03-24 16:33:29 -0300,2022-03-24,16:33:29,-300,70542353,enricomisasi,Enrico Misasi,,"Por que isso é importante? Esses documentos são a radiografia de uma época em que nós, tendo abandonado a forma monárquica, precisamos decidir a estrutura constitucional do Brasil.",pt,[],[],[],1,0,0,[],[],https://twitter.com/enricomisasi/status/1507078163951718405,False,,0,,,,,,,,[],,,,
1507078161624072192,1507078161624072192,2022-03-24 16:33:28 -0300,2022-03-24,16:33:28,-300,70542353,enricomisasi,Enrico Misasi,,AGORA: A @camaradeputados está disponibilizando de forma digital toda a documentação do arquivo do Congresso Nacional sobre a Constituinte de 1890-1891.    https://t.co/Vv55xLiNly,pt,"[{'screen_name': 'camaradeputados', 'name': 'câmara dos deputados', 'id': '61843152'}]",['https://www.camara.leg.br/evento-legislativo/64784'],[],1,0,0,[],[],https://twitter.com/enricomisasi/status/1507078161624072192,False,,0,,,,,,,,[],,,,
1506656097872056328,1506627664089694217,2022-03-23 12:36:20 -0300,2022-03-23,12:36:20,-300,70542353,enricomisasi,Enrico Misasi,,"Essa é uma das grandes questões que se apresentam ao Grupo de Trabalho. Poderemos deixar um grande legado ao país se soubermos, com diálogo e honestidade, envolver toda a sociedade nesse debate e extrair respostas profundas aos nossos problemas históricos.",pt,[],[],[],1,1,1,[],[],https://twitter.com/enricomisasi/status/1506656097872056328,False,,0,,,,,,,,[],,,,
1506655818225225731,1506627664089694217,2022-03-23 12:35:14 -0300,2022-03-23,12:35:14,-300,70542353,enricomisasi,Enrico Misasi,,"Nosso sistema atual gera crise atrás de crises há mais de 130 anos. Estamos presos no século XVIII, em um modelo que o Brasil importou e que, evidentemente, não está funcionando bem. Como sair do ciclo de crises em que o Brasil está imerso?  https://t.co/q4CqZY7QC1",pt,[],[],[],1,1,1,[],[],https://twitter.com/enricomisasi/status/1506655818225225731,False,,1,https://pbs.twimg.com/ext_tw_video_thumb/1506655122767720449/pu/img/CqIelXvGvg6Ljd9x.jpg,,,,,,,[],,,,
1506627664089694217,1506627664089694217,2022-03-23 10:43:21 -0300,2022-03-23,10:43:21,-300,70542353,enricomisasi,Enrico Misasi,,"Começando agora a primeira reunião do Grupo de Trabalho da Câmara que vai debater o semipresidencialismo. Terá a duração de 120 dias, que podem ser prorrogados.  Somos dez parlamentares e mais 10 juristas renomados que fazem parte de um conselho consultivo.  https://t.co/Vfh7RL8hyC",pt,[],[],['https://pbs.twimg.com/media/FOid333XMAgoB10.jpg'],2,2,4,[],[],https://twitter.com/enricomisasi/status/1506627664089694217,False,,1,https://pbs.twimg.com/media/FOid333XMAgoB10.jpg,,,,,,,[],,,,
