id,conversation_id,created_at,date,time,timezone,user_id,username,name,place,tweet,language,mentions,urls,photos,replies_count,retweets_count,likes_count,hashtags,cashtags,link,retweet,quote_url,video,thumbnail,near,geo,source,user_rt_id,user_rt,retweet_id,reply_to,retweet_date,translate,trans_src,trans_dest
1523726920310951937,1523726920310951937,2022-05-09 15:09:41 -0300,2022-05-09,15:09:41,-300,45235841,felixmendoncajr,Félix Mendonça Jr.,,"Quero me solidarizar com os familiares dos três policiais mortos no último final de semana, em Salvador. Não adianta o governo da BA culpar o cidadão de bem que compra uma arma para defender a família diante do aumento da violência. É preciso enfrentar o problema com seriedade.",pt,[],[],[],1,2,10,[],[],https://twitter.com/FelixMendoncaJr/status/1523726920310951937,False,,0,,,,,,,,[],,,,
1521119981110444034,1521119981110444034,2022-05-02 10:30:39 -0300,2022-05-02,10:30:39,-300,45235841,felixmendoncajr,Félix Mendonça Jr.,,"Está com a situação eleitoral ok para votar em @cirogomes e nos candidatos do #PDT? Se não tiver, ainda dá tempo de regularizar o título, hein? Ou vai deixar que os outros decidam por você? #PrefiroCiro  https://t.co/3nyya5c0bo",pt,"[{'screen_name': 'cirogomes', 'name': 'ciro gomes', 'id': '33374761'}]",[],[],1,4,12,"['pdt', 'prefirociro']",[],https://twitter.com/FelixMendoncaJr/status/1521119981110444034,False,,1,https://pbs.twimg.com/ext_tw_video_thumb/1521119938857123840/pu/img/wpa4ZDziIDYNbIwH.jpg,,,,,,,[],,,,
1519326553599057921,1519326553599057921,2022-04-27 11:44:12 -0300,2022-04-27,11:44:12,-300,45235841,felixmendoncajr,Félix Mendonça Jr.,,"Ao lado do amigo e baiano @DepArthurMaia, que acabou de ser eleito presidente da Comissão de Constituição e Justiça da Câmara. Por indicação do #PDT, permaneci como membro titular da mesma comissão, considerada a mais importante da Casa.  https://t.co/naXUkxrpbI",pt,"[{'screen_name': 'departhurmaia', 'name': 'arthur maia', 'id': '42454330'}]",[],['https://pbs.twimg.com/media/FRW7cjoWYAIzBbz.jpg'],2,6,15,['pdt'],[],https://twitter.com/FelixMendoncaJr/status/1519326553599057921,False,,1,https://pbs.twimg.com/media/FRW7cjoWYAIzBbz.jpg,,,,,,,[],,,,
1519024311822073856,1518675527111950336,2022-04-26 15:43:12 -0300,2022-04-26,15:43:12,-300,45235841,felixmendoncajr,Félix Mendonça Jr.,,@Leoaranha25 @eneas_pedro Olá. Ainda não podemos disponibilizar material de campanha. Abs!,pt,[],[],[],0,0,0,[],[],https://twitter.com/FelixMendoncaJr/status/1519024311822073856,False,,0,,,,,,,,"[{'screen_name': 'Leoaranha25', 'name': 'Leonardo Aranha🇧🇷💢🌹✊', 'id': '88755372'}, {'screen_name': 'eneas_pedro', 'name': 'Pedro Eneas', 'id': '2603904725'}]",,,,
1519024150270074880,1518675527111950336,2022-04-26 15:42:34 -0300,2022-04-26,15:42:34,-300,45235841,felixmendoncajr,Félix Mendonça Jr.,,"@felipe_nutricao Sede nacional, em Brasília.",pt,[],[],[],0,0,2,[],[],https://twitter.com/FelixMendoncaJr/status/1519024150270074880,False,,0,,,,,,,,"[{'screen_name': 'felipe_nutricao', 'name': 'Felipe Nascimento 🇧🇷', 'id': '1621284434'}]",,,,
1519023984263712768,1519023984263712768,2022-04-26 15:41:54 -0300,2022-04-26,15:41:54,-300,45235841,felixmendoncajr,Félix Mendonça Jr.,,Tenho dito: quem foge de debate não merece o seu voto. #PrefiroCiro  https://t.co/y1TdPqpbGY,pt,[],[],[],13,77,409,['prefirociro'],[],https://twitter.com/FelixMendoncaJr/status/1519023984263712768,False,,1,https://pbs.twimg.com/ext_tw_video_thumb/1519023938864570370/pu/img/bPk-VQEknmRTsHtl.jpg,,,,,,,[],,,,
1518675527111950336,1518675527111950336,2022-04-25 16:37:15 -0300,2022-04-25,16:37:15,-300,45235841,felixmendoncajr,Félix Mendonça Jr.,,"Atenção, prefeitos e vereadores da Bahia! Temos um encontro marcado nesta quarta, dia 27, com nosso futuro presidente da República. Vamos ouvir o Ciro?  #PrefiroCiro  https://t.co/XcdKTGuOeP",pt,[],[],['https://pbs.twimg.com/media/FRNrV4zXIAIOSbw.jpg'],7,86,373,['prefirociro'],[],https://twitter.com/FelixMendoncaJr/status/1518675527111950336,False,,1,https://pbs.twimg.com/media/FRNrV4zXIAIOSbw.jpg,,,,,,,[],,,,
1518366222458490881,1518366222458490881,2022-04-24 20:08:11 -0300,2022-04-24,20:08:11,-300,45235841,felixmendoncajr,Félix Mendonça Jr.,,"O domingo foi de muito trabalho e prestação de contas do mandato em Acajutiba, onde me reuni com agricultores familiares da cidade e da vizinha Aporá, no norte da Bahia. No #PDT é assim: temos resultados concretos e projetos para apresentar.  https://t.co/WIQ9rKxVzU",pt,[],[],['https://pbs.twimg.com/media/FRJSCERWQAAFZHF.jpg'],0,5,31,['pdt'],[],https://twitter.com/FelixMendoncaJr/status/1518366222458490881,False,,1,https://pbs.twimg.com/media/FRJSCERWQAAFZHF.jpg,,,,,,,[],,,,
1512030845107941379,1511739482537615361,2022-04-07 08:33:40 -0300,2022-04-07,08:33:40,-300,45235841,felixmendoncajr,Félix Mendonça Jr.,,@deccache Errado. Se Lula apoiar o Ciro derrotamos Bolsonaro no primeiro turno. Ciro é candidato até o fim. #PrefiroCiro,pt,[],[],[],0,0,0,['prefirociro'],[],https://twitter.com/FelixMendoncaJr/status/1512030845107941379,False,,0,,,,,,,,"[{'screen_name': 'deccache', 'name': 'David Deccache', 'id': '1135678943493873664'}]",,,,
1511870073572630530,1511870073572630530,2022-04-06 21:54:49 -0300,2022-04-06,21:54:49,-300,45235841,felixmendoncajr,Félix Mendonça Jr.,,"É muito gratificante quando o nosso trabalho em Brasília tem como resultado a melhoria da qualidade de vida das pessoas. Como servidor público eleito, essa é a minha missão. Em breve estaremos em Gentio do Ouro para inaugurar a nova unidade de saúde do município.  https://t.co/AjY4QmWy2u",pt,[],[],['https://pbs.twimg.com/media/FPs90ZkXEA4vowR.jpg'],0,2,20,[],[],https://twitter.com/FelixMendoncaJr/status/1511870073572630530,False,,1,https://pbs.twimg.com/media/FPs90ZkXEA4vowR.jpg,,,,,,,[],,,,
1510248589301366785,1510248589301366785,2022-04-02 10:31:37 -0300,2022-04-02,10:31:37,-300,45235841,felixmendoncajr,Félix Mendonça Jr.,,"O vereador @emersonpenalva3, de Salvador, agora é 12. Bem-vindo ao #PDT, futuro deputado estadual.  https://t.co/4CTcfTIJJd",pt,"[{'screen_name': 'emersonpenalva3', 'name': 'emerson penalva', 'id': '1355146778228760577'}]",[],['https://pbs.twimg.com/media/FPV7FRLXoAkRRVK.jpg'],2,25,188,['pdt'],[],https://twitter.com/FelixMendoncaJr/status/1510248589301366785,False,,1,https://pbs.twimg.com/media/FPV7FRLXoAkRRVK.jpg,,,,,,,[],,,,
1510024928350908426,1510024928350908426,2022-04-01 19:42:52 -0300,2022-04-01,19:42:52,-300,45235841,felixmendoncajr,Félix Mendonça Jr.,,"Fui questionado agora pela imprensa se o PDT da Bahia tem interesse em receber em seus quadros o ex-prefeito @acmneto_, e eu disse que estendemos o tapete azul para ele. Mas estamos na torcida para que o União Brasil resolva os problemas internos noticiados na imprensa.",pt,"[{'screen_name': 'acmneto_', 'name': 'acm neto', 'id': '49966078'}]",[],[],12,44,389,[],[],https://twitter.com/FelixMendoncaJr/status/1510024928350908426,False,,0,,,,,,,,[],,,,
1509951404038934538,1509951404038934538,2022-04-01 14:50:42 -0300,2022-04-01,14:50:42,-300,45235841,felixmendoncajr,Félix Mendonça Jr.,,Seguimos fortalecendo o #PDT. Filiados o ex-deputado José Carlos Araújo e a vereadora de Lauro se Freitas Debora Régis. Os dois vieram com o apoio do ex-prefeito @acmneto_.  https://t.co/IDcRC4kOMe,pt,"[{'screen_name': 'acmneto_', 'name': 'acm neto', 'id': '49966078'}]",[],['https://pbs.twimg.com/media/FPRszJ6XIAYV82K.jpg'],1,30,202,['pdt'],[],https://twitter.com/FelixMendoncaJr/status/1509951404038934538,False,,1,https://pbs.twimg.com/media/FPRszJ6XIAYV82K.jpg,,,,,,,[],,,,
1509882078703333384,1509882078703333384,2022-04-01 10:15:14 -0300,2022-04-01,10:15:14,-300,45235841,felixmendoncajr,Félix Mendonça Jr.,,"Ao vivo agora na Aratu Online falando de economia, política e @cirogomes. Clica para ver:   https://t.co/5gxn83htlD  https://t.co/27tvRjf0QP",pt,"[{'screen_name': 'cirogomes', 'name': 'ciro gomes', 'id': '33374761'}]",['https://aratuon.com.br/linha-de-frente/noticia/politica/ao-vivo-linha-de-frente-entrevista-deputado-federal-felix-mendonca-jr-assista'],['https://pbs.twimg.com/media/FPQtqfRXwAYwSHk.jpg'],6,13,116,[],[],https://twitter.com/FelixMendoncaJr/status/1509882078703333384,False,,1,https://pbs.twimg.com/media/FPQtqfRXwAYwSHk.jpg,,,,,,,[],,,,
1509856037733552132,1509856037733552132,2022-04-01 08:31:45 -0300,2022-04-01,08:31:45,-300,45235841,felixmendoncajr,Félix Mendonça Jr.,,Artigo publicado hoje no @bnews_oficial sobre a lei elaborada por mim e sancionada em 2019 pelo presidente que pune com mais rigor quem fizer denunciação caluniosa (uma espécie de fake news) nas eleições.    https://t.co/i1G5zQEV9q,pt,"[{'screen_name': 'bnews_oficial', 'name': 'bnews', 'id': '185816093'}]",['https://www.bnews.com.br/noticias/artigo/eleicoes-e-1-de-abril-nao-se-misturam.html'],[],0,2,11,[],[],https://twitter.com/FelixMendoncaJr/status/1509856037733552132,False,,0,,,,,,,,[],,,,
1509589589002010628,1509589589002010628,2022-03-31 14:52:59 -0300,2022-03-31,14:52:59,-300,45235841,felixmendoncajr,Félix Mendonça Jr.,,"Primeira vereadora trans do Brasil, @_leokret se filiou hoje ao #PDT, partido da educação, do trabalhismo, da liberdade e da diversidade.   #CiroUnicaVia  https://t.co/1LJAsn9rD1",pt,"[{'screen_name': '_leokret', 'name': 'léo kret do brasil', 'id': '129862871'}]",[],[],43,141,668,"['pdt', 'cirounicavia']",[],https://twitter.com/FelixMendoncaJr/status/1509589589002010628,False,,1,https://pbs.twimg.com/ext_tw_video_thumb/1509589524845895681/pu/img/WMfu0hptz3PufNFo.jpg,,,,,,,[],,,,
1509552554803351557,1509552554803351557,2022-03-31 12:25:49 -0300,2022-03-31,12:25:49,-300,45235841,felixmendoncajr,Félix Mendonça Jr.,,"Se todos os candidatos à Presidência que não têm projeto para o país desistirem da disputa, só vai restar @cirogomes no páreo.   #PrefiroCiro",pt,"[{'screen_name': 'cirogomes', 'name': 'ciro gomes', 'id': '33374761'}]",[],[],4,30,218,['prefirociro'],[],https://twitter.com/FelixMendoncaJr/status/1509552554803351557,False,,0,,,,,,,,[],,,,
1509350056654258180,1509347145962373127,2022-03-30 23:01:10 -0300,2022-03-30,23:01:10,-300,45235841,felixmendoncajr,Félix Mendonça Jr.,,@marcosvinbor Vamos marcar!,es,[],[],[],1,0,6,[],[],https://twitter.com/FelixMendoncaJr/status/1509350056654258180,False,,0,,,,,,,,"[{'screen_name': 'marcosvinbor', 'name': 'Marvin🍥', 'id': '211587672'}]",,,,
1509347145962373127,1509347145962373127,2022-03-30 22:49:36 -0300,2022-03-30,22:49:36,-300,45235841,felixmendoncajr,Félix Mendonça Jr.,,Estamos montando uma lista bacana de candidatos a deputado estadual e federal pelo #PDT da Bahia. Em breve teremos grandes novidades. Fiquem ligados! A partir desta sexta (31) faremos já alguns anúncios.,pt,[],[],[],10,21,160,['pdt'],[],https://twitter.com/FelixMendoncaJr/status/1509347145962373127,False,,0,,,,,,,,[],,,,
1507050844273135623,1507047839293222915,2022-03-24 14:44:55 -0300,2022-03-24,14:44:55,-300,45235841,felixmendoncajr,Félix Mendonça Jr.,,@jatobatiago @CarlosLupiPDT O palanque do PDT. Abs!,pt,[],[],[],0,2,3,[],[],https://twitter.com/FelixMendoncaJr/status/1507050844273135623,False,,0,,,,,,,,"[{'screen_name': 'jatobatiago', 'name': 'Ciro me Representa - 12 🌹🌹🌹🌹', 'id': '71155538'}, {'screen_name': 'CarlosLupiPDT', 'name': 'Carlos Lupi 🇧🇷🌹', 'id': '703032066'}]",,,,
1507050724533977100,1507047839293222915,2022-03-24 14:44:27 -0300,2022-03-24,14:44:27,-300,45235841,felixmendoncajr,Félix Mendonça Jr.,,@cirocmendes @CarlosLupiPDT Estamos caminhando nessa direção. Abs!,pt,[],[],[],1,2,5,[],[],https://twitter.com/FelixMendoncaJr/status/1507050724533977100,False,,0,,,,,,,,"[{'screen_name': 'cirocmendes', 'name': 'cirowski #PrefiroCiro', 'id': '1435777565847863296'}, {'screen_name': 'CarlosLupiPDT', 'name': 'Carlos Lupi 🇧🇷🌹', 'id': '703032066'}]",,,,
1507047839293222915,1507047839293222915,2022-03-24 14:32:59 -0300,2022-03-24,14:32:59,-300,45235841,felixmendoncajr,Félix Mendonça Jr.,,"Recebendo hoje em Salvador a visita do amigo @CarlosLupiPDT, presidente nacional do #PDT. Na pauta, o fortalecimento do partido para as eleições deste ano.   #CiroPresidente  #cironosegundoturno  #PrefiroCiro  https://t.co/FumUDdS32j",pt,"[{'screen_name': 'carloslupipdt', 'name': 'carlos lupi 🇧🇷🌹', 'id': '703032066'}]",[],['https://pbs.twimg.com/media/FOocBaCXsAglkE_.jpg'],5,13,47,"['pdt', 'ciropresidente', 'cironosegundoturno', 'prefirociro']",[],https://twitter.com/FelixMendoncaJr/status/1507047839293222915,False,,1,https://pbs.twimg.com/media/FOocBaCXsAglkE_.jpg,,,,,,,[],,,,
1506629880326328322,1506629880326328322,2022-03-23 10:52:09 -0300,2022-03-23,10:52:09,-300,45235841,felixmendoncajr,Félix Mendonça Jr.,,Deu na TV...  https://t.co/JFmkZ1CSNQ,pt,[],[],[],0,3,10,[],[],https://twitter.com/FelixMendoncaJr/status/1506629880326328322,False,,1,https://pbs.twimg.com/ext_tw_video_thumb/1506629733462810629/pu/img/RTijbqnDx10sNc2I.jpg,,,,,,,[],,,,
1505574099384512512,1505574099384512512,2022-03-20 12:56:52 -0300,2022-03-20,12:56:52,-300,45235841,felixmendoncajr,Félix Mendonça Jr.,,"São 150 fogões e 60 geladeiras que serão distribuídas amanhã aos municípios de Ubaíra, Barra do Rocha e Itacaré. O critério de distribuição será definido pelas prefeituras, com base nos cadastros sociais. Uma pequena ajuda, mas que vale muito para quem teve perdas materiais.",pt,[],[],[],0,1,7,[],[],https://twitter.com/FelixMendoncaJr/status/1505574099384512512,False,,0,,,,,,,,[],,,,
1505573732126969860,1505573732126969860,2022-03-20 12:55:24 -0300,2022-03-20,12:55:24,-300,45235841,felixmendoncajr,Félix Mendonça Jr.,,"Já estão na Bahia as geladeiras e fogões doados pela Turquia para famílias prejudicadas pelas de janeiro no estado. Agradecemos ao embaixador Murat Yavuz Ateş, que atendeu de pronto nosso pedido por meio da Frente Parlamentar Brasil-Turquia, presidida por mim na Câmara.  https://t.co/01CvstztnZ",pt,[],[],['https://pbs.twimg.com/media/FOTfVIGXEAAB93U.jpg'],0,3,9,[],[],https://twitter.com/FelixMendoncaJr/status/1505573732126969860,False,,1,https://pbs.twimg.com/media/FOTfVIGXEAAB93U.jpg,,,,,,,[],,,,
1504852326137352195,1504852326137352195,2022-03-18 13:08:48 -0300,2022-03-18,13:08:48,-300,45235841,felixmendoncajr,Félix Mendonça Jr.,,Prestei queixa de estelionato na Polícia denunciando um golpe que estão tentando aplicar em prefeituras utilizando o meu nome. Os golpistas enviam mensagem usando foto minha e o número de telefone (61) 992261944 pedindo documentos da prefeitura para a doação de alimentos. Golpe!  https://t.co/1SbtTG5EFt,pt,[],[],['https://pbs.twimg.com/media/FOJPNu8XIAMNV-O.jpg'],0,0,5,[],[],https://twitter.com/FelixMendoncaJr/status/1504852326137352195,False,,1,https://pbs.twimg.com/media/FOJPNu8XIAMNV-O.jpg,,,,,,,[],,,,
1504603366646812678,1504603366646812678,2022-03-17 20:39:31 -0300,2022-03-17,20:39:31,-300,45235841,felixmendoncajr,Félix Mendonça Jr.,,"Pela nona vez consecutiva, o BC aumentou a taxa de juros do país, que chegou agora a 11,75%. É o maior patamar desde 2017. A política perversa de enriquecer os banqueiros e empobrecer os trabalhadores vai, infelizmente, continuar neste governo. Vamos mudar isso? #PrefiroCiro  https://t.co/hlifhB31Re",pt,[],[],[],0,5,14,['prefirociro'],[],https://twitter.com/FelixMendoncaJr/status/1504603366646812678,False,,1,https://pbs.twimg.com/ext_tw_video_thumb/1504602966338289668/pu/img/LuCepuTi8S79QKsr.jpg,,,,,,,[],,,,
1504259542477164549,1504043197198176257,2022-03-16 21:53:17 -0300,2022-03-16,21:53:17,-300,45235841,felixmendoncajr,Félix Mendonça Jr.,,@rodcebrian Acho que Ciro aceitaria tranquilamente o apoio de Lula para derrotar Bolsonaro.,pt,[],[],[],0,0,0,[],[],https://twitter.com/FelixMendoncaJr/status/1504259542477164549,False,,0,,,,,,,,"[{'screen_name': 'rodcebrian', 'name': 'Rodrigo (Palito) Cebrian', 'id': '75787083'}]",,,,
1504221363082563586,1504221363082563586,2022-03-16 19:21:34 -0300,2022-03-16,19:21:34,-300,45235841,felixmendoncajr,Félix Mendonça Jr.,,"Hoje dei um abraço no meu líder e amigo @CarlosLupiPDT, presidente nacional do #PDT, que faz aniversário. Lupi tem conduzido o partido com maestria, contribuindo ainda para a construção de um país melhor e defendendo a candidatura de @cirogomes à Presidência.  https://t.co/ydKPibLMNR",pt,"[{'screen_name': 'carloslupipdt', 'name': 'carlos lupi 🇧🇷🌹', 'id': '703032066'}, {'screen_name': 'cirogomes', 'name': 'ciro gomes', 'id': '33374761'}]",[],['https://pbs.twimg.com/media/FOARV44XMAYCQBY.jpg'],1,6,35,['pdt'],[],https://twitter.com/FelixMendoncaJr/status/1504221363082563586,False,,1,https://pbs.twimg.com/media/FOARV44XMAYCQBY.jpg,,,,,,,[],,,,
1501318461267578887,1501318461267578887,2022-03-08 19:06:28 -0300,2022-03-08,19:06:28,-300,45235841,felixmendoncajr,Félix Mendonça Jr.,,"A Bahia pode mais. E o #PDT tem projeto de desenvolvimento para o Brasil real que vai também transformar a vida dos baianos, que sofrem com os erros tanto do governo federal quanto estadual. Confira a mensagem de @cirogomes para toda a gente da boa terra!  #PrefiroCiro  https://t.co/MxmOWZOx8z",pt,"[{'screen_name': 'cirogomes', 'name': 'ciro gomes', 'id': '33374761'}]",[],[],6,83,407,"['pdt', 'prefirociro']",[],https://twitter.com/FelixMendoncaJr/status/1501318461267578887,False,,1,https://pbs.twimg.com/ext_tw_video_thumb/1501318173299253249/pu/img/7wB8MG-pwUqFGmCw.jpg,,,,,,,[],,,,
1501318375531819022,1500965879886061568,2022-03-08 19:06:08 -0300,2022-03-08,19:06:08,-300,45235841,felixmendoncajr,Félix Mendonça Jr.,,@RicardoHoffster @PDT_Nacional Seja bem-vindo!,pt,[],[],[],0,0,0,[],[],https://twitter.com/FelixMendoncaJr/status/1501318375531819022,False,,0,,,,,,,,"[{'screen_name': 'RicardoHoffster', 'name': 'Ricardo Hoffster ®🌹', 'id': '136001046'}, {'screen_name': 'PDT_Nacional', 'name': 'PDT 12', 'id': '180500907'}]",,,,
1498672503669112837,1498672503669112837,2022-03-01 11:52:23 -0300,2022-03-01,11:52:23,-300,45235841,felixmendoncajr,Félix Mendonça Jr.,,A Bahia não pode continuar ocupando as últimas posições do país na qualidade da educação. Temos que mudar isso! Confira a minha participação na propaganda partidária do #PDT.   #pdtbahia  #educacao  #bahia  #felixmendoncajr  https://t.co/nZHUpmic9v,pt,[],[],[],3,15,55,"['pdt', 'pdtbahia', 'educacao', 'bahia', 'felixmendoncajr']",[],https://twitter.com/FelixMendoncaJr/status/1498672503669112837,False,,1,https://pbs.twimg.com/ext_tw_video_thumb/1498672019126292494/pu/img/TPi3MtszxBELDYMj.jpg,,,,,,,[],,,,
1496851829866463234,1496851829866463234,2022-02-24 11:17:41 -0300,2022-02-24,11:17:41,-300,45235841,felixmendoncajr,Félix Mendonça Jr.,,"O Brasil tem que condenar fortemente a invasão da Rússia à Ucrânia. Não podemos ficar do lado errado da história mundial, que parece, lamentavelmente, estar se repetindo. É tradição de nossa diplomacia defender a paz e a democracia.",pt,[],[],[],3,0,5,[],[],https://twitter.com/FelixMendoncaJr/status/1496851829866463234,False,,0,,,,,,,,[],,,,
1496520591892959237,1496520591892959237,2022-02-23 13:21:27 -0300,2022-02-23,13:21:27,-300,45235841,felixmendoncajr,Félix Mendonça Jr.,,"Recebi as visitas de duas lideranças de Cícero Dantas, o vice-prefeito Jackson Almeida e o vereador Uri da Ilha, ambos do #PDT, que solicitaram recursos para a construção de praças na zona rural, além de uma ambulância. Assumi o compromisso de viabilizar a verba via emendas.  https://t.co/B22La5EFYE",pt,[],[],['https://pbs.twimg.com/media/FMS1ikfXEAcbD8m.jpg'],1,3,10,['pdt'],[],https://twitter.com/FelixMendoncaJr/status/1496520591892959237,False,,1,https://pbs.twimg.com/media/FMS1ikfXEAcbD8m.jpg,,,,,,,[],,,,
1496250846677544967,1496250846677544967,2022-02-22 19:29:35 -0300,2022-02-22,19:29:35,-300,45235841,felixmendoncajr,Félix Mendonça Jr.,,Está claro que a ação policial contra @cirogomes foi um teatro político montado para atingir nosso candidato. Vamos pra cima deles! #CiroNoSegundoTurno   https://t.co/AsJ77l65kQ,pt,"[{'screen_name': 'cirogomes', 'name': 'ciro gomes', 'id': '33374761'}]",['https://www.bahianoticias.com.br/folha/noticia/154168-justica-anula-busca-e-apreensao-da-pf-contra-ciro-gomes.html'],[],3,21,79,['cironosegundoturno'],[],https://twitter.com/FelixMendoncaJr/status/1496250846677544967,False,,0,,,,,,,,[],,,,
1495878152844984320,1495878152844984320,2022-02-21 18:48:38 -0300,2022-02-21,18:48:38,-300,45235841,felixmendoncajr,Félix Mendonça Jr.,,"Precisamos de um presidente que tenha coragem de mudar a política econômica e de enfrentar o lobby dos bancos, beneficiados com a política de aumento dos juros adotada pelo atual governo. Esse presidente é @cirogomes. Confira um trecjo da entrevista de hoje ao @politi_zando.  https://t.co/0Zr8HinMof",pt,"[{'screen_name': 'cirogomes', 'name': 'ciro gomes', 'id': '33374761'}, {'screen_name': 'politi_zando', 'name': 'politizando', 'id': '1385000913585283073'}]",[],[],10,72,323,[],[],https://twitter.com/FelixMendoncaJr/status/1495878152844984320,False,,1,https://pbs.twimg.com/ext_tw_video_thumb/1495878037904183302/pu/img/Y9GDe5PWi6pNp2SJ.jpg,,,,,,,[],,,,
1495796400948453376,1495796400948453376,2022-02-21 13:23:47 -0300,2022-02-21,13:23:47,-300,45235841,felixmendoncajr,Félix Mendonça Jr.,,"Logo mais, às 14h, estarei batendo um papo com o Politizando sobre a campanha de @cirogomes na Bahia. Confira ao vivo acessando:   https://t.co/3pXXrLtODY  https://t.co/dBhqBY20PN",pt,"[{'screen_name': 'cirogomes', 'name': 'ciro gomes', 'id': '33374761'}]",['https://www.youtube.com/watch?v=aNmmHlN1po4'],['https://pbs.twimg.com/media/FMIi5PDXEAUdvS3.jpg'],1,6,17,[],[],https://twitter.com/FelixMendoncaJr/status/1495796400948453376,False,,1,https://pbs.twimg.com/media/FMIi5PDXEAUdvS3.jpg,,,,,,,[],,,,
1494814771299897357,1494814771299897357,2022-02-18 20:23:08 -0300,2022-02-18,20:23:08,-300,45235841,felixmendoncajr,Félix Mendonça Jr.,,"Participando agora de uma audiência pública em Itabuna para debater o fortalecimento da lavoura cacaueira. Enquanto o governo federal dá incentivos à importação, não estimula a produção local, formada, em sua maioria, por pequenos produtores que preservam a Mata Atlântica.  https://t.co/FINwhR4HTI",pt,[],[],['https://pbs.twimg.com/media/FL6mERKXEAo9ZuI.jpg'],1,5,13,[],[],https://twitter.com/FelixMendoncaJr/status/1494814771299897357,False,,1,https://pbs.twimg.com/media/FL6mERKXEAo9ZuI.jpg,,,,,,,[],,,,
1493625434990428164,1493625434990428164,2022-02-15 13:37:08 -0300,2022-02-15,13:37:08,-300,45235841,felixmendoncajr,Félix Mendonça Jr.,,"Reunião com @acmneto_ e os amigos do #PDT de Ribeira do Pombal: Zé Grilo, ex-prefeito e presidente municipal do partido, e Nay Grilo, pré-candidata pedetista a deputada federal. Neto foi convidado para o Encontro Municipal do PDT de Ribeira do Pombal, que acontece em março.  https://t.co/RveDQVfLeN",pt,"[{'screen_name': 'acmneto_', 'name': 'acm neto', 'id': '49966078'}]",[],['https://pbs.twimg.com/media/FLpsZGwWUAMLZgV.jpg'],6,16,138,['pdt'],[],https://twitter.com/FelixMendoncaJr/status/1493625434990428164,False,,1,https://pbs.twimg.com/media/FLpsZGwWUAMLZgV.jpg,,,,,,,[],,,,
1493577964411408389,1493577964411408389,2022-02-15 10:28:30 -0300,2022-02-15,10:28:30,-300,45235841,felixmendoncajr,Félix Mendonça Jr.,,"Muito triste com o falecimento do jornalista e cineasta Arnaldo Jabor. Eu era fã dos comentários repletos de ironia e sarcasmo que ele fazia nas madrugadas da TV sobre política. Referência do cinema novo, vai deixar também muitas saudades pela contribuição à cultura brasileira.",pt,[],[],[],0,1,6,[],[],https://twitter.com/FelixMendoncaJr/status/1493577964411408389,False,,0,,,,,,,,[],,,,
1492572173206265858,1492567206521155586,2022-02-12 15:51:51 -0300,2022-02-12,15:51:51,-300,45235841,felixmendoncajr,Félix Mendonça Jr.,,@Lennon_campos Acho mais fácil o seu juízo...,pt,[],[],[],1,0,1,[],[],https://twitter.com/FelixMendoncaJr/status/1492572173206265858,False,,0,,,,,,,,"[{'screen_name': 'Lennon_campos', 'name': 'Lennon O. Campos 🙏😷🇧🇷 #PrefiroCiro', 'id': '32421985'}]",,,,
1492567206521155586,1492567206521155586,2022-02-12 15:32:07 -0300,2022-02-12,15:32:07,-300,45235841,felixmendoncajr,Félix Mendonça Jr.,,"Reunimos, no Encontro Municipal do PDT de Itacaré, hoje, lideranças do União Brasil e do MDB local. Vamos ajudar a construir um novo projeto de desenvolvimento para a Bahia que tire o estado do atraso. Não podemos ficar na lanterninha na educação e na segurança.  https://t.co/4sK6KqvDP4",pt,[],[],['https://pbs.twimg.com/media/FLap9pwWQAIKIwh.jpg'],1,6,33,[],[],https://twitter.com/FelixMendoncaJr/status/1492567206521155586,False,,1,https://pbs.twimg.com/media/FLap9pwWQAIKIwh.jpg,,,,,,,[],,,,
1492565663709380613,1492507522611220480,2022-02-12 15:25:59 -0300,2022-02-12,15:25:59,-300,45235841,felixmendoncajr,Félix Mendonça Jr.,,"@victordojornal @rodansilva @acmneto_ @depmarcelonilo Se tiver a oportunidade, claro que será. O PDT quer somar, participar ativamente do processo de construção de um novo projeto para a Bahia. Abraços, amigo!",pt,[],[],[],0,0,1,[],[],https://twitter.com/FelixMendoncaJr/status/1492565663709380613,False,,0,,,,,,,,"[{'screen_name': 'victordojornal', 'name': 'Victor Pinto', 'id': '65085982'}, {'screen_name': 'rodansilva', 'name': 'Rodrigo Daniel Silva', 'id': '70698293'}, {'screen_name': 'acmneto_', 'name': 'ACM Neto', 'id': '49966078'}]",,,,
1491947084307648513,1491908341102223361,2022-02-10 22:27:58 -0300,2022-02-10,22:27:58,-300,45235841,felixmendoncajr,Félix Mendonça Jr.,,"@2e92e99d5eda4e7 Claro, amigo. Temos, inclusive, uma vereadora do PDT aí na sua cidade que sempre está comigo. Estamos à disposição. Abs!",pt,[],[],[],0,1,3,[],[],https://twitter.com/FelixMendoncaJr/status/1491947084307648513,False,,0,,,,,,,,"[{'screen_name': '2e92e99d5eda4e7', 'name': 'cdaniel Com Ciro 12✊🌹', 'id': '2819904382'}]",,,,
