id,conversation_id,created_at,date,time,timezone,user_id,username,name,place,tweet,language,mentions,urls,photos,replies_count,retweets_count,likes_count,hashtags,cashtags,link,retweet,quote_url,video,thumbnail,near,geo,source,user_rt_id,user_rt,retweet_id,reply_to,retweet_date,translate,trans_src,trans_dest
1471824135516999688,1471824135516999688,2021-12-17 09:46:33 -0300,2021-12-17,09:46:33,-300,45235841,felixmendoncajr,Félix Mendonça Jr.,,"Defendi, no plenário da Câmara, a votação do projeto de reabertura de prazo para regularização de tributos do setor produtivo. Neste momento de crise, temos que ajudar aqueles que geram emprego e renda, e não os banqueiros e especuladores amigos do governo federal.  https://t.co/ZbK4HAHqjo",pt,[],[],[],1,1,5,[],[],https://twitter.com/FelixMendoncaJr/status/1471824135516999688,False,,1,https://pbs.twimg.com/ext_tw_video_thumb/1471823988800249859/pu/img/7EryV0rJNQvCG2lq.jpg,,,,,,,[],,,,
1471162764475486213,1471162764475486213,2021-12-15 13:58:30 -0300,2021-12-15,13:58:30,-300,45235841,felixmendoncajr,Félix Mendonça Jr.,,"Nós, do PDT, estamos acompanhando de perto o desenrolar dos fatos e confiamos totalmente em @cirogomes, que não tem uma denúncia sequer de corrupção em sua biografia política e sempre se portou como homem público íntegro, correto e corajoso.   #Ciro2022",pt,"[{'screen_name': 'cirogomes', 'name': 'ciro gomes', 'id': '33374761'}]",[],[],6,47,352,['ciro2022'],[],https://twitter.com/FelixMendoncaJr/status/1471162764475486213,False,,0,,,,,,,,[],,,,
1471162173376413702,1471162173376413702,2021-12-15 13:56:09 -0300,2021-12-15,13:56:09,-300,45235841,felixmendoncajr,Félix Mendonça Jr.,,"Sou a favor de que qualquer denúncia de corrupção seja investigada, é claro. Mas não podemos aceitar que a Polícia Federal seja usada como polícia política por um presidente da República. A ação que aconteceu hoje na casa de @cirogomes parece abusiva, autoritária e eleitoreira.",pt,"[{'screen_name': 'cirogomes', 'name': 'ciro gomes', 'id': '33374761'}]",[],[],18,100,895,[],[],https://twitter.com/FelixMendoncaJr/status/1471162173376413702,False,,0,,,,,,,,[],,,,
1470200119035314177,1470043889696395272,2021-12-12 22:13:18 -0300,2021-12-12,22:13:18,-300,45235841,felixmendoncajr,Félix Mendonça Jr.,,@andrepdt12 Triste ter que conviver com isso todos os dias. Mais triste ainda é saber que tem brasileiros e brasileiras que estão do lado dessa turma negacionista.,pt,[],[],[],0,1,3,[],[],https://twitter.com/FelixMendoncaJr/status/1470200119035314177,False,,0,,,,,,,,"[{'screen_name': 'andrepdt12', 'name': 'André Figueiredo🌹🇧🇷💉', 'id': '165922194'}]",,,,
1470144546784923648,1470144546784923648,2021-12-12 18:32:28 -0300,2021-12-12,18:32:28,-300,45235841,felixmendoncajr,Félix Mendonça Jr.,,Será que toda vez que o presidente vem à Bahia tem que haver episódios de agressão à imprensa? E por que quase sempre esses episódios envolvem repórteres mulheres? É revoltante! Minha solidariedade à imprensa e às mulheres que precisam lidar com esse governo troglodita.,pt,[],[],[],1,4,28,[],[],https://twitter.com/FelixMendoncaJr/status/1470144546784923648,False,,0,,,,,,,,[],,,,
1470034447554777097,1469713459260669954,2021-12-12 11:14:58 -0300,2021-12-12,11:14:58,-300,45235841,felixmendoncajr,Félix Mendonça Jr.,,"@TimeCiroGomes Estamos sorteando 20 lá no Instagram, além de camisas.",pt,[],[],[],1,3,7,[],[],https://twitter.com/FelixMendoncaJr/status/1470034447554777097,False,,0,,,,,,,,"[{'screen_name': 'TimeCiroGomes', 'name': 'Time Ciro Gomes', 'id': '131147985'}]",,,,
1469699306580029448,1469668776878747652,2021-12-11 13:03:15 -0300,2021-12-11,13:03:15,-300,45235841,felixmendoncajr,Félix Mendonça Jr.,,@RenatoRibeio Eu e o partido somos a favor do requerimento e que a proposta que veio do Senado seja pautada. Nós da oposição estamos pressionando o presidente da Câmara. Continuem fazendo o mesmo.,pt,[],[],[],1,1,1,[],[],https://twitter.com/FelixMendoncaJr/status/1469699306580029448,False,,0,,,,,,,,"[{'screen_name': 'RenatoRibeio', 'name': 'Renato', 'id': '1384107085361680386'}]",,,,
1469691940451110915,1469668776878747652,2021-12-11 12:33:58 -0300,2021-12-11,12:33:58,-300,45235841,felixmendoncajr,Félix Mendonça Jr.,,@RenatoRibeio Já existe o requerimento. O PDT assinou. Resta o presidente da Câmara pautar.,pt,[],[],[],1,0,2,[],[],https://twitter.com/FelixMendoncaJr/status/1469691940451110915,False,,0,,,,,,,,"[{'screen_name': 'RenatoRibeio', 'name': 'Renato', 'id': '1384107085361680386'}]",,,,
1469668776878747652,1469668776878747652,2021-12-11 11:01:56 -0300,2021-12-11,11:01:56,-300,45235841,felixmendoncajr,Félix Mendonça Jr.,,"Enfermeiras e enfermeiros estão na linha de frente do atendimento à saúde da população e, durante a pandemia, demonstraram mais uma vez que são fundamentais. Contem comigo nessa luta lá no Congresso. #aprovapl2564  https://t.co/souePnN7y7",pt,[],[],['https://pbs.twimg.com/media/FGVP9oYXEAoVLg6.jpg'],2,6,13,['aprovapl2564'],[],https://twitter.com/FelixMendoncaJr/status/1469668776878747652,False,,1,https://pbs.twimg.com/media/FGVP9oYXEAoVLg6.jpg,,,,,,,[],,,,
1469422074217304064,1469422074217304064,2021-12-10 18:41:37 -0300,2021-12-10,18:41:37,-300,45235841,felixmendoncajr,Félix Mendonça Jr.,,"Quero externar minha solidariedade às famílias que sofrem com as chuvas e enchentes que atingem o sul e extremo-sul da Bahia. Os governos do Estado e Federal precisam somar esforços e adotar medidas rápidas para ajudar os municípios atingidos, os desabrigados e suas famílias.",pt,[],[],[],0,3,15,[],[],https://twitter.com/FelixMendoncaJr/status/1469422074217304064,False,,0,,,,,,,,[],,,,
1468721478384467977,1468721478384467977,2021-12-08 20:17:42 -0300,2021-12-08,20:17:42,-300,45235841,felixmendoncajr,Félix Mendonça Jr.,,"A cada 1% de alta nos juros, o Brasil perde R$40 bi que deveriam ir para o setor produtivo, para geração de emprego e renda. Se estamos com inflação em alta, não é por causa do consumo, pois vivemos uma crise, mas sim por conta dos equívocos do próprio governo na economia.  https://t.co/PjsaoK46Xa",pt,[],[],['https://pbs.twimg.com/media/FGHyZm0WYAI0CWs.jpg'],2,4,9,[],[],https://twitter.com/FelixMendoncaJr/status/1468721478384467977,False,,1,https://pbs.twimg.com/media/FGHyZm0WYAI0CWs.jpg,,,,,,,[],,,,
1468407540841074688,1468365477428834304,2021-12-07 23:30:14 -0300,2021-12-07,23:30:14,-300,45235841,felixmendoncajr,Félix Mendonça Jr.,,"@Ryttah70 Fake, como sempre. Toma jeito!",pt,[],[],[],2,0,1,[],[],https://twitter.com/FelixMendoncaJr/status/1468407540841074688,False,,0,,,,,,,,"[{'screen_name': 'Ryttah70', 'name': 'Pátria Amada, Brasil!🇧🇷', 'id': '1051604155939377152'}]",,,,
1468365477428834304,1468365477428834304,2021-12-07 20:43:05 -0300,2021-12-07,20:43:05,-300,45235841,felixmendoncajr,Félix Mendonça Jr.,,A decisão do presidente de não seguir a orientação da Anvisa para exigir comprovante de vacinação para viajantes estrangeiros é de uma estupidez incrível. O negacionismo vai continuar colocando em risco a vida das pessoas até quando? Chega de fazer ideologia com a vacina.,pt,[],[],[],11,9,17,[],[],https://twitter.com/FelixMendoncaJr/status/1468365477428834304,False,,0,,,,,,,,[],,,,
1466916961162518536,1466897569984954373,2021-12-03 20:47:12 -0300,2021-12-03,20:47:12,-300,45235841,felixmendoncajr,Félix Mendonça Jr.,,@getuliofreitas8 @cirogomes Pelo Instagram @FelixMendoncaJr,pt,"[{'screen_name': 'felixmendoncajr', 'name': 'félix mendonça jr.', 'id': '45235841'}]",[],[],1,0,1,[],[],https://twitter.com/FelixMendoncaJr/status/1466916961162518536,False,,0,,,,,,,,"[{'screen_name': 'getuliofreitas8', 'name': 'Getúlio Freitas⚘⚘⚘', 'id': '1242276967463829504'}, {'screen_name': 'cirogomes', 'name': 'Ciro Gomes', 'id': '33374761'}]",,,,
1466897569984954373,1466897569984954373,2021-12-03 19:30:08 -0300,2021-12-03,19:30:08,-300,45235841,felixmendoncajr,Félix Mendonça Jr.,,"Um mimo de Natal com engajamento político. Estou sorteando no Instagram @felixmendoncajr livros do nosso futuro presidente @cirogomes, além de camisas #PrefiroCiro. Confere lá na página como participar.   #CIROGAMES  #CiroAvisou  #ciro  #PrefiroCiro  https://t.co/vxG7ZJiAPY",pt,"[{'screen_name': 'felixmendoncajr', 'name': 'félix mendonça jr.', 'id': '45235841'}, {'screen_name': 'cirogomes', 'name': 'ciro gomes', 'id': '33374761'}]",[],['https://pbs.twimg.com/media/FFt3kFbXoAECdph.jpg'],30,20,64,"['prefirociro', 'cirogames', 'ciroavisou', 'ciro', 'prefirociro']",[],https://twitter.com/FelixMendoncaJr/status/1466897569984954373,False,,1,https://pbs.twimg.com/media/FFt3kFbXoAECdph.jpg,,,,,,,[],,,,
1466078525287510019,1466078525287510019,2021-12-01 13:15:33 -0300,2021-12-01,13:15:33,-300,45235841,felixmendoncajr,Félix Mendonça Jr.,,Eu também acredito!   #ciroavisou,pt,[],[],[],27,13,55,['ciroavisou'],[],https://twitter.com/FelixMendoncaJr/status/1466078525287510019,False,https://twitter.com/cartacapital/status/1466004126630883339,0,,,,,,,,[],,,,
1466061690785734658,1466061690785734658,2021-12-01 12:08:39 -0300,2021-12-01,12:08:39,-300,45235841,felixmendoncajr,Félix Mendonça Jr.,,"Tive uma reunião com o presidente do @Sindipol_BA, José Mário, e reafirmei a posição contrária do PDT à reforma administrativa. Também tratamos da emenda de R$100 milhões que estou destinando à PF, apresentada por meio da Comissâo de Constituição e Justiça da Cámara.  #PEC32Nao  https://t.co/8c9sKJEihM",pt,"[{'screen_name': 'sindipol_ba', 'name': 'sindipol/ba', 'id': '2855588451'}]",[],['https://pbs.twimg.com/media/FFh_Vn9XoAUh0UA.jpg'],10,0,4,['pec32nao'],[],https://twitter.com/FelixMendoncaJr/status/1466061690785734658,False,,1,https://pbs.twimg.com/media/FFh_Vn9XoAUh0UA.jpg,,,,,,,[],,,,
1464605074278264835,1464597077216972810,2021-11-27 11:40:35 -0300,2021-11-27,11:40:35,-300,45235841,felixmendoncajr,Félix Mendonça Jr.,,"@MonkeyBooks94 @cirogomes Já fizemos isso, amigo. Abraços!",pt,[],[],[],1,0,2,[],[],https://twitter.com/FelixMendoncaJr/status/1464605074278264835,False,,0,,,,,,,,"[{'screen_name': 'cirogomes', 'name': 'Ciro Gomes', 'id': '33374761'}]",,,,
1464597077216972810,1464597077216972810,2021-11-27 11:08:48 -0300,2021-11-27,11:08:48,-300,45235841,felixmendoncajr,Félix Mendonça Jr.,,"Em entrevista para o programa Frequência Política, da Rádio Interativa de Itabuna, no sul da Bahia, falei que @cirogomes é o único candidato que desafia o sistema financeiro e ataca a alta de juros do país. É o único que tem coragem de falar a verdade e desafiar o establishment.",pt,"[{'screen_name': 'cirogomes', 'name': 'ciro gomes', 'id': '33374761'}]",[],[],30,110,709,[],[],https://twitter.com/FelixMendoncaJr/status/1464597077216972810,False,,0,,,,,,,,[],,,,
1463989819017682950,1463989819017682950,2021-11-25 18:55:47 -0300,2021-11-25,18:55:47,-300,45235841,felixmendoncajr,Félix Mendonça Jr.,,Convidei hoje @_leokret para se filiar ao PDT e ser candidata em 2022. Será que ela vai aceitar? Mais novidades em breve...  https://t.co/mPmBbxbAnH,pt,"[{'screen_name': '_leokret', 'name': 'léo kret do brasil', 'id': '129862871'}]",[],['https://pbs.twimg.com/media/FFEi-z2WUAQHKuR.jpg'],12,9,142,[],[],https://twitter.com/FelixMendoncaJr/status/1463989819017682950,False,,1,https://pbs.twimg.com/media/FFEi-z2WUAQHKuR.jpg,,,,,,,[],,,,
1463636084865253385,1463636084865253385,2021-11-24 19:30:10 -0300,2021-11-24,19:30:10,-300,45235841,felixmendoncajr,Félix Mendonça Jr.,,"O maior responsável pela elevação inflacionária é o próprio governo, que gasta mal os recursos públicos, não altera a política de preços praticada pela Petrobras sobre os combustíveis e não tem capacidade de diálogo nacional ou internacional. Precisamos mudar isso!",pt,[],[],[],4,0,7,[],[],https://twitter.com/FelixMendoncaJr/status/1463636084865253385,False,,0,,,,,,,,[],,,,
1463636000329064455,1463636000329064455,2021-11-24 19:29:50 -0300,2021-11-24,19:29:50,-300,45235841,felixmendoncajr,Félix Mendonça Jr.,,"Além disso, justificar os aumentos da taxa Selic como instrumento de combate à inflação é um engodo, já que não temos elevação do consumo, pois o cenário é de crise econômica e social no Brasil.",pt,[],[],[],1,0,2,[],[],https://twitter.com/FelixMendoncaJr/status/1463636000329064455,False,,0,,,,,,,,[],,,,
1463635763321610242,1463635763321610242,2021-11-24 19:28:53 -0300,2021-11-24,19:28:53,-300,45235841,felixmendoncajr,Félix Mendonça Jr.,,"A política de alta dos juros adotada por este governo prejudica trabalhadores e o setor produtivo. Só quem ganha 💲 com isso é o sistema financeiro e os especuladores, inclusive aqueles com importantes cargos públicos.  https://t.co/fNWBwPByIX",pt,[],[],[],2,1,6,[],[],https://twitter.com/FelixMendoncaJr/status/1463635763321610242,False,,1,https://pbs.twimg.com/ext_tw_video_thumb/1463635744791093257/pu/img/2DevEMb5BCht7_OL.jpg,,,,,,,[],,,,
1462054469877878789,1462054469877878789,2021-11-20 10:45:23 -0300,2021-11-20,10:45:23,-300,45235841,felixmendoncajr,Félix Mendonça Jr.,,"Quem é verdadeiramente patriota sabe que a luta contra o racismo é de todos nós, e deve ser praticada no dia a dia. Só assim poderemos ter um Brasil com igualdade de oportunidades e sem preconceito.   #dianacionaldaconsciêncianegra #20denovembro  https://t.co/EomHKedJtU",pt,[],[],['https://pbs.twimg.com/media/FEpCykuXIAANIjz.jpg'],4,3,6,"['dianacionaldaconsciêncianegra', '20denovembro']",[],https://twitter.com/FelixMendoncaJr/status/1462054469877878789,False,,1,https://pbs.twimg.com/media/FEpCykuXIAANIjz.jpg,,,,,,,[],,,,
1461404593989038099,1461404593989038099,2021-11-18 15:43:01 -0300,2021-11-18,15:43:01,-300,45235841,felixmendoncajr,Félix Mendonça Jr.,,Debate sobre a dívida pública brasileira agora na Câmara. Confere lá:   https://t.co/JM0iANyKe9,pt,[],['https://www.youtube.com/watch?v=QItiYRRzT7E'],[],1,1,2,[],[],https://twitter.com/FelixMendoncaJr/status/1461404593989038099,False,,0,,,,,,,,[],,,,
1461127924892024832,1461127924892024832,2021-11-17 21:23:38 -0300,2021-11-17,21:23:38,-300,45235841,felixmendoncajr,Félix Mendonça Jr.,,"Um dos trabalhos mais gratificantes que tenho como deputado é ajudar municípios que fazem um trabalho sério e aplicam bem os recursos públicos. É o caso de Barra do Rocha, gerida pelo meu parceiro de PDT José Luiz. Asseguramos mais R$1 milhão para pavimentação na cidade.  https://t.co/9YjeYCMQFA",pt,[],[],['https://pbs.twimg.com/media/FEb4GoiXMA0Pek_.jpg'],1,4,15,[],[],https://twitter.com/FelixMendoncaJr/status/1461127924892024832,False,,1,https://pbs.twimg.com/media/FEb4GoiXMA0Pek_.jpg,,,,,,,[],,,,
1453843168940765198,1453843168940765198,2021-10-28 18:56:37 -0300,2021-10-28,18:56:37,-300,45235841,felixmendoncajr,Félix Mendonça Jr.,,O preço dos combustíveis subindo em disparada. Os juros cada vez mais altos. O país vive uma recessão profunda. Tem gente passando fome. E tem político incomodado com a sexualidade do Super-Homem? É demais para mim. Deixa essa questão para Lois Lane e companhia e vamos trabalhar!,pt,[],[],[],108,5,30,[],[],https://twitter.com/FelixMendoncaJr/status/1453843168940765198,False,,0,,,,,,,,[],,,,
1453512799028662278,1453512799028662278,2021-10-27 21:03:50 -0300,2021-10-27,21:03:50,-300,45235841,felixmendoncajr,Félix Mendonça Jr.,,"Num momento em que os brasileiros sofrem com os aumentos abusivos dos preços dos combustíveis e dos itens mais básicos, e estão indo às ruas protestar, o Banco Central decide enriquecer ainda mais os banqueiros e os especuladores. Estão debochando do povo. Vão se queimar...  https://t.co/k3J6Zs5mFP",pt,[],[],['https://pbs.twimg.com/media/FCvqL9dWEAk58vd.jpg'],3,4,7,[],[],https://twitter.com/FelixMendoncaJr/status/1453512799028662278,False,,1,https://pbs.twimg.com/media/FCvqL9dWEAk58vd.jpg,,,,,,,[],,,,
1453473165464809481,1453473165464809481,2021-10-27 18:26:21 -0300,2021-10-27,18:26:21,-300,45235841,felixmendoncajr,Félix Mendonça Jr.,,"Reunião da bancada baiana na @camaradeputados hoje, em Brasília, discutiu a apresentação de emendas para o estado e os municípios no orçamento da União. Defendi, como sempre, mais verbas para áreas como educação e saúde.   #PDT  https://t.co/IDP7EiuIZ3",pt,"[{'screen_name': 'camaradeputados', 'name': 'câmara dos deputados', 'id': '61843152'}]",[],['https://pbs.twimg.com/media/FCvGI-vXMAA55xS.jpg'],1,0,9,['pdt'],[],https://twitter.com/FelixMendoncaJr/status/1453473165464809481,False,,1,https://pbs.twimg.com/media/FCvGI-vXMAA55xS.jpg,,,,,,,[],,,,
1453062395346173967,1453062395346173967,2021-10-26 15:14:06 -0300,2021-10-26,15:14:06,-300,45235841,felixmendoncajr,Félix Mendonça Jr.,,"Hoje tem #CIROGAMES com a presença do ex-prefeito @acmneto_ no papo com @cirogomes, a partir das 19h30. Estamos construindo um novo caminho para o Brasil e a Bahia, o que envolve diálogo, entendimento e convergência. Temos que nos unir contra o continuísmo e o retrocesso.  https://t.co/fuQK3b1WZG",pt,"[{'screen_name': 'acmneto_', 'name': 'acm neto', 'id': '49966078'}, {'screen_name': 'cirogomes', 'name': 'ciro gomes', 'id': '33374761'}]",[],['https://pbs.twimg.com/media/FCpQjCmX0AchAbW.jpg'],5,24,114,['cirogames'],[],https://twitter.com/FelixMendoncaJr/status/1453062395346173967,False,,1,https://pbs.twimg.com/media/FCpQjCmX0AchAbW.jpg,,,,,,,[],,,,
1451536798962884612,1451536798962884612,2021-10-22 10:11:55 -0300,2021-10-22,10:11:55,-300,45235841,felixmendoncajr,Félix Mendonça Jr.,,"Em entrevista hoje para a rádio Salvador FM, disse que @cirogomes é a segunda via, e não terceira. Isso porque Bolsonaro e Lula representam uma única via, que já foi testada e reprovada. Os dois são farinhas do mesmo saco. Não queremos mais ladroagem, rachadinha e incompetência.  https://t.co/lVO4cP9f5e",pt,"[{'screen_name': 'cirogomes', 'name': 'ciro gomes', 'id': '33374761'}]",[],['https://pbs.twimg.com/media/FCTlBoaXEAY93jh.jpg'],31,123,681,[],[],https://twitter.com/FelixMendoncaJr/status/1451536798962884612,False,,1,https://pbs.twimg.com/media/FCTlBoaXEAY93jh.jpg,,,,,,,[],,,,
1448788387104804866,1448760321779326984,2021-10-14 20:10:43 -0300,2021-10-14,20:10:43,-300,45235841,felixmendoncajr,Félix Mendonça Jr.,,"@franzrotter O problema na Bahia não é baixa arrecadação, e sim gastar mal o que arrecada. No Ranking de Competitividade dos Estados, o único item em que a Bahia vai bem é na arrecadação. Mas vai mal nos demais, como segurança e educação. Sinal de que gasta mal.",pt,[],[],[],0,0,0,[],[],https://twitter.com/FelixMendoncaJr/status/1448788387104804866,False,,0,,,,,,,,"[{'screen_name': 'franzrotter', 'name': 'Frotter 🇾🇪', 'id': '84647892'}]",,,,
1448787126703775744,1448760244121788416,2021-10-14 20:05:42 -0300,2021-10-14,20:05:42,-300,45235841,felixmendoncajr,Félix Mendonça Jr.,,"@T0N13T0 @rmespindola Quanto mais alto os juros, mais alto os governos pagam aos bancos por financiamentos e empréstimos. Quanto mais alto os juros, maior é a dívida pública, e todos pagam a conta. Recomendo que estude um pouco mais economia. E parabéns por considerar juros de 9% aceitáveis. Tá bem!",pt,[],[],[],1,0,0,[],[],https://twitter.com/FelixMendoncaJr/status/1448787126703775744,False,,0,,,,,,,,"[{'screen_name': 'T0N13T0', 'name': 'T0N13T0 🇧🇷🇺🇸🇮🇱🇨🇴🇨🇱🏴\U000e0067\U000e0062\U000e0065\U000e006e\U000e0067\U000e007f', 'id': '201983952'}, {'screen_name': 'rmespindola', 'name': 'Ronaldo Martins 🌹🚜🌹', 'id': '86721541'}]",,,,
1448781265080102912,1448760321779326984,2021-10-14 19:42:25 -0300,2021-10-14,19:42:25,-300,45235841,felixmendoncajr,Félix Mendonça Jr.,,"@LcioFlvioRamos1 Não se trata de apontar quem é o vilão. Se trata de uma medida que pode ajudar a amenizar o problema. E que está longe de ser definitiva, como pontuei.",pt,[],[],[],1,0,0,[],[],https://twitter.com/FelixMendoncaJr/status/1448781265080102912,False,,0,,,,,,,,"[{'screen_name': 'LcioFlvioRamos1', 'name': '😳🧐🇧🇷Ramos#precisamosirprasruasbasta!', 'id': '1342208449208332289'}]",,,,
1448780741261864968,1448760321779326984,2021-10-14 19:40:20 -0300,2021-10-14,19:40:20,-300,45235841,felixmendoncajr,Félix Mendonça Jr.,,"@cid_pistola Para isso teria que mudar a política de preços da estatal, que segue a cotação em dólar do barril se petróleo. Concordo que o esforço tem que ser conjunto.",pt,[],[],[],1,0,1,[],[],https://twitter.com/FelixMendoncaJr/status/1448780741261864968,False,,0,,,,,,,,"[{'screen_name': 'cid_pistola', 'name': 'CID PISTOLA🌹O 🇧🇷 vai dar certo!', 'id': '1082016434727854080'}]",,,,
1448780237332942849,1448760244121788416,2021-10-14 19:38:20 -0300,2021-10-14,19:38:20,-300,45235841,felixmendoncajr,Félix Mendonça Jr.,,"@marcioraz O povo está pagando a conta é agora, com altos impostos. O que aprovamos vai reduzir impostos. Se informa um pouco melhor...",pt,[],[],[],2,0,0,[],[],https://twitter.com/FelixMendoncaJr/status/1448780237332942849,False,,0,,,,,,,,"[{'screen_name': 'marcioraz', 'name': 'Marcio Rosa', 'id': '45476301'}]",,,,
1448779609173024768,1448760244121788416,2021-10-14 19:35:50 -0300,2021-10-14,19:35:50,-300,45235841,felixmendoncajr,Félix Mendonça Jr.,,"@Suzane520 @rmespindola A taxa deve fechar o ano em até 9%, enquanto outros países estão com taxa zero ou até negativa para enfrentar a recessão. O Brasil está na contramão quando o assunto é política econômica.",pt,[],[],[],1,0,0,[],[],https://twitter.com/FelixMendoncaJr/status/1448779609173024768,False,,0,,,,,,,,"[{'screen_name': 'Suzane520', 'name': 'Suzane', 'id': '1104954753501532161'}, {'screen_name': 'rmespindola', 'name': 'Ronaldo Martins 🌹🚜🌹', 'id': '86721541'}]",,,,
1448778997060575234,1448760244121788416,2021-10-14 19:33:24 -0300,2021-10-14,19:33:24,-300,45235841,felixmendoncajr,Félix Mendonça Jr.,,@FabioAleluia2 Na Câmara se fez o cálculo de que a redução será de até 8%. Foi divulgado.,pt,[],[],[],2,0,0,[],[],https://twitter.com/FelixMendoncaJr/status/1448778997060575234,False,,0,,,,,,,,"[{'screen_name': 'FabioAleluia2', 'name': 'Fabio Aleluia', 'id': '1012005650560413697'}]",,,,
1448768926243074058,1448760244121788416,2021-10-14 18:53:23 -0300,2021-10-14,18:53:23,-300,45235841,felixmendoncajr,Félix Mendonça Jr.,,@marcioraz Discurso para boi dormir. Os Estados bateram recorde de arrecadação em 2021 e mesmo assim investiram menos em educação. Todos precisam dar a sua contribuição.,pt,[],[],[],1,0,0,[],[],https://twitter.com/FelixMendoncaJr/status/1448768926243074058,False,,0,,,,,,,,"[{'screen_name': 'marcioraz', 'name': 'Marcio Rosa', 'id': '45476301'}]",,,,
1448768232933007361,1448760244121788416,2021-10-14 18:50:38 -0300,2021-10-14,18:50:38,-300,45235841,felixmendoncajr,Félix Mendonça Jr.,,"@rmespindola Não estou dizendo que a culpa é do ICMS. O problema, no fundo, é a política econômica deste governo que, assim como os governos petistas, elevou juros para enriquecer banqueiros. Mas o fato é que ações precisam ser feitas com urgência para reduzir os preços.",pt,[],[],[],7,0,27,[],[],https://twitter.com/FelixMendoncaJr/status/1448768232933007361,False,,0,,,,,,,,"[{'screen_name': 'rmespindola', 'name': 'Ronaldo Martins 🌹🚜🌹', 'id': '86721541'}]",,,,
1448760321779326984,1448760321779326984,2021-10-14 18:19:12 -0300,2021-10-14,18:19:12,-300,45235841,felixmendoncajr,Félix Mendonça Jr.,,"Hoje, o ICMS é variável e depende do preço médio do produto vendido ao consumidor. Esperamos que o governador da Bahia faça sua parte e, além de não entrar na Justiça contra esse projeto, reduza a alíquota do ICMS, já que o estado teve aumento de arrecadação em 2021.",pt,[],[],[],7,7,37,[],[],https://twitter.com/FelixMendoncaJr/status/1448760321779326984,False,,0,,,,,,,,[],,,,
1448760244121788416,1448760244121788416,2021-10-14 18:18:53 -0300,2021-10-14,18:18:53,-300,45235841,felixmendoncajr,Félix Mendonça Jr.,,"Precisamos de soluções urgentes, mesmo que não sejam definitivas, para reduzir o preço dos combustíveis. Por isso, votei a favor da proposta que muda a tributação do ICMS, aprovada ontem na Câmara. Pela proposta, o valor passa a ser fixo, com alíquotas definidas pelos estados.  https://t.co/egtBUe0leN",pt,[],[],['https://pbs.twimg.com/media/FBsHw2SWYAMYC8s.jpg'],14,1,25,[],[],https://twitter.com/FelixMendoncaJr/status/1448760244121788416,False,,1,https://pbs.twimg.com/media/FBsHw2SWYAMYC8s.jpg,,,,,,,[],,,,
1448451194280628224,1448451194280628224,2021-10-13 21:50:50 -0300,2021-10-13,21:50:50,-300,45235841,felixmendoncajr,Félix Mendonça Jr.,,"A arrecadação da Bahia com o ICMS sobre os combustíveis cresceu bastante na comparação com 2019. Então, por que não reduzir o ICMS para estimular a economia e combater a pobreza? Fiz essa pergunta ao governador em entrevista para uma rádio do sul do estado.  https://t.co/gUi0ZQmdbm",pt,[],[],[],0,3,6,[],[],https://twitter.com/FelixMendoncaJr/status/1448451194280628224,False,,1,https://pbs.twimg.com/ext_tw_video_thumb/1448451112382652417/pu/img/9hD3Oi3gOUgGvN-R.jpg,,,,,,,[],,,,
1448413077372915714,1448413077372915714,2021-10-13 19:19:22 -0300,2021-10-13,19:19:22,-300,45235841,felixmendoncajr,Félix Mendonça Jr.,,"Segue o link para conferir a íntegra da minha entrevista sobre @cirogomes no programa Direto da Redação, transmitido pela revista @cartacapital no YouTube. A entrevista está no início do programa.    https://t.co/RFnrCha8Be",pt,"[{'screen_name': 'cirogomes', 'name': 'ciro gomes', 'id': '33374761'}, {'screen_name': 'cartacapital', 'name': 'cartacapital', 'id': '16632084'}]",['https://m.youtube.com/watch?v=F_y8uGO9GTc'],[],1,3,13,[],[],https://twitter.com/FelixMendoncaJr/status/1448413077372915714,False,,0,,,,,,,,[],,,,
