id,conversation_id,created_at,date,time,timezone,user_id,username,name,place,tweet,language,mentions,urls,photos,replies_count,retweets_count,likes_count,hashtags,cashtags,link,retweet,quote_url,video,thumbnail,near,geo,source,user_rt_id,user_rt,retweet_id,reply_to,retweet_date,translate,trans_src,trans_dest
1182012737972518912,1182012734835220481,2019-10-09 16:19:32 -0300,2019-10-09,16:19:32,-300,45235841,felixmendoncajr,Félix Mendonça Jr.,,Essa degradação inviabiliza a sustentabilidade das atividades agropecuárias e afeta os indicadores socioeconômicos das regiões onde se localizam.   Agora o PL segue para análise da CCJ.  #FélixMendonçaJr #Felixjr #pdt #pdtbahia #pdtnacâmara #bahia #codevasf #sustentabilidade,pt,[],[],[],0,1,2,"['félixmendonçajr', 'felixjr', 'pdt', 'pdtbahia', 'pdtnacâmara', 'bahia', 'codevasf', 'sustentabilidade']",[],https://twitter.com/FelixMendoncaJr/status/1182012737972518912,False,,0,,,,,,,,[],,,,
1182012736747851777,1182012734835220481,2019-10-09 16:19:31 -0300,2019-10-09,16:19:31,-300,45235841,felixmendoncajr,Félix Mendonça Jr.,,"Meu objetivo com esse Projeto é ampliar a área de atuação da Codevasf, elevando a qualidade dos recursos hídricos e estimulando a adoção de políticas preventivas nesses cinco rios que atravessam o território baiano e passam por uma crescente degradação ambiental.",pt,[],[],[],3,1,6,[],[],https://twitter.com/FelixMendoncaJr/status/1182012736747851777,False,,0,,,,,,,,[],,,,
1182012734835220481,1182012734835220481,2019-10-09 16:19:31 -0300,2019-10-09,16:19:31,-300,45235841,felixmendoncajr,Félix Mendonça Jr.,,"O Projeto de lei (PL 8.570/17), de minha autoria, que visa a inclusão das bacias dos rios de Contas, Subaé, Jequitinhonha, Jiquiriçá e Mucuri no ‘guarda-chuva’ da Codevasf, foi aprovado na Comissão da Amazônia, Integração Nacional e de Desenvolvimento Regional.  https://t.co/klEgbXoHML",pt,[],[],['https://pbs.twimg.com/media/EGdaUKHX0AEEqrd.jpg'],1,2,9,[],[],https://twitter.com/FelixMendoncaJr/status/1182012734835220481,False,,1,https://pbs.twimg.com/media/EGdaUKHX0AEEqrd.jpg,,,,,,,[],,,,
1179890387760091136,1179890384354320384,2019-10-03 19:46:04 -0300,2019-10-03,19:46:04,-300,45235841,felixmendoncajr,Félix Mendonça Jr.,,"Para mim, o conceito de mobilidade urbana é mais abrangente do que estes dois e gera um grande impacto, sendo hoje a principal referência para as políticas de transporte e circulação. #CâmaradosDeputados #PDT #PDTnaCâmara #mobilidadeurbana #transporte #circulação #FelixMendonçaJr",pt,[],[],[],1,1,3,"['câmaradosdeputados', 'pdt', 'pdtnacâmara', 'mobilidadeurbana', 'transporte', 'circulação', 'felixmendonçajr']",[],https://twitter.com/FelixMendoncaJr/status/1179890387760091136,False,,0,,,,,,,,[],,,,
1179890386065612803,1179890384354320384,2019-10-03 19:46:03 -0300,2019-10-03,19:46:03,-300,45235841,felixmendoncajr,Félix Mendonça Jr.,,"Atualmente, o Estatuto da Cidade determina que o EIV deve levar em conta, entre outros aspectos, o impacto do empreendimento na geração de tráfego e demanda por transporte público.",pt,[],[],[],3,1,4,[],[],https://twitter.com/FelixMendoncaJr/status/1179890386065612803,False,,0,,,,,,,,[],,,,
1179890384354320384,1179890384354320384,2019-10-03 19:46:03 -0300,2019-10-03,19:46:03,-300,45235841,felixmendoncajr,Félix Mendonça Jr.,,"A Comissão de Constituição e Justiça da Câmara aprovou um projeto (PL 5011/16) de minha autoria, que visa incluir o impacto na mobilidade urbana como um dos tópicos a serem analisados pelo Estudo de Impacto de Vizinhança (EIV). A proposta altera o Estatuto das Cidades (10.257/01)",pt,[],[],[],2,1,3,[],[],https://twitter.com/FelixMendoncaJr/status/1179890384354320384,False,,0,,,,,,,,[],,,,
1179771838903152640,1179771838903152640,2019-10-03 11:55:00 -0300,2019-10-03,11:55:00,-300,45235841,felixmendoncajr,Félix Mendonça Jr.,,"Participei ontem de uma homenagem aos líderes da bancada do PDT na Câmara. Na oportunidade, afixamos, na na liderança do PDT, uma galeria de fotos com todos os deputados que estiveram à frente da condução dos…  https://t.co/UsutJm98N6",pt,[],['https://www.instagram.com/p/B3KP-jfAiQo/?igshid=151svl6wsa7js'],[],1,1,2,[],[],https://twitter.com/FelixMendoncaJr/status/1179771838903152640,False,,0,,,,,,,,[],,,,
1179766688792944643,1179766685202558976,2019-10-03 11:34:32 -0300,2019-10-03,11:34:32,-300,45235841,felixmendoncajr,Félix Mendonça Jr.,,"O governo hoje defende uma série de reformas, mudanças, cortes e contingenciamentos em diversas áreas, amparados na justificativa da economia, mas não podemos discutir a questão da economia brasileira sem olhar para a dívida pública.",pt,[],[],[],0,0,4,[],[],https://twitter.com/FelixMendoncaJr/status/1179766688792944643,False,,0,,,,,,,,[],,,,
1179766687345893376,1179766685202558976,2019-10-03 11:34:31 -0300,2019-10-03,11:34:31,-300,45235841,felixmendoncajr,Félix Mendonça Jr.,,"Nosso objetivo é atualizar os dados sobre essa questão, identificando os fatores de evolução do endividamento público e a gestão da política monetária, além de analisar o papel do Congresso Nacional na fiscalização da dívida pública.",pt,[],[],[],1,1,4,[],[],https://twitter.com/FelixMendoncaJr/status/1179766687345893376,False,,0,,,,,,,,[],,,,
1179766685202558976,1179766685202558976,2019-10-03 11:34:31 -0300,2019-10-03,11:34:31,-300,45235841,felixmendoncajr,Félix Mendonça Jr.,,"Participando neste momento da 1ª Sessão Legislativa Ordinária do @CEDESCAMARA com a temática ""A Dívida Pública Brasileira: um novo estudo"", de minha autoria e do deputado @denisbezerra  https://t.co/cBpirYtxue",pt,"[{'screen_name': 'cedescamara', 'name': 'cedes', 'id': '1372897238'}, {'screen_name': 'denisbezerra', 'name': 'denis bezerra', 'id': '14513609'}]",[],['https://pbs.twimg.com/media/EF9fiz4XoAAEK2P.jpg'],1,1,4,[],[],https://twitter.com/FelixMendoncaJr/status/1179766685202558976,False,,1,https://pbs.twimg.com/media/EF9fiz4XoAAEK2P.jpg,,,,,,,[],,,,
1179065271497179137,1179065271497179137,2019-10-01 13:07:21 -0300,2019-10-01,13:07:21,-300,45235841,felixmendoncajr,Félix Mendonça Jr.,,"Hoje é dia de parabenizar aqueles que lutam pelos interesses dos nossos municípios. 🤜🤛Deixo aqui meus parabéns aos vereadores e vereadoras baianas, em especial aos meus amigos e amigas do PDT 🌹. #FélixMendonçaJr #FélixJr #PDT #PDTBahia #PDTnacaâmara #vereadores #vereador  https://t.co/u7H6TxOQ2c",pt,[],[],['https://pbs.twimg.com/media/EFzhnX5XkAIWOey.jpg'],1,2,6,"['félixmendonçajr', 'félixjr', 'pdt', 'pdtbahia', 'pdtnacaâmara', 'vereadores', 'vereador']",[],https://twitter.com/FelixMendoncaJr/status/1179065271497179137,False,,1,https://pbs.twimg.com/media/EFzhnX5XkAIWOey.jpg,,,,,,,[],,,,
1177304730269298689,1177304728369278976,2019-09-26 16:31:35 -0300,2019-09-26,16:31:35,-300,45235841,felixmendoncajr,Félix Mendonça Jr.,,"Recentemente, acompanhamos sucessivos cortes no orçamento que impactaram nas bolsas de pesquisa do CNPq. Precisamos encontrar uma solução para a questão e os bancos públicos podem e devem contribuir com esse processo.",pt,[],[],[],0,3,6,[],[],https://twitter.com/FelixMendoncaJr/status/1177304730269298689,False,,0,,,,,,,,[],,,,
1177304728369278976,1177304728369278976,2019-09-26 16:31:35 -0300,2019-09-26,16:31:35,-300,45235841,felixmendoncajr,Félix Mendonça Jr.,,"Na reunião de ontem da CCTCI, solicitei a realização de uma audiência pública com o objetivo de debater a participação dos bancos públicos no fomento à ciência, tecnologia e inovação no nosso país. Esse é um assunto importante que precisa ser discutido com a população.",pt,[],[],[],2,2,8,[],[],https://twitter.com/FelixMendoncaJr/status/1177304728369278976,False,,0,,,,,,,,[],,,,
1169290383538425856,1169290383538425856,2019-09-04 13:45:26 -0300,2019-09-04,13:45:26,-300,45235841,felixmendoncajr,Félix Mendonça Jr.,,"Sempre que se sentir no meio de um turbilhão de sentimentos ruins, converse, coloque para fora. Organize os pensamentos com ajuda de alguém, mesmo que seja um desconhecido. Depressão é coisa séria! Ligue para o CVV no número 188. #setembroamarelo #suicídio #depressão #cvv  https://t.co/BCCwlG5bZw",pt,[],[],['https://pbs.twimg.com/media/EDonaBLXoAInwHV.jpg'],2,1,4,"['setembroamarelo', 'suicídio', 'depressão', 'cvv']",[],https://twitter.com/FelixMendoncaJr/status/1169290383538425856,False,,1,https://pbs.twimg.com/media/EDonaBLXoAInwHV.jpg,,,,,,,[],,,,
1169044647773163522,1169044647773163522,2019-09-03 21:28:58 -0300,2019-09-03,21:28:58,-300,45235841,felixmendoncajr,Félix Mendonça Jr.,,"Noite produtiva em Brasília. Me reuni há pouco com o Procurador-Geral do Trabalho, Alberto Balazeiro, o subprocurador-geral do Trabalho Jeferson Coelho, os procuradores do Trabalho Luís Carneiro , Marcelo Brandão e Luciano Aragão e os colegas deputados João Roma e Daniel Almeida  https://t.co/k8lQz1MI1m",pt,[],[],"['https://pbs.twimg.com/media/EDlH4u3XoAE2zfu.jpg', 'https://pbs.twimg.com/media/EDlH4u2XUAA1kgm.jpg']",1,0,3,[],[],https://twitter.com/FelixMendoncaJr/status/1169044647773163522,False,,1,https://pbs.twimg.com/media/EDlH4u3XoAE2zfu.jpg,,,,,,,[],,,,
1168979005183340544,1168979003753082882,2019-09-03 17:08:08 -0300,2019-09-03,17:08:08,-300,45235841,felixmendoncajr,Félix Mendonça Jr.,,"Com esse projeto, empresas de pequeno porte que estiverem sem atividade há mais de 3 anos poderão dar baixa gratuita e automática, a não ser que o proprietário comunique que deseja manter a atividade. Nosso país precisa de menos burocracia 🤝",pt,[],[],[],0,1,6,[],[],https://twitter.com/FelixMendoncaJr/status/1168979005183340544,False,,0,,,,,,,,[],,,,
1168979003753082882,1168979003753082882,2019-09-03 17:08:07 -0300,2019-09-03,17:08:07,-300,45235841,felixmendoncajr,Félix Mendonça Jr.,,"O PLC 198/2015, de minha autoria, que visa desburocratizar o fechamento de empresas está na ordem do dia para votação no plenário do Senado. Vamos acompanhar!  #projetodelei #câmarafederal #deputadofederal #plc #burocracia #pequenasempresas #félixmendonçajr",pt,[],[],[],4,5,16,"['projetodelei', 'câmarafederal', 'deputadofederal', 'plc', 'burocracia', 'pequenasempresas', 'félixmendonçajr']",[],https://twitter.com/FelixMendoncaJr/status/1168979003753082882,False,,0,,,,,,,,[],,,,
1168961904666128384,1168961901654679558,2019-09-03 16:00:10 -0300,2019-09-03,16:00:10,-300,45235841,felixmendoncajr,Félix Mendonça Jr.,,"Para tentar minimizar esses dados, propus junto com o deputado @JoaoCampos uma emenda para impedir que o Governo corte ou contingencie verbas de educação destinadas ao setor de ciência e tecnologia.",pt,"[{'screen_name': 'joaocampos', 'name': 'joão campos', 'id': '1112804630453501953'}]",[],[],0,1,5,[],[],https://twitter.com/FelixMendoncaJr/status/1168961904666128384,False,,0,,,,,,,,[],,,,
1168961903231676422,1168961901654679558,2019-09-03 16:00:10 -0300,2019-09-03,16:00:10,-300,45235841,felixmendoncajr,Félix Mendonça Jr.,,Educação deveria ser tratada com mais cuidado no nosso país. Diversos pesquisadores que dependem da bolsa do CNPq estão prestes a ficar sem recursos para seguir com seu trabalho.,pt,[],[],[],2,0,4,[],[],https://twitter.com/FelixMendoncaJr/status/1168961903231676422,False,,0,,,,,,,,[],,,,
1168961901654679558,1168961901654679558,2019-09-03 16:00:10 -0300,2019-09-03,16:00:10,-300,45235841,felixmendoncajr,Félix Mendonça Jr.,, https://t.co/aow9ALZiiq,und,[],['https://www.todabahia.com.br/emenda-proposta-por-felix-garante-recursos-para-o-setor-de-ciencia-e-tecnologia/'],[],2,1,4,[],[],https://twitter.com/FelixMendoncaJr/status/1168961901654679558,False,,0,,,,,,,,[],,,,
1146450810026504192,1146450810026504192,2019-07-03 13:09:07 -0300,2019-07-03,13:09:07,-300,45235841,felixmendoncajr,Félix Mendonça Jr.,,#AReformaTeEngana,und,[],[],[],5,1,6,['areformateengana'],[],https://twitter.com/FelixMendoncaJr/status/1146450810026504192,False,https://twitter.com/PDT_Nacional/status/1146440114052194304,0,,,,,,,,[],,,,
1122510253160062984,1122510253160062984,2019-04-28 11:37:54 -0300,2019-04-28,11:37:54,-300,45235841,felixmendoncajr,Félix Mendonça Jr.,,"Hoje é o #DiadaEducação, dia muito importante para todos nós. A educação deve ser prioridade em nosso país, pois ela é a maior riqueza que um povo pode ter. Parabéns a todos os educadores! #diadaeducacao #felixmendonçajr #deputadofederal #pdt #pdtbahia  https://t.co/C23ytNxjZS",pt,[],[],[],5,0,7,"['diadaeducação', 'diadaeducacao', 'felixmendonçajr', 'deputadofederal', 'pdt', 'pdtbahia']",[],https://twitter.com/FelixMendoncaJr/status/1122510253160062984,False,,1,https://pbs.twimg.com/ext_tw_video_thumb/1122510204183117825/pu/img/spkxlUd4_LzJp-0R.jpg,,,,,,,[],,,,
1121487653873041409,1121487653873041409,2019-04-25 15:54:27 -0300,2019-04-25,15:54:27,-300,45235841,felixmendoncajr,Félix Mendonça Jr.,,"Um projeto de minha autoria foi aprovado ontem, pelo Senado Federal. A proposta é criminalizar calúnia quando praticada com finalidade eleitoral.  https://t.co/CkGMKT8KYI",pt,[],['https://g1.globo.com/politica/noticia/2019/04/24/senado-aprova-projeto-que-criminaliza-a-calunia-com-finalidade-eleitoral.ghtml'],[],1,0,4,[],[],https://twitter.com/FelixMendoncaJr/status/1121487653873041409,False,,0,,,,,,,,[],,,,
1115994297650819072,1115994297650819072,2019-04-10 12:05:49 -0300,2019-04-10,12:05:49,-300,45235841,felixmendoncajr,Félix Mendonça Jr.,,"Comecei o dia com um café da manhã junto com a bancada da comissão que presido. Contamos com a presença do ministro da Ciência e Tecnologia, Marcos Pontes, pessoa muito importante para auxiliar nos avanços da CCTCI.  https://t.co/fg8nlyQULf",pt,[],[],['https://pbs.twimg.com/media/D3zO5hdXkAQpmAo.jpg'],0,1,5,[],[],https://twitter.com/FelixMendoncaJr/status/1115994297650819072,False,,1,https://pbs.twimg.com/media/D3zO5hdXkAQpmAo.jpg,,,,,,,[],,,,
1115328667041841157,1115328667041841157,2019-04-08 16:00:50 -0300,2019-04-08,16:00:50,-300,45235841,felixmendoncajr,Félix Mendonça Jr.,,Para que copiar o que não deu certo lá fora? https://t.co/x4ldSgWER3,pt,[],['https://www.todabahia.com.br/nao-deu-certo-la-fora-diz-felix-mendonca-sobre-poupancinha-da-reforma-da-previdencia/'],[],2,1,4,[],[],https://twitter.com/FelixMendoncaJr/status/1115328667041841157,False,,0,,,,,,,,[],,,,
1114891124194381825,1114891124194381825,2019-04-07 11:02:12 -0300,2019-04-07,11:02:12,-300,45235841,felixmendoncajr,Félix Mendonça Jr.,,"O deputado federal Félix Mendonça Jr. (PDT-BA) não acredita que a “poupancinha” - espécie de capitalização individual sugerida pelo governo no texto da Reforma da Previdência, como forma de complemento à aposentadoria - venha beneficiar o trabalhador brasileiro. #AscomFélix  https://t.co/pEZj1Fsfxa",pt,[],[],['https://pbs.twimg.com/media/D3jjkXDXsAAnXtT.jpg'],0,2,7,['ascomfélix'],[],https://twitter.com/FelixMendoncaJr/status/1114891124194381825,False,,1,https://pbs.twimg.com/media/D3jjkXDXsAAnXtT.jpg,,,,,,,[],,,,
1113502735087874048,1113502735087874048,2019-04-03 15:05:14 -0300,2019-04-03,15:05:14,-300,45235841,felixmendoncajr,Félix Mendonça Jr.,,"Na primeira reunião do CCTCI, discutimos sobre tecnologia 5g e reconhecimento facial. Saiba mais:  https://t.co/ChqyFge76D  https://t.co/X5cPawnKZ0",pt,[],['https://informebaiano.com.br/107731/politica/sistema-5g-e-reconhecimento-facial-dominam-a-discussao-na-primeira-reuniao-da-cctci'],['https://pbs.twimg.com/media/D3P01epX4AETcok.jpg'],0,1,4,[],[],https://twitter.com/FelixMendoncaJr/status/1113502735087874048,False,,1,https://pbs.twimg.com/media/D3P01epX4AETcok.jpg,,,,,,,[],,,,
1113435219577667584,1113435219577667584,2019-04-03 10:36:57 -0300,2019-04-03,10:36:57,-300,45235841,felixmendoncajr,Félix Mendonça Jr.,,Acompanhe ao vivo a reunião da CCTCI. Participe enviando perguntas!  https://t.co/PoIkQYyQnn,pt,[],['https://www2.camara.leg.br/atividade-legislativa/webcamara/ao-vivo/transmissoes-do-dia/aoVivoSinais?codReuniao=54893'],[],0,1,4,[],[],https://twitter.com/FelixMendoncaJr/status/1113435219577667584,False,,0,,,,,,,,[],,,,
1113199853385998337,1113199853385998337,2019-04-02 19:01:41 -0300,2019-04-02,19:01:41,-300,45235841,felixmendoncajr,Félix Mendonça Jr.,,"A tecnologia de reconhecimento facial tem muito a contribuir com a questão da segurança pública no Brasil. Por isso, será o foco da reunião da CCTCI amanhã, às 10h. Acompanhem! #cctci #reconhecimentofacial #câmaradosdeputados  https://t.co/obSf3bto0X",pt,[],[],['https://pbs.twimg.com/media/D3LhXa5XoAAlBlJ.jpg'],0,1,4,"['cctci', 'reconhecimentofacial', 'câmaradosdeputados']",[],https://twitter.com/FelixMendoncaJr/status/1113199853385998337,False,,1,https://pbs.twimg.com/media/D3LhXa5XoAAlBlJ.jpg,,,,,,,[],,,,
1111695784230207488,1111695784230207488,2019-03-29 15:25:03 -0300,2019-03-29,15:25:03,-300,45235841,felixmendoncajr,Félix Mendonça Jr.,,"Hoje é aniversário da nossa querida cidade, Salvador! Tenho muito orgulho dela, do seu povo e de como nós estamos conseguindo ser cada vez mais uma cidade melhor. Que venham muitos mais anos de progresso!  https://t.co/4z4pNrOAir",pt,[],[],['https://pbs.twimg.com/media/D22JbIeXQAMfDRB.jpg'],0,2,7,[],[],https://twitter.com/FelixMendoncaJr/status/1111695784230207488,False,,1,https://pbs.twimg.com/media/D22JbIeXQAMfDRB.jpg,,,,,,,[],,,,
1108866112932974592,1108866112932974592,2019-03-21 20:00:57 -0300,2019-03-21,20:00:57,-300,45235841,felixmendoncajr,Félix Mendonça Jr.,,"Vamos usar a tecnologia ao nosso favor! Livros digitais, além de representarem uma grande economia, aumentarão a acessibilidade dos alunos à informação.  https://t.co/dd0kNzKP4i",pt,[],['https://br18.com.br/para-economizar-deputado-quer-livros-digitais-em-todo-o-pais/'],[],2,1,5,[],[],https://twitter.com/FelixMendoncaJr/status/1108866112932974592,False,,0,,,,,,,,[],,,,
1108394139698319362,1108394139698319362,2019-03-20 12:45:30 -0300,2019-03-20,12:45:30,-300,45235841,felixmendoncajr,Félix Mendonça Jr.,,Na Bahia faz assim! Temos deputados de diversos partidos e ideologias com algo em comum: vontade de trabalhar e mudar.  https://t.co/3oS4jMF8B8  #política #pdt #câmarafederal,pt,[],['https://www.bahianoticias.com.br/noticia/233864-pelo-menos-5-comissoes-na-camara-dos-deputados-terao-baianos-no-comando.html'],[],0,1,6,"['política', 'pdt', 'câmarafederal']",[],https://twitter.com/FelixMendoncaJr/status/1108394139698319362,False,,0,,,,,,,,[],,,,
1048022718837350400,1048022718837350400,2018-10-04 22:31:02 -0300,2018-10-04,22:31:02,-300,45235841,felixmendoncajr,Félix Mendonça Jr.,,#Ciro12 agora no debate da Globo! Vamos ouvir suas propostas e projetos. #TsunamiCIRO,pt,[],[],[],2,1,5,"['ciro12', 'tsunamiciro']",[],https://twitter.com/FelixMendoncaJr/status/1048022718837350400,False,,0,,,,,,,,[],,,,
1035945100231286784,1035945100231286784,2018-09-01 14:38:53 -0300,2018-09-01,14:38:53,-300,45235841,felixmendoncajr,Félix Mendonça Jr.,,"Na região do semiárido, junto com o povo bom de América Dourada.",pt,[],[],[],0,1,3,[],[],https://twitter.com/FelixMendoncaJr/status/1035945100231286784,False,,0,,,,,,,,[],,,,
1035876082396876801,1035876082396876801,2018-09-01 10:04:38 -0300,2018-09-01,10:04:38,-300,45235841,felixmendoncajr,Félix Mendonça Jr.,,"Amigos e amigas, daqui a pouco estarei em América Dourada e, no domingo, em Xique-Xique. #VemComFélix",pt,[],[],[],0,1,3,['vemcomfélix'],[],https://twitter.com/FelixMendoncaJr/status/1035876082396876801,False,,0,,,,,,,,[],,,,
1035531141359517697,1035531141359517697,2018-08-31 11:13:57 -0300,2018-08-31,11:13:57,-300,45235841,felixmendoncajr,Félix Mendonça Jr.,,"Em Cipó, no esquente para a chegada do Correria. @ruicostagov",pt,"[{'screen_name': 'ruicostagov', 'name': 'rui costa', 'id': '2878704093'}]",[],[],0,1,4,[],[],https://twitter.com/FelixMendoncaJr/status/1035531141359517697,False,,0,,,,,,,,[],,,,
1033038918411804672,1033038918411804672,2018-08-24 14:10:45 -0300,2018-08-24,14:10:45,-300,45235841,felixmendoncajr,Félix Mendonça Jr.,,Mostre seu apoio nas redes sociais e ajude a espalhar nossas ideias por uma Bahia melhor! Acesse  https://t.co/yzWQhqQ1A0. #VemComFélix  https://t.co/iav1Ob1D5F,pt,[],['http://bit.ly/felix1234'],['https://pbs.twimg.com/media/DlYXaQFXcAAHshH.jpg'],0,0,4,['vemcomfélix'],[],https://twitter.com/FelixMendoncaJr/status/1033038918411804672,False,,1,https://pbs.twimg.com/media/DlYXaQFXcAAHshH.jpg,,,,,,,[],,,,
1525054699677929472,1525054699677929472,2022-05-13 07:05:49 -0300,2022-05-13,07:05:49,-300,45235841,felixmendoncajr,Félix Mendonça Jr.,,"Um bom dia especial aos amigos da @BandTV, emissora pioneira nos debates eleitorais e importante veiculo de imprensa no país, que completa hoje 55 anos de existência. Meus parabéns aos profissionais que atuam na empresa, principalmente na Bahia.",pt,"[{'screen_name': 'bandtv', 'name': 'band tv', 'id': '246471130'}]",[],[],0,1,3,[],[],https://twitter.com/FelixMendoncaJr/status/1525054699677929472,False,,0,,,,,,,,[],,,,
1533534218269114371,1533534218269114371,2022-06-05 16:40:23 -0300,2022-06-05,16:40:23,-300,45235841,felixmendoncajr,Félix Mendonça Jr.,,"Testei novamente positivo para a Covid-19, apesar de adotar todas as precauções sanitárias. Ficarei em isolamento até um teste negativo, suspendendo a agenda de atendimentos em Salvador e viagens, inclusive Brasília. A pandemia não acabou e precisamos continuar nos cuidando.",pt,[],[],[],2,3,17,[],[],https://twitter.com/FelixMendoncaJr/status/1533534218269114371,False,,0,,,,,,,,[],,,,
1532083976546013185,1532083976546013185,2022-06-01 16:37:39 -0300,2022-06-01,16:37:39,-300,45235841,felixmendoncajr,Félix Mendonça Jr.,,"Hoje é o Dia da Imprensa. Meus parabéns a todos os profissionais que trabalham diariamente para divulgar informações com credibilidade e isenção, ouvindo sempre os diversos lados da história.",pt,[],[],[],0,4,10,[],[],https://twitter.com/FelixMendoncaJr/status/1532083976546013185,False,,0,,,,,,,,[],,,,
1530911231305031685,1530911231305031685,2022-05-29 10:57:35 -0300,2022-05-29,10:57:35,-300,45235841,felixmendoncajr,Félix Mendonça Jr.,,"Todo mundo gosta de presente no dia do aniversário. Hoje Santo Antônio de Jesus, a capital do Recôncavo da Bahia, terra da minha mãe Maria Helena, completa 142 anos. Momento certo para dar a notícia de que conseguimos liberar um bom volume de recursos para obras no município.  https://t.co/iJLEPEJK2x",pt,[],[],['https://pbs.twimg.com/media/FT7jpruWYAIr4tc.jpg'],1,6,20,[],[],https://twitter.com/FelixMendoncaJr/status/1530911231305031685,False,,1,https://pbs.twimg.com/media/FT7jpruWYAIr4tc.jpg,,,,,,,[],,,,
1530521723363282945,1530254522785968129,2022-05-28 09:09:49 -0300,2022-05-28,09:09:49,-300,45235841,felixmendoncajr,Félix Mendonça Jr.,,@VictorMTeles1 @de_mansu Nosso grupo em Euclides é Ciro. Mas esse L aí confunde mesmo. Vou até pedir para evitarem. Kkkk,pt,[],[],[],1,0,2,[],[],https://twitter.com/FelixMendoncaJr/status/1530521723363282945,False,,0,,,,,,,,"[{'screen_name': 'VictorMTeles1', 'name': 'Victor M. Teles', 'id': '1250833458668199942'}, {'screen_name': 'de_mansu', 'name': 'Diego Mansur 🌹💚', 'id': '775441850542989312'}]",,,,
1530258254302945280,1530254522785968129,2022-05-27 15:42:53 -0300,2022-05-27,15:42:53,-300,45235841,felixmendoncajr,Félix Mendonça Jr.,,"@VictorMTeles1 @de_mansu L, do prefeito Luciano.",pt,[],[],[],1,1,6,[],[],https://twitter.com/FelixMendoncaJr/status/1530258254302945280,False,,0,,,,,,,,"[{'screen_name': 'VictorMTeles1', 'name': 'Victor M. Teles', 'id': '1250833458668199942'}, {'screen_name': 'de_mansu', 'name': 'Diego Mansur 🌹💚', 'id': '775441850542989312'}]",,,,
1530254522785968129,1530254522785968129,2022-05-27 15:28:03 -0300,2022-05-27,15:28:03,-300,45235841,felixmendoncajr,Félix Mendonça Jr.,,"Acabamos de realizar a convenção do #PDT em Euclides da Cunha. O partido só faz crescer no município do sertão baiano, tendo como exemplo a gestão de excelência do prefeito Luciano. Temos ainda 8 vereadores incansáveis. Orgulho de ser o representante de Euclides na Câmara.  https://t.co/qvA12TBolR",pt,[],[],['https://pbs.twimg.com/media/FTyOXtGXEAAklez.jpg'],5,17,106,['pdt'],[],https://twitter.com/FelixMendoncaJr/status/1530254522785968129,False,,1,https://pbs.twimg.com/media/FTyOXtGXEAAklez.jpg,,,,,,,[],,,,
1530129132562128896,1530129132562128896,2022-05-27 07:09:48 -0300,2022-05-27,07:09:48,-300,45235841,felixmendoncajr,Félix Mendonça Jr.,,"Nota publicada hoje pelo jornal @correio24horas. Para desespero dos petistas e dos banqueiros, financistas das pesquisas, @cirogomes é candidato até o final. #PrefiroCiro  https://t.co/cfiJMcWtKd",pt,"[{'screen_name': 'correio24horas', 'name': 'jornal correio', 'id': '19249489'}, {'screen_name': 'cirogomes', 'name': 'ciro gomes', 'id': '33374761'}]",[],['https://pbs.twimg.com/media/FTwcTGmWQAEJBVw.jpg'],10,61,269,['prefirociro'],[],https://twitter.com/FelixMendoncaJr/status/1530129132562128896,False,,1,https://pbs.twimg.com/media/FTwcTGmWQAEJBVw.jpg,,,,,,,[],,,,
1529934694153854976,1529856395130155013,2022-05-26 18:17:10 -0300,2022-05-26,18:17:10,-300,45235841,felixmendoncajr,Félix Mendonça Jr.,,@Ceissa_Med @BelemJameson @cirogomes A combinação é perfeita. Estude mais um pouco de história. Abraços!,pt,[],[],[],2,2,24,[],[],https://twitter.com/FelixMendoncaJr/status/1529934694153854976,False,,0,,,,,,,,"[{'screen_name': 'Ceissa_Med', 'name': 'Ceiça Medeiros', 'id': '320796311'}, {'screen_name': 'BelemJameson', 'name': 'James 🍥', 'id': '1144050082209304576'}, {'screen_name': 'cirogomes', 'name': 'Ciro Gomes', 'id': '33374761'}]",,,,
