id,conversation_id,created_at,date,time,timezone,user_id,username,name,place,tweet,language,mentions,urls,photos,replies_count,retweets_count,likes_count,hashtags,cashtags,link,retweet,quote_url,video,thumbnail,near,geo,source,user_rt_id,user_rt,retweet_id,reply_to,retweet_date,translate,trans_src,trans_dest
1420332998529060869,1420332998529060869,2021-07-28 07:39:10 -0300,2021-07-28,07:39:10,-300,45235841,felixmendoncajr,Félix Mendonça Jr.,,"Procuro seguir os ensinamentos de meu pai, que tão bem serviu Itabuna e toda a Bahia como prefeito e deputado. A nossa luta em defesa da economia do cacau é um exemplo disso. É com saudade que dou os parabéns hj a Itabuna e a todos os itabunenses, de nascimento ou de coração.",pt,[],[],[],0,2,12,[],[],https://twitter.com/FelixMendoncaJr/status/1420332998529060869,False,,0,,,,,,,,[],,,,
1420332120535445509,1420332120535445509,2021-07-28 07:35:40 -0300,2021-07-28,07:35:40,-300,45235841,felixmendoncajr,Félix Mendonça Jr.,,"Itabuna, minha cidade natal, completa hoje 111 anos. É, pra mim, um dia de festa, mas tb de saudade. Meu pai, uma das mais de 550 mil vítimas da Covid, iniciou a trajetória política como prefeito de Itabuna, cargo para o qual foi eleito em 1962, aos 33 anos. Governou com o povo.  https://t.co/pCcL0qsh0d",pt,[],[],['https://pbs.twimg.com/media/E7YIiGcWQAA34gf.jpg'],1,4,20,[],[],https://twitter.com/FelixMendoncaJr/status/1420332120535445509,False,,1,https://pbs.twimg.com/media/E7YIiGcWQAA34gf.jpg,,,,,,,[],,,,
1419801888434835456,1419801888434835456,2021-07-26 20:28:43 -0300,2021-07-26,20:28:43,-300,45235841,felixmendoncajr,Félix Mendonça Jr.,,"Até o Bolsonaro já sabe que @cirogomes vai estar no segundo turno. E entre Ciro e Lula, Lula e Ciro, claro que é Ciro. Alguma dúvida?  #Ciro2022 #CiroGames",pt,"[{'screen_name': 'cirogomes', 'name': 'ciro gomes', 'id': '33374761'}]",[],[],16,83,783,"['ciro2022', 'cirogames']",[],https://twitter.com/FelixMendoncaJr/status/1419801888434835456,False,,0,,,,,,,,[],,,,
1418577316783996934,1418577316783996934,2021-07-23 11:22:42 -0300,2021-07-23,11:22:42,-300,45235841,felixmendoncajr,Félix Mendonça Jr.,,"Quando a pessoa envia o código de confirmação, tem o WhatsApp clonado. Já estou adotando as medidas policiais e judiciais cabíveis para identificação e punição dos criminosos.",pt,[],[],[],0,0,5,[],[],https://twitter.com/FelixMendoncaJr/status/1418577316783996934,False,,0,,,,,,,,[],,,,
1418577075678625793,1418577075678625793,2021-07-23 11:21:45 -0300,2021-07-23,11:21:45,-300,45235841,felixmendoncajr,Félix Mendonça Jr.,,"Estão usando meu nome para tentar aplicar um golpe em amigos e conhecidos. Por meio do telefone de final 2527, DDD de Salvador, estão convidando para um jantar que eu estaria organizando, pedindo que um código de confirmação seja enviado pelo WhatsApp.",pt,[],[],[],0,0,6,[],[],https://twitter.com/FelixMendoncaJr/status/1418577075678625793,False,,0,,,,,,,,[],,,,
1418000290545082370,1417994276835840000,2021-07-21 21:09:49 -0300,2021-07-21,21:09:49,-300,45235841,felixmendoncajr,Félix Mendonça Jr.,,@GilneiBorba Apois...,pt,[],[],[],0,0,1,[],[],https://twitter.com/FelixMendoncaJr/status/1418000290545082370,False,,0,,,,,,,,"[{'screen_name': 'GilneiBorba', 'name': 'Gilnei Borba com Ciro - 🌷', 'id': '107812928'}]",,,,
1417994276835840000,1417994276835840000,2021-07-21 20:45:55 -0300,2021-07-21,20:45:55,-300,45235841,felixmendoncajr,Félix Mendonça Jr.,,"O presidente vai criar um ministério do emprego somente pra empregar um aliado e fazer uma reforma de apadrinhados. Enquanto isso, a pauta trabalhista segue superada pelo auxílio aos bancos, com juros altos, e pelo aumento da verba dos partidos, aprovado pelos bolsonaristas.",pt,[],[],[],4,14,48,[],[],https://twitter.com/FelixMendoncaJr/status/1417994276835840000,False,,0,,,,,,,,[],,,,
1417623087848345601,1417623087848345601,2021-07-20 20:10:56 -0300,2021-07-20,20:10:56,-300,45235841,felixmendoncajr,Félix Mendonça Jr.,,"Esperamos que o presidente tenha alguma coerência e vete o aumento escandaloso do fundo eleitoral destinado aos partidos políticos. Esse dinheiro tem que ir para a educação, a saúde, a assistência social e investimentos em infraestrutura para estimular a economia.  https://t.co/D22rNvRnSp",pt,[],[],['https://pbs.twimg.com/media/E6xor3FWEAI2uM-.jpg'],1,0,8,[],[],https://twitter.com/FelixMendoncaJr/status/1417623087848345601,False,,1,https://pbs.twimg.com/media/E6xor3FWEAI2uM-.jpg,,,,,,,[],,,,
1417611947747516417,1417562936017657862,2021-07-20 19:26:40 -0300,2021-07-20,19:26:40,-300,45235841,felixmendoncajr,Félix Mendonça Jr.,,"@nave1964 O PDT já foi da base do governo do PT. Nos dois casos, tanto em nível federal quanto estadual. Inclusive participamos do governo. O que tem  alhos com bugalhos?",pt,[],[],[],0,0,0,[],[],https://twitter.com/FelixMendoncaJr/status/1417611947747516417,False,,0,,,,,,,,"[{'screen_name': 'nave1964', 'name': 'Neila 🚩🚩🚩', 'id': '1087031722615681024'}]",,,,
1417590908082475009,1417562936017657862,2021-07-20 18:03:04 -0300,2021-07-20,18:03:04,-300,45235841,felixmendoncajr,Félix Mendonça Jr.,,"@nave1964 Sim. De como é possível dialogar sem ódio, como é possível fazer política com respeito. Exemplo sim nesses tempos de política do ódio e da falta de diálogo.",pt,[],[],[],1,0,0,[],[],https://twitter.com/FelixMendoncaJr/status/1417590908082475009,False,,0,,,,,,,,"[{'screen_name': 'nave1964', 'name': 'Neila 🚩🚩🚩', 'id': '1087031722615681024'}]",,,,
1417562936017657862,1417562936017657862,2021-07-20 16:11:55 -0300,2021-07-20,16:11:55,-300,45235841,felixmendoncajr,Félix Mendonça Jr.,,"Neste Dia do Amigo, o arquivo pessoal lembra de uma amizade duradoura e leal. O senador ACM, q se foi há 14 anos (completados hoje), e meu pai, Félix Mendonça, q nos deixou em 2020, tinham uma relação que ia além da política e de diferenças ideológicas. Um exemplo a ser seguido.  https://t.co/nGRTASKmSg",pt,[],[],['https://pbs.twimg.com/media/E6wx-iiXsAEEELc.jpg'],2,0,9,[],[],https://twitter.com/FelixMendoncaJr/status/1417562936017657862,False,,1,https://pbs.twimg.com/media/E6wx-iiXsAEEELc.jpg,,,,,,,[],,,,
1417518076589977606,1417518076589977606,2021-07-20 13:13:40 -0300,2021-07-20,13:13:40,-300,45235841,felixmendoncajr,Félix Mendonça Jr.,,Estão vendo como eles se parecem bastante... #cironeles #CiroAvisou   https://t.co/lRji4Y7OA7,pt,[],['https://oglobo.globo.com/brasil/bolsonaro-lula-atacam-possibilidade-de-terceira-via-para-eleicoes-de-2022-25117968?utm_source=aplicativoOGlobo&utm_medium=aplicativo&utm_campaign=compartilhar'],[],1,5,9,"['cironeles', 'ciroavisou']",[],https://twitter.com/FelixMendoncaJr/status/1417518076589977606,False,,0,,,,,,,,[],,,,
1417510997271748613,1417510997271748613,2021-07-20 12:45:32 -0300,2021-07-20,12:45:32,-300,45235841,felixmendoncajr,Félix Mendonça Jr.,,"Ao lado dos meus dois melhores amigos. Meu filho, @Rafamendonca11, e meu pai, Félix Mendonça, cuja saudade não passa. Tive, com os dois, algumas das melhores conversas da minha vida, bem como momentos inesquecíveis. Por isso, no Dia do Amigo, agradeço muito pela amizade dos dois.  https://t.co/t9OhYrxIhQ",pt,"[{'screen_name': 'rafamendonca11', 'name': 'rafael p. mendonça', 'id': '3101823321'}]",[],['https://pbs.twimg.com/media/E6wCvBhXoAEet-Y.jpg'],0,1,27,[],[],https://twitter.com/FelixMendoncaJr/status/1417510997271748613,False,,1,https://pbs.twimg.com/media/E6wCvBhXoAEet-Y.jpg,,,,,,,[],,,,
1416764686138322945,1416764686138322945,2021-07-18 11:19:58 -0300,2021-07-18,11:19:58,-300,45235841,felixmendoncajr,Félix Mendonça Jr.,,A posição do @PDTBahia é clara: somos independentes e queremos ajudar a construir um projeto de desenvolvimento para a Bahia e para o Brasil. Não somos subordinados a ninguém e estaremos sempre ao lado de quem tiver compromisso com os ideais do partido e de @cirogomes.  https://t.co/4mbJEGFsWY,pt,"[{'screen_name': 'pdtbahia', 'name': 'pdt - bahia', 'id': '50648494'}, {'screen_name': 'cirogomes', 'name': 'ciro gomes', 'id': '33374761'}]",[],[],8,26,150,[],[],https://twitter.com/FelixMendoncaJr/status/1416764686138322945,False,,1,https://pbs.twimg.com/ext_tw_video_thumb/1416764577325408261/pu/img/kr2pctTQScSQRmNq.jpg,,,,,,,[],,,,
1416555477853474817,1416555477853474817,2021-07-17 21:28:38 -0300,2021-07-17,21:28:38,-300,45235841,felixmendoncajr,Félix Mendonça Jr.,,Roger Waters agora na @GFMSalvador. The Wall. Recomendo!,en,"[{'screen_name': 'gfmsalvador', 'name': 'gfm salvador', 'id': '55157667'}]",[],[],0,1,5,[],[],https://twitter.com/FelixMendoncaJr/status/1416555477853474817,False,,0,,,,,,,,[],,,,
1416414593547743234,1416414593547743234,2021-07-17 12:08:49 -0300,2021-07-17,12:08:49,-300,45235841,felixmendoncajr,Félix Mendonça Jr.,,#Ciro2022  https://t.co/doS7FMQvJU,und,[],[],[],0,4,32,['ciro2022'],[],https://twitter.com/FelixMendoncaJr/status/1416414593547743234,False,,1,https://pbs.twimg.com/ext_tw_video_thumb/1416414514132754432/pu/img/k6pTgC59jER-tHXj.jpg,,,,,,,[],,,,
1416411255724822533,1416383322922659840,2021-07-17 11:55:33 -0300,2021-07-17,11:55:33,-300,45235841,felixmendoncajr,Félix Mendonça Jr.,,@sccpglenda 12 vezes....,pt,[],[],[],0,0,0,[],[],https://twitter.com/FelixMendoncaJr/status/1416411255724822533,False,,0,,,,,,,,"[{'screen_name': 'sccpglenda', 'name': '𝗠𝗲𝗱𝘂𝘀𝗮 𓆙', 'id': '1022566772908666881'}]",,,,
1416410908667039749,1416202161193734146,2021-07-17 11:54:10 -0300,2021-07-17,11:54:10,-300,45235841,felixmendoncajr,Félix Mendonça Jr.,,"@cleciokel @PDTBahia @cirogomes Bacana, amigo. Mande seu contato que entraremos em contato.",pt,[],[],[],1,0,1,[],[],https://twitter.com/FelixMendoncaJr/status/1416410908667039749,False,,0,,,,,,,,"[{'screen_name': 'cleciokel', 'name': 'Clecio Barreto 🌹✊🏿🇧🇷 PND 12', 'id': '193353149'}, {'screen_name': 'PDTBahia', 'name': 'PDT - Bahia', 'id': '50648494'}, {'screen_name': 'cirogomes', 'name': 'Ciro Gomes', 'id': '33374761'}]",,,,
1416410738067902465,1416202161193734146,2021-07-17 11:53:30 -0300,2021-07-17,11:53:30,-300,45235841,felixmendoncajr,Félix Mendonça Jr.,,"@UzedaWallace @PDTBahia @cirogomes Olá, amigo. Será bem-vindo. Passe seu contato que minha assessoria lhe orienta.",pt,[],[],[],1,0,1,[],[],https://twitter.com/FelixMendoncaJr/status/1416410738067902465,False,,0,,,,,,,,"[{'screen_name': 'UzedaWallace', 'name': 'WallaceUzêda1️⃣2️⃣🌹🇧🇷', 'id': '1238559616725811200'}, {'screen_name': 'PDTBahia', 'name': 'PDT - Bahia', 'id': '50648494'}, {'screen_name': 'cirogomes', 'name': 'Ciro Gomes', 'id': '33374761'}]",,,,
1416209814103937026,1416202161193734146,2021-07-16 22:35:06 -0300,2021-07-16,22:35:06,-300,45235841,felixmendoncajr,Félix Mendonça Jr.,,@BrunoAr52941832 @PDTBahia @cirogomes Mande pelo PVT do Instagram.,pt,[],[],[],1,0,1,[],[],https://twitter.com/FelixMendoncaJr/status/1416209814103937026,False,,0,,,,,,,,"[{'screen_name': 'BrunoAr52941832', 'name': 'Bruno Lopes', 'id': '1184644849292791808'}, {'screen_name': 'PDTBahia', 'name': 'PDT - Bahia', 'id': '50648494'}, {'screen_name': 'cirogomes', 'name': 'Ciro Gomes', 'id': '33374761'}]",,,,
1416209427632427016,1416202161193734146,2021-07-16 22:33:34 -0300,2021-07-16,22:33:34,-300,45235841,felixmendoncajr,Félix Mendonça Jr.,,@_gabriellng @PDTBahia @cirogomes Só terá a legenda para concorrer em 2022 quem estiver com o partido e com @cirogomes.,pt,"[{'screen_name': 'cirogomes', 'name': 'ciro gomes', 'id': '33374761'}]",[],[],3,1,21,[],[],https://twitter.com/FelixMendoncaJr/status/1416209427632427016,False,,0,,,,,,,,"[{'screen_name': '_gabriellng', 'name': 'Gabriel', 'id': '187365807'}, {'screen_name': 'PDTBahia', 'name': 'PDT - Bahia', 'id': '50648494'}, {'screen_name': 'cirogomes', 'name': 'Ciro Gomes', 'id': '33374761'}]",,,,
1416203446349348867,1416202161193734146,2021-07-16 22:09:48 -0300,2021-07-16,22:09:48,-300,45235841,felixmendoncajr,Félix Mendonça Jr.,,"@BrunoAr52941832 @PDTBahia @cirogomes Olá, amigo. Me passe seu contato. Abs!!",pt,[],[],[],1,0,4,[],[],https://twitter.com/FelixMendoncaJr/status/1416203446349348867,False,,0,,,,,,,,"[{'screen_name': 'BrunoAr52941832', 'name': 'Bruno Lopes', 'id': '1184644849292791808'}, {'screen_name': 'PDTBahia', 'name': 'PDT - Bahia', 'id': '50648494'}, {'screen_name': 'cirogomes', 'name': 'Ciro Gomes', 'id': '33374761'}]",,,,
1416202885625417732,1416202161193734146,2021-07-16 22:07:34 -0300,2021-07-16,22:07:34,-300,45235841,felixmendoncajr,Félix Mendonça Jr.,,"@EJunioJunio @PDTBahia @cirogomes Nós teremos candidatos fortes e que representem a pluralidade de pensamentos, sem qualquer preconceito. Não podemos ter no partido apenas quem pensa como a gente. A exigência é que estejam de acordo com os ideais centrais do PDT, como a defesa da educação e do trabalhismo.",pt,[],[],[],1,0,6,[],[],https://twitter.com/FelixMendoncaJr/status/1416202885625417732,False,,0,,,,,,,,"[{'screen_name': 'EJunioJunio', 'name': 'Junio', 'id': '1230266013238939654'}, {'screen_name': 'PDTBahia', 'name': 'PDT - Bahia', 'id': '50648494'}, {'screen_name': 'cirogomes', 'name': 'Ciro Gomes', 'id': '33374761'}]",,,,
1416202161193734146,1416202161193734146,2021-07-16 22:04:41 -0300,2021-07-16,22:04:41,-300,45235841,felixmendoncajr,Félix Mendonça Jr.,,"Estamos construindo um @PDTBahia forte para disputar as eleições e ajudar @cirogomes. Tenho dito que, de forma independente e sem subserviência a ninguém, faremos o que for melhor para a Bahia e o Brasil. Não ligamos para cargos. Queremos, sim, fazer a diferença.",pt,"[{'screen_name': 'pdtbahia', 'name': 'pdt - bahia', 'id': '50648494'}, {'screen_name': 'cirogomes', 'name': 'ciro gomes', 'id': '33374761'}]",[],[],26,62,593,[],[],https://twitter.com/FelixMendoncaJr/status/1416202161193734146,False,,0,,,,,,,,[],,,,
1416091856568475664,1416091856568475664,2021-07-16 14:46:22 -0300,2021-07-16,14:46:22,-300,45235841,felixmendoncajr,Félix Mendonça Jr.,,"Bem-vindo ao @PDTBahia, @gusmaonetoreal. Com a filiação confirmada, o convite para ser candidato a deputado em 2022 está de pé, feito por mim e pela vice-prefeito de Salvador, @AnaPaulaMatosBA.  https://t.co/3kFR8yoFtR",pt,"[{'screen_name': 'pdtbahia', 'name': 'pdt - bahia', 'id': '50648494'}, {'screen_name': 'gusmaonetoreal', 'name': 'gusmão neto', 'id': '212322517'}, {'screen_name': 'anapaulamatosba', 'name': 'ana paula matos', 'id': '1357041737093505025'}]",[],[],1,4,29,[],[],https://twitter.com/FelixMendoncaJr/status/1416091856568475664,False,,1,https://pbs.twimg.com/ext_tw_video_thumb/1416091582177087489/pu/img/9zSHYvYFq0MJIthZ.jpg,,,,,,,[],,,,
1416071030385356802,1416071030385356802,2021-07-16 13:23:37 -0300,2021-07-16,13:23:37,-300,45235841,felixmendoncajr,Félix Mendonça Jr.,,"Eu sou coerente, e não um falso patriota. Votei ""não"" ao projeto da LDO, que incluiu um aumento de R$2 bi para R$5,7 bi do fundo eleitoral. Esse escândalo foi aprovado com os votos da base do governo Bolsonaro, o mesmo que foi ao STF para cortar R$3,5 bilhões para a educação.  https://t.co/NFmPVOpJ4W",pt,[],[],['https://pbs.twimg.com/media/E6blGNMWEAwjrnj.jpg'],1,3,19,[],[],https://twitter.com/FelixMendoncaJr/status/1416071030385356802,False,,1,https://pbs.twimg.com/media/E6blGNMWEAwjrnj.jpg,,,,,,,[],,,,
1415765975417380868,1415765975417380868,2021-07-15 17:11:26 -0300,2021-07-15,17:11:26,-300,45235841,felixmendoncajr,Félix Mendonça Jr.,,Tem repercutido bastante na mídia o projeto de indicação que apresentei que cria a Embrapa Cacau. Isso é bom para que possamos tirar as dúvidas sobre a proposta.   #cacau  #embrapa  https://t.co/XEKemZNcHL,pt,[],[],['https://pbs.twimg.com/media/E6XPpqNWEAc_8pu.jpg'],3,2,13,"['cacau', 'embrapa']",[],https://twitter.com/FelixMendoncaJr/status/1415765975417380868,False,,1,https://pbs.twimg.com/media/E6XPpqNWEAc_8pu.jpg,,,,,,,[],,,,
1415746579173187587,1415643180410806274,2021-07-15 15:54:22 -0300,2021-07-15,15:54:22,-300,45235841,felixmendoncajr,Félix Mendonça Jr.,,@GiselliCorreia Tem o Dirceu...,pt,[],[],[],0,0,1,[],[],https://twitter.com/FelixMendoncaJr/status/1415746579173187587,False,,0,,,,,,,,"[{'screen_name': 'GiselliCorreia', 'name': 'Gisa Correia 🇧🇷', 'id': '1027747627855699968'}]",,,,
1415738859921584130,1415738859921584130,2021-07-15 15:23:42 -0300,2021-07-15,15:23:42,-300,45235841,felixmendoncajr,Félix Mendonça Jr.,,"@cirogomes está ao lado do povo, e não dos coronéis. Essa coisa de chamar nosso futuro presidente de coronel não pega não. Como Conselheiro e seu seguidores, ele luta como sertanejo contra a miséria social e intelectual que se abateu sobre o Brasil com essa polarização raivosa.",pt,[],[],[],0,2,8,[],[],https://twitter.com/FelixMendoncaJr/status/1415738859921584130,False,https://twitter.com/cirogomes/status/1415732896443207680,0,,,,,,,,[],,,,
1415737401469816832,1415694868530311170,2021-07-15 15:17:54 -0300,2021-07-15,15:17:54,-300,45235841,felixmendoncajr,Félix Mendonça Jr.,,@laiseneres1 Time retado esse.,pt,[],[],[],1,1,2,[],[],https://twitter.com/FelixMendoncaJr/status/1415737401469816832,False,,0,,,,,,,,"[{'screen_name': 'laiseneres1', 'name': 'Laíse Neres', 'id': '1373976659980861440'}]",,,,
1415652457225535489,1415652457225535489,2021-07-15 09:40:22 -0300,2021-07-15,09:40:22,-300,45235841,felixmendoncajr,Félix Mendonça Jr.,,Estamos pedindo providências ao Ministério da Agricultura pra impedir que a praga da monilíase chegue até a lavoura cacaueira na Bahia. É preciso intensificar as barreiras fitossanitárias e ampliar os investimentos em pesquisa. Nossa lavoura não aguenta outra doença devastadora.,pt,[],[],[],0,5,32,[],[],https://twitter.com/FelixMendoncaJr/status/1415652457225535489,False,,0,,,,,,,,[],,,,
1415479506186514432,1415479506186514432,2021-07-14 22:13:07 -0300,2021-07-14,22:13:07,-300,45235841,felixmendoncajr,Félix Mendonça Jr.,,"Participei hj da posse da nova presidente do Movimento Negro do PDT de Salvador, @laiseneres1. Continuaremos firmes na luta contra o racismo e a favor da igualdade e da diversidade.  https://t.co/ggBHtVUdsu",pt,"[{'screen_name': 'laiseneres1', 'name': 'laíse neres', 'id': '1373976659980861440'}]",[],['https://pbs.twimg.com/media/E6TLG8IXIAIb9PK.jpg'],0,3,16,[],[],https://twitter.com/FelixMendoncaJr/status/1415479506186514432,False,,1,https://pbs.twimg.com/media/E6TLG8IXIAIb9PK.jpg,,,,,,,[],,,,
1415301011036647430,1415044707864952837,2021-07-14 10:23:50 -0300,2021-07-14,10:23:50,-300,45235841,felixmendoncajr,Félix Mendonça Jr.,,"@AmandaPDT12 @cirogomes O PDT é o partido da diversidade. Com Ciro, vamos voltar a ser um país mais solidário e humano, que dialoga e aceita as diferenças.",pt,[],[],[],0,1,5,[],[],https://twitter.com/FelixMendoncaJr/status/1415301011036647430,False,,0,,,,,,,,"[{'screen_name': 'AmandaPDT12', 'name': 'Amanda Anderson 🏳️\u200d⚧️🏳️\u200d🌈🇧🇷', 'id': '116353688'}, {'screen_name': 'cirogomes', 'name': 'Ciro Gomes', 'id': '33374761'}]",,,,
1415300459091439621,1415025435977658373,2021-07-14 10:21:39 -0300,2021-07-14,10:21:39,-300,45235841,felixmendoncajr,Félix Mendonça Jr.,,"@senadorcidgomes Parabéns, senador. O PDT segue cobrando do governo responsabilidade com a vida das pessoas.",pt,[],[],[],1,0,0,[],[],https://twitter.com/FelixMendoncaJr/status/1415300459091439621,False,,0,,,,,,,,"[{'screen_name': 'senadorcidgomes', 'name': 'Cid Gomes', 'id': '49089646'}]",,,,
1415282480660238342,1415282480660238342,2021-07-14 09:10:12 -0300,2021-07-14,09:10:12,-300,45235841,felixmendoncajr,Félix Mendonça Jr.,,"Estudo divulgado pelo Banco Mundial aponta que 39% dos brasileiros mais pobres não têm acesso à internet. Mesmo assim, o presidente foi ao STF para derrubar a lei que nós aprovamos que destina 3,5 bilhões para a inclusão digital de 18 milhões de de estudantes mais pobres.",pt,[],[],[],1,2,14,[],[],https://twitter.com/FelixMendoncaJr/status/1415282480660238342,False,,0,,,,,,,,[],,,,
1415270361453760517,1415270361453760517,2021-07-14 08:22:03 -0300,2021-07-14,08:22:03,-300,45235841,felixmendoncajr,Félix Mendonça Jr.,,"Parabéns ao escritor @paulocoelho, que se ofereceu para patrocinar o festival de Jazz na Chapada Diamantina que o governo @jairbolsonaro vetou, através da Lei Rouanet, por questões ideológicas.",pt,"[{'screen_name': 'paulocoelho', 'name': 'paulo coelho', 'id': '5520952'}, {'screen_name': 'jairbolsonaro', 'name': 'jair m. bolsonaro', 'id': '128372940'}]",[],[],0,6,23,[],[],https://twitter.com/FelixMendoncaJr/status/1415270361453760517,False,,0,,,,,,,,[],,,,
1415111007601561602,1415111007601561602,2021-07-13 21:48:50 -0300,2021-07-13,21:48:50,-300,45235841,felixmendoncajr,Félix Mendonça Jr.,,"Votei ""sim"" ao projeto oriundo do Senado que acaba com os supersalários no serviço público em todos os entes federados. Colocando um fim nos privilégios de poucos teremos mais recursos para que os governos invistam em melhorias na qualidade de vida de muitos.",pt,[],[],[],2,1,14,[],[],https://twitter.com/FelixMendoncaJr/status/1415111007601561602,False,,0,,,,,,,,[],,,,
1415029757423587332,1414960821973696512,2021-07-13 16:25:58 -0300,2021-07-13,16:25:58,-300,45235841,felixmendoncajr,Félix Mendonça Jr.,,@laiseneres1 Estarei presente.,pt,[],[],[],1,0,1,[],[],https://twitter.com/FelixMendoncaJr/status/1415029757423587332,False,,0,,,,,,,,"[{'screen_name': 'laiseneres1', 'name': 'Laíse Neres', 'id': '1373976659980861440'}]",,,,
1415029610425823236,1415029610425823236,2021-07-13 16:25:23 -0300,2021-07-13,16:25:23,-300,45235841,felixmendoncajr,Félix Mendonça Jr.,,Vou participar amanhã da posse da querida militante pedetista @laiseneres1 como presidente da comissão do Movimento Negro do @PDTBahia. Somos o partido da defesa da igualdade e do combate a todos os tipos de preconceito. Vamos construir um Brasil sem trevas.  https://t.co/uy38N4Ia3I,pt,"[{'screen_name': 'laiseneres1', 'name': 'laíse neres', 'id': '1373976659980861440'}, {'screen_name': 'pdtbahia', 'name': 'pdt - bahia', 'id': '50648494'}]",[],['https://pbs.twimg.com/media/E6Mx7mzXMAQ_q4f.jpg'],1,2,9,[],[],https://twitter.com/FelixMendoncaJr/status/1415029610425823236,False,,1,https://pbs.twimg.com/media/E6Mx7mzXMAQ_q4f.jpg,,,,,,,[],,,,
1414950882769260551,1414950882769260551,2021-07-13 11:12:33 -0300,2021-07-13,11:12:33,-300,45235841,felixmendoncajr,Félix Mendonça Jr.,,Sério que ele pensava que o Biden era comunista?,pt,[],[],[],1,0,6,[],[],https://twitter.com/FelixMendoncaJr/status/1414950882769260551,False,https://twitter.com/ultimosegundo/status/1414929641958166532,0,,,,,,,,[],,,,
1414739618889715720,1414739618889715720,2021-07-12 21:13:04 -0300,2021-07-12,21:13:04,-300,45235841,felixmendoncajr,Félix Mendonça Jr.,,"O presidente disse hoje que não é servidor público, e que por isso não prevaricou. Ou seja, admitiu indireramente que serve a interesses privados, dos familiares e dos amigos. Sem novidades...",pt,[],[],[],0,3,15,[],[],https://twitter.com/FelixMendoncaJr/status/1414739618889715720,False,,0,,,,,,,,[],,,,
1414696193125453825,1414585132749578244,2021-07-12 18:20:30 -0300,2021-07-12,18:20:30,-300,45235841,felixmendoncajr,Félix Mendonça Jr.,,@britofelipee Voto 12 vezes...,pt,[],[],[],1,1,2,[],[],https://twitter.com/FelixMendoncaJr/status/1414696193125453825,False,,0,,,,,,,,"[{'screen_name': 'britofelipee', 'name': 'Lipe Fe', 'id': '87275727'}]",,,,
1414651733075189764,1414627989858492416,2021-07-12 15:23:50 -0300,2021-07-12,15:23:50,-300,45235841,felixmendoncajr,Félix Mendonça Jr.,,@Alexandregalvs Governo tirano que usa o nome de Deus para justificar suas tiranias e podar as liberdades. Triste capítulo da história brasileira.,pt,[],[],[],0,0,0,[],[],https://twitter.com/FelixMendoncaJr/status/1414651733075189764,False,,0,,,,,,,,"[{'screen_name': 'Alexandregalvs', 'name': 'Alexandre Galvão', 'id': '40039438'}]",,,,
1414622795242299394,1414622795242299394,2021-07-12 13:28:51 -0300,2021-07-12,13:28:51,-300,45235841,felixmendoncajr,Félix Mendonça Jr.,,"Recebi hoje, em Salvador, o vereador da capital Henrique Carballal para um papo sobre o futuro do @PDTBahia e questões da política local. Estamos trabalhando para construir uma chapa forte de deputados em 2022.  https://t.co/WzUE2ipcBP",pt,"[{'screen_name': 'pdtbahia', 'name': 'pdt - bahia', 'id': '50648494'}]",[],['https://pbs.twimg.com/media/E6G_7zXWQAELaN7.jpg'],1,3,16,[],[],https://twitter.com/FelixMendoncaJr/status/1414622795242299394,False,,1,https://pbs.twimg.com/media/E6G_7zXWQAELaN7.jpg,,,,,,,[],,,,
1414591028909203461,1414591028909203461,2021-07-12 11:22:37 -0300,2021-07-12,11:22:37,-300,45235841,felixmendoncajr,Félix Mendonça Jr.,,"Excelente matéria do @correio24horas sobre a produção de cacau no oeste baiano. Com o avanço do cacau nessa região esperamos que a Bahia retome do Pará a posição de maior produtor do país. Na Câmara, seguimos na luta em defesa do setor.    https://t.co/PisSPuxV4x",pt,"[{'screen_name': 'correio24horas', 'name': 'jornal correio', 'id': '19249489'}]",['https://noticiasdaoeste.com.br/oeste-aposta-no-cacau-e-tem-produtividade-177-maior-que-media-de-melhor-regiao-do-pais/'],[],0,1,5,[],[],https://twitter.com/FelixMendoncaJr/status/1414591028909203461,False,,0,,,,,,,,[],,,,
1414334950216720392,1414214388916051971,2021-07-11 18:25:03 -0300,2021-07-11,18:25:03,-300,45235841,felixmendoncajr,Félix Mendonça Jr.,,@rafaelvelame Uma falta de respeito e de amor ao próximo.,pt,[],[],[],0,0,2,[],[],https://twitter.com/FelixMendoncaJr/status/1414334950216720392,False,,0,,,,,,,,"[{'screen_name': 'rafaelvelame', 'name': 'Rafael Velame', 'id': '28108748'}]",,,,
1414334797942562825,1414248222986493952,2021-07-11 18:24:27 -0300,2021-07-11,18:24:27,-300,45235841,felixmendoncajr,Félix Mendonça Jr.,,@JulianaBrizola Muito bom. Saudades do Brizola.,pt,[],[],[],0,0,3,[],[],https://twitter.com/FelixMendoncaJr/status/1414334797942562825,False,,0,,,,,,,,"[{'screen_name': 'JulianaBrizola', 'name': 'Juliana Brizola 🌹', 'id': '29994116'}]",,,,
