id,conversation_id,created_at,date,time,timezone,user_id,username,name,place,tweet,language,mentions,urls,photos,replies_count,retweets_count,likes_count,hashtags,cashtags,link,retweet,quote_url,video,thumbnail,near,geo,source,user_rt_id,user_rt,retweet_id,reply_to,retweet_date,translate,trans_src,trans_dest
1162385860999942144,1162385860999942144,2019-08-16 12:29:20 -0300,2019-08-16,12:29:20,-300,59323812,fernandofilhope,Fernando Filho,,"É muito gratificante ver como o dia a dia dos pequenos produtores de Salgueiro hoje está melhor. Aí ao meu lado estão os 2 tratores adquiridos com a emenda de R$ 1.1 milhão que destinamos para o município, recurso que também foi utilizado na compra de 1 caçamba e 2 escavadeiras.  https://t.co/FnopjCSZkK",pt,[],[],['https://pbs.twimg.com/media/ECGfxMCXYAEn50c.jpg'],0,0,1,[],[],https://twitter.com/fernandofilhope/status/1162385860999942144,False,,1,https://pbs.twimg.com/media/ECGfxMCXYAEn50c.jpg,,,,,,,[],,,,
1161985279336636417,1161985279336636417,2019-08-15 09:57:33 -0300,2019-08-15,09:57:33,-300,59323812,fernandofilhope,Fernando Filho,,"Que nossa fé se renove a cada manhã e que Nossa Senhora Rainha dos Anjos, Padroeira de Petrolina, abençoe sempre a todos nós!  https://t.co/btUFZCJyiO",pt,[],[],['https://pbs.twimg.com/media/ECAzchYXkAUlgEu.jpg'],0,0,7,[],[],https://twitter.com/fernandofilhope/status/1161985279336636417,False,,1,https://pbs.twimg.com/media/ECAzchYXkAUlgEu.jpg,,,,,,,[],,,,
1161734250141552644,1161734250141552644,2019-08-14 17:20:03 -0300,2019-08-14,17:20:03,-300,59323812,fernandofilhope,Fernando Filho,,"Recebendo, aqui em Brasília, a visita dos prefeitos de Petrolina (@miguelcoelhope), Santa Cruz do Capibaribe (@edsonvieira45) e São Joaquim do Monte (João Tenório), e também da deputada estadual Alessandra Vieira.  https://t.co/amRrioENdW",pt,"[{'screen_name': 'miguelcoelhope', 'name': 'miguel coelho', 'id': '66525428'}]",[],['https://pbs.twimg.com/media/EB9PI1vXYAA_SnZ.jpg'],0,1,3,[],[],https://twitter.com/fernandofilhope/status/1161734250141552644,False,,1,https://pbs.twimg.com/media/EB9PI1vXYAA_SnZ.jpg,,,,,,,[],,,,
1161647317084188672,1161647317084188672,2019-08-14 11:34:37 -0300,2019-08-14,11:34:37,-300,59323812,fernandofilhope,Fernando Filho,,"Não há imagem mais gratificante para um sertanejo que ver um poço jorrando tanta água! Esse fica na comunidade de Pé da Serra, em Serrita, e hoje é uma realidade graças à emenda que destinamos no valor de R$ 1.1 milhão, recurso usado para a aquisição da máquina perfuratriz.  https://t.co/gDHEUpR522",pt,[],[],[],0,0,3,[],[],https://twitter.com/fernandofilhope/status/1161647317084188672,False,,1,https://pbs.twimg.com/ext_tw_video_thumb/1161647258800218114/pu/img/sMdx-aKjUb1oQo8V.jpg,,,,,,,[],,,,
1160958479433117696,1160958479433117696,2019-08-12 13:57:25 -0300,2019-08-12,13:57:25,-300,59323812,fernandofilhope,Fernando Filho,,"Nada como começar a semana com mais um resultado do nosso trabalho, feito com seriedade e força política pra gente ter novas oportunidades para os produtores de mel. Em Petrolina, a Casa do Mel está com as obras avançadas, e em mais algumas semanas deve estar pronta.  https://t.co/7ruZgOU9gc",pt,[],[],[],0,0,2,[],[],https://twitter.com/fernandofilhope/status/1160958479433117696,False,,1,https://pbs.twimg.com/ext_tw_video_thumb/1160958320724926464/pu/img/PefaWPk_qjc4o1pS.jpg,,,,,,,[],,,,
1160526496303374336,1160526496303374336,2019-08-11 09:20:52 -0300,2019-08-11,09:20:52,-300,59323812,fernandofilhope,Fernando Filho,,"Nenhuma palavra conseguiria expressar o orgulho que sinto por ter seu exemplo diariamente em minha vida, meu pai. Ter você ao meu lado tanto como pai quanto inspiração política é o que mais inspira a continuar trabalhando. Feliz Dia dos Pais!  @fbezerracoelho  https://t.co/aXKjcEWc4W",pt,"[{'screen_name': 'fbezerracoelho', 'name': 'fernando bezerra', 'id': '53702605'}]",[],"['https://pbs.twimg.com/media/EBsEr4yWsAE_Ce7.jpg', 'https://pbs.twimg.com/media/EBsEr42WsAE1h-7.jpg']",0,1,6,[],[],https://twitter.com/fernandofilhope/status/1160526496303374336,False,,1,https://pbs.twimg.com/media/EBsEr4yWsAE_Ce7.jpg,,,,,,,[],,,,
1160253348836233216,1160253348836233216,2019-08-10 15:15:29 -0300,2019-08-10,15:15:29,-300,59323812,fernandofilhope,Fernando Filho,,"Continuando o giro aqui pelo interior de Petrolina, hoje a alegria por visitar Izacolândia no seu aniversário de 45 anos e poder ver de perto a Caravana da Cidadania, mutirão da @prefeiturapetrolina que leva diversos atendimentos e serviços públicos pra população.  https://t.co/mduhYAVxWG",pt,[],[],"['https://pbs.twimg.com/media/EBoMQdBWsAA6B66.jpg', 'https://pbs.twimg.com/media/EBoMQdEXUAE_80I.jpg', 'https://pbs.twimg.com/media/EBoMQc-XoAAyYNG.jpg']",0,0,1,[],[],https://twitter.com/fernandofilhope/status/1160253348836233216,False,,1,https://pbs.twimg.com/media/EBoMQdBWsAA6B66.jpg,,,,,,,[],,,,
1160186678864175105,1160186678864175105,2019-08-10 10:50:34 -0300,2019-08-10,10:50:34,-300,59323812,fernandofilhope,Fernando Filho,,"Bom dia, pessoal! Aproveitando esse sábado para conferir o andamento de duas grandes obras que estão sendo realizadas no interior de Petrolina: a pavimentação de 18 ruas na Agrovila Massangano e a construção da Casa do Mel, no povoado do Roçado.  https://t.co/LnGKbDjwB6",pt,[],[],"['https://pbs.twimg.com/media/EBnPld_X4AYjo7H.jpg', 'https://pbs.twimg.com/media/EBnPleDWsAA8nDN.jpg', 'https://pbs.twimg.com/media/EBnPleIXoAA9-2f.jpg']",0,0,3,[],[],https://twitter.com/fernandofilhope/status/1160186678864175105,False,,1,https://pbs.twimg.com/media/EBnPld_X4AYjo7H.jpg,,,,,,,[],,,,
1159517328893251586,1159517328893251586,2019-08-08 14:30:48 -0300,2019-08-08,14:30:48,-300,59323812,fernandofilhope,Fernando Filho,,"Ao lado do sen. @fbezerracoelho, do dep. Silvio Costa e de Pedro Guimarães, pres. da Caixa, para compartilhar uma boa notícia para o Nordeste: em breve, o banco terá um grupo de trabalho para apresentar medidas que ampliem as operações de crédito na região. Mais força para todos!  https://t.co/sPuVzPPJZU",pt,"[{'screen_name': 'fbezerracoelho', 'name': 'fernando bezerra', 'id': '53702605'}]",[],['https://pbs.twimg.com/media/EBdu3NaXYAMd7_J.jpg'],3,0,2,[],[],https://twitter.com/fernandofilhope/status/1159517328893251586,False,,1,https://pbs.twimg.com/media/EBdu3NaXYAMd7_J.jpg,,,,,,,[],,,,
1150080178804154370,1150080178804154370,2019-07-13 13:30:56 -0300,2019-07-13,13:30:56,-300,59323812,fernandofilhope,Fernando Filho,, https://t.co/xqioU2cyVX,und,[],['https://www.diariodepernambuco.com.br/noticia/economia/2019/07/produtos-pernambucanos-serao-beneficiados-com-acordo-do-mercosul-com-u.html'],[],0,1,3,[],[],https://twitter.com/fernandofilhope/status/1150080178804154370,False,,0,,,,,,,,[],,,,
1126470588674072577,1126470588674072577,2019-05-09 09:54:51 -0300,2019-05-09,09:54:51,-300,59323812,fernandofilhope,Fernando Filho,,"Ontem tive o prazer em proferir uma palestra na ""Round Table sobre Política Energética para o Setor de Óleo e Gás Brasileiro"", a convite da FGV Energia, na Rice University, em Houston (Texas/EUA).  https://t.co/yn00QrOzpv",pt,[],[],['https://pbs.twimg.com/media/D6IFw7KWsAA5Ks3.jpg'],12,1,9,[],[],https://twitter.com/fernandofilhope/status/1126470588674072577,False,,1,https://pbs.twimg.com/media/D6IFw7KWsAA5Ks3.jpg,,,,,,,[],,,,
1126185893537177602,1126181261414948865,2019-05-08 15:03:35 -0300,2019-05-08,15:03:35,-300,59323812,fernandofilhope,Fernando Filho,,"@celiarejanef @miguelcoelhope A prefeitura de Petrolina vai sim fazer a ciclovia na 7 de setembro, pode aguardar.",pt,[],[],[],1,0,2,[],[],https://twitter.com/fernandofilhope/status/1126185893537177602,False,,0,,,,,,,,"[{'screen_name': 'celiarejanef', 'name': 'Célia Rejane', 'id': '1322473933'}, {'screen_name': 'miguelcoelhope', 'name': 'Miguel Coelho', 'id': '66525428'}]",,,,
1126181261414948865,1126181261414948865,2019-05-08 14:45:10 -0300,2019-05-08,14:45:10,-300,59323812,fernandofilhope,Fernando Filho,,"Hoje à noite, o prefeito @miguelcoelhope entregará para todos os moradores do bairro Fernando Idalino uma nova quadra poliesportiva, conquista alcançada com a emenda de R$ 5.4 milhões que destinamos para essas obras. Orgulho em ver nosso trabalho dando frutos em Petrolina.",pt,"[{'screen_name': 'miguelcoelhope', 'name': 'miguel coelho', 'id': '66525428'}]",[],[],4,1,7,[],[],https://twitter.com/fernandofilhope/status/1126181261414948865,False,,0,,,,,,,,[],,,,
1120699459250343936,1120699459250343936,2019-04-23 11:42:27 -0300,2019-04-23,11:42:27,-300,59323812,fernandofilhope,Fernando Filho,,"Não pude estar presente, mas ver essas fotos da entrega da nova Unidade de Saúde do São Gonçalo, em Petrolina, me enche de alegria! O trabalho que a gente faz aqui em Brasília chega em Petrolina e o prefeito @miguelcoelhope joga duro, transformando-o em grandes resultados!  https://t.co/YXYQwIpHeR",pt,"[{'screen_name': 'miguelcoelhope', 'name': 'miguel coelho', 'id': '66525428'}]",[],"['https://pbs.twimg.com/media/D42GGlXXoAAUvES.jpg', 'https://pbs.twimg.com/media/D42GGlWXoAINane.jpg', 'https://pbs.twimg.com/media/D42GGlXWwAAVIMO.jpg']",4,0,2,[],[],https://twitter.com/fernandofilhope/status/1120699459250343936,False,,1,https://pbs.twimg.com/media/D42GGlXXoAAUvES.jpg,,,,,,,[],,,,
1117847982987042824,1117847982987042824,2019-04-15 14:51:42 -0300,2019-04-15,14:51:42,-300,59323812,fernandofilhope,Fernando Filho,,"Já cumprindo a agenda de reuniões com a ministra da Agricultura, Pecuária e Abastecimento, Tereza Cristina, aqui em Petrolina, logo cedo nos reunimos com produtores e criadores rurais, no Sindicato Patronal Rural e visitamos a Bayer/Monsanto.  https://t.co/T1JhN6ADwo",pt,[],[],"['https://pbs.twimg.com/media/D4NkzBGXoAAvqvV.jpg', 'https://pbs.twimg.com/media/D4NkzBGX4AE-JM4.jpg']",1,0,3,[],[],https://twitter.com/fernandofilhope/status/1117847982987042824,False,,1,https://pbs.twimg.com/media/D4NkzBGXoAAvqvV.jpg,,,,,,,[],,,,
1117733603239186432,1117733603239186432,2019-04-15 07:17:12 -0300,2019-04-15,07:17:12,-300,59323812,fernandofilhope,Fernando Filho,,"Bom dia, pessoal! Já tô aqui a caminho do aeroporto, que logo mais estarei em Petrolina levando a amiga Ministra da Agricultura Tereza Cristina. Tem muita coisa bacana chegando!",pt,[],[],[],1,0,9,[],[],https://twitter.com/fernandofilhope/status/1117733603239186432,False,,0,,,,,,,,[],,,,
1116422168680837120,1116422168680837120,2019-04-11 16:26:01 -0300,2019-04-11,16:26:01,-300,59323812,fernandofilhope,Fernando Filho,,Com todo time da XP  https://t.co/4a3pM5rA1O,pt,[],[],['https://pbs.twimg.com/media/D35T7WjW0AY3T2N.jpg'],1,1,7,[],[],https://twitter.com/fernandofilhope/status/1116422168680837120,False,,1,https://pbs.twimg.com/media/D35T7WjW0AY3T2N.jpg,,,,,,,[],,,,
1116421938925142016,1116421938925142016,2019-04-11 16:25:07 -0300,2019-04-11,16:25:07,-300,59323812,fernandofilhope,Fernando Filho,,"Vim ao ""XP Investments Conference Brazil: First 100 Days"", evento organizado pela XP Investimentos e que estou tendo a honra de participar junto ao presidente da Câmara, @RodrigoMaia. Alegria para mim e um grande momento para nosso país!",pt,"[{'screen_name': 'rodrigomaia', 'name': 'rodrigo maia', 'id': '35260027'}]",[],[],0,0,2,[],[],https://twitter.com/fernandofilhope/status/1116421938925142016,False,,0,,,,,,,,[],,,,
1115674553211027457,1115674553211027457,2019-04-09 14:55:16 -0300,2019-04-09,14:55:16,-300,59323812,fernandofilhope,Fernando Filho,,"Terça de muito trabalho e reuniões aqui em Brasília. Hoje tive o prazer de receber a visita dos amigos Erivaldo (prefeito de Serrita), Diogo Henrique (secretário de administração de Serrita), Túlio Alves (prefeito de Bodocó) e Chaparral (prefeito de Orobó).",pt,[],[],[],1,0,4,[],[],https://twitter.com/fernandofilhope/status/1115674553211027457,False,,0,,,,,,,,[],,,,
1114154169907187712,1114154169907187712,2019-04-05 10:13:48 -0300,2019-04-05,10:13:48,-300,59323812,fernandofilhope,Fernando Filho,,"Hoje vamos encerrar a semana com mais um grupo de ruas pavimentadas a ser entregue, e mais tarde espero todos vocês, às 19h, para entregarmos as 22 ruas beneficiadas com pavimentação asfáltica no distrito de Tapera, em Petrolina.",pt,[],[],[],1,0,1,[],[],https://twitter.com/fernandofilhope/status/1114154169907187712,False,,0,,,,,,,,[],,,,
1113847655661285382,1113847655661285382,2019-04-04 13:55:50 -0300,2019-04-04,13:55:50,-300,59323812,fernandofilhope,Fernando Filho,,"Compromisso assumido, resultado obtido. 👍🏼 o presidente da ANAC já me confirmou que a partir de junho a @voepassaredo começará a operar as rotas Petrolina/Salvador/Petrolina. Agora vai dar tempo de chamar os amigos baianos pra curtir o São João de Petrolina.",pt,[],[],[],0,4,60,[],[],https://twitter.com/fernandofilhope/status/1113847655661285382,False,,0,,,,,,,,[],,,,
1111635970384904192,1111635970384904192,2019-03-29 11:27:23 -0300,2019-03-29,11:27:23,-300,59323812,fernandofilhope,Fernando Filho,,"Já tô aqui a caminho do aeroporto para logo mais entregar, junto com o prefeito @miguelcoelhope, a nova Avenida dos Tapuios, que foi pavimentada, teve seu canal coberto e o resultado ficou bem bacana! Muito feliz por ter contribuído com este projeto.",pt,"[{'screen_name': 'miguelcoelhope', 'name': 'miguel coelho', 'id': '66525428'}]",[],[],1,0,12,[],[],https://twitter.com/fernandofilhope/status/1111635970384904192,False,,0,,,,,,,,[],,,,
1110954698532630533,1110954698532630533,2019-03-27 14:20:15 -0300,2019-03-27,14:20:15,-300,59323812,fernandofilhope,Fernando Filho,,"Ontem conversei com o presidente da ANAC, José Ricardo Botelho, pedindo para que encontremos uma solução a respeito, sobre o encerramento das operações da companhia aérea Avianca em Petrolina, para que não afete negativamente setores como o turismo e a economia da nossa região.",pt,[],[],[],2,0,6,[],[],https://twitter.com/fernandofilhope/status/1110954698532630533,False,,0,,,,,,,,[],,,,
1110647871731367942,1110647871731367942,2019-03-26 18:01:02 -0300,2019-03-26,18:01:02,-300,59323812,fernandofilhope,Fernando Filho,,"Ponto positivo para Petrolina e o Vale do São Francisco como um todo! Em meio a tantas notícias de desemprego pelo país, Petrolina vai na contramão e é a 3ª cidade que mais gerou empregos em Pernambuco no último mês de fevereiro. Parabéns ao prefeito de Petrolina.  https://t.co/KvNU1Pu32K",pt,[],[],['https://pbs.twimg.com/media/D2nQWVbXcAEOPv4.jpg'],1,1,4,[],[],https://twitter.com/fernandofilhope/status/1110647871731367942,False,,1,https://pbs.twimg.com/media/D2nQWVbXcAEOPv4.jpg,,,,,,,[],,,,
1110317186978140161,1110317186978140161,2019-03-25 20:07:00 -0300,2019-03-25,20:07:00,-300,59323812,fernandofilhope,Fernando Filho,,"Mais luz, mais trabalho e Petrolina avançando por um caminho com mais resultados.  https://t.co/k9hkdOVuZA",pt,[],[],['https://pbs.twimg.com/media/D2ijkOHXQAYUPTD.jpg'],2,0,6,[],[],https://twitter.com/fernandofilhope/status/1110317186978140161,False,,1,https://pbs.twimg.com/media/D2ijkOHXQAYUPTD.jpg,,,,,,,[],,,,
1108088560236797954,1108088560236797954,2019-03-19 16:31:14 -0300,2019-03-19,16:31:14,-300,59323812,fernandofilhope,Fernando Filho,,"Quando se tem união e força de vontade o resultado é esse, 26 vias sendo pavimentadas simultaneamente em Petrolina e mais 33 em comunidades ribeirinhas. Muito trabalho e muito investimento para transformar a vida da nossa gente.  https://t.co/EG7HypOOlk",pt,[],[],"['https://pbs.twimg.com/media/D2C1qzhX0AAG4e3.jpg', 'https://pbs.twimg.com/media/D2C1q2KWkAElOXQ.jpg']",4,1,8,[],[],https://twitter.com/fernandofilhope/status/1108088560236797954,False,,1,https://pbs.twimg.com/media/D2C1qzhX0AAG4e3.jpg,,,,,,,[],,,,
1106612570839023617,1106612570839023617,2019-03-15 14:46:11 -0300,2019-03-15,14:46:11,-300,59323812,fernandofilhope,Fernando Filho,,Estive hoje na Fábrica da Alpek Poliéster em Suape com o senador @fbezerracoelho conhecendo suas instalações e discutindo sobre a importância de negócios como este para o crescimento do nosso estado. A Alpek está presente em Pernambuco desde maio do ano passado.  https://t.co/21c6p8eNN6,pt,"[{'screen_name': 'fbezerracoelho', 'name': 'fernando bezerra', 'id': '53702605'}]",[],['https://pbs.twimg.com/media/D1t4ukBW0AUiRHS.jpg'],0,1,7,[],[],https://twitter.com/fernandofilhope/status/1106612570839023617,False,,1,https://pbs.twimg.com/media/D1t4ukBW0AUiRHS.jpg,,,,,,,[],,,,
1106276126761078784,1106276126761078784,2019-03-14 16:29:16 -0300,2019-03-14,16:29:16,-300,59323812,fernandofilhope,Fernando Filho,,"Mais um poço sendo montado e dessa vez é no Sítio Satisfeito II, na comunidade de Rajada. Alegria em poder beneficiar diversas famílias no interior da nossa cidade.  É a força do trabalho gerando resultados para o nosso Pernambuco.  https://t.co/9YOWQUCRg0",pt,[],[],"['https://pbs.twimg.com/media/D1pG1mJXQAEDnHy.jpg', 'https://pbs.twimg.com/media/D1pG1mOWsAAwJ1c.jpg', 'https://pbs.twimg.com/media/D1pG1lvXgAEnWIe.jpg', 'https://pbs.twimg.com/media/D1pG1cRWkAEJ5Z8.jpg']",0,0,3,[],[],https://twitter.com/fernandofilhope/status/1106276126761078784,False,,1,https://pbs.twimg.com/media/D1pG1mJXQAEDnHy.jpg,,,,,,,[],,,,
1106191299986837504,1106191299986837504,2019-03-14 10:52:12 -0300,2019-03-14,10:52:12,-300,59323812,fernandofilhope,Fernando Filho,,"Ontem foi dia de comemoração pela inauguração de mais um posto de saúde em Petrolina, o décimo primeiro que ajudamos o prefeito @miguelcoelhope a abrir as portas para atender bem a população, e isso em menos de 10 meses. Fico muito feliz com os resultados do nosso trabalho!  https://t.co/rc5N3qdPn5",pt,"[{'screen_name': 'miguelcoelhope', 'name': 'miguel coelho', 'id': '66525428'}]",[],[],0,0,2,[],[],https://twitter.com/fernandofilhope/status/1106191299986837504,False,,1,https://pbs.twimg.com/ext_tw_video_thumb/1106190727552397312/pu/img/1S_vWsTTovWuChyP.jpg,,,,,,,[],,,,
1106166641056976897,1106166641056976897,2019-03-14 09:14:13 -0300,2019-03-14,09:14:13,-300,59323812,fernandofilhope,Fernando Filho,,"É com pesar que lamento profundamente o ocorrido na Escola Estadual Prof. Raul Brasil, em Suzano. Deixo toda a minha solidariedade e força para os familiares e amigos das vítimas dessa tragédia.",pt,[],[],[],0,0,1,[],[],https://twitter.com/fernandofilhope/status/1106166641056976897,False,,0,,,,,,,,[],,,,
1082972607270567936,1082972607270567936,2019-01-09 10:09:24 -0200,2019-01-09,10:09:24,-300,59323812,fernandofilhope,Fernando Filho,,Confira nossa agenda de hoje em Petrolina-PE.  https://t.co/69CUWlH0Oy,pt,[],[],['https://pbs.twimg.com/media/Dwd91nCW0AAGHMl.jpg'],1,0,4,[],[],https://twitter.com/fernandofilhope/status/1082972607270567936,False,,1,https://pbs.twimg.com/media/Dwd91nCW0AAGHMl.jpg,,,,,,,[],,,,
1076463120133079040,1076463120133079040,2018-12-22 11:03:02 -0200,2018-12-22,11:03:02,-300,59323812,fernandofilhope,Fernando Filho,,"Ontem ao embarcar para Petrolina tive a grata surpresa de ver que a aeronave levava o nome do amigo Ozires Silva, ex-ministro de infraestrutura e comunicações, um dos grandes engenheiros aeronáuticos desse nosso Brasil.  https://t.co/yGJezBRL86",pt,[],[],"['https://pbs.twimg.com/media/DvBdfWIWsAE4RxG.jpg', 'https://pbs.twimg.com/media/DvBdgCnXgAAqjlW.jpg']",0,0,6,[],[],https://twitter.com/fernandofilhope/status/1076463120133079040,False,,1,https://pbs.twimg.com/media/DvBdfWIWsAE4RxG.jpg,,,,,,,[],,,,
1075778144064290816,1075778144064290816,2018-12-20 13:41:11 -0200,2018-12-20,13:41:11,-300,59323812,fernandofilhope,Fernando Filho,,"Hoje a cidade mãe do Pajeú completa 55 anos de emancipação política. Parabéns Ingazeira, sinônimo de um povo guerreiro e batalhador.  #deputadofederal #ingazeira55 #pernambuco #emancipacaopolitica  https://t.co/7QiabOxpiZ",pt,[],[],['https://pbs.twimg.com/media/Du3ugqBUUAEaMAB.jpg'],1,0,4,"['deputadofederal', 'ingazeira55', 'pernambuco', 'emancipacaopolitica']",[],https://twitter.com/fernandofilhope/status/1075778144064290816,False,,1,https://pbs.twimg.com/media/Du3ugqBUUAEaMAB.jpg,,,,,,,[],,,,
1073538194141077505,1073538194141077505,2018-12-14 09:20:25 -0200,2018-12-14,09:20:25,-300,59323812,fernandofilhope,Fernando Filho,,"Neste momento estou participando ao vivo no programa do amigo Edenevaldo Alves na Petrolina FM 98,3. Agradecendo ao apoio recebido e anunciando os novos investimentos que estão chegando para Petrolina.  https://t.co/2aFpudzqcY",pt,[],[],"['https://pbs.twimg.com/media/DuX5QH2XgAAQnKn.jpg', 'https://pbs.twimg.com/media/DuX5QjyW0AAS_0T.jpg', 'https://pbs.twimg.com/media/DuX5RrvW4AAFNY-.jpg', 'https://pbs.twimg.com/media/DuX5S1AWsAE84-H.jpg']",0,0,3,[],[],https://twitter.com/fernandofilhope/status/1073538194141077505,False,,1,https://pbs.twimg.com/media/DuX5QH2XgAAQnKn.jpg,,,,,,,[],,,,
1073025398592684032,1073025398592684032,2018-12-12 23:22:45 -0200,2018-12-12,23:22:45,-300,59323812,fernandofilhope,Fernando Filho,,Mais uma quadra entregue das 26 que estão previstas nesta etapa. Petrolina cada vez mais forte também no lazer. É trabalho que gera resultados. Matéria completa:  https://t.co/1mWKC1q40q  https://t.co/JtnsNmPfzC,pt,[],['https://www.instagram.com/p/BrTxCUSBhbJ/?utm_source=ig_share_sheet&igshid=1rzfwy19jhi7q'],"['https://pbs.twimg.com/media/DuQm5CFWoAIZGyH.jpg', 'https://pbs.twimg.com/media/DuQm5qtW4AEcJ-0.jpg', 'https://pbs.twimg.com/media/DuQm6J8WwAAY196.jpg']",1,0,5,[],[],https://twitter.com/fernandofilhope/status/1073025398592684032,False,,1,https://pbs.twimg.com/media/DuQm5CFWoAIZGyH.jpg,,,,,,,[],,,,
1068098353102290945,1068098353102290945,2018-11-29 09:04:26 -0200,2018-11-29,09:04:26,-300,59323812,fernandofilhope,Fernando Filho,,#NewProfilePic  https://t.co/tbIPjX1JLA,und,[],[],['https://pbs.twimg.com/media/DtKlyVrW0AER98O.jpg'],0,0,5,['newprofilepic'],[],https://twitter.com/fernandofilhope/status/1068098353102290945,False,,1,https://pbs.twimg.com/media/DtKlyVrW0AER98O.jpg,,,,,,,[],,,,
1067145310399549440,1067145310399549440,2018-11-26 17:57:23 -0200,2018-11-26,17:57:23,-300,59323812,fernandofilhope,Fernando Filho,,Já viram como está ficando o novo Estádio Paulo de Souza Coelho? Leia matéria completa em  https://t.co/loPLOwNnoO,pt,[],['https://www.instagram.com/p/Bqp-6ARBTmp/?utm_source=ig_share_sheet&igshid=1vhfc5lrixmdv'],[],0,0,1,[],[],https://twitter.com/fernandofilhope/status/1067145310399549440,False,,0,,,,,,,,[],,,,
1066354001158041600,1066354001158041600,2018-11-24 13:33:00 -0200,2018-11-24,13:33:00,-300,59323812,fernandofilhope,Fernando Filho,,"Registro do almoço de quinta, reencontrando um amigo que ganhei no MME. Aprendendo com Barrosinho, que chegou de uma temporada na Agência Internacional de Energia. #amizade #trabalho #MME  https://t.co/iwaMdMxBWe",pt,[],['https://www.instagram.com/p/BqkXHcYhXyU/?utm_source=ig_twitter_share&igshid=13cylal334rxx'],[],0,0,7,"['amizade', 'trabalho', 'mme']",[],https://twitter.com/fernandofilhope/status/1066354001158041600,False,,0,,,,,,,,[],,,,
1066078118430064641,1066078118430064641,2018-11-23 19:16:44 -0200,2018-11-23,19:16:44,-300,59323812,fernandofilhope,Fernando Filho,,"Estive ontem na Praia Forte em Salvador-BA, participando do 10° Encontro Anual do Mercado Livre de Energia. Confira matéria completa no link  https://t.co/MWQsPXKyl1",pt,[],['https://www.instagram.com/p/BqiZ4bfhRGh/?utm_source=ig_share_sheet&igshid=ij9idj10hgu4'],[],0,0,3,[],[],https://twitter.com/fernandofilhope/status/1066078118430064641,False,,0,,,,,,,,[],,,,
1065767752349167616,1065767752349167616,2018-11-22 22:43:27 -0200,2018-11-22,22:43:27,-300,59323812,fernandofilhope,Fernando Filho,,"Matéria de hoje no site ""O Antagonista"" destaca o importante trabalho que foi feito no Ministério de Minas e Energia.  https://t.co/Sp17meQefe",pt,[],[],['https://pbs.twimg.com/media/DspeG78UcAA2sLf.jpg'],1,8,26,[],[],https://twitter.com/fernandofilhope/status/1065767752349167616,False,,1,https://pbs.twimg.com/media/DspeG78UcAA2sLf.jpg,,,,,,,[],,,,
1065697352118353921,1065697352118353921,2018-11-22 18:03:43 -0200,2018-11-22,18:03:43,-300,59323812,fernandofilhope,Fernando Filho,,"Pessoal, hoje recebemos o Ministro da Saúde, Gilberto Occhi, onde anunciamos que a Apami foi oficialmente habilitada como Hospital Dom Tomás, passando a receber a partir de agora recursos do governo federal e estadual.   https://t.co/pCcGF0qulD",pt,[],['https://www.instagram.com/p/BqfL2V7Bjtx/?utm_source=ig_share_sheet&igshid=1o6jf8zqpgtu9'],[],0,0,1,[],[],https://twitter.com/fernandofilhope/status/1065697352118353921,False,,0,,,,,,,,[],,,,
1064872616320745473,1064672334295048192,2018-11-20 11:26:30 -0200,2018-11-20,11:26:30,-300,59323812,fernandofilhope,Fernando Filho,,@elenalandau Obrigado pelo carinho.,pt,[],[],[],0,0,0,[],[],https://twitter.com/fernandofilhope/status/1064872616320745473,False,,0,,,,,,,,"[{'screen_name': 'ElenaLandau', 'name': 'Landau Elena', 'id': '1385058800126898180'}]",,,,
1064848910764642304,1064848910764642304,2018-11-20 09:52:18 -0200,2018-11-20,09:52:18,-300,59323812,fernandofilhope,Fernando Filho,,Visita do amigo e vereador de Serra Talhada Zé Raimundo juntamente com o prefeito de Serra Luciano Duque.    https://t.co/RUrOaqGmAs,pt,[],['https://www.instagram.com/p/BqXcdVQhOF8/?utm_source=ig_share_sheet&igshid=d9gqy97hk1za'],[],0,0,2,[],[],https://twitter.com/fernandofilhope/status/1064848910764642304,False,,0,,,,,,,,[],,,,
1064672334295048192,1064672334295048192,2018-11-19 22:10:39 -0200,2018-11-19,22:10:39,-300,59323812,fernandofilhope,Fernando Filho,,Encerrando nosso dia de hoje em Brasília em reunião com o Ministro das Cidades Alexandre Baldy.  https://t.co/XSWYd1vBIx,pt,[],['https://www.instagram.com/p/BqYaouElnwa/?utm_source=ig_share_sheet&igshid=1exc6tmp1kkpz'],[],0,0,8,[],[],https://twitter.com/fernandofilhope/status/1064672334295048192,False,,0,,,,,,,,[],,,,
