id,conversation_id,created_at,date,time,timezone,user_id,username,name,place,tweet,language,mentions,urls,photos,replies_count,retweets_count,likes_count,hashtags,cashtags,link,retweet,quote_url,video,thumbnail,near,geo,source,user_rt_id,user_rt,retweet_id,reply_to,retweet_date,translate,trans_src,trans_dest
1524015406956097541,1524015404506619910,2022-05-10 10:16:02 -03,2022-05-10,10:16:02,-300,59323812,fernandofilhope,Fernando Filho,,"Na pauta, discutimos sobre a liberação de recursos para a duplicação da Avenida Transnordestina, novas obras de pavimentação e o convênio para a construção do abatedouro de galinha caipira. Importantes projetos que vão fortalecer ainda mais nossa Petrolina.",pt,[],[],[],0,0,2,[],[],https://twitter.com/fernandofilhope/status/1524015406956097541,False,,0,,,,,,,,[],,,,
1524015404506619910,1524015404506619910,2022-05-10 10:16:01 -03,2022-05-10,10:16:01,-300,59323812,fernandofilhope,Fernando Filho,,"Registro de mais uma agenda aqui em Brasília com o prefeito de Petrolina, @DurandoSimao. Ao lado do pré-candidato a governador @miguelcoelhope, participamos de uma reunião com o presidente da @codevasf, Marcelo Moreira.  https://t.co/hHApHtS25c",pt,"[{'screen_name': 'durandosimao', 'name': 'simão durando', 'id': '1512228694538039318'}, {'screen_name': 'miguelcoelhope', 'name': 'miguel coelho', 'id': '66525428'}, {'screen_name': 'codevasf', 'name': 'codevasf', 'id': '256988854'}]",[],"['https://pbs.twimg.com/media/FSZj4xjXEAUC5Rr.jpg', 'https://pbs.twimg.com/media/FSZj7TuX0AEhPHJ.jpg']",1,1,6,[],[],https://twitter.com/fernandofilhope/status/1524015404506619910,False,,1,https://pbs.twimg.com/media/FSZj4xjXEAUC5Rr.jpg,,,,,,,[],,,,
1523738096051027969,1523738092565254144,2022-05-09 15:54:06 -03,2022-05-09,15:54:06,-300,59323812,fernandofilhope,Fernando Filho,,"Na ocasião, discutimos sobre uma série de ações importantes que queremos viabilizar junto ao Ministério para melhorar a qualidade de vida da população, como a criação de um abrigo municipal para pessoas em situação de rua.",pt,[],[],[],0,0,2,[],[],https://twitter.com/fernandofilhope/status/1523738096051027969,False,,0,,,,,,,,[],,,,
1523738092565254144,1523738092565254144,2022-05-09 15:54:05 -03,2022-05-09,15:54:05,-300,59323812,fernandofilhope,Fernando Filho,,"Mais um dia intenso de reuniões, aqui em Brasília, para tratar de temas importantes para o desenvolvimento de Pernambuco. Ao lado do prefeito de Petrolina, @DurandoSimao e do senador @fbezerracoelho, participei da audiência com o ministro da Cidadania, Ronaldo Vieira.  https://t.co/rqggBbQEoz",pt,"[{'screen_name': 'durandosimao', 'name': 'simão durando', 'id': '1512228694538039318'}, {'screen_name': 'fbezerracoelho', 'name': 'fernando bezerra', 'id': '53702605'}]",[],"['https://pbs.twimg.com/media/FSVnr4IWQAA_EA0.jpg', 'https://pbs.twimg.com/media/FSVnr4JWUAUzpd4.jpg']",3,0,5,[],[],https://twitter.com/fernandofilhope/status/1523738092565254144,False,,1,https://pbs.twimg.com/media/FSVnr4IWQAA_EA0.jpg,,,,,,,[],,,,
1522019673679794178,1522019671515488256,2022-05-04 22:05:42 -03,2022-05-04,22:05:42,-300,59323812,fernandofilhope,Fernando Filho,,"Uma antiga demanda, que irá regulamentar o piso salarial de cerca de 2,5 milhões de profissionais da enfermagem no Brasil, entre ele os técnicos, auxiliares e parteiras. Valorizar os profissionais da enfermagem é valorizar a saúde do povo brasileiro!",pt,[],[],[],0,0,2,[],[],https://twitter.com/fernandofilhope/status/1522019673679794178,False,,0,,,,,,,,[],,,,
1522019671515488256,1522019671515488256,2022-05-04 22:05:42 -03,2022-05-04,22:05:42,-300,59323812,fernandofilhope,Fernando Filho,,"Dia histórico para todos os profissionais da Enfermagem! Hoje, a Câmara dos Deputados mostrou o seu compromisso e aprovou o PL2564/2020, que estabelece o piso nacional da enfermagem.",pt,[],[],[],2,0,4,[],[],https://twitter.com/fernandofilhope/status/1522019671515488256,False,,0,,,,,,,,[],,,,
1521521973670645762,1521521863545004032,2022-05-03 13:08:01 -03,2022-05-03,13:08:01,-300,59323812,fernandofilhope,Fernando Filho,,"Por meio desta importante conquista, mais de 100 famílias deixarão a lista dos carros-pipas e passarão a ter água de qualidade saindo de suas torneiras. Esta obra só reforça o cuidado e atenção da nossa força politica com o homem e a mulher sertaneja.",pt,[],[],[],0,0,1,[],[],https://twitter.com/fernandofilhope/status/1521521973670645762,False,,0,,,,,,,,[],,,,
1521521866858549249,1521521863545004032,2022-05-03 13:07:36 -03,2022-05-03,13:07:36,-300,59323812,fernandofilhope,Fernando Filho,,"As obras da Adutora das comunidades de Lagoa dos Cavalos, Caiçara e Barreiros, na zona rural de Petrolina, continuam avançando e, logo logo, proporcionarão benefícios para os moradores e também para os pequenos produtores.",pt,[],[],[],1,0,2,[],[],https://twitter.com/fernandofilhope/status/1521521866858549249,False,,0,,,,,,,,[],,,,
1521521863545004032,1521521863545004032,2022-05-03 13:07:35 -03,2022-05-03,13:07:35,-300,59323812,fernandofilhope,Fernando Filho,,"Levar água ao interior dos municípios pernambucanos sempre traz um sentimento de alegria, tanto por transformar a vida das pessoas quanto por fortalecer o nosso estado.  https://t.co/rw6QZfQYXz",pt,[],[],[],1,0,7,[],[],https://twitter.com/fernandofilhope/status/1521521863545004032,False,,1,https://pbs.twimg.com/ext_tw_video_thumb/1521521666186174464/pu/img/e6BUgGtZbJJEJFMQ.jpg,,,,,,,[],,,,
1521266810645008386,1521266808518549504,2022-05-02 20:14:06 -03,2022-05-02,20:14:06,-300,59323812,fernandofilhope,Fernando Filho,,Hospitais sucateados e sem condições de oferecer os cuidados adequados a população. Não podemos mais permitir que casos como esse aconteçam. Toda minha solidariedade aos pacientes e profissionais afetados por essa tragédia. Qual a desculpa o governo do PSB dará dessa vez?,pt,[],[],[],0,0,1,[],[],https://twitter.com/fernandofilhope/status/1521266810645008386,False,,0,,,,,,,,[],,,,
1521266808518549504,1521266808518549504,2022-05-02 20:14:05 -03,2022-05-02,20:14:05,-300,59323812,fernandofilhope,Fernando Filho,,"Um verdadeiro cenário de horror no Hospital da Restauração, principal emergência pública de Pernambuco. A queda do teto do hospital e a tubulação se rompendo em cima do setor de traumas expressam a triste situação que a saúde do nosso estado vem enfrentando nesses últimos 8 anos.",pt,[],[],[],1,0,2,[],[],https://twitter.com/fernandofilhope/status/1521266808518549504,False,,0,,,,,,,,[],,,,
1520021368322019329,1520021365516025857,2022-04-29 09:45:09 -03,2022-04-29,09:45:09,-300,59323812,fernandofilhope,Fernando Filho,,"Mais que títulos, entregamos um grande alívio para essas famílias. Fico muito feliz por fazer parte disso!",pt,[],[],[],0,0,0,[],[],https://twitter.com/fernandofilhope/status/1520021368322019329,False,,0,,,,,,,,[],,,,
1520021365516025857,1520021365516025857,2022-04-29 09:45:08 -03,2022-04-29,09:45:08,-300,59323812,fernandofilhope,Fernando Filho,,"Que sensação boa poder olhar no rosto das pessoas e ver a alegria por estarem realizando um sonho. Ontem, ao lado do prefeito @simaodurando entregamos as 200 Escrituras e os 100 Títulos de Posse para os moradores do Cosme e Damião, em Petrolina.  https://t.co/UUZgStEO65",pt,"[{'screen_name': 'simaodurando', 'name': 'simão durando', 'id': '202773687'}]",[],"['https://pbs.twimg.com/media/FRgzUykXEAAk7iR.jpg', 'https://pbs.twimg.com/media/FRgzUypXIAEoaXu.jpg', 'https://pbs.twimg.com/media/FRgzUykXoAI0DgG.jpg', 'https://pbs.twimg.com/media/FRgzUzwXIAIfj4O.jpg']",1,0,0,[],[],https://twitter.com/fernandofilhope/status/1520021365516025857,False,,1,https://pbs.twimg.com/media/FRgzUykXEAAk7iR.jpg,,,,,,,[],,,,
1519075713395081217,1519075710278774787,2022-04-26 19:07:27 -03,2022-04-26,19:07:27,-300,59323812,fernandofilhope,Fernando Filho,,"Mantendo uma boa relação com as prefeituras, pessoal, podemos destinar recursos para áreas essenciais em cada uma delas. Quando o trabalho é feito em conjunto, Pernambuco todo fica mais forte! #trabalhocomforça",pt,[],[],[],0,0,1,['trabalhocomforça'],[],https://twitter.com/fernandofilhope/status/1519075713395081217,False,,0,,,,,,,,[],,,,
1517909487574827011,1517909483908907009,2022-04-23 13:53:17 -03,2022-04-23,13:53:17,-300,59323812,fernandofilhope,Fernando Filho,,"A nossa força política tem trabalho para mostrar e Petrolina é o grande exemplo disso. Agora é hora de levar esse trabalho, que transforma e cuida das pessoas, para cada canto de Pernambuco.",pt,[],[],[],0,1,2,[],[],https://twitter.com/fernandofilhope/status/1517909487574827011,False,,0,,,,,,,,[],,,,
1517909483908907009,1517909483908907009,2022-04-23 13:53:17 -03,2022-04-23,13:53:17,-300,59323812,fernandofilhope,Fernando Filho,,"A política, pra mim, é um importante instrumento que melhora a vida das pessoas. Por isso, eu continuo ajudando os nossos municípios, liberando os recursos e trabalhando com muita coragem pelo que a nossa população precisa.  https://t.co/zRCP78xvPP",pt,[],[],[],1,1,6,[],[],https://twitter.com/fernandofilhope/status/1517909483908907009,False,,1,https://pbs.twimg.com/ext_tw_video_thumb/1517909320557543424/pu/img/DmD6h73liSaFKaf2.jpg,,,,,,,[],,,,
1512068675502698509,1512068669127364618,2022-04-07 11:03:59 -03,2022-04-07,11:03:59,-300,59323812,fernandofilhope,Fernando Filho,,"Minha homenagem e agradecimento a todos os profissionais da comunicação, responsáveis pela apuração de fatos e democratização da informação.",pt,[],[],[],0,1,1,[],[],https://twitter.com/fernandofilhope/status/1512068675502698509,False,,0,,,,,,,,[],,,,
1512068669127364618,1512068669127364618,2022-04-07 11:03:58 -03,2022-04-07,11:03:58,-300,59323812,fernandofilhope,Fernando Filho,,"Parabéns a todos os jornalistas pelo seu dia! Sem a força e o profissionalismo daqueles que formam nossa imprensa, não seria possível levarmos as notícias para a população.  https://t.co/l0ftgan0HP",pt,[],[],"['https://pbs.twimg.com/media/FPvyVo9VEAc-CGo.jpg', 'https://pbs.twimg.com/media/FPvyVo8VgAQBXWu.jpg', 'https://pbs.twimg.com/media/FPvyVo9VgAgZnmg.jpg', 'https://pbs.twimg.com/media/FPvyV8mVIAA4g0z.jpg']",1,1,2,[],[],https://twitter.com/fernandofilhope/status/1512068669127364618,False,,1,https://pbs.twimg.com/media/FPvyVo9VEAc-CGo.jpg,,,,,,,[],,,,
1511447945111130120,1511447945111130120,2022-04-05 17:57:26 -03,2022-04-05,17:57:26,-300,59323812,fernandofilhope,Fernando Filho,,"Hoje, ao lado do senador @fbezerracoelho, tive a alegria de receber aqui em Brasília, a visita do prefeito de João Alfredo, Zé Martins.  https://t.co/RRyGaAs0qV",pt,"[{'screen_name': 'fbezerracoelho', 'name': 'fernando bezerra', 'id': '53702605'}]",[],['https://pbs.twimg.com/media/FPm9AWpWYAAmX_Y.jpg'],0,0,2,[],[],https://twitter.com/fernandofilhope/status/1511447945111130120,False,,1,https://pbs.twimg.com/media/FPm9AWpWYAAmX_Y.jpg,,,,,,,[],,,,
1511343097317408782,1511343097317408782,2022-04-05 11:00:48 -03,2022-04-05,11:00:48,-300,59323812,fernandofilhope,Fernando Filho,,"Olha aí o avanço chegando em Poção! Muito feliz em receber esse vídeo do prefeito Merson, mostrando que as obras já estão adiantadas no município. A cada dia que passa, mais ruas vão sendo asfaltadas, e mais gente vai se beneficiando com mais mobilidade e segurança.  https://t.co/UxbzxSUuvi",pt,[],[],"['https://pbs.twimg.com/media/FPleXVBXEAs2btG.jpg', 'https://pbs.twimg.com/media/FPleXVCX0AYIRpR.jpg', 'https://pbs.twimg.com/media/FPleXX3WQBA9nKJ.jpg']",0,0,2,[],[],https://twitter.com/fernandofilhope/status/1511343097317408782,False,,1,https://pbs.twimg.com/media/FPleXVBXEAs2btG.jpg,,,,,,,[],,,,
1524403905337176064,1524403905337176064,2022-05-11 11:59:47 -03,2022-05-11,11:59:47,-300,59323812,fernandofilhope,Fernando Filho,,"Hoje quem passa pela avenida Sete de Setembro pode constatar o quanto Petrolina cresceu e se desenvolveu nos últimos anos. Um dos resultados deste trabalho é uma obra grandiosa, que foi pensada e executada para nossa cidade ficar ainda mais forte e preparada para o futuro.  https://t.co/wFdvNGs4JQ",pt,[],[],['https://pbs.twimg.com/media/FSfFQaGXsAEwAyb.jpg'],0,0,6,[],[],https://twitter.com/fernandofilhope/status/1524403905337176064,False,,1,https://pbs.twimg.com/media/FSfFQaGXsAEwAyb.jpg,,,,,,,[],,,,
1504113445335044096,1504113439786123270,2022-03-16 12:12:45 -03,2022-03-16,12:12:45,-300,59323812,fernandofilhope,Fernando Filho,,"Pernambuco precisa viver um novo tempo, um novo tempo de oportunidades e avanços. E é por essa razão que confio nessa missão de levarmos para cada canto do estado a transformação que @miguelcoelhope fez todos esses anos por Petrolina.",pt,"[{'screen_name': 'miguelcoelhope', 'name': 'miguel coelho', 'id': '66525428'}]",[],[],0,0,0,[],[],https://twitter.com/fernandofilhope/status/1504113445335044096,False,,0,,,,,,,,[],,,,
1504113439786123270,1504113439786123270,2022-03-16 12:12:43 -03,2022-03-16,12:12:43,-300,59323812,fernandofilhope,Fernando Filho,,"Eu acredito muito no potencial de Pernambuco. Por isso, me dedico tanto ao lado da nossa força política pelo desenvolvimento do estado. No Congresso Nacional, busco os recursos necessários para que os nossos municípios possam oferecer uma melhor qualidade de vida para as pessoas.  https://t.co/WYDxoG5abS",pt,[],[],[],1,1,1,[],[],https://twitter.com/fernandofilhope/status/1504113439786123270,False,,1,https://pbs.twimg.com/ext_tw_video_thumb/1504113225746505733/pu/img/8NFG_-e3-9UimifE.jpg,,,,,,,[],,,,
1502371944120913920,1502371937422618624,2022-03-11 16:52:38 -03,2022-03-11,16:52:38,-300,59323812,fernandofilhope,Fernando Filho,,Muito feliz por poder trabalhar para desenvolver Pernambuco e destinar recursos para melhorar cada vez mais os nossos municípios.,pt,[],[],[],0,0,1,[],[],https://twitter.com/fernandofilhope/status/1502371944120913920,False,,0,,,,,,,,[],,,,
1502371941528879105,1502371937422618624,2022-03-11 16:52:38 -03,2022-03-11,16:52:38,-300,59323812,fernandofilhope,Fernando Filho,,"Uma conquista importante que vai trazer mais desenvolvimento na mobilidade urbana, mais segurança e conforto para quem trafega e mora pelos bairros beneficiados.",pt,[],[],[],1,0,0,[],[],https://twitter.com/fernandofilhope/status/1502371941528879105,False,,0,,,,,,,,[],,,,
1502371937422618624,1502371937422618624,2022-03-11 16:52:37 -03,2022-03-11,16:52:37,-300,59323812,fernandofilhope,Fernando Filho,,"O trabalho que traz resultados para Petrolina não para! Hoje, ao lado do prefeito @miguelcoelhope anunciamos os novos investimentos para a realização de mais obras de pavimentação na cidade.  https://t.co/BY4uWyzT5o",pt,"[{'screen_name': 'miguelcoelhope', 'name': 'miguel coelho', 'id': '66525428'}]",[],[],3,1,2,[],[],https://twitter.com/fernandofilhope/status/1502371937422618624,False,,1,https://pbs.twimg.com/ext_tw_video_thumb/1502371760263602191/pu/img/a95Yh-OUYutJDBDj.jpg,,,,,,,[],,,,
1494651514102726657,1494651508847259652,2022-02-18 09:34:24 -03,2022-02-18,09:34:24,-300,59323812,fernandofilhope,Fernando Filho,,"Por isso, seguimos firmes apoiando a pré-candidatura de Zeca Cavalcanti. Pernambuco precisa viver um novo tempo!",pt,[],[],[],0,0,0,[],[],https://twitter.com/fernandofilhope/status/1494651514102726657,False,,0,,,,,,,,[],,,,
1494651511795859458,1494651508847259652,2022-02-18 09:34:24 -03,2022-02-18,09:34:24,-300,59323812,fernandofilhope,Fernando Filho,,"Precisamos valorizar a experiência de quem trabalha com compromisso e conhece os caminhos para organizar a administração, trazer investimentos e qualidade de vida, com respeito às pessoas.",pt,[],[],[],1,0,0,[],[],https://twitter.com/fernandofilhope/status/1494651511795859458,False,,0,,,,,,,,[],,,,
1494651508847259652,1494651508847259652,2022-02-18 09:34:23 -03,2022-02-18,09:34:23,-300,59323812,fernandofilhope,Fernando Filho,,"Estamos somando forças para recuperar o tempo perdido do nosso estado e, por onde passamos, encontramos mais pessoas que desejam dias melhores para Pernambuco.  https://t.co/aIa8WB2JjK",pt,[],[],"['https://pbs.twimg.com/media/FL4RkXXWUAAeKbh.jpg', 'https://pbs.twimg.com/media/FL4RmDpX0AEiHXP.jpg', 'https://pbs.twimg.com/media/FL4Rm_0XsAQPG25.jpg']",2,0,3,[],[],https://twitter.com/fernandofilhope/status/1494651508847259652,False,,1,https://pbs.twimg.com/media/FL4RkXXWUAAeKbh.jpg,,,,,,,[],,,,
1494428875455148034,1494428872535859200,2022-02-17 18:49:43 -03,2022-02-17,18:49:43,-300,59323812,fernandofilhope,Fernando Filho,,"E hoje foi assim nos municípios de Sanharó e Pesqueira, ao lado do nosso pré-candidato ao Governo de Pernambuco, @miguelcoelhope, discutimos diversas ações que vão contribuir com o retorno do desenvolvimento do nosso estado.",pt,"[{'screen_name': 'miguelcoelhope', 'name': 'miguel coelho', 'id': '66525428'}]",[],[],0,0,1,[],[],https://twitter.com/fernandofilhope/status/1494428875455148034,False,,0,,,,,,,,[],,,,
1494428872535859200,1494428872535859200,2022-02-17 18:49:43 -03,2022-02-17,18:49:43,-300,59323812,fernandofilhope,Fernando Filho,,"É sempre um prazer ser tão bem recebido, dialogar com os pernambucanos e ouvir as demandas para melhorar a vida da nossa gente.  https://t.co/jiRrLllPBk",pt,[],[],"['https://pbs.twimg.com/media/FL1HFFPXoAANNnH.jpg', 'https://pbs.twimg.com/media/FL1HIHNXsAM1IdN.jpg', 'https://pbs.twimg.com/media/FL1HIHSX0AAycya.jpg', 'https://pbs.twimg.com/media/FL1HIHUWQAItbuk.jpg']",1,0,2,[],[],https://twitter.com/fernandofilhope/status/1494428872535859200,False,,1,https://pbs.twimg.com/media/FL1HFFPXoAANNnH.jpg,,,,,,,[],,,,
1493963697437523974,1493963694820241409,2022-02-16 12:01:16 -03,2022-02-16,12:01:16,-300,59323812,fernandofilhope,Fernando Filho,,"Na ocasião, abordamos o PL 414/2021, do qual sou relator, que trata da ampliação e abertura do Mercado Livre de Energia no Brasil.",pt,[],[],[],0,0,1,[],[],https://twitter.com/fernandofilhope/status/1493963697437523974,False,,0,,,,,,,,[],,,,
1493963694820241409,1493963694820241409,2022-02-16 12:01:16 -03,2022-02-16,12:01:16,-300,59323812,fernandofilhope,Fernando Filho,,"Quarta de muito trabalho, pessoal! Em reunião da Frente Parlamentar de Energia Renovável - FER e membros da Comissão de Minas e Energia, debatemos pautas para construirmos soluções que vão ao encontro do fortalecimento e modernização do setor no nosso país.  https://t.co/XTiYcEJQcM",pt,[],[],"['https://pbs.twimg.com/media/FLuf9jmXMAcJe2m.jpg', 'https://pbs.twimg.com/media/FLuf9jpXIAUDhmd.jpg']",1,0,4,[],[],https://twitter.com/fernandofilhope/status/1493963694820241409,False,,1,https://pbs.twimg.com/media/FLuf9jmXMAcJe2m.jpg,,,,,,,[],,,,
1493726969300668419,1493726966498930690,2022-02-15 20:20:36 -03,2022-02-15,20:20:36,-300,59323812,fernandofilhope,Fernando Filho,,"Na pauta, conversamos um pouco sobre as necessidades de cada município e as ações que podemos promover em benefício do desenvolvimento de todo nosso estado.",pt,[],[],[],0,0,0,[],[],https://twitter.com/fernandofilhope/status/1493726969300668419,False,,0,,,,,,,,[],,,,
1491763088080748545,1491763088080748545,2022-02-10 10:16:50 -03,2022-02-10,10:16:50,-300,59323812,fernandofilhope,Fernando Filho,,"Participei hoje da inauguração do Mix Mateus Atacarejo em Petrolina, uma das maiores redes varejistas do Norte e Nordeste do país, que vai dinamizar nossa economia e gerar mais de 600 empregos diretos.  https://t.co/rhWDmLfF5B",pt,[],[],"['https://pbs.twimg.com/media/FLPOdOkWYAgLZnY.jpg', 'https://pbs.twimg.com/media/FLPOg6WXwAI-wQ6.jpg', 'https://pbs.twimg.com/media/FLPOiFcWYAMnP6U.jpg']",1,0,6,[],[],https://twitter.com/fernandofilhope/status/1491763088080748545,False,,1,https://pbs.twimg.com/media/FLPOdOkWYAgLZnY.jpg,,,,,,,[],,,,
1491209454788177920,1491209449402662913,2022-02-08 21:36:54 -03,2022-02-08,21:36:54,-300,59323812,fernandofilhope,Fernando Filho,,"Em Pernambuco, não iremos fazer diferente, vamos seguir trabalhando incansavelmente para escrever uma nova história na política do nosso estado.",pt,[],[],[],0,0,3,[],[],https://twitter.com/fernandofilhope/status/1491209454788177920,False,,0,,,,,,,,[],,,,
1491209452636479489,1491209449402662913,2022-02-08 21:36:53 -03,2022-02-08,21:36:53,-300,59323812,fernandofilhope,Fernando Filho,,"O União Brasil chega com a mensagem de construção de um novo tempo com diálogo, respeito e muita força de vontade de fazer do Brasil um lugar melhor para todos.",pt,[],[],[],1,0,3,[],[],https://twitter.com/fernandofilhope/status/1491209452636479489,False,,0,,,,,,,,[],,,,
1491209449402662913,1491209449402662913,2022-02-08 21:36:52 -03,2022-02-08,21:36:52,-300,59323812,fernandofilhope,Fernando Filho,,"Dia histórico! Hoje o TSE aprovou por unanimidade, a fusão dos partidos DEM e PSL – que passam, agora, a formar o @uniaobrasil44, o maior partido do país em número de lideranças.  https://t.co/HtLS9yKWw0",pt,"[{'screen_name': 'uniaobrasil44', 'name': 'união brasil 44', 'id': '1443282163818979336'}]",[],['https://pbs.twimg.com/media/FLHXFhlXwAU-e9i.jpg'],2,0,5,[],[],https://twitter.com/fernandofilhope/status/1491209449402662913,False,,1,https://pbs.twimg.com/media/FLHXFhlXwAU-e9i.jpg,,,,,,,[],,,,
1490762027379437571,1490762024346861570,2022-02-07 15:58:59 -03,2022-02-07,15:58:59,-300,59323812,fernandofilhope,Fernando Filho,,Uma clara demonstração de que Pernambuco tem em Miguel a esperança de dias melhores.,pt,[],[],[],0,0,0,[],[],https://twitter.com/fernandofilhope/status/1490762027379437571,False,,0,,,,,,,,[],,,,
1490762024346861570,1490762024346861570,2022-02-07 15:58:58 -03,2022-02-07,15:58:58,-300,59323812,fernandofilhope,Fernando Filho,,"Selfie diretamente daqui, do Recife, para deixar registrado que é através da união que vamos transformar o futuro de Pernambuco. Hoje, o Podemos anuncia formalmente o apoio à pré-candidatura de @miguelcoelhope ao Governo do Estado.  https://t.co/zQINdpNxdL",pt,"[{'screen_name': 'miguelcoelhope', 'name': 'miguel coelho', 'id': '66525428'}]",[],['https://pbs.twimg.com/media/FLA_uwhWYBA2dUr.jpg'],1,0,0,[],[],https://twitter.com/fernandofilhope/status/1490762024346861570,False,,1,https://pbs.twimg.com/media/FLA_uwhWYBA2dUr.jpg,,,,,,,[],,,,
1489965808545681408,1489965808545681408,2022-02-05 11:15:05 -03,2022-02-05,11:15:05,-300,59323812,fernandofilhope,Fernando Filho,,"Ontem, tive a alegria de participar de um encontro muito bacana com os amigos @alexandrebaldy e @MassaFelipe19.  https://t.co/ouWwFPtIAp",pt,"[{'screen_name': 'alexandrebaldy', 'name': '@alexandrebaldy', 'id': '130620293'}, {'screen_name': 'massafelipe19', 'name': 'felipe massa', 'id': '525208028'}]",[],['https://pbs.twimg.com/media/FK1r3_qXwAM9F45.jpg'],2,1,12,[],[],https://twitter.com/fernandofilhope/status/1489965808545681408,False,,1,https://pbs.twimg.com/media/FK1r3_qXwAM9F45.jpg,,,,,,,[],,,,
1489946167224029186,1489946167224029186,2022-02-05 09:57:02 -03,2022-02-05,09:57:02,-300,59323812,fernandofilhope,Fernando Filho,,Não poderíamos começar o final de semana de outro jeito: com muito planejamento por um Pernambuco com mais desenvolvimento!  https://t.co/kLR1Ii4AsX,pt,[],[],['https://pbs.twimg.com/media/FK1ZnTdXsAE7RkC.jpg'],0,0,5,[],[],https://twitter.com/fernandofilhope/status/1489946167224029186,False,,1,https://pbs.twimg.com/media/FK1ZnTdXsAE7RkC.jpg,,,,,,,[],,,,
1486385150019649543,1486385147293446151,2022-01-26 14:06:50 -03,2022-01-26,14:06:50,-300,59323812,fernandofilhope,Fernando Filho,,"São quase R$ 800 mil investidos, fruto das minhas articulações em Brasília e de recursos próprios da Prefeitura, o que vai promover mais dignidade, conforto e segurança aos profissionais do sistema de transporte e a toda população!",pt,[],[],[],0,0,2,[],[],https://twitter.com/fernandofilhope/status/1486385150019649543,False,,0,,,,,,,,[],,,,
1486385147293446151,1486385147293446151,2022-01-26 14:06:49 -03,2022-01-26,14:06:49,-300,59323812,fernandofilhope,Fernando Filho,,"Enquanto @miguelcoelhope segue cumprindo isolamento em casa, eu, Simão Durando e o deputado @CoelhoAntonioPE fizemos a nossa parte e o representamos, com muito orgulho, na assinatura da Ordem de Serviço para a construção de 40 novos pontos de táxi e mototáxi em Petrolina.  https://t.co/cY6DHEjkLP",pt,"[{'screen_name': 'miguelcoelhope', 'name': 'miguel coelho', 'id': '66525428'}, {'screen_name': 'coelhoantoniope', 'name': 'antonio coelho', 'id': '1106161642486796288'}]",[],"['https://pbs.twimg.com/media/FKCyz_7XwAEK7ct.jpg', 'https://pbs.twimg.com/media/FKCyz_6X0AI5t01.jpg', 'https://pbs.twimg.com/media/FKCy0AFWUAUA2vo.jpg', 'https://pbs.twimg.com/media/FKCy3SKWYAUw4ZK.jpg']",2,0,5,[],[],https://twitter.com/fernandofilhope/status/1486385147293446151,False,,1,https://pbs.twimg.com/media/FKCyz_7XwAEK7ct.jpg,,,,,,,[],,,,
1481751195412799489,1481751195412799489,2022-01-13 19:13:09 -03,2022-01-13,19:13:09,-300,59323812,fernandofilhope,Fernando Filho,,"Hoje foi dia de visitar a cidade de Casinhas e de levar as conquistas do nosso mandato que beneficiam toda população. Por lá, assinamos a Ordem de Serviço para as obras de pavimentação de novas ruas e entregamos 7 novos veículos operacionais para a Prefeitura do município.  https://t.co/75f0QgpM7Y",pt,[],[],"['https://pbs.twimg.com/media/FJA82vQWUAQ2M9H.jpg', 'https://pbs.twimg.com/media/FJA82vrXIAErXM0.jpg', 'https://pbs.twimg.com/media/FJA82vkXMA0355y.jpg', 'https://pbs.twimg.com/media/FJA82v8XoAYsxvZ.jpg']",1,0,2,[],[],https://twitter.com/fernandofilhope/status/1481751195412799489,False,,1,https://pbs.twimg.com/media/FJA82vQWUAQ2M9H.jpg,,,,,,,[],,,,
1480615024569819145,1480615021868556289,2022-01-10 15:58:25 -03,2022-01-10,15:58:25,-300,59323812,fernandofilhope,Fernando Filho,,Seguimos empenhados em trabalhar por um novo tempo de avanços para Pernambuco.,pt,[],[],[],0,0,1,[],[],https://twitter.com/fernandofilhope/status/1480615024569819145,False,,0,,,,,,,,[],,,,
