id,conversation_id,created_at,date,time,timezone,user_id,username,name,place,tweet,language,mentions,urls,photos,replies_count,retweets_count,likes_count,hashtags,cashtags,link,retweet,quote_url,video,thumbnail,near,geo,source,user_rt_id,user_rt,retweet_id,reply_to,retweet_date,translate,trans_src,trans_dest
1433059636471545862,1433059636471545862,2021-09-01 10:30:16 -0300,2021-09-01,10:30:16,-300,2525371838,fmonteirope,Fernando Monteiro,,@Braziliense  https://t.co/a61YxhUAIi,und,[],[],['https://pbs.twimg.com/media/E-NAI6HX0AMQ4EJ.jpg'],73,1,3,[],[],https://twitter.com/fmonteiroPE/status/1433059636471545862,False,,1,https://pbs.twimg.com/media/E-NAI6HX0AMQ4EJ.jpg,,,,,,,[],,,,
1432825717893615620,1432825717893615620,2021-08-31 19:00:46 -0300,2021-08-31,19:00:46,-300,2525371838,fmonteirope,Fernando Monteiro,,"Mantivemos a realização de concurso público para a contratação de servidores, mantendo-se também a contratação de comissionados para cargos em comissão e o contrato temporário. #PEC32",pt,[],[],[],292,2,15,['pec32'],[],https://twitter.com/fmonteiroPE/status/1432825717893615620,False,,0,,,,,,,,[],,,,
1432825589354881033,1432825589354881033,2021-08-31 19:00:15 -0300,2021-08-31,19:00:15,-300,2525371838,fmonteirope,Fernando Monteiro,,"No diálogo, na transparência e no debate respeitoso também conseguimos manter o atual Regime Jurídico Único, outra importante vitória para os servidores públicos do país. #PEC32",pt,[],[],[],70,0,11,['pec32'],[],https://twitter.com/fmonteiroPE/status/1432825589354881033,False,,0,,,,,,,,[],,,,
1432825499542298625,1432825499542298625,2021-08-31 18:59:54 -0300,2021-08-31,18:59:54,-300,2525371838,fmonteirope,Fernando Monteiro,,Outra conquista no relatório é a definição das carreiras típicas de Estado. Também nelas não se admitirá a contratação temporária. #PEC32,pt,[],[],[],42,0,8,['pec32'],[],https://twitter.com/fmonteiroPE/status/1432825499542298625,False,,0,,,,,,,,[],,,,
1432825323125678080,1432825323125678080,2021-08-31 18:59:12 -0300,2021-08-31,18:59:12,-300,2525371838,fmonteirope,Fernando Monteiro,,"Garantimos a estabilidade para os atuais e futuros servidores públicos, resultado das 15 audiências públicas e mais de 80 horas de conversas com representantes da sociedade. Diálogo e transparência garantiram a estabilidade dos servidores. #PEC32",pt,[],[],[],147,10,87,['pec32'],[],https://twitter.com/fmonteiroPE/status/1432825323125678080,False,,0,,,,,,,,[],,,,
1423057907420213254,1423057907420213254,2021-08-04 20:06:58 -0300,2021-08-04,20:06:58,-300,2525371838,fmonteirope,Fernando Monteiro,,"Mais uma vez - agora passada a posse - desejo sucesso, sabedoria e equilíbrio ao meu amigo @ciro_nogueira, o novo ministro-chefe da Casa Civil da Presidência da República.",pt,"[{'screen_name': 'ciro_nogueira', 'name': 'ciro nogueira', 'id': '67098726'}]",[],[],25,0,6,[],[],https://twitter.com/fmonteiroPE/status/1423057907420213254,False,,0,,,,,,,,[],,,,
1422744533754855424,1422744533754855424,2021-08-03 23:21:44 -0300,2021-08-03,23:21:44,-300,2525371838,fmonteirope,Fernando Monteiro,,Perdemos hoje um grande homem público. O ex-governador Joaquim Francisco fez sua trajetória na política sempre representando os pernambucanos com firmeza e capacidade de diálogo. Na década de 90 fui às ruas como seu militante. Continuará sendo referência para todos nós.,pt,[],[],[],5,0,3,[],[],https://twitter.com/fmonteiroPE/status/1422744533754855424,False,,0,,,,,,,,[],,,,
1420420550497820677,1420420550497820677,2021-07-28 13:27:04 -0300,2021-07-28,13:27:04,-300,2525371838,fmonteirope,Fernando Monteiro,,A nomeação de @ciro_nogueira na Casa Civil da Presidência da República é um importante reforço para o governo em sua articulação política. Ao lado da ministra @FlaviaArrudaDF e dos ministros Luiz Ramos e @onyxlorenzoni o governo também aumentará sua eficiência. Boa sorte a todos!,pt,"[{'screen_name': 'ciro_nogueira', 'name': 'ciro nogueira', 'id': '67098726'}, {'screen_name': 'flaviaarrudadf', 'name': 'flávia arruda', 'id': '1090726954335125504'}, {'screen_name': 'onyxlorenzoni', 'name': 'onyx lorenzoni 🇧🇷', 'id': '43041690'}]",[],[],8,1,2,[],[],https://twitter.com/fmonteiroPE/status/1420420550497820677,False,,0,,,,,,,,[],,,,
1420185794376085508,1420185794376085508,2021-07-27 21:54:13 -0300,2021-07-27,21:54:13,-300,2525371838,fmonteirope,Fernando Monteiro,,"Ao presidente do meu partido Progressistas, meu amigo @ciro_nogueira, desejo todo sucesso e um caminho abençoado na chefia da Casa Civil da Presidência da República.",pt,"[{'screen_name': 'ciro_nogueira', 'name': 'ciro nogueira', 'id': '67098726'}]",[],[],7,1,4,[],[],https://twitter.com/fmonteiroPE/status/1420185794376085508,False,,0,,,,,,,,[],,,,
1417466735800750089,1417466735800750089,2021-07-20 09:49:39 -0300,2021-07-20,09:49:39,-300,2525371838,fmonteirope,Fernando Monteiro,,@folha de hoje.   https://t.co/14LNjXa6If,pt,[],['https://www1.folha.uol.com.br/mercado/2021/07/reforma-administrativa-sera-texto-da-camara-nao-do-governo-diz-presidente-de-comissao-especial.shtml?utm_source=whatsapp&utm_medium=social&utm_campaign=compwa'],[],0,0,0,[],[],https://twitter.com/fmonteiroPE/status/1417466735800750089,False,,0,,,,,,,,[],,,,
1417466464534253569,1417466464534253569,2021-07-20 09:48:35 -0300,2021-07-20,09:48:35,-300,2525371838,fmonteirope,Fernando Monteiro,,@folha de hoje.   https://t.co/14LNjXa6If,pt,[],['https://www1.folha.uol.com.br/mercado/2021/07/reforma-administrativa-sera-texto-da-camara-nao-do-governo-diz-presidente-de-comissao-especial.shtml?utm_source=whatsapp&utm_medium=social&utm_campaign=compwa'],[],0,0,0,[],[],https://twitter.com/fmonteiroPE/status/1417466464534253569,False,,0,,,,,,,,[],,,,
1415478139669581828,1415478139669581828,2021-07-14 22:07:41 -0300,2021-07-14,22:07:41,-300,2525371838,fmonteirope,Fernando Monteiro,,"Hoje debatemos a estabilidade em mais uma reunião da Comissão que analisa a PEC 32/20. Todos apresentaram seus diferentes pontos de vista, contra e a favor da estabilidade e seu alcance. O compromisso é o do diálogo e da transparência. Vamos em frente. Mais um dia de trabalho!  https://t.co/O6giaLJf02",pt,[],[],['https://pbs.twimg.com/media/E6TJ3LxXoAASDjU.jpg'],179,1,9,[],[],https://twitter.com/fmonteiroPE/status/1415478139669581828,False,,1,https://pbs.twimg.com/media/E6TJ3LxXoAASDjU.jpg,,,,,,,[],,,,
1415063421373095936,1415063421373095936,2021-07-13 18:39:44 -0300,2021-07-13,18:39:44,-300,2525371838,fmonteirope,Fernando Monteiro,,Precisamos nos aproximar e encontrar uma proposta que realmente traga benefícios para a população.,pt,[],[],[],185,0,3,[],[],https://twitter.com/fmonteiroPE/status/1415063421373095936,False,,0,,,,,,,,[],,,,
1415063290389188611,1415063290389188611,2021-07-13 18:39:13 -0300,2021-07-13,18:39:13,-300,2525371838,fmonteirope,Fernando Monteiro,,"Os servidores trabalham bem, prestam adequadamente os serviços para a população e não é necessário mudar praticamente nada. Há algo de errado no pensamento deles. Há uma enorme distância entre a visão deles e o que o conheço em meu Pernambuco.",pt,[],[],[],65,0,13,[],[],https://twitter.com/fmonteiroPE/status/1415063290389188611,False,,0,,,,,,,,[],,,,
1415063217177509889,1415063217177509889,2021-07-13 18:38:56 -0300,2021-07-13,18:38:56,-300,2525371838,fmonteirope,Fernando Monteiro,,A Brasília e sua burocracia com toda a estabilidade e bons salários em contraposição à dura realidade nordestina. Os ouvi e me pareceu - posso estar equivocado - que a visão deles é que no Estado brasileiro em que vivem tudo funciona perfeitamente.,pt,[],[],[],71,1,12,[],[],https://twitter.com/fmonteiroPE/status/1415063217177509889,False,,0,,,,,,,,[],,,,
1415063106242465792,1415063106242465792,2021-07-13 18:38:29 -0300,2021-07-13,18:38:29,-300,2525371838,fmonteirope,Fernando Monteiro,,Ouvi-os com atenção e procurei imaginar o impacto de suas análises e propostas na melhoria da qualidade de vida do povo interiorano pernambucano. Não consegui visualizar. Parece que vivemos em mundos diferentes.,pt,[],[],[],9,0,4,[],[],https://twitter.com/fmonteiroPE/status/1415063106242465792,False,,0,,,,,,,,[],,,,
1415063017927098373,1415063017927098373,2021-07-13 18:38:08 -0300,2021-07-13,18:38:08,-300,2525371838,fmonteirope,Fernando Monteiro,,"Nos rincões do meu estado a população carece de atendimento básico de qualidade. E não é só porque não há infraestrutura para a prestação dos serviços, mas pela maneira como é tratada por alguns servidores.",pt,[],[],[],171,1,6,[],[],https://twitter.com/fmonteiroPE/status/1415063017927098373,False,,0,,,,,,,,[],,,,
1415062924675137540,1415062924675137540,2021-07-13 18:37:46 -0300,2021-07-13,18:37:46,-300,2525371838,fmonteirope,Fernando Monteiro,,"Ouvindo-os, inclusive aqueles que se referiram aos municípios, me lembrei das enormes dificuldades que o povo pernambucano sofre para ter um atendimento adequado, até mesmo digno.",pt,[],[],[],6,0,2,[],[],https://twitter.com/fmonteiroPE/status/1415062924675137540,False,,0,,,,,,,,[],,,,
1415062821306523652,1415062821306523652,2021-07-13 18:37:21 -0300,2021-07-13,18:37:21,-300,2525371838,fmonteirope,Fernando Monteiro,,"Ouvi com atenção e cuidado as palestras apresentadas hoje sobre a questão do estatuto da estabilidade na proposta da PEC 32/20. São considerações e críticas pertinentes e já conhecidas, mas que não apresentam alternativas viáveis para a necessária mudança do funcionalismo público",pt,[],[],[],10,0,3,[],[],https://twitter.com/fmonteiroPE/status/1415062821306523652,False,,0,,,,,,,,[],,,,
1412870141629579268,1412870141629579268,2021-07-07 17:24:26 -0300,2021-07-07,17:24:26,-300,2525371838,fmonteirope,Fernando Monteiro,,"Como presidente da Comissão Especial que analisa a PEC 32/20, vou garantir um debate franco, leal e aberto com o ministro da Economia, Paulo Guedes. O parlamento é o local adequado para o debate, mas sempre respeitoso e de alto nível.  https://t.co/21xxeb5ArE",pt,[],[],['https://pbs.twimg.com/media/E5uF5ucXIAQwYV3.jpg'],169,0,3,[],[],https://twitter.com/fmonteiroPE/status/1412870141629579268,False,,1,https://pbs.twimg.com/media/E5uF5ucXIAQwYV3.jpg,,,,,,,[],,,,
1411026630361989126,1411026630361989126,2021-07-02 15:18:58 -0300,2021-07-02,15:18:58,-300,2525371838,fmonteirope,Fernando Monteiro,,"“Não estamos falando de economia fiscal do serviço público. Estamos falando de eficiência no serviço público. Não estamos falando do servidor público e, sim, do serviço público”.  https://t.co/b44qcDjjUc",pt,[],['https://www.google.com.br/amp/s/www.correiobraziliense.com.br/brasil/2021/07/amp/4934932-monteiro-precisamos-trazer-o-servico-publico-para-a-modernidade.html'],[],70,0,6,[],[],https://twitter.com/fmonteiroPE/status/1411026630361989126,False,,0,,,,,,,,[],,,,
1410358263649013763,1410358263649013763,2021-06-30 19:03:07 -0300,2021-06-30,19:03:07,-300,2525371838,fmonteirope,Fernando Monteiro,,Seguimos o diálogo em torno de uma reforma que torne o serviço público brasileiro mais eficiente. A reforma administrativa que eu imagino não é a da PEC 32. Hoje realizamos mais uma audiência pública. O objetivo é ouvir todos envolvidos. É pra isso que a Comissão Especial existe.  https://t.co/U2lwtz8D3W,pt,[],[],['https://pbs.twimg.com/media/E5KZXOyXMAgvZ6L.jpg'],75,6,33,[],[],https://twitter.com/fmonteiroPE/status/1410358263649013763,False,,1,https://pbs.twimg.com/media/E5KZXOyXMAgvZ6L.jpg,,,,,,,[],,,,
1405559171441991687,1405559171441991687,2021-06-17 13:13:15 -0300,2021-06-17,13:13:15,-300,2525371838,fmonteirope,Fernando Monteiro,,Como tenho dito desde que assumi a presidência da Comissão: não vou tratar de uma reforma do Estado sem um amplo diálogo. Estou aqui para ouvir! #FernandoMonteiro #ReformaCidadã,pt,[],[],[],124,2,12,"['fernandomonteiro', 'reformacidadã']",[],https://twitter.com/fmonteiroPE/status/1405559171441991687,False,,0,,,,,,,,[],,,,
1405559108200239107,1405559108200239107,2021-06-17 13:13:00 -0300,2021-06-17,13:13:00,-300,2525371838,fmonteirope,Fernando Monteiro,,"Recebemos várias novas sugestões e na semana que vem definiremos o número exato de audiências públicas - serão em torno de 14 - , de junho a agosto, até esgotarmos este debate.",pt,[],[],[],11,0,0,[],[],https://twitter.com/fmonteiroPE/status/1405559108200239107,False,,0,,,,,,,,[],,,,
1405559026050646017,1405559026050646017,2021-06-17 13:12:40 -0300,2021-06-17,13:12:40,-300,2525371838,fmonteirope,Fernando Monteiro,,"Cumprindo o compromisso de dialogarmos e, especialmente, ouvirmos todas as partes envolvidas na PEC 32/20, apresentamos o plano de trabalho da Comissão Especial da Reforma Administrativa. #ReformaCidadã",pt,[],[],[],12,0,1,['reformacidadã'],[],https://twitter.com/fmonteiroPE/status/1405559026050646017,False,,0,,,,,,,,[],,,,
1405151525438214150,1405151525438214150,2021-06-16 10:13:24 -0300,2021-06-16,10:13:24,-300,2525371838,fmonteirope,Fernando Monteiro,,Não há defesa prévia deste ou daquele posicionamento e não existem pautas “inegociáveis”. Existe o equilíbrio para chegarmos a um consenso. A população terá no Congresso uma instituição que resolve os problemas brasileiros. #PEC32,pt,[],[],[],28,1,7,['pec32'],[],https://twitter.com/fmonteiroPE/status/1405151525438214150,False,,0,,,,,,,,[],,,,
1405151433956151296,1405151433956151296,2021-06-16 10:13:02 -0300,2021-06-16,10:13:02,-300,2525371838,fmonteirope,Fernando Monteiro,,"Hoje teremos a primeira reunião de trabalho da Comissão Especial que analisa a PEC 32/2020. Definiremos o plano de trabalho. Na presidência, vou garantir que todos sejam ouvidos. A Comissão não é nem governo e nem oposição.",pt,[],[],[],7,0,1,[],[],https://twitter.com/fmonteiroPE/status/1405151433956151296,False,,0,,,,,,,,[],,,,
1404980296139919370,1404980296139919370,2021-06-15 22:53:00 -0300,2021-06-15,22:53:00,-300,2525371838,fmonteirope,Fernando Monteiro,,"No ar agora, pela @recordnews, falando sobre a PEC 32/2020.  https://t.co/fXkVxAfXwP  https://t.co/NiEDBN4a93",pt,"[{'screen_name': 'recordnews', 'name': 'record news', 'id': '259372253'}]",['https://m.youtube.com/watch?v=8jbFEVDc8Wc'],['https://pbs.twimg.com/media/E39-IXVXwAMmopf.jpg'],75,2,9,[],[],https://twitter.com/fmonteiroPE/status/1404980296139919370,False,,1,https://pbs.twimg.com/media/E39-IXVXwAMmopf.jpg,,,,,,,[],,,,
1404931012581335045,1404931012581335045,2021-06-15 19:37:10 -0300,2021-06-15,19:37:10,-300,2525371838,fmonteirope,Fernando Monteiro,," https://t.co/fXkVxAfXwP hoje, 22h40  https://t.co/3pxUzdpXWg",pt,[],['https://m.youtube.com/watch?v=8jbFEVDc8Wc'],['https://pbs.twimg.com/media/E39RTvgXIAAq83n.jpg'],4,1,1,[],[],https://twitter.com/fmonteiroPE/status/1404931012581335045,False,,1,https://pbs.twimg.com/media/E39RTvgXIAAq83n.jpg,,,,,,,[],,,,
1404777772501942280,1404777772501942280,2021-06-15 09:28:15 -0300,2021-06-15,09:28:15,-300,2525371838,fmonteirope,Fernando Monteiro,, https://t.co/tAKkYB14l9,und,[],[],['https://pbs.twimg.com/media/E37F72eVgAI0eRx.jpg'],2,0,2,[],[],https://twitter.com/fmonteiroPE/status/1404777772501942280,False,,1,https://pbs.twimg.com/media/E37F72eVgAI0eRx.jpg,,,,,,,[],,,,
1403732086880706561,1403732086880706561,2021-06-12 12:13:04 -0300,2021-06-12,12:13:04,-300,2525371838,fmonteirope,Fernando Monteiro,,"A partida de Marco Maciel, marco de Pernambuco, representa a perda também de parte importante da história política do nosso Estado e do País. Marco Maciel deixa o legado de homem público sempre aberto ao diálogo sem esquecer de suas convicções. Meus sentimentos a família e amigos",pt,[],[],[],6,1,0,[],[],https://twitter.com/fmonteiroPE/status/1403732086880706561,False,,0,,,,,,,,[],,,,
1403681695203737604,1403681695203737604,2021-06-12 08:52:49 -0300,2021-06-12,08:52:49,-300,2525371838,fmonteirope,Fernando Monteiro,, https://t.co/rWN1wS1tfy #ReformaAdministrativa  https://t.co/3iIGXz92OJ,und,[],['https://www.correiobraziliense.com.br/economia/2021/06/4930778-quero-trazer-inovacao-ao-servico-publico-diz-deputado-fernando-monteiro.html'],['https://pbs.twimg.com/media/E3rhDaiWUAERtyo.jpg'],41,1,4,['reformaadministrativa'],[],https://twitter.com/fmonteiroPE/status/1403681695203737604,False,,1,https://pbs.twimg.com/media/E3rhDaiWUAERtyo.jpg,,,,,,,[],,,,
1403430071868796933,1403430071868796933,2021-06-11 16:12:58 -0300,2021-06-11,16:12:58,-300,2525371838,fmonteirope,Fernando Monteiro,,O foco é modernizar a administração pública. #ReformaCidadã  https://t.co/8lppRN4NCg,pt,[],[],['https://pbs.twimg.com/media/E3n8NYtWQAUqKg6.jpg'],42,2,3,['reformacidadã'],[],https://twitter.com/fmonteiroPE/status/1403430071868796933,False,,1,https://pbs.twimg.com/media/E3n8NYtWQAUqKg6.jpg,,,,,,,[],,,,
1403316425163485184,1403316425163485184,2021-06-11 08:41:22 -0300,2021-06-11,08:41:22,-300,2525371838,fmonteirope,Fernando Monteiro,," https://t.co/lMrPnemb1f entrevista de ontem à noite, para a @bandnewstv #ReformaAdministrativa  https://t.co/drf0ZkznTf",pt,"[{'screen_name': 'bandnewstv', 'name': 'bandnews tv', 'id': '64851983'}]",['https://bandnewstv.band.uol.com.br/videos/16933984/comissao-da-reforma-administrativa-elege-fernando-monteiro-presidente.html'],['https://pbs.twimg.com/media/E3mU2W6WYAU5CAK.jpg'],13,0,3,['reformaadministrativa'],[],https://twitter.com/fmonteiroPE/status/1403316425163485184,False,,1,https://pbs.twimg.com/media/E3mU2W6WYAU5CAK.jpg,,,,,,,[],,,,
1403135644998713351,1403135644998713351,2021-06-10 20:43:01 -0300,2021-06-10,20:43:01,-300,2525371838,fmonteirope,Fernando Monteiro,,A PEC 32/2020 propõe mudar a administração pública do país para os futuros servidores. Os atuais direitos e obrigações estão garantidos para os servidores que já entraram no sistema público.#FernandoMonteiro #ReformaAdministrativa #ReformaCidadã #BrasilMaisModerno,pt,[],[],[],84,0,8,"['fernandomonteiro', 'reformaadministrativa', 'reformacidadã', 'brasilmaismoderno']",[],https://twitter.com/fmonteiroPE/status/1403135644998713351,False,,0,,,,,,,,[],,,,
1403135540099174402,1403135540099174402,2021-06-10 20:42:36 -0300,2021-06-10,20:42:36,-300,2525371838,fmonteirope,Fernando Monteiro,,"Uma das perguntas que mais escuto, agora que estou na presidência da Comissão Especial para análise da Reforma Administrativa, é se a proposta retira os direitos dos atuais servidores. A resposta é não. #FernandoMonteiro #ReformaAdministrativa #ReformaCidadã #BrasilMaisModerno",pt,[],[],[],29,0,2,"['fernandomonteiro', 'reformaadministrativa', 'reformacidadã', 'brasilmaismoderno']",[],https://twitter.com/fmonteiroPE/status/1403135540099174402,False,,0,,,,,,,,[],,,,
1403033792265297926,1403033792265297926,2021-06-10 13:58:17 -0300,2021-06-10,13:58:17,-300,2525371838,fmonteirope,Fernando Monteiro,,#ReformaAdministrativa #ReformaCidadã  https://t.co/m80wqLx8zd,und,[],[],['https://pbs.twimg.com/media/E3iTy2cWEAQEj-T.jpg'],41,2,10,"['reformaadministrativa', 'reformacidadã']",[],https://twitter.com/fmonteiroPE/status/1403033792265297926,False,,1,https://pbs.twimg.com/media/E3iTy2cWEAQEj-T.jpg,,,,,,,[],,,,
1403033652750077953,1403033652750077953,2021-06-10 13:57:44 -0300,2021-06-10,13:57:44,-300,2525371838,fmonteirope,Fernando Monteiro,,"Não seremos nem governo, nem oposição. Meu compromisso é com o povo brasileiro, com o servidor público e com o cidadão, que paga seus impostos e quer um serviço público de qualidade. #ReformaAdministrativa #ReformaCidadã",pt,[],[],[],12,1,3,"['reformaadministrativa', 'reformacidadã']",[],https://twitter.com/fmonteiroPE/status/1403033652750077953,False,,0,,,,,,,,[],,,,
1403033514124193800,1403033514124193800,2021-06-10 13:57:11 -0300,2021-06-10,13:57:11,-300,2525371838,fmonteirope,Fernando Monteiro,,"Como presidente da Comissão Especial da Reforma Administrativa, função para a qual fui eleito nesta quarta-feira, pretendo atuar no sentido de garantir a imparcialidade na condução dos trabalhos. #ReformaAdministrativa #ReformaCidadã",pt,[],[],[],4,0,2,"['reformaadministrativa', 'reformacidadã']",[],https://twitter.com/fmonteiroPE/status/1403033514124193800,False,,0,,,,,,,,[],,,,
1402743034207408130,1402743034207408130,2021-06-09 18:42:55 -0300,2021-06-09,18:42:55,-300,2525371838,fmonteirope,Fernando Monteiro,,"Lutaremos pela garantia de bons serviços para o cidadão. O diálogo e a democracia prevalecerão nos trabalhos da comissão. Ouvir, ouvir e ouvir! #ReformaCidadã #ReformaAdministrativa",pt,[],[],[],74,2,8,"['reformacidadã', 'reformaadministrativa']",[],https://twitter.com/fmonteiroPE/status/1402743034207408130,False,,0,,,,,,,,[],,,,
1402740568678146050,1402740568678146050,2021-06-09 18:33:07 -0300,2021-06-09,18:33:07,-300,2525371838,fmonteirope,Fernando Monteiro,,Tenho convicção de que precisamos de uma mudança de mentalidade e de um estado mais moderno. É por isso que tenho falado em uma “Reforma Cidadã”. #ReformaCidadã #ReformaAdministrativa,pt,[],[],[],15,0,2,"['reformacidadã', 'reformaadministrativa']",[],https://twitter.com/fmonteiroPE/status/1402740568678146050,False,,0,,,,,,,,[],,,,
1402740169929809920,1402740169929809920,2021-06-09 18:31:32 -0300,2021-06-09,18:31:32,-300,2525371838,fmonteirope,Fernando Monteiro,,"Quem conhece minha história sabe que sempre estive ao lado do cidadão. Agora não será diferente. Por isso, aceitei a missão de presidir o colegiado que tratará da Reforma Administrativa. #ReformaCidadã #ReformaAdministrativa",pt,[],[],[],45,0,8,"['reformacidadã', 'reformaadministrativa']",[],https://twitter.com/fmonteiroPE/status/1402740169929809920,False,,0,,,,,,,,[],,,,
1199817740950941696,1199817740950941696,2019-11-27 19:30:15 -0300,2019-11-27,19:30:15,-300,2525371838,fmonteirope,Fernando Monteiro,,"O Plenário da Câmara aprovou, por 269 votos a 113, o regime de urgência para o Projeto de Lei 3261/19, do Senado, que muda o marco legal do saneamento básico. #Saneamento",pt,[],[],[],60,0,6,['saneamento'],[],https://twitter.com/fmonteiroPE/status/1199817740950941696,False,,0,,,,,,,,[],,,,
1152383809951870977,1152383809951870977,2019-07-19 22:04:45 -0300,2019-07-19,22:04:45,-300,2525371838,fmonteirope,Fernando Monteiro,,"Ao invés de nos maldizer e querer que nos sintamos fracos, presidente, nos diga o que fará por nós. Um presidente não divide o país. Ele o fortalece. @jairbolsonaro",pt,"[{'screen_name': 'jairbolsonaro', 'name': 'jair m. bolsonaro', 'id': '128372940'}]",[],[],14,0,4,[],[],https://twitter.com/fmonteiroPE/status/1152383809951870977,False,,0,,,,,,,,[],,,,
1152383690712014859,1152383690712014859,2019-07-19 22:04:16 -0300,2019-07-19,22:04:16,-300,2525371838,fmonteirope,Fernando Monteiro,,"Presidente Bolsonaro. O mínimo que esperamos de um governante é que busque construir consensos. O nosso povo, presidente, é guerreiro e vibrante, mas também passa fome e sede. Preconceito não nos ajuda em nada... @jairbolsonaro",pt,"[{'screen_name': 'jairbolsonaro', 'name': 'jair m. bolsonaro', 'id': '128372940'}]",[],[],4,0,1,[],[],https://twitter.com/fmonteiroPE/status/1152383690712014859,False,,0,,,,,,,,[],,,,
1139680329067712513,1139680329067712513,2019-06-14 20:45:39 -0300,2019-06-14,20:45:39,-300,2525371838,fmonteirope,Fernando Monteiro,,"Enquanto Paulo Guedes dá mostras de que não tem sensibilidade com os mais carentes, o relatório apresentado esta semana na Comissão Especial traz avanços importantes. Entretanto, ao meu ver, a proposta para reforma da Previdência ainda não é justa.",pt,[],[],[],12,0,3,[],[],https://twitter.com/fmonteiroPE/status/1139680329067712513,False,,0,,,,,,,,[],,,,
1139675135663906816,1139675135663906816,2019-06-14 20:25:01 -0300,2019-06-14,20:25:01,-300,2525371838,fmonteirope,Fernando Monteiro,,"Não respeitar a democracia é um absurdo. O Ministro precisa lembrar que tal como ele, ministro de um governo eleito, nós, parlamentares, também fomos legitimamente eleitos.",pt,[],[],[],7,0,3,[],[],https://twitter.com/fmonteiroPE/status/1139675135663906816,False,,0,,,,,,,,[],,,,
1139675064796884994,1139675064796884994,2019-06-14 20:24:44 -0300,2019-06-14,20:24:44,-300,2525371838,fmonteirope,Fernando Monteiro,,"Apesar de dizer que respeitaria a decisão do Congresso, o ministro Paulo Guedes criticou publicamente as mudanças apresentadas no parecer do relator da reforma da Previdência, deputado Samuel Moreira.",pt,[],[],[],4,0,2,[],[],https://twitter.com/fmonteiroPE/status/1139675064796884994,False,,0,,,,,,,,[],,,,
1136561390142074880,1136561390142074880,2019-06-06 06:12:06 -0300,2019-06-06,06:12:06,-300,2525371838,fmonteirope,Fernando Monteiro,,"Hoje participo do Reboot Lisboa, Seminário de Marketing Político e Comunicação Institucional que acontece na Universidade Lusófona de Lisboa. Vou falar sobre política, transparência e a nova comunicação digital na visão de um parlamentar brasileiro.",pt,[],[],[],2,0,3,[],[],https://twitter.com/fmonteiroPE/status/1136561390142074880,False,,0,,,,,,,,[],,,,
1135958066514583554,1135958066514583554,2019-06-04 14:14:42 -0300,2019-06-04,14:14:42,-300,2525371838,fmonteirope,Fernando Monteiro,,"Começou a audiência da Comissão de Finanças e Tributação (CFT) com a presença do ministro da Economia, Paulo Guedes.  https://t.co/q7L8Mx27Wi",pt,[],['https://www.youtube.com/watch?v=2uegJvkPT64'],[],1,0,4,[],[],https://twitter.com/fmonteiroPE/status/1135958066514583554,False,,0,,,,,,,,[],,,,
1135957081549365248,1135957081549365248,2019-06-04 14:10:47 -0300,2019-06-04,14:10:47,-300,2525371838,fmonteirope,Fernando Monteiro,,#QueReformaEEssa  https://t.co/diMlhMthtx,und,[],[],[],5,0,1,['quereformaeessa'],[],https://twitter.com/fmonteiroPE/status/1135957081549365248,False,,1,https://pbs.twimg.com/ext_tw_video_thumb/1135957050171842560/pu/img/swoRVFRRQ65YSy83.jpg,,,,,,,[],,,,
