id,conversation_id,created_at,date,time,timezone,user_id,username,name,place,tweet,language,mentions,urls,photos,replies_count,retweets_count,likes_count,hashtags,cashtags,link,retweet,quote_url,video,thumbnail,near,geo,source,user_rt_id,user_rt,retweet_id,reply_to,retweet_date,translate,trans_src,trans_dest
1164147593078816769,1164147593078816769,2019-08-21 09:09:49 -0300,2019-08-21,09:09:49,-300,133692726,glaustindafokus,Glaustin da Fokus,,Conseguimos uma agenda com o presidente @jairbolsonaro para levar os meninos goianos premiados pela NASA para conhecer o Palácio do Planalto. Confira a nota do Giro do @jornal_opopular .  https://t.co/Uy4fL7XYzm,pt,"[{'screen_name': 'jairbolsonaro', 'name': 'jair m. bolsonaro', 'id': '128372940'}, {'screen_name': 'jornal_opopular', 'name': 'o popular', 'id': '54527239'}]",[],['https://pbs.twimg.com/media/ECfiEBFW4AEeG6E.jpg'],0,0,1,[],[],https://twitter.com/glaustindafokus/status/1164147593078816769,False,,1,https://pbs.twimg.com/media/ECfiEBFW4AEeG6E.jpg,,,,,,,[],,,,
1159108353437720576,1159108353437720576,2019-08-07 11:25:41 -0300,2019-08-07,11:25:41,-300,133692726,glaustindafokus,Glaustin da Fokus,,"O assunto do dia aqui na Câmara dos Deputados ainda é a Reforma da Previdência. Mas, já estamos de olho na próxima grande agenda do Congresso Nacional.Como titular da Comissão Especial da Reforma Tributária, comentei sobre a essa pauta em artigo publicado hoje no @jornal_opopular  https://t.co/dihmlWOCpE",pt,"[{'screen_name': 'jornal_opopular', 'name': 'o popular', 'id': '54527239'}]",[],['https://pbs.twimg.com/media/EBX65mpXYAAH900.jpg'],1,0,2,[],[],https://twitter.com/glaustindafokus/status/1159108353437720576,False,,1,https://pbs.twimg.com/media/EBX65mpXYAAH900.jpg,,,,,,,[],,,,
1157010045504229376,1157010045504229376,2019-08-01 16:27:45 -0300,2019-08-01,16:27:45,-300,133692726,glaustindafokus,Glaustin da Fokus,,Hoje é dia de parabenizar um dos homens que trabalha incansavelmente para transformar o nosso Brasil em um País melhor. Parabéns Ministro @SF_Moro ! Muita saúde e que Deus continue te abençoando! #FelizNiverMoro  https://t.co/LeiLlWglPV,pt,"[{'screen_name': 'sf_moro', 'name': 'sergio moro', 'id': '1113094855281008641'}]",[],['https://pbs.twimg.com/media/EA6GgGTWwAAnRQY.jpg'],2,2,11,['feliznivermoro'],[],https://twitter.com/glaustindafokus/status/1157010045504229376,False,,1,https://pbs.twimg.com/media/EA6GgGTWwAAnRQY.jpg,,,,,,,[],,,,
1151131322959581185,1151131322959581185,2019-07-16 11:07:49 -0300,2019-07-16,11:07:49,-300,133692726,glaustindafokus,Glaustin da Fokus,,Muito orgulho dos nossos jovens goianos que conquistaram o 1º lugar em um torneio de robótica realizado na Universidade da Nasa. Os estudantes do Sesi Vila Canaã são a prova que devemos investir no Sistema S. Parabéns a todos que se empenharam para esta conquista.,pt,[],[],[],2,1,7,[],[],https://twitter.com/glaustindafokus/status/1151131322959581185,False,https://twitter.com/jornalnacional/status/1150931837788798976,0,,,,,,,,[],,,,
1150458404340752384,1150458404340752384,2019-07-14 14:33:52 -0300,2019-07-14,14:33:52,-300,133692726,glaustindafokus,Glaustin da Fokus,,Eu sempre defendi que a Reforma Tributária era mais necessária para a retomada do nosso crescimento. O Brasil precisa facilitar a vida de quem quer investir e gerar empregos aqui. Na edição deste domingo do @jornal_opopular falei sobre quais pontos são essenciais na reforma.Leia:  https://t.co/mW49Xgk3zA,pt,"[{'screen_name': 'jornal_opopular', 'name': 'o popular', 'id': '54527239'}]",[],['https://pbs.twimg.com/media/D_c_0NAWkAII-HA.jpg'],0,1,1,[],[],https://twitter.com/glaustindafokus/status/1150458404340752384,False,,1,https://pbs.twimg.com/media/D_c_0NAWkAII-HA.jpg,,,,,,,[],,,,
1149100798015692800,1149096268943306753,2019-07-10 20:39:14 -0300,2019-07-10,20:39:14,-300,133692726,glaustindafokus,Glaustin da Fokus,,"@jairbolsonaro Estamos unidos no mesmo propósito, presidente @jairbolsonaro! Votei a favor da Nova Previdência e continuaremos ao seu lado para retomarmos o crescimento do nosso País. Acredito em você, Capitão!",pt,"[{'screen_name': 'jairbolsonaro', 'name': 'jair m. bolsonaro', 'id': '128372940'}]",[],[],0,0,1,[],[],https://twitter.com/glaustindafokus/status/1149100798015692800,False,,0,,,,,,,,"[{'screen_name': 'jairbolsonaro', 'name': 'Jair M. Bolsonaro', 'id': '128372940'}]",,,,
1149095853476499456,1149095853476499456,2019-07-10 20:19:35 -0300,2019-07-10,20:19:35,-300,133692726,glaustindafokus,Glaustin da Fokus,,"Votamos pelo Brasil e aprovamos por 379 a 131 a Reforma da Previdência no 1º turno, aqui na Câmara dos Deputados. Sei que essa reforma não é a salvação da nossa economia, mas é a chave de entrada para a retomada do crescimento do Brasil!  https://t.co/axLyFet8DH",pt,[],[],['https://pbs.twimg.com/media/D_Jolg_X4AAx2yp.jpg'],1,1,2,[],[],https://twitter.com/glaustindafokus/status/1149095853476499456,False,,1,https://pbs.twimg.com/media/D_Jolg_X4AAx2yp.jpg,,,,,,,[],,,,
1148941616327069696,1148941616327069696,2019-07-10 10:06:42 -0300,2019-07-10,10:06:42,-300,133692726,glaustindafokus,Glaustin da Fokus,,"Perdemos hoje, de forma inesperada, um exemplo de credibilidade do jornalismo brasileiro. Fiquei muito triste ao receber a notícia do falecimento de Paulo Henrique Amorim. Que Deus conforte o coração dos entes, amigos e de todos nós telespectadores.",pt,[],[],[],0,0,0,[],[],https://twitter.com/glaustindafokus/status/1148941616327069696,False,https://twitter.com/Estadao/status/1148921810941075456,0,,,,,,,,[],,,,
1146839077439844352,1146839077439844352,2019-07-04 14:51:57 -0300,2019-07-04,14:51:57,-300,133692726,glaustindafokus,Glaustin da Fokus,,"Acaba de ser aprovado o texto-base da Reforma da Previdência aqui na Câmara dos Deputados. Um grande avanço que sinaliza a retomada de crescimento do nosso Brasil.Agora, serão votados os destaques na Comissão Especial. Nossa expectativa é votar a PEC no plenário na próxima semana",pt,[],[],[],3,0,4,[],[],https://twitter.com/glaustindafokus/status/1146839077439844352,False,,0,,,,,,,,[],,,,
1145441941150191617,1145441941150191617,2019-06-30 18:20:14 -0300,2019-06-30,18:20:14,-300,133692726,glaustindafokus,Glaustin da Fokus,,"Tenho acompanhado as manifestações hoje em várias capitais. E percebo que, assim como eu, o povo acredita e confia que o Ministro @SF_Moro tem um compromisso sério com o nosso Brasil e contra a corrupção. #BrasilNasRuas",pt,"[{'screen_name': 'sf_moro', 'name': 'sergio moro', 'id': '1113094855281008641'}]",[],[],2,1,2,['brasilnasruas'],[],https://twitter.com/glaustindafokus/status/1145441941150191617,False,,0,,,,,,,,[],,,,
1141032752432713735,1141032752432713735,2019-06-18 14:19:42 -0300,2019-06-18,14:19:42,-300,133692726,glaustindafokus,Glaustin da Fokus,,"Participei do lançamento do #PlanoSafra 2019/2020 que trouxe novidades para o pequeno, médio e grande produtor rural. Tenho muito respeito pelo agronegócio que impulsiona a economia do nosso País. Estamos juntos!  https://t.co/b8iAW96dqE",pt,[],[],['https://pbs.twimg.com/media/D9XDPRFXoME-pvU.jpg'],2,1,1,['planosafra'],[],https://twitter.com/glaustindafokus/status/1141032752432713735,False,,1,https://pbs.twimg.com/media/D9XDPRFXoME-pvU.jpg,,,,,,,[],,,,
1140251156922478594,1140251153718009857,2019-06-16 10:33:55 -0300,2019-06-16,10:33:55,-300,133692726,glaustindafokus,Glaustin da Fokus,,"E estamos aqui para o que for preciso. Que a justiça seja feita e os responsáveis paguem por esse terrível crime e não vitimizem mais vidas inocentes. Lamentável, muito triste, revoltante e absurdo. 💔😢🙏🏻 #luto",pt,[],[],[],0,0,0,['luto'],[],https://twitter.com/glaustindafokus/status/1140251156922478594,False,,0,,,,,,,,[],,,,
1140251155345432576,1140251153718009857,2019-06-16 10:33:54 -0300,2019-06-16,10:33:54,-300,133692726,glaustindafokus,Glaustin da Fokus,,"Anderson foi covardemente assassinado em uma tentativa de assalto em Niterói-RJ. Eles são pais de 55 filhos, 51 deles adotivos. Não imagino a dor dessa família, mas quero dizer à nossa amiga @flordelismk que estamos em oração para que Deus dê conforto e paz aos seus corações.",pt,"[{'screen_name': 'flordelismk', 'name': 'flordelis', 'id': '1277774141731614721'}]",[],[],1,0,0,[],[],https://twitter.com/glaustindafokus/status/1140251155345432576,False,,0,,,,,,,,[],,,,
1140251153718009857,1140251153718009857,2019-06-16 10:33:54 -0300,2019-06-16,10:33:54,-300,133692726,glaustindafokus,Glaustin da Fokus,,"Domingo muito triste com a notícia da morte do @prandersondocarmo, esposo da deputada federal @flordelismk, nossa irmã de fé e colega na Câmara, que sempre abençoa nossos cultos na @fpevangelica19 com sua voz e canções.",pt,"[{'screen_name': 'flordelismk', 'name': 'flordelis', 'id': '1277774141731614721'}, {'screen_name': 'fpevangelica19', 'name': 'frente parlamentar evangélica', 'id': '1112758008768024578'}]",[],[],1,0,2,[],[],https://twitter.com/glaustindafokus/status/1140251153718009857,False,,0,,,,,,,,[],,,,
1138517999231676423,1138517996874412032,2019-06-11 15:46:58 -0300,2019-06-11,15:46:58,-300,133692726,glaustindafokus,Glaustin da Fokus,,"Serei um defensor da atuação de @SF_Moro aqui no Congresso, pois acredito em seus propósitos. Logo mais, irei pessoalmente manifestar meu total apoio ao Ministro. A missão de passar o Brasil a limpo é difícil, áspera, mas vamos vencer com trabalho, fé, retidão e Deus no coração.",pt,"[{'screen_name': 'sf_moro', 'name': 'sergio moro', 'id': '1113094855281008641'}]",[],[],1,0,3,[],[],https://twitter.com/glaustindafokus/status/1138517999231676423,False,,0,,,,,,,,[],,,,
1138517998074028034,1138517996874412032,2019-06-11 15:46:58 -0300,2019-06-11,15:46:58,-300,133692726,glaustindafokus,Glaustin da Fokus,,"O preço por ter uma postura séria, honesta, íntegra e de lutar contra grupos poderosos é alto, mas com toda certeza absoluta @SF_Moro não está sozinho nesta batalha. 🇧🇷Falei ontem diretamente a ele da minha confiança inabalável na sua conduta e ética e reafirmo isso aqui. 👊",pt,"[{'screen_name': 'sf_moro', 'name': 'sergio moro', 'id': '1113094855281008641'}]",[],[],1,0,3,[],[],https://twitter.com/glaustindafokus/status/1138517998074028034,False,,0,,,,,,,,[],,,,
1138517996874412032,1138517996874412032,2019-06-11 15:46:57 -0300,2019-06-11,15:46:57,-300,133692726,glaustindafokus,Glaustin da Fokus,,"O Ministro @SF_Moro tem uma contribuição inconteste ao País. Fez e faz um grande trabalho de combate à corrupção e ao crime organizado, desprendido de qualquer motivação que não seja a de livrar o Brasil dos interesses escusos de quem fez da nação um balcão de negócios ilícitos.",pt,"[{'screen_name': 'sf_moro', 'name': 'sergio moro', 'id': '1113094855281008641'}]",[],[],2,0,4,[],[],https://twitter.com/glaustindafokus/status/1138517996874412032,False,,0,,,,,,,,[],,,,
1136238308143620097,1136238308143620097,2019-06-05 08:48:17 -0300,2019-06-05,08:48:17,-300,133692726,glaustindafokus,Glaustin da Fokus,,"Estou a caminho de Aragarças com o presidente @jairbolsonaro para o lançamento do programa Juntos Pelo Araguaia. A ação atuará na recomposição florestal, conservação do solo e água, além de ações de saneamento nos municípios goianos.",pt,"[{'screen_name': 'jairbolsonaro', 'name': 'jair m. bolsonaro', 'id': '128372940'}]",[],[],5,0,4,[],[],https://twitter.com/glaustindafokus/status/1136238308143620097,False,,0,,,,,,,,[],,,,
1134603993202724864,1134603993202724864,2019-05-31 20:34:06 -0300,2019-05-31,20:34:06,-300,133692726,glaustindafokus,Glaustin da Fokus,,"Mais vidas foram cruelmente interrompidas por conta de um atentado. Desta vez, oro para que Deus console o coração dos familiares e amigos que perderam entes queridos no tiroteio em um prédio governamental de Virgínia. Oro também por dias melhores para todos. Chega de violência!",pt,[],[],[],2,0,0,[],[],https://twitter.com/glaustindafokus/status/1134603993202724864,False,https://twitter.com/g1/status/1134600917012160513,0,,,,,,,,[],,,,
1133832768725630978,1133832767333179392,2019-05-29 17:29:32 -0300,2019-05-29,17:29:32,-300,133692726,glaustindafokus,Glaustin da Fokus,,"Por isso, sugeri e vou presidir nesta quinta-feira, às 9h30, aqui na @camaradeputados, uma audiência pública com dirigentes do @SistemaCNC, @CNI_br, @agenciaCNT, @SouSesi e @fecomerciopa. Vamos pensar nas futuras gerações!  #SouSESI #PeloFuturoDoTrabalho #PeloFuturoDaIndústria",pt,"[{'screen_name': 'camaradeputados', 'name': 'câmara dos deputados', 'id': '61843152'}, {'screen_name': 'sistemacnc', 'name': 'sistemacnc', 'id': '264438617'}, {'screen_name': 'cni_br', 'name': 'cni brasil', 'id': '88915485'}, {'screen_name': 'agenciacnt', 'name': 'agência cnt', 'id': '234436419'}, {'screen_name': 'sousesi', 'name': 'sou sesi', 'id': '1067117044527702017'}, {'screen_name': 'fecomerciopa', 'name': 'fecomercio pará', 'id': '334248289'}]",[],[],1,0,4,"['sousesi', 'pelofuturodotrabalho', 'pelofuturodaindústria']",[],https://twitter.com/glaustindafokus/status/1133832768725630978,False,,0,,,,,,,,[],,,,
1133832767333179392,1133832767333179392,2019-05-29 17:29:31 -0300,2019-05-29,17:29:31,-300,133692726,glaustindafokus,Glaustin da Fokus,,"Qual é sua opinião sobre o Sistema S? Para mim, essas 9 entidades movimentam a economia brasileira e são fundamentais para o ensino profissionalizante no País. Sou a favor de mais transparência nas contas, mas discordo de cortes que comprometam a sobrevivência das instituições.",pt,[],[],[],4,2,11,[],[],https://twitter.com/glaustindafokus/status/1133832767333179392,False,,0,,,,,,,,[],,,,
1133096319709601792,1133096319709601792,2019-05-27 16:43:09 -0300,2019-05-27,16:43:09,-300,133692726,glaustindafokus,Glaustin da Fokus,,"É sempre muito triste perdas tão precoces como a do cantor Gabriel Diniz, jovem do bem e alto astral. Ele morre no momento auge de sua carreira, assim como aconteceu com o amigo Cristiano Araújo. Que Deus conforte as famílias e amigos das vítimas dessa tragédia.  https://t.co/9lhxfDz6hp",pt,[],[],['https://pbs.twimg.com/media/D7mRF9zWwAABWXi.jpg'],4,0,3,[],[],https://twitter.com/glaustindafokus/status/1133096319709601792,False,,1,https://pbs.twimg.com/media/D7mRF9zWwAABWXi.jpg,,,,,,,[],,,,
1131001930493366272,1131001930493366272,2019-05-21 22:00:47 -0300,2019-05-21,22:00:47,-300,133692726,glaustindafokus,Glaustin da Fokus,,"Me reuni com o ministro da Cidadania, Osmar Terra, o secretário especial do Esporte, general Décio Brasil, e com o secretário estadual de Esporte e Lazer, Rafael Rahif, para buscar recursos para reformar o estádio Annibal Batista de Toledo e cinco ginásios em Aparecida de Goiânia",pt,[],[],[],36,1,5,[],[],https://twitter.com/glaustindafokus/status/1131001930493366272,False,,0,,,,,,,,[],,,,
1130517648566050816,1130517648566050816,2019-05-20 13:56:26 -0300,2019-05-20,13:56:26,-300,133692726,glaustindafokus,Glaustin da Fokus,,O PL que protocolei em prol da segurança no ambiente escolar ganhou um parecer favorável do deputado federal Otto Alencar. Este é um grande passo para que as nossas crianças tenham segurança para aprender. Como mostra a matéria do @diariodamanha :  https://t.co/X3jlgcDqfo,pt,"[{'screen_name': 'diariodamanha', 'name': 'diário da manhã', 'id': '43229821'}]",[],['https://pbs.twimg.com/media/D7Bny-5W0AECQCZ.jpg'],3,0,2,[],[],https://twitter.com/glaustindafokus/status/1130517648566050816,False,,1,https://pbs.twimg.com/media/D7Bny-5W0AECQCZ.jpg,,,,,,,[],,,,
1127261909290561536,1127261909290561536,2019-05-11 14:19:17 -0300,2019-05-11,14:19:17,-300,133692726,glaustindafokus,Glaustin da Fokus,,Que alegria celebrar 97 anos de Aparecida de Goiânia ao lado do povo. Sou aparecidense de coração e participo do crescimento deste município tão pujante. Reforço o meu compromisso em ajudar a fazer com que Aparecida continue prosperando.  https://t.co/fTLZWXscKi,pt,[],[],['https://pbs.twimg.com/media/D6TWuNYW4AEtmGn.jpg'],1,0,4,[],[],https://twitter.com/glaustindafokus/status/1127261909290561536,False,,1,https://pbs.twimg.com/media/D6TWuNYW4AEtmGn.jpg,,,,,,,[],,,,
1123370027284090881,1123370027284090881,2019-04-30 20:34:20 -0300,2019-04-30,20:34:20,-300,133692726,glaustindafokus,Glaustin da Fokus,,Inclusive propus um PL que autoriza escolas a adotar medidas para evitar a entrada de armas de fogo e drogas em suas dependências. Meus sentimentos à família do professor. Que Deus conforte e console o coração de vocês!,pt,[],[],[],0,0,3,[],[],https://twitter.com/glaustindafokus/status/1123370027284090881,False,,0,,,,,,,,[],,,,
1123369862867431424,1123369862867431424,2019-04-30 20:33:41 -0300,2019-04-30,20:33:41,-300,133692726,glaustindafokus,Glaustin da Fokus,,É com muita indignação que recebi a notícia que um professor foi assassinado a tiros por um aluno dentro de uma escola em Valparaíso. Isso mais uma vez reforça a importância de ações de segurança nas escolas.,pt,[],[],[],1,0,1,[],[],https://twitter.com/glaustindafokus/status/1123369862867431424,False,,0,,,,,,,,[],,,,
1121397131473051648,1121397131473051648,2019-04-25 09:54:45 -0300,2019-04-25,09:54:45,-300,133692726,glaustindafokus,Glaustin da Fokus,,"Concordo com o @RodrigoMaia sobre a  ‘nova x velha política’. Precisamos da boa política. Sou novato neste mundo, mas não acredito que definir parlamentar como vilão ajude a resolver problemas do Brasil. Como ele disse, as grandes democracias do mundo têm parlamentos fortes.",pt,"[{'screen_name': 'rodrigomaia', 'name': 'rodrigo maia', 'id': '35260027'}]",[],[],4,1,2,[],[],https://twitter.com/glaustindafokus/status/1121397131473051648,False,,0,,,,,,,,[],,,,
1121396152589529088,1121396152589529088,2019-04-25 09:50:51 -0300,2019-04-25,09:50:51,-300,133692726,glaustindafokus,Glaustin da Fokus,,"Preciso enaltecer a entrevista do presidente @RodrigoMaia à @GloboNews. Ele demonstrou lucidez e toda a firmeza necessária para conduzir um processo tão importante para o futuro do País como a reforma da Previdência, cujo texto precisa ser melhorado.",pt,"[{'screen_name': 'rodrigomaia', 'name': 'rodrigo maia', 'id': '35260027'}, {'screen_name': 'globonews', 'name': 'globonews', 'id': '142393421'}]",[],[],1,0,0,[],[],https://twitter.com/glaustindafokus/status/1121396152589529088,False,,0,,,,,,,,[],,,,
1120889246380904448,1120889246380904448,2019-04-24 00:16:36 -0300,2019-04-24,00:16:36,-300,133692726,glaustindafokus,Glaustin da Fokus,,"Agora há pouco, a CCJ aprovou o parecer favorável à Reforma da Previdência. Sabemos que o texto está de acordo com a Constituição. Agora, na comissão especial, entramos na fase mais importante: discutir e avaliar item por item da proposta!",pt,[],[],[],1,0,2,[],[],https://twitter.com/glaustindafokus/status/1120889246380904448,False,,0,,,,,,,,[],,,,
1120730761634643968,1120730761634643968,2019-04-23 13:46:50 -0300,2019-04-23,13:46:50,-300,133692726,glaustindafokus,Glaustin da Fokus,,"Como vice-presidente da CPD, tenho dialogado com instituições goianas para entender as necessidades de cada uma. Ontem conheci a Adfego e ressaltei que estou abraçando esta comunidade e quero ser parceiro nesta causa tão digna e que reabilita tantas vidas. Esta luta é nossa!  https://t.co/vw4ki9Nv6Z",pt,[],[],['https://pbs.twimg.com/media/D42irgHWsAAJVLO.jpg'],0,0,1,[],[],https://twitter.com/glaustindafokus/status/1120730761634643968,False,,1,https://pbs.twimg.com/media/D42irgHWsAAJVLO.jpg,,,,,,,[],,,,
1118645116170919936,1118645116170919936,2019-04-17 19:39:13 -0300,2019-04-17,19:39:13,-300,133692726,glaustindafokus,Glaustin da Fokus,,"Estou acompanhando de perto a discussão da Reforma da Previdência que deveria ter sido votada nesta semana na CCJ, mas que foi adiada. Defendo que a proposta chegue logo na Comissão Especial para que possamos discutir a fundo ponto a ponto do texto.  https://t.co/5P7nhJXoU0",pt,[],[],[],4,0,3,[],[],https://twitter.com/glaustindafokus/status/1118645116170919936,False,,1,https://pbs.twimg.com/ext_tw_video_thumb/1118643839936471040/pu/img/GL01WIIsV7_UOlxA.jpg,,,,,,,[],,,,
1117892965714800648,1117892965714800648,2019-04-15 17:50:27 -0300,2019-04-15,17:50:27,-300,133692726,glaustindafokus,Glaustin da Fokus,,Toda a nossa solidariedade aos moradores do Rio de Janeiro que tem sofrido desde a semana passada com as fortes chuvas na região. Hoje durante o meu pronunciamento no Plenário da Câmara dos Deputados fiz um pedido especial a todos os brasileiros. Assista! #chuvarj  https://t.co/RKEJgU264M,pt,[],[],[],0,1,0,['chuvarj'],[],https://twitter.com/glaustindafokus/status/1117892965714800648,False,,1,https://pbs.twimg.com/ext_tw_video_thumb/1117892260459352064/pu/img/kLJL1iqr7wNbP3kB.jpg,,,,,,,[],,,,
1117874438156894208,1117874438156894208,2019-04-15 16:36:49 -0300,2019-04-15,16:36:49,-300,133692726,glaustindafokus,Glaustin da Fokus,,"É com muita tristeza que tenho acompanhado a notícia do incêndio na Catedral de Notre-Dame, uma construção importantíssima para a história da França. Mais uma tragédia de impacto mundial.",pt,[],[],[],0,0,0,[],[],https://twitter.com/glaustindafokus/status/1117874438156894208,False,,0,,,,,,,,[],,,,
1117849603703889920,1117849603703889920,2019-04-15 14:58:08 -0300,2019-04-15,14:58:08,-300,133692726,glaustindafokus,Glaustin da Fokus,,"Convidei o  senador Luiz do Carmo, o secretário de Indústria e Comércio,@wildermorais , o deputado estadual Henrique Cesar e a vereadora Leia Klebia para participarem do bate-papo, abraçarem esse setor e nos ajudarem a mostrar a força que temos.  https://t.co/SeJsrad11v",pt,"[{'screen_name': 'wildermorais', 'name': 'wilder morais', 'id': '237687306'}]",[],['https://pbs.twimg.com/media/D4NmR9zXoAAg3OF.jpg'],0,0,3,[],[],https://twitter.com/glaustindafokus/status/1117849603703889920,False,,1,https://pbs.twimg.com/media/D4NmR9zXoAAg3OF.jpg,,,,,,,[],,,,
1117848993034199040,1117848993034199040,2019-04-15 14:55:43 -0300,2019-04-15,14:55:43,-300,133692726,glaustindafokus,Glaustin da Fokus,,"Como representante do supermercadista, tive a iniciativa de abrir uma agenda de diálogo com os principais supermercadistas do Estado para mostrar projetos e ações que temos feito e também para ouvi-los.  https://t.co/XtE636G2p2",pt,[],[],['https://pbs.twimg.com/media/D4NluaWW4AAkip2.jpg'],0,0,0,[],[],https://twitter.com/glaustindafokus/status/1117848993034199040,False,,1,https://pbs.twimg.com/media/D4NluaWW4AAkip2.jpg,,,,,,,[],,,,
1116489905448935424,1116489905448935424,2019-04-11 20:55:11 -0300,2019-04-11,20:55:11,-300,133692726,glaustindafokus,Glaustin da Fokus,,Protocolei um PL que autoriza escolas a adotar medidas para coibir entrada de armas de fogo e de drogas em suas dependências. Não podemos deixar que o ambiente de ensino vire o ambiente do medo. O objetivo é evitar que mais atentados aconteçam  https://t.co/69d4TxQzA8,pt,[],['https://youtu.be/D_mzY9gKbCY'],[],0,0,1,[],[],https://twitter.com/glaustindafokus/status/1116489905448935424,False,,0,,,,,,,,[],,,,
1115999570251665409,1115999570251665409,2019-04-10 12:26:46 -0300,2019-04-10,12:26:46,-300,133692726,glaustindafokus,Glaustin da Fokus,,"Requeri e consegui uma audiência pública para debater o grau de importância do Sistema S, em um cenário de cortes no orçamento, para tomarmos decisões corretas. Inclusive ganhei apoio dos colegas da Comissão de Desenvolvimento Econômico, Indústria, Comércio e Serviços da Câmara.  https://t.co/gZGeyunWwh",pt,[],[],['https://pbs.twimg.com/media/D3zTsSoX4AEkGMW.jpg'],0,0,1,[],[],https://twitter.com/glaustindafokus/status/1115999570251665409,False,,1,https://pbs.twimg.com/media/D3zTsSoX4AEkGMW.jpg,,,,,,,[],,,,
1111687721578360832,1111687721578360832,2019-03-29 14:53:01 -0300,2019-03-29,14:53:01,-300,133692726,glaustindafokus,Glaustin da Fokus,,A coluna Giro do @jornal_opopular trouxe na edição de hoje um pouco da minha reunião com o Ministro Moro. Confira!  https://t.co/BZdoPCPe1O,pt,"[{'screen_name': 'jornal_opopular', 'name': 'o popular', 'id': '54527239'}]",[],['https://pbs.twimg.com/media/D22CFntXcAAaSq5.jpg'],1,1,1,[],[],https://twitter.com/glaustindafokus/status/1111687721578360832,False,,1,https://pbs.twimg.com/media/D22CFntXcAAaSq5.jpg,,,,,,,[],,,,
1111253761685684224,1111253761685684224,2019-03-28 10:08:37 -0300,2019-03-28,10:08:37,-300,133692726,glaustindafokus,Glaustin da Fokus,,"Ontem, em sessão na Comissão de Finanças e Tributação (CFT), propus que haja mais cooperação entre o legislativo e o executivo e que os interesses partidários não sejam colocados acima dos interesses da população. Assista:  https://t.co/Q7NJf0tkXk  https://t.co/EAsotWCIta",pt,[],['https://www.youtube.com/watch?v=sVdWpw9GwuA'],['https://pbs.twimg.com/media/D2v3ZzhXgAAW0X2.jpg'],1,0,2,[],[],https://twitter.com/glaustindafokus/status/1111253761685684224,False,,1,https://pbs.twimg.com/media/D2v3ZzhXgAAW0X2.jpg,,,,,,,[],,,,
1111236153477341184,1111236153477341184,2019-03-28 08:58:39 -0300,2019-03-28,08:58:39,-300,133692726,glaustindafokus,Glaustin da Fokus,,"A sociedade brasileira exige medidas enérgicas no combate à corrupção, por isso protocolei um Projeto de lei que prevê penalidades em casos de improbidade administrativa. Saiba mais na Coluna Giro do @jornal_opopular .  https://t.co/28SHZ0bXTO",pt,"[{'screen_name': 'jornal_opopular', 'name': 'o popular', 'id': '54527239'}]",[],['https://pbs.twimg.com/media/D2vnY8iXQAAy9ni.jpg'],0,0,1,[],[],https://twitter.com/glaustindafokus/status/1111236153477341184,False,,1,https://pbs.twimg.com/media/D2vnY8iXQAAy9ni.jpg,,,,,,,[],,,,
