id,conversation_id,created_at,date,time,timezone,user_id,username,name,place,tweet,language,mentions,urls,photos,replies_count,retweets_count,likes_count,hashtags,cashtags,link,retweet,quote_url,video,thumbnail,near,geo,source,user_rt_id,user_rt,retweet_id,reply_to,retweet_date,translate,trans_src,trans_dest
1318517591804203009,1318517591804203009,2020-10-20 08:41:05 -0300,2020-10-20,08:41:05,-300,133692726,glaustindafokus,Glaustin da Fokus,,"É hoje! O plenário da @camaradeputados deve votar a MP 992, que facilita acesso ao crédito para empresas. O jornal @valoreconomico destacou a minha decisão de estender o programa de capital de giro para microempreendedores individuais e produtores rurais:  https://t.co/jpKYqYGcz3",pt,"[{'screen_name': 'camaradeputados', 'name': 'câmara dos deputados', 'id': '61843152'}, {'screen_name': 'valoreconomico', 'name': 'valor econômico', 'id': '32529120'}]",['https://glo.bo/31rE4Ex'],[],2,0,0,[],[],https://twitter.com/glaustindafokus/status/1318517591804203009,False,,0,,,,,,,,[],,,,
1314176392750342144,1314176390825213955,2020-10-08 09:10:42 -0300,2020-10-08,09:10:42,-300,133692726,glaustindafokus,Glaustin da Fokus,,"Sempre admirei o trabalho dele como cronista esportivo e acompanho desde, muito jovem, suas entrevistas e sua trajetória. Tive o prazer de conhecer Adolfo e sei o quanto a sua ausência será sentida por todos nós. Goiás amanheceu de luto!",pt,[],[],[],1,0,0,[],[],https://twitter.com/glaustindafokus/status/1314176392750342144,False,,0,,,,,,,,[],,,,
1314176390825213955,1314176390825213955,2020-10-08 09:10:42 -0300,2020-10-08,09:10:42,-300,133692726,glaustindafokus,Glaustin da Fokus,,"O jornalismo goiano perdeu hoje um grande profissional.Estou em oração para que Deus conforte o coração dos familiares, amigos,colegas de profissão e a todos que acompanhavam o brilhante trabalho do cronista Adolfo Campos .Fica o seu legado e exemplo de ética para a sociedade.",pt,[],[],[],5,0,2,[],[],https://twitter.com/glaustindafokus/status/1314176390825213955,False,,0,,,,,,,,[],,,,
1313617692117663744,1313617690037190656,2020-10-06 20:10:38 -0300,2020-10-06,20:10:38,-300,133692726,glaustindafokus,Glaustin da Fokus,,"Em nome relator @_luizdocarmo , que também é um grande amigo de Goiás, parabenizo e agradeço aos senadores por olharem com sensibilidade diante de uma causa tão importante e em tempos tão difíceis para a geração de oportunidades de trabalho.",pt,"[{'screen_name': '_luizdocarmo', 'name': 'luiz do carmo senador', 'id': '173834511'}]",[],[],1,0,1,[],[],https://twitter.com/glaustindafokus/status/1313617692117663744,False,,0,,,,,,,,[],,,,
1313617690037190656,1313617690037190656,2020-10-06 20:10:37 -0300,2020-10-06,20:10:37,-300,133692726,glaustindafokus,Glaustin da Fokus,,"A nossa emenda na MP 987, que prorroga incentivos para empresas automotivas no Centro-Oeste, teve mais uma grande vitória hoje. O @SenadoFederal aprovou o texto por meio de uma sessão virtual. Com isso, vamos garantir mais de 6 mil empregos principalmente em Anápolis e Catalão.",pt,"[{'screen_name': 'senadofederal', 'name': 'senado federal', 'id': '40095953'}]",[],[],2,0,2,[],[],https://twitter.com/glaustindafokus/status/1313617690037190656,False,,0,,,,,,,,[],,,,
1311083024260435970,1311083001791623168,2020-09-29 20:18:46 -0300,2020-09-29,20:18:46,-300,133692726,glaustindafokus,Glaustin da Fokus,,"Esse projeto irá preservar 6 mil empregos apenas em Anápolis e Catalão. Agradeço ao nosso governador @ronaldocaiado , que se empenhou junto comigo para manter essas empresas em nosso Estado, e também ao relator André de Paula pela sensibilidade com essa causa.  https://t.co/2e0g0Tc2EN",pt,"[{'screen_name': 'ronaldocaiado', 'name': 'ronaldo caiado', 'id': '32101740'}]",[],['https://pbs.twimg.com/media/EjHnDTwWkAUNbZE.jpg'],1,1,2,[],[],https://twitter.com/glaustindafokus/status/1311083024260435970,False,,1,https://pbs.twimg.com/media/EjHnDTwWkAUNbZE.jpg,,,,,,,[],,,,
1311083001791623168,1311083001791623168,2020-09-29 20:18:41 -0300,2020-09-29,20:18:41,-300,133692726,glaustindafokus,Glaustin da Fokus,,Dia de vitória para a garantia de empregos e desenvolvimento econômico do nosso povo goiano.A @camaradeputados acaba de aprovar uma emenda de minha autoria na MP 987/20 para prorrogar até 2025 a concessão de incentivos fiscais às montadoras de veículos instaladas no Centro-Oeste,pt,"[{'screen_name': 'camaradeputados', 'name': 'câmara dos deputados', 'id': '61843152'}]",[],[],3,1,3,[],[],https://twitter.com/glaustindafokus/status/1311083001791623168,False,,0,,,,,,,,[],,,,
1309462787899502592,1309462787899502592,2020-09-25 09:00:31 -0300,2020-09-25,09:00:31,-300,133692726,glaustindafokus,Glaustin da Fokus,,"O nosso governador @ronaldocaiado celebra mais um ano em Cristo hoje.Ele me trouxe para a política para que eu ajudasse na reconstrução de Goiás. Missão que muito me honra. Parabéns,Caiado! Que Deus continue te dando garra, saúde e sabedoria para conduzir Goiás.Feliz Aniversário!",pt,"[{'screen_name': 'ronaldocaiado', 'name': 'ronaldo caiado', 'id': '32101740'}]",[],[],3,0,4,[],[],https://twitter.com/glaustindafokus/status/1309462787899502592,False,,0,,,,,,,,[],,,,
1308548071199043590,1308548071199043590,2020-09-22 20:25:46 -0300,2020-09-22,20:25:46,-300,133692726,glaustindafokus,Glaustin da Fokus,,A @camaradedeputados aprovou o PL 3267/2019 que amplia a validade da CNH de 5 anos para até 10 anos.Também foi flexibilizado as regras para a suspensão do direito de dirigir vinculando a punição à gravidade da infração. A medida segue para a aprovação do Presidente @jairbolsonaro,pt,"[{'screen_name': 'jairbolsonaro', 'name': 'jair m. bolsonaro', 'id': '128372940'}]",[],[],4,0,1,[],[],https://twitter.com/glaustindafokus/status/1308548071199043590,False,,0,,,,,,,,[],,,,
1308030944130072582,1308030944130072582,2020-09-21 10:10:53 -0300,2020-09-21,10:10:53,-300,133692726,glaustindafokus,Glaustin da Fokus,,"O nosso estado é outro sob o comando de @ronaldocaiado. Goiás lidera rankings de educação, saúde e segurança. Faço questão de reproduzir o artigo de hoje do governador no @jornal_opopular. São resultados diretos de empenho coletivo e liderança! Agora a meta é nota máxima no Ideb!  https://t.co/li1QCbG6lS",pt,"[{'screen_name': 'ronaldocaiado', 'name': 'ronaldo caiado', 'id': '32101740'}, {'screen_name': 'jornal_opopular', 'name': 'o popular', 'id': '54527239'}]",[],['https://pbs.twimg.com/media/EicPM-EXYAYxArB.jpg'],2,0,2,[],[],https://twitter.com/glaustindafokus/status/1308030944130072582,False,,1,https://pbs.twimg.com/media/EicPM-EXYAYxArB.jpg,,,,,,,[],,,,
1305966565528154113,1305966562457915392,2020-09-15 17:27:47 -0300,2020-09-15,17:27:47,-300,133692726,glaustindafokus,Glaustin da Fokus,,"Parabéns, governador @ronaldocaiado e secretária de Educação @fatimagavioli , pela gestão eficiente. Parabéns, especialmente, a todos os professores e servidores da rede estadual que se dedicam incansavelmente para formar nossas crianças e jovens.",pt,"[{'screen_name': 'ronaldocaiado', 'name': 'ronaldo caiado', 'id': '32101740'}, {'screen_name': 'fatimagavioli', 'name': 'fátima gavioli', 'id': '923955464'}]",[],[],1,0,1,[],[],https://twitter.com/glaustindafokus/status/1305966565528154113,False,,0,,,,,,,,[],,,,
1305966562457915392,1305966562457915392,2020-09-15 17:27:46 -0300,2020-09-15,17:27:46,-300,133692726,glaustindafokus,Glaustin da Fokus,,"Goiás é referência na educação do País! Que orgulho de termos o melhor ensino público do Brasil! O nosso Estado é líder no ranking nacional do Ideb 2019. Esse é o reconhecimento de um governo que prioriza as pessoas e trabalha, com determinação, para construir um futuro melhor.",pt,[],[],[],5,0,2,[],[],https://twitter.com/glaustindafokus/status/1305966562457915392,False,,0,,,,,,,,[],,,,
1305831152473776129,1305831152473776129,2020-09-15 08:29:42 -0300,2020-09-15,08:29:42,-300,133692726,glaustindafokus,Glaustin da Fokus,,Estamos em uma semana decisiva para o futuro de mais de 3 mil famílias goianas. 👨🏽‍🏭A minha emenda na Medida Provisória 987 prorroga até 2025 os incentivos fiscais que atraem e mantêm montadoras de veículos no Estado. 🚘A MP está na pauta de votação da próxima quinta-feira.,pt,[],[],[],1,0,1,[],[],https://twitter.com/glaustindafokus/status/1305831152473776129,False,https://twitter.com/ronaldocaiado/status/1305656347174866945,0,,,,,,,,[],,,,
1301575526071644163,1301575503804018688,2020-09-03 14:39:22 -0300,2020-09-03,14:39:22,-300,133692726,glaustindafokus,Glaustin da Fokus,,"Um dos projetos de sua autoria é a inclusão da frase ""Deus seja louvado"" nas cédulas do real. O Pastor nos deixou aos 79 anos, vítima de Covid. Em nome da irmã Bispa Neusa César, me solidarizo com toda a família nesse momento de profunda dor. Que Deus nos dê conforto e paz.  https://t.co/hnYXBclgET",pt,[],[],['https://pbs.twimg.com/media/EhAgCcLXkAEyx7x.jpg'],0,0,0,[],[],https://twitter.com/glaustindafokus/status/1301575526071644163,False,,1,https://pbs.twimg.com/media/EhAgCcLXkAEyx7x.jpg,,,,,,,[],,,,
1301575503804018688,1301575503804018688,2020-09-03 14:39:16 -0300,2020-09-03,14:39:16,-300,133692726,glaustindafokus,Glaustin da Fokus,,"Hoje perdemos uma pessoa muito importante em nossa comunidade cristã e também na vida pública. O Pastor Antônio de Jesus Dias, além um grande servo de Deus, foi psicólogo, professor universitário e deputado federal constituinte.",pt,[],[],[],2,0,0,[],[],https://twitter.com/glaustindafokus/status/1301575503804018688,False,,0,,,,,,,,[],,,,
1301516872492384257,1301516872492384257,2020-09-03 10:46:18 -0300,2020-09-03,10:46:18,-300,133692726,glaustindafokus,Glaustin da Fokus,,"Metade dos brasileiros aprova o governo @jairbolsonaro, segundo o @Poder360. 📈A popularidade do nosso presidente subiu 10% desde julho. 👊🏽A avaliação positiva também cresceu entre os jovens de 16 a 24 anos: de 34% a 43% em 15 dias. 🇧🇷Seguimos juntos, capitão! Acredito e confio!",pt,"[{'screen_name': 'jairbolsonaro', 'name': 'jair m. bolsonaro', 'id': '128372940'}, {'screen_name': 'poder360', 'name': 'poder360', 'id': '4896510833'}]",[],[],1,0,0,[],[],https://twitter.com/glaustindafokus/status/1301516872492384257,False,https://twitter.com/Poder360/status/1301490869875494920,0,,,,,,,,[],,,,
1299459189744504834,1299459189744504834,2020-08-28 18:29:48 -0300,2020-08-28,18:29:48,-300,133692726,glaustindafokus,Glaustin da Fokus,,"Sextou com trabalho em São Luís do Maranhão, na companhia do amigo e mestre @AluisioMendesMA. Encarei o desafio de relatar a MP 992 em busca de garantir capital de giro para preservar empresas castigadas pela pandemia de covid-19. Nosso empreendedorismo merece mais oportunidades!  https://t.co/HZTVxNG1nb",pt,"[{'screen_name': 'aluisiomendesma', 'name': 'aluisio mendes', 'id': '2654800357'}]",[],['https://pbs.twimg.com/media/EgibPm9WsAEY-dF.jpg'],0,0,0,[],[],https://twitter.com/glaustindafokus/status/1299459189744504834,False,,1,https://pbs.twimg.com/media/EgibPm9WsAEY-dF.jpg,,,,,,,[],,,,
1298385428576313344,1298385425401294850,2020-08-25 19:23:03 -0300,2020-08-25,19:23:03,-300,133692726,glaustindafokus,Glaustin da Fokus,,"Até 2024, a expectativa é que 1,6 milhão de famílias sejam beneficiadas. Parabéns, @jairbolsonaro , e a todos do @mdregional_br que estão à frente desse importante programa que vai minimizar o déficit habitacional do nosso País. Os brasileiros agradecem!",pt,"[{'screen_name': 'jairbolsonaro', 'name': 'jair m. bolsonaro', 'id': '128372940'}, {'screen_name': 'mdregional_br', 'name': 'ministério do desenvolvimento regional', 'id': '1004396762'}]",[],[],0,0,2,[],[],https://twitter.com/glaustindafokus/status/1298385428576313344,False,,0,,,,,,,,[],,,,
1298385425401294850,1298385425401294850,2020-08-25 19:23:02 -0300,2020-08-25,19:23:02,-300,133692726,glaustindafokus,Glaustin da Fokus,,"Não tem alegria maior para um pai e mãe de família do que a conquista de uma casa própria. O Presidente @jairbolsonaro lançou hoje o programa Casa Verde e Amarela com taxas de juros reduzidos para assegurar o direito à moradia, principalmente para quem mais precisa.",pt,"[{'screen_name': 'jairbolsonaro', 'name': 'jair m. bolsonaro', 'id': '128372940'}]",[],[],1,0,5,[],[],https://twitter.com/glaustindafokus/status/1298385425401294850,False,,0,,,,,,,,[],,,,
1298257711709032449,1298257711709032449,2020-08-25 10:55:33 -0300,2020-08-25,10:55:33,-300,133692726,glaustindafokus,Glaustin da Fokus,,"O Brasil perdeu uma grande referência no jornalismo ambiental. Conhecido mundialmente, Washington Novaes escolheu Goiânia para viver há 4 décadas. Ele nos deixou aos 86 anos, em Aparecida, após lutar contra um câncer. Meus sinceros sentimentos à família e aos amigos. #notadepesar",pt,[],[],[],0,0,1,['notadepesar'],[],https://twitter.com/glaustindafokus/status/1298257711709032449,False,,0,,,,,,,,[],,,,
1296603773553516545,1296603773553516545,2020-08-20 21:23:24 -0300,2020-08-20,21:23:24,-300,133692726,glaustindafokus,Glaustin da Fokus,,"A @camaradeputados votou pela manutenção do veto 17 do Presidente @jairbolsonaro .Tenho total respeito aos servidores públicos,mas o ônus da crise financeira não pode pesar apenas sobre os ombros da iniciativa privada.O momento é de união e responsabilidade com o futuro do Brasil",pt,"[{'screen_name': 'camaradeputados', 'name': 'câmara dos deputados', 'id': '61843152'}, {'screen_name': 'jairbolsonaro', 'name': 'jair m. bolsonaro', 'id': '128372940'}]",[],[],1,0,2,[],[],https://twitter.com/glaustindafokus/status/1296603773553516545,False,,0,,,,,,,,[],,,,
1294271964471857152,1294271964471857152,2020-08-14 10:57:37 -0300,2020-08-14,10:57:37,-300,133692726,glaustindafokus,Glaustin da Fokus,,"Sempre acreditei no compromisso do Presidente @jairbolsonaro de construir uma Nação melhor.A pesquisa do @Data_Folha ,divulgada hoje, aponta o crescimento da aprovação do governo. Apesar do momento difícil, o povo já percebe a postura do nosso Capitão e sua dedicação com o Brasil",pt,"[{'screen_name': 'jairbolsonaro', 'name': 'jair m. bolsonaro', 'id': '128372940'}, {'screen_name': 'data_folha', 'name': 'datafolha', 'id': '1281366055'}]",[],[],1,0,1,[],[],https://twitter.com/glaustindafokus/status/1294271964471857152,False,,0,,,,,,,,[],,,,
1293902747436294144,1293902747436294144,2020-08-13 10:30:29 -0300,2020-08-13,10:30:29,-300,133692726,glaustindafokus,Glaustin da Fokus,,"Retomada é a palavra da vez em Goiás. 🏭O governador @ronaldocaiado anunciou agora a vinda de 24 empresas para o estado, com investimentos previstos de R$ 1,6 bilhão e geração de 16 mil empregos em 12 municípios. 🤜🏼A pandemia não inviabilizou a economia goiana. 💪🏼Pelo contrário!",pt,"[{'screen_name': 'ronaldocaiado', 'name': 'ronaldo caiado', 'id': '32101740'}]",[],[],0,1,1,[],[],https://twitter.com/glaustindafokus/status/1293902747436294144,False,,0,,,,,,,,[],,,,
1293354364178923525,1293354364178923525,2020-08-11 22:11:24 -0300,2020-08-11,22:11:24,-300,133692726,glaustindafokus,Glaustin da Fokus,,"Com duas emendas minhas, aprovamos a Medida Provisória 983, que cria dois tipos de assinatura eletrônica: a simples e a avançada. ✏️Relator da MP, o amigo @LucasVergilioGO acatou nossas sugestões para aperfeiçoar o texto. 🧑🏽‍💻A ideia é ampliar o acesso a serviços públicos digitais.",pt,"[{'screen_name': 'lucasvergiliogo', 'name': 'lucas vergilio', 'id': '2717062461'}]",[],[],0,0,1,[],[],https://twitter.com/glaustindafokus/status/1293354364178923525,False,,0,,,,,,,,[],,,,
1293319226397265922,1293319226397265922,2020-08-11 19:51:46 -0300,2020-08-11,19:51:46,-300,133692726,glaustindafokus,Glaustin da Fokus,,"Também acompanhei o governador @ronaldocaiado em uma vistoria a trechos do Sistema de Linhões da @saneago, que, até 2024, vai reforçar o abastecimento de 450 mil aparecidenses já atendidos e também levar água tratada para outros 80 bairros.",pt,"[{'screen_name': 'ronaldocaiado', 'name': 'ronaldo caiado', 'id': '32101740'}, {'screen_name': 'saneago', 'name': 'saneago', 'id': '45591385'}]",[],[],0,0,0,[],[],https://twitter.com/glaustindafokus/status/1293319226397265922,False,,0,,,,,,,,[],,,,
1293318680407953408,1293318676196872194,2020-08-11 19:49:36 -0300,2020-08-11,19:49:36,-300,133692726,glaustindafokus,Glaustin da Fokus,,"Isso sem falar na geração de quase 700 empregos temporários. 🏗As obras começaram em 2013 e já estão 70% prontas. 🇧🇷Nesta reta final, serão investidos R$ 35 milhões.",pt,[],[],[],0,0,1,[],[],https://twitter.com/glaustindafokus/status/1293318680407953408,False,,0,,,,,,,,[],,,,
1293318676196872194,1293318676196872194,2020-08-11 19:49:35 -0300,2020-08-11,19:49:35,-300,133692726,glaustindafokus,Glaustin da Fokus,,"O Governo de Goiás está cada vez mais presente em Aparecida de Goiânia. Hoje foi dia de assinar um convênio para finalizar a construção de 900 apartamentos da @agehabgoias na Chácara São Pedro. Se Deus quiser, realizaremos os sonhos dessas famílias daqui a um ano e meio.",pt,[],[],[],1,0,3,[],[],https://twitter.com/glaustindafokus/status/1293318676196872194,False,,0,,,,,,,,[],,,,
1293317879664988161,1293317879664988161,2020-08-11 19:46:25 -0300,2020-08-11,19:46:25,-300,133692726,glaustindafokus,Glaustin da Fokus,,"Estamos driblando a crise, prova disso é que a indústria goiana cresceu 5,4% em junho e ficou em 1º lugar no País. Isso significa que nem mesmo a covid-19 conseguiu barrar a nossa expansão. Mesmo com a pandemia, o nosso Estado tem reagido positivamente e gerado emprego e renda.",pt,[],[],[],0,0,0,[],[],https://twitter.com/glaustindafokus/status/1293317879664988161,False,https://twitter.com/ronaldocaiado/status/1293265961181683713,0,,,,,,,,[],,,,
1291327415512436737,1291327415512436737,2020-08-06 07:57:02 -0300,2020-08-06,07:57:02,-300,133692726,glaustindafokus,Glaustin da Fokus,,"Nesta semana, me reuni com o nosso governador @ronaldocaiado para tratar de projetos políticos de municípios goianos. Um deles foi Aparecida. Confira a notícia completa no @jornal_opopular  https://t.co/IXG39Y9t8w",pt,"[{'screen_name': 'ronaldocaiado', 'name': 'ronaldo caiado', 'id': '32101740'}, {'screen_name': 'jornal_opopular', 'name': 'o popular', 'id': '54527239'}]",[],['https://pbs.twimg.com/media/Eeu3b35XYAAkWr7.jpg'],0,0,3,[],[],https://twitter.com/glaustindafokus/status/1291327415512436737,False,,1,https://pbs.twimg.com/media/Eeu3b35XYAAkWr7.jpg,,,,,,,[],,,,
1291086412167643136,1291086412167643136,2020-08-05 15:59:22 -0300,2020-08-05,15:59:22,-300,133692726,glaustindafokus,Glaustin da Fokus,,"Em 2020, o Dia Nacional da Saúde merece ainda mais destaque. 🩺Parabenizo o general @EduardoPazuello e o secretário @IsmAlexandrino, à frente de @minsaude e @saudegoias nesta pandemia. 💉A data homenageia Oswaldo Cruz, médico pioneiro no combate a epidemias brasileiras. Obrigado!",pt,"[{'screen_name': 'eduardopazuello', 'name': 'eduardo pazuello', 'id': '1250872379674431488'}, {'screen_name': 'ismalexandrino', 'name': 'ismael alexandrino', 'id': '52294792'}, {'screen_name': 'minsaude', 'name': 'ministério da saúde', 'id': '37717107'}, {'screen_name': 'saudegoias', 'name': 'saúde goiás', 'id': '116174454'}]",[],[],0,0,1,[],[],https://twitter.com/glaustindafokus/status/1291086412167643136,False,,0,,,,,,,,[],,,,
1290353479932837893,1290353479932837893,2020-08-03 15:26:57 -0300,2020-08-03,15:26:57,-300,133692726,glaustindafokus,Glaustin da Fokus,,"Deus recolheu hoje uma ovelha que trabalhou muito em Sua obra e na missão de levar a Palavra para quem mais precisa. Meus sentimentos à família e a todos que conviviam com o Pr. Valdivino Rodrigues da Luz, presidente da AD. Crixás. Que Deus conforte e console o coração de cada um",pt,[],[],[],0,0,0,[],[],https://twitter.com/glaustindafokus/status/1290353479932837893,False,,0,,,,,,,,[],,,,
1288812467641090049,1288812463878701064,2020-07-30 09:23:31 -0300,2020-07-30,09:23:31,-300,133692726,glaustindafokus,Glaustin da Fokus,,"O último item aprovado foi o PL 2424/20 que cria uma linha de crédito para profissionais liberais.Foram mais de 16 h de votações,o que reforça o quanto estamos atentos e trabalhando para ajudar quem mais precisa,principalmente nesse período de calamidade que passam alguns estados",pt,[],[],[],0,0,0,[],[],https://twitter.com/glaustindafokus/status/1288812467641090049,False,,0,,,,,,,,[],,,,
1288812463878701064,1288812463878701064,2020-07-30 09:23:31 -0300,2020-07-30,09:23:31,-300,133692726,glaustindafokus,Glaustin da Fokus,,"Passamos a noite e a madrugada votando muitos projetos importantes para minimizar os impactos da covid-19. Uma delas foi a MP 946/20 que facilita o saque do FGTS durante a pandemia. Também votei “sim” para a MP que destina R$ 2,11 bilhões para ações de combate à covid-19.",pt,[],[],[],1,0,0,[],[],https://twitter.com/glaustindafokus/status/1288812463878701064,False,,0,,,,,,,,[],,,,
1287756350689349633,1287756350689349633,2020-07-27 11:26:54 -0300,2020-07-27,11:26:54,-300,133692726,glaustindafokus,Glaustin da Fokus,,"O debate está reaberto no Congresso com a chegada da proposta de Reforma Tributária do governo federal na semana passada. 🗞Como disse ao @jornalopcao, o momento é bom para a matéria andar, ainda mais com essa necessidade de reconstruir a nossa economia e atrair investimentos! 🇧🇷",pt,"[{'screen_name': 'jornalopcao', 'name': 'jornal opção', 'id': '126390210'}]",[],[],0,0,0,[],[],https://twitter.com/glaustindafokus/status/1287756350689349633,False,https://twitter.com/jornalopcao/status/1287466747734495234,0,,,,,,,,[],,,,
1285983284879675392,1285983284879675392,2020-07-22 14:01:22 -0300,2020-07-22,14:01:22,-300,133692726,glaustindafokus,Glaustin da Fokus,,"Semana produtiva na Câmara! 🏃‍♂️Aprovamos a MP que autoriza a União a repassar até R$ 16 bilhões a estados e municípios, para mitigar efeitos econômicos da pandemia. Já foram pagos R$ 9,86 bilhões. 🏥Essa complementação vale de março a novembro. 🗳️O texto segue agora para o Senado!",pt,[],[],[],0,0,2,[],[],https://twitter.com/glaustindafokus/status/1285983284879675392,False,,0,,,,,,,,[],,,,
1285383932415016960,1285383932415016960,2020-07-20 22:19:45 -0300,2020-07-20,22:19:45,-300,133692726,glaustindafokus,Glaustin da Fokus,,"👍🏼Boa notícia para quem se vira para pagar as parcelas do programa Minha Casa Minha Vida em plena pandemia. 🏠Aprovamos agora à noite o projeto de lei que suspende por 180 dias as mensalidades para famílias com renda mensal de até R$ 1,8 mil. 🗳️O texto agora segue para o Senado!",pt,[],[],[],1,0,3,[],[],https://twitter.com/glaustindafokus/status/1285383932415016960,False,,0,,,,,,,,[],,,,
1281684479707406337,1281684479707406337,2020-07-10 17:19:27 -0300,2020-07-10,17:19:27,-300,133692726,glaustindafokus,Glaustin da Fokus,,"O nosso presidente @jairbolsonaro sancionou hoje o PL 1079/20 que suspende o pagamento de estudantes ao Fies em razão da calamidade pública causada pelo coronavírus. A medida já havia sido aprovada na Câmara no dia 18 de junho. Parabéns, Presidente, pela sensibilidade!",pt,"[{'screen_name': 'jairbolsonaro', 'name': 'jair m. bolsonaro', 'id': '128372940'}]",[],[],3,0,2,[],[],https://twitter.com/glaustindafokus/status/1281684479707406337,False,,0,,,,,,,,[],,,,
1280561600836112387,1280561600836112387,2020-07-07 14:57:31 -0300,2020-07-07,14:57:31,-300,133692726,glaustindafokus,Glaustin da Fokus,,"Estamos em oração para que o nosso Capitão @jairbolsonaro tenha uma rápida recuperação. O Presidente testou positivo para a covid-19, mas graças a Deus está bem e tenho certeza que em breve estará 100%. O Brasil e o nosso povo precisam de você! 🇧🇷",pt,"[{'screen_name': 'jairbolsonaro', 'name': 'jair m. bolsonaro', 'id': '128372940'}]",[],[],1,0,2,[],[],https://twitter.com/glaustindafokus/status/1280561600836112387,False,,0,,,,,,,,[],,,,
1278469515744067585,1278469515744067585,2020-07-01 20:24:20 -0300,2020-07-01,20:24:20,-300,133692726,glaustindafokus,Glaustin da Fokus,,"Apesar da minha posição contrária ao adiamento das eleições municipais, a @camaradeputados aprovou hoje a PEC 18/20 que altera o calendário eleitoral. Dessa forma, serão realizados nos dias 15 e 29 de novembro o primeiro e segundo turno. A PEC deve ser promulgada nesta quinta.",pt,"[{'screen_name': 'camaradeputados', 'name': 'câmara dos deputados', 'id': '61843152'}]",[],[],0,0,2,[],[],https://twitter.com/glaustindafokus/status/1278469515744067585,False,,0,,,,,,,,[],,,,
1278136837576568834,1278136835101859841,2020-06-30 22:22:23 -0300,2020-06-30,22:22:23,-300,133692726,glaustindafokus,Glaustin da Fokus,,A continuação desse benefício é essencial para as inúmeras famílias brasileiras que perderam renda por conta da pandemia. Seguimos lutando contra o coronavírus e contra desigualdade social implacavelmente agravada por essa crise.,pt,[],[],[],0,0,0,[],[],https://twitter.com/glaustindafokus/status/1278136837576568834,False,,0,,,,,,,,[],,,,
1278136835101859841,1278136835101859841,2020-06-30 22:22:22 -0300,2020-06-30,22:22:22,-300,133692726,glaustindafokus,Glaustin da Fokus,,"Fui convidado para a cerimônia de anúncio, hoje, da prorrogação do auxílio emergencial com o presidente @jairbolsonaro , ministros e os líderes do Congresso, @RodrigoMaia e @davialcolumbre .",pt,"[{'screen_name': 'jairbolsonaro', 'name': 'jair m. bolsonaro', 'id': '128372940'}, {'screen_name': 'rodrigomaia', 'name': 'rodrigo maia', 'id': '35260027'}, {'screen_name': 'davialcolumbre', 'name': 'davi alcolumbre', 'id': '2716763753'}]",[],[],1,0,1,[],[],https://twitter.com/glaustindafokus/status/1278136835101859841,False,,0,,,,,,,,[],,,,
