id,conversation_id,created_at,date,time,timezone,user_id,username,name,place,tweet,language,mentions,urls,photos,replies_count,retweets_count,likes_count,hashtags,cashtags,link,retweet,quote_url,video,thumbnail,near,geo,source,user_rt_id,user_rt,retweet_id,reply_to,retweet_date,translate,trans_src,trans_dest
1242093433990393858,1242093433990393858,2020-03-23 11:18:46 -0300,2020-03-23,11:18:46,-300,133692726,glaustindafokus,Glaustin da Fokus,,"O Estado de Goiás está conseguindo controlar a evolução do coronavírus, mas a situação ainda é preocupante. Nos próximos dias, o contágio vai se acelerar em todo o País. Por isso, é imprescindível tomarmos medidas de isolamento social e a mais importante delas é: fiquem em casa!  https://t.co/x6y0e5vHeT",pt,[],[],['https://pbs.twimg.com/media/ETzNY8KWsAAXvh7.jpg'],0,0,0,[],[],https://twitter.com/glaustindafokus/status/1242093433990393858,False,,1,https://pbs.twimg.com/media/ETzNY8KWsAAXvh7.jpg,,,,,,,[],,,,
1241784672436269056,1241784672436269056,2020-03-22 14:51:51 -0300,2020-03-22,14:51:51,-300,133692726,glaustindafokus,Glaustin da Fokus,,"Bombeiros e policiais estão nas ruas para limitar ao máximo o fluxo de pessoas. Essa medida do governador @ronaldocaiado é essencial para romper a propagação do coronavírus, pois ainda vemos gente sem a real percepção da gravidade da ameaça à nossa saúde. #GoiásContraCoronavírus  https://t.co/nAe74rQF4g",pt,"[{'screen_name': 'ronaldocaiado', 'name': 'ronaldo caiado', 'id': '32101740'}]",[],['https://pbs.twimg.com/media/ETu0knNXsAA1-iM.jpg'],1,0,0,['goiáscontracoronavírus'],[],https://twitter.com/glaustindafokus/status/1241784672436269056,False,,1,https://pbs.twimg.com/media/ETu0knNXsAA1-iM.jpg,,,,,,,[],,,,
1241052159669567489,1241052159669567489,2020-03-20 14:21:07 -0300,2020-03-20,14:21:07,-300,133692726,glaustindafokus,Glaustin da Fokus,,"Muito importante a decisão do Senado, que em sua primeira sessão remota,aprovaram o decreto de calamidade pública do coronavírus.Decisão flexibiliza uso do Orçamento e tira a obrigação do governo de contingenciar despesas.Parabéns a todos!O Brasil agradece  https://t.co/ULvMZm0LeA",pt,[],['http://encurtador.com.br/azFQ8'],[],0,0,0,[],[],https://twitter.com/glaustindafokus/status/1241052159669567489,False,,0,,,,,,,,[],,,,
1240741912082034688,1240741912082034688,2020-03-19 17:48:18 -0300,2020-03-19,17:48:18,-300,133692726,glaustindafokus,Glaustin da Fokus,,"O @pscnacional tem o propósito de fazer política para promover transformações. Em Aparecida de Goiânia, não é diferente. Temos ao nosso lado uma pessoa do bem, séria e preparada para assumir grandes responsabilidades. Seja muito bem-vindo ao PSC, Ozair!   https://t.co/adSI4WRuzF",pt,"[{'screen_name': 'pscnacional', 'name': 'psc', 'id': '243182504'}]",['http://encurtador.com.br/hlHPZ'],[],0,0,1,[],[],https://twitter.com/glaustindafokus/status/1240741912082034688,False,,0,,,,,,,,[],,,,
1240732045032202240,1240732045032202240,2020-03-19 17:09:05 -0300,2020-03-19,17:09:05,-300,133692726,glaustindafokus,Glaustin da Fokus,,"O @TSEjusbr definiu que a data limite para a filiação partidária será no dia 4 de abril. Na sexta, eu requeri um adiamento da data devido à pandemia do coronavírus.A medida seria fundamental para garantir a definição de melhores candidatos para as eleições  https://t.co/GCi8h0dzmq",pt,"[{'screen_name': 'tsejusbr', 'name': 'tse', 'id': '75270377'}]",['http://encurtador.com.br/abfi8'],[],0,0,0,[],[],https://twitter.com/glaustindafokus/status/1240732045032202240,False,,0,,,,,,,,[],,,,
1240731259246202880,1240731259246202880,2020-03-19 17:05:58 -0300,2020-03-19,17:05:58,-300,133692726,glaustindafokus,Glaustin da Fokus,,"@TSEjusbr definiu que a data limite para a filiação partidária será no dia 4 de abril. Na sexta, eu requeri um adiamento da data devido à pandemia do coronavírus. A medida seria fundamental para garantir a definição de melhores candidatos para as eleições.  https://t.co/GCi8h0dzmq",pt,[],['http://encurtador.com.br/abfi8'],[],0,0,0,[],[],https://twitter.com/glaustindafokus/status/1240731259246202880,False,,0,,,,,,,,[],,,,
1240607430838452225,1240607430838452225,2020-03-19 08:53:55 -0300,2020-03-19,08:53:55,-300,133692726,glaustindafokus,Glaustin da Fokus,,"Bem-vindo ao PSC-GO, Ozair José! @jornal_opopular  https://t.co/gxvHJfmdir",pt,"[{'screen_name': 'jornal_opopular', 'name': 'o popular', 'id': '54527239'}]",[],['https://pbs.twimg.com/media/ETeF4K4XsAAYJKi.jpg'],0,0,1,[],[],https://twitter.com/glaustindafokus/status/1240607430838452225,False,,1,https://pbs.twimg.com/media/ETeF4K4XsAAYJKi.jpg,,,,,,,[],,,,
1239697792140021761,1239697792140021761,2020-03-16 20:39:20 -0300,2020-03-16,20:39:20,-300,133692726,glaustindafokus,Glaustin da Fokus,,"Vamos cumprir à risca o que as autoridades determinam! É hora de autoproteção e respeito ao próximo, principalmente aos mais vulneráveis ao vírus. Evite aglomerações. Distanciamento social agora é gesto de cuidado e amor! #GoiasContraCoronavirus",pt,[],[],[],0,0,0,['goiascontracoronavirus'],[],https://twitter.com/glaustindafokus/status/1239697792140021761,False,,0,,,,,,,,[],,,,
1239697576607219718,1239697576607219718,2020-03-16 20:38:29 -0300,2020-03-16,20:38:29,-300,133692726,glaustindafokus,Glaustin da Fokus,,"Apesar do registo de novos casos do coronavírus em Goiás, não é momento de pânico, e sim de cautela. Sabemos o quanto o nosso povo é carinhoso, mas devemos estar atentos às medidas para que possamos reduzir a contaminação e o crescimento exponencial de pessoas infectadas.",pt,[],[],[],0,0,0,[],[],https://twitter.com/glaustindafokus/status/1239697576607219718,False,,0,,,,,,,,[],,,,
1239367898088517632,1239367898088517632,2020-03-15 22:48:27 -0300,2020-03-15,22:48:27,-300,133692726,glaustindafokus,Glaustin da Fokus,,"Goiás tem um governador sério, responsável, que respeita a vida e os goianos, acima de tudo. O @ronaldocaiado tem agido com muita firmeza no combate ao coronavírus e hoje não foi diferente. Uma atitude estadista e humana para proteger a população. Tem o nosso total apoio!",pt,"[{'screen_name': 'ronaldocaiado', 'name': 'ronaldo caiado', 'id': '32101740'}]",[],[],1,4,8,[],[],https://twitter.com/glaustindafokus/status/1239367898088517632,False,,0,,,,,,,,[],,,,
1239367476711956481,1239367476711956481,2020-03-15 22:46:47 -0300,2020-03-15,22:46:47,-300,133692726,glaustindafokus,Glaustin da Fokus,,"Parabéns pelo gesto responsável e sensato, governador @ronaldocaiado!",pt,"[{'screen_name': 'ronaldocaiado', 'name': 'ronaldo caiado', 'id': '32101740'}]",[],[],0,0,2,[],[],https://twitter.com/glaustindafokus/status/1239367476711956481,False,https://twitter.com/ronaldocaiado/status/1239314078058909698,0,,,,,,,,[],,,,
1238542544050552838,1238542544050552838,2020-03-13 16:08:48 -0300,2020-03-13,16:08:48,-300,133692726,glaustindafokus,Glaustin da Fokus,,"A indústria goiana já reage ao comprometimento do governador @ronaldocaiado em reconstruir nosso estado. 🏭Em janeiro de 2020, o setor cresceu 2,5%, segundo o IBGE. 📈Estamos em 4º lugar no ranking nacional, à frente de Minas, Rio Grande do Sul e São Paulo. 🇧🇷 #SomosTodosGoiás",pt,"[{'screen_name': 'ronaldocaiado', 'name': 'ronaldo caiado', 'id': '32101740'}]",[],[],0,0,3,['somostodosgoiás'],[],https://twitter.com/glaustindafokus/status/1238542544050552838,False,,0,,,,,,,,[],,,,
1237740437139599360,1237740437139599360,2020-03-11 11:01:30 -0300,2020-03-11,11:01:30,-300,133692726,glaustindafokus,Glaustin da Fokus,,"Participo agora da 1ª audiência da Comissão Mista da Reforma Tributária, onde ouvimos a especialista portuguesa @delaFeriaR. Professora e pesquisadora na Inglaterra, ela já orientou os governos de Angola, Portugal, São Tomé e Príncipe, Timor-Leste e Turquia. #ReformaTributáriaJá",pt,"[{'screen_name': 'delaferiar', 'name': 'rita de la feria', 'id': '1267959955'}]",[],[],5,0,3,['reformatributáriajá'],[],https://twitter.com/glaustindafokus/status/1237740437139599360,False,,0,,,,,,,,[],,,,
1237455519000023047,1237455519000023047,2020-03-10 16:09:21 -0300,2020-03-10,16:09:21,-300,133692726,glaustindafokus,Glaustin da Fokus,,"Em entrevista ao jornalista Caio Henrique Salgado do @jornal_opopular , fiz questão de reforçar que estou à disposição do nosso governador @ronaldocaiado para trabalhar por um projeto para Aparecida de Goiânia em prol da união da base. Confira:  https://t.co/6CGnmfHZ2P",pt,"[{'screen_name': 'jornal_opopular', 'name': 'o popular', 'id': '54527239'}, {'screen_name': 'ronaldocaiado', 'name': 'ronaldo caiado', 'id': '32101740'}]",[],['https://pbs.twimg.com/media/ESxTOyvXYAEueZ8.jpg'],0,0,1,[],[],https://twitter.com/glaustindafokus/status/1237455519000023047,False,,1,https://pbs.twimg.com/media/ESxTOyvXYAEueZ8.jpg,,,,,,,[],,,,
1237121964134871043,1237121964134871043,2020-03-09 18:03:55 -0300,2020-03-09,18:03:55,-300,133692726,glaustindafokus,Glaustin da Fokus,,"Tem time goiano bicampeão do Torneio @SouSesi de Robótica! 🏆🏆 O projeto inovador do Geartech Canaã ganhou o prêmio Inspiração e garantiu vaga no próximo campeonato mundial, em Houston, nos EUA, em abril. 🤖🇧🇷Muito orgulho dos nossos jovens!  https://t.co/9S0vunbifI #SESIRobótica",pt,"[{'screen_name': 'sousesi', 'name': 'sou sesi', 'id': '1067117044527702017'}]",['http://bit.ly/2wKxRas'],[],1,0,1,['sesirobótica'],[],https://twitter.com/glaustindafokus/status/1237121964134871043,False,,0,,,,,,,,[],,,,
1235991891642068997,1235991891642068997,2020-03-06 15:13:25 -0300,2020-03-06,15:13:25,-300,133692726,glaustindafokus,Glaustin da Fokus,,"Estou na torcida pelos estudantes goianos no Festival @SouSESI de Robótica, em SP. Eles desenvolveram projetos inovadores para tornar nossas cidades mais inteligentes, conquistaram vaga na etapa nacional e vão lutar para classificar às competições internacionais. #SESIRobótica  https://t.co/PFbUkEoNb2",pt,"[{'screen_name': 'sousesi', 'name': 'sou sesi', 'id': '1067117044527702017'}]",[],['https://pbs.twimg.com/media/EScgEgTXkAAYvmO.jpg'],1,0,2,['sesirobótica'],[],https://twitter.com/glaustindafokus/status/1235991891642068997,False,,1,https://pbs.twimg.com/media/EScgEgTXkAAYvmO.jpg,,,,,,,[],,,,
1235355593080279043,1235355593080279043,2020-03-04 21:04:59 -0300,2020-03-04,21:04:59,-300,133692726,glaustindafokus,Glaustin da Fokus,,Hoje votei ‘sim’ para a manutenção do veto 52. Minha posição segue firme ao lado do presidente @jairbolsonaro e da capacidade administrativa do governo federal.  https://t.co/WwqkvMDVMl,pt,"[{'screen_name': 'jairbolsonaro', 'name': 'jair m. bolsonaro', 'id': '128372940'}]",[],['https://pbs.twimg.com/media/ESTdXDZXsAIXE3d.jpg'],1,1,3,[],[],https://twitter.com/glaustindafokus/status/1235355593080279043,False,,1,https://pbs.twimg.com/media/ESTdXDZXsAIXE3d.jpg,,,,,,,[],,,,
1234510629807022082,1234510629807022082,2020-03-02 13:07:24 -0300,2020-03-02,13:07:24,-300,133692726,glaustindafokus,Glaustin da Fokus,,"A sessão do Congresso está marcada para terça-feira, mas já antecipo meu voto a favor do veto 52 do presidente @jairbolsonaro ao projeto que inclui o chamado orçamento impositivo na Lei de Diretrizes Orçamentárias. Precisamos de responsabilidade com a gestão pública. 🗳️#Veto52Sim",pt,"[{'screen_name': 'jairbolsonaro', 'name': 'jair m. bolsonaro', 'id': '128372940'}]",[],[],4,0,8,['veto52sim'],[],https://twitter.com/glaustindafokus/status/1234510629807022082,False,,0,,,,,,,,[],,,,
1231766105640837121,1231766105640837121,2020-02-23 23:21:39 -0300,2020-02-23,23:21:39,-300,133692726,glaustindafokus,Glaustin da Fokus,,"O domingo de Carnaval foi de reencontro familiar para as 58 pessoas que estavam em quarentena em Anápolis, depois de 14 dias. Essa operação entra para a história graças à coragem do povo goiano, do governador @ronaldocaiado, ministro @lhmandetta e presidente @jairbolsonaro! 🇧🇷",pt,"[{'screen_name': 'ronaldocaiado', 'name': 'ronaldo caiado', 'id': '32101740'}, {'screen_name': 'jairbolsonaro', 'name': 'jair m. bolsonaro', 'id': '128372940'}]",[],[],1,0,1,[],[],https://twitter.com/glaustindafokus/status/1231766105640837121,False,,0,,,,,,,,[],,,,
1230944677014179846,1230944677014179846,2020-02-21 16:57:35 -0300,2020-02-21,16:57:35,-300,133692726,glaustindafokus,Glaustin da Fokus,,Hoje falei sobre a expectativa da Reforma Tributária em entrevista ao jornalista Caio Henrique Salgado do @jornal_opopular . Leia:  https://t.co/7ipFYywUEn,pt,"[{'screen_name': 'jornal_opopular', 'name': 'o popular', 'id': '54527239'}]",[],['https://pbs.twimg.com/media/ERUxp9CWsAMojCX.jpg'],0,0,0,[],[],https://twitter.com/glaustindafokus/status/1230944677014179846,False,,1,https://pbs.twimg.com/media/ERUxp9CWsAMojCX.jpg,,,,,,,[],,,,
1230558088639303686,1230558088639303686,2020-02-20 15:21:25 -0300,2020-02-20,15:21:25,-300,133692726,glaustindafokus,Glaustin da Fokus,,"Já são 6 meses seguidos de alta no Índice de Confiança do Empresário do Comércio, apurado pelo @SistemaCNC. Segundo a pesquisa, 61,9% dos empreendedores consideram a economia atual melhor do que há 12 meses. É o maior nº em 7 anos! A recuperação é gradual, mas vem com firmeza! 🇧🇷",pt,"[{'screen_name': 'sistemacnc', 'name': 'sistemacnc', 'id': '264438617'}]",[],[],0,0,0,[],[],https://twitter.com/glaustindafokus/status/1230558088639303686,False,,0,,,,,,,,[],,,,
1230476961329352705,1230476961329352705,2020-02-20 09:59:03 -0300,2020-02-20,09:59:03,-300,133692726,glaustindafokus,Glaustin da Fokus,,É uma grande responsabilidade compor a Comissão Mista da Reforma Tributária junto com o meu amigo senador @_luizdocarmo representando Goiás.Vamos trabalhar com muita garra para que o texto ajude a impulsionar o nosso Estado e garantir que o Brasil volte a crescer e gerar empregos  https://t.co/60xu36FUU7,pt,"[{'screen_name': '_luizdocarmo', 'name': 'luiz do carmo senador', 'id': '173834511'}]",[],['https://pbs.twimg.com/media/EROIRW2XkAIGVOS.jpg'],1,1,6,[],[],https://twitter.com/glaustindafokus/status/1230476961329352705,False,,1,https://pbs.twimg.com/media/EROIRW2XkAIGVOS.jpg,,,,,,,[],,,,
1230257889052446721,1230257889052446721,2020-02-19 19:28:32 -0300,2020-02-19,19:28:32,-300,133692726,glaustindafokus,Glaustin da Fokus,,"Temos agora uma grande oportunidade de elaborar um texto de consenso a partir das propostas que tramitam no Congresso, mudar diretamente a vida de cada brasileiro e fazer prosperar a nossa Nação. Estou confiante que agora vai dar certo!",pt,[],[],[],0,0,1,[],[],https://twitter.com/glaustindafokus/status/1230257889052446721,False,,0,,,,,,,,[],,,,
1230257790620491776,1230257790620491776,2020-02-19 19:28:09 -0300,2020-02-19,19:28:09,-300,133692726,glaustindafokus,Glaustin da Fokus,,Hoje foi instalada a Comissão Mista da Reforma Tributária. Sou o único deputado goiano entre os 25 representantes da Câmara a integrar o colegiado. Sempre defendi que a tributária era a reforma mais relevante para retomar investimentos e a confiança do mercado e gerar empregos.,pt,[],[],[],0,0,5,[],[],https://twitter.com/glaustindafokus/status/1230257790620491776,False,,0,,,,,,,,[],,,,
1229884710110801922,1229884710110801922,2020-02-18 18:45:39 -0300,2020-02-18,18:45:39,-300,133692726,glaustindafokus,Glaustin da Fokus,,"O time de ministros de @jairbolsonaro ganhou o reforço do general Braga Netto, agora na chefia da @casacivilbr. 🇧🇷 Já @onyxlorenzoni assumiu o @mincidadania e suas políticas sociais. Enquanto isso, recebemos um colega de respeito, @osmarterra, de volta a seu mandato de deputado.  https://t.co/wGgS5txrzl",pt,"[{'screen_name': 'jairbolsonaro', 'name': 'jair m. bolsonaro', 'id': '128372940'}, {'screen_name': 'casacivilbr', 'name': 'casa civil', 'id': '1623608509'}, {'screen_name': 'onyxlorenzoni', 'name': 'onyx lorenzoni 🇧🇷', 'id': '43041690'}, {'screen_name': 'mincidadania', 'name': 'ministério da cidadania', 'id': '281572031'}, {'screen_name': 'osmarterra', 'name': 'osmar terra', 'id': '52722451'}]",[],['https://pbs.twimg.com/media/ERFtny3WkAgRVoz.jpg'],0,0,1,[],[],https://twitter.com/glaustindafokus/status/1229884710110801922,False,,1,https://pbs.twimg.com/media/ERFtny3WkAgRVoz.jpg,,,,,,,[],,,,
1227387862804582401,1227387862804582401,2020-02-11 21:24:04 -0300,2020-02-11,21:24:04,-300,133692726,glaustindafokus,Glaustin da Fokus,,Boa notícia para o produtor rural! A @camaradeputados aprovou o texto-base da MP 897 que apoia a modernização do agronegócio e facilita o acesso a empréstimos para financiar investimentos.Amanhã continuaremos a votação dos destaques e teremos sessão conjunta do Congresso Nacional,pt,"[{'screen_name': 'camaradeputados', 'name': 'câmara dos deputados', 'id': '61843152'}]",[],[],2,0,2,[],[],https://twitter.com/glaustindafokus/status/1227387862804582401,False,,0,,,,,,,,[],,,,
1226516432562900992,1226516432562900992,2020-02-09 11:41:19 -0300,2020-02-09,11:41:19,-300,133692726,glaustindafokus,Glaustin da Fokus,,"Este domingo marca o início da quarentena de 18 dias para os 34 brasileiros resgatados na China. Eles vão levar na memória e no coração o tempo vivido em Anápolis. Goiás tem a vocação de ser uma terra acolhedora! 🤍🙏🏽 Nossas orações estão com os pacientes, médicos e tripulantes.",pt,[],[],[],0,0,2,[],[],https://twitter.com/glaustindafokus/status/1226516432562900992,False,,0,,,,,,,,[],,,,
1225522794093522958,1225522791367225352,2020-02-06 17:52:57 -0300,2020-02-06,17:52:57,-300,133692726,glaustindafokus,Glaustin da Fokus,,"🤜🏻🤛🏻 Tenho certeza de que, com esse propósito, iremos trabalhar muito para fortalecer e ampliar o @pscnacional nos municípios de Goiás e em todo o Brasil. 💪🏻 Este ano é 20-20! #vemser20 #2020 #oanodo20 #glaustinfokus #deputadofederal 🇧🇷",pt,"[{'screen_name': 'pscnacional', 'name': 'psc', 'id': '243182504'}]",[],[],0,0,0,"['vemser20', 'oanodo20', 'glaustinfokus', 'deputadofederal']",[],https://twitter.com/glaustindafokus/status/1225522794093522958,False,,0,,,,,,,,[],,,,
1225522791367225352,1225522791367225352,2020-02-06 17:52:57 -0300,2020-02-06,17:52:57,-300,133692726,glaustindafokus,Glaustin da Fokus,,Tenho orgulho de integrar um partido que tem como diretriz fazer o que Jesus nos ensinou: servir a quem mais precisa. 💚 O @pscnacional tem potencial para transformar a sociedade. 🤝 Reforçamos esse sentimento hoje com lideranças de todo o País em reunião da executiva nacional.  https://t.co/Ru4y2MsShX,pt,"[{'screen_name': 'pscnacional', 'name': 'psc', 'id': '243182504'}]",[],['https://pbs.twimg.com/media/EQHueSzWoAIxR9y.jpg'],1,0,0,[],[],https://twitter.com/glaustindafokus/status/1225522791367225352,False,,1,https://pbs.twimg.com/media/EQHueSzWoAIxR9y.jpg,,,,,,,[],,,,
1225030865341820928,1225030865341820928,2020-02-05 09:18:12 -0300,2020-02-05,09:18:12,-300,133692726,glaustindafokus,Glaustin da Fokus,,"Jesus nos ensinou a estender a mão àqueles que precisam. 🇧🇷 Como um país cristão, nada mais humano que buscar os brasileiros que estão em Wuhan, na China, para uma quarentena em território nacional, distante do epicentro do coronavírus. 🙏🏽 É um momento histórico para Anápolis.",pt,[],[],[],0,0,1,[],[],https://twitter.com/glaustindafokus/status/1225030865341820928,False,,0,,,,,,,,[],,,,
1223800527189893121,1223800524866191360,2020-02-01 23:49:17 -0300,2020-02-01,23:49:17,-300,133692726,glaustindafokus,Glaustin da Fokus,,"Em atuação integrada com o governo federal e as PMs da Bahia e do DF, o serviço de inteligência da Polícia Militar goiana foi decisivo para prender em Salvador um dos criminosos mais procurados do país, apelidado como Pintado e foragido há 12 anos. 👮🏽‍♀️Goiás e o Brasil já mudaram!",pt,[],[],[],0,0,1,[],[],https://twitter.com/glaustindafokus/status/1223800527189893121,False,,0,,,,,,,,[],,,,
1223800524866191360,1223800524866191360,2020-02-01 23:49:16 -0300,2020-02-01,23:49:16,-300,133692726,glaustindafokus,Glaustin da Fokus,,"A Polícia Militar de Goiás ganhou destaque nacional neste sábado! 🚨Parabéns pela transformação na segurança pública, governador @ronaldocaiado! 🇧🇷O trabalho da corporação goiana foi reconhecido nada mais nada menos do que pelo ministro @SF_Moro e pelo presidente @jairbolsonaro!",pt,"[{'screen_name': 'ronaldocaiado', 'name': 'ronaldo caiado', 'id': '32101740'}, {'screen_name': 'sf_moro', 'name': 'sergio moro', 'id': '1113094855281008641'}, {'screen_name': 'jairbolsonaro', 'name': 'jair m. bolsonaro', 'id': '128372940'}]",[],[],1,0,4,[],[],https://twitter.com/glaustindafokus/status/1223800524866191360,False,https://twitter.com/SF_Moro/status/1223694556421656576,0,,,,,,,,[],,,,
1223367509262422016,1223367509262422016,2020-01-31 19:08:37 -0300,2020-01-31,19:08:37,-300,133692726,glaustindafokus,Glaustin da Fokus,,"São muitos os desafios, mas estamos caminhando no rumo certo: um Brasil forte, competitivo, sem desigualdades e com qualidade de vida para as pessoas.",pt,[],[],[],0,0,0,[],[],https://twitter.com/glaustindafokus/status/1223367509262422016,False,,0,,,,,,,,[],,,,
1223367224217538561,1223367224217538561,2020-01-31 19:07:29 -0300,2020-01-31,19:07:29,-300,133692726,glaustindafokus,Glaustin da Fokus,,"Cresceu o número de trabalhadores que viram na dificuldade uma oportunidade para empreender: 24,2 milhões, o maior nível da série.A informalidade atingiu 41,1% da força de trabalho em 2019, um número que reforça o que sempre digo:temos que facilitar a vida de quem quer empreender",pt,[],[],[],0,0,3,[],[],https://twitter.com/glaustindafokus/status/1223367224217538561,False,,0,,,,,,,,[],,,,
1223365306963374080,1223365306963374080,2020-01-31 18:59:52 -0300,2020-01-31,18:59:52,-300,133692726,glaustindafokus,Glaustin da Fokus,,"Melhor resultado em 3 anos no Brasil! A taxa média de desemprego no País caiu de 12,7% em 2017 e 12,3% em 2018 para 11,9% em 2019. Ainda temos 11,6 milhões de brasileiros fora do mercado, mas dados do @ibgeoficial sinalizam que há um movimento de retomada da atividade econômica.",pt,"[{'screen_name': 'ibgeoficial', 'name': 'ibge', 'id': '2222156131'}]",[],[],0,0,0,[],[],https://twitter.com/glaustindafokus/status/1223365306963374080,False,,0,,,,,,,,[],,,,
1222884161565986818,1222884160039157761,2020-01-30 11:07:58 -0300,2020-01-30,11:07:58,-300,133692726,glaustindafokus,Glaustin da Fokus,,"A reforma tributária é um passo fundamental para retomar o crescimento econômico, gerar equilíbrio fiscal e combater a desigualdade social. 🗳 Como empreendedor e deputado, tenho fé nesse poder transformador, agora com a força do presidente @jairbolsonaro e do Congresso Nacional.",pt,"[{'screen_name': 'jairbolsonaro', 'name': 'jair m. bolsonaro', 'id': '128372940'}]",[],[],0,0,0,[],[],https://twitter.com/glaustindafokus/status/1222884161565986818,False,,0,,,,,,,,[],,,,
1222884160039157761,1222884160039157761,2020-01-30 11:07:58 -0300,2020-01-30,11:07:58,-300,133692726,glaustindafokus,Glaustin da Fokus,,"Chegou a hora de enfrentar a reforma tributária! Tudo indica que essa tão esperada revisão finalmente sairá, neste semestre. Como voltaremos às atividades em Brasília na semana que vem, publiquei artigo no @jornal_opopular para aquecer o debate. 📰Leia:  https://t.co/dr5Mvn4TKn.",pt,"[{'screen_name': 'jornal_opopular', 'name': 'o popular', 'id': '54527239'}]",['https://bit.ly/2vutwY1'],[],1,0,1,[],[],https://twitter.com/glaustindafokus/status/1222884160039157761,False,,0,,,,,,,,[],,,,
1221888479954644994,1221888479954644994,2020-01-27 17:11:29 -0300,2020-01-27,17:11:29,-300,133692726,glaustindafokus,Glaustin da Fokus,,"Parabéns aos nossos policiais e à postura firme do nosso governador @ronaldocaiado no combate ao crime. A meta agora é fazer de Goiás o estado mais seguro, no Brasil, para se viver. #somostodosgoias",pt,"[{'screen_name': 'ronaldocaiado', 'name': 'ronaldo caiado', 'id': '32101740'}]",[],[],0,0,0,['somostodosgoias'],[],https://twitter.com/glaustindafokus/status/1221888479954644994,False,,0,,,,,,,,[],,,,
1221888314330009602,1221888314330009602,2020-01-27 17:10:50 -0300,2020-01-27,17:10:50,-300,133692726,glaustindafokus,Glaustin da Fokus,,"Os casos de roubos também apresentaram quedas expressivas, bem como o número abordagens, prisão em flagrante e apreensão. Esse resultado é decorrente de um trabalho intenso e decisivo da nossa polícia goiana.",pt,[],[],[],0,0,1,[],[],https://twitter.com/glaustindafokus/status/1221888314330009602,False,,0,,,,,,,,[],,,,
1221888145987375106,1221888145987375106,2020-01-27 17:10:10 -0300,2020-01-27,17:10:10,-300,133692726,glaustindafokus,Glaustin da Fokus,,"Em Goiás, ou o bandido muda de profissão ou muda de estado. Indicadores de criminalidade apontam que estamos mais seguros na gestão do nosso governador @ronaldocaiado . Juntos, os crimes letais, como homicídio e roubo seguidos de morte, caíram 23%.",pt,"[{'screen_name': 'ronaldocaiado', 'name': 'ronaldo caiado', 'id': '32101740'}]",[],[],0,0,0,[],[],https://twitter.com/glaustindafokus/status/1221888145987375106,False,,0,,,,,,,,[],,,,
1220780040830509060,1220780040830509060,2020-01-24 15:46:57 -0300,2020-01-24,15:46:57,-300,133692726,glaustindafokus,Glaustin da Fokus,,"Notícia boa! Brasil criou 644.079 vagas formais em 2019, melhor resultado em 6 anos. Os dados do Caged apontam que essas oportunidades foram criadas devido ao crescimento da atividade econômica de 8 setores no último ano.A meta agora é avançar e gerar mais empregos em todo o País",pt,[],[],[],1,0,1,[],[],https://twitter.com/glaustindafokus/status/1220780040830509060,False,,0,,,,,,,,[],,,,
