id,conversation_id,created_at,date,time,timezone,user_id,username,name,place,tweet,language,mentions,urls,photos,replies_count,retweets_count,likes_count,hashtags,cashtags,link,retweet,quote_url,video,thumbnail,near,geo,source,user_rt_id,user_rt,retweet_id,reply_to,retweet_date,translate,trans_src,trans_dest
1521986590704386049,1521986590704386049,2022-05-04 19:54:15 -0300,2022-05-04,19:54:15,-300,133692726,glaustindafokus,Glaustin da Fokus,,"Vitória do povo de Deus! ✅A @camaradeputados  aprovou hoje o requerimento de urgência para o PL 4606/19, que proíbe qualquer alteração, edição, supressão, adição ou adaptação aos textos dos livros da Bíblia. 🗳️A proposta pode ser votada nas próximas sessões. 🙏Eita Glória!",pt,"[{'screen_name': 'camaradeputados', 'name': 'câmara dos deputados', 'id': '61843152'}]",[],[],2,1,5,[],[],https://twitter.com/glaustindafokus/status/1521986590704386049,False,,0,,,,,,,,[],,,,
1512076548693639184,1512076548693639184,2022-04-07 11:35:16 -0300,2022-04-07,11:35:16,-300,133692726,glaustindafokus,Glaustin da Fokus,,"O Projeto de Lei 2630/2020, também conhecido com o PL das Fake News,pode ter um efeito terrível sobre a liberdade de expressão,além de abrir margem para vigilância ostensiva na internet. Sou contra esse absurdo. Por isso, votei “não” ao requerimento de urgência ao PL. #CensuraNao",pt,[],[],[],1,0,2,['censuranao'],[],https://twitter.com/glaustindafokus/status/1512076548693639184,False,,0,,,,,,,,[],,,,
1503777954463109125,1503777954463109125,2022-03-15 13:59:37 -0300,2022-03-15,13:59:37,-300,133692726,glaustindafokus,Glaustin da Fokus,,"Precisamos proteger e zelar das nossas crianças e adolescentes. P3d0fili4 não é piada, é crime! Não podemos tolerar a “normalização” dessa grave violência que deixa duras marcas em nossa sociedade.",pt,[],[],[],4,0,2,[],[],https://twitter.com/glaustindafokus/status/1503777954463109125,False,https://twitter.com/g1/status/1503768893780905986,0,,,,,,,,[],,,,
1503197989594148868,1503197989594148868,2022-03-13 23:35:03 -0300,2022-03-13,23:35:03,-300,133692726,glaustindafokus,Glaustin da Fokus,,"Pais e mães, fiquem atentos ao que os seus filhos assistem. Esse filme é uma agressão às nossas crianças. Que possamos ser vigilantes e continuar lutando pela proteção das nossas famílias e contra esse tipo de desrespeito. @NetflixBrasil",pt,"[{'screen_name': 'netflixbrasil', 'name': 'netflixbrasil🍂', 'id': '231579149'}]",[],[],3,22,58,[],[],https://twitter.com/glaustindafokus/status/1503197989594148868,False,,0,,,,,,,,[],,,,
1503193356880564224,1503193356880564224,2022-03-13 23:16:38 -0300,2022-03-13,23:16:38,-300,133692726,glaustindafokus,Glaustin da Fokus,,"Assisti com indignação e repúdio ao trecho do filme ""Como ser o pior aluno da escola"", disponível na @NetflixBrasil. É inadmissível que conteúdos dessa natureza, com apologia à p3d0fili4, sejam normalizados. Isso não é engraçado. Isso é um crime, um absurdo.",pt,"[{'screen_name': 'netflixbrasil', 'name': 'netflixbrasil🍂', 'id': '231579149'}]",[],[],2,0,4,[],[],https://twitter.com/glaustindafokus/status/1503193356880564224,False,,0,,,,,,,,[],,,,
1502043408189337602,1502043408189337602,2022-03-10 19:07:09 -0300,2022-03-10,19:07:09,-300,133692726,glaustindafokus,Glaustin da Fokus,,"Vitória dos micro e pequenos empresários! 🗳Derrubamos no Congresso Nacional o veto ao Relp, novo programa de renegociação de dívidas. ✅Muitos empreendedores temiam ser excluídos do Simples e, assim, ficarem sem condições de pagar dívidas com o governo! 👏🏽Parabéns, @frentefcs!",pt,"[{'screen_name': 'frentefcs', 'name': 'frente parlamentar do comércio e serviços', 'id': '1153298199836278785'}]",[],[],0,0,0,[],[],https://twitter.com/glaustindafokus/status/1502043408189337602,False,,0,,,,,,,,[],,,,
1499128803997765633,1499128801523122189,2022-03-02 18:05:33 -0300,2022-03-02,18:05:33,-300,133692726,glaustindafokus,Glaustin da Fokus,,"Que possam dialogar pela pacificação rumo ao cessar-fogo e deixar para trás o cenário de dor, sofrimento e destruição. Oremos pela paz e que Deus proteja os povos ucranianos e russos.",pt,[],[],[],1,0,3,[],[],https://twitter.com/glaustindafokus/status/1499128803997765633,False,,0,,,,,,,,[],,,,
1499128801523122189,1499128801523122189,2022-03-02 18:05:33 -0300,2022-03-02,18:05:33,-300,133692726,glaustindafokus,Glaustin da Fokus,,"Com o voto do Brasil, a ONU aprovou a resolução condenando a Rússia pelos ataques contra a Ucrânia. Uma guerra não representa apenas uma agressão diplomática, mas também vidas interrompidas e uma mancha na história de muitas gerações.",pt,[],[],[],3,0,4,[],[],https://twitter.com/glaustindafokus/status/1499128801523122189,False,,0,,,,,,,,[],,,,
1496859938076991499,1496859938076991499,2022-02-24 11:49:54 -0300,2022-02-24,11:49:54,-300,133692726,glaustindafokus,Glaustin da Fokus,,"O mundo vive um momento sombrio com a invasão da Ucrânia pela Rússia. Como cristão e pai, penso nas famílias que ouviram o estrondo de mísseis na madrugada de Kiev e tiveram que sair em busca de abrigo contra os ataques, para então fugir da guerra e da morte. 🇺🇦🇷🇺Oremos pela PAZ!",pt,[],[],[],0,0,1,[],[],https://twitter.com/glaustindafokus/status/1496859938076991499,False,,0,,,,,,,,[],,,,
1493576189721591809,1493576189721591809,2022-02-15 10:21:27 -0300,2022-02-15,10:21:27,-300,133692726,glaustindafokus,Glaustin da Fokus,,O Brasil perdeu hoje um grande jornalista e cineasta. Minha solidariedade à família e aos amigos de @ArnaldoJaborCBN . Que Deus possa levar paz e consolo ao coração de todos. O seu brilhante legado será lembrado por gerações. Vá em Paz!,pt,"[{'screen_name': 'arnaldojaborcbn', 'name': 'arnaldo jabor', 'id': '629431385'}]",[],[],1,0,1,[],[],https://twitter.com/glaustindafokus/status/1493576189721591809,False,https://twitter.com/Estadao/status/1493563769250881550,0,,,,,,,,[],,,,
1476303724872183826,1476303724872183826,2021-12-29 18:26:51 -0300,2021-12-29,18:26:51,-300,133692726,glaustindafokus,Glaustin da Fokus,,"Quantas perdas para a cultura goiana em 2021! Hoje lamentamos a despedida precoce do cantor @mauriliodelmont, da dupla @luizaemaurilio_. Maranhense de nascença, ele morava em Goiânia, berço da música sertaneja, e sempre era visto pelas ruas. Que Deus conforte amigos e familiares!",pt,"[{'screen_name': 'mauriliodelmont', 'name': 'maurilindo ✌🏼🔥', 'id': '63337260'}, {'screen_name': 'luizaemaurilio_', 'name': 'para em mim de novo!', 'id': '810843961526992896'}]",[],[],0,0,1,[],[],https://twitter.com/glaustindafokus/status/1476303724872183826,False,,0,,,,,,,,[],,,,
1458818989199663111,1458818989199663111,2021-11-11 12:28:45 -0300,2021-11-11,12:28:45,-300,133692726,glaustindafokus,Glaustin da Fokus,,"Semana triste para Goiás. 😢Perdemos @cristilobo, goiana que se tornou uma grande figura do jornalismo político brasileiro. O País inteiro vai sentir saudades da sua firmeza e do seu sorriso. 🖤Minha solidariedade à família, aos amigos e aos colegas. 🙏🏽Que Deus conforte a todos!",pt,"[{'screen_name': 'cristilobo', 'name': 'cristiana lôbo', 'id': '46463401'}]",[],[],16,0,2,[],[],https://twitter.com/glaustindafokus/status/1458818989199663111,False,,0,,,,,,,,[],,,,
1458014726848499714,1458014715792211974,2021-11-09 07:12:54 -0300,2021-11-09,07:12:54,-300,133692726,glaustindafokus,Glaustin da Fokus,,"Iris foi governador, prefeito de Goiânia, vereador, deputado estadual, senador e ministro.   Obrigado, meu amigo, pelo exemplo de simplicidade, determinação e força!  Vá em paz, nosso grande e eterno Iris Rezende! 🙏🏻🖤😭  https://t.co/LtkPe5ZQj9",pt,[],[],['https://pbs.twimg.com/media/FDvoqZTWUAE1iiS.jpg'],1,0,0,[],[],https://twitter.com/glaustindafokus/status/1458014726848499714,False,,1,https://pbs.twimg.com/media/FDvoqZTWUAE1iiS.jpg,,,,,,,[],,,,
1458014715792211974,1458014715792211974,2021-11-09 07:12:51 -0300,2021-11-09,07:12:51,-300,133692726,glaustindafokus,Glaustin da Fokus,,"Goiás hoje chora muito a perda de um dos nossos maiores estadistas. Iris Rezende fez tanto pelo nosso Estado que a história o honrará para sempre.   Aos 87 anos, hoje ele partiu, mas o seu legado será vivo e pujante como foi o seu trabalho de décadas.",pt,[],[],[],3,1,1,[],[],https://twitter.com/glaustindafokus/status/1458014715792211974,False,,0,,,,,,,,[],,,,
1456734203270340612,1456734203270340612,2021-11-05 18:24:33 -0300,2021-11-05,18:24:33,-300,133692726,glaustindafokus,Glaustin da Fokus,,"Meus sentimentos aos familiares da @MariliaMReal e de todas as vítimas que estavam no avião, aos amigos e aos fãs da cantora. O mundo sertanejo e o Brasil estão de luto e em silêncio com a perda de uma das vozes mais potentes que já conhecemos. Que Deus conforte a todos.  https://t.co/k42g177KQ5",pt,"[{'screen_name': 'mariliamreal', 'name': 'maria mendonça', 'id': '2921763658'}]",[],['https://pbs.twimg.com/media/FDdcCGCXIAQ_Itv.jpg'],0,1,1,[],[],https://twitter.com/glaustindafokus/status/1456734203270340612,False,,1,https://pbs.twimg.com/media/FDdcCGCXIAQ_Itv.jpg,,,,,,,[],,,,
1456734059636445189,1456734059636445189,2021-11-05 18:23:59 -0300,2021-11-05,18:23:59,-300,133692726,glaustindafokus,Glaustin da Fokus,,"É inacreditável que uma tragédia tenha levado essa grande artista, mãe e referência para uma geração. Assim como o nosso Cristiano Araújo, agora a @MariliaMReal nos deixa para brilhar no céu. #luto",pt,"[{'screen_name': 'mariliamreal', 'name': 'maria mendonça', 'id': '2921763658'}]",[],[],0,0,0,['luto'],[],https://twitter.com/glaustindafokus/status/1456734059636445189,False,,0,,,,,,,,[],,,,
1449507464127389697,1449507464127389697,2021-10-16 19:48:04 -0300,2021-10-16,19:48:04,-300,133692726,glaustindafokus,Glaustin da Fokus,,"Meus sentimentos às famílias das sete vítimas do naufrágio durante temporal no rio Paraguai, no Pantanal, em Corumbá (MS). Cinco deles eram goianos de Rio Verde e se reuniam depois de algum tempo sem pescar na região por causa da pandemia. 🖤Que Deus conforte o coração de vocês!",pt,[],[],[],4,0,2,[],[],https://twitter.com/glaustindafokus/status/1449507464127389697,False,,0,,,,,,,,[],,,,
1437029783515406342,1437029783515406342,2021-09-12 09:26:13 -0300,2021-09-12,09:26:13,-300,133692726,glaustindafokus,Glaustin da Fokus,,"Nós goianos perdemos o padre Jesus Flores, aos 88 anos. Mais uma voz silenciada pela covid-19. 📻Sempre no microfone da rádio Difusora, o missionário redentorista fez história como um religioso muito popular e um analista dos cenários políticos do nosso estado. 🙏🏼Descanse em paz!",pt,[],[],[],10,0,3,[],[],https://twitter.com/glaustindafokus/status/1437029783515406342,False,,0,,,,,,,,[],,,,
1425512280888860674,1425512280888860674,2021-08-11 14:39:47 -0300,2021-08-11,14:39:47,-300,133692726,glaustindafokus,Glaustin da Fokus,,"Quem não se lembra dos bichos soterrados na lama de Mariana e Brumadinho? Cenas tristes! Proteger animais é uma bandeira do meu mandato. Por isso, relatei o PL 2950/19, do Senado, para amparar outros seres vivos em desastres ambientais. Boa notícia: a Cdeics aprovou meu parecer!",pt,[],[],[],7,1,0,[],[],https://twitter.com/glaustindafokus/status/1425512280888860674,False,,0,,,,,,,,[],,,,
1425263634662531073,1425263634662531073,2021-08-10 22:11:45 -0300,2021-08-10,22:11:45,-300,133692726,glaustindafokus,Glaustin da Fokus,,"Votei SIM pelo #votoimpressoauditável porque acredito que transparência e segurança nunca são demais. Apesar do nosso esforço, a proposta não passou na @camaradeputados. Respeito a decisão e continuo a confiar no processo eleitoral. Isso é democracia. 🇧🇷Que Deus proteja o Brasil.  https://t.co/1CGco4nf5R",pt,"[{'screen_name': 'camaradeputados', 'name': 'câmara dos deputados', 'id': '61843152'}]",[],['https://pbs.twimg.com/media/E8eNt2AX0AcW_dI.jpg'],5,3,14,['votoimpressoauditável'],[],https://twitter.com/glaustindafokus/status/1425263634662531073,False,,1,https://pbs.twimg.com/media/E8eNt2AX0AcW_dI.jpg,,,,,,,[],,,,
1425260949238337537,1425260949238337537,2021-08-10 22:01:05 -0300,2021-08-10,22:01:05,-300,133692726,glaustindafokus,Glaustin da Fokus,,"Votei SIM pelo #votoimpressoauditável porque acredito que transparência e segurança nunca são demais. Apesar do nosso esforço, a proposta não passou na @camaradeputados. Respeito a decisão e continuo a confiar no processo eleitoral. Isso é democracia. 🇧🇷Que Deus proteja o Brasil.",pt,"[{'screen_name': 'camaradeputados', 'name': 'câmara dos deputados', 'id': '61843152'}]",[],[],3,1,5,['votoimpressoauditável'],[],https://twitter.com/glaustindafokus/status/1425260949238337537,False,,0,,,,,,,,[],,,,
1425167367043227652,1425167367043227652,2021-08-10 15:49:13 -0300,2021-08-10,15:49:13,-300,133692726,glaustindafokus,Glaustin da Fokus,,"Vamos tornar o processo eleitoral ainda mais seguro e transparente. Assim como o povo brasileiro, sou favorável ao voto impresso auditável. Votarei “sim” ao aperfeiçoamento de apuração das urnas eletrônicas.",pt,[],[],[],10,6,16,[],[],https://twitter.com/glaustindafokus/status/1425167367043227652,False,,0,,,,,,,,[],,,,
1423695796738928643,1423695796738928643,2021-08-06 14:21:43 -0300,2021-08-06,14:21:43,-300,133692726,glaustindafokus,Glaustin da Fokus,,"Minha família e eu estamos em oração e confiantes no sucesso do procedimento cirúrgico pelo qual o  nosso amigo @IrisRezendeM será submetido. 🙌🏽Ele tem uma força extraordinária e tenho certeza de que rapidamente estará recuperado. 🙏🏼Deus está contigo, amigo!",pt,"[{'screen_name': 'irisrezendem', 'name': 'iris rezende', 'id': '777108204832555008'}]",[],[],20,1,7,[],[],https://twitter.com/glaustindafokus/status/1423695796738928643,False,,0,,,,,,,,[],,,,
1420781389604139008,1420781389604139008,2021-07-29 13:20:54 -0300,2021-07-29,13:20:54,-300,133692726,glaustindafokus,Glaustin da Fokus,,"O nosso @VilaNovaFC completa hoje 78 anos de muita raça e paixão! ❤️Somente um vilanovense sabe o que significa apoiar esse clube e acompanhar essa história de tantas lutas e glórias. Nossa torcida é gigante e fenomenal! 🇦🇹Somos o #timedopovo! 🐯Parabéns, meu Tigrão! #Vila78anos",pt,"[{'screen_name': 'vilanovafc', 'name': 'vila nova f.c.', 'id': '68473498'}]",[],[],6,0,1,"['timedopovo', 'vila78anos']",[],https://twitter.com/glaustindafokus/status/1420781389604139008,False,,0,,,,,,,,[],,,,
1419609292571922434,1419609292571922434,2021-07-26 07:43:25 -0300,2021-07-26,07:43:25,-300,133692726,glaustindafokus,Glaustin da Fokus,,"Teve bandeira brasileira no segundo lugar mais alto do pódio. 🥈Parabéns, Fadinha! 🧚‍♀️ Rayssa Leal levou o gingado e a garra do povo brasileiro para o skate street feminino nas #OlimpíadasdeTokio. Nossa jovem atleta conquistou medalha de prata e fez história! 🇧🇷 Muito merecido!  https://t.co/0HyTceb0q8",pt,[],[],['https://pbs.twimg.com/media/E7N3H5RXEAAqPil.jpg'],0,0,4,['olimpíadasdetokio'],[],https://twitter.com/glaustindafokus/status/1419609292571922434,False,,1,https://pbs.twimg.com/media/E7N3H5RXEAAqPil.jpg,,,,,,,[],,,,
1416783915621232646,1416783915621232646,2021-07-18 12:36:22 -0300,2021-07-18,12:36:22,-300,133692726,glaustindafokus,Glaustin da Fokus,,"Pela graça do Senhor, o nosso Presidente @jairbolsonaro recebeu alta na manhã deste domingo. Não há batalha que seja maior que Deus. E Ele sempre esteve ao lado do nosso Capitão. Hoje, eu e a minha família vamos orar, não para pedir, mas para agradecer pela rápida recuperação. 🙏🏻",pt,"[{'screen_name': 'jairbolsonaro', 'name': 'jair m. bolsonaro', 'id': '128372940'}]",[],[],1,0,2,[],[],https://twitter.com/glaustindafokus/status/1416783915621232646,False,,0,,,,,,,,[],,,,
1416116528446152704,1416116526734876673,2021-07-16 16:24:25 -0300,2021-07-16,16:24:25,-300,133692726,glaustindafokus,Glaustin da Fokus,,"Assim como a maioria da população, eu não concordo com o aumento do fundão.  Prezo pela transparência, por isso faço questão de esclarecer como foi a votação e dizer que vamos pedir ao nosso presidente @jairbolsonaro que vete o aumento do fundão e aprove a LDO de 2022.",pt,"[{'screen_name': 'jairbolsonaro', 'name': 'jair m. bolsonaro', 'id': '128372940'}]",[],[],1,0,1,[],[],https://twitter.com/glaustindafokus/status/1416116528446152704,False,,0,,,,,,,,[],,,,
1416116526734876673,1416116526734876673,2021-07-16 16:24:24 -0300,2021-07-16,16:24:24,-300,133692726,glaustindafokus,Glaustin da Fokus,,"Nesta quinta, a @camaradeputados votou a LDO de 2022. Incluso nesta pauta estava o aumento do ‘Fundão eleitoral’, que sou totalmente contrário. Com toda a certeza, se houvesse a possibilidade de votar separado, o meu voto seria “NÃO”.",pt,"[{'screen_name': 'camaradeputados', 'name': 'câmara dos deputados', 'id': '61843152'}]",[],[],8,0,1,[],[],https://twitter.com/glaustindafokus/status/1416116526734876673,False,,0,,,,,,,,[],,,,
1415393311284678658,1415393311284678658,2021-07-14 16:30:36 -0300,2021-07-14,16:30:36,-300,133692726,glaustindafokus,Glaustin da Fokus,,"Estou em oração pela rápida recuperação do nosso presidente @jairbolsonaro . O povo brasileiro sabe da sua força e tenho certeza que essa será mais uma batalha vencida. O nosso País precisa de você, Capitão! 🇧🇷 Deus é contigo. 🙏🏻",pt,"[{'screen_name': 'jairbolsonaro', 'name': 'jair m. bolsonaro', 'id': '128372940'}]",[],[],4,0,2,[],[],https://twitter.com/glaustindafokus/status/1415393311284678658,False,,0,,,,,,,,[],,,,
1414996905768128514,1414996905768128514,2021-07-13 14:15:26 -0300,2021-07-13,14:15:26,-300,133692726,glaustindafokus,Glaustin da Fokus,,"Estou feliz com a indicação de @AmendoncaAGU para o cargo de ministro do @STF_oficial .Acredito que ele contribuirá muito p/ o avanço do nosso País, uma vez que possui um formidável currículo acadêmico, extenso conhecimento jurídico e trajetória impecável.Deus é contigo,ministro!",pt,"[{'screen_name': 'amendoncaagu', 'name': 'perfil reservado', 'id': '1518980677110222849'}, {'screen_name': 'stf_oficial', 'name': 'stf', 'id': '68313718'}]",[],[],1,0,0,[],[],https://twitter.com/glaustindafokus/status/1414996905768128514,False,,0,,,,,,,,[],,,,
1414598746881601540,1414598746881601540,2021-07-12 11:53:17 -0300,2021-07-12,11:53:17,-300,133692726,glaustindafokus,Glaustin da Fokus,,"Violência contra a mulher é crime! 🚫É absurdo, revoltante e inadmissível. 🗳️Na @camaradeputados, aprovamos o #AgostoLilás e o programa #SinalVermelho. Espero que agressões como a sofrida por @pamellaholanda1 jamais se repitam! ❌Se você é vítima, ligue para o 180 e denuncie!",pt,"[{'screen_name': 'camaradeputados', 'name': 'câmara dos deputados', 'id': '61843152'}, {'screen_name': 'pamellaholanda1', 'name': 'pamellaholanda', 'id': '1048362891525718016'}]",[],[],0,1,2,"['agostolilás', 'sinalvermelho']",[],https://twitter.com/glaustindafokus/status/1414598746881601540,False,,0,,,,,,,,[],,,,
1410958041948819460,1410958041948819460,2021-07-02 10:46:26 -0300,2021-07-02,10:46:26,-300,133692726,glaustindafokus,Glaustin da Fokus,,"A Secretaria da Retomada já traz resultados na geração de empregos! 👷🏾‍♀️Segundo o Caged, Goiás registrou saldo positivo pelo 5° mês consecutivo no nº de postos de trabalho com carteira assinada. 📈É o melhor resultado do Centro-Oeste e o 6º do Brasil. 👏🏽Parabéns, @ronaldocaiado!",pt,"[{'screen_name': 'ronaldocaiado', 'name': 'ronaldo caiado', 'id': '32101740'}]",[],[],1,0,1,[],[],https://twitter.com/glaustindafokus/status/1410958041948819460,False,,0,,,,,,,,[],,,,
1410326212094873604,1410326212094873604,2021-06-30 16:55:46 -0300,2021-06-30,16:55:46,-300,133692726,glaustindafokus,Glaustin da Fokus,,"🗳️#MeuVotoMinhaEscolha! 💬Reforcei minha defesa pelo #distritão, que traz o voto único, majoritário e intransferível, como defende o @pscnacional. 📢O debate desta tarde trouxe à comissão especial da PEC da #ReformaEleitoral especialistas em coligação e financiamento de campanha.",pt,"[{'screen_name': 'pscnacional', 'name': 'psc', 'id': '243182504'}]",[],[],0,0,2,"['meuvotominhaescolha', 'distritão', 'reformaeleitoral']",[],https://twitter.com/glaustindafokus/status/1410326212094873604,False,https://twitter.com/camaradeputados/status/1410295118838611989,0,,,,,,,,[],,,,
1409491295274422278,1409491287607291909,2021-06-28 09:38:06 -0300,2021-06-28,09:38:06,-300,133692726,glaustindafokus,Glaustin da Fokus,,Parabéns também ao nosso governador @ronaldocaiado por valorizar a nossa força policial e possibilitar que essa prisão acontecesse. (Foto: arquivo)  https://t.co/zACP6pjmfQ,pt,"[{'screen_name': 'ronaldocaiado', 'name': 'ronaldo caiado', 'id': '32101740'}]",[],['https://pbs.twimg.com/media/E4-E3K_WUAQE872.jpg'],1,0,0,[],[],https://twitter.com/glaustindafokus/status/1409491295274422278,False,,1,https://pbs.twimg.com/media/E4-E3K_WUAQE872.jpg,,,,,,,[],,,,
1409491289419169792,1409491287607291909,2021-06-28 09:38:05 -0300,2021-06-28,09:38:05,-300,133692726,glaustindafokus,Glaustin da Fokus,,"Parabéns a todos os policiais que, sob comando do secretário @RodneyMirandaRM , prenderam Lázaro e fizeram justiça por tantas vítimas, principalmente por aquelas que tiveram suas vidas injustamente interrompidas.",pt,"[{'screen_name': 'rodneymirandarm', 'name': 'rodney miranda', 'id': '1113132598073745409'}]",[],[],2,0,0,[],[],https://twitter.com/glaustindafokus/status/1409491289419169792,False,,0,,,,,,,,[],,,,
1409491287607291909,1409491287607291909,2021-06-28 09:38:04 -0300,2021-06-28,09:38:04,-300,133692726,glaustindafokus,Glaustin da Fokus,,Que orgulho da polícia goiana! Hoje mais famílias poderão dormir o sono dos justos e descansar em paz porque mais um serial killer foi retirado das ruas.,pt,[],[],[],9,0,2,[],[],https://twitter.com/glaustindafokus/status/1409491287607291909,False,,0,,,,,,,,[],,,,
1409196599377547266,1409196599377547266,2021-06-27 14:07:05 -0300,2021-06-27,14:07:05,-300,133692726,glaustindafokus,Glaustin da Fokus,,"Infelizmente, crianças com autismo de SP continuam sem professor especializado, após veto do governo estadual a um projeto da deputada @valbolsonaro. Por aqui, apresentei em março o PL 630, para obrigar o poder público a fomentar programas de saúde e educação para autistas.  🧩💙",pt,"[{'screen_name': 'valbolsonaro', 'name': 'valéria bolsonaro', 'id': '943448461680275457'}]",[],[],2,0,2,[],[],https://twitter.com/glaustindafokus/status/1409196599377547266,False,,0,,,,,,,,[],,,,
1408517808300908547,1408517808300908547,2021-06-25 17:09:49 -0300,2021-06-25,17:09:49,-300,133692726,glaustindafokus,Glaustin da Fokus,,"Parabéns, presidente @ArthurLira_ ! Que Deus esteja sempre te abençoando e dando sabedoria para ajudar a conduzir o nosso Brasil rumo ao desenvolvimento. Muita saúde, paz e prosperidade. 🙏🏻 Feliz Aniversário!  https://t.co/4nUW3TsWd9",pt,"[{'screen_name': 'arthurlira_', 'name': 'arthur lira', 'id': '1086390169970884613'}]",[],['https://pbs.twimg.com/media/E4wPesNXwCI3sXU.jpg'],2,0,0,[],[],https://twitter.com/glaustindafokus/status/1408517808300908547,False,,1,https://pbs.twimg.com/media/E4wPesNXwCI3sXU.jpg,,,,,,,[],,,,
1408138701725700103,1408138701725700103,2021-06-24 16:03:23 -0300,2021-06-24,16:03:23,-300,133692726,glaustindafokus,Glaustin da Fokus,,"O @pscnacional caminha lado a lado com o presidente @jairbolsonaro .Fico mto feliz por @AluisioMendesMA assumir o papel de vice-lider do governo no #CongressoNacional. Importante missão na reconstrução do Brasil.Acreditamos no seu potencial para ajudar a alavancar a Nação, amigo.",pt,"[{'screen_name': 'pscnacional', 'name': 'psc', 'id': '243182504'}, {'screen_name': 'jairbolsonaro', 'name': 'jair m. bolsonaro', 'id': '128372940'}, {'screen_name': 'aluisiomendesma', 'name': 'aluisio mendes', 'id': '2654800357'}]",[],[],12,1,6,['congressonacional'],[],https://twitter.com/glaustindafokus/status/1408138701725700103,False,,0,,,,,,,,[],,,,
1407808383399387142,1407808369554071555,2021-06-23 18:10:49 -0300,2021-06-23,18:10:49,-300,133692726,glaustindafokus,Glaustin da Fokus,,Toda e qualquer ação agora deve ser no sentido de apoiá-los e fortalecer essa missão. Sigo à disposição para somar com o que for preciso e em oração para que Deus cuide da vida dos nossos policiais e os guie durante essa árdua jornada.  https://t.co/AR5PfYeTZo,pt,[],[],"['https://pbs.twimg.com/media/E4mKQcCX0AIzdvU.jpg', 'https://pbs.twimg.com/media/E4mKQdgWYAQScTS.jpg', 'https://pbs.twimg.com/media/E4mKQdlXwAYYwq-.jpg', 'https://pbs.twimg.com/media/E4mKQdlXoAAx1uB.jpg']",0,0,2,[],[],https://twitter.com/glaustindafokus/status/1407808383399387142,False,,1,https://pbs.twimg.com/media/E4mKQcCX0AIzdvU.jpg,,,,,,,[],,,,
1407808369554071555,1407808369554071555,2021-06-23 18:10:45 -0300,2021-06-23,18:10:45,-300,133692726,glaustindafokus,Glaustin da Fokus,,"Nesta terça-feira, o governador @ronaldocaiado me pediu que uma nova remessa de mantimentos fosse enviada à base de comando da força-tarefa para capturar Lázaro. Imediatamente, um caminhão do Grupo Fokus seguiu viagem para Cocalzinho com mais de 1,3 tonelada de alimentos.",pt,"[{'screen_name': 'ronaldocaiado', 'name': 'ronaldo caiado', 'id': '32101740'}]",[],[],1,1,3,[],[],https://twitter.com/glaustindafokus/status/1407808369554071555,False,,0,,,,,,,,[],,,,
1407076388167950337,1407076385932390414,2021-06-21 17:42:07 -0300,2021-06-21,17:42:07,-300,133692726,glaustindafokus,Glaustin da Fokus,,"Estimo boa recuperação, física e emocional, a Silvye e seu filho, que infelizmente presenciou a covardia. Que a justiça seja feita para o agressor!",pt,[],[],[],0,0,2,[],[],https://twitter.com/glaustindafokus/status/1407076388167950337,False,,0,,,,,,,,[],,,,
