id,conversation_id,created_at,date,time,timezone,user_id,username,name,place,tweet,language,mentions,urls,photos,replies_count,retweets_count,likes_count,hashtags,cashtags,link,retweet,quote_url,video,thumbnail,near,geo,source,user_rt_id,user_rt,retweet_id,reply_to,retweet_date,translate,trans_src,trans_dest
1201997197543391237,1201915640761765889,2019-12-03 19:50:38 -0300,2019-12-03,19:50:38,-300,1071160842543136769,ltrutis,Loester Trutis,,"@filipebarrost @PSL_Nacional O deputado além de mentiroso é um cínico. 1° eu não sou do conselho de ética, logo não voto. 2° Eu estava na reunião como membro, assim como vc estava. 3° Sua irá pela perda dos cargos CNEs de alto salário que vc tinha na liderança e foram cortados o Sr. Não fala.",pt,[],[],[],61,1,22,[],[],https://twitter.com/LTrutis/status/1201997197543391237,False,,0,,,,,,,,"[{'screen_name': 'filipebarrost', 'name': 'Filipe Barros', 'id': '225925013'}, {'screen_name': 'PSL_Nacional', 'name': 'Partido Social Liberal - PSL', 'id': '1011297899463041028'}]",,,,
1201996486994808832,1201915640761765889,2019-12-03 19:47:49 -0300,2019-12-03,19:47:49,-300,1071160842543136769,ltrutis,Loester Trutis,,"@filipebarrost @DelegadoPablo_ @deppimentel @bozzellajr @joicehasselmann @Bivar1717 Essa tática de confundir o eleitorado logo não funcionará mais. Explique seus cargos comissionados para seus seguidores, como usufruiu da estrutura do PSL.",pt,[],[],[],34,0,8,[],[],https://twitter.com/LTrutis/status/1201996486994808832,False,,0,,,,,,,,"[{'screen_name': 'filipebarrost', 'name': 'Filipe Barros', 'id': '225925013'}, {'screen_name': 'DelegadoPablo_', 'name': 'Delegado PABLO', 'id': '1019959604971802625'}, {'screen_name': 'deppimentel', 'name': 'Professora Dayane Pimentel', 'id': '1026636587298443265'}, {'screen_name': 'joicehasselmann', 'name': 'Joice Hasselmann', 'id': '116519514'}, {'screen_name': 'Bivar1717', 'name': 'Luciano Bivar 1717', 'id': '2548083266'}]",,,,
1200579709584715781,1200579709584715781,2019-11-29 21:58:03 -0300,2019-11-29,21:58:03,-300,1071160842543136769,ltrutis,Loester Trutis,,"Reclamar por reclamar é tão latente na esquerda, que tem vegano reclamado do preço da carne bovina só pra atacar o presidente.",pt,[],[],[],101,15,118,[],[],https://twitter.com/LTrutis/status/1200579709584715781,False,,0,,,,,,,,[],,,,
1200072874825928705,1200072874825928705,2019-11-28 12:24:04 -0300,2019-11-28,12:24:04,-300,1071160842543136769,ltrutis,Loester Trutis,,Hoje 28/11 Mato Grosso do Sul da um importante passo para ser uns dos pilotos na Internet 5G.  https://t.co/tqLwR3drXj,pt,[],['https://www.instagram.com/p/B5ad2CkBtZx/?igshid=1kubshbbvsld3'],[],6,1,12,[],[],https://twitter.com/LTrutis/status/1200072874825928705,False,,0,,,,,,,,[],,,,
1200068669092585472,1200068669092585472,2019-11-28 12:07:21 -0300,2019-11-28,12:07:21,-300,1071160842543136769,ltrutis,Loester Trutis,,Hoje 28/11 Mato Grosso do Sul da um importante passo para ser uns dos pilotos na Internet 5G.  https://t.co/n1V4wtPnB8,pt,[],['https://www.instagram.com/p/B5ad2CkBtZx/?igshid=1ruahoxn397gv'],[],0,0,8,[],[],https://twitter.com/LTrutis/status/1200068669092585472,False,,0,,,,,,,,[],,,,
1199695582245212161,1199695582245212161,2019-11-27 11:24:50 -0300,2019-11-27,11:24:50,-300,1071160842543136769,ltrutis,Loester Trutis,,Polícia para trabalhar precisa estrutura e valorização. Por hora como deputado federal só posso garantir o primeiro. Quem sabe em 2022 tenhamos no governo do estado alguém  que valorize os policiais e profissionais…  https://t.co/9YDboYLebn,pt,[],['https://www.instagram.com/p/B5X0P3bBbSH/?igshid=3l8mrrlc0rw5'],[],3,0,9,[],[],https://twitter.com/LTrutis/status/1199695582245212161,False,,0,,,,,,,,[],,,,
1199475794755670017,1199475794755670017,2019-11-26 20:51:29 -0300,2019-11-26,20:51:29,-300,1071160842543136769,ltrutis,Loester Trutis,,Acabou de publicar uma foto  https://t.co/Y0em7xpp95,pt,[],['https://www.instagram.com/p/B5WQTSDBzsi/?igshid=pkl2hp84n843'],[],0,0,5,[],[],https://twitter.com/LTrutis/status/1199475794755670017,False,,0,,,,,,,,[],,,,
1198458914230153216,1198458914230153216,2019-11-24 01:30:46 -0300,2019-11-24,01:30:46,-300,1071160842543136769,ltrutis,Loester Trutis,,O prêmio em dinheiro pro @Flamengo pela conquista da libertadores é de 12 milhões de dólares. Que tal indenizar as 10 famílias dos garotos mortos sobre responsabilidade de vocês? Isso seria a verdadeira conquista de grandeza.,pt,"[{'screen_name': 'flamengo', 'name': 'flamengo', 'id': '59591856'}]",[],[],6,2,33,[],[],https://twitter.com/LTrutis/status/1198458914230153216,False,,0,,,,,,,,[],,,,
1196789649198460928,1196789649198460928,2019-11-19 10:57:42 -0300,2019-11-19,10:57:42,-300,1071160842543136769,ltrutis,Loester Trutis,,Querido símbolo da terra Da amada terra do Brasil.  https://t.co/GMTwX4Rt5h,pt,[],['https://www.instagram.com/p/B5DKyJTB-Wt/?igshid=r3g6h6xc5twr'],[],1,0,7,[],[],https://twitter.com/LTrutis/status/1196789649198460928,False,,0,,,,,,,,[],,,,
1194216637827895297,1194216637827895297,2019-11-12 08:33:28 -0300,2019-11-12,08:33:28,-300,1071160842543136769,ltrutis,Loester Trutis,,"Como presidente do grupo de amizade entre  parlamentares Brasil- República Tcheca, inauguramos a exposição no Senado Federal. Todo custo da exposição, ficou por conta do governo Tcheco.  https://t.co/lEWrg5ZttK",pt,[],['https://www.instagram.com/p/B4w4tgIB_5X/?igshid=1ns7esr8xvlfo'],[],2,0,9,[],[],https://twitter.com/LTrutis/status/1194216637827895297,False,,0,,,,,,,,[],,,,
1192882925529915392,1192882925529915392,2019-11-08 16:13:46 -0300,2019-11-08,16:13:46,-300,1071160842543136769,ltrutis,Loester Trutis,,"Nada é mais importante!  Vamos coordenar um movimento para nenhuma pauta seja votada, até a prisão de segunda instância seja colocada como prioridade.  https://t.co/st2NBQj4YL",pt,[],['https://www.instagram.com/p/B4naNbehzy2/?igshid=4r1i7409a8sw'],[],8,3,22,[],[],https://twitter.com/LTrutis/status/1192882925529915392,False,,0,,,,,,,,[],,,,
1190486617900883968,1190486617900883968,2019-11-02 01:31:42 -0300,2019-11-02,01:31:42,-300,1071160842543136769,ltrutis,Loester Trutis,,"Aproveitando o dia de finados pra mandar um salve pros 111 mortos no carandirú, que não vão mais roubar, matar nem estuprar ninguém.",pt,[],[],[],9,3,62,[],[],https://twitter.com/LTrutis/status/1190486617900883968,False,,0,,,,,,,,[],,,,
1189970667619278848,1189970667619278848,2019-10-31 15:21:30 -0300,2019-10-31,15:21:30,-300,1071160842543136769,ltrutis,Loester Trutis,,"Fortalecer a segurança pública.  Além de investimentos na polícia militar e rodoviária federal, a guarda municipal tb poderá contar com nossas emendas pra cidade.  https://t.co/ds97Gkrc2n",pt,[],['https://www.instagram.com/p/B4St3klhxvu/?igshid=1kr9w91jsy4m5'],[],1,0,6,[],[],https://twitter.com/LTrutis/status/1189970667619278848,False,,0,,,,,,,,[],,,,
1189536799397314561,1189536799397314561,2019-10-30 10:37:28 -0300,2019-10-30,10:37:28,-300,1071160842543136769,ltrutis,Loester Trutis,,"Além de melhorar as condições dentro da escola é nossa obrigação facilitar o acesso a escola. Por esse motivo o transporte adequado e com acessibilidade é imprescindível, ainda mais no interior no Mato Grosso do Sul.…  https://t.co/VgwXEahlKB",pt,[],['https://www.instagram.com/p/B4PokZHB0Zn/?igshid=3du14rngginy'],[],2,0,5,[],[],https://twitter.com/LTrutis/status/1189536799397314561,False,,0,,,,,,,,[],,,,
1189213908554407936,1189213908554407936,2019-10-29 13:14:24 -0300,2019-10-29,13:14:24,-300,1071160842543136769,ltrutis,Loester Trutis,,Meu Ministro Chefe do Gabinete de Segurança Institucional GSI. Orgulho em pertencer ao seu time.  https://t.co/iXLRNWMiG8,pt,[],['https://www.instagram.com/p/B4NVvC6BBQ1/?igshid=rh7ruo74yy7t'],[],0,0,3,[],[],https://twitter.com/LTrutis/status/1189213908554407936,False,,0,,,,,,,,[],,,,
1189155895403433984,1189155895403433984,2019-10-29 09:23:53 -0300,2019-10-29,09:23:53,-300,1071160842543136769,ltrutis,Loester Trutis,,"Tem deputado e vereador que só abre a boca na hora de dar moção ou brigar por partido. Gastam um fortuna com coisas inúteis, agora na hora de defender o povo, dizem que não investigam pra economizar. Piada!  https://t.co/bmaeaXl9cI",pt,[],['https://www.instagram.com/p/B4M7WqeBNOh/?igshid=17cdftd2b9cia'],[],2,0,7,[],[],https://twitter.com/LTrutis/status/1189155895403433984,False,,0,,,,,,,,[],,,,
1188821882151297024,1188821882151297024,2019-10-28 11:16:38 -0300,2019-10-28,11:16:38,-300,1071160842543136769,ltrutis,Loester Trutis,,"Meu apoio não é moeda de troca. Direito a vida e a propriedade privada é sagrado e inegociável. Além disso, proteger nossas crianças da doutrinação ideológica de esquerda é tão importante quanto conseguir recursos…  https://t.co/dKyskrmzNJ",pt,[],['https://www.instagram.com/p/B4KjdfgB2xj/?igshid=1px8qotnbgapf'],[],0,0,2,[],[],https://twitter.com/LTrutis/status/1188821882151297024,False,,0,,,,,,,,[],,,,
1187740494031396865,1187740494031396865,2019-10-25 11:39:35 -0300,2019-10-25,11:39:35,-300,1071160842543136769,ltrutis,Loester Trutis,,"Colégios Cívicos Militares, Laboratórios de Robótica em escolas públicas e muito mais.  https://t.co/IQr9mu0En5",pt,[],['https://www.instagram.com/p/B4C3s_whXzk/?igshid=14xb1biyfnuqv'],[],0,0,2,[],[],https://twitter.com/LTrutis/status/1187740494031396865,False,,0,,,,,,,,[],,,,
1187584140042002433,1187584140042002433,2019-10-25 01:18:17 -0300,2019-10-25,01:18:17,-300,1071160842543136769,ltrutis,Loester Trutis,, https://t.co/nBe3jXO5F2,und,[],['https://www.instagram.com/p/B4BH-kUh8KU/?igshid=96vdvhhx6xya'],[],0,0,1,[],[],https://twitter.com/LTrutis/status/1187584140042002433,False,,0,,,,,,,,[],,,,
1187522343872000000,1187522343872000000,2019-10-24 21:12:44 -0300,2019-10-24,21:12:44,-300,1071160842543136769,ltrutis,Loester Trutis,,"@bolsonarosp @charllesevg @DelegadoFreitas. Happy com amigos, não existe desunião, existe um interesse em prol do Brasil. Saúde!!! em Embaixada Da República Tcheca  https://t.co/s7bVXISPY1",pt,"[{'screen_name': 'charllesevg', 'name': 'charlles evangelista', 'id': '1050022141440270336'}, {'screen_name': 'delegadofreitas', 'name': 'delegado marcelo freitas', 'id': '1098981858321276929'}]",['https://www.instagram.com/p/B4BUf68hLAv/?igshid=1qh3853q6en08'],[],0,1,3,[],[],https://twitter.com/LTrutis/status/1187522343872000000,False,,0,,,,,,,,[],,,,
1187105493824749574,1187105493824749574,2019-10-23 17:36:19 -0300,2019-10-23,17:36:19,-300,1071160842543136769,ltrutis,Loester Trutis,,"Sim, pra mim bandido bom é bandido morto. Achou ruim? Leva esse mala pra casa.  https://t.co/DOsRMrh1ZF",pt,[],['https://www.instagram.com/p/B3-W8BDhc-0/?igshid=1ku96h9oj9mxy'],[],3,1,10,[],[],https://twitter.com/LTrutis/status/1187105493824749574,False,,0,,,,,,,,[],,,,
1187068497605480453,1187068497605480453,2019-10-23 15:09:19 -0300,2019-10-23,15:09:19,-300,1071160842543136769,ltrutis,Loester Trutis,,"Os ervoafetivos estão bravinhos pq eu não gosto de maconheiro, dizem que maconha é natural. Amigão petróleo tb é, bebe uns gole aí e não me torra. #maconheironemégente.",pt,[],[],[],3,5,61,['maconheironemégente'],[],https://twitter.com/LTrutis/status/1187068497605480453,False,,0,,,,,,,,[],,,,
1186805217183948800,1186805217183948800,2019-10-22 21:43:08 -0300,2019-10-22,21:43:08,-300,1071160842543136769,ltrutis,Loester Trutis,,"Foi difícil vencer a oposição, mas agora o Brasil fará parte do mercado bilionário do lançamento de satélites de pequeno porte. Eu como membro da Comissão de Defesa e nosso Presidente dessa comissão, tivemos dias de…  https://t.co/srJ7zw1lIT",pt,[],['https://www.instagram.com/p/B38OY6EBrWV/?igshid=1gqtx4yxcha9b'],[],3,10,40,[],[],https://twitter.com/LTrutis/status/1186805217183948800,False,,0,,,,,,,,[],,,,
1186779252487675904,1186779252487675904,2019-10-22 19:59:57 -0300,2019-10-22,19:59:57,-300,1071160842543136769,ltrutis,Loester Trutis,,"Reforma da Previdência aprovada na Câmara e no Senado. Um dia, um passo, uma meta de cada vez. Assim vamos entrando pra história. em Câmara Anexo 3  https://t.co/qPSVIO4q1r",pt,[],['https://www.instagram.com/p/B38ClE3hOte/?igshid=180odwfopxaod'],[],1,0,10,[],[],https://twitter.com/LTrutis/status/1186779252487675904,False,,0,,,,,,,,[],,,,
1186668297313341440,1186668297313341440,2019-10-22 12:39:03 -0300,2019-10-22,12:39:03,-300,1071160842543136769,ltrutis,Loester Trutis,,"Estou onde meu presidente e meu país mais precisam de mim: TRABALHANDO:  100% dos votos alinhados com governo, discursos em plenário defendendo as pautas da Direita, atuante nas comissões mais importantes, apoiando…  https://t.co/hOzHUzcKzw",pt,[],['https://www.instagram.com/p/B37QHxVB59r/?igshid=1ut1suiv1ow8k'],[],7,4,23,[],[],https://twitter.com/LTrutis/status/1186668297313341440,False,,0,,,,,,,,[],,,,
1186589058820124672,1186389151563878400,2019-10-22 07:24:12 -0300,2019-10-22,07:24:12,-300,1071160842543136769,ltrutis,Loester Trutis,,@edibitencourt @BolsonaroSP Incorreto . Nunca fui vice líder de fato. Fui nomeado por um dia para defender o governo  a CCJ conforme portal da Câmara.,pt,[],[],[],1,0,1,[],[],https://twitter.com/LTrutis/status/1186589058820124672,False,,0,,,,,,,,"[{'screen_name': 'edibitencourt', 'name': 'Edivaldo Bitencourt', 'id': '153482894'}, {'screen_name': 'BolsonaroSP', 'name': 'Eduardo Bolsonaro🇧🇷', 'id': '74756085'}]",,,,
1186376308244148225,1186376308244148225,2019-10-21 17:18:48 -0300,2019-10-21,17:18:48,-300,1071160842543136769,ltrutis,Loester Trutis,,"Enquanto uns se prestam ao ridículo, eu trabalho. ESTOU FORA DE BRASÍLIA DESDE QUINTA. Portanto não estou em nenhuma nova lista. Já disse e reafirmo: Estou entre os deputados que votaram 100% com as pautas do…  https://t.co/XaLJC1fZSs",pt,[],['https://www.instagram.com/p/B342TtKBWWR/?igshid=1oqaxc7aksgt9'],[],19,6,30,[],[],https://twitter.com/LTrutis/status/1186376308244148225,False,,0,,,,,,,,[],,,,
1132013897840508928,1132013897840508928,2019-05-24 17:01:59 -0300,2019-05-24,17:01:59,-300,1071160842543136769,ltrutis,Loester Trutis,,"Acho que esse frio é culpa do Bolsonaro, ele deve ter soltado o vento que a Dilma tinha estocado!!!",pt,[],[],[],36,7,80,[],[],https://twitter.com/LTrutis/status/1132013897840508928,False,,0,,,,,,,,[],,,,
1130571358516195329,1130571358516195329,2019-05-20 17:29:51 -0300,2019-05-20,17:29:51,-300,1071160842543136769,ltrutis,Loester Trutis,,"Dia 26  NÃO é para invadir o congresso ou fechar STF,  NÃO SOMOS FORA DA LEI!  Dia 26 será pelas pautas do Presidente: Reforma da previdência, tributária e MP 870 Pacote anticrimes do minist. Moro Dia 26 será apoio ao Presidente. É pelo BRASIL! Respeitamos a CF. Somos patriotas.",pt,[],[],[],15,15,60,[],[],https://twitter.com/LTrutis/status/1130571358516195329,False,,0,,,,,,,,[],,,,
1123331196711309314,1123331196711309314,2019-04-30 18:00:02 -0300,2019-04-30,18:00:02,-300,1071160842543136769,ltrutis,Loester Trutis,,"EU FICO PUTO, com vereador/deputado que da uma “moção de congratulações” para um aluno/atleta. Pq ao invés de um pedaço de papel, não pega um pedaço do próprio ótimo salário e da um patrocínio. Isso seria reconhecimento. Eu faço isso. Ahhh...Enfia a moção no cu.",pt,[],[],[],17,7,49,[],[],https://twitter.com/LTrutis/status/1123331196711309314,False,,0,,,,,,,,[],,,,
1122504961072533507,1122504961072533507,2019-04-28 11:16:52 -0300,2019-04-28,11:16:52,-300,1071160842543136769,ltrutis,Loester Trutis,,"“A forma como vc trata a pessoa que serve a sua mesa diz muito sobre o seu caráter”. Não importa se vc é um senador, coronel ou empresário. Se vc não sabe valorizar um trabalhador, te acho um idiota. Não adianta ter doutorado e não cumprimentar o porteiro.",pt,[],[],[],1,5,30,[],[],https://twitter.com/LTrutis/status/1122504961072533507,False,,0,,,,,,,,[],,,,
1120902089142616064,1120902089142616064,2019-04-24 01:07:38 -0300,2019-04-24,01:07:38,-300,1071160842543136769,ltrutis,Loester Trutis,,"Após quase 9h de tentativas frustradas de obstruções por parte da oposição, foi aprovado parecer favorável a Nova Previdência na CCJ por 48 votos favoráveis e 18 contras. Estamos apenas começando.",pt,[],[],[],4,3,30,[],[],https://twitter.com/LTrutis/status/1120902089142616064,False,,0,,,,,,,,[],,,,
1120760740191907841,1120760740191907841,2019-04-23 15:45:57 -0300,2019-04-23,15:45:57,-300,1071160842543136769,ltrutis,Loester Trutis,,"Governo Bolsonaro cortou cargos na Empresa Brasileira de Comunicação. Passou a faca no cabide do PT pra mais de 1200 encostados. Aí, vieram na comissão chorar as pitangas. Tive que enquadrar.  https://t.co/C4jXM160oI",pt,[],['https://www.facebook.com/1738245342858207/posts/2616628091686590/'],[],3,3,22,[],[],https://twitter.com/LTrutis/status/1120760740191907841,False,,0,,,,,,,,[],,,,
1120693406785789952,1120693406785789952,2019-04-23 11:18:24 -0300,2019-04-23,11:18:24,-300,1071160842543136769,ltrutis,Loester Trutis,,Estou agora na Comissão de Cultura debatendo os cortes de cabide de emprego. A oposição vai tremer!  https://t.co/5ikkrEFPBs,pt,[],[],['https://pbs.twimg.com/media/D42ArvvXsAARtzb.jpg'],0,1,19,[],[],https://twitter.com/LTrutis/status/1120693406785789952,False,,1,https://pbs.twimg.com/media/D42ArvvXsAARtzb.jpg,,,,,,,[],,,,
1120662141806231555,1120662141806231555,2019-04-23 09:14:10 -0300,2019-04-23,09:14:10,-300,1071160842543136769,ltrutis,Loester Trutis,,"Mesmo não sendo membro, hoje estarei presente na CCJ, em busca da aprovação da nova previdência. Vamos pra cima!",pt,[],[],[],1,0,11,[],[],https://twitter.com/LTrutis/status/1120662141806231555,False,,0,,,,,,,,[],,,,
1120297700690468864,1120297700690468864,2019-04-22 09:06:00 -0300,2019-04-22,09:06:00,-300,1071160842543136769,ltrutis,Loester Trutis,,Semana iniciando!!!CPI do BNDES na câmara aprovou e Marcelo Odebrecht comparecerá na Casa para prestar esclarecimentos. Agora o bicho vai pegar!,pt,[],[],[],2,4,23,[],[],https://twitter.com/LTrutis/status/1120297700690468864,False,,0,,,,,,,,[],,,,
1119964118486790144,1119964118486790144,2019-04-21 11:00:28 -0300,2019-04-21,11:00:28,-300,1071160842543136769,ltrutis,Loester Trutis,,"Os integrantes da Polícia Militar do Mato Grosso do Sul agora tem sua voz na Câmara dos Deputados. Parabéns pelo seu dia, guerreiros!  https://t.co/GmHNFwcbj4",pt,[],[],['https://pbs.twimg.com/media/D4rpa6-XkAARx-7.jpg'],0,1,7,[],[],https://twitter.com/LTrutis/status/1119964118486790144,False,,1,https://pbs.twimg.com/media/D4rpa6-XkAARx-7.jpg,,,,,,,[],,,,
1119949070943039488,1119949070943039488,2019-04-21 10:00:40 -0300,2019-04-21,10:00:40,-300,1071160842543136769,ltrutis,Loester Trutis,,Nossa esperança se renova na certeza de que Jesus está sempre entre nós. Feliz Páscoa para todos!  https://t.co/sTVlcpcpbk,pt,[],[],['https://pbs.twimg.com/media/D4rbuv1WwAAzC0b.jpg'],1,1,12,[],[],https://twitter.com/LTrutis/status/1119949070943039488,False,,1,https://pbs.twimg.com/media/D4rbuv1WwAAzC0b.jpg,,,,,,,[],,,,
1119568886435917824,1119568886435917824,2019-04-20 08:49:57 -0300,2019-04-20,08:49:57,-300,1071160842543136769,ltrutis,Loester Trutis,,"Na terça-feira (16/04) subscrevi o requerimento do Presidente da Comissão Permanente de Ciência e Tecnologia, Comunicação e Informática, Deputado Félix Mendonça, para a realização de Audiência Pública sobre Tecnologia 5G. Trabalharemos sempre pelo avanço do país!",pt,[],[],[],0,0,6,[],[],https://twitter.com/LTrutis/status/1119568886435917824,False,,0,,,,,,,,[],,,,
1119221569916690433,1119221569916690433,2019-04-19 09:49:51 -0300,2019-04-19,09:49:51,-300,1071160842543136769,ltrutis,Loester Trutis,,"Exército é nossa mão forte. Pode passar cem anos sem entrar num conflito, mas não pode passar um minuto sem estar preparado. Rui Barbosa  https://t.co/BwlRf10vAz",pt,[],[],['https://pbs.twimg.com/media/D4hGFH1WsAAvcKQ.jpg'],0,2,11,[],[],https://twitter.com/LTrutis/status/1119221569916690433,False,,1,https://pbs.twimg.com/media/D4hGFH1WsAAvcKQ.jpg,,,,,,,[],,,,
1118946377424359427,1118946377424359427,2019-04-18 15:36:20 -0300,2019-04-18,15:36:20,-300,1071160842543136769,ltrutis,Loester Trutis,,Vamos lutar para aprovar a Reforma da Previdência. Independente da esquerda irresponsável e de grupos de parlamentares que insistem nas manobras contrárias. Nosso compromisso é com o povo.,pt,[],[],[],4,2,9,[],[],https://twitter.com/LTrutis/status/1118946377424359427,False,,0,,,,,,,,[],,,,
1118859050538754048,1118859050538754048,2019-04-18 09:49:19 -0300,2019-04-18,09:49:19,-300,1071160842543136769,ltrutis,Loester Trutis,,"Com o crescente envelhecimento da população e o passar dos anos, o dinheiro arrecadado será insuficiente para arcar com as necessidades. Isso não é achismo, são estudos.",pt,[],[],[],0,1,5,[],[],https://twitter.com/LTrutis/status/1118859050538754048,False,,0,,,,,,,,[],,,,
1118858946595438592,1118858946595438592,2019-04-18 09:48:54 -0300,2019-04-18,09:48:54,-300,1071160842543136769,ltrutis,Loester Trutis,,"A Reforma da Previdência é improrrogável. Quando os números não batem, nenhuma equação fecha. E é isso que vai acontecer se não adequarmos a previdência à realidade da sociedade.",pt,[],[],[],0,1,7,[],[],https://twitter.com/LTrutis/status/1118858946595438592,False,,0,,,,,,,,[],,,,
1117893730957242368,1117893730957242368,2019-04-15 17:53:29 -0300,2019-04-15,17:53:29,-300,1071160842543136769,ltrutis,Loester Trutis,,Acesse o link para ler a matéria completa. 👇🏻👇🏻👇🏻👇🏻👇🏻   https://t.co/0r3Xrde9j6  https://t.co/JwC1SEXh7L,pt,[],['https://www.midiamax.com.br/politica/2019/bebendo-lagrimas-de-petistas-deputado-de-ms-abre-fila-na-ccj/'],['https://pbs.twimg.com/media/D4OOaqJWwAYy5E3.jpg'],4,3,12,[],[],https://twitter.com/LTrutis/status/1117893730957242368,False,,1,https://pbs.twimg.com/media/D4OOaqJWwAYy5E3.jpg,,,,,,,[],,,,
1116309665623748610,1116309665623748610,2019-04-11 08:58:58 -0300,2019-04-11,08:58:58,-300,1071160842543136769,ltrutis,Loester Trutis,,"Nosso presidente Jair Bolsonaro, acaba de assinar o homeschooling. Novos tempo! O poder de escolha da família conservadora sendo respeitado.",pt,[],[],[],1,2,17,[],[],https://twitter.com/LTrutis/status/1116309665623748610,False,,0,,,,,,,,[],,,,
1115694998274695170,1115694998274695170,2019-04-09 16:16:30 -0300,2019-04-09,16:16:30,-300,1071160842543136769,ltrutis,Loester Trutis,,"Encontro-me, neste momento, na Reunião da CPI do BNDES, da qual sou o único representante do Mato Grosso do Sul e aproveito para deixar um aviso cordial: estamos chegando.",pt,[],[],[],3,3,18,[],[],https://twitter.com/LTrutis/status/1115694998274695170,False,,0,,,,,,,,[],,,,
1110355887582035968,1110355887582035968,2019-03-25 22:40:47 -0300,2019-03-25,22:40:47,-300,1071160842543136769,ltrutis,Loester Trutis,, https://t.co/nCiXPh7wNN,und,[],[],['https://pbs.twimg.com/media/D2jGyo9WsAAWeQ8.jpg'],1,1,10,[],[],https://twitter.com/LTrutis/status/1110355887582035968,False,,1,https://pbs.twimg.com/media/D2jGyo9WsAAWeQ8.jpg,,,,,,,[],,,,
1093141277556817921,1093141277556817921,2019-02-06 11:36:04 -0200,2019-02-06,11:36:04,-300,1071160842543136769,ltrutis,Loester Trutis,,"Vejo a imprensa tentando minar @GeneralMourao e deputados da base, e a direita caindo na armadilha.   Abram os olhos, o PT não é mais o inimigo mais poderoso.   A imprensa quer derrubar o governo e vc está ajudando? Governo forte, Direita forte.",pt,"[{'screen_name': 'generalmourao', 'name': 'general hamilton mourão', 'id': '1058819604741525510'}]",[],[],6,1,11,[],[],https://twitter.com/LTrutis/status/1093141277556817921,False,,0,,,,,,,,[],,,,
1085915536456802304,1085735154323058689,2019-01-17 13:03:33 -0200,2019-01-17,13:03:33,-300,1071160842543136769,ltrutis,Loester Trutis,,"@LucasPaagaani Particularmente eu gostaria de saber sobre desburocratização, na China se abre uma empresa em 24hs. Como poderíamos vender mais pra ele? Sabendo que eles são nosso maiores compradores de soja a avião. Como tirar maior proveito disso?",pt,[],[],[],2,1,3,[],[],https://twitter.com/LTrutis/status/1085915536456802304,False,,0,,,,,,,,"[{'screen_name': 'LucasPaagaani', 'name': 'Lucas Pagani', 'id': '950572762640343046'}]",,,,
1085914759965208577,1085735154323058689,2019-01-17 13:00:28 -0200,2019-01-17,13:00:28,-300,1071160842543136769,ltrutis,Loester Trutis,,@LucasPaagaani Essa é a questão não foi o motivo da viagem.,pt,[],[],[],2,1,0,[],[],https://twitter.com/LTrutis/status/1085914759965208577,False,,0,,,,,,,,"[{'screen_name': 'LucasPaagaani', 'name': 'Lucas Pagani', 'id': '950572762640343046'}]",,,,
1085735154323058689,1085735154323058689,2019-01-17 01:06:47 -0200,2019-01-17,01:06:47,-300,1071160842543136769,ltrutis,Loester Trutis,,23:59 A Esquerda “resistência”  Sérgio Moro é agente da CIA pra desestabilizar o Brasil 00:00 A Direita “Pensante” Tio Trutis foi recrutado pelo serviço secreto chinês.  PQP quem falou em sistema de vigilância? Direita,pt,[],[],[],35,3,25,[],[],https://twitter.com/LTrutis/status/1085735154323058689,False,,0,,,,,,,,[],,,,
1084580679453691905,1084580679453691905,2019-01-13 20:39:19 -0200,2019-01-13,20:39:19,-300,1071160842543136769,ltrutis,Loester Trutis,, https://t.co/fcG52krh8C,und,[],[],['https://pbs.twimg.com/media/Dw00YArXQAAXOOl.jpg'],5,1,10,[],[],https://twitter.com/LTrutis/status/1084580679453691905,False,,1,https://pbs.twimg.com/media/Dw00YArXQAAXOOl.jpg,,,,,,,[],,,,
1081244331313455105,1080958522496552963,2019-01-04 15:41:51 -0200,2019-01-04,15:41:51,-300,1071160842543136769,ltrutis,Loester Trutis,,"@CarlosBolsonaro @CarlosBolsonaro  em nome dos eleitores do seu pai, muito obrigado por tudo.",pt,[],[],[],0,0,4,[],[],https://twitter.com/LTrutis/status/1081244331313455105,False,,0,,,,,,,,"[{'screen_name': 'CarlosBolsonaro', 'name': 'Carlos Bolsonaro', 'id': '68712576'}]",,,,
