id,conversation_id,created_at,date,time,timezone,user_id,username,name,place,tweet,language,mentions,urls,photos,replies_count,retweets_count,likes_count,hashtags,cashtags,link,retweet,quote_url,video,thumbnail,near,geo,source,user_rt_id,user_rt,retweet_id,reply_to,retweet_date,translate,trans_src,trans_dest
1516957551639810048,1516957551639810048,2022-04-20 22:50:38 -0300,2022-04-20,22:50:38,-300,1071160842543136769,ltrutis,Loester Trutis,,"STF é autoritário pq o nosso Senado é omisso, os Senadores são omissos pq têm os rabos presos, têm os rabos presos pq são corruptos, conseguiram ser corruptos pq foram votados e eleitos por nós. Então, pense bem pra quem vc dará uma das 81 cadeiras do Senado da aqui pra frente.",pt,[],[],[],1,4,8,[],[],https://twitter.com/LTrutis/status/1516957551639810048,False,,0,,,,,,,,[],,,,
1510747936027721736,1509178725795078146,2022-04-03 19:35:50 -0300,2022-04-03,19:35:50,-300,1071160842543136769,ltrutis,Loester Trutis,,@Steppenwolf_Bra @drluizovando Já deixei sendo um dos poucos que votaram contra a prisão do Daniel e mais ainda nesta semana assinando o requerimento de urgência para o Lira pautar a urgência do pedido de revisão.,pt,[],[],[],0,0,1,[],[],https://twitter.com/LTrutis/status/1510747936027721736,False,,0,,,,,,,,"[{'screen_name': 'Steppenwolf_Bra', 'name': 'The Steppenwolf 2️⃣2️⃣🇧🇷🇵🇹🇮🇱🔫🔫', 'id': '1354505043811176450'}, {'screen_name': 'drluizovando', 'name': 'Deputado Dr. Luiz Ovando', 'id': '1247287375803355136'}]",,,,
1463934311296606211,1463934311296606211,2021-11-25 15:15:13 -0300,2021-11-25,15:15:13,-300,1071160842543136769,ltrutis,Loester Trutis,,Acabou de publicar uma foto  https://t.co/5OiiAnLrdp,pt,[],['https://www.instagram.com/p/CWtWHH9FOgi/?utm_medium=twitter'],[],5,0,3,[],[],https://twitter.com/LTrutis/status/1463934311296606211,False,,0,,,,,,,,[],,,,
1462094117026992133,1462094117026992133,2021-11-20 13:22:56 -0300,2021-11-20,13:22:56,-300,1071160842543136769,ltrutis,Loester Trutis,,"Acabou de publicar uma foto em Carlota, Campo Grande  https://t.co/29Mh82sLfB",pt,[],['https://www.instagram.com/p/CWgRSV8lacp/?utm_medium=twitter'],[],0,0,1,[],[],https://twitter.com/LTrutis/status/1462094117026992133,False,,0,,,,,,,,[],,,,
1462083773563088906,1462083773563088906,2021-11-20 12:41:50 -0300,2021-11-20,12:41:50,-300,1071160842543136769,ltrutis,Loester Trutis,,"Café da manhã em família para o aniversário da minha linda primogênita @ana_leticiatrutis  Obrigado Deus. em Carlota, Campo Grande  https://t.co/RKiepzlX2c",pt,[],['https://www.instagram.com/p/CWgMlMUl7az/?utm_medium=twitter'],[],0,0,1,[],[],https://twitter.com/LTrutis/status/1462083773563088906,False,,0,,,,,,,,[],,,,
1461684199262498819,1461684199262498819,2021-11-19 10:14:04 -0300,2021-11-19,10:14:04,-300,1071160842543136769,ltrutis,Loester Trutis,,"...Símbolo da terra, da amada terra do Brasil."" NUNCA SERÁ VERMELHA! em Carlota, Campo Grande  https://t.co/5UHAKE2SUa",pt,[],['https://www.instagram.com/p/CWdW4LslB8s/?utm_medium=twitter'],[],0,0,2,[],[],https://twitter.com/LTrutis/status/1461684199262498819,False,,0,,,,,,,,[],,,,
1461056003093508104,1461056003093508104,2021-11-17 16:37:50 -0300,2021-11-17,16:37:50,-300,1071160842543136769,ltrutis,Loester Trutis,,"Como diria @carlosbolsonaro  ""Tem Método""  A terceira via tem um único intuito. Abram o olho.  https://t.co/oxESodcmu3",pt,"[{'screen_name': 'carlosbolsonaro', 'name': 'carlos bolsonaro', 'id': '68712576'}]",['https://www.instagram.com/p/CWY5NL4lZbu/?utm_medium=twitter'],[],1,3,8,[],[],https://twitter.com/LTrutis/status/1461056003093508104,False,,0,,,,,,,,[],,,,
1460968363551715329,1460968363551715329,2021-11-17 10:49:36 -0300,2021-11-17,10:49:36,-300,1071160842543136769,ltrutis,Loester Trutis,,Acabou de publicar uma foto em Câmara dos Deputados  https://t.co/bz51vCuS8t,pt,[],['https://www.instagram.com/p/CWYRWjHliy1/?utm_medium=twitter'],[],0,0,1,[],[],https://twitter.com/LTrutis/status/1460968363551715329,False,,0,,,,,,,,[],,,,
1460715797823639553,1460715797823639553,2021-11-16 18:05:59 -0300,2021-11-16,18:05:59,-300,1071160842543136769,ltrutis,Loester Trutis,,Acabou de publicar uma foto  https://t.co/vcuDARCkmI,pt,[],['https://www.instagram.com/p/CWWef54lKrY/?utm_medium=twitter'],[],0,0,1,[],[],https://twitter.com/LTrutis/status/1460715797823639553,False,,0,,,,,,,,[],,,,
1459225891121377289,1459225891121377289,2021-11-12 15:25:38 -0300,2021-11-12,15:25:38,-300,1071160842543136769,ltrutis,Loester Trutis,,Observe o ZERO REIAIS PARA IMPRENSA. Por esse motivo você nunca verá qualquer informação destas em  veículo de notícias do MS. Sigo trabalhando.  https://t.co/knwiekOVXU,pt,[],['https://www.instagram.com/p/CWL4-D2FbUl/?utm_medium=twitter'],[],1,0,2,[],[],https://twitter.com/LTrutis/status/1459225891121377289,False,,0,,,,,,,,[],,,,
1459177346875994112,1459177346875994112,2021-11-12 12:12:44 -0300,2021-11-12,12:12:44,-300,1071160842543136769,ltrutis,Loester Trutis,,Abençoado seja o povo pantaneiro. em Pantanal Sul Mato-grossense Brasil  https://t.co/N6WyQJ79li,pt,[],['https://www.instagram.com/p/CWLi5FhFzB0/?utm_medium=twitter'],[],1,0,0,[],[],https://twitter.com/LTrutis/status/1459177346875994112,False,,0,,,,,,,,[],,,,
1458913459794419717,1458913459794419717,2021-11-11 18:44:08 -0300,2021-11-11,18:44:08,-300,1071160842543136769,ltrutis,Loester Trutis,,Meu respeito e admiração.  https://t.co/7cvy9AiXCs,pt,[],['https://www.instagram.com/p/CWJq5C6lJGQ/?utm_medium=twitter'],[],1,0,0,[],[],https://twitter.com/LTrutis/status/1458913459794419717,False,,0,,,,,,,,[],,,,
1458420525940756483,1458420525940756483,2021-11-10 10:05:24 -0300,2021-11-10,10:05:24,-300,1071160842543136769,ltrutis,Loester Trutis,,Veja a mágica acontecer...  https://t.co/VoKibVLhCd,pt,[],['https://www.instagram.com/p/CWGKutnr0PC/?utm_medium=twitter'],[],1,0,0,[],[],https://twitter.com/LTrutis/status/1458420525940756483,False,,0,,,,,,,,[],,,,
1458229729262125059,1458229729262125059,2021-11-09 21:27:14 -0300,2021-11-09,21:27:14,-300,1071160842543136769,ltrutis,Loester Trutis,,Barbudos do MT e MS. Esse é o cara! Raiz em Câmara dos Deputados  https://t.co/eUWYn0ZxUp,pt,[],['https://www.instagram.com/p/CWEz91BlEoT/?utm_medium=twitter'],[],1,0,0,[],[],https://twitter.com/LTrutis/status/1458229729262125059,False,,0,,,,,,,,[],,,,
1458188579792953350,1458188579792953350,2021-11-09 18:43:43 -0300,2021-11-09,18:43:43,-300,1071160842543136769,ltrutis,Loester Trutis,,Acabou de publicar uma foto em Câmara dos Deputados  https://t.co/gBumKv4jMq,pt,[],['https://www.instagram.com/p/CWEhQMxFFVy/?utm_medium=twitter'],[],2,2,5,[],[],https://twitter.com/LTrutis/status/1458188579792953350,False,,0,,,,,,,,[],,,,
1458122422318731273,1458122422318731273,2021-11-09 14:20:50 -0300,2021-11-09,14:20:50,-300,1071160842543136769,ltrutis,Loester Trutis,,A esquerda brinca de atrapalhar o Brasil. em Câmara dos Deputados  https://t.co/hF5hqe0Kr7,pt,[],['https://www.instagram.com/p/CWEDKpHpF0O/?utm_medium=twitter'],[],2,2,3,[],[],https://twitter.com/LTrutis/status/1458122422318731273,False,,0,,,,,,,,[],,,,
1457714683234832387,1457714683234832387,2021-11-08 11:20:38 -0300,2021-11-08,11:20:38,-300,1071160842543136769,ltrutis,Loester Trutis,,Acabou de publicar uma foto  https://t.co/GIEfAHvWAD,pt,[],['https://www.instagram.com/p/CWBJwGVFpkx/?utm_medium=twitter'],[],2,0,0,[],[],https://twitter.com/LTrutis/status/1457714683234832387,False,,0,,,,,,,,[],,,,
1456759278887387140,1456759278887387140,2021-11-05 20:04:12 -0300,2021-11-05,20:04:12,-300,1071160842543136769,ltrutis,Loester Trutis,,"Perdoe hoje! Ame hoje, abrace seus filhos e seus pais enquanto você ainda pode. Se for mandar flores, mande aos vivos. em Carlota, Campo Grande  https://t.co/WodtqLAk2N",pt,[],['https://www.instagram.com/p/CV6XSFLlYAS/?utm_medium=twitter'],[],1,0,0,[],[],https://twitter.com/LTrutis/status/1456759278887387140,False,,0,,,,,,,,[],,,,
1456042802693951491,1456042802693951491,2021-11-03 20:37:10 -0300,2021-11-03,20:37:10,-300,1071160842543136769,ltrutis,Loester Trutis,,Quem mandou matar Bolsonaro? Quem paga os advogados do Adélio?  https://t.co/DrWTpeTJ25,pt,[],['https://www.instagram.com/p/CV1Rd_YlWre/?utm_medium=twitter'],[],1,0,2,[],[],https://twitter.com/LTrutis/status/1456042802693951491,False,,0,,,,,,,,[],,,,
1449858294546317316,1449858294546317316,2021-10-17 19:02:09 -0300,2021-10-17,19:02:09,-300,1071160842543136769,ltrutis,Loester Trutis,,"Compartilhe, cobre. Deixe sua ocorrência nos comentários.  https://t.co/WwbKgTYuZU",pt,[],['https://www.instagram.com/p/CVJVFH6FxKz/?utm_medium=twitter'],[],4,0,1,[],[],https://twitter.com/LTrutis/status/1449858294546317316,False,,0,,,,,,,,[],,,,
1449781737605812231,1449781737605812231,2021-10-17 13:57:56 -0300,2021-10-17,13:57:56,-300,1071160842543136769,ltrutis,Loester Trutis,,"Qual a demanda da sua cidade? Vamos reunir com prefeito e vereadores, mas quero ouvir vc cidadão em primeiro lugar.  https://t.co/5BwfvZ4KkX",pt,[],['https://www.instagram.com/p/CVIyQ9nlLIc/?utm_medium=twitter'],[],1,0,1,[],[],https://twitter.com/LTrutis/status/1449781737605812231,False,,0,,,,,,,,[],,,,
1449083568723046403,1449083568723046403,2021-10-15 15:43:40 -0300,2021-10-15,15:43:40,-300,1071160842543136769,ltrutis,Loester Trutis,,"Deus tá vendo você dar parabéns pelo Dia dos Professores, mas ser à favor da reforma administrativa.  https://t.co/nqptaIUhYb",pt,[],['https://www.instagram.com/p/CVD0xktF6Dm/?utm_medium=twitter'],[],19,22,86,[],[],https://twitter.com/LTrutis/status/1449083568723046403,False,,0,,,,,,,,[],,,,
1448272622765187076,1448272622765187076,2021-10-13 10:01:15 -0300,2021-10-13,10:01:15,-300,1071160842543136769,ltrutis,Loester Trutis,,Acabou de publicar uma foto  https://t.co/tMVbY0OHUO,pt,[],['https://www.instagram.com/p/CU-D_5kA4iy/?utm_medium=twitter'],[],3,1,1,[],[],https://twitter.com/LTrutis/status/1448272622765187076,False,,0,,,,,,,,[],,,,
1437388196019585031,1437388196019585031,2021-09-13 09:10:25 -0300,2021-09-13,09:10:25,-300,1071160842543136769,ltrutis,Loester Trutis,,"Mato Grosso do Sul no Coração, Brasil acima de tudo e Deus acima de todos. ""São nos momentos difíceis que a lealdade é testada, na Bonanza há apenas bajulação"" em Congresso Nacional Brasileiro  https://t.co/ZWNcvI8UEZ",pt,[],['https://www.instagram.com/p/CTwuVbIlNNx/?utm_medium=twitter'],[],44,0,1,[],[],https://twitter.com/LTrutis/status/1437388196019585031,False,,0,,,,,,,,[],,,,
1431405898744860677,1431405898744860677,2021-08-27 20:58:55 -0300,2021-08-27,20:58:55,-300,1071160842543136769,ltrutis,Loester Trutis,,Acabou de publicar uma foto  https://t.co/7ZchZHdIPw,pt,[],['https://www.instagram.com/p/CTGN5w8Fzqb/?utm_medium=twitter'],[],6,0,0,[],[],https://twitter.com/LTrutis/status/1431405898744860677,False,,0,,,,,,,,[],,,,
1427013220456357895,1427013220456357895,2021-08-15 18:03:59 -0300,2021-08-15,18:03:59,-300,1071160842543136769,ltrutis,Loester Trutis,,Defender sua residência e sua família é um direito inegociável.  https://t.co/umsBhcqMus,pt,[],['https://www.instagram.com/p/CSnAWAElDCU/?utm_medium=twitter'],[],8,0,0,[],[],https://twitter.com/LTrutis/status/1427013220456357895,False,,0,,,,,,,,[],,,,
1418607189363544067,1418607189363544067,2021-07-23 13:21:25 -0300,2021-07-23,13:21:25,-300,1071160842543136769,ltrutis,Loester Trutis,,SIGO TRABALHANDO!  https://t.co/x1r2bqgEgs,pt,[],['https://www.instagram.com/p/CRZbkEKBhj8/?utm_medium=twitter'],[],13,0,1,[],[],https://twitter.com/LTrutis/status/1418607189363544067,False,,0,,,,,,,,[],,,,
1417274946515083265,1417274946515083265,2021-07-19 21:07:33 -0300,2021-07-19,21:07:33,-300,1071160842543136769,ltrutis,Loester Trutis,,O resto é historinha.  https://t.co/S6QdC6DNR4,pt,[],['https://www.instagram.com/p/CRhz4yOBXls/?utm_medium=twitter'],[],1,0,0,[],[],https://twitter.com/LTrutis/status/1417274946515083265,False,,0,,,,,,,,[],,,,
1416527560435912704,1416527560435912704,2021-07-17 19:37:42 -0300,2021-07-17,19:37:42,-300,1071160842543136769,ltrutis,Loester Trutis,,"A lista é grande. Agora pra trás, nem pra pegar impulso.  https://t.co/MyCsk0WTYC",pt,[],['https://www.instagram.com/p/CQT5-cjB3ov/?utm_medium=twitter'],[],0,0,1,[],[],https://twitter.com/LTrutis/status/1416527560435912704,False,,0,,,,,,,,[],,,,
1412548294170001417,1412548294170001417,2021-07-06 20:05:31 -0300,2021-07-06,20:05:31,-300,1071160842543136769,ltrutis,Loester Trutis,,"Nossa @terezacristinams verdadeira força da mulher sul-mato-grossense, se Deus quiser, nossa futura Senadora e essa sim, base do nosso presidente em 2023.  https://t.co/IPgPti42C4",pt,[],['https://www.instagram.com/p/CRAOdDEhzpu/?utm_medium=twitter'],[],6,1,2,[],[],https://twitter.com/LTrutis/status/1412548294170001417,False,,0,,,,,,,,[],,,,
1410760402535813126,1410760402535813126,2021-07-01 21:41:05 -0300,2021-07-01,21:41:05,-300,1071160842543136769,ltrutis,Loester Trutis,,Acabou de publicar uma foto  https://t.co/dxnL6Z8SdY,pt,[],['https://www.instagram.com/p/CNjDb-sh1xy/?utm_medium=twitter'],[],0,0,0,[],[],https://twitter.com/LTrutis/status/1410760402535813126,False,,0,,,,,,,,[],,,,
1410226221263294465,1410226221263294465,2021-06-30 10:18:26 -0300,2021-06-30,10:18:26,-300,1071160842543136769,ltrutis,Loester Trutis,,"Post no Facebook é mole, agora na hora que o pau come no plenário, hora que a oposição vem pra guerra ou tentar ludibriar com o canto da sereia, aí cada parlamentar mostra seu valor, dia após dia.  https://t.co/rXLNeRSdWX",pt,[],['https://www.instagram.com/p/CQvuf1ABIj4/?utm_medium=twitter'],[],4,0,1,[],[],https://twitter.com/LTrutis/status/1410226221263294465,False,,0,,,,,,,,[],,,,
1409657332015910913,1409657332015910913,2021-06-28 20:37:52 -0300,2021-06-28,20:37:52,-300,1071160842543136769,ltrutis,Loester Trutis,,Hoje ficou bem claro que: Bandido solto gera violência. Bandido preso gera gastos. Bandido morto gera paz.,pt,[],[],[],3,0,7,[],[],https://twitter.com/LTrutis/status/1409657332015910913,False,,0,,,,,,,,[],,,,
1407861528985063434,1407861528985063434,2021-06-23 21:41:59 -0300,2021-06-23,21:41:59,-300,1071160842543136769,ltrutis,Loester Trutis,,Acabou de publicar uma foto  https://t.co/ymJgPfiO7n,pt,[],['https://www.instagram.com/p/CQe7KaBhe7o/?utm_medium=twitter'],[],2,0,1,[],[],https://twitter.com/LTrutis/status/1407861528985063434,False,,0,,,,,,,,[],,,,
1407797677023182850,1407796238632751110,2021-06-23 17:28:16 -0300,2021-06-23,17:28:16,-300,1071160842543136769,ltrutis,Loester Trutis,,@WilToTheWild Qual deles vacinou em números absolutos mais que o Brasil?,pt,[],[],[],2,0,1,[],[],https://twitter.com/LTrutis/status/1407797677023182850,False,,0,,,,,,,,"[{'screen_name': 'WilToTheWild', 'name': 'Viúvo do Gil do Vigor', 'id': '333672214'}]",,,,
1407796238632751110,1407796238632751110,2021-06-23 17:22:33 -0300,2021-06-23,17:22:33,-300,1071160842543136769,ltrutis,Loester Trutis,,"Se o Bolsonaro é o genocida responsável pelas mortes de 505k brasileiros, quem é o responsável pelas mortes de mais de 600k americanos? Quem são os responsáveis pelas mais de 700k mortes na União Européia, que tem a metade do território brasileiro e 200k mortes a mais?",pt,[],[],[],5,0,9,[],[],https://twitter.com/LTrutis/status/1407796238632751110,False,,0,,,,,,,,[],,,,
1405228466551799813,1405228466551799813,2021-06-16 15:19:08 -0300,2021-06-16,15:19:08,-300,1071160842543136769,ltrutis,Loester Trutis,,Acabou de publicar uma foto  https://t.co/k2naJu0MKA,pt,[],['https://www.instagram.com/p/CQMNx6iByl7/?utm_medium=twitter'],[],28,0,0,[],[],https://twitter.com/LTrutis/status/1405228466551799813,False,,0,,,,,,,,[],,,,
1404772033897111552,1404772033897111552,2021-06-15 09:05:26 -0300,2021-06-15,09:05:26,-300,1071160842543136769,ltrutis,Loester Trutis,,Acabou de publicar um vídeo  https://t.co/ynfBNlOUgp,pt,[],['https://www.instagram.com/p/CQI-CYUBNov/?utm_medium=twitter'],[],2,0,0,[],[],https://twitter.com/LTrutis/status/1404772033897111552,False,,0,,,,,,,,[],,,,
1404542187099074570,1404542187099074570,2021-06-14 17:52:07 -0300,2021-06-14,17:52:07,-300,1071160842543136769,ltrutis,Loester Trutis,,Acabou de publicar uma foto  https://t.co/yv4xKzvSKF,pt,[],['https://www.instagram.com/p/CQHVszOhW-Y/?utm_medium=twitter'],[],2,0,1,[],[],https://twitter.com/LTrutis/status/1404542187099074570,False,,0,,,,,,,,[],,,,
1403838286087524357,1403838286087524357,2021-06-12 19:15:04 -0300,2021-06-12,19:15:04,-300,1071160842543136769,ltrutis,Loester Trutis,,Mas segundo Globo e DataPTfolha foram  alguns gatos pingandos.  https://t.co/30T3fjBFhZ,pt,[],['https://www.instagram.com/p/CQCVmfshLyT/?utm_medium=twitter'],[],4,0,1,[],[],https://twitter.com/LTrutis/status/1403838286087524357,False,,0,,,,,,,,[],,,,
1403514539518349322,1403514539518349322,2021-06-11 21:48:36 -0300,2021-06-11,21:48:36,-300,1071160842543136769,ltrutis,Loester Trutis,,"Atendendo pedidos, dia 12/06 vai rolar um vídeo ensinando fazer Rosas de Bacon lá na página @familiatrutis  E Feliz dia do Namorados. em Vila Carlota  https://t.co/mX9gV8m03k",pt,[],['https://www.instagram.com/p/CQACYPZBsgI/?utm_medium=twitter'],[],1,1,1,[],[],https://twitter.com/LTrutis/status/1403514539518349322,False,,0,,,,,,,,[],,,,
1403476789566087168,1403476789566087168,2021-06-11 19:18:36 -0300,2021-06-11,19:18:36,-300,1071160842543136769,ltrutis,Loester Trutis,,Nunca será! Hahaha  https://t.co/XrR3u8ud9s,pt,[],['https://www.instagram.com/p/CP_xNh8BIJh/?utm_medium=twitter'],[],2,0,0,[],[],https://twitter.com/LTrutis/status/1403476789566087168,False,,0,,,,,,,,[],,,,
1402776571560271873,1402776571560271873,2021-06-09 20:56:11 -0300,2021-06-09,20:56:11,-300,1071160842543136769,ltrutis,Loester Trutis,,"Nosso estado está diante uma oportunidade única, vamos lutar com unhas e dentes para que todo sul-mato-grossense seja vacinado.  https://t.co/MrpcaFnIE2",pt,[],['https://www.instagram.com/p/CP6yyakhwdz/?utm_medium=twitter'],[],2,0,2,[],[],https://twitter.com/LTrutis/status/1402776571560271873,False,,0,,,,,,,,[],,,,
1400903922915610631,1400903922915610631,2021-06-04 16:54:57 -0300,2021-06-04,16:54:57,-300,1071160842543136769,ltrutis,Loester Trutis,,Acabou de publicar uma foto em Aero Rancho  https://t.co/SuJOne8Pwy,pt,[],['https://www.instagram.com/p/CPtfNLehXvB/?utm_medium=twitter'],[],1,0,0,[],[],https://twitter.com/LTrutis/status/1400903922915610631,False,,0,,,,,,,,[],,,,
1400857746094833664,1400857746094833664,2021-06-04 13:51:28 -0300,2021-06-04,13:51:28,-300,1071160842543136769,ltrutis,Loester Trutis,,Acabou de publicar uma foto  https://t.co/FwNr8GFvQf,pt,[],['https://www.instagram.com/p/CPtKNRBh8BF/?utm_medium=twitter'],[],0,0,1,[],[],https://twitter.com/LTrutis/status/1400857746094833664,False,,0,,,,,,,,[],,,,
1399819205592113154,1399819205592113154,2021-06-01 17:04:40 -0300,2021-06-01,17:04:40,-300,1071160842543136769,ltrutis,Loester Trutis,,Acabou de publicar uma foto  https://t.co/SH2J4h5Tm8,pt,[],['https://www.instagram.com/p/CPlx79Yhef4/?utm_medium=twitter'],[],0,0,1,[],[],https://twitter.com/LTrutis/status/1399819205592113154,False,,0,,,,,,,,[],,,,
1399494308605091845,1399494308605091845,2021-05-31 19:33:39 -0300,2021-05-31,19:33:39,-300,1071160842543136769,ltrutis,Loester Trutis,,Sigo trabalhando.  https://t.co/1wxNEKbnTK,pt,[],['https://www.instagram.com/p/CPjeMBVhlH5/?utm_medium=twitter'],[],0,0,0,[],[],https://twitter.com/LTrutis/status/1399494308605091845,False,,0,,,,,,,,[],,,,
1398343202504118275,1398343202504118275,2021-05-28 15:19:34 -0300,2021-05-28,15:19:34,-300,1071160842543136769,ltrutis,Loester Trutis,,"Aos homens e mulheres desse departamento, o meu muito obrigado. Força e Honra.  https://t.co/idMkmw2F5V",pt,[],['https://www.instagram.com/p/CPbSubIhv9Q/?utm_medium=twitter'],[],0,0,1,[],[],https://twitter.com/LTrutis/status/1398343202504118275,False,,0,,,,,,,,[],,,,
1397552708157165568,1397552708157165568,2021-05-26 10:58:25 -0300,2021-05-26,10:58:25,-300,1071160842543136769,ltrutis,Loester Trutis,,Acabou de publicar uma foto  https://t.co/XEjLHYlcWA,pt,[],['https://www.instagram.com/p/CPVrP9mhzm7/?utm_medium=twitter'],[],1,0,1,[],[],https://twitter.com/LTrutis/status/1397552708157165568,False,,0,,,,,,,,[],,,,
1397321079375470593,1397321079375470593,2021-05-25 19:38:00 -0300,2021-05-25,19:38:00,-300,1071160842543136769,ltrutis,Loester Trutis,,Acabou de publicar uma foto  https://t.co/zVJ2kNGogm,pt,[],['https://www.instagram.com/p/CPUB6wKh-3g/?utm_medium=twitter'],[],0,0,2,[],[],https://twitter.com/LTrutis/status/1397321079375470593,False,,0,,,,,,,,[],,,,
1397290189068898311,1397290189068898311,2021-05-25 17:35:16 -0300,2021-05-25,17:35:16,-300,1071160842543136769,ltrutis,Loester Trutis,,"Parabéns ""Seu Merda""  Reza a lenda que cada compartilhamento faz 05 esquerdistas chorarem.  https://t.co/uXApITXUWD",pt,[],['https://www.instagram.com/p/CPTz3qxBuPa/?utm_medium=twitter'],[],0,0,0,[],[],https://twitter.com/LTrutis/status/1397290189068898311,False,,0,,,,,,,,[],,,,
1396900929379737606,1396900929379737606,2021-05-24 15:48:29 -0300,2021-05-24,15:48:29,-300,1071160842543136769,ltrutis,Loester Trutis,,Acabou de publicar uma foto em Câmara Municipal de Campo Grande - MS  https://t.co/fAoHDwm2GZ,pt,[],['https://www.instagram.com/p/CPRC2uehVDN/?utm_medium=twitter'],[],0,1,1,[],[],https://twitter.com/LTrutis/status/1396900929379737606,False,,0,,,,,,,,[],,,,
1396198885454929921,1396198885454929921,2021-05-22 17:18:49 -0300,2021-05-22,17:18:49,-300,1071160842543136769,ltrutis,Loester Trutis,,O melhor abraço do mundo! em Vila Carlota  https://t.co/dCAzBf3bkQ,pt,[],['https://www.instagram.com/p/CPMDmxAhiMy/?utm_medium=twitter'],[],0,0,1,[],[],https://twitter.com/LTrutis/status/1396198885454929921,False,,0,,,,,,,,[],,,,
1396118474938855424,1396118474938855424,2021-05-22 11:59:17 -0300,2021-05-22,11:59:17,-300,1071160842543136769,ltrutis,Loester Trutis,,"Ritmoooo, é Ritmo de festaaa, Ritmoooo...  https://t.co/RLvqlwBtkx",it,[],['https://www.instagram.com/p/CPLfCXxhhnC/?utm_medium=twitter'],[],1,0,2,[],[],https://twitter.com/LTrutis/status/1396118474938855424,False,,0,,,,,,,,[],,,,
1395504977670549507,1395504977670549507,2021-05-20 19:21:28 -0300,2021-05-20,19:21:28,-300,1071160842543136769,ltrutis,Loester Trutis,,Chega de censura por opinião em território brasileiro.  https://t.co/IUycesiUTY,pt,[],['https://www.instagram.com/p/CPHIDZ2Blhv/?utm_medium=twitter'],[],0,0,1,[],[],https://twitter.com/LTrutis/status/1395504977670549507,False,,0,,,,,,,,[],,,,
1395455322467225606,1395455322467225606,2021-05-20 16:04:09 -0300,2021-05-20,16:04:09,-300,1071160842543136769,ltrutis,Loester Trutis,,Aos mestres com carinho. Obrigado por orientarem nossas crianças.  https://t.co/xAKl94Ivy0,pt,[],['https://www.instagram.com/p/CPGxeLBBLsT/?utm_medium=twitter'],[],0,0,0,[],[],https://twitter.com/LTrutis/status/1395455322467225606,False,,0,,,,,,,,[],,,,
1395420468342104068,1395420468342104068,2021-05-20 13:45:39 -0300,2021-05-20,13:45:39,-300,1071160842543136769,ltrutis,Loester Trutis,,"Menos um pra tomar vacina paga com nosso imposto. Vagabundo solto gera violência, preso gera gastos, morto gera paz.  https://t.co/5qJyf04fgm",pt,[],['https://www.instagram.com/p/CPGhns-BZgs/?utm_medium=twitter'],[],1,0,3,[],[],https://twitter.com/LTrutis/status/1395420468342104068,False,,0,,,,,,,,[],,,,
1394791984171294726,1394791984171294726,2021-05-18 20:08:17 -0300,2021-05-18,20:08:17,-300,1071160842543136769,ltrutis,Loester Trutis,,Meus impostos sendo bem gastos.  https://t.co/Xp57ufcPPa,pt,[],['https://www.instagram.com/p/CPCD0cABekW/?utm_medium=twitter'],[],2,0,2,[],[],https://twitter.com/LTrutis/status/1394791984171294726,False,,0,,,,,,,,[],,,,
1394702920860438533,1394702920860438533,2021-05-18 14:14:23 -0300,2021-05-18,14:14:23,-300,1071160842543136769,ltrutis,Loester Trutis,,Acabou de publicar uma foto  https://t.co/4desZ1Feyy,pt,[],['https://www.instagram.com/p/CPBbUUxhEKn/?utm_medium=twitter'],[],0,0,0,[],[],https://twitter.com/LTrutis/status/1394702920860438533,False,,0,,,,,,,,[],,,,
1394379846504091648,1394379846504091648,2021-05-17 16:50:36 -0300,2021-05-17,16:50:36,-300,1071160842543136769,ltrutis,Loester Trutis,,"Esse pessoal do MBL vulgo Movimento Bumbum Livre, são assim, memória curta, demagogia. Já foram Tô Time do Cunha, depois Time Maia, agora são Time ForoBolso. Caça likes.  https://t.co/8PFJueukHC",pt,[],['https://www.instagram.com/p/CO_IYU8h1C4/?igshid=gq4h1911zoc5'],[],1,2,3,[],[],https://twitter.com/LTrutis/status/1394379846504091648,False,,0,,,,,,,,[],,,,
1393967903125409799,1393967903125409799,2021-05-16 13:33:41 -0300,2021-05-16,13:33:41,-300,1071160842543136769,ltrutis,Loester Trutis,,"Obrigado Deus, pelo filho abençoado que tenho.  https://t.co/QPjZ6BEOha",pt,[],['https://www.instagram.com/p/CO8NEnYho1m/?igshid=1s29suqk22167'],[],0,0,1,[],[],https://twitter.com/LTrutis/status/1393967903125409799,False,,0,,,,,,,,[],,,,
1393556288794238976,1393556288794238976,2021-05-15 10:18:04 -0300,2021-05-15,10:18:04,-300,1071160842543136769,ltrutis,Loester Trutis,,"Acabou de publicar uma foto em Carlota, Campo Grande  https://t.co/A7v1B63SBO",pt,[],['https://www.instagram.com/p/CO5R458h2UG/?igshid=1eood5ts77e69'],[],1,0,1,[],[],https://twitter.com/LTrutis/status/1393556288794238976,False,,0,,,,,,,,[],,,,
1393287170442543109,1393287170442543109,2021-05-14 16:28:42 -0300,2021-05-14,16:28:42,-300,1071160842543136769,ltrutis,Loester Trutis,,Acabou de publicar uma foto  https://t.co/WPXpeLe0l0,pt,[],['https://www.instagram.com/p/CO3Xgf_h7rO/?igshid=10f14hj4g66rf'],[],0,0,0,[],[],https://twitter.com/LTrutis/status/1393287170442543109,False,,0,,,,,,,,[],,,,
