id,conversation_id,created_at,date,time,timezone,user_id,username,name,place,tweet,language,mentions,urls,photos,replies_count,retweets_count,likes_count,hashtags,cashtags,link,retweet,quote_url,video,thumbnail,near,geo,source,user_rt_id,user_rt,retweet_id,reply_to,retweet_date,translate,trans_src,trans_dest
1392552661560475661,1392552661560475661,2021-05-12 15:50:01 -0300,2021-05-12,15:50:01,-300,1071160842543136769,ltrutis,Loester Trutis,,"Valorizar a vida de policiais passa pelo equipamentos de ponta adquidos pelas minhas emendas individuais, mas tb pelas políticas públicas de saúde psicológica e prevenção ao suicídio. Sigo trabalhando.  https://t.co/K5iaGCqGNh",pt,[],['https://www.instagram.com/p/COyJfgwBh-m/?igshid=139fllxg1669y'],[],0,0,2,[],[],https://twitter.com/LTrutis/status/1392552661560475661,False,,0,,,,,,,,[],,,,
1392524855560507392,1392524855560507392,2021-05-12 13:59:32 -0300,2021-05-12,13:59:32,-300,1071160842543136769,ltrutis,Loester Trutis,,"Sem enfermagem, não há cuidados.  https://t.co/TPmEB5gJA7",pt,[],['https://www.instagram.com/p/COx82ShhlBB/?igshid=1202oqe7x5gmu'],[],0,0,1,[],[],https://twitter.com/LTrutis/status/1392524855560507392,False,,0,,,,,,,,[],,,,
1392162406281977858,1392162406281977858,2021-05-11 13:59:17 -0300,2021-05-11,13:59:17,-300,1071160842543136769,ltrutis,Loester Trutis,,Acabou de publicar uma foto  https://t.co/FHqcnkQiPh,pt,[],['https://www.instagram.com/p/COvYBpehi7D/?igshid=5xvt9mcy8gfs'],[],1,0,0,[],[],https://twitter.com/LTrutis/status/1392162406281977858,False,,0,,,,,,,,[],,,,
1391521596855263239,1391521596855263239,2021-05-09 19:32:56 -0300,2021-05-09,19:32:56,-300,1071160842543136769,ltrutis,Loester Trutis,,Acabou de publicar uma foto  https://t.co/n82ilLekqD,pt,[],['https://www.instagram.com/p/COq0ntmB_aU/?igshid=x4ixccn248cv'],[],1,0,1,[],[],https://twitter.com/LTrutis/status/1391521596855263239,False,,0,,,,,,,,[],,,,
1391510254651904000,1391510254651904000,2021-05-09 18:47:52 -0300,2021-05-09,18:47:52,-300,1071160842543136769,ltrutis,Loester Trutis,,"INACREDITÁVEL E ABSURDO Hj subiu pra 29 o número de traficantes mortos pelo CORE da Polícia Civil no Jacarezinho, inadmissível! Não acredito que o BOPE da PM/RJ ficará pra trás e vai perder pra essa marca. Força guerreiros, acredito no potencial de vocês, vamos dobrar essa meta?",pt,[],[],[],0,0,6,[],[],https://twitter.com/LTrutis/status/1391510254651904000,False,,0,,,,,,,,[],,,,
1391093644686471169,1391093644686471169,2021-05-08 15:12:24 -0300,2021-05-08,15:12:24,-300,1071160842543136769,ltrutis,Loester Trutis,,Acabou de publicar uma foto  https://t.co/3ya7M6Pqdy,pt,[],['https://www.instagram.com/p/COnyAnlhZiD/?igshid=1qx02ekl9xjrc'],[],0,0,0,[],[],https://twitter.com/LTrutis/status/1391093644686471169,False,,0,,,,,,,,[],,,,
1390509441296912385,1390509441296912385,2021-05-07 00:30:59 -0300,2021-05-07,00:30:59,-300,1071160842543136769,ltrutis,Loester Trutis,,"Um amigo, um policial exemplar. Ainda estou sem acreditar. em Mato Grosso do Sul  https://t.co/RYbR7kwB44",pt,[],['https://www.instagram.com/p/COjoWC7h6H7/?igshid=1j33zoqymhouo'],[],0,1,2,[],[],https://twitter.com/LTrutis/status/1390509441296912385,False,,0,,,,,,,,[],,,,
1390367217804525578,1390367217804525578,2021-05-06 15:05:51 -0300,2021-05-06,15:05:51,-300,1071160842543136769,ltrutis,Loester Trutis,,"Quem não quiser levar bala, não entre em terra alheia.  O direito à proteção da vida e da propriedade privada é algo natural e sagrado.  https://t.co/FvTn23MVFR",pt,[],['https://www.instagram.com/p/COinqx-B9ok/?igshid=1hfr9d44hs6im'],[],0,0,1,[],[],https://twitter.com/LTrutis/status/1390367217804525578,False,,0,,,,,,,,[],,,,
1389317391696502785,1389317391696502785,2021-05-03 17:34:13 -0300,2021-05-03,17:34:13,-300,1071160842543136769,ltrutis,Loester Trutis,,"Deixe sua risada pro peba de hj. em Carlota, Campo Grande  https://t.co/eANEaVSHKQ",pt,[],['https://www.instagram.com/p/CObKQzlBJxn/?igshid=1cfroryahs4cg'],[],0,1,1,[],[],https://twitter.com/LTrutis/status/1389317391696502785,False,,0,,,,,,,,[],,,,
1388240320102486019,1388240320102486019,2021-04-30 18:14:19 -0300,2021-04-30,18:14:19,-300,1071160842543136769,ltrutis,Loester Trutis,,Acabou de publicar uma foto em Vila Carlota  https://t.co/rCF63ITVFm,pt,[],['https://www.instagram.com/p/COTgdy3B2w9/?igshid=ntoeh3ybjedq'],[],0,0,0,[],[],https://twitter.com/LTrutis/status/1388240320102486019,False,,0,,,,,,,,[],,,,
1388156946583334919,1388156946583334919,2021-04-30 12:43:01 -0300,2021-04-30,12:43:01,-300,1071160842543136769,ltrutis,Loester Trutis,,Acabou de publicar uma foto  https://t.co/MefFQrDvOO,pt,[],['https://www.instagram.com/p/COS6jYPhtPO/?igshid=pe9hr2dpdx6m'],[],1,0,0,[],[],https://twitter.com/LTrutis/status/1388156946583334919,False,,0,,,,,,,,[],,,,
1387052902087372808,1387052902087372808,2021-04-27 11:35:56 -0300,2021-04-27,11:35:56,-300,1071160842543136769,ltrutis,Loester Trutis,,Acabou de publicar uma foto  https://t.co/qerLAIyLaG,pt,[],['https://www.instagram.com/p/COLEfjthr9h/?igshid=1lh1e41yu56wn'],[],0,0,0,[],[],https://twitter.com/LTrutis/status/1387052902087372808,False,,0,,,,,,,,[],,,,
1386770930312040451,1386770930312040451,2021-04-26 16:55:29 -0300,2021-04-26,16:55:29,-300,1071160842543136769,ltrutis,Loester Trutis,,Acabou de publicar uma foto  https://t.co/tuUlu7CqWL,pt,[],['https://www.instagram.com/p/COJERFMhjTx/?igshid=1nw8vju85f2x8'],[],0,0,0,[],[],https://twitter.com/LTrutis/status/1386770930312040451,False,,0,,,,,,,,[],,,,
1386680156929073154,1386680156929073154,2021-04-26 10:54:47 -0300,2021-04-26,10:54:47,-300,1071160842543136769,ltrutis,Loester Trutis,,Acabou de publicar uma foto  https://t.co/qJIJuppgx5,pt,[],['https://www.instagram.com/p/COIa_V-B6fu/?igshid=1mz9f5wztex1p'],[],0,0,0,[],[],https://twitter.com/LTrutis/status/1386680156929073154,False,,0,,,,,,,,[],,,,
1384935236878864384,1384935236878864384,2021-04-21 15:21:05 -0300,2021-04-21,15:21:05,-300,1071160842543136769,ltrutis,Loester Trutis,,Acabou de publicar uma foto  https://t.co/HzVXf7BZBQ,pt,[],['https://www.instagram.com/p/CN8BfInBZXI/?igshid=1okkmcodnbrtu'],[],0,0,0,[],[],https://twitter.com/LTrutis/status/1384935236878864384,False,,0,,,,,,,,[],,,,
1384605753076436997,1384605753076436997,2021-04-20 17:31:50 -0300,2021-04-20,17:31:50,-300,1071160842543136769,ltrutis,Loester Trutis,,Acabou de publicar uma foto  https://t.co/12i3OFGhaT,pt,[],['https://www.instagram.com/p/CN5rqF4Ba1s/?igshid=60b2ut21lcoz'],[],0,0,1,[],[],https://twitter.com/LTrutis/status/1384605753076436997,False,,0,,,,,,,,[],,,,
1384273032802226180,1384273032802226180,2021-04-19 19:29:44 -0300,2021-04-19,19:29:44,-300,1071160842543136769,ltrutis,Loester Trutis,,"Acabou de publicar uma foto em Carlota, Campo Grande  https://t.co/gIxYx2gaGG",pt,[],['https://www.instagram.com/p/CN3UWhbh9Ap/?igshid=1az0b0u2vxzik'],[],0,0,3,[],[],https://twitter.com/LTrutis/status/1384273032802226180,False,,0,,,,,,,,[],,,,
1384216204512882694,1384216204512882694,2021-04-19 15:43:55 -0300,2021-04-19,15:43:55,-300,1071160842543136769,ltrutis,Loester Trutis,,"Acabou de publicar uma foto em Carlota, Campo Grande  https://t.co/kjWq5nwL4W",pt,[],['https://www.instagram.com/p/CN26Kwjh5XA/?igshid=15inzt3bt3mlv'],[],0,1,0,[],[],https://twitter.com/LTrutis/status/1384216204512882694,False,,0,,,,,,,,[],,,,
1384128146639769602,1384128146639769602,2021-04-19 09:54:00 -0300,2021-04-19,09:54:00,-300,1071160842543136769,ltrutis,Loester Trutis,,Acabou de publicar uma foto  https://t.co/iZ7C358Vy4,pt,[],['https://www.instagram.com/p/CN2Sd4FBDf1/?igshid=1qyj18ecspfqa'],[],0,0,1,[],[],https://twitter.com/LTrutis/status/1384128146639769602,False,,0,,,,,,,,[],,,,
1383549835731636233,1383549835731636233,2021-04-17 19:36:00 -0300,2021-04-17,19:36:00,-300,1071160842543136769,ltrutis,Loester Trutis,,Acabou de publicar uma foto  https://t.co/VXnfXVjLQU,pt,[],['https://www.instagram.com/p/CNyLe5-hQhF/?igshid=jlrqncooz5d9'],[],1,0,4,[],[],https://twitter.com/LTrutis/status/1383549835731636233,False,,0,,,,,,,,[],,,,
1383455380366188544,1383455380366188544,2021-04-17 13:20:40 -0300,2021-04-17,13:20:40,-300,1071160842543136769,ltrutis,Loester Trutis,,Acabou de publicar uma foto  https://t.co/nL5qseDB0x,pt,[],['https://www.instagram.com/p/CNxghh1hmcK/?igshid=14tzlf5w77bo7'],[],0,0,1,[],[],https://twitter.com/LTrutis/status/1383455380366188544,False,,0,,,,,,,,[],,,,
1382786313548492801,1382786313548492801,2021-04-15 17:02:02 -0300,2021-04-15,17:02:02,-300,1071160842543136769,ltrutis,Loester Trutis,,Acabou de publicar uma foto  https://t.co/dnc9qjpi3b,pt,[],['https://www.instagram.com/p/CNswRPvBKD8/?igshid=57amo8k02g06'],[],0,0,1,[],[],https://twitter.com/LTrutis/status/1382786313548492801,False,,0,,,,,,,,[],,,,
1382775209724366848,1382775209724366848,2021-04-15 16:17:55 -0300,2021-04-15,16:17:55,-300,1071160842543136769,ltrutis,Loester Trutis,,"Quem tem C# tem medo. Já tem Governadores e Prefeitos  sentados encima dos números, pensando como esconder as merdas que fizerem....No que depender do governo federal e nós da sua base, não vão.  https://t.co/ThCcYfMATz",pt,[],['https://www.instagram.com/p/CNsq4rhh74Z/?igshid=1882wpj583w40'],[],3,2,1,[],[],https://twitter.com/LTrutis/status/1382775209724366848,False,,0,,,,,,,,[],,,,
1382491437854523398,1382491437854523398,2021-04-14 21:30:18 -0300,2021-04-14,21:30:18,-300,1071160842543136769,ltrutis,Loester Trutis,,"Quanto ao caso Henry: Acredito que só pena de morte para essa ""mãe e padrasto dos infernos seria o justo. Infelizmente os nádegas flácidas da constituinte de 88 proibiram até a discussão sobre o assunto. Uma pena, em qq país sério, injeção letal pra esses monstros era o mínimo.",pt,[],[],[],2,0,9,[],[],https://twitter.com/LTrutis/status/1382491437854523398,False,,0,,,,,,,,[],,,,
1382049777748152327,1382049777748152327,2021-04-13 16:15:18 -0300,2021-04-13,16:15:18,-300,1071160842543136769,ltrutis,Loester Trutis,,"Uma CPI do Covid que quer ""investigar"" apenas quem repassou o dinheiro e isentar quem recebeu é no mínimo tendênciosa. O dinheiro público tem duas pontas: Quem envia e quem recebe. Só analisando cada centavo, de ambos os lados saberemos a verdade. Queremos INVESTIGAÇÃO TOTAL!",pt,[],[],[],1,1,9,[],[],https://twitter.com/LTrutis/status/1382049777748152327,False,,0,,,,,,,,[],,,,
1381651575622541316,1381651575622541316,2021-04-12 13:53:00 -0300,2021-04-12,13:53:00,-300,1071160842543136769,ltrutis,Loester Trutis,,"Se durante as eleições você saiu pra rua, distribuiu santinho, fez carreta, foi em caminhada entregando panfletos participou de reuniões políticas... Não venha criticar quem quer igrejas abertas. Hipocrisia não é só pecado, é falta de caráter tb.",pt,[],[],[],2,2,10,[],[],https://twitter.com/LTrutis/status/1381651575622541316,False,,0,,,,,,,,[],,,,
1379931586163007488,1379822342625505284,2021-04-07 19:58:22 -0300,2021-04-07,19:58:22,-300,1071160842543136769,ltrutis,Loester Trutis,,@htsnet Eu sugeri congelamento de salários de deputados e senadores. Corte de 50% da cota tudo em projeto de lei e ainda a  inclusão do congresso e judiciário na reforma administrativa,pt,[],[],[],1,0,0,[],[],https://twitter.com/LTrutis/status/1379931586163007488,False,,0,,,,,,,,"[{'screen_name': 'htsnet', 'name': 'Hamilton T Silva', 'id': '32129707'}]",,,,
1379894146048081922,1379894146048081922,2021-04-07 17:29:36 -0300,2021-04-07,17:29:36,-300,1071160842543136769,ltrutis,Loester Trutis,,"A extrema imprensa censurou o terno VIRUS CHINÊS, mesmo que  o Covid19 tenha surgido em Wuhan na China, mas insiste em usar o termo:  ""Variante brasileira do Covid"" para a cepa mais contagiosa da doença. Pra vc é má fé ou só síndrome de vira latas mesmo?",pt,[],[],[],5,0,6,[],[],https://twitter.com/LTrutis/status/1379894146048081922,False,,0,,,,,,,,[],,,,
1378120137040142342,1378120137040142342,2021-04-02 20:00:19 -0300,2021-04-02,20:00:19,-300,1071160842543136769,ltrutis,Loester Trutis,,"Quando os EUA aplicaram 01 Milhão de doses de vacina dia, a extrema imprensa deu pulos orgasmáticos, disserem que Biden era o presidente mais competente do mundo. Hj o Governo Bolsonaro aplicou 1.095.362 doses, 2° país no mundo a atingir a marca em 24hs.  Impressa em silêncio!",pt,[],[],[],3,2,19,[],[],https://twitter.com/LTrutis/status/1378120137040142342,False,,0,,,,,,,,[],,,,
1372970988409864197,1372970988409864197,2021-03-19 14:59:26 -0300,2021-03-19,14:59:26,-300,1071160842543136769,ltrutis,Loester Trutis,,"Whatsapp, Instagram e Socialismo não estão funcionando!",pt,[],[],[],5,0,8,[],[],https://twitter.com/LTrutis/status/1372970988409864197,False,,0,,,,,,,,[],,,,
1370096808324648961,1370096808324648961,2021-03-11 16:38:28 -0300,2021-03-11,16:38:28,-300,1071160842543136769,ltrutis,Loester Trutis,,Não há como não ficar puto num país onde ladrões e assassinos presos terão prioridade nas vacinas e policiais e professores não.,pt,[],[],[],2,2,6,[],[],https://twitter.com/LTrutis/status/1370096808324648961,False,,0,,,,,,,,[],,,,
1367634463270842371,1367634463270842371,2021-03-04 21:34:00 -0300,2021-03-04,21:34:00,-300,1071160842543136769,ltrutis,Loester Trutis,,"Covid acabou nos EUA? Não! Você parou de ouvir sobre, pq um presidente de esquerda, John Biden (ala ideológica da imprensa viciada em verba estatal) foi eleito por lá. O caos gerado por eles da clique, like e audiência na TV. Quem não entende essa agenda, não entendeu nada.",pt,[],[],[],6,1,19,[],[],https://twitter.com/LTrutis/status/1367634463270842371,False,,0,,,,,,,,[],,,,
1366957312062222342,1366957312062222342,2021-03-03 00:43:14 -0300,2021-03-03,00:43:14,-300,1071160842543136769,ltrutis,Loester Trutis,,"A PF nesse momento está periciando o celular aprendido com Dep. Federal Daniel Silveira, o meu celular foi aprendido e aberto de forma arbitrária. Parece que os únicos celulares invioláveis são do Adélio Bispo e seus advogados caríssimos. Pq será?  Quem mandou matar Bolsonaro?",pt,[],[],[],6,1,18,[],[],https://twitter.com/LTrutis/status/1366957312062222342,False,,0,,,,,,,,[],,,,
1366432416928305163,1366432416928305163,2021-03-01 13:57:29 -0300,2021-03-01,13:57:29,-300,1071160842543136769,ltrutis,Loester Trutis,,"Hj fechei o orçamento federal individual, milhões em investimentos. Dos 29 vereadores de CG só 02 me procuraram pra conseguir verbas (Tiago Vargas/Prof. Juari). Será q os outros 27 já tem verba? Ñ tem projeto? Estão com medo da minha fiscalização? Ou ñ sabem o que faz o vereador?",pt,[],[],[],4,3,16,[],[],https://twitter.com/LTrutis/status/1366432416928305163,False,,0,,,,,,,,[],,,,
1326611178001494016,1326611178001494016,2020-11-11 16:42:06 -0300,2020-11-11,16:42:06,-300,1071160842543136769,ltrutis,Loester Trutis,,"Se o seu candidato ao invés de mostrar propostas e atacar a péssima gestão do atual prefeito, ele ataca o único candidato cristão que tem chance de ir pro segundo turno...ELE É UM BOSTA. Cuidado com a #direitafake",pt,[],[],[],102,0,12,['direitafake'],[],https://twitter.com/LTrutis/status/1326611178001494016,False,,0,,,,,,,,[],,,,
1325835312149520395,1325835312149520395,2020-11-09 13:19:05 -0300,2020-11-09,13:19:05,-300,1071160842543136769,ltrutis,Loester Trutis,,"A campanha do Marquinhos e da sua base deveria ser assim: ""Vou asfaltar as ruas que eu JÁ DEVERIA ter asfaltado, vou entregar as casas populares que eu JÁ DEVERIA ter entregue, vou reformar as UPAS que eu JÁ DEVERIA ter reformado, vou gerar os empregos que JÁ DEVERIA ter gerado.",pt,[],[],[],12,1,16,[],[],https://twitter.com/LTrutis/status/1325835312149520395,False,,0,,,,,,,,[],,,,
1303510226163961856,1303510226163961856,2020-09-08 22:47:10 -0300,2020-09-08,22:47:10,-300,1071160842543136769,ltrutis,Loester Trutis,,"Asfalto Ruim, IPTU Caro, UPA Sem Estrutura e  Taxas e mais Taxas. E os vereadores que deveriam fiscalizar, são todos amiguinhos do prefeito. Eu poderia estar falando de CG, mas se encaixa em qualquer cidade do interior do Mato Grosso do Sul. Muito difícil fiscalizar sozinho.",pt,[],[],[],31,3,34,[],[],https://twitter.com/LTrutis/status/1303510226163961856,False,,0,,,,,,,,[],,,,
1302344384218828802,1302344384218828802,2020-09-05 17:34:32 -0300,2020-09-05,17:34:32,-300,1071160842543136769,ltrutis,Loester Trutis,,Acabou de publicar uma foto  https://t.co/WPNzulNuWH,pt,[],['https://www.instagram.com/p/CExLhMBB4jy/?igshid=y1c6jdt4b0g7'],[],5,0,3,[],[],https://twitter.com/LTrutis/status/1302344384218828802,False,,0,,,,,,,,[],,,,
1292222294228639755,1292222294228639755,2020-08-08 19:12:57 -0300,2020-08-08,19:12:57,-300,1071160842543136769,ltrutis,Loester Trutis,,"No Brasil o cara que humilhou o motoboy tem problemas mentais, o Adélio tb, pedófilo é doente, funcionária do UPA que maltrata mães é bipolar, nóia ladrão é dependente químico, o traficante é vítima da sociedade, o GCM corrupto é vítima do sistema e o político ladrão é reeleito.",pt,[],[],[],11,5,24,[],[],https://twitter.com/LTrutis/status/1292222294228639755,False,,0,,,,,,,,[],,,,
1288179989653880840,1288179989653880840,2020-07-28 15:30:17 -0300,2020-07-28,15:30:17,-300,1071160842543136769,ltrutis,Loester Trutis,,"Quem determina Lockdown depois de 4 meses de quarentena, ou é corrupto ou incompetente. Não deu tempo de expandir o sistema de saúde? A quarentena não era pra isso? Aonde estão os milhões de reais que a União repassou pros municípios? Não deu tempo de fazer nada? 160 dias? Nada?",pt,[],[],[],17,25,68,[],[],https://twitter.com/LTrutis/status/1288179989653880840,False,,0,,,,,,,,[],,,,
1285297875551948801,1285297875551948801,2020-07-20 16:37:47 -0300,2020-07-20,16:37:47,-300,1071160842543136769,ltrutis,Loester Trutis,,"Aviso: Já que a pref. de CG ""não gosta"" de fiscalização surpresa: Quinta 31/07/20  vou fiscalizar farmácia e Raio-X das unids. de saúde do Jd. Leblon, Sta. Mônica, Cel. Antonino e Moreninhas Vai dar tempo maquiar, chama a GCM e tentar ajuizar pra impedir minha entrada. Boa Sorte.",pt,[],[],[],5,2,17,[],[],https://twitter.com/LTrutis/status/1285297875551948801,False,,0,,,,,,,,[],,,,
1285294520700145667,1285294520700145667,2020-07-20 16:24:28 -0300,2020-07-20,16:24:28,-300,1071160842543136769,ltrutis,Loester Trutis,,"Aviso: Já que a prefeitura de CG ""não gosta"" de fiscalização surpresa: Quinta 31/07/20 9hs da manhã, vou fiscalizar a farmácia e Raio-X das unidades de saúde do Jardim Leblon e Sta. Mônica. Vai dar tempo maquiar, chama a GCM e tentar ajuizar pra impedir minha entrada. Boa Sorte.",pt,[],[],[],6,4,28,[],[],https://twitter.com/LTrutis/status/1285294520700145667,False,,0,,,,,,,,[],,,,
1284509762378444800,1284509762378444800,2020-07-18 12:26:07 -0300,2020-07-18,12:26:07,-300,1071160842543136769,ltrutis,Loester Trutis,,"Já diria meu pai: ""Recuar, nem pra pegar impulso."" Então, sai da frente quem tem medo. Ninguém ficará para trás. O bicho vai pegar.",pt,[],[],[],2,3,17,[],[],https://twitter.com/LTrutis/status/1284509762378444800,False,,0,,,,,,,,[],,,,
1282926973103284224,1282926973103284224,2020-07-14 03:36:40 -0300,2020-07-14,03:36:40,-300,1071160842543136769,ltrutis,Loester Trutis,,"Anotem ai: Vários membros da Assembleia Lesgislativa MS e do Judiciário MS vão alegar Covid19 e pedir afastamento. Tudo para não se manifestarem sobre impeachment. Já tá tudo combinado, inclusive tem gente que vai se manifestar só na rede social, mas não no processo. Esperem.",pt,[],[],[],1,3,10,[],[],https://twitter.com/LTrutis/status/1282926973103284224,False,,0,,,,,,,,[],,,,
1280931627703635970,1280638198335578114,2020-07-08 15:27:53 -0300,2020-07-08,15:27:53,-300,1071160842543136769,ltrutis,Loester Trutis,,@BrunetThiago Não perco tempo falando sobre fake news. Sigo trabalhando.,pt,[],[],[],2,0,1,[],[],https://twitter.com/LTrutis/status/1280931627703635970,False,,0,,,,,,,,"[{'screen_name': 'BrunetThiago', 'name': 'Thiago.brunet', 'id': '1099680372458180608'}]",,,,
1280764023529668608,1280553931245002753,2020-07-08 04:21:53 -0300,2020-07-08,04:21:53,-300,1071160842543136769,ltrutis,Loester Trutis,,"@suckow_edinei @Amanda_PCruz Imbecil é quem se diz conservador, e não sabe que a competência jurídica do parlamentar é fiscalizar o executivo e não defender.",pt,[],[],[],2,0,0,[],[],https://twitter.com/LTrutis/status/1280764023529668608,False,,0,,,,,,,,"[{'screen_name': 'suckow_edinei', 'name': 'Edinei 🇧🇷 - Conservador do MS - 🇧🇷🇺🇸🇮🇱', 'id': '1104349148445372417'}, {'screen_name': 'Amanda_PCruz', 'name': 'Amanda Pereira', 'id': '992626344004595714'}]",,,,
1280638731196739586,1280553931245002753,2020-07-07 20:04:01 -0300,2020-07-07,20:04:01,-300,1071160842543136769,ltrutis,Loester Trutis,,@marcia_vozap38 Voto com o Povo.,pt,[],[],[],0,0,0,[],[],https://twitter.com/LTrutis/status/1280638731196739586,False,,0,,,,,,,,"[{'screen_name': 'marcia_vozap38', 'name': 'Marcia Vovó do TT e Zap', 'id': '4567642709'}]",,,,
1280638471573581825,1280553931245002753,2020-07-07 20:02:59 -0300,2020-07-07,20:02:59,-300,1071160842543136769,ltrutis,Loester Trutis,,@Amanda_PCruz Apoio o plano de governo e as bandeiras que também são minha antes da eleição. Agora não sou advogado de ninguém.,pt,[],[],[],2,0,0,[],[],https://twitter.com/LTrutis/status/1280638471573581825,False,,0,,,,,,,,"[{'screen_name': 'Amanda_PCruz', 'name': 'Amanda Pereira', 'id': '992626344004595714'}]",,,,
1280638198335578114,1280638198335578114,2020-07-07 20:01:54 -0300,2020-07-07,20:01:54,-300,1071160842543136769,ltrutis,Loester Trutis,,"Errei. Hoje eu chamei os deputados estaduais de bunda moles por não ter nenhum pra pedir impeachment do governador por lavagem de dinheiro e associação criminosa. Nem todos são bundas moles, teriam que ter molejo. Estão eu corrijo: Eles são RABO PRESO mesmo.",pt,[],[],[],7,0,19,[],[],https://twitter.com/LTrutis/status/1280638198335578114,False,,0,,,,,,,,[],,,,
1280553931245002753,1280553931245002753,2020-07-07 14:27:03 -0300,2020-07-07,14:27:03,-300,1071160842543136769,ltrutis,Loester Trutis,,"Acho que vou ter que chamar os deputados estaduais de Mato Grosso do Sul de BUNDA MOLES de novo. Não tem um com coragem de pedir o impeachment do governador  que a PF iniciou por corrupção e lavagem de dinheiro? Cara, nem um?",pt,[],[],[],9,5,34,[],[],https://twitter.com/LTrutis/status/1280553931245002753,False,,0,,,,,,,,[],,,,
1258504305725882372,1258504305725882372,2020-05-07 18:09:43 -0300,2020-05-07,18:09:43,-300,1071160842543136769,ltrutis,Loester Trutis,,"Enquanto a gente discute, eles avançam. Defender nossas bandeiras, combater a corrupção e fazer o Brasil crescer;  esse é o nosso foco! Sigo trabalhando.  https://t.co/cjTUNRtLvR",pt,[],['https://www.instagram.com/p/B_5rUx8BLqb/?igshid=1kttaf65na3e4'],[],14,1,13,[],[],https://twitter.com/LTrutis/status/1258504305725882372,False,,0,,,,,,,,[],,,,
1253407331272048640,1253407331272048640,2020-04-23 16:36:09 -0300,2020-04-23,16:36:09,-300,1071160842543136769,ltrutis,Loester Trutis,,Acabou de publicar uma foto  https://t.co/gostz99o54,pt,[],['https://www.instagram.com/p/B_VdhhNBN2n/?igshid=8gjeg4deqx3l'],[],9,0,9,[],[],https://twitter.com/LTrutis/status/1253407331272048640,False,,0,,,,,,,,[],,,,
1253359430240030727,1253359430240030727,2020-04-23 13:25:49 -0300,2020-04-23,13:25:49,-300,1071160842543136769,ltrutis,Loester Trutis,,"É preciso respeitar a história de um homem que envelhece em uma profissão que é  comum morrer jovem.  A polícia militar do MS é uma das mais eficientes e respeitadas do Brasil, mesmo não sendo tratada como tal por…  https://t.co/zCCnTbUqBf",pt,[],['https://www.instagram.com/p/B_VHvZ8hGiA/?igshid=19yo39cgcfiqj'],[],4,2,16,[],[],https://twitter.com/LTrutis/status/1253359430240030727,False,,0,,,,,,,,[],,,,
1231592747888455680,1231592747888455680,2020-02-23 11:52:47 -0300,2020-02-23,11:52:47,-300,1071160842543136769,ltrutis,Loester Trutis,,"Meu apoio incondicional aos nossos policiais honestos do Mato Grosso do Sul, em especial hoje ao Batalhão de Choque da Polícia Militar MS. Fazer a desobstrução de uma via e ser recebido com pedras e garrafas, DEVEM SIM reagir à altura para cumprir a missão. Parabéns!",pt,[],[],[],17,4,46,[],[],https://twitter.com/LTrutis/status/1231592747888455680,False,,0,,,,,,,,[],,,,
1223294603031470081,1223294603031470081,2020-01-31 14:18:55 -0300,2020-01-31,14:18:55,-300,1071160842543136769,ltrutis,Loester Trutis,,"Meus compromissos são: ser um dos melhores parlamentares da história do MS; enquanto viver defender o conservadorismo de direita, o sagrado direito à vida e à propriedade privada; a legítima defesa; a fé cristã; o…  https://t.co/qEFVVJ4oMG",pt,[],['https://www.instagram.com/p/B7_f1vqhF8E/?igshid=t3c819j3o1oe'],[],32,9,145,[],[],https://twitter.com/LTrutis/status/1223294603031470081,False,,0,,,,,,,,[],,,,
1209686610255785984,1209686610255785984,2019-12-25 01:05:37 -0300,2019-12-25,01:05:37,-300,1071160842543136769,ltrutis,Loester Trutis,,Acabou de publicar uma foto  https://t.co/8HqavigobT,pt,[],['https://www.instagram.com/p/B6ezpI0Bsfr/?igshid=1cry0esmyxi8a'],[],4,1,25,[],[],https://twitter.com/LTrutis/status/1209686610255785984,False,,0,,,,,,,,[],,,,
1202253011529150466,1202253011529150466,2019-12-04 12:47:09 -0300,2019-12-04,12:47:09,-300,1071160842543136769,ltrutis,Loester Trutis,,"Bandido solto geral violência, ferido gera vingança, preso gera despesas, MORTO GERA PAZ.  Deixe seus parabéns aos nossos heróis.  https://t.co/TUM6j1Cc8S",pt,[],['https://www.instagram.com/p/B5p_O7RB7yK/?igshid=ajyps3q8x351'],[],19,5,98,[],[],https://twitter.com/LTrutis/status/1202253011529150466,False,,0,,,,,,,,[],,,,
