id,conversation_id,created_at,date,time,timezone,user_id,username,name,place,tweet,language,mentions,urls,photos,replies_count,retweets_count,likes_count,hashtags,cashtags,link,retweet,quote_url,video,thumbnail,near,geo,source,user_rt_id,user_rt,retweet_id,reply_to,retweet_date,translate,trans_src,trans_dest
1192836750722379778,1192836750722379778,2019-11-08 13:10:17 -0300,2019-11-08,13:10:17,-300,80307396,luistibeoficial,Luis Tibé,"{'type': 'Point', 'coordinates': [-12.71390846, -38.45456844]}",fundacaodrjesus @somosavante70 pastorsargentoisidorio em Fundacao Doutor Jesus  https://t.co/hYVYhMuOn3,pt,"[{'screen_name': 'somosavante70', 'name': 'avante70', 'id': '231192764'}]",['https://www.instagram.com/p/B4nFNiojHa-/?igshid=ezk9l0fki4fg'],[],4,1,1,[],[],https://twitter.com/LuisTibeOficial/status/1192836750722379778,False,,0,,,,,,,,[],,,,
1192096901082025989,1192096901082025989,2019-11-06 12:10:23 -0300,2019-11-06,12:10:23,-300,80307396,luistibeoficial,Luis Tibé,"{'type': 'Point', 'coordinates': [-15.95635, -44.86085]}","Parabéns a querida cidade de São Francisco, conhecida como “Cidade do Sol”. Nosso mandato celebra juntos seus 142 anos e nos alegramos por diversas conquintas para o município, como quatro carros para auxiliar a…  https://t.co/2QAsZmG1rX",pt,[],['https://www.instagram.com/p/B4h0w4TDlPu/?igshid=ho2pdhd0e0ak'],[],1,0,0,[],[],https://twitter.com/LuisTibeOficial/status/1192096901082025989,False,,0,,,,,,,,[],,,,
1190330978700603393,1190330978700603393,2019-11-01 15:13:15 -0300,2019-11-01,15:13:15,-300,80307396,luistibeoficial,Luis Tibé,,#NovembroAzul  https://t.co/XhloIx8jSL,und,[],['https://www.instagram.com/p/B4VRt3nji1C/?igshid=u94dz3mxgj17'],[],1,0,0,['novembroazul'],[],https://twitter.com/LuisTibeOficial/status/1190330978700603393,False,,0,,,,,,,,[],,,,
1189308492768862208,1189308492768862208,2019-10-29 19:30:15 -0300,2019-10-29,19:30:15,-300,80307396,luistibeoficial,Luis Tibé,"{'type': 'Point', 'coordinates': [-14.85594, -43.9165]}","#MatiasCardoso | Enviamos através do nosso mandato, um Fiat Strada 0Km para o município de Matias Cardoso, a pedido do prefeito Edmarcio, em parceria com a Codevasf. Esse carro irá ajudar a prefeitura e atender as…  https://t.co/gU8MFbEtSH",pt,[],['https://www.instagram.com/p/B4OAvnujpc7/?igshid=wz4ba45sroy'],[],0,0,0,['matiascardoso'],[],https://twitter.com/LuisTibeOficial/status/1189308492768862208,False,,0,,,,,,,,[],,,,
1188826737490190336,1188826737490190336,2019-10-28 11:35:56 -0300,2019-10-28,11:35:56,-300,80307396,luistibeoficial,Luis Tibé,,"#Agricultura | Atendendo ao pedido do prefeito de Machacalis, Mauro de Moreno, enviamos um trator o km para atender a demanda agrícola do município. “É de suma importância este maquinário para o setor agrícola, em…  https://t.co/LJJh866VDx",pt,[],['https://www.instagram.com/p/B4Klqx9DIF4/?igshid=1aaodrfxlp0q'],[],0,0,2,['agricultura'],[],https://twitter.com/LuisTibeOficial/status/1188826737490190336,False,,0,,,,,,,,[],,,,
1188199423223848961,1188199423223848961,2019-10-26 18:03:12 -0300,2019-10-26,18:03:12,-300,80307396,luistibeoficial,Luis Tibé,"{'type': 'Point', 'coordinates': [-20.28661, -45.90112]}","#ÁguaPotável | Atendendo aos anseios da população de Doresópolis, enviamos para o município, um caminhão pipa para abastecer a população que tanto necessita deste serviço de agua potável. Sabemos que a qualidade da…  https://t.co/A6jPzAAdEt",pt,[],['https://www.instagram.com/p/B4GIZkvD5AT/?igshid=1rbu042gcdrdq'],[],0,0,1,['águapotável'],[],https://twitter.com/LuisTibeOficial/status/1188199423223848961,False,,0,,,,,,,,[],,,,
1188067305676144643,1188067305676144643,2019-10-26 09:18:13 -0300,2019-10-26,09:18:13,-300,80307396,luistibeoficial,Luis Tibé,"{'type': 'Point', 'coordinates': [-15.29441, -44.42244]}",#CônegoMarinho | Enviamos para a Associação dos Pequenos Produtores Rurais e Agricultores Familiares de Olhos D’água em Cônego Marinho um veículo Fiat Strada 0 km a pedido dos vereadores Van Madureira e Rubens. O…  https://t.co/T7B4xPD9P9,pt,[],['https://www.instagram.com/p/B4FMUcdDsiA/?igshid=bhk62ervil19'],[],0,0,1,['cônegomarinho'],[],https://twitter.com/LuisTibeOficial/status/1188067305676144643,False,,0,,,,,,,,[],,,,
1187049637947019265,1187049637947019265,2019-10-23 13:54:22 -0300,2019-10-23,13:54:22,-300,80307396,luistibeoficial,Luis Tibé,"{'type': 'Point', 'coordinates': [-15.8, -47.9]}","#Esporte | Reuni na manhã desta quarta-feira (23/10) o Ministro da Cidadania Lelo Coimbra e o presidente do Olympico Club de Belo Horizonte, Walney José de Almeida. Na oportunidade, conversamos sobre novos projetos e…  https://t.co/xK1SoQYl5g",pt,[],['https://www.instagram.com/p/B399iTsDj62/?igshid=k6aq4jplf2qb'],[],0,0,2,['esporte'],[],https://twitter.com/LuisTibeOficial/status/1187049637947019265,False,,0,,,,,,,,[],,,,
1186411018521436160,1186411018521436160,2019-10-21 19:36:43 -0300,2019-10-21,19:36:43,-300,80307396,luistibeoficial,Luis Tibé,,Obrigado Minas Gerais! Obrigado a todos! Encontro Mineiro Avante 2019! ↗️ #SomosAvante #EncontroMineiro #Avante70 #AvanteMG em Câmara Municipal de Belo Horizonte  https://t.co/U2dms6zjZ9,pt,[],['https://www.instagram.com/p/B35a4zVAf0J/?igshid=4uox1r19ms5f'],[],0,0,1,"['somosavante', 'encontromineiro', 'avante70', 'avantemg']",[],https://twitter.com/LuisTibeOficial/status/1186411018521436160,False,,0,,,,,,,,[],,,,
1186358768281509892,1186358768281509892,2019-10-21 16:09:06 -0300,2019-10-21,16:09:06,-300,80307396,luistibeoficial,Luis Tibé,,Encontro Mineiro Avante 2019! Obrigado pela presença de todos! #Avante70 ↗️ em Câmara Municipal de Belo Horizonte  https://t.co/UIr6B7K3Hp,pt,[],['https://www.instagram.com/p/B3zlcXdjNwV/?igshid=xvyjma861emx'],[],1,0,2,['avante70'],[],https://twitter.com/LuisTibeOficial/status/1186358768281509892,False,,0,,,,,,,,[],,,,
1186358239874748416,1186358239874748416,2019-10-21 16:07:00 -0300,2019-10-21,16:07:00,-300,80307396,luistibeoficial,Luis Tibé,,"#Avante70 O Avante MG realizou, no último sábado (19/10), o Encontro Mineiro que oficializou a filiação de 45 novos prefeitos mandatários e outros 36 vice-prefeitos. Veja as fotos:  https://t.co/jjcHwchdxk",pt,[],['https://bit.ly/2P6yCS9'],[],0,0,2,['avante70'],[],https://twitter.com/LuisTibeOficial/status/1186358239874748416,False,,0,,,,,,,,[],,,,
1181675104721350658,1181675104721350658,2019-10-08 17:57:54 -0300,2019-10-08,17:57:54,-300,80307396,luistibeoficial,Luis Tibé,,↗ É possível fazer diferença pelo simples prazer de ajudar o próximo 🤝🏼 https://t.co/wfGWtXTCbL,pt,[],['https://bit.ly/31TWtbj'],[],0,0,1,[],[],https://twitter.com/LuisTibeOficial/status/1181675104721350658,False,,0,,,,,,,,[],,,,
1181631878392143877,1181631878392143877,2019-10-08 15:06:08 -0300,2019-10-08,15:06:08,-300,80307396,luistibeoficial,Luis Tibé,"{'type': 'Point', 'coordinates': [-13.01011584, -38.48701624]}","Está chegando o maior evento do ano 🔥 Encontro Nacional do Avante ↗️ dia 09/11 - Salvador/Bahia! #Avante70 #AvanteBrasil  #EncontroNacional #SouAvante em Salvador, Bahia, Brasil  https://t.co/uElDZ9bZ6G",pt,[],['https://www.instagram.com/p/B3PfQ44Dh3f/?igshid=kbxe1puqu6n3'],[],1,1,3,"['avante70', 'avantebrasil', 'encontronacional', 'souavante']",[],https://twitter.com/LuisTibeOficial/status/1181631878392143877,False,,0,,,,,,,,[],,,,
1048658073752166406,1048658073752166406,2018-10-06 16:35:42 -0300,2018-10-06,16:35:42,-300,80307396,luistibeoficial,Luis Tibé,,Confiante com o apoio do povo mineiro. Vote #LuisTibé7070,pt,[],[],[],33,0,2,['luistibé7070'],[],https://twitter.com/LuisTibeOficial/status/1048658073752166406,False,,0,,,,,,,,[],,,,
1048576978159321089,1048576978159321089,2018-10-06 11:13:27 -0300,2018-10-06,11:13:27,-300,80307396,luistibeoficial,Luis Tibé,,"Colabore com a mudança do seu estado. Vote consciente, vote #LuisTibé7070",pt,[],[],[],7,2,4,['luistibé7070'],[],https://twitter.com/LuisTibeOficial/status/1048576978159321089,False,,0,,,,,,,,[],,,,
1048323052948402176,1048323052948402176,2018-10-05 18:24:27 -0300,2018-10-05,18:24:27,-300,80307396,luistibeoficial,Luis Tibé,,"Seja quem você quiser, onde quiser e como quiser. Apoiando o empoderamento de nossas mulheres. Vote #LuisTibé7070",pt,[],[],[],0,2,3,['luistibé7070'],[],https://twitter.com/LuisTibeOficial/status/1048323052948402176,False,,0,,,,,,,,[],,,,
1048264937796259840,1048264937796259840,2018-10-05 14:33:31 -0300,2018-10-05,14:33:31,-300,80307396,luistibeoficial,Luis Tibé,,Saúde tem que ser prioridade em nosso estado. #LuisTibé7070,pt,[],[],[],0,4,6,['luistibé7070'],[],https://twitter.com/LuisTibeOficial/status/1048264937796259840,False,,0,,,,,,,,[],,,,
1047822980691189760,1047822980691189760,2018-10-04 09:17:20 -0300,2018-10-04,09:17:20,-300,80307396,luistibeoficial,Luis Tibé,,Transparência gera confiança. #LuisTibé7070,pt,[],[],[],4,2,4,['luistibé7070'],[],https://twitter.com/LuisTibeOficial/status/1047822980691189760,False,,0,,,,,,,,[],,,,
1047621729961631745,1047621729961631745,2018-10-03 19:57:38 -0300,2018-10-03,19:57:38,-300,80307396,luistibeoficial,Luis Tibé,,Investir no esporte é investir na educação. #LuisTibé7070,pt,[],[],[],1,2,6,['luistibé7070'],[],https://twitter.com/LuisTibeOficial/status/1047621729961631745,False,,0,,,,,,,,[],,,,
1047480479509827584,1047480479509827584,2018-10-03 10:36:22 -0300,2018-10-03,10:36:22,-300,80307396,luistibeoficial,Luis Tibé,,"Orgulhoso em representar Minas Gerais. Peço seu voto de confiança, para continuarmos as mudanças necessárias que nosso estado precisa rumo ao desenvolvimento. #LuisTibé7070",pt,[],[],[],0,2,5,['luistibé7070'],[],https://twitter.com/LuisTibeOficial/status/1047480479509827584,False,,0,,,,,,,,[],,,,
1047242980791345152,1047242980791345152,2018-10-02 18:52:38 -0300,2018-10-02,18:52:38,-300,80307396,luistibeoficial,Luis Tibé,,Vamos continuar com a luta por melhorias no sistema de saúde de nosso estado. #LuisTibé7070,pt,[],[],[],0,2,2,['luistibé7070'],[],https://twitter.com/LuisTibeOficial/status/1047242980791345152,False,,0,,,,,,,,[],,,,
1047144699033718784,1047144699033718784,2018-10-02 12:22:05 -0300,2018-10-02,12:22:05,-300,80307396,luistibeoficial,Luis Tibé,,"Está em suas mãos deter a corrupção em nosso país. Vote Consciente, Vote #LuisTibé7070",pt,[],[],[],5,1,3,['luistibé7070'],[],https://twitter.com/LuisTibeOficial/status/1047144699033718784,False,,0,,,,,,,,[],,,,
1046779809634897936,1046779809634897936,2018-10-01 12:12:09 -0300,2018-10-01,12:12:09,-300,80307396,luistibeoficial,Luis Tibé,,Apoiando o desenvolvimento de Minas Gerais e a criação de novos empregos para o nosso povo. #LuisTibé7070,pt,[],[],[],0,2,5,['luistibé7070'],[],https://twitter.com/LuisTibeOficial/status/1046779809634897936,False,,0,,,,,,,,[],,,,
1046736059047038977,1046736059047038977,2018-10-01 09:18:18 -0300,2018-10-01,09:18:18,-300,80307396,luistibeoficial,Luis Tibé,,Comprometido com a mudança de Minas Gerais. #LuisTibé7070,pt,[],[],[],0,1,2,['luistibé7070'],[],https://twitter.com/LuisTibeOficial/status/1046736059047038977,False,,0,,,,,,,,[],,,,
1046062609835978764,1046062609835978764,2018-09-29 12:42:15 -0300,2018-09-29,12:42:15,-300,80307396,luistibeoficial,Luis Tibé,,Apoiando o desenvolvimento de Minas Gerais e a criação de novos empregos para o nosso povo #LuisTibé7070.,pt,[],[],[],1,2,1,['luistibé7070'],[],https://twitter.com/LuisTibeOficial/status/1046062609835978764,False,,0,,,,,,,,[],,,,
1045798656602001408,1045798656602001408,2018-09-28 19:13:24 -0300,2018-09-28,19:13:24,-300,80307396,luistibeoficial,Luis Tibé,,"Obrigado a todos que vem acompanhando nossa trajetória. Avante com Luis Tibé, 7070! #LuisTibé7070",pt,[],[],[],0,2,4,['luistibé7070'],[],https://twitter.com/LuisTibeOficial/status/1045798656602001408,False,,0,,,,,,,,[],,,,
1045752410998820864,1045752410998820864,2018-09-28 16:09:38 -0300,2018-09-28,16:09:38,-300,80307396,luistibeoficial,Luis Tibé,,"Minas quer mais desenvolvimento, melhorias na saúde, segurança e educação. Para Federal #LuisTibé7070",pt,[],[],[],0,0,2,['luistibé7070'],[],https://twitter.com/LuisTibeOficial/status/1045752410998820864,False,,0,,,,,,,,[],,,,
1045645632483074048,1045645632483074048,2018-09-28 09:05:20 -0300,2018-09-28,09:05:20,-300,80307396,luistibeoficial,Luis Tibé,,Sempre trabalhando pelo nosso estado e pela melhoria de vida dos nossos cidadãos. #LuisTibé7070,pt,[],[],[],0,1,2,['luistibé7070'],[],https://twitter.com/LuisTibeOficial/status/1045645632483074048,False,,0,,,,,,,,[],,,,
1045346489654947840,1045346489654947840,2018-09-27 13:16:39 -0300,2018-09-27,13:16:39,-300,80307396,luistibeoficial,Luis Tibé,,#Transparência é a palavra chave contra a corrupção. #LuisTibé7070,pt,[],[],[],1,1,4,"['transparência', 'luistibé7070']",[],https://twitter.com/LuisTibeOficial/status/1045346489654947840,False,,0,,,,,,,,[],,,,
1045282207781335040,1045282207781335040,2018-09-27 09:01:13 -0300,2018-09-27,09:01:13,-300,80307396,luistibeoficial,Luis Tibé,,O Centro Oeste de Minas também foi beneficiado com meu mandato como Deputado Federal. Trazendo várias melhorias para a população da região. #LuisTibé7070,pt,[],[],[],0,1,3,['luistibé7070'],[],https://twitter.com/LuisTibeOficial/status/1045282207781335040,False,,0,,,,,,,,[],,,,
1044998600860864512,1044998600860864512,2018-09-26 14:14:16 -0300,2018-09-26,14:14:16,-300,80307396,luistibeoficial,Luis Tibé,,Está chegando a hora mais importante do nosso país. Escolha quem tem compromisso real com a população. #LuisTibé7070,pt,[],[],[],0,2,3,['luistibé7070'],[],https://twitter.com/LuisTibeOficial/status/1044998600860864512,False,,0,,,,,,,,[],,,,
1044943810760003584,1044943810760003584,2018-09-26 10:36:33 -0300,2018-09-26,10:36:33,-300,80307396,luistibeoficial,Luis Tibé,,A chance de mudar nosso estado está em suas mãos.  #LuisTibé7070,pt,[],[],[],1,2,5,['luistibé7070'],[],https://twitter.com/LuisTibeOficial/status/1044943810760003584,False,,0,,,,,,,,[],,,,
1044675171431452673,1044675171431452673,2018-09-25 16:49:04 -0300,2018-09-25,16:49:04,-300,80307396,luistibeoficial,Luis Tibé,,"O nosso estado precisa de mudanças e elas precisam de nós. Avante com Luis Tibé, 7070! #LuisTibé7070",pt,[],[],[],0,3,4,['luistibé7070'],[],https://twitter.com/LuisTibeOficial/status/1044675171431452673,False,,0,,,,,,,,[],,,,
1044283870055723010,1044283870055723010,2018-09-24 14:54:11 -0300,2018-09-24,14:54:11,-300,80307396,luistibeoficial,Luis Tibé,,"Em cada município que passo, sou bem recebido pela população. Só tenho a agradecer a confiança e o apoio do povo mineiro. #LuisTibé7070",pt,[],[],[],1,0,2,['luistibé7070'],[],https://twitter.com/LuisTibeOficial/status/1044283870055723010,False,,0,,,,,,,,[],,,,
1044198303020322816,1044198303020322816,2018-09-24 09:14:10 -0300,2018-09-24,09:14:10,-300,80307396,luistibeoficial,Luis Tibé,,"Dentre os vários projetos de lei que foram aprovados, um deles obriga a divulgação clara de preços na internet, visando maior segurança para os consumidores. #LuisTibé7070",pt,[],[],[],0,1,2,['luistibé7070'],[],https://twitter.com/LuisTibeOficial/status/1044198303020322816,False,,0,,,,,,,,[],,,,
1043580209881120770,1043580209881120770,2018-09-22 16:18:05 -0300,2018-09-22,16:18:05,-300,80307396,luistibeoficial,Luis Tibé,,"Visando maior segurança para a população, municípios foram contemplados com viaturas da Polícia Militar, frutos de emendas parlamentares indicados do meu mandato. #LuisTibé7070",pt,[],[],[],0,1,3,['luistibé7070'],[],https://twitter.com/LuisTibeOficial/status/1043580209881120770,False,,0,,,,,,,,[],,,,
1043540547200274433,1043540547200274433,2018-09-22 13:40:29 -0300,2018-09-22,13:40:29,-300,80307396,luistibeoficial,Luis Tibé,,"Visando mais reconhecimento para os estagiários, um de meus projetos permite a comprovação da contribuição do estagiário às atividades das empresas e órgãos. #LuisTibé7070",pt,[],[],[],0,1,4,['luistibé7070'],[],https://twitter.com/LuisTibeOficial/status/1043540547200274433,False,,0,,,,,,,,[],,,,
1043156092933623814,1043156092933623814,2018-09-21 12:12:48 -0300,2018-09-21,12:12:48,-300,80307396,luistibeoficial,Luis Tibé,,Um de meus projetos aprovados defende preço mais justo nos alimentos que são vendidos nos aeroportos em todo Brasil. #LuisTibé7070,pt,[],[],[],0,1,5,['luistibé7070'],[],https://twitter.com/LuisTibeOficial/status/1043156092933623814,False,,0,,,,,,,,[],,,,
1042383016000204800,1042383016000204800,2018-09-19 09:00:52 -0300,2018-09-19,09:00:52,-300,80307396,luistibeoficial,Luis Tibé,,Fui autor do projeto que prioriza as candidatas mulheres como critério de desempate caso duas ou mais candidaturas obtenham igual número de votos. #LuisTibé7070,pt,[],[],[],0,0,3,['luistibé7070'],[],https://twitter.com/LuisTibeOficial/status/1042383016000204800,False,,0,,,,,,,,[],,,,
1042077717955571712,1042077717955571712,2018-09-18 12:47:43 -0300,2018-09-18,12:47:43,-300,80307396,luistibeoficial,Luis Tibé,,"Estamos unidos com pessoas do bem, lutando por um objetivo em comum, melhorar a vida dos mineiros. #LuisTibé7070",pt,[],[],[],0,0,3,['luistibé7070'],[],https://twitter.com/LuisTibeOficial/status/1042077717955571712,False,,0,,,,,,,,[],,,,
1041797992045600774,1041797992045600774,2018-09-17 18:16:11 -0300,2018-09-17,18:16:11,-300,80307396,luistibeoficial,Luis Tibé,,Ter pessoas de bem ao nosso lado é fundamental para seguir com o projeto de construir uma Minas Gerais mais justa e melhor. #LuisTibé7070,pt,[],[],[],0,0,2,['luistibé7070'],[],https://twitter.com/LuisTibeOficial/status/1041797992045600774,False,,0,,,,,,,,[],,,,
1041772311244886016,1041772311244886016,2018-09-17 16:34:08 -0300,2018-09-17,16:34:08,-300,80307396,luistibeoficial,Luis Tibé,,"Fui autor de projeto que sugere a concessão de curso profissionalizante gratuito, a mulheres vítimas de violência doméstica.  #LuisTibé7070",pt,[],[],[],1,2,5,['luistibé7070'],[],https://twitter.com/LuisTibeOficial/status/1041772311244886016,False,,0,,,,,,,,[],,,,
1041050656646291463,1041050656646291463,2018-09-15 16:46:32 -0300,2018-09-15,16:46:32,-300,80307396,luistibeoficial,Luis Tibé,,"Ao lado de Willian e de Dr Paulo Telles, viabilizamos diversos recursos para Ibirité. Avante com Luis Tibe, 7070! #LuisTibé7070",pt,[],[],[],0,0,4,['luistibé7070'],[],https://twitter.com/LuisTibeOficial/status/1041050656646291463,False,,0,,,,,,,,[],,,,
1040966906449154048,1040966906449154048,2018-09-15 11:13:45 -0300,2018-09-15,11:13:45,-300,80307396,luistibeoficial,Luis Tibé,,Unindo forças para buscar um estado mais justo e que tenha como principal objetivo oferecer ao povo o bem estar que merece. #LuisTibé7070,pt,[],[],[],0,2,5,['luistibé7070'],[],https://twitter.com/LuisTibeOficial/status/1040966906449154048,False,,0,,,,,,,,[],,,,
1040643156319117313,1040643156319117313,2018-09-14 13:47:17 -0300,2018-09-14,13:47:17,-300,80307396,luistibeoficial,Luis Tibé,,Trabalho e determinação são as palavras chaves para concluirmos os nossos projetos a benefício da população mineira. #LuisTibé7070,pt,[],[],[],0,0,2,['luistibé7070'],[],https://twitter.com/LuisTibeOficial/status/1040643156319117313,False,,0,,,,,,,,[],,,,
1040378255885385728,1040378255885385728,2018-09-13 20:14:40 -0300,2018-09-13,20:14:40,-300,80307396,luistibeoficial,Luis Tibé,,Muito contente em ser tão bem recepcionado por todos os municípios que passo em Minas Gerais. #LuisTibé7070,pt,[],[],[],1,0,2,['luistibé7070'],[],https://twitter.com/LuisTibeOficial/status/1040378255885385728,False,,0,,,,,,,,[],,,,
1039973207070199811,1039973207070199811,2018-09-12 17:25:08 -0300,2018-09-12,17:25:08,-300,80307396,luistibeoficial,Luis Tibé,,"Luis Tibé, o deputado que destinou verbas para mais de 170 municípios em todo o estado.  #LuisTibé7070",pt,[],[],[],0,2,2,['luistibé7070'],[],https://twitter.com/LuisTibeOficial/status/1039973207070199811,False,,0,,,,,,,,[],,,,
1039853680374292485,1039853680374292485,2018-09-12 09:30:11 -0300,2018-09-12,09:30:11,-300,80307396,luistibeoficial,Luis Tibé,,"Junte-se ao time mais preparado para mudar Minas para melhor, Avante com Luis Tibé 7070! #LuisTibé7070",pt,[],[],[],0,1,3,['luistibé7070'],[],https://twitter.com/LuisTibeOficial/status/1039853680374292485,False,,0,,,,,,,,[],,,,
1035278085829079040,1035278085829079040,2018-08-30 18:28:24 -0300,2018-08-30,18:28:24,-300,80307396,luistibeoficial,Luis Tibé,,#LuisTibé7070  https://t.co/OpKztSyABx,und,[],[],['https://pbs.twimg.com/media/Dl4L7Q0WsAAof8Z.jpg'],0,3,4,['luistibé7070'],[],https://twitter.com/LuisTibeOficial/status/1035278085829079040,False,,1,https://pbs.twimg.com/media/Dl4L7Q0WsAAof8Z.jpg,,,,,,,[],,,,
1034543964374880257,1034543964374880257,2018-08-28 17:51:16 -0300,2018-08-28,17:51:16,-300,80307396,luistibeoficial,Luis Tibé,,#LuisTibé7070  https://t.co/6mO8PPNILc,und,[],[],['https://pbs.twimg.com/media/DltwP2vXsAAOmca.jpg'],0,2,3,['luistibé7070'],[],https://twitter.com/LuisTibeOficial/status/1034543964374880257,False,,1,https://pbs.twimg.com/media/DltwP2vXsAAOmca.jpg,,,,,,,[],,,,
1033882778356670464,1033882778356670464,2018-08-26 22:03:57 -0300,2018-08-26,22:03:57,-300,80307396,luistibeoficial,Luis Tibé,,"Agradeço, ao deputado e amigo Luiz Fernando, pelo apoio e parceria.#DoresDeCampo #LuisTibé 7070  https://t.co/ccWKhaSRRW",pt,[],[],['https://pbs.twimg.com/media/DlkW50EX4AEjkbR.jpg'],0,2,4,"['doresdecampo', 'luistibé']",[],https://twitter.com/LuisTibeOficial/status/1033882778356670464,False,,1,https://pbs.twimg.com/media/DlkW50EX4AEjkbR.jpg,,,,,,,[],,,,
1030633456148144129,1030633456148144129,2018-08-17 22:52:18 -0300,2018-08-17,22:52:18,-300,80307396,luistibeoficial,Luis Tibé,,Luis Tibé 7070  https://t.co/2y5r51G32g via @issuu,fr,"[{'screen_name': 'issuu', 'name': 'issuu', 'id': '10156602'}]",['https://issuu.com/luistibe7070/docs/santao_luis_fechdo'],[],0,0,1,[],[],https://twitter.com/LuisTibeOficial/status/1030633456148144129,False,,0,,,,,,,,[],,,,
1030153741859782656,1030153741859782656,2018-08-16 15:06:06 -0300,2018-08-16,15:06:06,-300,80307396,luistibeoficial,Luis Tibé,,A sua foto já pode ter a marca da nossa campanha  https://t.co/9PLO0wCKaM Luis Tibé é o nosso Federal 7070,pt,[],['https://goo.gl/crk3M3'],[],0,0,1,[],[],https://twitter.com/LuisTibeOficial/status/1030153741859782656,False,,0,,,,,,,,[],,,,
1030094549450977281,1030094549450977281,2018-08-16 11:10:53 -0300,2018-08-16,11:10:53,-300,80307396,luistibeoficial,Luis Tibé,,ESCUTAR os anseios das pessoas é o melhor caminho para encontrar soluções que realmente façam diferença. 7070 #LuisTibé,pt,[],[],[],0,1,2,['luistibé'],[],https://twitter.com/LuisTibeOficial/status/1030094549450977281,False,,0,,,,,,,,[],,,,
1027745785482555392,1027745785482555392,2018-08-09 23:37:44 -0300,2018-08-09,23:37:44,-300,80307396,luistibeoficial,Luis Tibé,,Acesse  https://t.co/FJvuC0FTlo e acompanhe os dados citados por Ciro em tempo real. #CiroNaBand #AvanteCiro,pt,[],['https://bit.ly/CiroNaBand'],[],0,0,3,"['cironaband', 'avanteciro']",[],https://twitter.com/LuisTibeOficial/status/1027745785482555392,False,,0,,,,,,,,[],,,,
1025794085288910848,1025794085288910848,2018-08-04 14:22:22 -0300,2018-08-04,14:22:22,-300,80307396,luistibeoficial,Luis Tibé,,Agora é oficial nosso próximo presidente do Brasil é Ciro Gomes. Avante Ciro! #Familia70 #AvanteBrasil #Familia70 #PDTeAvante  https://t.co/LRCDisblXy,pt,[],[],['https://pbs.twimg.com/media/DjxaRvuXcAA0BgZ.jpg'],0,0,3,"['familia70', 'avantebrasil', 'familia70', 'pdteavante']",[],https://twitter.com/LuisTibeOficial/status/1025794085288910848,False,,1,https://pbs.twimg.com/media/DjxaRvuXcAA0BgZ.jpg,,,,,,,[],,,,
1020711176186015746,1020711176186015746,2018-07-21 13:44:42 -0300,2018-07-21,13:44:42,-300,80307396,luistibeoficial,Luis Tibé,,Agradeço a todos que participaram da nossa Convenção. Vocês fizeram o nosso evento ainda melhor!     #AvanteMinas #AvanteBrasil  #Familia70  https://t.co/OaHgn3TtGD,pt,[],[],['https://pbs.twimg.com/media/DipLZhcXsAAfhJm.jpg'],1,0,4,"['avanteminas', 'avantebrasil', 'familia70']",[],https://twitter.com/LuisTibeOficial/status/1020711176186015746,False,,1,https://pbs.twimg.com/media/DipLZhcXsAAfhJm.jpg,,,,,,,[],,,,
1020661920775499776,1020661920775499776,2018-07-21 10:28:59 -0300,2018-07-21,10:28:59,-300,80307396,luistibeoficial,Luis Tibé,,Estamos AO VIVO Convenção Nacional! #AvanteBrasil #Familia70 #ConvencaoBH  https://t.co/c672wtSUIc,pt,[],['https://web.facebook.com/70.avante/videos/1873918085984742/'],[],0,0,0,"['avantebrasil', 'familia70', 'convencaobh']",[],https://twitter.com/LuisTibeOficial/status/1020661920775499776,False,,0,,,,,,,,[],,,,
1020657819073286144,1020657819073286144,2018-07-21 10:12:41 -0300,2018-07-21,10:12:41,-300,80307396,luistibeoficial,Luis Tibé,,Você é capaz de fazer a mudança acontecer! #avante70 #LuisTibé #ComvençãoAvante2018,pt,[],[],[],1,0,0,"['avante70', 'luistibé', 'comvençãoavante2018']",[],https://twitter.com/LuisTibeOficial/status/1020657819073286144,False,,0,,,,,,,,[],,,,
1020642358965297152,1020642358965297152,2018-07-21 09:11:15 -0300,2018-07-21,09:11:15,-300,80307396,luistibeoficial,Luis Tibé,,"Logo mais estaremos ao vivo, às 9h20 estarei ao vivo no Facebook  #TibéAOvivo #Convenção #AvanteMinas #AvanteBrasil  #Familia70",pt,[],[],[],0,0,0,"['tibéaovivo', 'convenção', 'avanteminas', 'avantebrasil', 'familia70']",[],https://twitter.com/LuisTibeOficial/status/1020642358965297152,False,,0,,,,,,,,[],,,,
1020635144204505088,1020635144204505088,2018-07-21 08:42:35 -0300,2018-07-21,08:42:35,-300,80307396,luistibeoficial,Luis Tibé,,Para avançar é preciso unir! #avante70,pt,[],[],[],0,0,1,['avante70'],[],https://twitter.com/LuisTibeOficial/status/1020635144204505088,False,,0,,,,,,,,[],,,,
