id,conversation_id,created_at,date,time,timezone,user_id,username,name,place,tweet,language,mentions,urls,photos,replies_count,retweets_count,likes_count,hashtags,cashtags,link,retweet,quote_url,video,thumbnail,near,geo,source,user_rt_id,user_rt,retweet_id,reply_to,retweet_date,translate,trans_src,trans_dest
1349753219841454081,1349753219841454081,2021-01-14 13:20:19 -0300,2021-01-14,13:20:19,-300,80307396,luistibeoficial,Luis Tibé,,"Acompanhamos nosso candidato a presidência da Câmara  @ArthurLira_ em Sergipe, junto do governador @belivaldochagas e da bancada sergipana. #ArthurLiraPresidente  https://t.co/8ppV9Oi01n",pt,"[{'screen_name': 'arthurlira_', 'name': 'arthur lira', 'id': '1086390169970884613'}, {'screen_name': 'belivaldochagas', 'name': 'belivaldo chagas', 'id': '79516716'}]",[],"['https://pbs.twimg.com/media/ErtJSHJXMAEALev.jpg', 'https://pbs.twimg.com/media/ErtJSHMXUAIDsB_.jpg', 'https://pbs.twimg.com/media/ErtJSHKXEAAlS4w.jpg', 'https://pbs.twimg.com/media/ErtJSHJW8AA8331.jpg']",17,0,4,['arthurlirapresidente'],[],https://twitter.com/LuisTibeOficial/status/1349753219841454081,False,,1,https://pbs.twimg.com/media/ErtJSHJXMAEALev.jpg,,,,,,,[],,,,
1349380865919492096,1349380865919492096,2021-01-13 12:40:43 -0300,2021-01-13,12:40:43,-300,80307396,luistibeoficial,Luis Tibé,,"Em Pernambuco, reunimos com o governador @PauloCamara40 , com o prefeito de Recife @JoaoCampos , com a bancada pernambucana e com nosso candidato a presidência da Câmara @ArthurLira_ . #ArthurLiraPresidente  https://t.co/0BwF0PVvzU",pt,"[{'screen_name': 'paulocamara40', 'name': 'paulo câmara 40', 'id': '2357026778'}, {'screen_name': 'joaocampos', 'name': 'joão campos', 'id': '1112804630453501953'}, {'screen_name': 'arthurlira_', 'name': 'arthur lira', 'id': '1086390169970884613'}]",[],['https://pbs.twimg.com/media/Ern2uHMXAAMPGqi.jpg'],0,1,3,['arthurlirapresidente'],[],https://twitter.com/LuisTibeOficial/status/1349380865919492096,False,,1,https://pbs.twimg.com/media/Ern2uHMXAAMPGqi.jpg,,,,,,,[],,,,
1349142933430267905,1349142933430267905,2021-01-12 20:55:15 -0300,2021-01-12,20:55:15,-300,80307396,luistibeoficial,Luis Tibé,,"Estivemos no estado do Maranhão, acompanhando nosso candidato a presidência da Câmara @oficialarthurlira, juntamente do governador em exercício Carlos Brandao, do prefeito de São Luís Eduardo Braide e da bancada maranhanse. #ArturLiraPresidente  https://t.co/JwvWYUyDsD",pt,[],[],"['https://pbs.twimg.com/media/ErkeV5QXEAAs4ob.jpg', 'https://pbs.twimg.com/media/ErkeV5KXUAIGvyD.jpg', 'https://pbs.twimg.com/media/ErkeV5KW4AAbpEG.jpg']",1,0,1,['arturlirapresidente'],[],https://twitter.com/LuisTibeOficial/status/1349142933430267905,False,,1,https://pbs.twimg.com/media/ErkeV5QXEAAs4ob.jpg,,,,,,,[],,,,
1334223651823087616,1334223651823087616,2020-12-02 16:51:21 -0300,2020-12-02,16:51:21,-300,80307396,luistibeoficial,Luis Tibé,,Posse da presidente do núcleo Jovem Avante Nacional Fernanda Aryel  https://t.co/fWMCRqro2j,pt,[],[],['https://pbs.twimg.com/media/EoQdSkTXIAEtnUS.jpg'],1,0,8,[],[],https://twitter.com/LuisTibeOficial/status/1334223651823087616,False,,1,https://pbs.twimg.com/media/EoQdSkTXIAEtnUS.jpg,,,,,,,[],,,,
1327391784096423936,1327391784096423936,2020-11-13 20:23:57 -0300,2020-11-13,20:23:57,-300,80307396,luistibeoficial,Luis Tibé,,"Ratificamos o apoio ao nosso candidato a prefeito de Carlos Chagas, Acássio. Sua gestão pode contar com nosso mandato para fazer o município Avançar. Com Acássio na prefeitura a cidade continuará sorrindo! Vote 70! #LuisTibé #Acássio #Vote70  https://t.co/fiMeZ3AitS",pt,[],[],"['https://pbs.twimg.com/media/EmvXyOKXYAEbKOv.jpg', 'https://pbs.twimg.com/media/EmvXyOLXMAI9XaE.jpg', 'https://pbs.twimg.com/media/EmvXyOQXUAYwydh.jpg', 'https://pbs.twimg.com/media/EmvXyOSXIAAQlCn.jpg']",3,0,3,"['luistibé', 'acássio', 'vote70']",[],https://twitter.com/LuisTibeOficial/status/1327391784096423936,False,,1,https://pbs.twimg.com/media/EmvXyOKXYAEbKOv.jpg,,,,,,,[],,,,
1327348032854233089,1327348032854233089,2020-11-13 17:30:06 -0300,2020-11-13,17:30:06,-300,80307396,luistibeoficial,Luis Tibé,,"Em Teófilo Otoni me reuni com Bruno Balarini, nosso candidato a prefeito e o vice Dr. Cicero. No encontro estiveram presentes lideranças da cidade e o presidente eleito do Coren-MG, Bruno Farias. Reafirmamos nosso apoio a campanha 70 e colocamos nosso mandato à disposição.#Vote70  https://t.co/nTR9T2XGdz",pt,[],[],"['https://pbs.twimg.com/media/Emuv_gzXEAE3IjA.jpg', 'https://pbs.twimg.com/media/Emuv_gxXMAwUf6b.jpg', 'https://pbs.twimg.com/media/Emuv_g4XYAE7xye.jpg', 'https://pbs.twimg.com/media/Emuv_g2XYAA49Kr.jpg']",0,0,2,['vote70'],[],https://twitter.com/LuisTibeOficial/status/1327348032854233089,False,,1,https://pbs.twimg.com/media/Emuv_gzXEAE3IjA.jpg,,,,,,,[],,,,
1327225765650436097,1327225765650436097,2020-11-13 09:24:15 -0300,2020-11-13,09:24:15,-300,80307396,luistibeoficial,Luis Tibé,,"Fui até Montalvânia para efetivar nosso apoio ao candidato a prefeito pelo Avante, Dr. Tarcísio, colocamos nosso mandato a disposição do município para continuar levando recursos que melhorem a vida dos cidadãos. Vote 70 para prefeito! #LuisTibé #Montalvânia #DrTarcísioPrefeito  https://t.co/ubnzQyGPG8",pt,[],[],"['https://pbs.twimg.com/media/EmtAxccXUAEFpVE.jpg', 'https://pbs.twimg.com/media/EmtAxceWEAACPaL.jpg', 'https://pbs.twimg.com/media/EmtAxceW4AEnhTG.jpg', 'https://pbs.twimg.com/media/EmtAxcgXIAUz5Sb.jpg']",0,0,1,"['luistibé', 'montalvânia', 'drtarcísioprefeito']",[],https://twitter.com/LuisTibeOficial/status/1327225765650436097,False,,1,https://pbs.twimg.com/media/EmtAxccXUAEFpVE.jpg,,,,,,,[],,,,
1326180469558423554,1326180469558423554,2020-11-10 12:10:37 -0300,2020-11-10,12:10:37,-300,80307396,luistibeoficial,Luis Tibé,,"Em Juruaia estive no comitê do candidato a prefeito Alvinho, juntamente com o vice Celsinho e lideranças. Reforçamos o compromisso do nosso mandato com o município! Vote 45 para prefeito e para vereador vote na chapa do Avante 70! #LuisTibé #PrefeitoAlvinho #Juruaia #Avante  https://t.co/YKZz4Kcr3z",pt,[],[],"['https://pbs.twimg.com/media/EmeKExvXcAEQ3Lq.jpg', 'https://pbs.twimg.com/media/EmeKExxXYAMb_t1.jpg', 'https://pbs.twimg.com/media/EmeKExvXYAAPXNn.jpg', 'https://pbs.twimg.com/media/EmeKExvXIAgHziF.jpg']",0,0,2,"['luistibé', 'prefeitoalvinho', 'juruaia', 'avante']",[],https://twitter.com/LuisTibeOficial/status/1326180469558423554,False,,1,https://pbs.twimg.com/media/EmeKExvXcAEQ3Lq.jpg,,,,,,,[],,,,
1326161192725962752,1326161192725962752,2020-11-10 10:54:01 -0300,2020-11-10,10:54:01,-300,80307396,luistibeoficial,Luis Tibé,,"Participei hoje (10) de um café da manhã no distrito das Três Barras no município de Carmo do Rio claro, com o prefeito Tião Nara, os candidatos a prefeito e vice, Juninho Nicolau e Paulão, e lideranças. Para Carmo do Rio Claro continuar avançando, VOTE 70 neste domingo! #Vote70  https://t.co/gUPDZp9ofJ",pt,[],[],"['https://pbs.twimg.com/media/Emd4ijcW8AID72u.jpg', 'https://pbs.twimg.com/media/Emd4ijcXYAM_7LO.jpg', 'https://pbs.twimg.com/media/Emd4ijeXUAAEXgN.jpg', 'https://pbs.twimg.com/media/Emd4ijcXUAEKPXO.jpg']",0,0,1,['vote70'],[],https://twitter.com/LuisTibeOficial/status/1326161192725962752,False,,1,https://pbs.twimg.com/media/Emd4ijcW8AID72u.jpg,,,,,,,[],,,,
1324518187728326660,1324518187728326660,2020-11-05 22:05:18 -0300,2020-11-05,22:05:18,-300,80307396,luistibeoficial,Luis Tibé,,"Em Montes Claros, estive em um encontro com nosso candidato a prefeito Ruy Muniz, e lideranças, para dar nosso apoio e chancelar nosso compromisso com o município! Montes Claros já é Ruy, vote 1️⃣1️⃣ para prefeito e 7️⃣0️⃣↗️↗️↗️ para vereador! #LuisTibé #Avante70 #RuyMunizPrefeito  https://t.co/TlcymCKJ5o",pt,[],[],['https://pbs.twimg.com/media/EmGiRJSXEAI8DWc.jpg'],0,0,1,"['luistibé', 'avante70', 'ruymunizprefeito']",[],https://twitter.com/LuisTibeOficial/status/1324518187728326660,False,,1,https://pbs.twimg.com/media/EmGiRJSXEAI8DWc.jpg,,,,,,,[],,,,
1324052900721676288,1324052900721676288,2020-11-04 15:16:25 -0300,2020-11-04,15:16:25,-300,80307396,luistibeoficial,Luis Tibé,,O Novo Fundeb foi votado e aprovado em agosto deste ano e até hoje nada está decidido. Precisamos pressionar os parlamentares para que iniciemos 2021 com o Novo Fundeb regulamentado! Nossos estudantes merecem e precisam disso!  #LuisTibé #NovoFundeb #AvanteNacional #Avante70  https://t.co/ZUyTJp9BnA,pt,[],[],['https://pbs.twimg.com/media/El_6jvTWMAIc-Th.jpg'],1,1,6,"['luistibé', 'novofundeb', 'avantenacional', 'avante70']",[],https://twitter.com/LuisTibeOficial/status/1324052900721676288,False,,1,https://pbs.twimg.com/media/El_6jvTWMAIc-Th.jpg,,,,,,,[],,,,
1309486597071605765,1309486597071605765,2020-09-25 10:35:08 -0300,2020-09-25,10:35:08,-300,80307396,luistibeoficial,Luis Tibé,,Avante Aracajú com pré-candidato a prefeito Lúcio Flávio↗️!  #AvanteAracaju #AvanteSergipe #Avante70 #PensandoAvante #Eleições2020  https://t.co/ya4MZvguVN,pt,[],[],[],16,0,3,"['avantearacaju', 'avantesergipe', 'avante70', 'pensandoavante', 'eleições2020']",[],https://twitter.com/LuisTibeOficial/status/1309486597071605765,False,,1,https://pbs.twimg.com/ext_tw_video_thumb/1309486495024189441/pu/img/uLH-_honF_5h5bN6.jpg,,,,,,,[],,,,
1308901200599953409,1308901200599953409,2020-09-23 19:48:59 -0300,2020-09-23,19:48:59,-300,80307396,luistibeoficial,Luis Tibé,,"O Projeto de Lei 3267/19, que moderniza o Código de Trânsito Brasileiro, foi aprovado na Câmara dos Deputados! ✅ Confira a matéria completa em:  https://t.co/oV2u8WMCO5  #LuisTibé #Avante #AvanteNacional #PensandoAvante #CódigodeTrânsitoBrasileiro #ProjetodeLei  https://t.co/fBY4ELP6RA",pt,[],['https://bit.ly/3cqVeGP'],['https://pbs.twimg.com/media/EioVZjgXYAA53sD.jpg'],12,0,4,"['luistibé', 'avante', 'avantenacional', 'pensandoavante', 'códigodetrânsitobrasileiro', 'projetodelei']",[],https://twitter.com/LuisTibeOficial/status/1308901200599953409,False,,1,https://pbs.twimg.com/media/EioVZjgXYAA53sD.jpg,,,,,,,[],,,,
1305961682846593026,1305961682846593026,2020-09-15 17:08:23 -0300,2020-09-15,17:08:23,-300,80307396,luistibeoficial,Luis Tibé,,#LuisTibé #Avante #AvanteNacional #PensandoAvante #Democracia  https://t.co/nEr3spiCiQ,und,[],[],['https://pbs.twimg.com/media/Eh-1OOjWsAYoqT5.jpg'],32,1,6,"['luistibé', 'avante', 'avantenacional', 'pensandoavante', 'democracia']",[],https://twitter.com/LuisTibeOficial/status/1305961682846593026,False,,1,https://pbs.twimg.com/media/Eh-1OOjWsAYoqT5.jpg,,,,,,,[],,,,
1304064614246871042,1304064614246871042,2020-09-10 11:30:07 -0300,2020-09-10,11:30:07,-300,80307396,luistibeoficial,Luis Tibé,,"Você sabe quais são as funções de um PREFEITO em seu município? 🤔 🔸 Se você é Pré-Candidato ou se interessa em saber, dê o PLAY ▶️ no vídeo e entenda melhor sobre esse importante cargo! #Avante #Avante70 #AvanteNacional #PensandoAvante #Eleições2020 #EleiçõesMunicipais #Brasil  https://t.co/8D5Y62oUeF",pt,[],[],[],16,0,2,"['avante', 'avante70', 'avantenacional', 'pensandoavante', 'eleições2020', 'eleiçõesmunicipais', 'brasil']",[],https://twitter.com/LuisTibeOficial/status/1304064614246871042,False,,1,https://pbs.twimg.com/ext_tw_video_thumb/1304064520365715456/pu/img/HIWFjSMRrdPNVTMB.jpg,,,,,,,[],,,,
1298725106554871814,1298725106554871814,2020-08-26 17:52:49 -0300,2020-08-26,17:52:49,-300,80307396,luistibeoficial,Luis Tibé,,Eu votei SIM para o novo FUNDEB! ✅  https://t.co/BNGrlOIyPk  https://t.co/cg6iI4XbEv,pt,[],['https://bit.ly/3lhPiE5'],['https://pbs.twimg.com/media/EgX_l-jU4AEcOfZ.jpg'],12,0,2,[],[],https://twitter.com/LuisTibeOficial/status/1298725106554871814,False,,1,https://pbs.twimg.com/media/EgX_l-jU4AEcOfZ.jpg,,,,,,,[],,,,
1298621137157586944,1298621137157586944,2020-08-26 10:59:40 -0300,2020-08-26,10:59:40,-300,80307396,luistibeoficial,Luis Tibé,,Novo FUNDEB aprovado✅ https://t.co/SR3u5DDz5O  #PensandoAvante #LuisTibé,pt,[],['https://bit.ly/3huUS3D'],[],5,0,3,"['pensandoavante', 'luistibé']",[],https://twitter.com/LuisTibeOficial/status/1298621137157586944,False,,0,,,,,,,,[],,,,
1296556043254861828,1296556043254861828,2020-08-20 18:13:44 -0300,2020-08-20,18:13:44,-300,80307396,luistibeoficial,Luis Tibé,,"R$ 1.260.000,00 foi o valor que destinamos, através de emenda parlamentar do nosso mandato, para a saúde e também 1 caminhão pipa, 1 caminhonete, 1 trator e duas grades para o município de Mirabela. Podem contar sempre com o nosso mandato em prol dos mirabelenses! #LuisTibé  https://t.co/O7Qdk60yUk",pt,[],[],['https://pbs.twimg.com/media/Ef5K1lbXkAED6JP.jpg'],3,1,3,['luistibé'],[],https://twitter.com/LuisTibeOficial/status/1296556043254861828,False,,1,https://pbs.twimg.com/media/Ef5K1lbXkAED6JP.jpg,,,,,,,[],,,,
1295826469164326918,1295826467528507392,2020-08-18 17:54:40 -0300,2020-08-18,17:54:40,-300,80307396,luistibeoficial,Luis Tibé,,Contem sempre com o apoio do nosso mandato! #LuisTibé #CônegoMarinho #PensandoAvante  https://t.co/tuTkmLh3DT,pt,[],[],['https://pbs.twimg.com/media/EfuzSKOX0AA1-7c.jpg'],0,0,2,"['luistibé', 'cônegomarinho', 'pensandoavante']",[],https://twitter.com/LuisTibeOficial/status/1295826469164326918,False,,1,https://pbs.twimg.com/media/EfuzSKOX0AA1-7c.jpg,,,,,,,[],,,,
1295826467528507392,1295826467528507392,2020-08-18 17:54:39 -0300,2020-08-18,17:54:39,-300,80307396,luistibeoficial,Luis Tibé,,"Atendendo ao pedido dos vereadores:Edson Rocha, Rubens e Van Madureira, pré-candidato a prefeito de Cônego Marinho, enviamos através de emenda parlamentar, em parceria com a CODEVASF, duas caminhonetes que irão servir a Associação Comunitária de Gaim, Cabeceira de Cedro/Macaúbas.",pt,[],[],[],3,0,1,[],[],https://twitter.com/LuisTibeOficial/status/1295826467528507392,False,,0,,,,,,,,[],,,,
1294387312265175043,1294387312265175043,2020-08-14 18:35:58 -0300,2020-08-14,18:35:58,-300,80307396,luistibeoficial,Luis Tibé,,"Destinamos para o município de LONTRA, através de emenda parlamentar e a pedido do pré-candidato a prefeito Eudes Antunes, uma picape que irá beneficiar a comunidade da Vila União e 50 mil reais para estruturação da rede de serviços do sistema único de assistência da APAE.#Avante  https://t.co/LVlVLyFhsr",pt,[],[],"['https://pbs.twimg.com/media/EfaWW_XXkAEPpzM.jpg', 'https://pbs.twimg.com/media/EfaWW_XX0AIb_OF.jpg']",0,0,2,['avante'],[],https://twitter.com/LuisTibeOficial/status/1294387312265175043,False,,1,https://pbs.twimg.com/media/EfaWW_XXkAEPpzM.jpg,,,,,,,[],,,,
1294029359070752768,1294029359070752768,2020-08-13 18:53:35 -0300,2020-08-13,18:53:35,-300,80307396,luistibeoficial,Luis Tibé,,"Em uma parceria com a CODEVASF, nosso mandato enviou um caminhão pipa para a cidade de São João da Ponte, o que trará mais qualidade de vida para toda a população!!  O município pode contar sempre com o nosso trabalho e apoio!!!#LuisTibé #Avante70 #SãoJoãoDaPonte #AvanteBrasil  https://t.co/YcbbtUjUoW",pt,[],[],['https://pbs.twimg.com/media/EfVQ1vjUcAEtcwW.jpg'],0,0,2,"['luistibé', 'avante70', 'sãojoãodaponte', 'avantebrasil']",[],https://twitter.com/LuisTibeOficial/status/1294029359070752768,False,,1,https://pbs.twimg.com/media/EfVQ1vjUcAEtcwW.jpg,,,,,,,[],,,,
1293286235025416194,1293286235025416194,2020-08-11 17:40:41 -0300,2020-08-11,17:40:41,-300,80307396,luistibeoficial,Luis Tibé,,"Nosso mandato, em parceria com a CODEVASF, destinou para o município de Icaraí de Minas, a pedido do prefeito James, um trator traçado e uma carreta pipa com motor, no valor total de 194 mil reais! Contem sempre com o nosso apoio em prol de Icaraí!#LuisTibé #Avante #IcaraíDeMinas  https://t.co/L9bPAbFugW",pt,[],[],"['https://pbs.twimg.com/media/EfKs5X9X0AIFQ7y.jpg', 'https://pbs.twimg.com/media/EfKs5YCWsAAUuxX.jpg']",0,0,3,"['luistibé', 'avante', 'icaraídeminas']",[],https://twitter.com/LuisTibeOficial/status/1293286235025416194,False,,1,https://pbs.twimg.com/media/EfKs5X9X0AIFQ7y.jpg,,,,,,,[],,,,
1292839570757816321,1292839570757816321,2020-08-10 12:05:48 -0300,2020-08-10,12:05:48,-300,80307396,luistibeoficial,Luis Tibé,,"Destinamos, para o município de Piedade dos Gerais, uma pá-carregadeira e uma fábrica (máquina) de blocos/bloquetes no valor total de R$336.290,00, através de emenda parlamentar do nosso mandato. Vamos continuar trabalhando em prol de Piedade dos Gerais!#LuisTibé #Desenvolvimento  https://t.co/vxx8knwoN6",pt,[],[],"['https://pbs.twimg.com/media/EfEWtpnX0AA0NRz.jpg', 'https://pbs.twimg.com/media/EfEWtpmWoAEDWHZ.jpg']",0,0,1,"['luistibé', 'desenvolvimento']",[],https://twitter.com/LuisTibeOficial/status/1292839570757816321,False,,1,https://pbs.twimg.com/media/EfEWtpnX0AA0NRz.jpg,,,,,,,[],,,,
1292492874198716416,1292492874198716416,2020-08-09 13:08:09 -0300,2020-08-09,13:08:09,-300,80307396,luistibeoficial,Luis Tibé,,"Dia de homenagear os heróis sem capa! Ser pai é dedicar-se sem limites. É amar incondicionalmente e ter um coração fora do corpo chamado FILHO(A). Esse ano, demonstre e retribua ao seu pai todo o amor que ele merece. De longe ou de perto! ❤️  #LuisTibé #Avante70 #DiadosPais  https://t.co/IfoJmjppUI",pt,[],[],['https://pbs.twimg.com/media/Ee_bagSXoAAgHBJ.jpg'],0,0,2,"['luistibé', 'avante70', 'diadospais']",[],https://twitter.com/LuisTibeOficial/status/1292492874198716416,False,,1,https://pbs.twimg.com/media/Ee_bagSXoAAgHBJ.jpg,,,,,,,[],,,,
1288928586582446083,1288928586582446083,2020-07-30 17:04:56 -0300,2020-07-30,17:04:56,-300,80307396,luistibeoficial,Luis Tibé,,"Estive em reunião na Fecomércio do estado de Goiás, dentre as pautas, falamos sobre a Reforma Tributária e demandas do setor.   #LuisTibé #AvanteGO #PensandoAvante #Fecomercio #Sicoob  https://t.co/hqkX9ltuIb",pt,[],[],"['https://pbs.twimg.com/media/EeMxrrxWAAUl-6d.jpg', 'https://pbs.twimg.com/media/EeMxrrzX0AYYajb.jpg']",2,1,3,"['luistibé', 'avantego', 'pensandoavante', 'fecomercio', 'sicoob']",[],https://twitter.com/LuisTibeOficial/status/1288928586582446083,False,,1,https://pbs.twimg.com/media/EeMxrrxWAAUl-6d.jpg,,,,,,,[],,,,
1288222571629076485,1288222571629076485,2020-07-28 18:19:29 -0300,2020-07-28,18:19:29,-300,80307396,luistibeoficial,Luis Tibé,,"Enviamos, através de emenda parlamentar, 2 resfriadores de leite para o município de Matias Cardoso, sabemos que cada recurso destinado a melhorar a qualidade de vida dos cidadãos é extremamente importante, principalmente nesse momento em que estamos vivendo.🐄 🥛  #EmendaDoTibé  https://t.co/PzYVRl6DRe",pt,[],[],"['https://pbs.twimg.com/media/EeCvmHnWsAY7ySk.jpg', 'https://pbs.twimg.com/media/EeCvmHnWsAAWQmj.jpg', 'https://pbs.twimg.com/media/EeCvmHmWoAE7uet.jpg']",1,1,4,['emendadotibé'],[],https://twitter.com/LuisTibeOficial/status/1288222571629076485,False,,1,https://pbs.twimg.com/media/EeCvmHnWsAY7ySk.jpg,,,,,,,[],,,,
1287855234577039360,1287855234577039360,2020-07-27 17:59:49 -0300,2020-07-27,17:59:49,-300,80307396,luistibeoficial,Luis Tibé,,"Como membro do conselho na comissão mista da reforma tributária, participei da reunião promovida pela SIAMIG (Associação das Industrias Sucroenergéticas de Minas Gerais), para discutir os impactos de tal reforma no setor sucroenergético.  #LuisTibé #Avante70 #Bioenergia #SIAMIG  https://t.co/m5xgL0Zdkz",pt,[],[],['https://pbs.twimg.com/media/Ed9hgLhWoAQ3afA.jpg'],0,0,2,"['luistibé', 'avante70', 'bioenergia', 'siamig']",[],https://twitter.com/LuisTibeOficial/status/1287855234577039360,False,,1,https://pbs.twimg.com/media/Ed9hgLhWoAQ3afA.jpg,,,,,,,[],,,,
1286264969038901248,1286264969038901248,2020-07-23 08:40:40 -0300,2020-07-23,08:40:40,-300,80307396,luistibeoficial,Luis Tibé,,"Mais do que um líder, um amigo!Neste dia especial, do seu aniversário, além de desejar as mais sinceras felicidades, também agradecemos a oportunidade de fazer parte da sua equipe. Parabéns e muito sucesso!Avante, Tibé!70, abraços!Homenagem da sua equipe!#PensandoAvante #VídeoTBT  https://t.co/D2iqzMz3rX",pt,[],[],[],2,1,8,"['pensandoavante', 'vídeotbt']",[],https://twitter.com/LuisTibeOficial/status/1286264969038901248,False,,1,https://pbs.twimg.com/ext_tw_video_thumb/1286264920565317632/pu/img/4BI8_tMusJ2sM-Zg.jpg,,,,,,,[],,,,
1286030648663330818,1286030648663330818,2020-07-22 17:09:34 -0300,2020-07-22,17:09:34,-300,80307396,luistibeoficial,Luis Tibé,,"O novo Fundeb foi APROVADO! Agora, o fundo responsável pela manutenção do ensino básico no Brasil está garantido e milhões de crianças e adolescentes terão acesso a uma educação de maior qualidade!  Continuamos na luta pela educação!📚#LuisTibé #Avante70 #Educação #Fundeb #Brasil  https://t.co/hlWTIzNKxn",pt,[],[],['https://pbs.twimg.com/media/EdjmBZcWkAQsp7Q.jpg'],1,2,8,"['luistibé', 'avante70', 'educação', 'fundeb', 'brasil']",[],https://twitter.com/LuisTibeOficial/status/1286030648663330818,False,,1,https://pbs.twimg.com/media/EdjmBZcWkAQsp7Q.jpg,,,,,,,[],,,,
1285691887932694529,1285691887932694529,2020-07-21 18:43:27 -0300,2020-07-21,18:43:27,-300,80307396,luistibeoficial,Luis Tibé,,Aprovamos ontem projeto de lei 4731/19 que amplia a área de atuação da CODEVASF. Os Vales do Jequitinhonha e do Mucuri e a região do Alto Rio Pardo poderão ser beneficiários de ações para o desenvolvimento sustentável de suas regiões. #PensandoAvante #CODEVASF #LuisTibé #Avante  https://t.co/4KDmeszm6x,pt,[],[],['https://pbs.twimg.com/media/Edex8kEWoAMnXgG.jpg'],1,0,3,"['pensandoavante', 'codevasf', 'luistibé', 'avante']",[],https://twitter.com/LuisTibeOficial/status/1285691887932694529,False,,1,https://pbs.twimg.com/media/Edex8kEWoAMnXgG.jpg,,,,,,,[],,,,
1285334144403341312,1285334144403341312,2020-07-20 19:01:55 -0300,2020-07-20,19:01:55,-300,80307396,luistibeoficial,Luis Tibé,,"Hoje é Dia da Amizade e quero utilizar essa data muito especial para prestar minhas condolências aos amigos e familiares do grande amigo Genival Matias, que faleceu nesse final de semana. Uma mensagem carinhosa ou uma ligação é suficiente para demonstrar seu amor e cumplicidade!  https://t.co/t4zINuZxjW",pt,[],[],['https://pbs.twimg.com/media/EdZsk7HXsAUhfdy.jpg'],1,0,4,[],[],https://twitter.com/LuisTibeOficial/status/1285334144403341312,False,,1,https://pbs.twimg.com/media/EdZsk7HXsAUhfdy.jpg,,,,,,,[],,,,
1284210532300525574,1284210532300525574,2020-07-17 16:37:05 -0300,2020-07-17,16:37:05,-300,80307396,luistibeoficial,Luis Tibé,,"É com imensa alegria que informo a vocês essa inauguração.  Na próxima segunda-feira (20/07) às 10h00 será inaugurada a UBS de Frutal, construída com recursos indicados no nosso mandato.  #EmendaDoTibé #Frutal #LuisTibé #Avante #UBS  https://t.co/Y3WGbhJSJp",pt,[],[],[],2,1,3,"['emendadotibé', 'frutal', 'luistibé', 'avante', 'ubs']",[],https://twitter.com/LuisTibeOficial/status/1284210532300525574,False,,1,https://pbs.twimg.com/ext_tw_video_thumb/1284210376582856704/pu/img/LHGKCBnQyXlMROKp.jpg,,,,,,,[],,,,
1284148652437655553,1284148652437655553,2020-07-17 12:31:11 -0300,2020-07-17,12:31:11,-300,80307396,luistibeoficial,Luis Tibé,,"Grande conquista para Minas Gerais! Hospitais dos municípios de Contagem, Ibirité e Nanuque receberam respiradores novos e prontos para serem utilizados no tratamento de casos graves de Covid-19.Seguimos nessa batalha contra o novo coronavírus e em defesa da população!#LuisTibé  https://t.co/PIt4XSkze6",pt,[],[],['https://pbs.twimg.com/media/EdI2WX1XYAA0Ix8.jpg'],1,1,5,['luistibé'],[],https://twitter.com/LuisTibeOficial/status/1284148652437655553,False,,1,https://pbs.twimg.com/media/EdI2WX1XYAA0Ix8.jpg,,,,,,,[],,,,
1283843236604379136,1283843235052486656,2020-07-16 16:17:34 -0300,2020-07-16,16:17:34,-300,80307396,luistibeoficial,Luis Tibé,,"Nesta ocasião discutimos a liberação de recursos para obras de reconstrução no município de Contagem, devido aos danos causados pelas fortes chuvas do início deste ano.  #LuisTibé #Avante #Contagem #DefesaCivil  https://t.co/wWSlUFoZ7R",pt,[],[],['https://pbs.twimg.com/media/EdEgmLhX0AEhsYE.jpg'],1,0,2,"['luistibé', 'avante', 'contagem', 'defesacivil']",[],https://twitter.com/LuisTibeOficial/status/1283843236604379136,False,,1,https://pbs.twimg.com/media/EdEgmLhX0AEhsYE.jpg,,,,,,,[],,,,
1283843235052486656,1283843235052486656,2020-07-16 16:17:34 -0300,2020-07-16,16:17:34,-300,80307396,luistibeoficial,Luis Tibé,,"Estive em reunião nessa quinta-feira, 16/07, com o Ministro Rogério Marinho (Desenvolvimento Regional), Coronel Alexandre Lucas Alves, Secretário Nacional de Proteção e Defesa Civil e Alex de Freitas, Prefeito de Contagem.",pt,[],[],[],1,0,2,[],[],https://twitter.com/LuisTibeOficial/status/1283843235052486656,False,,0,,,,,,,,[],,,,
1283087228315541511,1283087228315541511,2020-07-14 14:13:28 -0300,2020-07-14,14:13:28,-300,80307396,luistibeoficial,Luis Tibé,,"Hoje é celebrado o Dia Mundial da Liberdade de Pensamento. Somente oferecendo educação de qualidade é que veremos nossos jovens se tornarem cidadãos pensantes, conscientes, com personalidade e opinião próprias. Viva a liberdade de ideias, de opiniões e de pensamentos! #LuisTibé  https://t.co/iBzGuETK2K",pt,[],[],['https://pbs.twimg.com/media/Ec5wzr-WAAg1K1X.jpg'],1,0,4,['luistibé'],[],https://twitter.com/LuisTibeOficial/status/1283087228315541511,False,,1,https://pbs.twimg.com/media/Ec5wzr-WAAg1K1X.jpg,,,,,,,[],,,,
1280968257332219905,1280968257332219905,2020-07-08 17:53:26 -0300,2020-07-08,17:53:26,-300,80307396,luistibeoficial,Luis Tibé,,"Com a expansão da internet, somos bombardeados com muita informação ao mesmo tempo. Essa imersão no mundo digital nos trouxe muitos benefícios, mas também algumas desvantagens, como as tais FAKE NEWS. Você sabe identificar quando uma notícia é verdadeira e quando ela é falsa? 🤔  https://t.co/gg61nq4YQk",pt,[],[],[],2,0,5,[],[],https://twitter.com/LuisTibeOficial/status/1280968257332219905,False,,1,https://pbs.twimg.com/ext_tw_video_thumb/1280968010023481350/pu/img/51o21BVwKTObI6Cr.jpg,,,,,,,[],,,,
