id,conversation_id,created_at,date,time,timezone,user_id,username,name,place,tweet,language,mentions,urls,photos,replies_count,retweets_count,likes_count,hashtags,cashtags,link,retweet,quote_url,video,thumbnail,near,geo,source,user_rt_id,user_rt,retweet_id,reply_to,retweet_date,translate,trans_src,trans_dest
1519685467775590401,1519685467775590401,2022-04-28 11:30:24 -0300,2022-04-28,11:30:24,-300,80307396,luistibeoficial,Luis Tibé,,#Tbt desse importante dia em Tiradentes.  https://t.co/93meS2OUWr,pt,[],[],[],0,0,1,['tbt'],[],https://twitter.com/LuisTibeOficial/status/1519685467775590401,False,,1,https://pbs.twimg.com/ext_tw_video_thumb/1519685373470945280/pu/img/vRvCpmzQ2pZ2EvEU.jpg,,,,,,,[],,,,
1504174685692567563,1504174685692567563,2022-03-16 16:16:05 -0300,2022-03-16,16:16:05,-300,80307396,luistibeoficial,Luis Tibé,,"Reunião com os ministros Edson Fachin, Alexandre de Moraes e Sergio Banhos com o objetivo de dialogarmos para  estabelecer parceria em defesa da segurança e da lisura do processo eleitoral.  https://t.co/OMB7Vrp0Gu",pt,[],[],['https://pbs.twimg.com/media/FN_m5iiWUAoaZV2.jpg'],5,1,1,[],[],https://twitter.com/LuisTibeOficial/status/1504174685692567563,False,,1,https://pbs.twimg.com/media/FN_m5iiWUAoaZV2.jpg,,,,,,,[],,,,
1496847440636518413,1496847440636518413,2022-02-24 11:00:14 -0300,2022-02-24,11:00:14,-300,80307396,luistibeoficial,Luis Tibé,,Sigo em oração por todos.,pt,[],[],[],11,0,3,[],[],https://twitter.com/LuisTibeOficial/status/1496847440636518413,False,https://twitter.com/somosavante70/status/1496842892123512839,0,,,,,,,,[],,,,
1496501832306286595,1496501832306286595,2022-02-23 12:06:55 -0300,2022-02-23,12:06:55,-300,80307396,luistibeoficial,Luis Tibé,,↗️ Nosso mandato segue Avante para melhoria da saúde em nosso Estado.  https://t.co/Mt8GNAIfvU,pt,[],[],[],1,2,3,[],[],https://twitter.com/LuisTibeOficial/status/1496501832306286595,False,,1,https://pbs.twimg.com/ext_tw_video_thumb/1496501756490039301/pu/img/ix-qCLB4IlU5sFRw.jpg,,,,,,,[],,,,
1496258500053270533,1496258500053270533,2022-02-22 20:00:00 -0300,2022-02-22,20:00:00,-300,80307396,luistibeoficial,Luis Tibé,,"Venha acompanhar de perto nosso mandato! TELEGRAM DO TIBÉ, é só clicar no link:  https://t.co/vYHetq4g4c  https://t.co/Do1L5Moeol",pt,[],['https://t.me/LuisTibe'],[],4,0,1,[],[],https://twitter.com/LuisTibeOficial/status/1496258500053270533,False,,1,https://pbs.twimg.com/ext_tw_video_thumb/1496207745162391553/pu/img/mql-mVPjWCSRM_4k.jpg,,,,,,,[],,,,
1490810011051859972,1490810011051859972,2022-02-07 19:09:39 -0300,2022-02-07,19:09:39,-300,80307396,luistibeoficial,Luis Tibé,,"Você mais próximo do nosso mandato. Informações do nosso trabalho e de Minas Gerais. TELEGRAM DO TIBÉ, é só clicar no link:  https://t.co/vYHetqlRsM  https://t.co/aPLzF7oac7",pt,[],['https://t.me/LuisTibe'],[],3,0,1,[],[],https://twitter.com/LuisTibeOficial/status/1490810011051859972,False,,1,https://pbs.twimg.com/ext_tw_video_thumb/1490809717953859586/pu/img/8JhvusxXMXN0hMgE.jpg,,,,,,,[],,,,
1488889947880787971,1488889947880787971,2022-02-02 12:00:00 -0300,2022-02-02,12:00:00,-300,80307396,luistibeoficial,Luis Tibé,,Nosso trabalho é entender as demandas da sociedade e transformar isso em projetos viáveis que vão trazer melhorias para todos.   Tudo o que fazemos só tem sentido se for para transformar a vida daqueles que acreditaram em nós e nos deram essa oportunidade.  https://t.co/7qTkXHEJcR,pt,[],[],['https://pbs.twimg.com/media/FKmRQTmWQAcMuxQ.jpg'],5,0,5,[],[],https://twitter.com/LuisTibeOficial/status/1488889947880787971,False,,1,https://pbs.twimg.com/media/FKmRQTmWQAcMuxQ.jpg,,,,,,,[],,,,
1485598659425316864,1485598659425316864,2022-01-24 10:01:36 -0300,2022-01-24,10:01:36,-300,80307396,luistibeoficial,Luis Tibé,,"O município de Araújos, na região Centro-Oeste de MG, recebeu uma emenda parlamentar, de minha autoria, no valor de R$300mil. Os recursos serão utilizados, principalmente, para a manutenção das unidades de atenção básica de saúde garantindo a qualidade no atendimento à população.  https://t.co/fs7ovUhP4v",pt,[],[],['https://pbs.twimg.com/media/FJ3oGOxWQAEmz_6.jpg'],6,1,5,[],[],https://twitter.com/LuisTibeOficial/status/1485598659425316864,False,,1,https://pbs.twimg.com/media/FJ3oGOxWQAEmz_6.jpg,,,,,,,[],,,,
1481615309278752772,1481615309278752772,2022-01-13 10:13:11 -0300,2022-01-13,10:13:11,-300,80307396,luistibeoficial,Luis Tibé,,"O principal objetivo do meu mandato é ajudar a transformar a vida de quem mais precisa.   Sei que ainda há um longo caminho a ser percorrido, mas pode ter certeza de que não me falta disposição para trabalhar por Minas Gerais e pelo Brasil.   Conto com o seu apoio!  https://t.co/tOMVqId6wl",pt,[],[],['https://pbs.twimg.com/media/FI_BQzJXIAAbIvr.jpg'],6,0,4,[],[],https://twitter.com/LuisTibeOficial/status/1481615309278752772,False,,1,https://pbs.twimg.com/media/FI_BQzJXIAAbIvr.jpg,,,,,,,[],,,,
1469468434660474885,1469468434660474885,2021-12-10 21:45:50 -0300,2021-12-10,21:45:50,-300,80307396,luistibeoficial,Luis Tibé,,Água para todos 💦  Fico extremamente satisfeito em saber que esses recursos vão melhorar a qualidade de vida do produtor rural. Conte sempre com o nosso mandato prefeito Mario Osvaldo 🤜🏻🤛🏻  https://t.co/pF5cVKS3Ji,pt,[],[],[],2,1,1,[],[],https://twitter.com/LuisTibeOficial/status/1469468434660474885,False,,1,https://pbs.twimg.com/ext_tw_video_thumb/1469468359947440130/pu/img/oko51Bt18rMAw1Nn.jpg,,,,,,,[],,,,
1466065527529512969,1466065527529512969,2021-12-01 12:23:54 -0300,2021-12-01,12:23:54,-300,80307396,luistibeoficial,Luis Tibé,,"R$200 mil para a Assistência Social de Patrocínio-MG!  120 usuários da APAE do município serão beneficiados pela reforma na unidade, melhorias que vão desde obras no espaço de aprendizagem até a revitalização de toda a pintura externa da unidade.  https://t.co/y8xx7RXmO8",pt,[],[],['https://pbs.twimg.com/media/FFiC0qjXwAYxAvN.jpg'],1,1,1,[],[],https://twitter.com/LuisTibeOficial/status/1466065527529512969,False,,1,https://pbs.twimg.com/media/FFiC0qjXwAYxAvN.jpg,,,,,,,[],,,,
1463614777012465671,1463614777012465671,2021-11-24 18:05:30 -0300,2021-11-24,18:05:30,-300,80307396,luistibeoficial,Luis Tibé,,"Uma ajuda fundamental para os produtores rurais de Montalvânia-MG  Por meio da Companhia de Desenvolvimento dos Vales do São Francisco e do Parnaíba (Codevasf) destinei recursos para a compra de um trator com grade aradora, equipamento fundamental para o plantio da região.  https://t.co/SQe3O7R2lP",pt,[],[],['https://pbs.twimg.com/media/FE_N4HIWUA0vlP-.jpg'],0,0,3,[],[],https://twitter.com/LuisTibeOficial/status/1463614777012465671,False,,1,https://pbs.twimg.com/media/FE_N4HIWUA0vlP-.jpg,,,,,,,[],,,,
1463240512828227594,1463240512828227594,2021-11-23 17:18:18 -0300,2021-11-23,17:18:18,-300,80307396,luistibeoficial,Luis Tibé,,"Bate-papo em Ibirité com as lideranças para ouvir os anseios do município e região.  Obrigado ao prefeito, William Parreira e ao secretario de governo, Beto Alegria pela parceria em prol de toda população.  https://t.co/11R2Y2Sa88",pt,[],[],"['https://pbs.twimg.com/media/FE55c5qXIAMUEPa.jpg', 'https://pbs.twimg.com/media/FE55c5qWYAsJtkM.jpg']",0,0,2,[],[],https://twitter.com/LuisTibeOficial/status/1463240512828227594,False,,1,https://pbs.twimg.com/media/FE55c5qXIAMUEPa.jpg,,,,,,,[],,,,
1461824104173031434,1461824104173031434,2021-11-19 19:30:00 -0300,2021-11-19,19:30:00,-300,80307396,luistibeoficial,Luis Tibé,,"Uma ajuda aos pequenos produtores de Santa Fé de Minas!  Equipamento de grande ajuda na construção de barragens e barraginhas na zona rural do município, a destinação dessa pá carregadeira irá levar mais conforto aos produtores na condução dos trabalhos.  E contem sempre comigo!  https://t.co/xmySBJakdo",pt,[],[],['https://pbs.twimg.com/media/FElmlxDWUAA9-VK.jpg'],1,0,3,[],[],https://twitter.com/LuisTibeOficial/status/1461824104173031434,False,,1,https://pbs.twimg.com/media/FElmlxDWUAA9-VK.jpg,,,,,,,[],,,,
1461092680105177091,1461092680105177091,2021-11-17 19:03:35 -0300,2021-11-17,19:03:35,-300,80307396,luistibeoficial,Luis Tibé,,"O PL  8489/2017, de minha autoria, foi aprovado pela Comissão de Defesa dos Direitos das Pessoas com Deficiência da Câmara dos Deputados. O objetivo é assegurar condições adequadas para realização de provas por pessoas com dislexia e outros transtornos de aprendizagem.  https://t.co/sfEkz6PcNp",pt,[],[],['https://pbs.twimg.com/media/FEbYB9aXIAQLdk6.jpg'],1,0,2,[],[],https://twitter.com/LuisTibeOficial/status/1461092680105177091,False,,1,https://pbs.twimg.com/media/FEbYB9aXIAQLdk6.jpg,,,,,,,[],,,,
1458744287546511367,1458744287546511367,2021-11-11 07:31:54 -0300,2021-11-11,07:31:54,-300,80307396,luistibeoficial,Luis Tibé,,"R$100 mil destinados para incentivar o esporte em Monte Azul!  O recurso será utilizado para a construção de uma quadra na comunidade Lagedo do Gato e toda a comunidade será beneficiada.  Meu mandato está sempre à disposição, Monte Azul!  https://t.co/aVMb0cOYTj",pt,[],[],['https://pbs.twimg.com/media/FD6AMdyXIAAnzvY.jpg'],14,0,2,[],[],https://twitter.com/LuisTibeOficial/status/1458744287546511367,False,,1,https://pbs.twimg.com/media/FD6AMdyXIAAnzvY.jpg,,,,,,,[],,,,
1458587370299830275,1458587370299830275,2021-11-10 21:08:22 -0300,2021-11-10,21:08:22,-300,80307396,luistibeoficial,Luis Tibé,,"Após destinar um caminhão pipa para o município de Perdigão, no Centro-Oeste de Minas, recebi a foto do agradecimento carinhoso da população.Em parceria com o deputado estadual, Fábio Avelar, conquistamos esse recurso para o município, que vai ajudar muito na qualidade de vida.  https://t.co/3x9dhsUU0G",pt,[],[],['https://pbs.twimg.com/media/FD3xeCMWQAA55qU.jpg'],3,0,3,[],[],https://twitter.com/LuisTibeOficial/status/1458587370299830275,False,,1,https://pbs.twimg.com/media/FD3xeCMWQAA55qU.jpg,,,,,,,[],,,,
1458549911008468993,1458549911008468993,2021-11-10 18:39:31 -0300,2021-11-10,18:39:31,-300,80307396,luistibeoficial,Luis Tibé,,"Emenda do Tibé ✅ O município de Caeté, na Região Metropolitana de Belo Horizonte, recebeu uma emenda parlamentar de minha autoria no valor de R$ 500 mil.  O recurso será destinado para a Santa Casa de Caeté e ajudará na manutenção e funcionamento da instituição.  #LuisTibé  https://t.co/XiwyBFdTzX",pt,[],[],['https://pbs.twimg.com/media/FD3PZIrXMAoq1KN.jpg'],3,0,1,['luistibé'],[],https://twitter.com/LuisTibeOficial/status/1458549911008468993,False,,1,https://pbs.twimg.com/media/FD3PZIrXMAoq1KN.jpg,,,,,,,[],,,,
1456734209846956044,1456734209846956044,2021-11-05 18:24:35 -0300,2021-11-05,18:24:35,-300,80307396,luistibeoficial,Luis Tibé,,"Esse é um de tantos belos registros que venho construindo ao longo do meu mandato. Se me perguntar qual a primeira coisa que me vem à cabeça ao falar do meu trabalho, imagens como essa falam por mim.   E assim sigo colocando meu mandato à disposição de Minas Gerais e do Brasil.  https://t.co/6iFRGIcGyt",pt,[],[],['https://pbs.twimg.com/media/FDdb4RcXIAUoXat.jpg'],8,0,1,[],[],https://twitter.com/LuisTibeOficial/status/1456734209846956044,False,,1,https://pbs.twimg.com/media/FDdb4RcXIAUoXat.jpg,,,,,,,[],,,,
1450577669008109569,1450577669008109569,2021-10-19 18:40:41 -0300,2021-10-19,18:40:41,-300,80307396,luistibeoficial,Luis Tibé,,"Fortalecendo a infraestrutura! 🤝  Nosso compromisso com a população de Araújos segue Avante. Destinamos emenda parlamentar para a prefeitura, no valor de R$ 350 mil, que possibilitou a compra de uma retroescavadeira. Mais obras e desenvolvimento para o município! #EmendaDoTibé  https://t.co/W4vFWbjWDY",pt,[],[],[],9,0,0,['emendadotibé'],[],https://twitter.com/LuisTibeOficial/status/1450577669008109569,False,,1,https://pbs.twimg.com/ext_tw_video_thumb/1450577509444108290/pu/img/vCFry_iVA_iGUymg.jpg,,,,,,,[],,,,
1448723218420875264,1448723218420875264,2021-10-14 15:51:45 -0300,2021-10-14,15:51:45,-300,80307396,luistibeoficial,Luis Tibé,,"Mais investimentos para Piracema que passa a contar com uma pá carregadeira, entregue por meio de emenda do nosso mandato, no valor de R$ 480 mil. Além disso, a saúde também ganha reforço com outra emenda que destinei, no valor de R$ 500 mil.  https://t.co/liU0PkLxF0",pt,[],[],['https://pbs.twimg.com/media/FBrmEMxXEAAi2wm.jpg'],14,1,3,[],[],https://twitter.com/LuisTibeOficial/status/1448723218420875264,False,,1,https://pbs.twimg.com/media/FBrmEMxXEAAi2wm.jpg,,,,,,,[],,,,
1446061804623437830,1446061804623437830,2021-10-07 07:36:15 -0300,2021-10-07,07:36:15,-300,80307396,luistibeoficial,Luis Tibé,,"Um lixo com a destinação correta, garante saúde pública para a sociedade como um todo! Foi pensando nisto, que destinei para o município de Crucilândia, um caminhão compactador de resíduos sólidos no valor de R$ 356 mil.  O equipamento foi destinado via Codevasf.  #LuisTibé  https://t.co/5UH2Nc2PHh",pt,[],[],['https://pbs.twimg.com/media/FBFxijAXMAAxuv-.jpg'],7,0,3,['luistibé'],[],https://twitter.com/LuisTibeOficial/status/1446061804623437830,False,,1,https://pbs.twimg.com/media/FBFxijAXMAAxuv-.jpg,,,,,,,[],,,,
1445870081205055489,1445870081205055489,2021-10-06 18:54:24 -0300,2021-10-06,18:54:24,-300,80307396,luistibeoficial,Luis Tibé,,"Reconhecimento ao trabalho de todos os meus colegas que atuam nas prefeituras de cada região do nosso país! Desejo que cada um de vocês continuem a exercer de forma plena seus papéis à frente, no objetivo de construirmos cidades melhores para cada brasileiro e brasileira.  https://t.co/37fuJMKYmp",pt,[],[],['https://pbs.twimg.com/media/FBDDLCEUUAsoVOM.jpg'],0,0,2,[],[],https://twitter.com/LuisTibeOficial/status/1445870081205055489,False,,1,https://pbs.twimg.com/media/FBDDLCEUUAsoVOM.jpg,,,,,,,[],,,,
1445753567629873160,1445753567629873160,2021-10-06 11:11:25 -0300,2021-10-06,11:11:25,-300,80307396,luistibeoficial,Luis Tibé,,Destinamos emenda parlamentar no valor de R$600 mil para a Santa Casa de Belo Horizonte. ✔️  ↗️Dê um play e confira como o recurso irá ajudar a saúde do município.  https://t.co/Iw027awWxp,pt,[],[],[],2,0,0,[],[],https://twitter.com/LuisTibeOficial/status/1445753567629873160,False,,1,https://pbs.twimg.com/ext_tw_video_thumb/1445753361559552001/pu/img/O7oyUFchmDNyG3n0.jpg,,,,,,,[],,,,
1445493131743354882,1445493131743354882,2021-10-05 17:56:33 -0300,2021-10-05,17:56:33,-300,80307396,luistibeoficial,Luis Tibé,,"Avante Paraná tem novo presidente ↗️ Estive com o governador do Paraná @ratinho_jr  e o chefe da Casa Civil @GUTOSILVA1 para oficializarmos Rodrigo Pina como novo presidente do Avante no Estado. Vem muito trabalho pela frente. Seja bem-vindo Rodrido Pina! Avante, Paraná!  https://t.co/PDCkpnajAS",pt,"[{'screen_name': 'ratinho_jr', 'name': '@ratinho_jr', 'id': '95904965'}, {'screen_name': 'gutosilva1', 'name': 'guto silva', 'id': '1458130780782276613'}]",[],"['https://pbs.twimg.com/media/FA9sUpbVkAMyQda.jpg', 'https://pbs.twimg.com/media/FA9sUpeVcAkCdaB.jpg', 'https://pbs.twimg.com/media/FA9sUnwVEAoqrGM.jpg']",2,0,3,[],[],https://twitter.com/LuisTibeOficial/status/1445493131743354882,False,,1,https://pbs.twimg.com/media/FA9sUpbVkAMyQda.jpg,,,,,,,[],,,,
1445047077533364227,1445047077533364227,2021-10-04 12:24:05 -0300,2021-10-04,12:24:05,-300,80307396,luistibeoficial,Luis Tibé,,"Me reuni nesta segunda-feira (4) com o sec. de Governo de MG @igoreto_ , juntamente com os deputados estaduais do Avante Bosco e Fabio Avelar e o companheiro de bancada @AndreJanonesAdv , para discutirmos sobre as demandas do Estado e alinharmos ações para beneficiar os mineiros.  https://t.co/7yOeCpYw8q",pt,"[{'screen_name': 'igoreto_', 'name': 'igor eto', 'id': '940282192592285696'}, {'screen_name': 'andrejanonesadv', 'name': 'andré janones', 'id': '1198004545'}]",[],['https://pbs.twimg.com/media/FA3WnYoXEAUMyHR.jpg'],13,2,4,[],[],https://twitter.com/LuisTibeOficial/status/1445047077533364227,False,,1,https://pbs.twimg.com/media/FA3WnYoXEAUMyHR.jpg,,,,,,,[],,,,
1443301322439135234,1443301322439135234,2021-09-29 16:47:05 -0300,2021-09-29,16:47:05,-300,80307396,luistibeoficial,Luis Tibé,,"Por meio da destinação de R$180 mil para compra de trator equipado com grade aradora, Indaiabira terá muito mais motivos para seguir produzindo e crescendo!  #LuisTibé #PensandoAvante #Agricultura #Indaiabira #MinasGerais  https://t.co/mxBxhKCOoU",pt,[],[],['https://pbs.twimg.com/media/FAei5PfWUAsh1Nu.jpg'],22,0,2,"['luistibé', 'pensandoavante', 'agricultura', 'indaiabira', 'minasgerais']",[],https://twitter.com/LuisTibeOficial/status/1443301322439135234,False,,1,https://pbs.twimg.com/media/FAei5PfWUAsh1Nu.jpg,,,,,,,[],,,,
1441396956509532167,1441396956509532167,2021-09-24 10:39:48 -0300,2021-09-24,10:39:48,-300,80307396,luistibeoficial,Luis Tibé,,"Com emenda parlamentar que destinei, a pavimentação da zona rural de Crucilândia agora terá mais fluxo.A boa notícia não é só para quem precisa passar por ali, mas também para o agronegócio do município, já que o tráfego de mercadorias agora terá mais celeridade. #LuisTibé  https://t.co/sg9cKqIxXB",pt,[],[],"['https://pbs.twimg.com/media/FADe4ZNVQAEJdnz.jpg', 'https://pbs.twimg.com/media/FADe4YuXsAMrIF1.jpg']",12,0,2,['luistibé'],[],https://twitter.com/LuisTibeOficial/status/1441396956509532167,False,,1,https://pbs.twimg.com/media/FADe4ZNVQAEJdnz.jpg,,,,,,,[],,,,
1440727222659137551,1440727222659137551,2021-09-22 14:18:31 -0300,2021-09-22,14:18:31,-300,80307396,luistibeoficial,Luis Tibé,,"Recebendo em Brasília o prefeito de Santa Fé de Minas, Júnior Leite,  o vice-prefeito, Professor Cláudio Bento e os vereadores Emerson Nascimento e Hudson Santos. #LuisTibe #PensandoAvante  https://t.co/PFtYE3aY5N",pt,[],[],['https://pbs.twimg.com/media/E_59wmpVgAIC7aD.jpg'],2,1,2,"['luistibe', 'pensandoavante']",[],https://twitter.com/LuisTibeOficial/status/1440727222659137551,False,,1,https://pbs.twimg.com/media/E_59wmpVgAIC7aD.jpg,,,,,,,[],,,,
1440455190180622345,1440455190180622345,2021-09-21 20:17:34 -0300,2021-09-21,20:17:34,-300,80307396,luistibeoficial,Luis Tibé,,"Recebendo em Brasília o prefeito de Formoso, Dinarte, o vice-prefeito Jane, o vereador Messias e os ex-vereadores Rosemar e Romeu. #LuisTibé #PensandoAvante  https://t.co/w48Bvq6t0W",pt,[],[],['https://pbs.twimg.com/media/E_2GWmEUUAYPAoq.jpg'],3,0,0,"['luistibé', 'pensandoavante']",[],https://twitter.com/LuisTibeOficial/status/1440455190180622345,False,,1,https://pbs.twimg.com/media/E_2GWmEUUAYPAoq.jpg,,,,,,,[],,,,
1438956528627851280,1438956528627851280,2021-09-17 17:02:25 -0300,2021-09-17,17:02:25,-300,80307396,luistibeoficial,Luis Tibé,,Estive com o secretário municipal de Proteção aos Animais e presidente do Avante Rio de Janeiro @viniciuscordeiro70 e com o secretário de Estado do Idoso @pedregaloficial para alinhar as ações do partido no Estado. #LuisTibé  https://t.co/VEVbyHdVUK,pt,"[{'screen_name': 'pedregaloficial', 'name': 'pedregal ordinário', 'id': '1312237922238771201'}]",[],['https://pbs.twimg.com/media/E_gzU8lWEAYXsoo.jpg'],1,0,0,['luistibé'],[],https://twitter.com/LuisTibeOficial/status/1438956528627851280,False,,1,https://pbs.twimg.com/media/E_gzU8lWEAYXsoo.jpg,,,,,,,[],,,,
1436033340008697857,1436033340008697857,2021-09-09 15:26:43 -0300,2021-09-09,15:26:43,-300,80307396,luistibeoficial,Luis Tibé,,"✅APROVADO - PL 783/2021 o qual fui relator.  A proposta permite, nas eleições proporcionais, a participação na distribuição dos lugares apenas dos partidos que tiverem obtido quociente eleitoral. A matéria retorna ao Senado Federal para análise.  https://t.co/xYlPbVpYKc",pt,[],[],[],3,0,2,[],[],https://twitter.com/LuisTibeOficial/status/1436033340008697857,False,,1,https://pbs.twimg.com/ext_tw_video_thumb/1436033239412625410/pu/img/u2kO7SFwra8wvFrd.jpg,,,,,,,[],,,,
1430137400215416834,1430137400215416834,2021-08-24 08:58:21 -0300,2021-08-24,08:58:21,-300,80307396,luistibeoficial,Luis Tibé,,"Fortalecendo a saúde!Afirmando ainda mais o nosso compromisso com a população, destinamos através de emenda parlamentar, para o município de Divino das Laranjeiras, um ônibus no valor de R$310 mil, que será utilizado para atender as demandas da saúde na região.  Seguimos, Avante!  https://t.co/S2h8zlJUYa",pt,[],[],['https://pbs.twimg.com/media/E9jeYgdX0CE5o8j.jpg'],3,2,3,[],[],https://twitter.com/LuisTibeOficial/status/1430137400215416834,False,,1,https://pbs.twimg.com/media/E9jeYgdX0CE5o8j.jpg,,,,,,,[],,,,
1428462474894917652,1428462474894917652,2021-08-19 18:02:48 -0300,2021-08-19,18:02:48,-300,80307396,luistibeoficial,Luis Tibé,,Investimentos que importam!✅  Destinei emenda parlamentar no valor de R$207 mil para o município de São Pedro do Suaçuí. Essa verba será usada para  melhorias no setor da saúde.  #LuisTibé #PensandoAvante #Saúde #SãoPedroDoSuaçui #MinsaGerais  https://t.co/CESVbYgSi3,pt,[],[],['https://pbs.twimg.com/media/E9LrDBHXMAEXdFX.jpg'],4,0,2,"['luistibé', 'pensandoavante', 'saúde', 'sãopedrodosuaçui', 'minsagerais']",[],https://twitter.com/LuisTibeOficial/status/1428462474894917652,False,,1,https://pbs.twimg.com/media/E9LrDBHXMAEXdFX.jpg,,,,,,,[],,,,
1425920582726586373,1425920582726586373,2021-08-12 17:42:13 -0300,2021-08-12,17:42:13,-300,80307396,luistibeoficial,Luis Tibé,,Mais saúde! ✅ A saúde é uma das prioridades do nosso mandato. O município de Bambuí foi contemplado com uma ambulância para melhorar a assistência da população no acesso aos serviços de saúde.  #LuisTibé #AvanteNacional #Avante70 #PensandoAvante #EmendaParlamentar #Saúde #Bambuí  https://t.co/u1OGq6kb3z,pt,[],[],['https://pbs.twimg.com/media/E8njNSkXEAAR-ye.jpg'],1,0,0,"['luistibé', 'avantenacional', 'avante70', 'pensandoavante', 'emendaparlamentar', 'saúde', 'bambuí']",[],https://twitter.com/LuisTibeOficial/status/1425920582726586373,False,,1,https://pbs.twimg.com/media/E8njNSkXEAAR-ye.jpg,,,,,,,[],,,,
1425648424305709058,1425648424305709058,2021-08-11 23:40:46 -0300,2021-08-11,23:40:46,-300,80307396,luistibeoficial,Luis Tibé,, https://t.co/ahP7H1hXaY,und,[],['https://avante70.org.br/noticias/camara-dos-deputados-rejeita-proposta-do-distritao-para-as-proximas-eleicoes/'],[],1,0,0,[],[],https://twitter.com/LuisTibeOficial/status/1425648424305709058,False,,0,,,,,,,,[],,,,
1425448880762769416,1425448880762769416,2021-08-11 10:27:51 -0300,2021-08-11,10:27:51,-300,80307396,luistibeoficial,Luis Tibé,,Zezinho da Vitalina pode contar  sempre com o apoio do nosso mandato em prol da população de Capelinha.  #PensandoAvante #Capelinha #saneamentobásico #Saúde  https://t.co/rNBcyIhC06,pt,[],[],[],10,0,4,"['pensandoavante', 'capelinha', 'saneamentobásico', 'saúde']",[],https://twitter.com/LuisTibeOficial/status/1425448880762769416,False,,1,https://pbs.twimg.com/ext_tw_video_thumb/1425448822025641998/pu/img/na6qsdmVCBGe0O-6.jpg,,,,,,,[],,,,
1424346428055359492,1424346428055359492,2021-08-08 09:27:06 -0300,2021-08-08,09:27:06,-300,80307396,luistibeoficial,Luis Tibé,,"Quanta falta o senhor faz, desde que partiu, no ano passado! Mas aqui ficam seus ensinamentos, valores e traços de alguém que esteve comigo nos momentos mais decisivos e foi o melhor amigo que tive a honra de ter em toda minha vida. E a todos os pais, um Feliz Dia dos Pais! 👨‍👧‍👦  https://t.co/LMAJ0qVLPN",pt,[],[],['https://pbs.twimg.com/media/E8RLhgjXMAEdO5W.jpg'],21,0,1,[],[],https://twitter.com/LuisTibeOficial/status/1424346428055359492,False,,1,https://pbs.twimg.com/media/E8RLhgjXMAEdO5W.jpg,,,,,,,[],,,,
1422924232770609153,1422924232770609153,2021-08-04 11:15:48 -0300,2021-08-04,11:15:48,-300,80307396,luistibeoficial,Luis Tibé,,Protocolei na Câmara dos Deputados o projeto de lei que inclui como grupo prioritário do Plano Nacional de Operacionalização da Vacinação contra a Covid-19 estudantes participantes de intercâmbio no exterior que estejam com viagens agendadas.  #LuisTibé #AvanteNacional  #Covid19  https://t.co/PpbNs0o9bt,pt,[],[],['https://pbs.twimg.com/media/E78-ClBWUAcTGfh.jpg'],13,2,6,"['luistibé', 'avantenacional', 'covid19']",[],https://twitter.com/LuisTibeOficial/status/1422924232770609153,False,,1,https://pbs.twimg.com/media/E78-ClBWUAcTGfh.jpg,,,,,,,[],,,,
1420546124658749448,1420546124658749448,2021-07-28 21:46:03 -0300,2021-07-28,21:46:03,-300,80307396,luistibeoficial,Luis Tibé,,"Em Ilicínea me reuni com o prefeito Nirlei do Sindicato, o vice-prefeito do Avante, Bruno Miguel, a secretária de Saúde, Cristiane Barbosa e vereadores. Além de conversarmos sobre as demandas da cidade, pude ver de perto a diferença dos recursos destinados via emenda parlamentar.  https://t.co/OYnF2Vqchl",pt,[],[],"['https://pbs.twimg.com/media/E7bLKqnXIAYMJMk.jpg', 'https://pbs.twimg.com/media/E7bLKqnXIAANLoo.jpg', 'https://pbs.twimg.com/media/E7bLKqoXMAA966D.jpg', 'https://pbs.twimg.com/media/E7bLKqoXEAI9tfI.jpg']",2,0,1,[],[],https://twitter.com/LuisTibeOficial/status/1420546124658749448,False,,1,https://pbs.twimg.com/media/E7bLKqnXIAYMJMk.jpg,,,,,,,[],,,,
1412791011512836103,1412791011512836103,2021-07-07 12:10:00 -0300,2021-07-07,12:10:00,-300,80307396,luistibeoficial,Luis Tibé,,"Minas terá a maior usina solar do planeta e vai gerar mais de 5mil mega watts, podendo abastecer mais de 4mi de residências. O investimento será de cerca de R$17bi e trará à comunidade benefícios com a geração de emprego e renda, além de preservar riquezas culturais e ambientais.  https://t.co/AlEz8dSisV",pt,[],[],['https://pbs.twimg.com/media/E5s92IeWUAIpEsM.jpg'],16,0,3,[],[],https://twitter.com/LuisTibeOficial/status/1412791011512836103,False,,1,https://pbs.twimg.com/media/E5s92IeWUAIpEsM.jpg,,,,,,,[],,,,
