id,conversation_id,created_at,date,time,timezone,user_id,username,name,place,tweet,language,mentions,urls,photos,replies_count,retweets_count,likes_count,hashtags,cashtags,link,retweet,quote_url,video,thumbnail,near,geo,source,user_rt_id,user_rt,retweet_id,reply_to,retweet_date,translate,trans_src,trans_dest
1411026506273411079,1411026506273411079,2021-07-02 15:18:29 -0300,2021-07-02,15:18:29,-300,80307396,luistibeoficial,Luis Tibé,,"O meu PL2.097/11, que torna obrigatório o fornecimento de cadernos de provas impressas no sistema braile a candidatos deficientes visuais, inscritos em concursos públicos realizados por órgãos e entidades da Administração Pública Federal, foi aprovado!  https://t.co/nUzvxmBWzB",pt,[],[],['https://pbs.twimg.com/media/E5T5IGZXIAcvNUr.jpg'],14,2,3,[],[],https://twitter.com/LuisTibeOficial/status/1411026506273411079,False,,1,https://pbs.twimg.com/media/E5T5IGZXIAcvNUr.jpg,,,,,,,[],,,,
1410241640112037900,1410241640112037900,2021-06-30 11:19:42 -0300,2021-06-30,11:19:42,-300,80307396,luistibeoficial,Luis Tibé,,"Destinei emenda parlamentar para as áreas da saúde e assistência social do município de Areado, no Sul de Minas. A cidade vai receber o valor de R$350 mil, sendo R$ 250 mil para a saúde e mais R$ 100 mil para auxiliar o funcionamento da APAE. #EmendaDoTibé  https://t.co/5OLDQBWxPn",pt,[],[],['https://pbs.twimg.com/media/E5IvMPnWEAUP0fX.jpg'],14,1,1,['emendadotibé'],[],https://twitter.com/LuisTibeOficial/status/1410241640112037900,False,,1,https://pbs.twimg.com/media/E5IvMPnWEAUP0fX.jpg,,,,,,,[],,,,
1407057327719583747,1407057327719583747,2021-06-21 16:26:23 -0300,2021-06-21,16:26:23,-300,80307396,luistibeoficial,Luis Tibé,,"Destinei emenda parlamentar, no valor de R$270 mil, para o Hospital Bom Samaritano, em Teófilo Otoni. O recurso foi solicitado pelo vereador e presidente da Câmara, Fábio Lemes (Avante).  https://t.co/2Po3wKSvKd",pt,[],[],['https://pbs.twimg.com/media/E4bfDhaXIAE59n_.jpg'],56,0,2,[],[],https://twitter.com/LuisTibeOficial/status/1407057327719583747,False,,1,https://pbs.twimg.com/media/E4bfDhaXIAE59n_.jpg,,,,,,,[],,,,
1404460557768564741,1404460557768564741,2021-06-14 12:27:45 -0300,2021-06-14,12:27:45,-300,80307396,luistibeoficial,Luis Tibé,,Estou na torcida pelos estudantes de Minas Gerais que participam da etapa nacional do Festival SESI de Robótica! Saiba mais:  https://t.co/2mw5SzZHXq  #SESIRobótica #ARobóticaTáON #RePLAYBrasil #UltimateGoalBrasil #F1inSchools  https://t.co/P0Kmwn7L3J,pt,[],['https://bit.ly/2SpnvYA'],['https://pbs.twimg.com/media/E32lJg4XwAAqTxm.jpg'],13,0,2,"['sesirobótica', 'arobóticatáon', 'replaybrasil', 'ultimategoalbrasil', 'f1inschools']",[],https://twitter.com/LuisTibeOficial/status/1404460557768564741,False,,1,https://pbs.twimg.com/media/E32lJg4XwAAqTxm.jpg,,,,,,,[],,,,
1403002882513797125,1403002882513797125,2021-06-10 11:55:28 -0300,2021-06-10,11:55:28,-300,80307396,luistibeoficial,Luis Tibé,,"Reforma Eleitoral ✅  A discussão é ampla e, eu, como presidente da Comissão Especial da Reforma Eleitoral, busco atuar de forma democrática, ouvindo todas as ideias, que podem beneficiar ao parlamento mas, principalmente, a todo o país nas próximas eleições.  #LuisTibé #Avante  https://t.co/pEA6LK5pWR",pt,[],[],[],16,1,2,"['luistibé', 'avante']",[],https://twitter.com/LuisTibeOficial/status/1403002882513797125,False,,1,https://pbs.twimg.com/ext_tw_video_thumb/1403002578959433735/pu/img/FBdr5ZWyXj5T208T.jpg,,,,,,,[],,,,
1398345788070170631,1398345788070170631,2021-05-28 15:29:50 -0300,2021-05-28,15:29:50,-300,80307396,luistibeoficial,Luis Tibé,,"Em Indaiabira, eu e o deputado @ArlenSantiago fomos recebidos pelos amigos Manoel de Nita e Tim. Agradeço aos vereadores Demir do Pintado e Kembleu, além da Ana da Saúde, importante liderança da cidade pela acolhida. Foi uma conversa muito produtiva. #TibéNoNorteDeMinas  https://t.co/RNTG4JybFA",pt,"[{'screen_name': 'arlensantiago', 'name': 'arlen santiago', 'id': '42630237'}]",[],"['https://pbs.twimg.com/media/E2fsBk-XoAE6fh1.jpg', 'https://pbs.twimg.com/media/E2fsBk9WYAIzapw.jpg', 'https://pbs.twimg.com/media/E2fsBk6XwAEORv5.jpg']",9,0,0,['tibénonortedeminas'],[],https://twitter.com/LuisTibeOficial/status/1398345788070170631,False,,1,https://pbs.twimg.com/media/E2fsBk-XoAE6fh1.jpg,,,,,,,[],,,,
1398296152970305536,1398296152970305536,2021-05-28 12:12:36 -0300,2021-05-28,12:12:36,-300,80307396,luistibeoficial,Luis Tibé,,"Iniciamos nosso 2° dia de agenda no Norte de MG em Gameleiras. Fomos recebidos pelos vereadores Idi de Zael, Valdir, Acir da Vila, Gislaine de Dio e lideranças locais na casa do ex-prefeito Dú de Getúlio para conversar sobre as necessidades da região e pensar em novos projetos.  https://t.co/ZJKVKPkHsx",pt,[],[],"['https://pbs.twimg.com/media/E2e-7ZUXIAEk5Xh.jpg', 'https://pbs.twimg.com/media/E2e-7ZZWUAI2oTc.jpg', 'https://pbs.twimg.com/media/E2e-7ZbWYAQjX4i.jpg', 'https://pbs.twimg.com/media/E2e-7ZZWQAELaD7.jpg']",1,0,0,[],[],https://twitter.com/LuisTibeOficial/status/1398296152970305536,False,,1,https://pbs.twimg.com/media/E2e-7ZUXIAEk5Xh.jpg,,,,,,,[],,,,
1397932580926787585,1397932580926787585,2021-05-27 12:07:54 -0300,2021-05-27,12:07:54,-300,80307396,luistibeoficial,Luis Tibé,,"Em Bonito de Minas fomos recebidos pela prefeita Vania Carneiro, exemplo de mulher guerreira e que está sempre em busca de melhorias para os bonitenses. Juntamente com o deputado @ArlenSantiago, conversamos com os vereadores, a administração municipal e lideranças da região.  https://t.co/HYFBOAzDX6",pt,"[{'screen_name': 'arlensantiago', 'name': 'arlen santiago', 'id': '42630237'}]",[],"['https://pbs.twimg.com/media/E2Z0QwLVgAMi2mX.jpg', 'https://pbs.twimg.com/media/E2Z0QvkWYAISmXB.jpg', 'https://pbs.twimg.com/media/E2Z0Qv_VgAIb9YY.jpg', 'https://pbs.twimg.com/media/E2Z0QvnWYAs7Qru.jpg']",2,0,1,[],[],https://twitter.com/LuisTibeOficial/status/1397932580926787585,False,,1,https://pbs.twimg.com/media/E2Z0QwLVgAMi2mX.jpg,,,,,,,[],,,,
1397924733354614785,1397924733354614785,2021-05-27 11:36:43 -0300,2021-05-27,11:36:43,-300,80307396,luistibeoficial,Luis Tibé,,"Iniciamos o dia visitando a Aldeia Forges, em São João das Missões. Conversamos com os ex-prefeitos Marcelo Pereira e  Zé Nunes, vereadores, lideranças indígenas e diretores de escolas para entender as demandas da população e ajudar da melhor maneira por meio do nosso mandato.  https://t.co/s1xRPgdi5Z",pt,[],[],"['https://pbs.twimg.com/media/E2ZtIAyUcAU1E2-.jpg', 'https://pbs.twimg.com/media/E2ZtIBUVIAIW68l.jpg']",0,0,2,[],[],https://twitter.com/LuisTibeOficial/status/1397924733354614785,False,,1,https://pbs.twimg.com/media/E2ZtIAyUcAU1E2-.jpg,,,,,,,[],,,,
1397561056923369474,1397561056923369474,2021-05-26 11:31:36 -0300,2021-05-26,11:31:36,-300,80307396,luistibeoficial,Luis Tibé,,"Acompanhe, ao vivo, a reunião da Comissão Especial da Reforma Política, presidida pelo deputado federal Luis Tibé.     https://t.co/Jv9e1AwivF",pt,[],['https://www.instagram.com/deputadoluistibe/?hl=pt-br'],[],1,1,1,[],[],https://twitter.com/LuisTibeOficial/status/1397561056923369474,False,,0,,,,,,,,[],,,,
1396944646048292872,1396944646048292872,2021-05-24 18:42:12 -0300,2021-05-24,18:42:12,-300,80307396,luistibeoficial,Luis Tibé,,"Segurança e compromisso ✅  Destinei ao município de Buenópolis, situado na área do “Grande Sertão”, uma viatura 0km, que vai beneficiar a Polícia Militar da região.  A nova viatura vai fortalecer o policiamento e patrulhamento preventivo, que garantem a segurança da população.  https://t.co/errcp5hwkP",pt,[],[],['https://pbs.twimg.com/media/E2LxvxtXMAEU07w.jpg'],2,1,2,[],[],https://twitter.com/LuisTibeOficial/status/1396944646048292872,False,,1,https://pbs.twimg.com/media/E2LxvxtXMAEU07w.jpg,,,,,,,[],,,,
1395022246499004422,1395022246499004422,2021-05-19 11:23:16 -0300,2021-05-19,11:23:16,-300,80307396,luistibeoficial,Luis Tibé,,"Agradeço ao amigo, vereador @thialluguiotti, pela indicação ao título de cidadão goianiense. É uma honra dividir a condução do partido Avante com pessoas como Thialu, que preside o Avante Goiás. #LuisTibé #Goiás #Goiania  https://t.co/lKzf4WcM3g",pt,[],[],[],3,0,4,"['luistibé', 'goiás', 'goiania']",[],https://twitter.com/LuisTibeOficial/status/1395022246499004422,False,,1,https://pbs.twimg.com/ext_tw_video_thumb/1395021666086965256/pu/img/wMDm_0vRXyB3VkCU.jpg,,,,,,,[],,,,
1394751082081968130,1394751082081968130,2021-05-18 17:25:45 -0300,2021-05-18,17:25:45,-300,80307396,luistibeoficial,Luis Tibé,,A reforma política está sendo discutida na Câmara dos Deputados. Você tem ideias que podem melhorar o sistema eleitoral do país? Quer participar dando a sua opinião na Comissão Especial da Reforma Política? Acesse o link  https://t.co/OjrMZVf9nG preencha o formulário.  https://t.co/kBoBTYAlJs,pt,[],['https://luistibe.com.br/envie/'],[],3,2,3,[],[],https://twitter.com/LuisTibeOficial/status/1394751082081968130,False,,1,https://pbs.twimg.com/ext_tw_video_thumb/1394750766691360770/pu/img/sE2S3inKwo3dinOu.jpg,,,,,,,[],,,,
1392538571953868802,1392538571953868802,2021-05-12 14:54:02 -0300,2021-05-12,14:54:02,-300,80307396,luistibeoficial,Luis Tibé,,"Acompanhe, ao vivo, a reunião da Comissão Especial da Reforma Política.  https://t.co/TiINHLenoc",pt,[],['https://www.youtube.com/watch?v=7msyCB32e7U'],[],7,1,3,[],[],https://twitter.com/LuisTibeOficial/status/1392538571953868802,False,,0,,,,,,,,[],,,,
1391855198046412800,1391855198046412800,2021-05-10 17:38:33 -0300,2021-05-10,17:38:33,-300,80307396,luistibeoficial,Luis Tibé,,PODCAST - Comissão da reforma política discute distritão e participação das mulheres nas eleições.  https://t.co/aFBckCHnyi,pt,[],['https://www.itatiaia.com.br/itacast/podcasts/abrindo-o-jogo/504'],[],5,0,1,[],[],https://twitter.com/LuisTibeOficial/status/1391855198046412800,False,,0,,,,,,,,[],,,,
1390678230026264582,1390678230026264582,2021-05-07 11:41:42 -0300,2021-05-07,11:41:42,-300,80307396,luistibeoficial,Luis Tibé,,"Destinei ao município de São José da Lapa, na região central do estado, emenda parlamentar da ordem de R$ 1,8 milhão de reais, para construção da Escola Municipal Pedacinho do Céu. A escola será construída no bairro Inácia de Carvalho e irá atender alunos de 0 a 6 anos.#LuisTibé  https://t.co/y4vzbNKnxg",pt,[],[],['https://pbs.twimg.com/media/E0yueGEXsAAJVyU.jpg'],4,0,3,['luistibé'],[],https://twitter.com/LuisTibeOficial/status/1390678230026264582,False,,1,https://pbs.twimg.com/media/E0yueGEXsAAJVyU.jpg,,,,,,,[],,,,
1389667953134686216,1389667953134686216,2021-05-04 16:47:13 -0300,2021-05-04,16:47:13,-300,80307396,luistibeoficial,Luis Tibé,,"Assumo, a partir de hoje, mais um importante desafio como deputado: presidir a Comissão Especial da Reforma Política. Esta é uma importante discussão que precisa ser retomada no País. Nosso trabalho será o de conduzir as discussões que serão sempre voltadas para o amplo diálogo.  https://t.co/awaj9zUmhE",pt,[],[],['https://pbs.twimg.com/media/E0kXZJhXMAMtYwq.jpg'],2,1,2,[],[],https://twitter.com/LuisTibeOficial/status/1389667953134686216,False,,1,https://pbs.twimg.com/media/E0kXZJhXMAMtYwq.jpg,,,,,,,[],,,,
1388222326903291910,1388222326903291910,2021-04-30 17:02:49 -0300,2021-04-30,17:02:49,-300,80307396,luistibeoficial,Luis Tibé,,"Fechando com chave de ouro nossas vistas ao Centro-Oeste mineiro, no município de Itapecerica. Nos reunimos com o prefeito Têko, os vereadores Gleytinho do Valério, Radialista Marcone, Xandy e lideranças locais.   #LuisTibé #Itapecerica #FábioAvelar #AvanteMG  https://t.co/2d1bwI3vzx",pt,[],[],"['https://pbs.twimg.com/media/E0P0zuuWEAEYokB.jpg', 'https://pbs.twimg.com/media/E0P0zuxXIAIezLe.jpg', 'https://pbs.twimg.com/media/E0P0zurXoAMdnlU.jpg', 'https://pbs.twimg.com/media/E0P0zuyXsAQ16BR.jpg']",6,0,1,"['luistibé', 'itapecerica', 'fábioavelar', 'avantemg']",[],https://twitter.com/LuisTibeOficial/status/1388222326903291910,False,,1,https://pbs.twimg.com/media/E0P0zuuWEAEYokB.jpg,,,,,,,[],,,,
1388207180407615490,1388207180407615490,2021-04-30 16:02:38 -0300,2021-04-30,16:02:38,-300,80307396,luistibeoficial,Luis Tibé,,"Em visita ao município de Moema, junto ao ex-prefeito, Marcelo, vereador Tonhão, vereadora Samira e lideranças da região colocamos nosso mandato à disposição. Minas segue Avante! #LuisTibé #Moema #FábioAvelar  https://t.co/4GvYRGPDSm",pt,[],[],"['https://pbs.twimg.com/media/E0PnBn_X0AYjWFl.jpg', 'https://pbs.twimg.com/media/E0PnBoAXEAgbaXM.jpg', 'https://pbs.twimg.com/media/E0PnBoEWEAA_Oe_.jpg']",0,0,2,"['luistibé', 'moema', 'fábioavelar']",[],https://twitter.com/LuisTibeOficial/status/1388207180407615490,False,,1,https://pbs.twimg.com/media/E0PnBn_X0AYjWFl.jpg,,,,,,,[],,,,
1388189544504303620,1388189544504303620,2021-04-30 14:52:33 -0300,2021-04-30,14:52:33,-300,80307396,luistibeoficial,Luis Tibé,,"Em Igaratinga reunimos com o prefeito, Fábio Alves, o vice, Wanderson Santos, e com vereadores e lideranças do município. Aproveitamos a oportunidade para fazer a entrega de um caminhão compactador de resíduos sólidos que enviamos através de emenda parlamentar. #LuisTibé  https://t.co/mPoHNnCUTf",pt,[],[],[],0,0,2,['luistibé'],[],https://twitter.com/LuisTibeOficial/status/1388189544504303620,False,,1,https://pbs.twimg.com/ext_tw_video_thumb/1388189498484342785/pu/img/WGeDBLwjvhYz7jtq.jpg,,,,,,,[],,,,
1388127635822231558,1388127635822231558,2021-04-30 10:46:33 -0300,2021-04-30,10:46:33,-300,80307396,luistibeoficial,Luis Tibé,,"Hoje em Perdigão acompanhados do prefeito, Gilmar Teodoro, do vice Julliano da Abs e de vereadores e lideranças. Visitamos uma fábrica de calçados que gera emprego para a população do município e realizamos a entrega de um veículo utilitário que ajudará a locomoção de idosos.  https://t.co/0n4CrE2pvh",pt,[],[],"['https://pbs.twimg.com/media/E0OeuJpWUAA7MCn.jpg', 'https://pbs.twimg.com/media/E0OeuJoWEAQd-lg.jpg', 'https://pbs.twimg.com/media/E0OeuJrXMAAvXOF.jpg', 'https://pbs.twimg.com/media/E0OeuJrWEAYDhOe.jpg']",1,0,1,[],[],https://twitter.com/LuisTibeOficial/status/1388127635822231558,False,,1,https://pbs.twimg.com/media/E0OeuJpWUAA7MCn.jpg,,,,,,,[],,,,
1387934046659874817,1387934046659874817,2021-04-29 21:57:17 -0300,2021-04-29,21:57:17,-300,80307396,luistibeoficial,Luis Tibé,,"Fechamos o dia com uma produtiva reunião no município de Nova Serrana. Estiveram presentes vereadores e lideranças do município, além do prefeito de Araújos, Geraldo Massa e seu vice, Rafa. Aproveitamos a conversa para reiterar o compromisso do nosso mandato com toda a região.  https://t.co/qGM3aPoxhN",pt,[],[],"['https://pbs.twimg.com/media/E0LupxoXoAIV39M.jpg', 'https://pbs.twimg.com/media/E0LupxpXoAMb6su.jpg', 'https://pbs.twimg.com/media/E0LupxpWUAMN1_D.jpg']",0,0,2,[],[],https://twitter.com/LuisTibeOficial/status/1387934046659874817,False,,1,https://pbs.twimg.com/media/E0LupxoXoAIV39M.jpg,,,,,,,[],,,,
1387920679169929220,1387920679169929220,2021-04-29 21:04:10 -0300,2021-04-29,21:04:10,-300,80307396,luistibeoficial,Luis Tibé,,"Em Medeiros, tivemos um excelente bate-papo com o prefeito Chiquinho, o vice Celso Rodrigues, vereadores e lideranças da região. Durante o encontro, falei com os presentes que temos que buscar e discutir propostas para melhorar a vida das pessoas. #LuisTibé #Medeiros #FábioAvelar  https://t.co/ohjRcngYWg",pt,[],[],"['https://pbs.twimg.com/media/E0LifyIWQAQiGYw.jpg', 'https://pbs.twimg.com/media/E0LifyIWUAQW9bh.jpg']",0,0,2,"['luistibé', 'medeiros', 'fábioavelar']",[],https://twitter.com/LuisTibeOficial/status/1387920679169929220,False,,1,https://pbs.twimg.com/media/E0LifyIWQAQiGYw.jpg,,,,,,,[],,,,
1387812226682195969,1387812226682195969,2021-04-29 13:53:13 -0300,2021-04-29,13:53:13,-300,80307396,luistibeoficial,Luis Tibé,,"Em Tapiraí reunimos com o prefeito Vanderlei, com os vereadores de Campos Altos e com as lideranças da região. Ouvimos as demandas que foram pautadas e na oportunidade realizamos a entrega de um caminhão compactador de resíduos sólidos, que dará qualidade ao saneamento básico.♻️  https://t.co/exXlrWUS85",pt,[],[],"['https://pbs.twimg.com/media/E0J_r9sXIAcBZGE.jpg', 'https://pbs.twimg.com/media/E0J_r-OWEAEsHuu.jpg', 'https://pbs.twimg.com/media/E0J_r-wWUAUUk_x.jpg', 'https://pbs.twimg.com/media/E0J_r_HWUAw7XnY.jpg']",0,0,2,[],[],https://twitter.com/LuisTibeOficial/status/1387812226682195969,False,,1,https://pbs.twimg.com/media/E0J_r9sXIAcBZGE.jpg,,,,,,,[],,,,
1387811615047835654,1387811615047835654,2021-04-29 13:50:47 -0300,2021-04-29,13:50:47,-300,80307396,luistibeoficial,Luis Tibé,,"Reunião em Córrego Danta com o prefeito Ednei, com o vice Jaime, com vereadores e lideranças do município juntamente do deputado estadual Fábio Avelar e da secretária municipal de educação Ilene Carvalho. Colocamos nosso mandato a disposição. #LuisTibé #CórregoDanta #Avante  https://t.co/FS0XAbi3NS",pt,[],[],"['https://pbs.twimg.com/media/E0J_RglXMAAeqfe.jpg', 'https://pbs.twimg.com/media/E0J_RhLWEAU7in0.jpg']",0,0,1,"['luistibé', 'córregodanta', 'avante']",[],https://twitter.com/LuisTibeOficial/status/1387811615047835654,False,,1,https://pbs.twimg.com/media/E0J_RglXMAAeqfe.jpg,,,,,,,[],,,,
1387811027354628101,1387811027354628101,2021-04-29 13:48:27 -0300,2021-04-29,13:48:27,-300,80307396,luistibeoficial,Luis Tibé,,"Em visita a Bom Despacho na companhia do deputado estadual Fabio Avelar , para ouvir as demandas do município e da região. Estiveram presentes o prefeito de Bom Despacho, Doutor Bertolino, prefeito de Martinho Campos, Wilson Diretor juntamente de vereadores e lideranças da região  https://t.co/Iv0ICyfSX1",pt,[],[],"['https://pbs.twimg.com/media/E0J-wcNXEAAJBwJ.jpg', 'https://pbs.twimg.com/media/E0J-wcKWUAkZAI5.jpg']",0,1,2,[],[],https://twitter.com/LuisTibeOficial/status/1387811027354628101,False,,1,https://pbs.twimg.com/media/E0J-wcNXEAAJBwJ.jpg,,,,,,,[],,,,
1387386357731971075,1387386357731971075,2021-04-28 09:40:58 -0300,2021-04-28,09:40:58,-300,80307396,luistibeoficial,Luis Tibé,,"Destinei, juntamente com o deputado estadual de MG, Fábio Avelar, um caminhão compactador de lixo para a cidade de Igaratinga, no centro-oeste de Minas. Fico muito feliz por ver o bom emprego do dinheiro público fazer diferença na vida da população. ↗️ #LuisTibé  https://t.co/nqJpuwSWpK",pt,[],[],['https://pbs.twimg.com/media/E0D8eCyXMAEkR_3.jpg'],1,0,2,['luistibé'],[],https://twitter.com/LuisTibeOficial/status/1387386357731971075,False,,1,https://pbs.twimg.com/media/E0D8eCyXMAEkR_3.jpg,,,,,,,[],,,,
1382798519543726084,1382798519543726084,2021-04-15 17:50:32 -0300,2021-04-15,17:50:32,-300,80307396,luistibeoficial,Luis Tibé,,"Encontro com o presidente do Senado, Rodrigo Pacheco , para discutirmos assuntos relacionados a vacinação da Covid-19.  #Vacina #SUS  #PensandoAvante  https://t.co/hGyr4EdV24",pt,[],[],"['https://pbs.twimg.com/media/EzCv41lXAAYQNZ_.jpg', 'https://pbs.twimg.com/media/EzCv41jW8AIPNPV.jpg']",5,0,1,"['vacina', 'sus', 'pensandoavante']",[],https://twitter.com/LuisTibeOficial/status/1382798519543726084,False,,1,https://pbs.twimg.com/media/EzCv41lXAAYQNZ_.jpg,,,,,,,[],,,,
1382786509347119107,1382786509347119107,2021-04-15 17:02:49 -0300,2021-04-15,17:02:49,-300,80307396,luistibeoficial,Luis Tibé,,"Café com o presidente da Câmara, deputado Arthur Lira, com o prefeito de Canoas (RS) Jairo Jorge, o prefeito de Bonfim (MG), Gustavo Ribeiro e com o presidente estadual do Avante RS, Anderson Dorneles. Na pauta, discutimos as demandas dos municípios.  https://t.co/HLllbEPDSL",pt,[],[],['https://pbs.twimg.com/media/EzCk8_iW8AYv-Bs.jpg'],4,1,2,[],[],https://twitter.com/LuisTibeOficial/status/1382786509347119107,False,,1,https://pbs.twimg.com/media/EzCk8_iW8AYv-Bs.jpg,,,,,,,[],,,,
1376932963678584839,1376932963678584839,2021-03-30 13:22:55 -0300,2021-03-30,13:22:55,-300,80307396,luistibeoficial,Luis Tibé,,"O município de Monte Azul, no norte de Minas recebeu dois poços artesianos, R$ 250 mil para o Hospital e Maternidade Nossa Senhora das Graças e três caixas d’água de 10 mil litros para abastecer comunidades do município. A emenda foi destinada por mim em parceria com a Codevasf.  https://t.co/UOMDR1nuWl",pt,[],[],['https://pbs.twimg.com/media/ExvZEBeWEAoFHhc.jpg'],2,0,3,[],[],https://twitter.com/LuisTibeOficial/status/1376932963678584839,False,,1,https://pbs.twimg.com/media/ExvZEBeWEAoFHhc.jpg,,,,,,,[],,,,
1370081233212952576,1370081233212952576,2021-03-11 15:36:35 -0300,2021-03-11,15:36:35,-300,80307396,luistibeoficial,Luis Tibé,,"Aprovamos agora, na Câmara dos Deputados, a continuidade do Auxílio Emergencial para desempregados e trabalhadores autônomos que estão sem renda durante a pandemia. Ainda é pouco, mas seguimos trabalhando para levar comida para a mesa das famílias e dar dignidade ao nosso povo.↗️  https://t.co/gcDDZV5JwT",pt,[],[],['https://pbs.twimg.com/media/EwOBNvNWQAs3nd1.jpg'],11,0,3,[],[],https://twitter.com/LuisTibeOficial/status/1370081233212952576,False,,1,https://pbs.twimg.com/media/EwOBNvNWQAs3nd1.jpg,,,,,,,[],,,,
1367222702986186756,1367222702986186756,2021-03-03 18:17:48 -0300,2021-03-03,18:17:48,-300,80307396,luistibeoficial,Luis Tibé,,O setor de eventos pode contar com nosso mandato🎟️  #LuisTibé #EventosMG #ProduçãoDeEventos  https://t.co/zISFUfEUZV,pt,[],[],[],17,0,2,"['luistibé', 'eventosmg', 'produçãodeeventos']",[],https://twitter.com/LuisTibeOficial/status/1367222702986186756,False,,1,https://pbs.twimg.com/ext_tw_video_thumb/1367222659654778880/pu/img/k-Fk04I4mXRdgYIg.jpg,,,,,,,[],,,,
1365349643643744258,1365349643643744258,2021-02-26 14:14:56 -0300,2021-02-26,14:14:56,-300,80307396,luistibeoficial,Luis Tibé,,"Nesta quinta-feira (25) estive em Goiânia, na companhia do vereador e presidente estadual do Avante, Thialu Guiotti, para conversar com o governador de Goiás, Ronaldo Caiado, e com o prefeito da capital, Rogério Cruz. #Avante70 #LuisTibé  https://t.co/ZMFieHcXkp",pt,[],[],"['https://pbs.twimg.com/media/EvKyQsZXEAsZbX6.jpg', 'https://pbs.twimg.com/media/EvKyQsZXAAIA_hC.jpg']",85,1,2,"['avante70', 'luistibé']",[],https://twitter.com/LuisTibeOficial/status/1365349643643744258,False,,1,https://pbs.twimg.com/media/EvKyQsZXEAsZbX6.jpg,,,,,,,[],,,,
1357423156978475008,1357423156978475008,2021-02-04 17:17:54 -0300,2021-02-04,17:17:54,-300,80307396,luistibeoficial,Luis Tibé,,"Marcando o início dos trabalhos legislativos deste ano, realizamos hoje (4/2) a primeira reunião de lideranças do biênio 2021-2022, juntamente do novo presidente da Câmara @ArthurLira_ .  #LuisTibé #Avante70 #CamaraDosDeputados  https://t.co/mnaq87mvYp",pt,"[{'screen_name': 'arthurlira_', 'name': 'arthur lira', 'id': '1086390169970884613'}]",[],"['https://pbs.twimg.com/media/EtaJG-NWgAgZu_w.jpg', 'https://pbs.twimg.com/media/EtaJG-PXcAYFmMv.jpg']",20,0,5,"['luistibé', 'avante70', 'camaradosdeputados']",[],https://twitter.com/LuisTibeOficial/status/1357423156978475008,False,,1,https://pbs.twimg.com/media/EtaJG-NWgAgZu_w.jpg,,,,,,,[],,,,
1354488712474882052,1354488712474882052,2021-01-27 14:57:28 -0300,2021-01-27,14:57:28,-300,80307396,luistibeoficial,Luis Tibé,,Alerta sobre nova tentativa de golpe pelo whatsapp utilizando o nome do deputado federal Luis Tibé. Saiba mais em:  https://t.co/xnLgEajRiE  https://t.co/FrNlUuokxx,pt,[],['http://bit.ly/3sVm95c'],['https://pbs.twimg.com/media/EswcQYOW4AEQZX0.jpg'],7,1,3,[],[],https://twitter.com/LuisTibeOficial/status/1354488712474882052,False,,1,https://pbs.twimg.com/media/EswcQYOW4AEQZX0.jpg,,,,,,,[],,,,
1352678240981278723,1352678240981278723,2021-01-22 15:03:18 -0300,2021-01-22,15:03:18,-300,80307396,luistibeoficial,Luis Tibé,,"Na última quinta-feira (21), reunimos com nosso candidato à presidência da Câmara @ArthurLira_  em Belo Horizonte, juntamente do governador @RomeuZema , do prefeito da capital @alexandrekalil , do presidente da ALMG @agostinhopatrus  e da bancada mineira.  https://t.co/xGeNEWWgrf",pt,"[{'screen_name': 'arthurlira_', 'name': 'arthur lira', 'id': '1086390169970884613'}, {'screen_name': 'romeuzema', 'name': 'romeu zema', 'id': '1020798087449776128'}, {'screen_name': 'alexandrekalil', 'name': 'alexandre kalil', 'id': '40721032'}, {'screen_name': 'agostinhopatrus', 'name': 'agostinho patrus', 'id': '80548228'}]",[],"['https://pbs.twimg.com/media/EsWteuEXAAMHI6s.jpg', 'https://pbs.twimg.com/media/EsWteuEW8AAlaoo.jpg', 'https://pbs.twimg.com/media/EsWteuEWMAI8ngZ.jpg', 'https://pbs.twimg.com/media/EsWteuCXAAIVQnt.jpg']",4,0,1,[],[],https://twitter.com/LuisTibeOficial/status/1352678240981278723,False,,1,https://pbs.twimg.com/media/EsWteuEXAAMHI6s.jpg,,,,,,,[],,,,
1351534999485472775,1351534999485472775,2021-01-19 11:20:28 -0300,2021-01-19,11:20:28,-300,80307396,luistibeoficial,Luis Tibé,,"Vitória para o Brasil e para Minas Gerais! Finalmente, o sonho da vacina contra a Covid-19 se tornou realidade!As doses da vacina estão chegando hoje a todos os municípios mineiros e, em breve, milhares de mineiros estarão imunizados contra a doença.É momento de comemorar!#Avante  https://t.co/Ltuw0EHyQd",pt,[],[],['https://pbs.twimg.com/media/EsGd3XvW4AE9Bj-.jpg'],10,2,6,['avante'],[],https://twitter.com/LuisTibeOficial/status/1351534999485472775,False,,1,https://pbs.twimg.com/media/EsGd3XvW4AE9Bj-.jpg,,,,,,,[],,,,
