id,conversation_id,created_at,date,time,timezone,user_id,username,name,place,tweet,language,mentions,urls,photos,replies_count,retweets_count,likes_count,hashtags,cashtags,link,retweet,quote_url,video,thumbnail,near,geo,source,user_rt_id,user_rt,retweet_id,reply_to,retweet_date,translate,trans_src,trans_dest
1385569016228454412,1385569016228454412,2021-04-23 09:19:30 -0300,2021-04-23,09:19:30,-300,79174387,profdorinha,Professora Dorinha,,"É indiscutível o prejuízo para a educação com a pandemia da Covid-19, mas 49% das escolas não têm saneamento básico, não têm água, não têm ventilação.",pt,[],[],[],0,1,11,[],[],https://twitter.com/profdorinha/status/1385569016228454412,False,,0,,,,,,,,[],,,,
1385568895864557575,1385568895864557575,2021-04-23 09:19:02 -0300,2021-04-23,09:19:02,-300,79174387,profdorinha,Professora Dorinha,,"A situação do retorno às aulas não pode ser tratada de forma superficial, isso porque não há garantia de estruturas nos locais. Já contabilizamos 360 mil mortos no País, por isso devemos agir com responsabilidade e cautela.  https://t.co/MDqQXMEdQE",pt,[],[],[],0,2,10,[],[],https://twitter.com/profdorinha/status/1385568895864557575,False,,1,https://pbs.twimg.com/ext_tw_video_thumb/1385568716830674944/pu/img/5GFeHi9JLZ1Rqgsq.jpg,,,,,,,[],,,,
1385240294371758090,1385240294371758090,2021-04-22 11:33:17 -0300,2021-04-22,11:33:17,-300,79174387,profdorinha,Professora Dorinha,,Confira👇🏻 #Educação   https://t.co/xQzx5qX1Jh  https://t.co/m8U0FVopW9,pt,[],['https://gazetadocerrado.com.br/retorno-seguro-prejuizo-incalculavel-mais-que-um-sim-ou-nao-a-analise-de-dorinha-sobre-o-pl-da-educacao-como-servico-essencial/'],['https://pbs.twimg.com/media/EzlcmUSX0AAXRMJ.jpg'],1,0,5,['educação'],[],https://twitter.com/profdorinha/status/1385240294371758090,False,,1,https://pbs.twimg.com/media/EzlcmUSX0AAXRMJ.jpg,,,,,,,[],,,,
1385239798055673858,1385239798055673858,2021-04-22 11:31:19 -0300,2021-04-22,11:31:19,-300,79174387,profdorinha,Professora Dorinha,,Leia 👇🏻   https://t.co/xQzx5qX1Jh,pt,[],['https://gazetadocerrado.com.br/retorno-seguro-prejuizo-incalculavel-mais-que-um-sim-ou-nao-a-analise-de-dorinha-sobre-o-pl-da-educacao-como-servico-essencial/'],[],1,0,4,[],[],https://twitter.com/profdorinha/status/1385239798055673858,False,,0,,,,,,,,[],,,,
1384140795863736323,1384140795863736323,2021-04-19 10:44:16 -0300,2021-04-19,10:44:16,-300,79174387,profdorinha,Professora Dorinha,,O evento será transmitido pelo Youtube e Twitter do Todos Pela Educação:  https://t.co/ko6IMdvto9,pt,[],['https://www.youtube.com/watch?v=k-8sxlIRqVM'],[],1,0,2,[],[],https://twitter.com/profdorinha/status/1384140795863736323,False,,0,,,,,,,,[],,,,
1384140561158795270,1384140561158795270,2021-04-19 10:43:20 -0300,2021-04-19,10:43:20,-300,79174387,profdorinha,Professora Dorinha,,"Daqui a pouco começa o lançamento da Agenda Legislativa Pela Educação, com a participação dos Presidentes das Comissões de Educação da Câmara e do Senado e representantes das presidências de Consed e Undime.",pt,[],[],[],0,0,7,[],[],https://twitter.com/profdorinha/status/1384140561158795270,False,,0,,,,,,,,[],,,,
1383118617630420997,1383118617630420997,2021-04-16 15:02:30 -0300,2021-04-16,15:02:30,-300,79174387,profdorinha,Professora Dorinha,,✅ Começou! Acompanhe ▶️  https://t.co/yBSiG6XLWB,pt,[],['https://edemocracia.camara.leg.br/audiencias/sala/1788'],[],0,0,0,[],[],https://twitter.com/profdorinha/status/1383118617630420997,False,,0,,,,,,,,[],,,,
1382501132178747397,1382501132178747397,2021-04-14 22:08:50 -0300,2021-04-14,22:08:50,-300,79174387,profdorinha,Professora Dorinha,,"Trabalhamos muito para que pudéssemos chegar nesse resultado. Quem ganha são milhares de alunos, especialmente os do meu estado, o Tocantins. Para a implementação dos campus da UFNT, Tocantinópolis, Araguaína, Xambioá e Guaraí, destinei emendas. Uma vitória de todos!",pt,[],[],[],2,1,13,[],[],https://twitter.com/profdorinha/status/1382501132178747397,False,,0,,,,,,,,[],,,,
1382500957842505728,1382500957842505728,2021-04-14 22:08:08 -0300,2021-04-14,22:08:08,-300,79174387,profdorinha,Professora Dorinha,,"O texto da proposição também permite o preenchimento de cargos efetivos do quadro permanente para a Empresa Brasileira de Serviços Hospitalares (Ebserh), que irá contemplar os hospitais universitários, abastecidos pela Ebserh, e o Hospital de Doenças Tropicais, em Araguaina.",pt,[],[],[],0,0,5,[],[],https://twitter.com/profdorinha/status/1382500957842505728,False,,0,,,,,,,,[],,,,
1382500800375701507,1382500800375701507,2021-04-14 22:07:31 -0300,2021-04-14,22:07:31,-300,79174387,profdorinha,Professora Dorinha,,"Mais uma vitória para Educação! Foi sancionado o Projeto de Lei Complementar (PLP) 266/2020, que permite a admissão de pessoal para preencher cargos de direção e função das seis novas universidades federais, incluindo a Universidade Federal do Norte do Tocantins (UFNT).",pt,[],[],[],0,2,16,[],[],https://twitter.com/profdorinha/status/1382500800375701507,False,,0,,,,,,,,[],,,,
1382356872582340614,1382356872582340614,2021-04-14 12:35:36 -0300,2021-04-14,12:35:36,-300,79174387,profdorinha,Professora Dorinha,, https://t.co/jSFRB9dc3j,und,[],['https://clebertoledo.com.br/tocantins/bancada-vai-ao-tcu-para-suspender-do-edital-de-concessao-da-br-153-leilao-sera-dia-29-e-ministro-garante-rapidez-em-apreciar-pleito/'],[],0,0,1,[],[],https://twitter.com/profdorinha/status/1382356872582340614,False,,0,,,,,,,,[],,,,
1382315777387335687,1382315777387335687,2021-04-14 09:52:18 -0300,2021-04-14,09:52:18,-300,79174387,profdorinha,Professora Dorinha,, https://t.co/TxXx0UMc6M,und,[],['https://www.camara.leg.br/noticias/746081-camara-aprova-inclusao-de-medidas-protetivas-de-mulheres-em-banco-de-dados-policial/'],[],0,0,3,[],[],https://twitter.com/profdorinha/status/1382315777387335687,False,,0,,,,,,,,[],,,,
1382304981047513090,1382304981047513090,2021-04-14 09:09:24 -0300,2021-04-14,09:09:24,-300,79174387,profdorinha,Professora Dorinha,, https://t.co/x0Q8sUUn0L,und,[],['https://www.camara.leg.br/radio/radioagencia/746250-reabertura-de-escolas-como-servico-essencial-divide-deputados-mas-esta-na-pauta-de-votacoes/'],[],0,0,1,[],[],https://twitter.com/profdorinha/status/1382304981047513090,False,,0,,,,,,,,[],,,,
1380152016857665542,1380152016857665542,2021-04-08 10:34:17 -0300,2021-04-08,10:34:17,-300,79174387,profdorinha,Professora Dorinha,,Confira! 🤓📚   https://t.co/v4Gh3z4nUb,pt,[],['https://clebertoledo.com.br/politica/comissao-de-educacao-dorinha-apresenta-parecer-favoravel-ao-pl-5533-e-consegue-aprovacao-de-tres-requerimentos-de-sua-autoria/'],[],3,0,3,[],[],https://twitter.com/profdorinha/status/1380152016857665542,False,,0,,,,,,,,[],,,,
1380143330869272579,1380143330869272579,2021-04-08 09:59:46 -0300,2021-04-08,09:59:46,-300,79174387,profdorinha,Professora Dorinha,,"Desses, como relatora, a deputada emitiu parecer favorável ao Projeto de Lei 5533/2013 e obteve aprovação de outros três requerimentos de sua autoria durante a reunião do colegiado. #ComissãodeEducação",pt,[],[],[],0,0,5,['comissãodeeducação'],[],https://twitter.com/profdorinha/status/1380143330869272579,False,,0,,,,,,,,[],,,,
1380143269884145666,1380143269884145666,2021-04-08 09:59:32 -0300,2021-04-08,09:59:32,-300,79174387,profdorinha,Professora Dorinha,,"Sob a presidência da deputada Professora Dorinha (DEM/TO), a Comissão de Educação da Câmara analisou 22 propostas, entre projetos e requerimentos, nessa quarta-feira, 7 de abril.  #ComissãodeEducação",pt,[],[],[],0,0,3,['comissãodeeducação'],[],https://twitter.com/profdorinha/status/1380143269884145666,False,,0,,,,,,,,[],,,,
1379163900323753995,1379163900323753995,2021-04-05 17:07:52 -0300,2021-04-05,17:07:52,-300,79174387,profdorinha,Professora Dorinha,,"São R$ 176,3 bilhões, que irão garantir uma Educação mais justa e igualitária no Brasil para 2021. Vitória da Educação, vitória de todos! Leia a matéria completa em  https://t.co/iqwkzgWzCf",pt,[],['https://bit.ly/2R94kBn'],[],2,2,8,[],[],https://twitter.com/profdorinha/status/1379163900323753995,False,,0,,,,,,,,[],,,,
1379163876999200772,1379163876999200772,2021-04-05 17:07:46 -0300,2021-04-05,17:07:46,-300,79174387,profdorinha,Professora Dorinha,,"Como relatora da Emenda Constitucional 108/20, o nosso trabalho foi árduo em busca da garantia da efetiva aprendizagem. E vencemos!",pt,[],[],[],1,2,9,[],[],https://twitter.com/profdorinha/status/1379163876999200772,False,,0,,,,,,,,[],,,,
1379163720698445831,1379163720698445831,2021-04-05 17:07:09 -0300,2021-04-05,17:07:09,-300,79174387,profdorinha,Professora Dorinha,,"Amigos e amigas, o Fundeb, agora garantido na Constituição, passa a obter estimativa para este ano a partir deste mês de abril.  . As informações foram estabelecidas por meio da Portaria Interministerial 1/2021, publicada no último dia 31.  https://t.co/NVCfw4VmyE",pt,[],[],['https://pbs.twimg.com/media/EyPGA0BW8AA8RmL.jpg'],0,1,6,[],[],https://twitter.com/profdorinha/status/1379163720698445831,False,,1,https://pbs.twimg.com/media/EyPGA0BW8AA8RmL.jpg,,,,,,,[],,,,
1377231500236754945,1377231500236754945,2021-03-31 09:09:12 -0300,2021-03-31,09:09:12,-300,79174387,profdorinha,Professora Dorinha,,"Acompanhe! ""Reunião de Comparecimento do Sr. Milton Ribeiro, Ministro da Educação""   https://t.co/EWgbVLyAxX",pt,[],['https://www.camara.leg.br/evento-legislativo/60783'],[],1,1,4,[],[],https://twitter.com/profdorinha/status/1377231500236754945,False,,0,,,,,,,,[],,,,
1377017230286815233,1377017230286815233,2021-03-30 18:57:46 -0300,2021-03-30,18:57:46,-300,79174387,profdorinha,Professora Dorinha,,Deputada Professora Dorinha (DEM/TO) é uma das autoras 👇🏻👇🏻   https://t.co/rXI5DQQ3Nw,pt,[],['https://www.camara.leg.br/noticias/741279-deputados-analisam-projeto-sobre-uso-alternativo-dos-veiculos-de-transporte-escolar-na-pandemia/'],[],0,0,0,[],[],https://twitter.com/profdorinha/status/1377017230286815233,False,,0,,,,,,,,[],,,,
1375905292630818819,1375905292630818819,2021-03-27 17:19:19 -0300,2021-03-27,17:19:19,-300,79174387,profdorinha,Professora Dorinha,,"Amigos foi sancionada a Lei Federal 14.128, referente ao PL 1826/2020, do qual sou coautora, que garante o pagamento de R$ 50 mil ao profissional de saúde incapacitado permanente de trabalhar ou, em caso de morte, ao seu cônjuge, aos seus dependentes e herdeiros.  https://t.co/EPSyCgPdnM",pt,[],[],['https://pbs.twimg.com/media/ExgyjC1XEAIP0TH.jpg'],3,9,31,[],[],https://twitter.com/profdorinha/status/1375905292630818819,False,,1,https://pbs.twimg.com/media/ExgyjC1XEAIP0TH.jpg,,,,,,,[],,,,
1375898794882170881,1375898794882170881,2021-03-27 16:53:30 -0300,2021-03-27,16:53:30,-300,79174387,profdorinha,Professora Dorinha,,"O texto também prevê a garantia do benefício em uma única prestação, de valor variável, a cada um dos dependentes menores de 21, ou 24 anos se cursando curso superior, do profissional ou trabalhador de saúde falecido.",pt,[],[],[],1,0,10,[],[],https://twitter.com/profdorinha/status/1375898794882170881,False,,0,,,,,,,,[],,,,
1375898750057582594,1375898750057582594,2021-03-27 16:53:19 -0300,2021-03-27,16:53:19,-300,79174387,profdorinha,Professora Dorinha,,"Conseguimos esse avanço, após termos derrubado o veto presidencial, número 36, no último dia 18 de março.",pt,[],[],[],0,1,7,[],[],https://twitter.com/profdorinha/status/1375898750057582594,False,,0,,,,,,,,[],,,,
1375495334399475715,1375495334399475715,2021-03-26 14:10:17 -0300,2021-03-26,14:10:17,-300,79174387,profdorinha,Professora Dorinha,, https://t.co/TtRsdB38Jq,und,[],['https://movel.t1noticias.com.br/politica/emendas-da-deputada-dorinha-para-educacao-e-senapred-sao-garantidas-no-orcamento-2021/116800/'],[],1,0,5,[],[],https://twitter.com/profdorinha/status/1375495334399475715,False,,0,,,,,,,,[],,,,
1375076925492838402,1375076925492838402,2021-03-25 10:27:41 -0300,2021-03-25,10:27:41,-300,79174387,profdorinha,Professora Dorinha,,Acompanhe! 👇🏻💰   https://t.co/BITGNfETfC,pt,[],['https://www.camara.leg.br/noticias/739748-comissao-analisa-parecer-final-do-orcamento-para-2021-acompanhe/'],[],2,0,1,[],[],https://twitter.com/profdorinha/status/1375076925492838402,False,,0,,,,,,,,[],,,,
1374732591794954240,1374732591794954240,2021-03-24 11:39:25 -0300,2021-03-24,11:39:25,-300,79174387,profdorinha,Professora Dorinha,,Nosso objetivo é ofertar cada vez mais uma Educação de qualidade aos futuros alunos e valorizar os profissionais. Parabéns a todos! Juntos por uma educação pública de qualidade!  ____________________ #depproddorinha #UFNT #266 #educação #universidades #ufnt,pt,[],[],[],0,0,1,"['depproddorinha', 'ufnt', 'educação', 'universidades', 'ufnt']",[],https://twitter.com/profdorinha/status/1374732591794954240,False,,0,,,,,,,,[],,,,
1374732548312608771,1374732548312608771,2021-03-24 11:39:15 -0300,2021-03-24,11:39:15,-300,79174387,profdorinha,Professora Dorinha,,"Sem dúvida, a nossa nova universidade possibilitará uma nova perspectiva para o avanço da educação no Norte do Estado, contemplando também as regiões sudoeste e sul do Maranhão e Pará.",pt,[],[],[],0,0,2,[],[],https://twitter.com/profdorinha/status/1374732548312608771,False,,0,,,,,,,,[],,,,
1374732457967239168,1374732457967239168,2021-03-24 11:38:53 -0300,2021-03-24,11:38:53,-300,79174387,profdorinha,Professora Dorinha,,"Sinto-me muito feliz em poder contribuir com a Educação do País, em especial com a do Tocantins; de maneira que fui responsável pela destinação de  emendas para a criação dos dois novos campus da UFNT em Xambioá e Guaraí.",pt,[],[],[],0,0,3,[],[],https://twitter.com/profdorinha/status/1374732457967239168,False,,0,,,,,,,,[],,,,
1374732236591923201,1374732236591923201,2021-03-24 11:38:01 -0300,2021-03-24,11:38:01,-300,79174387,profdorinha,Professora Dorinha,,"Mais uma vitória para Educação! Conseguimos aprovar nessa terça, 23, em plenário, o PLP 266/2020, que garante a contratação de pessoal para a UFNT e mais outras cinco novas universidades federais do País. A partir de agora, a proposição segue para sanção presidencial.",pt,[],[],[],6,0,6,[],[],https://twitter.com/profdorinha/status/1374732236591923201,False,,0,,,,,,,,[],,,,
1374444876390014983,1374444876390014983,2021-03-23 16:36:09 -0300,2021-03-23,16:36:09,-300,79174387,profdorinha,Professora Dorinha,,"A parlamentar também apresentou emendas para as áreas de Ciência e Tecnologia, Institutos Federais e Universidades Federais; combate à violência contra a mulher e para Secretaria Nacional Antidrogas. Continue nos acompanhando! Essa luta é de todos!",pt,[],[],[],1,1,2,[],[],https://twitter.com/profdorinha/status/1374444876390014983,False,,0,,,,,,,,[],,,,
1374444779954597900,1374444779954597900,2021-03-23 16:35:46 -0300,2021-03-23,16:35:46,-300,79174387,profdorinha,Professora Dorinha,,"Lembrando que, no último dia 3 de março, o destaque da parlamentar, em que propôs a reestimativa de R$ 12,6 bilhões para Educação, foi aprovado em plenário. O montante corresponde a uma ampliação na complementação da União ao Fundeb.",pt,[],[],[],0,0,3,[],[],https://twitter.com/profdorinha/status/1374444779954597900,False,,0,,,,,,,,[],,,,
1374444642263953424,1374444642263953424,2021-03-23 16:35:13 -0300,2021-03-23,16:35:13,-300,79174387,profdorinha,Professora Dorinha,,"Isso porque, a Comissão Mista de Planos, Orçamentos Públicos e Fiscalização (CMO) realiza sessões nesta semana para aprovar o Orçamento da União para 2021. Se aprovado na Comissão, o orçamento segue para votação em plenário.",pt,[],[],[],0,0,0,[],[],https://twitter.com/profdorinha/status/1374444642263953424,False,,0,,,,,,,,[],,,,
1374444475523600385,1374444475523600385,2021-03-23 16:34:33 -0300,2021-03-23,16:34:33,-300,79174387,profdorinha,Professora Dorinha,,"Além disso, a parlamentar estudou as possibilidades de apresentação de destaques que possam minimizar perdas nas áreas da Educação, Mulheres, Ciência e Tecnologia e para Secretaria Nacional Antidrogas.",pt,[],[],[],0,0,1,[],[],https://twitter.com/profdorinha/status/1374444475523600385,False,,0,,,,,,,,[],,,,
1374443929618186244,1374443929618186244,2021-03-23 16:32:23 -0300,2021-03-23,16:32:23,-300,79174387,profdorinha,Professora Dorinha,,"Com foco no Orçamento a ser destinado em 2021, a deputada Professora Dorinha (DEM/TO) se reuniu com técnicos da Câmara para compreender as alocações orçamentárias feitas pelo relator-geral, senador Márcio Bittar (MDB/AC).",pt,[],[],[],4,1,11,[],[],https://twitter.com/profdorinha/status/1374443929618186244,False,,0,,,,,,,,[],,,,
1374054740066242560,1374054740066242560,2021-03-22 14:45:53 -0300,2021-03-22,14:45:53,-300,79174387,profdorinha,Professora Dorinha,,"Sigo atuante em cada uma delas e na busca de mais recursos para os municípios do Tocantins, afim de garantir uma saúde e educação de qualidade aos tocantinenses. Continue acompanhando o meu trabalho.  . Uma boa semana a todos! Vamos juntos!",pt,[],[],[],2,0,2,[],[],https://twitter.com/profdorinha/status/1374054740066242560,False,,0,,,,,,,,[],,,,
1374054555143569410,1374054555143569410,2021-03-22 14:45:09 -0300,2021-03-22,14:45:09,-300,79174387,profdorinha,Professora Dorinha,,"Sei da relevância de ocupar importantes posições de liderança na Casa e da importância em ser membro de comissões de destaque, que são responsáveis pela aprovação de leis em nosso País.  https://t.co/KBFELfwTvz",pt,[],[],['https://pbs.twimg.com/media/ExGfU5nW8AEE37w.jpg'],0,1,3,[],[],https://twitter.com/profdorinha/status/1374054555143569410,False,,1,https://pbs.twimg.com/media/ExGfU5nW8AEE37w.jpg,,,,,,,[],,,,
1374054471966281729,1374054471966281729,2021-03-22 14:44:49 -0300,2021-03-22,14:44:49,-300,79174387,profdorinha,Professora Dorinha,,"Boa tarde! Na Câmara dos Deputados, em Brasília (DF), desempenho importante trabalho nas áreas da Educação, Mulheres, Seguridade Social e Família; e Desenvolvimento Urbano.  https://t.co/FiLy0K97iL",pt,[],[],['https://pbs.twimg.com/media/ExGfOR_XEAMPtCS.jpg'],0,1,3,[],[],https://twitter.com/profdorinha/status/1374054471966281729,False,,1,https://pbs.twimg.com/media/ExGfOR_XEAMPtCS.jpg,,,,,,,[],,,,
1373330800712761351,1373330800712761351,2021-03-20 14:49:12 -0300,2021-03-20,14:49:12,-300,79174387,profdorinha,Professora Dorinha,,"“O Congresso Nacional se mobiliza a partir de agora pela derrubada do veto ao PL 3477/2020, que garante internet e equipamentos para 18 milhões de alunos e 1,5 milhão de professores. O Ensino Público do País é prioridade. #ConectividadeJá!” Assista 📺👆🏻  https://t.co/CKh0Jfo5d6",pt,[],[],[],3,8,47,['conectividadejá'],[],https://twitter.com/profdorinha/status/1373330800712761351,False,,1,https://pbs.twimg.com/ext_tw_video_thumb/1373330559099887618/pu/img/QOmsrS4UfDoQxFkS.jpg,,,,,,,[],,,,
1372981845403570176,1372981845403570176,2021-03-19 15:42:35 -0300,2021-03-19,15:42:35,-300,79174387,profdorinha,Professora Dorinha,,Confira! ✅   https://t.co/1hYvFv4Xgw,pt,[],['https://movel.t1noticias.com.br/politica/bancada-feminina-aprova-proposicoes-de-combate-a-violencia-contra-a-mulher/116687/'],[],1,1,10,[],[],https://twitter.com/profdorinha/status/1372981845403570176,False,,0,,,,,,,,[],,,,
1371509722663243784,1371509722663243784,2021-03-15 14:12:53 -0300,2021-03-15,14:12:53,-300,79174387,profdorinha,Professora Dorinha,,"A pandemia forçou o país a buscar um salto tecnológico que deve ser revertido em novos métodos de qualificação dos profissionais do setor, dos alunos e das próprias famílias, com a participação dos gestores públicos [...]. Ouça a matéria completa em  https://t.co/tNvbgXh5hh",pt,[],['https://bit.ly/3eAyZRM'],[],3,1,4,[],[],https://twitter.com/profdorinha/status/1371509722663243784,False,,0,,,,,,,,[],,,,
1371509405674524674,1371509405674524674,2021-03-15 14:11:38 -0300,2021-03-15,14:11:38,-300,79174387,profdorinha,Professora Dorinha,,"Como presidente da Comissão de Educação na Câmara concedi entrevista à Rádio Câmara nesta segunda, 15. Na ocasião, abordei as prioridades do colegiado neste ano para análise de projetos que auxiliem Estados e Municípios no enfrentamento da situação atual da Educação no País.",pt,[],[],[],0,2,11,[],[],https://twitter.com/profdorinha/status/1371509405674524674,False,,0,,,,,,,,[],,,,
1369765010298335235,1369765010298335235,2021-03-10 18:40:02 -0300,2021-03-10,18:40:02,-300,79174387,profdorinha,Professora Dorinha,,"Com ela tratei sobre os trabalhos internos e o planejamento das atividades legislativas para a próxima reunião ordinária, na quarta-feira, 17 de março. Vamos juntos nesse novo desafio! #ComissãodeEducação #presidente",pt,[],[],[],3,0,8,"['comissãodeeducação', 'presidente']",[],https://twitter.com/profdorinha/status/1369765010298335235,False,,0,,,,,,,,[],,,,
1369764868308484101,1369764868308484101,2021-03-10 18:39:28 -0300,2021-03-10,18:39:28,-300,79174387,profdorinha,Professora Dorinha,,"Amigos e amigas, já iniciei os trabalhos como presidente da Comissão de Educação, cargo que fui eleita ainda hoje, quarta-feira, 10 de março, na Câmara dos Deputados. Para dar andamento às demandas da área, me reuni com a secretária-executiva do colegiado, Eugênia Pestana.  https://t.co/ofIS6vIDNf",pt,[],[],['https://pbs.twimg.com/media/EwJh4e5XEAsT4MZ.jpg'],6,3,26,[],[],https://twitter.com/profdorinha/status/1369764868308484101,False,,1,https://pbs.twimg.com/media/EwJh4e5XEAsT4MZ.jpg,,,,,,,[],,,,
1369704342769524743,1369704342769524743,2021-03-10 14:38:57 -0300,2021-03-10,14:38:57,-300,79174387,profdorinha,Professora Dorinha,, https://t.co/BhMakTTPBX  https://t.co/8L6kCiq9VS,und,[],['https://www.t1noticias.com.br/politica/eleita-por-unanimidade-dorinha-vai-presidir-a-comissao-de-educacao-na-camara/116544/'],['https://pbs.twimg.com/media/EwIqkyeXEAU072v.jpg'],2,3,12,[],[],https://twitter.com/profdorinha/status/1369704342769524743,False,,1,https://pbs.twimg.com/media/EwIqkyeXEAU072v.jpg,,,,,,,[],,,,
1369623941283733507,1369623941283733507,2021-03-10 09:19:28 -0300,2021-03-10,09:19:28,-300,79174387,profdorinha,Professora Dorinha,, https://t.co/EVzgbcJIhw  ✅Acompanhe a instalação da Comissão de Educação que a deputada Professora Dorinha irá presidir a partir de hoje. 👆🏻#Educação,pt,[],['https://m.youtube.com/watch?v=O3LDE7xtRRU'],[],0,0,6,['educação'],[],https://twitter.com/profdorinha/status/1369623941283733507,False,,0,,,,,,,,[],,,,
1369418219191230465,1369418219191230465,2021-03-09 19:42:00 -0300,2021-03-09,19:42:00,-300,79174387,profdorinha,Professora Dorinha,," https://t.co/GPfhK0V1uc  ⚠️ Acontece daqui a pouco, às 20 horas, live da deputada Professora Dorinha com a jornalista Glês Nascimento. Você não pode perder! 👍🏻   ⏰Horário: 20 horas  ✍🏻Pauta: Mulheres na Política 🌹 ✅Instagram: @glesnascimento   #depprofdorinha #mulheres #live",pt,"[{'screen_name': 'glesnascimento', 'name': 'glês nascimento', 'id': '50682770'}]",['https://www.instagram.com/p/CMMsJD8M7e6/?igshid=1ojhvwjqz3nux'],[],0,1,3,"['depprofdorinha', 'mulheres', 'live']",[],https://twitter.com/profdorinha/status/1369418219191230465,False,,0,,,,,,,,[],,,,
1369330860579815432,1369330860579815432,2021-03-09 13:54:52 -0300,2021-03-09,13:54:52,-300,79174387,profdorinha,Professora Dorinha,,"Isso corresponde a uma ampliação na complementação da União ao Fundeb. De maneira que, os recursos poderão vir da reestimativa positiva de receita para o ano de 2021, o que, na prática, poderemos ter mais R$ 14 bilhões em recursos para Educação.  https://t.co/zkAVLytu41",pt,[],[],['https://pbs.twimg.com/media/EwDXKFxXAAkJUHQ.jpg'],1,1,6,[],[],https://twitter.com/profdorinha/status/1369330860579815432,False,,1,https://pbs.twimg.com/media/EwDXKFxXAAkJUHQ.jpg,,,,,,,[],,,,
1369330730594140161,1369330730594140161,2021-03-09 13:54:21 -0300,2021-03-09,13:54:21,-300,79174387,profdorinha,Professora Dorinha,,"Fundeb: Amigos e amigas, o plenário da CMO aprovou, no último dia 3 de março, o destaque que propus para incluir no texto, do parecer preliminar, nas alocações orçamentárias aceitas ao relator-geral, senador Márcio Bittar (MDB-AC).",pt,[],[],[],0,0,11,[],[],https://twitter.com/profdorinha/status/1369330730594140161,False,,0,,,,,,,,[],,,,
1369267914176667649,1369267914176667649,2021-03-09 09:44:45 -0300,2021-03-09,09:44:45,-300,79174387,profdorinha,Professora Dorinha,,Bom dia! É hoje! Acompanhe 🌷  https://t.co/rX5wEc6vLB,pt,[],[],['https://pbs.twimg.com/media/EwCd5_VWQAMTVSx.jpg'],1,0,8,[],[],https://twitter.com/profdorinha/status/1369267914176667649,False,,1,https://pbs.twimg.com/media/EwCd5_VWQAMTVSx.jpg,,,,,,,[],,,,
1368944623108907011,1368944623108907011,2021-03-08 12:20:06 -0300,2021-03-08,12:20:06,-300,79174387,profdorinha,Professora Dorinha,,💪🏻🌹  https://t.co/In8N91aDNG,und,[],[],['https://pbs.twimg.com/media/Ev932x7XYAEU-3S.jpg'],1,1,9,[],[],https://twitter.com/profdorinha/status/1368944623108907011,False,,1,https://pbs.twimg.com/media/Ev932x7XYAEU-3S.jpg,,,,,,,[],,,,
1368903112317149186,1368903112317149186,2021-03-08 09:35:09 -0300,2021-03-08,09:35:09,-300,79174387,profdorinha,Professora Dorinha,,"Hoje, data em que se celebra mais um Dia da Mulher desejo a todas muito amor, protagonismo e, principalmente, direitos respeitados. A nós que ajudamos a transformar o nosso País, especialmente o nosso Tocantins, minha homenagem, respeito e admiração.Feliz Dia da Mulher! 💪🏻🌹  https://t.co/lFj82cntiO",pt,[],[],[],0,0,8,[],[],https://twitter.com/profdorinha/status/1368903112317149186,False,,1,https://pbs.twimg.com/ext_tw_video_thumb/1368902907798708225/pu/img/E-EyIkTtJcdTDzmD.jpg,,,,,,,[],,,,
