id,conversation_id,created_at,date,time,timezone,user_id,username,name,place,tweet,language,mentions,urls,photos,replies_count,retweets_count,likes_count,hashtags,cashtags,link,retweet,quote_url,video,thumbnail,near,geo,source,user_rt_id,user_rt,retweet_id,reply_to,retweet_date,translate,trans_src,trans_dest
1523778605587001344,1523778605587001344,2022-05-09 18:35:04 -03,2022-05-09,18:35:04,-300,79174387,profdorinha,Professora Dorinha,,"Hoje, acompanhei a entrega de uma caminhonete, adquirida com recursos que enviei à Defensoria Pública do Tocantins. A convite da Dra. Estellamaris, participei desse momento tão importante para a instituição que garante a justiça aos nossos tocantinenses.",pt,[],[],[],0,0,0,[],[],https://twitter.com/profdorinha/status/1523778605587001344,False,,0,,,,,,,,[],,,,
1522030225185509377,1522030225185509377,2022-05-04 22:47:38 -03,2022-05-04,22:47:38,-300,79174387,profdorinha,Professora Dorinha,,"Com grande alegria que aprovamos hoje o Piso Salarial da Enfermagem. Uma luta que travamos pela valorização destes importantes profissionais. O PL aprovado foi o 2.564/2020, mas apensado a ele está o 2.997/2020, de minha autoria. Segue agora para sanção. Parabéns a todos!",pt,[],[],[],0,0,2,[],[],https://twitter.com/profdorinha/status/1522030225185509377,False,,0,,,,,,,,[],,,,
1521223034430013444,1521223032458682368,2022-05-02 17:20:09 -03,2022-05-02,17:20:09,-300,79174387,profdorinha,Professora Dorinha,,"Vivo no Tocantins há mais de 30 anos. Já residi em Arraias, Porto Nacional e Palmas. Conheço e amo meu estado. O meu comprometimento é o mesmo, aliás quero trabalhar ainda mais porque acredito que somos o estado mais promissor do Brasil. Há muito o que ser feito.",pt,[],[],[],0,0,5,[],[],https://twitter.com/profdorinha/status/1521223034430013444,False,,0,,,,,,,,[],,,,
1521223032458682368,1521223032458682368,2022-05-02 17:20:08 -03,2022-05-02,17:20:08,-300,79174387,profdorinha,Professora Dorinha,,"Recebi hoje, com muita humildade, o resultado de mais uma pesquisa, realizada pelo instituto Real Time Big Data. Seguimos na liderança para o Senado, com 11 pontos à frente do segundo colocado. Agradeço ao povo tocantinense pela confiança e reconhecimento do meu trabalho.",pt,[],[],[],1,0,7,[],[],https://twitter.com/profdorinha/status/1521223032458682368,False,,0,,,,,,,,[],,,,
1520046839596306432,1520046838132400128,2022-04-29 11:26:22 -03,2022-04-29,11:26:22,-300,79174387,profdorinha,Professora Dorinha,,A PRF faz um trabalho de extrema importância para a sociedade e essa medida é essencial para que instituição consiga formar mais de 500 policiais. Podem continuar contando com o meu apoio em defesa da PRF.  https://t.co/OwggvcB5pe,pt,[],['http://encurtador.com.br/aoMS0'],[],0,0,1,[],[],https://twitter.com/profdorinha/status/1520046839596306432,False,,0,,,,,,,,[],,,,
1520046838132400128,1520046838132400128,2022-04-29 11:26:21 -03,2022-04-29,11:26:21,-300,79174387,profdorinha,Professora Dorinha,,"O Congresso aprovou, ontem, o Projeto de Lei do Congresso Nacional (PLN), que assegura aditivo orçamentário à Polícia Rodoviária Federal (PRF) no valor de R$ 21 milhões. O montante será utilizado para realização do curso de formação para os excedentes do concurso de 2021",pt,[],[],[],1,0,2,[],[],https://twitter.com/profdorinha/status/1520046838132400128,False,,0,,,,,,,,[],,,,
1519750594927468544,1519750594927468544,2022-04-28 15:49:12 -03,2022-04-28,15:49:12,-300,79174387,profdorinha,Professora Dorinha,,"Hoje celebramos o Dia Mundial da Educação, uma data muito importante para aqueles que fazem a educação acontecer e que acreditam na diferença que ela faz na vida das pessoas. A educação sempre será o caminho. Obrigada a todos vocês! Assista:  https://t.co/ijXE7CBG3c",pt,[],['http://encurtador.com.br/luE17'],[],1,0,5,[],[],https://twitter.com/profdorinha/status/1519750594927468544,False,,0,,,,,,,,[],,,,
1519405498113613826,1519405495660040194,2022-04-27 16:57:54 -03,2022-04-27,16:57:54,-300,79174387,profdorinha,Professora Dorinha,,"Continuo como membro titular da Comissão de Educação, afinal essa é a minha bandeira do coração. Sou professora, antes de ser deputada, e é esse o meu propósito de vida: lutar para que todos tenham acesso à educação de qualidade.",pt,[],[],[],0,0,5,[],[],https://twitter.com/profdorinha/status/1519405498113613826,False,,0,,,,,,,,[],,,,
1519405495660040194,1519405495660040194,2022-04-27 16:57:54 -03,2022-04-27,16:57:54,-300,79174387,profdorinha,Professora Dorinha,,"Deixo, hoje, a cadeira de presidente da Comissão de Educação na @camaradeputados. Esse foi um dos maiores desafios de toda minha carreira de parlamentar. Foram muitas as discussões e 281 proposições deliberadas.  https://t.co/l2PPk2o7e7",pt,"[{'screen_name': 'camaradeputados', 'name': 'câmara dos deputados', 'id': '61843152'}]",[],['https://pbs.twimg.com/media/FRYDOuqXEAEIrTn.jpg'],5,0,25,[],[],https://twitter.com/profdorinha/status/1519405495660040194,False,,1,https://pbs.twimg.com/media/FRYDOuqXEAEIrTn.jpg,,,,,,,[],,,,
1519297692966526977,1519297692966526977,2022-04-27 09:49:31 -03,2022-04-27,09:49:31,-300,79174387,profdorinha,Professora Dorinha,,"Hoje participo da Marcha dos Vereadores e da Marcha dos Prefeitos, atos importantes para a construção democrática do nosso País. Fico feliz de ver nossa capital federal cheia de prefeitos e vereadores, na luta por melhorias para nosso povo tocantinense.",pt,[],[],[],0,0,3,[],[],https://twitter.com/profdorinha/status/1519297692966526977,False,,0,,,,,,,,[],,,,
1519066618659229696,1519066618659229696,2022-04-26 18:31:19 -03,2022-04-26,18:31:19,-300,79174387,profdorinha,Professora Dorinha,,"Continuamos na luta pela aprovação do Piso Salarial da Enfermagem. A votação desta importante pauta está prevista para acontecer no próximo dia 4 de maio. Contem com o meu apoio, vocês merecem esse reconhecimento.",pt,[],[],[],2,3,23,[],[],https://twitter.com/profdorinha/status/1519066618659229696,False,,0,,,,,,,,[],,,,
1518952396336082944,1518952396336082944,2022-04-26 10:57:26 -03,2022-04-26,10:57:26,-300,79174387,profdorinha,Professora Dorinha,,"Hoje celebramos o aniversário da querida cidade Barra do Ouro, que completa 26 anos. Desejo felicidades e prosperidade a todos os barraourenses, não somente nesta data, mas todos os dias. Contem comigo!",pt,[],[],[],0,0,1,[],[],https://twitter.com/profdorinha/status/1518952396336082944,False,,0,,,,,,,,[],,,,
1518686633083744257,1518686630390947842,2022-04-25 17:21:23 -03,2022-04-25,17:21:23,-300,79174387,profdorinha,Professora Dorinha,,"No sábado, falei em minhas redes sobre o Dia da Educação de Surdos, disponível no link:  https://t.co/8ZIS2gJTxZ Já no domingo, abordei o Dia da Língua Brasileira de Sinais (Libras), disponível em:  https://t.co/NBwpNiVDBK",pt,[],"['http://encurtador.com.br/enpBD', 'http://encurtador.com.br/twHUX']",[],0,0,3,[],[],https://twitter.com/profdorinha/status/1518686633083744257,False,,0,,,,,,,,[],,,,
1518686630390947842,1518686630390947842,2022-04-25 17:21:23 -03,2022-04-25,17:21:23,-300,79174387,profdorinha,Professora Dorinha,,"Celebramos, neste fim de semana, duas importantes datas para a educação inclusiva, que tem sido uma das minhas bandeiras nesta área. Temos esse compromisso de garantir uma rede de ensino que respeite as diferenças, reduza a desigualdade e seja acessível.",pt,[],[],[],1,0,11,[],[],https://twitter.com/profdorinha/status/1518686630390947842,False,,0,,,,,,,,[],,,,
1516765817085509639,1516765817085509639,2022-04-20 10:08:45 -03,2022-04-20,10:08:45,-300,79174387,profdorinha,Professora Dorinha,,"Logo cedo me reuni com o novo ministro da Educação, Victor Godoy Veiga, para tratar de assuntos muito importantes para o Tocantins e todo Brasil. Em pauta, destaco a questão das escolas não empenhadas pelo FNDE e a atualização do repasse do Plano Nacional de Alimentação Escolar.  https://t.co/Vv8GbFOyBD",pt,[],[],['https://pbs.twimg.com/media/FQyieMGWUAUHP_0.jpg'],0,0,10,[],[],https://twitter.com/profdorinha/status/1516765817085509639,False,,1,https://pbs.twimg.com/media/FQyieMGWUAUHP_0.jpg,,,,,,,[],,,,
1516571596013645827,1516571596013645827,2022-04-19 21:16:59 -03,2022-04-19,21:16:59,-300,79174387,profdorinha,Professora Dorinha,,"Aprovamos hoje, na @camaradeputados, a emenda que apresentei para prorrogação do prazo de aplicação dos R$ 3,5 bilhões destinados pela MP 1077 para implementações tecnológicas que viabilizam internet gratuita em escolas públicas de todo País. Confira:  https://t.co/hmf8UXC60n",pt,"[{'screen_name': 'camaradeputados', 'name': 'câmara dos deputados', 'id': '61843152'}]",['http://encr.pw/mIsDd'],[],1,3,10,[],[],https://twitter.com/profdorinha/status/1516571596013645827,False,,0,,,,,,,,[],,,,
1516176063436673028,1516176060982902785,2022-04-18 19:05:17 -03,2022-04-18,19:05:17,-300,79174387,profdorinha,Professora Dorinha,,"Aproveitei para apresentar a eles o meu Projeto de Lei 810/2022, que amplia o prazo até março de 2023. Além de se tratar de um montante alto, é um investimento muito importante para Educação do país. É necessário tempo suficiente para alcançar o resultado pretendido.",pt,[],[],[],0,2,7,[],[],https://twitter.com/profdorinha/status/1516176063436673028,False,,0,,,,,,,,[],,,,
1516176060982902785,1516176060982902785,2022-04-18 19:05:16 -03,2022-04-18,19:05:16,-300,79174387,profdorinha,Professora Dorinha,,"Na manhã de hoje me reuni com o presidente do Consed, Vitor de Angelo e os secretários de Educação Cláudio Furtado (PB) e Josué Modesto (SE) para debater sobre os prazos estabelecidos na Lei 14.172/2021, que garante R$ 3,5 bilhões para conectividade em escolas públicas.",pt,[],[],[],2,2,10,[],[],https://twitter.com/profdorinha/status/1516176060982902785,False,,0,,,,,,,,[],,,,
1512564065964544004,1512564065964544004,2022-04-08 19:52:30 -03,2022-04-08,19:52:30,-300,79174387,profdorinha,Professora Dorinha,,"Hoje participei do ato de assinatura da Ordem de Serviço para construção do Centro de Cultura e Arte no Distrito de Taquaraçu. Fiquei muito feliz de participar desse momento, uma iniciativa muito importante para a Taquaruçu.",pt,[],[],[],2,0,7,[],[],https://twitter.com/profdorinha/status/1512564065964544004,False,,0,,,,,,,,[],,,,
1511829929440292865,1511829925359230979,2022-04-06 19:15:18 -03,2022-04-06,19:15:18,-300,79174387,profdorinha,Professora Dorinha,,"O montante já foi pago aos estados e municípios em março, e agora é preciso tempo hábil para que os sistemas possam se preparar na compra de equipamentos e dar sequência ao processo tecnológico para fornecer internet aos alunos e professores da Rede Pública de Ensino.",pt,[],[],[],2,1,1,[],[],https://twitter.com/profdorinha/status/1511829929440292865,False,,0,,,,,,,,[],,,,
1511829925359230979,1511829925359230979,2022-04-06 19:15:17 -03,2022-04-06,19:15:17,-300,79174387,profdorinha,Professora Dorinha,,"Hoje participei de uma videoconferência com a chefe de gabinete do ministro Dias Toffoli, do @STF_oficial. Discutimos a ampliação do prazo para implantação da Lei da Conectividade nos estados e municípios. Isso garantirá que a finalidade dos R$ 3,5 bi investidos seja alcançada",pt,"[{'screen_name': 'stf_oficial', 'name': 'stf', 'id': '68313718'}]",[],[],3,2,8,[],[],https://twitter.com/profdorinha/status/1511829925359230979,False,,0,,,,,,,,[],,,,
1511463845885267970,1511463844253679622,2022-04-05 19:00:37 -03,2022-04-05,19:00:37,-300,79174387,profdorinha,Professora Dorinha,,"A rede une a UFT, UndimeTO, o MPTO e diversos parceiros na tarefa de garantir uma educação de qualidade. Parabéns a todos pelo trabalho desenvolvido.",pt,[],[],[],1,0,0,[],[],https://twitter.com/profdorinha/status/1511463845885267970,False,,0,,,,,,,,[],,,,
1511463844253679622,1511463844253679622,2022-04-05 19:00:36 -03,2022-04-05,19:00:36,-300,79174387,profdorinha,Professora Dorinha,,"Hoje aconteceu o Seminário de Abertura 2022, da Rede de ColaborAção, com o tema ""Gestão da educação e atuação pedagógica nas redes e sistemas municipais do Tocantins"". Tive a alegria de participar palestrando sobre o tema ""Educação no município, diálogos sobre a gestão"".",pt,[],[],[],4,0,0,[],[],https://twitter.com/profdorinha/status/1511463844253679622,False,,0,,,,,,,,[],,,,
1511068731727822850,1511068731727822850,2022-04-04 16:50:34 -03,2022-04-04,16:50:34,-300,79174387,profdorinha,Professora Dorinha,,"Hoje, o Instituto Federal de Educação, Ciência e Tecnologia do Tocantins - Campus Palmas completa 19 anos e eu tive a alegria de participar desse lindo momento. A presença do @IFTOPalmas na formação das pessoas só dá orgulho para nós que representamos o Tocantins. Contem comigo!",pt,"[{'screen_name': 'iftopalmas', 'name': 'campus palmas - ifto', 'id': '556199988'}]",[],[],1,0,3,[],[],https://twitter.com/profdorinha/status/1511068731727822850,False,,0,,,,,,,,[],,,,
1509947839127994370,1509947837462847492,2022-04-01 14:36:32 -03,2022-04-01,14:36:32,-300,79174387,profdorinha,Professora Dorinha,,"Fui relatora do projeto na @camaradeputados, e fico feliz em saber que pudemos atuar, mais uma vez, na defesa de todas mulheres do país. A lei faz parte de um grande conjunto de legislações que aprovamos em março no combate à violência contra a mulher.",pt,"[{'screen_name': 'camaradeputados', 'name': 'câmara dos deputados', 'id': '61843152'}]",[],[],0,0,1,[],[],https://twitter.com/profdorinha/status/1509947839127994370,False,,0,,,,,,,,[],,,,
1509947837462847492,1509947837462847492,2022-04-01 14:36:32 -03,2022-04-01,14:36:32,-300,79174387,profdorinha,Professora Dorinha,,"Mais uma conquista! Entrou em vigor hoje a lei 14.321/22, que torna crime a violência institucional, conduta que acontece quando vítimas ou testemunhas de crimes são submetidas a procedimentos desnecessários, repetitivos e invasivos que levem a reviver a situação de violência.",pt,[],[],[],5,0,5,[],[],https://twitter.com/profdorinha/status/1509947837462847492,False,,0,,,,,,,,[],,,,
1509876123815006211,1509876122271506440,2022-04-01 09:51:34 -03,2022-04-01,09:51:34,-300,79174387,profdorinha,Professora Dorinha,,"Sejam bem-vindos, nossos pré-candidatos a deputado estadual: Deputado estadual Jair Farias, ex-vereador de Porto Nacional Djalma Araújo, vereador de Miracema Cirilo Douglas, odontólogo Maurício Nunes e advogada Maria de Jesus. Sintam-se acolhidos pelo União Brasil Tocantins.",pt,[],[],[],0,0,3,[],[],https://twitter.com/profdorinha/status/1509876123815006211,False,,0,,,,,,,,[],,,,
1509876122271506440,1509876122271506440,2022-04-01 09:51:34 -03,2022-04-01,09:51:34,-300,79174387,profdorinha,Professora Dorinha,,"Ontem, com grande alegria, aumentamos a força do União Brasil em nosso estado. Recebemos importantes nomes que chegam para somar ao nosso trabalho por um Tocantins melhor. Somos um partido com grandes lideranças, e faremos uma política participativa e democrática.",pt,[],[],[],1,0,5,[],[],https://twitter.com/profdorinha/status/1509876122271506440,False,,0,,,,,,,,[],,,,
1509266661890834432,1509266659214823428,2022-03-30 17:29:47 -03,2022-03-30,17:29:47,-300,79174387,profdorinha,Professora Dorinha,,"Devido a pandemia, a solenidade foi adiada, mas me sinto honrada em participar da escolha dessas mulheres incríveis. Deixo aqui registrado meu carinho a elas: Ministra Rosa Weber, jurista Luciana Lóssio, senadora Mara Gabrilli, professora Telma Maria e professora Lúcia Maria.",pt,[],[],[],0,0,1,[],[],https://twitter.com/profdorinha/status/1509266661890834432,False,,0,,,,,,,,[],,,,
1509266659214823428,1509266659214823428,2022-03-30 17:29:47 -03,2022-03-30,17:29:47,-300,79174387,profdorinha,Professora Dorinha,,"Hoje, na @camaradeputados, aconteceu a entrega da Medalha Mietta Santiago, uma homenagem às mulheres que brilhantemente lutaram a favor dos direitos femininos em nosso país. As homenageadas foram escolhidas em 2020, quando eu era coordenadora da bancada feminina.",pt,"[{'screen_name': 'camaradeputados', 'name': 'câmara dos deputados', 'id': '61843152'}]",[],[],1,0,1,[],[],https://twitter.com/profdorinha/status/1509266659214823428,False,,0,,,,,,,,[],,,,
1509261050595655680,1509261049018650627,2022-03-30 17:07:29 -03,2022-03-30,17:07:29,-300,79174387,profdorinha,Professora Dorinha,,"Devido a pandemia, a solenidade foi adiada, mas me sinto honrada em participar da escolha dessas mulheres incríveis. Deixo aqui registrado meu carinho a elas: Ministra Rosa Weber, jurista Luciana Lóssio, senadora Mara Gabrilli, professora Telma Maria e professora Lúcia Maria.",pt,[],[],[],0,0,0,[],[],https://twitter.com/profdorinha/status/1509261050595655680,False,,0,,,,,,,,[],,,,
1509259032028237828,1509259030178455552,2022-03-30 16:59:28 -03,2022-03-30,16:59:28,-300,79174387,profdorinha,Professora Dorinha,,"Devido a pandemia, a solenidade foi adiada, mas me sinto honrada em participar da escolha dessas mulheres incríveis. Deixo aqui registrado meu carinho a elas: Ministra Rosa Weber, jurista Luciana Lóssio, senadora Mara Gabrilli, professora Telma Maria e professora Lúcia Maria.",pt,[],[],[],0,0,0,[],[],https://twitter.com/profdorinha/status/1509259032028237828,False,,0,,,,,,,,[],,,,
1508541797689180160,1508541797689180160,2022-03-28 17:29:26 -03,2022-03-28,17:29:26,-300,79174387,profdorinha,Professora Dorinha,,"No Brasil, uma a cada quatro estudantes deixam de ir à escola por falta de absorventes. No combate à pobreza menstrual, no mês da mulher derrubamos o veto, que era contra a distribuição gratuita de absorventes para mulheres em situação de vulnerabilidade. Mais uma vitória nossa!",pt,[],[],[],0,0,6,[],[],https://twitter.com/profdorinha/status/1508541797689180160,False,,0,,,,,,,,[],,,,
1507426945117601808,1507426945117601808,2022-03-25 15:39:25 -03,2022-03-25,15:39:25,-300,79174387,profdorinha,Professora Dorinha,,"O TSE registrou o menor número de jovens com título de eleitor da história. Em fevereiro, 830 mil jovens se cadastraram, sendo que na eleição passada foram 1,4 milhão de adolescentes, no mesmo período. Peço aos jovens que façam seus títulos, vocês têm o poder de mudar o futuro.  https://t.co/bHaZhiSYyt",pt,[],[],['https://pbs.twimg.com/media/FOt00RdWQBcBdni.jpg'],1,0,6,[],[],https://twitter.com/profdorinha/status/1507426945117601808,False,,1,https://pbs.twimg.com/media/FOt00RdWQBcBdni.jpg,,,,,,,[],,,,
1507063821902532609,1507063819687940102,2022-03-24 15:36:29 -03,2022-03-24,15:36:29,-300,79174387,profdorinha,Professora Dorinha,,"Estou à disposição para discutir os projetos apresentados e contribuir para torná-los realidade, pois acredito que os projetos da ADAT podem beneficiar diretamente o estado com geração de emprego, renda e desenvolvimento econômico para todos os tocantinenses.",pt,[],[],[],1,2,3,[],[],https://twitter.com/profdorinha/status/1507063821902532609,False,,0,,,,,,,,[],,,,
1507063819687940102,1507063819687940102,2022-03-24 15:36:29 -03,2022-03-24,15:36:29,-300,79174387,profdorinha,Professora Dorinha,,"Ontem recebi, em meu escritório, a visita de membros da Associação de Distribuidores e Atacadistas do Estado do Tocantins (ADAT). Na ocasião, o presidente da ADAT, @henriquenesello, apresentou a associação e os desafios enfrentados por ela.",pt,"[{'screen_name': 'henriquenesello', 'name': 'henrique nesello', 'id': '318986534'}]",[],[],2,2,3,[],[],https://twitter.com/profdorinha/status/1507063819687940102,False,,0,,,,,,,,[],,,,
1506983611240693762,1506983609713967107,2022-03-24 10:17:45 -03,2022-03-24,10:17:45,-300,79174387,profdorinha,Professora Dorinha,,Esta luta é legítima e esses profissionais merecem o nosso reconhecimento pelo trabalho que prestam à sociedade. Saiba mais:  https://t.co/1Flgzbrgrq,pt,[],['http://encurtador.com.br/mHLOV'],[],0,1,5,[],[],https://twitter.com/profdorinha/status/1506983611240693762,False,,0,,,,,,,,[],,,,
1506983609713967107,1506983609713967107,2022-03-24 10:17:45 -03,2022-03-24,10:17:45,-300,79174387,profdorinha,Professora Dorinha,,"Após muita luta, ontem, conseguimos aprovar a PEC 22, que assegura o pagamento do piso salarial aos agentes comunitários de saúde e aos agentes de combate às endemias. A remuneração desses agentes não será inferior a dois salários mínimos, mais o adicional de insalubridade.",pt,[],[],[],2,1,5,[],[],https://twitter.com/profdorinha/status/1506983609713967107,False,,0,,,,,,,,[],,,,
1506744998619926534,1506744998619926534,2022-03-23 18:29:36 -03,2022-03-23,18:29:36,-300,79174387,profdorinha,Professora Dorinha,,"Publicada, agora à tarde, resolução que confirma meu nome como presidente do União Brasil TO. Me sinto honrada e determinada a organizar a sigla de maneira democrática. Nosso partido nasce com espírito de construção coletiva, respeito à cidadania e construção de um país melhor.  https://t.co/y4RnRRBPv4",pt,[],[],['https://pbs.twimg.com/media/FOkIlz2XEAUpdM-.jpg'],0,0,8,[],[],https://twitter.com/profdorinha/status/1506744998619926534,False,,1,https://pbs.twimg.com/media/FOkIlz2XEAUpdM-.jpg,,,,,,,[],,,,
1506693457607335943,1506693456286162944,2022-03-23 15:04:47 -03,2022-03-23,15:04:47,-300,79174387,profdorinha,Professora Dorinha,,"Contem com meu voto favorável. Sei da importância do trabalho realizado por vocês e reconheço a desvalorização que sofrem. O que depender de mim, todos vocês enfermeiros, técnicos de enfermagem, auxiliares e parteiras terão o seu valor garantido. Veja:  https://t.co/phNighbn6g",pt,[],['http://encurtador.com.br/rvAHJ'],[],0,0,6,[],[],https://twitter.com/profdorinha/status/1506693457607335943,False,,0,,,,,,,,[],,,,
1506693456286162944,1506693456286162944,2022-03-23 15:04:47 -03,2022-03-23,15:04:47,-300,79174387,profdorinha,Professora Dorinha,,"Aos profissionais da enfermagem, uma boa notícia. Aprovamos ontem o requerimento de urgência para o PL 2564/20, que institui o piso salarial nacional para a categoria. Realizei várias reuniões com parlamentares e, graças ao nosso esforço, em abril a proposta será analisada.",pt,[],[],[],4,1,13,[],[],https://twitter.com/profdorinha/status/1506693456286162944,False,,0,,,,,,,,[],,,,
1506017733707956225,1506017733707956225,2022-03-21 18:19:42 -03,2022-03-21,18:19:42,-300,79174387,profdorinha,Professora Dorinha,,"Recebi a informação, dada pelo presidente da Câmara @ArthurLira_, de que a urgência do piso da enfermagem será votada ainda nesta semana. Quero reforçar que estou à disposição dos trabalhadores da saúde, em especial da Enfermagem.  Esses profissionais merecem nosso reconhecimento",pt,"[{'screen_name': 'arthurlira_', 'name': 'arthur lira', 'id': '1086390169970884613'}]",[],[],1,0,8,[],[],https://twitter.com/profdorinha/status/1506017733707956225,False,,0,,,,,,,,[],,,,
1506003787248455694,1506003787248455694,2022-03-21 17:24:17 -03,2022-03-21,17:24:17,-300,79174387,profdorinha,Professora Dorinha,,"Como professora e deputada, luto pela inclusão de estudantes com deficiência em nossas escolas regulares. Hoje, Dia Internacional da Síndrome de Down, quero destacar a importância de garantir uma educação inclusiva do ensino fundamental ao nível superior   https://t.co/TuwDMI0Jmu",pt,[],['http://encurtador.com.br/kmsKR'],[],0,0,6,[],[],https://twitter.com/profdorinha/status/1506003787248455694,False,,0,,,,,,,,[],,,,
1505983212958457861,1505983211272351745,2022-03-21 16:02:32 -03,2022-03-21,16:02:32,-300,79174387,profdorinha,Professora Dorinha,,O novo FUNDEB vai garantir o recurso que as instituições precisam para implementar este modelo.  https://t.co/SxC28TMEz4,pt,[],['http://encurtador.com.br/mDUZ0'],[],0,0,5,[],[],https://twitter.com/profdorinha/status/1505983212958457861,False,,0,,,,,,,,[],,,,
1505983211272351745,1505983211272351745,2022-03-21 16:02:32 -03,2022-03-21,16:02:32,-300,79174387,profdorinha,Professora Dorinha,,"O tempo de permanência nas escolas faz a diferença na vida das nossas crianças e jovens. Pensando nisso, consegui garantir o empenho de várias unidades de ensino integral no Tocantins.",pt,[],[],[],1,0,8,[],[],https://twitter.com/profdorinha/status/1505983211272351745,False,,0,,,,,,,,[],,,,
1504452168895668226,1504452166634905600,2022-03-17 10:38:43 -03,2022-03-17,10:38:43,-300,79174387,profdorinha,Professora Dorinha,,"A bancada feminina, no período em que estive como coordenadora, no biênio 2019-2021, abraçou e tornou possível a discussão e tipificação desse crime. A aprovação dessa proposta é muito importante para todas nós!",pt,[],[],[],0,0,6,[],[],https://twitter.com/profdorinha/status/1504452168895668226,False,,0,,,,,,,,[],,,,
1504452166634905600,1504452166634905600,2022-03-17 10:38:42 -03,2022-03-17,10:38:42,-300,79174387,profdorinha,Professora Dorinha,,"Aprovamos ontem o PL 5091/20, de minha relatoria. A proposta tipifica o crime de 'Violência Institucional' e pune o agente que submeter vítimas a procedimentos que as levem reviver situação de violência ou que gere sofrimento. Grande vitória no combate à violência contra mulher.",pt,[],[],[],3,0,7,[],[],https://twitter.com/profdorinha/status/1504452166634905600,False,,0,,,,,,,,[],,,,
1501268968199364612,1501268968199364612,2022-03-08 15:49:48 -03,2022-03-08,15:49:48,-300,79174387,profdorinha,Professora Dorinha,,"Hoje, Dia da Mulher, tive a honra de ser indicada à vice-liderança do @uniaobrasil44 na @camaradeputados. Conquista que vem em momento muito oportuno, neste 8 de março. Ser voz de mulheres e também do meu Tocantins me faz honrada e é o reconhecimento de toda luta travada até aqui",pt,"[{'screen_name': 'uniaobrasil44', 'name': 'união brasil 44', 'id': '1443282163818979336'}, {'screen_name': 'camaradeputados', 'name': 'câmara dos deputados', 'id': '61843152'}]",[],[],6,1,11,[],[],https://twitter.com/profdorinha/status/1501268968199364612,False,,0,,,,,,,,[],,,,
