id,conversation_id,created_at,date,time,timezone,user_id,username,name,place,tweet,language,mentions,urls,photos,replies_count,retweets_count,likes_count,hashtags,cashtags,link,retweet,quote_url,video,thumbnail,near,geo,source,user_rt_id,user_rt,retweet_id,reply_to,retweet_date,translate,trans_src,trans_dest
1339175913498562562,1339175913498562562,2020-12-16 08:49:53 -0300,2020-12-16,08:49:53,-300,79174387,profdorinha,Professora Dorinha,,Bom dia! #Fundeb   Acesse e confira:  https://t.co/NljnAqaYs6  https://t.co/kOeEqmun07,pt,[],['https://veja.abril.com.br/educacao/senado-aprova-com-alteracoes-regulamentacao-do-fundeb/'],['https://pbs.twimg.com/media/EpW1OWtWMAAlgNA.jpg'],11,0,17,['fundeb'],[],https://twitter.com/profdorinha/status/1339175913498562562,False,,1,https://pbs.twimg.com/media/EpW1OWtWMAAlgNA.jpg,,,,,,,[],,,,
1338919149649727489,1338896523988496384,2020-12-15 15:49:35 -0300,2020-12-15,15:49:35,-300,79174387,profdorinha,Professora Dorinha,,"@F_J_O_F Olá! Boa tarde! O texto original (PL4372/2020), que regulamenta o Fundeb é de autoria da deputada Professora Dorinha.",pt,[],[],[],1,0,0,[],[],https://twitter.com/profdorinha/status/1338919149649727489,False,,0,,,,,,,,"[{'screen_name': 'F_J_O_F', 'name': 'Jailson', 'id': '50318287'}]",,,,
1338918987720253442,1338896523988496384,2020-12-15 15:48:57 -0300,2020-12-15,15:48:57,-300,79174387,profdorinha,Professora Dorinha,,"@F_J_O_F Agora, no Senado Federal, estou trabalhando para que o texto original se mantenha. Vamos juntos pela Educação!",pt,[],[],[],0,0,0,[],[],https://twitter.com/profdorinha/status/1338918987720253442,False,,0,,,,,,,,"[{'screen_name': 'F_J_O_F', 'name': 'Jailson', 'id': '50318287'}]",,,,
1338918870858559488,1338896523988496384,2020-12-15 15:48:29 -0300,2020-12-15,15:48:29,-300,79174387,profdorinha,Professora Dorinha,,"@F_J_O_F O que ocorreu foi que houve uma negociação em Plenário, para que não fosse votada a emenda10, que inclui um leque maior de instituições privadas. Desta forma, a parlamentar destaca que o buscou-se deixar o texto o mais próximo do original.",pt,[],[],[],0,0,0,[],[],https://twitter.com/profdorinha/status/1338918870858559488,False,,0,,,,,,,,"[{'screen_name': 'F_J_O_F', 'name': 'Jailson', 'id': '50318287'}]",,,,
1338918792899031040,1338896523988496384,2020-12-15 15:48:10 -0300,2020-12-15,15:48:10,-300,79174387,profdorinha,Professora Dorinha,,"@F_J_O_F Ele abrange somente o ensino público, inclusive o Democratas, partido da parlamentar, orientou CONTRA a inclusão de até 10% para instituições filantrópicas e para o Sistema S, (emendas 10 e 40, respectivamente). Portanto, não é de caráter obrigatório.",pt,[],[],[],0,0,0,[],[],https://twitter.com/profdorinha/status/1338918792899031040,False,,0,,,,,,,,"[{'screen_name': 'F_J_O_F', 'name': 'Jailson', 'id': '50318287'}]",,,,
1338896523988496384,1338896523988496384,2020-12-15 14:19:41 -0300,2020-12-15,14:19:41,-300,79174387,profdorinha,Professora Dorinha,,"Fui designada relatora, nesta terça, 15, do Projeto de Lei Complementar (PLP) 135/2020, que libera recursos do Fundo Nacional de Desenvolvimento Científico e Tecnológico (FNDCT) em apoio à agenda da ciência, tecnologia e inovação (CT&amp;I) para o desenvolvimento do Brasil.  https://t.co/Jb6O5jjHtR",pt,[],[],['https://pbs.twimg.com/media/EpS3ScpXYAEniB-.jpg'],3,1,14,[],[],https://twitter.com/profdorinha/status/1338896523988496384,False,,1,https://pbs.twimg.com/media/EpS3ScpXYAEniB-.jpg,,,,,,,[],,,,
1338836857929478145,1338836857929478145,2020-12-15 10:22:35 -0300,2020-12-15,10:22:35,-300,79174387,profdorinha,Professora Dorinha,,Recursos: Garantir recursos para saúde é zelar pela vida de cada cidadão do nosso Tocantins. #Saúde,pt,[],[],[],0,0,7,['saúde'],[],https://twitter.com/profdorinha/status/1338836857929478145,False,,0,,,,,,,,[],,,,
1338836776723640322,1338836776723640322,2020-12-15 10:22:16 -0300,2020-12-15,10:22:16,-300,79174387,profdorinha,Professora Dorinha,,"R$ 302 milhões: esse montante foi usado para construção de Unidades Básicas de Saúde (UBSs); reformas de Unidades de Pronto Atendimento (UPAs); compra de medicamentos e insumos; pagamento de pessoal como médicos e enfermeiros, além de manutenção predial.",pt,[],[],[],0,0,7,[],[],https://twitter.com/profdorinha/status/1338836776723640322,False,,0,,,,,,,,[],,,,
1338836628559814659,1338836628559814659,2020-12-15 10:21:41 -0300,2020-12-15,10:21:41,-300,79174387,profdorinha,Professora Dorinha,,"Como deputada federal pelo Tocantins, empenhei para SAÚDE dos municípios tocantinenses mais de R$ 302 milhões.  https://t.co/nuUkwHylsN",pt,[],[],['https://pbs.twimg.com/media/EpSA0BNXEAASyEK.jpg'],0,0,7,[],[],https://twitter.com/profdorinha/status/1338836628559814659,False,,1,https://pbs.twimg.com/media/EpSA0BNXEAASyEK.jpg,,,,,,,[],,,,
1338497483123662850,1337182011782541315,2020-12-14 11:54:02 -0300,2020-12-14,11:54:02,-300,79174387,profdorinha,Professora Dorinha,,"@euleosant Agora, no Senado, a parlamentar trabalha para que o texto original se mantenha.",pt,[],[],[],0,0,0,[],[],https://twitter.com/profdorinha/status/1338497483123662850,False,,0,,,,,,,,"[{'screen_name': 'euleosant', 'name': 'Leo Santos', 'id': '819697643425239040'}]",,,,
1338497371282542592,1337182011782541315,2020-12-14 11:53:36 -0300,2020-12-14,11:53:36,-300,79174387,profdorinha,Professora Dorinha,,"@euleosant O que ocorreu foi que houve uma negociação em Plenário, para que não fosse votada a emenda10, que inclui um leque maior de instituições privadas. Desta forma, a parlamentar destaca que o buscou deixar o texto próximo do original.",pt,[],[],[],0,0,0,[],[],https://twitter.com/profdorinha/status/1338497371282542592,False,,0,,,,,,,,"[{'screen_name': 'euleosant', 'name': 'Leo Santos', 'id': '819697643425239040'}]",,,,
1338497078771802118,1337182011782541315,2020-12-14 11:52:26 -0300,2020-12-14,11:52:26,-300,79174387,profdorinha,Professora Dorinha,,"@euleosant Bom dia! O texto original (PL4372/2020), que regulamenta o Fundeb é de autoria da deputada Professora Dorinha. Ele abrange somente o ensino público, inclusive o Democratas, partido da parlamentar, orientou *CONTRA* a inclusão de até 10% p/ instituições filantrópicas e Sistema S.",pt,[],[],[],0,0,1,[],[],https://twitter.com/profdorinha/status/1338497078771802118,False,,0,,,,,,,,"[{'screen_name': 'euleosant', 'name': 'Leo Santos', 'id': '819697643425239040'}]",,,,
1338493056383930376,1338493056383930376,2020-12-14 11:36:27 -0300,2020-12-14,11:36:27,-300,79174387,profdorinha,Professora Dorinha,,Obra fruto de muito trabalho e empenho. Fico muito feliz em poder contribuir com o Tocantins e com Paraíso. Vamos juntos! #esporte   https://t.co/Dc2hUIuA9X,pt,[],['https://gazetadocerrado.com.br/com-emenda-da-deputada-professora-dorinha-complexo-poliesportivo-e-inaugurado-em-paraiso-do-tocantins/'],[],3,0,5,['esporte'],[],https://twitter.com/profdorinha/status/1338493056383930376,False,,0,,,,,,,,[],,,,
1337182011782541315,1337182011782541315,2020-12-10 20:46:49 -0300,2020-12-10,20:46:49,-300,79174387,profdorinha,Professora Dorinha,,Juntos pela Educação de qualidade! #Fundeb,pt,[],[],[],8,1,12,['fundeb'],[],https://twitter.com/profdorinha/status/1337182011782541315,False,https://twitter.com/democratas/status/1337159545114734594,0,,,,,,,,[],,,,
1337149412515209220,1337149412515209220,2020-12-10 18:37:17 -0300,2020-12-10,18:37:17,-300,79174387,profdorinha,Professora Dorinha,,#Fundeb,und,[],[],[],0,0,8,['fundeb'],[],https://twitter.com/profdorinha/status/1337149412515209220,False,https://twitter.com/DeputadosDEM/status/1337141493589487616,0,,,,,,,,[],,,,
1337088929527377925,1337088929527377925,2020-12-10 14:36:57 -0300,2020-12-10,14:36:57,-300,79174387,profdorinha,Professora Dorinha,,#BancadaFeminina Uma vitória para todas nós!,pt,[],[],[],0,1,2,['bancadafeminina'],[],https://twitter.com/profdorinha/status/1337088929527377925,False,https://twitter.com/DeputadosDEM/status/1337052067500789761,0,,,,,,,,[],,,,
1337088534621118465,1337088534621118465,2020-12-10 14:35:23 -0300,2020-12-10,14:35:23,-300,79174387,profdorinha,Professora Dorinha,,Por unanimidade foi aprovado! #ViolênciaInstitucional,pt,[],[],[],0,0,2,['violênciainstitucional'],[],https://twitter.com/profdorinha/status/1337088534621118465,False,https://twitter.com/ParlaTube/status/1337079909265666051,0,,,,,,,,[],,,,
1337088373878624259,1337088373878624259,2020-12-10 14:34:44 -0300,2020-12-10,14:34:44,-300,79174387,profdorinha,Professora Dorinha,,Obrigada @RodrigoCunhaAL Foi uma honra para mim como coordenadora da Bancada Feminina na Câmara.,pt,"[{'screen_name': 'rodrigocunhaal', 'name': 'rodrigo cunha', 'id': '37050975'}]",[],[],0,0,6,[],[],https://twitter.com/profdorinha/status/1337088373878624259,False,https://twitter.com/RodrigoCunhaAL/status/1337084154043895810,0,,,,,,,,[],,,,
1337087964606849026,1337087964606849026,2020-12-10 14:33:07 -0300,2020-12-10,14:33:07,-300,79174387,profdorinha,Professora Dorinha,,A partir de agora o projeto segue para apreciação do Senado Federal.  #violênciainstitucional #BancadaFeminina,pt,[],[],[],0,0,3,"['violênciainstitucional', 'bancadafeminina']",[],https://twitter.com/profdorinha/status/1337087964606849026,False,,0,,,,,,,,[],,,,
1337086156647837696,1337086156647837696,2020-12-10 14:25:56 -0300,2020-12-10,14:25:56,-300,79174387,profdorinha,Professora Dorinha,,"Foi aprovado, por unanimidade, pelo Plenário da Câmara dos Deputados, o meu relatório ao Projeto de Lei 5091/2020, que tipifica o crime de violência institucional. O texto altera a Lei nº 13.869, de 5 de setembro de 2019.  #BancadaFeminina",pt,[],[],[],1,0,6,['bancadafeminina'],[],https://twitter.com/profdorinha/status/1337086156647837696,False,,0,,,,,,,,[],,,,
1337085487635369988,1337085487635369988,2020-12-10 14:23:16 -0300,2020-12-10,14:23:16,-300,79174387,profdorinha,Professora Dorinha,,"Segundo as Nações Unidas, “o princípio da igualdade de gênero poderia não ter sido incluído se não fossem as mulheres, que defenderam uma Declaração que fosse verdadeiramente universal.” #DireitosHumanos",pt,[],[],[],0,0,3,['direitoshumanos'],[],https://twitter.com/profdorinha/status/1337085487635369988,False,,0,,,,,,,,[],,,,
1337084683058896897,1337084683058896897,2020-12-10 14:20:04 -0300,2020-12-10,14:20:04,-300,79174387,profdorinha,Professora Dorinha,,"Portanto, pela lei e tratados universais todos são iguais independente da raça, cor, gênero, idioma ou nacionalidade. #igualdade  #mulheres #direitoshumanos #declaraçãouniversal #bancadafeminina",pt,[],[],[],0,0,2,"['igualdade', 'mulheres', 'direitoshumanos', 'declaraçãouniversal', 'bancadafeminina']",[],https://twitter.com/profdorinha/status/1337084683058896897,False,,0,,,,,,,,[],,,,
1337084356783972357,1337084356783972357,2020-12-10 14:18:47 -0300,2020-12-10,14:18:47,-300,79174387,profdorinha,Professora Dorinha,,Hoje se comemora o 72º aniversário da Declaração Universal dos Direitos Humanos. O documento defende a igualdade e a liberdade para todos no mundo.  https://t.co/Vj587uBjme,pt,[],[],['https://pbs.twimg.com/media/Eo5HH-qXEAcOlqY.jpg'],0,0,2,[],[],https://twitter.com/profdorinha/status/1337084356783972357,False,,1,https://pbs.twimg.com/media/Eo5HH-qXEAcOlqY.jpg,,,,,,,[],,,,
1337049536439709696,1337049536439709696,2020-12-10 12:00:25 -0300,2020-12-10,12:00:25,-300,79174387,profdorinha,Professora Dorinha,,Projetos: Eles denominam que nomes de mulheres ilustrem espaços físicos da Câmara dos Deputados. Essas proposições que visam dar uma maior equidade de gênero e de igualdade de direito. #bancadafeminina #mulheres #equidade #garantias,pt,[],[],[],0,1,5,"['bancadafeminina', 'mulheres', 'equidade', 'garantias']",[],https://twitter.com/profdorinha/status/1337049536439709696,False,,0,,,,,,,,[],,,,
1337048986579046403,1337048986579046403,2020-12-10 11:58:14 -0300,2020-12-10,11:58:14,-300,79174387,profdorinha,Professora Dorinha,,"O Plenário da Câmara dos Deputados, aprovou e promulgou na manhã desta quinta-feira, 10 dezembro, os quatro Projetos de Resolução (PRCs) de autoria da deputada Professora Dorinha Seabra Rezende (DEM/TO), coordenadora da Bancada Feminina.  https://t.co/mPCsqcCLRf",pt,[],[],[],0,0,2,[],[],https://twitter.com/profdorinha/status/1337048986579046403,False,,1,https://pbs.twimg.com/ext_tw_video_thumb/1337048840713723908/pu/img/U-ov23ZSLSJFquIV.jpg,,,,,,,[],,,,
1337006264451207168,1337006264451207168,2020-12-10 09:08:28 -0300,2020-12-10,09:08:28,-300,79174387,profdorinha,Professora Dorinha,,Sinto-me lisonjeada de fazer parte deste time de mulheres na política. #BancadaFeminina   https://t.co/UIRas5Bnmb,pt,[],['https://www.metropoles.com/brasil/politica-brasil/mulheres-deputadas-foram-tres-vezes-mais-eficientes-que-parlamentares-homens-no-brasil'],[],1,2,7,['bancadafeminina'],[],https://twitter.com/profdorinha/status/1337006264451207168,False,,0,,,,,,,,[],,,,
1336811177175814146,1336811177175814146,2020-12-09 20:13:16 -0300,2020-12-09,20:13:16,-300,79174387,profdorinha,Professora Dorinha,,#BancadaFeminina,und,[],[],[],0,0,4,['bancadafeminina'],[],https://twitter.com/profdorinha/status/1336811177175814146,False,https://twitter.com/DeputadosDEM/status/1336810828276838401,0,,,,,,,,[],,,,
1336642846628175876,1336642846628175876,2020-12-09 09:04:22 -0300,2020-12-09,09:04:22,-300,79174387,profdorinha,Professora Dorinha,,"“Além dos números em plenário, 2020 foi revelador para os deputados federais, e foi quando a deputada Professora Dorinha foi indicada no ranking dos cabeças do Congresso. Foi  um ano consagrador de projeção nacional, principalmente em razão do #Fundeb”   https://t.co/lhOGUpR6Sf",pt,[],['https://gazetadocerrado.com.br/especial-gazeta-o-ano-dos-federais-tocantinenses-saiba-os-principais-indices-de-produtividade-de-cada-um/'],[],1,0,6,['fundeb'],[],https://twitter.com/profdorinha/status/1336642846628175876,False,,0,,,,,,,,[],,,,
1336428210746175491,1336428210746175491,2020-12-08 18:51:29 -0300,2020-12-08,18:51:29,-300,79174387,profdorinha,Professora Dorinha,,#FundebUrgente,und,[],[],[],1,1,17,['fundeburgente'],[],https://twitter.com/profdorinha/status/1336428210746175491,False,https://twitter.com/DeputadosDEM/status/1336427653797195776,0,,,,,,,,[],,,,
1336415075620499456,1336415075620499456,2020-12-08 17:59:18 -0300,2020-12-08,17:59:18,-300,79174387,profdorinha,Professora Dorinha,,Encerrada a votação. Aprovada a urgência com 414 votos favoráveis. #FundebUrgente,pt,[],[],[],7,8,72,['fundeburgente'],[],https://twitter.com/profdorinha/status/1336415075620499456,False,,0,,,,,,,,[],,,,
1336414510207410179,1336414510207410179,2020-12-08 17:57:03 -0300,2020-12-08,17:57:03,-300,79174387,profdorinha,Professora Dorinha,,Todos juntos pelo Fundeb! #Educação,es,[],[],[],1,0,10,['educação'],[],https://twitter.com/profdorinha/status/1336414510207410179,False,https://twitter.com/RAPS_Brasil/status/1336385050347261952,0,,,,,,,,[],,,,
1336410959821279233,1336410959821279233,2020-12-08 17:42:56 -0300,2020-12-08,17:42:56,-300,79174387,profdorinha,Professora Dorinha,,Foi aprovada a urgência para votação do projeto que regulamenta o Fundeb.,pt,[],[],[],1,2,37,[],[],https://twitter.com/profdorinha/status/1336410959821279233,False,,0,,,,,,,,[],,,,
1336410736046862338,1336410736046862338,2020-12-08 17:42:03 -0300,2020-12-08,17:42:03,-300,79174387,profdorinha,Professora Dorinha,,Neste momento estamos votando na Câmara dos Deputados a urgência para votação do projeto que regulamenta o Fundeb. Acompanhe ao vivo  https://t.co/kbDRKbAyNq,pt,[],['https://www.camara.leg.br/evento-legislativo/60185'],[],0,0,6,[],[],https://twitter.com/profdorinha/status/1336410736046862338,False,,0,,,,,,,,[],,,,
1336385284313919496,1336385284313919496,2020-12-08 16:00:55 -0300,2020-12-08,16:00:55,-300,79174387,profdorinha,Professora Dorinha,,"Para os cinco campi da Universidade Federal do Tocantins (UFT), em três mandatos, empenhei mais de R$ 150 milhões para construção de bibliotecas e refeitório; compra de equipamentos, entre outros. Fortalecer o ensino superior é uma das minhas prioridades como parlamentar.  https://t.co/k5hROixred",pt,[],[],"['https://pbs.twimg.com/media/EovLSDSXUAYXle4.jpg', 'https://pbs.twimg.com/media/EovLSDUXIAAmcfJ.jpg', 'https://pbs.twimg.com/media/EovLSDQW4AE3Qum.jpg', 'https://pbs.twimg.com/media/EovLSDQW8AcMDdY.jpg']",0,0,6,[],[],https://twitter.com/profdorinha/status/1336385284313919496,False,,1,https://pbs.twimg.com/media/EovLSDSXUAYXle4.jpg,,,,,,,[],,,,
1336304822044258306,1336304822044258306,2020-12-08 10:41:11 -0300,2020-12-08,10:41:11,-300,79174387,profdorinha,Professora Dorinha,,"Para o novo Fundeb temos hoje a apreciação e votação do requerimento de urgência. Passando a urgência, ele entra para votação. #Educação    https://t.co/VwIMPB0Lqy",pt,[],['https://valor.globo.com/brasil/noticia/2020/12/07/regulamentacao-do-novo-fundeb-sera-votada-ate-quarta-diz-relator.ghtml'],[],0,3,13,['educação'],[],https://twitter.com/profdorinha/status/1336304822044258306,False,,0,,,,,,,,[],,,,
1335958519359606785,1335958519359606785,2020-12-07 11:45:06 -0300,2020-12-07,11:45:06,-300,79174387,profdorinha,Professora Dorinha,,"Para a Educação Básica do Tocantins, em três mandatos, empenhei mais de R$ 225 milhões para construção de creches e escolas; mobiliário escolar, transporte escolar, entre outros. A educação das nossas crianças é uma prioridade. #deprofdorinha #empenho #recursos #educação  https://t.co/DUgJ34U1zR",pt,[],[],"['https://pbs.twimg.com/media/EopHL2DWEAAQ7Zc.jpg', 'https://pbs.twimg.com/media/EopHL2CXYAEzCGf.jpg', 'https://pbs.twimg.com/media/EopHL2CXEAQ63Ju.jpg', 'https://pbs.twimg.com/media/EopHL2CXEAIvb_6.jpg']",0,0,6,"['deprofdorinha', 'empenho', 'recursos', 'educação']",[],https://twitter.com/profdorinha/status/1335958519359606785,False,,1,https://pbs.twimg.com/media/EopHL2DWEAAQ7Zc.jpg,,,,,,,[],,,,
1335921050568306689,1335921050568306689,2020-12-07 09:16:13 -0300,2020-12-07,09:16:13,-300,79174387,profdorinha,Professora Dorinha,,"Bom dia! A todos uma boa semana! Hoje temos conferência sobre Educação, às 16h, com a presença do Ministro, Milton Ribeiro e outros importantes nomes. Iremos abordar dos “Desafios para garantir o direito à educação em tempos de e pós pandemia”. Vamos juntos! #depprofdorinha  https://t.co/8kI1F7fvHx",pt,[],[],['https://pbs.twimg.com/media/EoolG4AXMAEOi4L.jpg'],0,2,10,['depprofdorinha'],[],https://twitter.com/profdorinha/status/1335921050568306689,False,,1,https://pbs.twimg.com/media/EoolG4AXMAEOi4L.jpg,,,,,,,[],,,,
1334944175062716419,1334944175062716419,2020-12-04 16:34:28 -0300,2020-12-04,16:34:28,-300,79174387,profdorinha,Professora Dorinha,,"O novo Fundeb tem o desafio de garantir a qualidade e equidade educacional em nosso País. Precisamos votá-lo imediatamente, senão ficaremos sem recursos suficientes para a área em 2021.    https://t.co/DNCVZwbJQd",pt,[],['https://politica.estadao.com.br/blogs/fausto-macedo/a-educacao-nao-pode-esperar/'],[],2,1,24,[],[],https://twitter.com/profdorinha/status/1334944175062716419,False,,0,,,,,,,,[],,,,
1334580353915359233,1334580353915359233,2020-12-03 16:28:46 -0300,2020-12-03,16:28:46,-300,79174387,profdorinha,Professora Dorinha,,"Também fui coautora do PL 1291/2020, já foi aprovado e transformado na Lei 14022/2020, que trata sobre medidas de enfrentamento à violência das pessoas com deficiência durante a pandemia da Covid-19. #inclusão",pt,[],[],[],0,0,2,['inclusão'],[],https://twitter.com/profdorinha/status/1334580353915359233,False,,0,,,,,,,,[],,,,
1334580196700270592,1334580196700270592,2020-12-03 16:28:08 -0300,2020-12-03,16:28:08,-300,79174387,profdorinha,Professora Dorinha,,"Em defesa da dignidade, dos direitos e do bem estar dos deficientes, sou coautora do Projeto de Lei 3258/2015. O texto dispõe sobre a isenção do imposto sobre IPI, na aquisição de automóveis para utilização no transporte, bem como por pessoas portadoras de deficiência.",pt,[],[],[],1,1,6,[],[],https://twitter.com/profdorinha/status/1334580196700270592,False,,0,,,,,,,,[],,,,
1334579546851598340,1334579546851598340,2020-12-03 16:25:33 -0300,2020-12-03,16:25:33,-300,79174387,profdorinha,Professora Dorinha,,"Neste Dia Internacional das Pessoas com Deficiência destaco a relevância da inclusão delas em cada aspecto da vida política, social, econômica e cultural, como também da compreensão da sociedade a cerca dos assuntos concernentes à deficiência.  https://t.co/jwZccK1T2I",pt,[],[],['https://pbs.twimg.com/media/EoVhBJHWEAAzGul.jpg'],0,0,1,[],[],https://twitter.com/profdorinha/status/1334579546851598340,False,,1,https://pbs.twimg.com/media/EoVhBJHWEAAzGul.jpg,,,,,,,[],,,,
1334505310090911745,1334505310090911745,2020-12-03 11:30:34 -0300,2020-12-03,11:30:34,-300,79174387,profdorinha,Professora Dorinha,,"Nosso objetivo é fazer com que Justiça tome as medidas previstas no texto, por meio do acolhimento da vítima, isso porque as consequências físicas e psicológicas são muitas, principalmente no meio institucional. #AtuaçãoParlamentar #relatora",pt,[],[],[],0,0,2,"['atuaçãoparlamentar', 'relatora']",[],https://twitter.com/profdorinha/status/1334505310090911745,False,,0,,,,,,,,[],,,,
1334462791357505537,1334462791357505537,2020-12-03 08:41:37 -0300,2020-12-03,08:41:37,-300,79174387,profdorinha,Professora Dorinha,,#TBT A inclusão deles foi uma conquista da minha constante luta pela descentralização das oportunidades de acesso ao ensino superior no Tocantins. Vamos juntos pela #Educação #UFNT,pt,[],[],[],0,0,1,"['tbt', 'educação', 'ufnt']",[],https://twitter.com/profdorinha/status/1334462791357505537,False,,0,,,,,,,,[],,,,
1334462581906546691,1334462581906546691,2020-12-03 08:40:47 -0300,2020-12-03,08:40:47,-300,79174387,profdorinha,Professora Dorinha,,"#TBT Não posso deixar de lembrar do dia 09 de julho de 2019, quando foi criada a Universidade Federal do Norte do Tocantins (UFNT), por meio da Lei 13.856/2019. Como parlamentar pelo Tocantins, garanti, através de emenda, a criação de dois novos câmpus em Xambioá e Guaraí.  https://t.co/Cu7VfTpnWu",pt,[],[],['https://pbs.twimg.com/media/EoT2TrCXYAAavXN.jpg'],0,0,2,['tbt'],[],https://twitter.com/profdorinha/status/1334462581906546691,False,,1,https://pbs.twimg.com/media/EoT2TrCXYAAavXN.jpg,,,,,,,[],,,,
1334185457148686336,1334185457148686336,2020-12-02 14:19:35 -0300,2020-12-02,14:19:35,-300,79174387,profdorinha,Professora Dorinha,,Por mais mulheres na política! #BancadaFeminina,pt,[],[],[],0,0,8,['bancadafeminina'],[],https://twitter.com/profdorinha/status/1334185457148686336,False,https://twitter.com/DeputadosDEM/status/1334180532272304129,0,,,,,,,,[],,,,
1334105409498517505,1334105409498517505,2020-12-02 09:01:30 -0300,2020-12-02,09:01:30,-300,79174387,profdorinha,Professora Dorinha,,"A cota favorece a presença feminina também em outros cargos, de maneira que, começa a ter mulher no exercício do mandato, com condição de disputar uma prefeitura, por exemplo. #mulheresnapolítica",pt,[],[],[],0,0,5,['mulheresnapolítica'],[],https://twitter.com/profdorinha/status/1334105409498517505,False,,0,,,,,,,,[],,,,
1334105286081187841,1334105286081187841,2020-12-02 09:01:01 -0300,2020-12-02,09:01:01,-300,79174387,profdorinha,Professora Dorinha,,"Bancada Feminina: Se nós olharmos a representatividade do ponto de vista de população, é mais do que realista. Atualmente, 52,5% do eleitorado é composto por mulheres. #eleicões2020  https://t.co/O4ecyXTqyQ",pt,[],['https://www.poder360.com.br/eleicoes/cota-feminina-de-16-mudaria-o-resultado-da-eleicao-em-metade-do-brasil/'],[],0,1,3,['eleicões2020'],[],https://twitter.com/profdorinha/status/1334105286081187841,False,,0,,,,,,,,[],,,,
1333785538810155008,1333785538810155008,2020-12-01 11:50:27 -0300,2020-12-01,11:50:27,-300,79174387,profdorinha,Professora Dorinha,,"Em entrevista concedida à TV Câmara defendi, mais uma vez, o aperfeiçoamento da legislação para que tenhamos mais mulheres na Política. O objetivo da Bancada Feminina é ter o percentual inicial de 20% de reserva de cadeiras para o gênero. Assista ao vídeo! Televisão  https://t.co/naHtZ5P6uU",pt,[],[],[],0,0,3,[],[],https://twitter.com/profdorinha/status/1333785538810155008,False,,1,https://pbs.twimg.com/ext_tw_video_thumb/1333785353170210821/pu/img/Opv4SNHQ2AqplAhT.jpg,,,,,,,[],,,,
1333464434614865935,1333464434614865935,2020-11-30 14:34:30 -0300,2020-11-30,14:34:30,-300,79174387,profdorinha,Professora Dorinha,,"Conforme dados do Tribunal Superior Eleitoral (TSE), mais de 900 cidades do país não elegeram nenhuma vereadora nas eleições em 2020, ou seja, não haverá nenhuma mulher que ocupará vaga nas Câmaras Municipais a partir do dia 01 de janeiro de 2021. #mulheresnapolítica",pt,[],[],[],0,0,3,['mulheresnapolítica'],[],https://twitter.com/profdorinha/status/1333464434614865935,False,,0,,,,,,,,[],,,,
1333464215659683842,1333464215659683842,2020-11-30 14:33:38 -0300,2020-11-30,14:33:38,-300,79174387,profdorinha,Professora Dorinha,,"Apesar do número mínimo já ser cumprido na maioria das Capitais, é preciso avançar. Uma prova disso é que temos apenas uma mulher eleita prefeita de Capital em nosso País, a @CinthiaCRibeiro de Palmas (TO).",pt,"[{'screen_name': 'cinthiacribeiro', 'name': 'cinthia ribeiro', 'id': '175438359'}]",[],[],0,1,35,[],[],https://twitter.com/profdorinha/status/1333464215659683842,False,,0,,,,,,,,[],,,,
1333463880744529924,1333463880744529924,2020-11-30 14:32:18 -0300,2020-11-30,14:32:18,-300,79174387,profdorinha,Professora Dorinha,,"Nós defendemos o percentual de cotas graduais, que no final alcance no mínimo 33% de mulheres no Legislativo como consta na PEC 205/2007 do deputado Luiz Carlos Hauly (PSBD/PR), que está apensada na 134/2015.",pt,[],[],[],0,0,3,[],[],https://twitter.com/profdorinha/status/1333463880744529924,False,,0,,,,,,,,[],,,,
