id,conversation_id,created_at,date,time,timezone,user_id,username,name,place,tweet,language,mentions,urls,photos,replies_count,retweets_count,likes_count,hashtags,cashtags,link,retweet,quote_url,video,thumbnail,near,geo,source,user_rt_id,user_rt,retweet_id,reply_to,retweet_date,translate,trans_src,trans_dest
1293519713272770560,1293519713272770560,2020-08-12 09:08:26 -0300,2020-08-12,09:08:26,-300,79174387,profdorinha,Professora Dorinha,,Serviço   Webinar – Poder Legislativo e Desafios do Ensino Superior Pós-Pandemia  Data: 13/08/2020  Horário: 17:00 (horário de Brasília)  Transmissão: Canais da TV Senado e do Interlegis no Youtube / portal e-Cidadania  https://t.co/1Q4TQeS49k,pt,[],['https://www.instagram.com/p/CDyehcVFq4q/?igshid=s8socs3yjcm3'],[],0,1,3,[],[],https://twitter.com/profdorinha/status/1293519713272770560,False,,0,,,,,,,,[],,,,
1293267326515716096,1293267326515716096,2020-08-11 16:25:33 -0300,2020-08-11,16:25:33,-300,79174387,profdorinha,Professora Dorinha,,"Parabéns a todos os advogados. Sua função é essencial para o funcionamento do Estado Democrático de Direito, para o fortalecimento de uma sociedade justa e firmada nos princípios democráticos.  https://t.co/FWXarp8yyW",pt,[],['https://www.instagram.com/p/CDwrv_GFm0s/?igshid=j3jvvllvesqh'],[],0,0,7,[],[],https://twitter.com/profdorinha/status/1293267326515716096,False,,0,,,,,,,,[],,,,
1292837941887283202,1292837941887283202,2020-08-10 11:59:19 -0300,2020-08-10,11:59:19,-300,79174387,profdorinha,Professora Dorinha,,"No facebook da deputada professora Dorinha você acompanha mais uma live que vai esclarecer os principais pontos de transformação promovidos pelo NOVO FUNDEB. O encontro com os convidados da deputada federal, Alice…  https://t.co/g1eEWoIlyI",pt,[],['https://www.instagram.com/p/CDtofUeFvPM/?igshid=n67cf8fvb1w'],[],0,0,5,[],[],https://twitter.com/profdorinha/status/1292837941887283202,False,,0,,,,,,,,[],,,,
1292218643594522624,1292218643594522624,2020-08-08 18:58:27 -0300,2020-08-08,18:58:27,-300,79174387,profdorinha,Professora Dorinha,,Só a Educação pode desconstruir as heranças culturais que produzem esse tipo de comportamento. A deputada professora Dorinha  lamenta o episódio de constrangimento sofrido pelo motoboy Matheus Pires. Tais posturas…  https://t.co/OmOxZwG7vi,pt,[],['https://www.instagram.com/p/CDpO3JYFk58/?igshid=816if8hmx50e'],[],0,0,6,[],[],https://twitter.com/profdorinha/status/1292218643594522624,False,,0,,,,,,,,[],,,,
1292211205600350214,1292211205600350214,2020-08-08 18:28:54 -0300,2020-08-08,18:28:54,-300,79174387,profdorinha,Professora Dorinha,,"Atingimos a marca de 100 mil mortos pela Covid-19. É um verdadeiro placar de guerra. É angustiante perceber que nessa batalha contra o coronavírus perdermos tantas vidas.  No parlamento, votamos medidas de proteção…  https://t.co/DxJ7xnMICB",pt,[],['https://www.instagram.com/p/CDpLe_ZF9co/?igshid=1sxvpcvjyfs4m'],[],0,1,17,[],[],https://twitter.com/profdorinha/status/1292211205600350214,False,,0,,,,,,,,[],,,,
1291475137196326913,1291475137196326913,2020-08-06 17:44:01 -0300,2020-08-06,17:44:01,-300,79174387,profdorinha,Professora Dorinha,,"Povo do Líbano, a resiliência faz parte da sua história. Como humanidade, fomos todos afetados por essa tragédia que abalou famílias e desestabilizou a nação. Mas acreditamos e oramos pela construção de uma nova…  https://t.co/mATyq5N5YI",pt,[],['https://www.instagram.com/p/CDj8kttlQLL/?igshid=6wjrxg4n2us4'],[],0,0,3,[],[],https://twitter.com/profdorinha/status/1291475137196326913,False,,0,,,,,,,,[],,,,
1291440310162059264,1291440310162059264,2020-08-06 15:25:38 -0300,2020-08-06,15:25:38,-300,79174387,profdorinha,Professora Dorinha,,O trabalho burocrático muitas vezes não é visto. Mas é essencial para a organização e o bom funcionamento das escolas e creches. A deputada professora Dorinha parabeniza a todos os técnicos administrativos que atuam…  https://t.co/Grt8Y1RjL4,pt,[],['https://www.instagram.com/p/CDjs69tF5pd/?igshid=1nvwmu6v5wqjr'],[],0,0,6,[],[],https://twitter.com/profdorinha/status/1291440310162059264,False,,0,,,,,,,,[],,,,
1291440101835321347,1291440101835321347,2020-08-06 15:24:48 -0300,2020-08-06,15:24:48,-300,79174387,profdorinha,Professora Dorinha,,"Nas escolas, o bibliotecário é aquele que incentiva e monitora o processo de leitura dos alunos. Quanta vida, cor e graça estão contidas nas prateleiras das nossas bibliotecas ! Graças ao apoio desse profissional,…  https://t.co/UWpdE75VjU",pt,[],['https://www.instagram.com/p/CDjs020FZd4/?igshid=1o76b8fvu6dvy'],[],0,0,1,[],[],https://twitter.com/profdorinha/status/1291440101835321347,False,,0,,,,,,,,[],,,,
1291439891054841856,1291439891054841856,2020-08-06 15:23:58 -0300,2020-08-06,15:23:58,-300,79174387,profdorinha,Professora Dorinha,,"A Alimentação Escolar representa um dos alicerces do processo de aprendizagem. Através trabalho das merendeiras , são inseridos na rotina dos alunos  hábitos alimentares saudáveis que irão repercutir em uma melhora…  https://t.co/f6k1GNuWa1",pt,[],['https://www.instagram.com/p/CDjsuwHlGJv/?igshid=j3jdo5obm4oq'],[],0,0,2,[],[],https://twitter.com/profdorinha/status/1291439891054841856,False,,0,,,,,,,,[],,,,
1291439688553844740,1291439688553844740,2020-08-06 15:23:10 -0300,2020-08-06,15:23:10,-300,79174387,profdorinha,Professora Dorinha,,"De que forma seus professores marcaram sua vida ? Mais do que transmitir conhecimento, o professor é a peça chave de uma sociedade desenvolvida e fortalecida. A deputada professora Dorinha cumprimenta todos os…  https://t.co/7x5zy1Jkxh",pt,[],['https://www.instagram.com/p/CDjso3MFOU2/?igshid=wlbv663wygst'],[],0,0,1,[],[],https://twitter.com/profdorinha/status/1291439688553844740,False,,0,,,,,,,,[],,,,
1291439579527094274,1291439579527094274,2020-08-06 15:22:44 -0300,2020-08-06,15:22:44,-300,79174387,profdorinha,Professora Dorinha,,"A escola é um tipo de segunda casa. São diversas horas por dia que alunos, professores e demais servidores ficam por ali. Por isso, a limpeza desse ambiente é essencial para o rendimento escolar. Nesse dia 06 de…  https://t.co/sF11Bn3NmC",pt,[],['https://www.instagram.com/p/CDjslnHFJdP/?igshid=bkb310o3ults'],[],0,0,4,[],[],https://twitter.com/profdorinha/status/1291439579527094274,False,,0,,,,,,,,[],,,,
1291318612544954368,1291318612544954368,2020-08-06 07:22:03 -0300,2020-08-06,07:22:03,-300,79174387,profdorinha,Professora Dorinha,,"O país que reconhece a importância da Educação precisa, essencialmente, valorizar os profissionais que atendem crianças e jovens nas escolas. O profissional da Educação merece mais do que reverência, merece uma…  https://t.co/hlGW9nndQE",pt,[],['https://www.instagram.com/p/CDi1lIAlm-1/?igshid=1tiadwamd9s3b'],[],4,3,28,[],[],https://twitter.com/profdorinha/status/1291318612544954368,False,,0,,,,,,,,[],,,,
1291082589080629248,1291082589080629248,2020-08-05 15:44:11 -0300,2020-08-05,15:44:11,-300,79174387,profdorinha,Professora Dorinha,,A deputada professora Dorinha é a convidada do senador @sen_wellington  para uma live que vai debater o pacto entre Câmara e Senado pelo NOVO FUNDEB e trará esclarecimento sobre o assunto. Às 19h pelo horário de…  https://t.co/vdPRUFXYOr,pt,"[{'screen_name': 'sen_wellington', 'name': 'senador wellington fagundes', 'id': '71065638'}]",['https://www.instagram.com/p/CDhKPz6lWuo/?igshid=f53o56xhqbht'],[],0,0,13,[],[],https://twitter.com/profdorinha/status/1291082589080629248,False,,0,,,,,,,,[],,,,
1291028713656770560,1291028713656770560,2020-08-05 12:10:06 -0300,2020-08-05,12:10:06,-300,79174387,profdorinha,Professora Dorinha,,"O Projeto de Lei 3551/20 prevê repasse de R$ 2 bilhões para que escolas se preparem para retorno às aulas em meio à pandemia do novo coronavírus.  Pela proposta, o repasse virá do Programa Dinheiro Direto na Escola…  https://t.co/3SoLSJortA",pt,[],['https://www.instagram.com/p/CDgxv3XlawQ/?igshid=1mtj26ps4gekz'],[],0,0,4,[],[],https://twitter.com/profdorinha/status/1291028713656770560,False,,0,,,,,,,,[],,,,
1290781172897927169,1290781172897927169,2020-08-04 19:46:27 -0300,2020-08-04,19:46:27,-300,79174387,profdorinha,Professora Dorinha,,"“O Fundeb é fundamental para assegurar um futuro em que todas as meninas brasileiras possam ir à escola, não importa onde vivam"", afirmou Malala em entrevista exclusiva a BBC.  https://t.co/xMjUkcd4PB",pt,[],['https://www.instagram.com/p/CDfBLbGlBNB/?igshid=s54b413qr7y4'],[],2,11,104,[],[],https://twitter.com/profdorinha/status/1290781172897927169,False,,0,,,,,,,,[],,,,
1289917211763646464,1289917211763646464,2020-08-02 10:33:23 -0300,2020-08-02,10:33:23,-300,79174387,profdorinha,Professora Dorinha,,"Bom Domingo a todos, com uma super reportagem detalhando a luta da deputada professora Dorinha por mais recursos para a Educação Básica, através do Novo FUNDEB. Confira nos storys o link para acesso.  https://t.co/z1Tf3YsVWZ",pt,[],['https://www.instagram.com/p/CDY4S9uFTql/?igshid=10c0de2rt77za'],[],1,0,8,[],[],https://twitter.com/profdorinha/status/1289917211763646464,False,,0,,,,,,,,[],,,,
1289537593500024832,1289537593500024832,2020-08-01 09:24:55 -0300,2020-08-01,09:24:55,-300,79174387,profdorinha,Professora Dorinha,,"Arraias é cidade oriunda do ciclo do ouro. Esse sábado (1) marca 280 anos de história desse  município, que é terra de festas populares e danças, como vaquejada, sússia e a roda de São Gonçalo. Por lá também se…  https://t.co/l8N9bMgI2n",pt,[],['https://www.instagram.com/p/CDWLqnklZ4m/?igshid=vdoynudcawmf'],[],0,0,2,[],[],https://twitter.com/profdorinha/status/1289537593500024832,False,,0,,,,,,,,[],,,,
1289536933576630272,1289536933576630272,2020-08-01 09:22:18 -0300,2020-08-01,09:22:18,-300,79174387,profdorinha,Professora Dorinha,,"""Sua biografia durante esses 92 anos de serviço pelo Tocantins e pelo Brasil não traz nos capítulos dessa história  apenas a luta pela criação do nosso Estado, mas a autoria de fatos extraordinários que marcaram…  https://t.co/42l83mQdj0",pt,[],['https://www.instagram.com/p/CDWLXeYFhvv/?igshid=1gu6oduvrwclq'],[],0,0,3,[],[],https://twitter.com/profdorinha/status/1289536933576630272,False,,0,,,,,,,,[],,,,
1289283606649679874,1289283606649679874,2020-07-31 16:35:40 -0300,2020-07-31,16:35:40,-300,79174387,profdorinha,Professora Dorinha,,"Já está disponível o link do Webinário ""O Fundeb e a valorização do Profissional de Educação"". A deputada professora Dorinha é um dos grandes nomes confirmados para o debate. Às 19h, pelo…  https://t.co/BxfJx4Dws4",pt,[],['https://www.instagram.com/p/CDUYKrjlpJ9/?igshid=9h442w7ly00v'],[],0,0,14,[],[],https://twitter.com/profdorinha/status/1289283606649679874,False,,0,,,,,,,,[],,,,
1288857098122661889,1288857098122661889,2020-07-30 12:20:52 -0300,2020-07-30,12:20:52,-300,79174387,profdorinha,Professora Dorinha,,"*Abertura do curso Mulheres na Política:*""As pessoas falam que sou tranquila, que sou mansa... Não sou mansa não! Educação não quer dizer que eu não queira respeito"", afirmou a deputada professora DORINHA ao…  https://t.co/nMZ1wiKeEC",pt,[],['https://www.instagram.com/p/CDRWL0UFDie/?igshid=11w649x6fbkrz'],[],1,1,7,[],[],https://twitter.com/profdorinha/status/1288857098122661889,False,,0,,,,,,,,[],,,,
1288853803752726529,1288853803752726529,2020-07-30 12:07:47 -0300,2020-07-30,12:07:47,-300,79174387,profdorinha,Professora Dorinha,,"*Abertura do curso Mulheres na Política:*""As pessoas falam que sou tranquila, que sou mansa. Não sou mansa não. Educação não quer dizer que eu não queira respeito"", afirmou a deputada professora DORINHA ao refletir…  https://t.co/11B5VtwdvO",pt,[],['https://www.instagram.com/p/CDRUryRFHiO/?igshid=13nfvbs9aeagv'],[],0,0,3,[],[],https://twitter.com/profdorinha/status/1288853803752726529,False,,0,,,,,,,,[],,,,
1288792575688704001,1288792575688704001,2020-07-30 08:04:29 -0300,2020-07-30,08:04:29,-300,79174387,profdorinha,Professora Dorinha,,"Dedique um pouco do seu tempo para se inscrever neste evento e aprender mais sobre esse assunto tão importante. A deputada professora Dorinha fará sua contribuição como Secretária da Mulher na Câmara dos Deputados,…  https://t.co/6nAXXY5cHO",pt,[],['https://www.instagram.com/p/CDQ43u9FIJd/?igshid=8eey5u69nfi9'],[],0,2,9,[],[],https://twitter.com/profdorinha/status/1288792575688704001,False,,0,,,,,,,,[],,,,
1288597546575659009,1288597546575659009,2020-07-29 19:09:30 -0300,2020-07-29,19:09:30,-300,79174387,profdorinha,Professora Dorinha,,No dia 30/07(quinta-feira) temos um encontro marcado no I Seminário Virtual Conviva - Undime PB. Às 10h40 a deputada professora Dorinha fará sua contribuição.   O Link do evento está…  https://t.co/iQ5G7o92Np,pt,[],['https://www.instagram.com/p/CDPgLmYlrra/?igshid=13dn4j671csz8'],[],0,0,3,[],[],https://twitter.com/profdorinha/status/1288597546575659009,False,,0,,,,,,,,[],,,,
1288558603285258240,1288558603285258240,2020-07-29 16:34:45 -0300,2020-07-29,16:34:45,-300,79174387,profdorinha,Professora Dorinha,,"Ao participar da abertura oficial do curso Mulheres na Política promovido pelo Centro de Formação da Câmara dos Deputados, a deputada professora Dorinha deu seu recado sobre o respeito devido às mulheres nos espaços…  https://t.co/ZbAyBGc3QW",pt,[],['https://www.instagram.com/p/CDPOeOolaBQ/?igshid=9oc0sjfwan1e'],[],0,0,0,[],[],https://twitter.com/profdorinha/status/1288558603285258240,False,,0,,,,,,,,[],,,,
1288251157517946880,1288251157517946880,2020-07-28 20:13:05 -0300,2020-07-28,20:13:05,-300,79174387,profdorinha,Professora Dorinha,,"Amanhã (29), às 15h, participarei de uma conversa com o Senador Flávio Arns, relator da PEC do Novo Fundeb no Senado, e com o Luiz Miguel Martins Garcia, Presidente da Undime. Falaremos sobre a importância do…  https://t.co/JdVX9vZ6kj",pt,[],['https://www.instagram.com/p/CDNCqVoFNWW/?igshid=1mkehykbv30b2'],[],2,0,27,[],[],https://twitter.com/profdorinha/status/1288251157517946880,False,,0,,,,,,,,[],,,,
1288201532928794624,1288201532928794624,2020-07-28 16:55:53 -0300,2020-07-28,16:55:53,-300,79174387,profdorinha,Professora Dorinha,,"O facebook da deputada professora Dorinha transmitirá esse encontro com a deputada Clarissa  Garotinho para tratar do NOVO FUNDEB. É hoje (28), às 19h. Não perca:…  https://t.co/J8280NkQ2L",pt,[],['https://www.instagram.com/p/CDMsGIdFSNf/?igshid=cfzudiiuj22e'],[],0,0,8,[],[],https://twitter.com/profdorinha/status/1288201532928794624,False,,0,,,,,,,,[],,,,
1288166583148457984,1288166583148457984,2020-07-28 14:37:01 -0300,2020-07-28,14:37:01,-300,79174387,profdorinha,Professora Dorinha,,Mais de R$3 milhões já foram destinados pela Deputada Professora Dorinha para Araguacema.  O município figura entre as cidades mais antigas do Tocantins. Seu povoamento começou por volta de 1812.     O nome da…  https://t.co/Dc84chtPp5,pt,[],['https://www.instagram.com/p/CDMcM7XFDYT/?igshid=1fy1z57w60zf8'],[],0,0,3,[],[],https://twitter.com/profdorinha/status/1288166583148457984,False,,0,,,,,,,,[],,,,
1288165875036631040,1288165875036631040,2020-07-28 14:34:12 -0300,2020-07-28,14:34:12,-300,79174387,profdorinha,Professora Dorinha,,"São muitos anos de parceria pelo crescimento de Tocantinópolis!  A deputada professora Dorinha já investiu R$14.700.139,09  em recursos para o município.  Cidade histórica, marcada pela tradição indígena e pela…  https://t.co/rYHglT5B1l",pt,[],['https://www.instagram.com/p/CDMb4WblNSj/?igshid=1l45h6cqrz182'],[],0,0,1,[],[],https://twitter.com/profdorinha/status/1288165875036631040,False,,0,,,,,,,,[],,,,
1288160142035423233,1288160142035423233,2020-07-28 14:11:25 -0300,2020-07-28,14:11:25,-300,79174387,profdorinha,Professora Dorinha,,"*É daqui a pouco, com a participação da nossa Deputada professora DORINHA* *Lançamento do Curso Mulheres na Política* Acompanhe pelo canal da Câmara dos Deputados com YouTube. Vamos prestigiar e…  https://t.co/0HNYQSwVBQ",pt,[],['https://www.instagram.com/p/CDMZRbqlhT_/?igshid=8sblg6hbr2i7'],[],0,0,6,[],[],https://twitter.com/profdorinha/status/1288160142035423233,False,,0,,,,,,,,[],,,,
1288145809641365505,1288145809641365505,2020-07-28 13:14:28 -0300,2020-07-28,13:14:28,-300,79174387,profdorinha,Professora Dorinha,,"Curso Mulheres na Política  *Público-alvo:* mulheres já filiadas a partidos políticos, mas qualquer cidadã ou cidadão pode ter acesso. *Carga horária:* estimada em 8h, mas em um curso como esse, autoinstrucional e…  https://t.co/zgKhwntdhb",pt,[],['https://www.instagram.com/p/CDMSwYjlD3h/?igshid=1lbyrfw0ktp8m'],[],0,0,3,[],[],https://twitter.com/profdorinha/status/1288145809641365505,False,,0,,,,,,,,[],,,,
1287851531891433472,1287851531891433472,2020-07-27 17:45:06 -0300,2020-07-27,17:45:06,-300,79174387,profdorinha,Professora Dorinha,,"Quase R$10 milhões em emendas foram destinadas pela deputada federal Professora Dorinha (DEM-TO) à capital do Tocantins, Palmas, no primeiro semestre de 2020. Cidadania, Esporte, Saúde, Educação e Defesa da Mulher…  https://t.co/pu1uQWuetm",pt,[],['https://www.instagram.com/p/CDKM7wkFj8J/?igshid=1hml6t922tmgq'],[],0,2,8,[],[],https://twitter.com/profdorinha/status/1287851531891433472,False,,0,,,,,,,,[],,,,
1287510798974300160,1287510798974300160,2020-07-26 19:11:09 -0300,2020-07-26,19:11:09,-300,79174387,profdorinha,Professora Dorinha,,Abracem seus avós e aproveitem essa data que festeja esse amor tão singular.  https://t.co/NwNZNWlSwu,pt,[],['https://www.instagram.com/p/CDHx_F5FfnI/?igshid=1bqcrnwq5nnx9'],[],0,3,21,[],[],https://twitter.com/profdorinha/status/1287510798974300160,False,,0,,,,,,,,[],,,,
1287462312274796545,1287462312274796545,2020-07-26 15:58:29 -0300,2020-07-26,15:58:29,-300,79174387,profdorinha,Professora Dorinha,,"Hoje é dia de festejar a vida do vô e da vó, aqueles membros da família conhecidos por serem pais e mães duas vezes, ou quantas vezes forem necessárias. O relacionamento entre os avós e seus netos é feito de mimo,…  https://t.co/OPSiR9oi6f",pt,[],['https://www.instagram.com/p/CDHb79QlTki/?igshid=6lhwok6qle25'],[],0,0,7,[],[],https://twitter.com/profdorinha/status/1287462312274796545,False,,0,,,,,,,,[],,,,
1286664224454959109,1286664224454959109,2020-07-24 11:07:10 -0300,2020-07-24,11:07:10,-300,79174387,profdorinha,Professora Dorinha,,"Hoje, às 18h, pelo facebook da deputada professora mais uma live sobre FUNDEB.  Dessa vez, a conversa é com o Secretário da Educação do Estado de SP e Ex-Ministro da Educação, Rossieli Soares.  https://t.co/V7FVsson78",pt,[],['https://www.instagram.com/p/CDBxAhBlei-/?igshid=os7vgzg8cg18'],[],1,0,18,[],[],https://twitter.com/profdorinha/status/1286664224454959109,False,,0,,,,,,,,[],,,,
1286404547523391489,1286404547523391489,2020-07-23 17:55:19 -0300,2020-07-23,17:55:19,-300,79174387,profdorinha,Professora Dorinha,,Democratas é mais Brasil! democratas  https://t.co/JQKQIauzE6,pt,[],['https://www.instagram.com/p/CC_660zFfSb/?igshid=62qigvg1xowu'],[],0,0,8,[],[],https://twitter.com/profdorinha/status/1286404547523391489,False,,0,,,,,,,,[],,,,
1286353304616919040,1286353304616919040,2020-07-23 14:31:41 -0300,2020-07-23,14:31:41,-300,79174387,profdorinha,Professora Dorinha,,"A mobilização dos parlamentares da Frente Parlamentar Mista da Educação traz um novo futuro para o País, com mais recursos para a educação e uma nova realidade de distribuição destinada para as nossas crianças e…  https://t.co/DNM9Cn3zlO",pt,[],['https://www.instagram.com/p/CC_jnkFl_-5/?igshid=autiudkd47jh'],[],1,0,21,[],[],https://twitter.com/profdorinha/status/1286353304616919040,False,,0,,,,,,,,[],,,,
1286324708342935552,1286324708342935552,2020-07-23 12:38:03 -0300,2020-07-23,12:38:03,-300,79174387,profdorinha,Professora Dorinha,,@joeniawapichana  https://t.co/s8CBXMgPfq,und,[],['https://www.instagram.com/p/CC_WkYkFX_S/?igshid=jzr156jv82e4'],[],0,0,0,[],[],https://twitter.com/profdorinha/status/1286324708342935552,False,,0,,,,,,,,[],,,,
1286324109413097473,1286324109413097473,2020-07-23 12:35:41 -0300,2020-07-23,12:35:41,-300,79174387,profdorinha,Professora Dorinha,,O deputado @tuliogadelha também registrou o momento.  https://t.co/h1z1oKUD86,pt,"[{'screen_name': 'tuliogadelha', 'name': 'túlio gadêlha', 'id': '71456987'}]",['https://www.instagram.com/p/CC_WUHNFGw_/?igshid=1sgolbzj4plw6'],[],0,1,1,[],[],https://twitter.com/profdorinha/status/1286324109413097473,False,,0,,,,,,,,[],,,,
1286323697184387072,1286323697184387072,2020-07-23 12:34:02 -0300,2020-07-23,12:34:02,-300,79174387,profdorinha,Professora Dorinha,,"O Secretário da Educação de São Paulo e ex Ministro da Educação, @rossieli, comentou a aprovação do Novo FUNDEB diretamente do plenário Ulysses Guimarães.  https://t.co/7Kgrb3k3LH",pt,"[{'screen_name': 'rossieli', 'name': 'rossieli soares', 'id': '93752949'}]",['https://www.instagram.com/p/CC_WG9_lsV_/?igshid=hkp3jl140p1'],[],0,1,8,[],[],https://twitter.com/profdorinha/status/1286323697184387072,False,,0,,,,,,,,[],,,,
1286323470066909184,1286323470066909184,2020-07-23 12:33:08 -0300,2020-07-23,12:33:08,-300,79174387,profdorinha,Professora Dorinha,,@tabataamaralsp registrou sua emoção com a aprovação do Novo FUNDEB.  https://t.co/kr7vwMH7sK,pt,[],['https://www.instagram.com/p/CC_WBg7laLb/?igshid=1bf0gyi54wob1'],[],0,0,3,[],[],https://twitter.com/profdorinha/status/1286323470066909184,False,,0,,,,,,,,[],,,,
1286322990574186503,1286322990574186503,2020-07-23 12:31:14 -0300,2020-07-23,12:31:14,-300,79174387,profdorinha,Professora Dorinha,,A Deputada Federal paulabelmonteoficial também deixou se recado.  https://t.co/48KkkH64JK,pt,[],['https://www.instagram.com/p/CC_VzMXlYPV/?igshid=t5zos8ajmsk1'],[],0,0,0,[],[],https://twitter.com/profdorinha/status/1286322990574186503,False,,0,,,,,,,,[],,,,
1286322739058442241,1286322739058442241,2020-07-23 12:30:14 -0300,2020-07-23,12:30:14,-300,79174387,profdorinha,Professora Dorinha,,O Secretário da Educação de São Paulo e ex ministro da Educação comentou a aprovação do Novo FUNDEB diretamente do plenário Ulysses Guimarães.  https://t.co/3LktvBYKzc,pt,[],['https://www.instagram.com/p/CC_VrMJlSIJ/?igshid=1ifaccyt1ttwk'],[],0,0,5,[],[],https://twitter.com/profdorinha/status/1286322739058442241,False,,0,,,,,,,,[],,,,
1286082823166857217,1286082823166857217,2020-07-22 20:36:53 -0300,2020-07-22,20:36:53,-300,79174387,profdorinha,Professora Dorinha,,Acompanhe pelo nosso Instagram @profdorinha. Uma conversa proveitosa sobre FUNDEB com a ex- deputada federal Laura Carneiro.  https://t.co/UXYdQdwPSJ,pt,"[{'screen_name': 'profdorinha', 'name': 'professora dorinha', 'id': '79174387'}]",['https://www.instagram.com/p/CC9onlnF_K2/?igshid=1eghwwslkzjkf'],[],1,2,20,[],[],https://twitter.com/profdorinha/status/1286082823166857217,False,,0,,,,,,,,[],,,,
1285766008972742658,1285766008972742658,2020-07-21 23:37:59 -0300,2020-07-21,23:37:59,-300,79174387,profdorinha,Professora Dorinha,,"A Câmara dos Deputados aprovou nesta terça-feira (21), em dois turnos, a Proposta de Emenda à Constituição (PEC) 15/15, que torna permanente o Fundo de Desenvolvimento e Valorização dos Profissionais de Educação…  https://t.co/3DtQ5yZ5GQ",pt,[],['https://www.instagram.com/p/CC7YjDTlpIK/?igshid=1kr0cgnx0cj69'],[],53,42,439,[],[],https://twitter.com/profdorinha/status/1285766008972742658,False,,0,,,,,,,,[],,,,
1285730765540655106,1285730765540655106,2020-07-21 21:17:56 -0300,2020-07-21,21:17:56,-300,79174387,profdorinha,Professora Dorinha,,"O FUNDEB está aprovado em primeiro turno na Câmara dos Deputados, com um placar de 499 votos favoráveis. Seguimos para a apreciação dos destaques. #aprovaFundeb  https://t.co/xO1Ow2FJwM",pt,[],['https://www.instagram.com/p/CC7IhQblv5G/?igshid=1gryenkutd7vb'],[],37,48,525,['aprovafundeb'],[],https://twitter.com/profdorinha/status/1285730765540655106,False,,0,,,,,,,,[],,,,
1285704573953495041,1285704573953495041,2020-07-21 19:33:52 -0300,2020-07-21,19:33:52,-300,79174387,profdorinha,Professora Dorinha,,História sendo feita na sessão de votação do NOVO FUNDEB. Todos os partidos orientaram sim ao relatório da deputada professora Dorinha. @deputadosdem democratas  https://t.co/oj8FHsABZX,pt,"[{'screen_name': 'deputadosdem', 'name': 'deputados democratas', 'id': '253655900'}]",['https://www.instagram.com/p/CC68nG0lhNd/?igshid=s9mwhxz7o37a'],[],70,103,999,[],[],https://twitter.com/profdorinha/status/1285704573953495041,False,,0,,,,,,,,[],,,,
1285699125917487112,1285699125917487112,2020-07-21 19:12:13 -0300,2020-07-21,19:12:13,-300,79174387,profdorinha,Professora Dorinha,,"Deputada professora DORINHA lembra que o Tocantins nunca recebeu completação da União, mas que o Novo FUNDEB atende pontualmente a realidade das redes de ensino. #MudaBrasil #AprovaFundeb democratas @deputadosdem  https://t.co/KkRy1h3mom",pt,"[{'screen_name': 'deputadosdem', 'name': 'deputados democratas', 'id': '253655900'}]",['https://www.instagram.com/p/CC66FnNF79q/?igshid=kwaz5opwhkfp'],[],3,6,102,"['mudabrasil', 'aprovafundeb']",[],https://twitter.com/profdorinha/status/1285699125917487112,False,,0,,,,,,,,[],,,,
1285686064229777412,1285686064229777412,2020-07-21 18:20:19 -0300,2020-07-21,18:20:19,-300,79174387,profdorinha,Professora Dorinha,,"Boas notícias! A Complementação da União será de 23%, de acordo com o NOVO FUNDEB democratas  https://t.co/BeYGCyWuaa",pt,[],['https://www.instagram.com/p/CC60JbylMKR/?igshid=auqz17jwsnj1'],[],16,21,137,[],[],https://twitter.com/profdorinha/status/1285686064229777412,False,,0,,,,,,,,[],,,,
