id,conversation_id,created_at,date,time,timezone,user_id,username,name,place,tweet,language,mentions,urls,photos,replies_count,retweets_count,likes_count,hashtags,cashtags,link,retweet,quote_url,video,thumbnail,near,geo,source,user_rt_id,user_rt,retweet_id,reply_to,retweet_date,translate,trans_src,trans_dest
1318550788453564419,1318550788453564419,2020-10-20 10:53:00 -0300,2020-10-20,10:53:00,-300,71456987,tuliogadelha,Túlio Gadêlha,,Projeto de Bolsonaro quer retirar R$ 1 bi do orçamento da educação para destinar a obras de infraestrutura. Proposta do Executivo já chegou no Congresso e nós já apresentamos quatro emendas para barrar estes cortes. Não vamos aceitar nem um real a menos para a educação.,pt,[],[],[],20,40,522,[],[],https://twitter.com/tuliogadelha/status/1318550788453564419,False,,0,,,,,,,,[],,,,
1318345618213974016,1318345618213974016,2020-10-19 21:17:43 -0300,2020-10-19,21:17:43,-300,71456987,tuliogadelha,Túlio Gadêlha,,"Bolívia, 2019. Uma cena de puro fascismo: Patricia Arce, prefeita de Vinto, covardemente atacada por membros da extrema direita, foi pintada de rosa e teve os cabelos cortados. Hoje, Patricia foi eleita senadora, o MAS elegeu o governo e a maioria nas duas casas legislativas.  https://t.co/gHQCsDjgNj",pt,[],[],['https://pbs.twimg.com/media/Eku0WPwXEAA8JI-.jpg'],14,70,1045,[],[],https://twitter.com/tuliogadelha/status/1318345618213974016,False,,1,https://pbs.twimg.com/media/Eku0WPwXEAA8JI-.jpg,,,,,,,[],,,,
1318267235350269953,1318267235350269953,2020-10-19 16:06:15 -0300,2020-10-19,16:06:15,-300,71456987,tuliogadelha,Túlio Gadêlha,,"É público que o governo omitiu envio de agentes da Abin à COP25 em 2019. Queremos saber, agora, motivo deles terem sido mandados à Cúpula do Clima? Será mais uma ação autoritária de Bolsonaro com os contrários à sua gestão? Requeremos informação e eles têm 30 dias para responder.",pt,[],[],[],10,8,262,[],[],https://twitter.com/tuliogadelha/status/1318267235350269953,False,,0,,,,,,,,[],,,,
1316759776412475392,1316759776412475392,2020-10-15 12:16:09 -0300,2020-10-15,12:16:09,-300,71456987,tuliogadelha,Túlio Gadêlha,,Alô galera de Curitiba! Já conhecem o Dalton? Ele é um grande quadro que tenho o privilégio de caminhar lado a lado. Vale a pena seguir! Tamo junto Dalton 👊🌹#DaltonBorba12012,pt,[],[],[],6,14,72,['daltonborba12012'],[],https://twitter.com/tuliogadelha/status/1316759776412475392,False,https://twitter.com/DaltonBorba/status/1316529097091186689,0,,,,,,,,[],,,,
1316747898550472706,1316747898550472706,2020-10-15 11:28:57 -0300,2020-10-15,11:28:57,-300,71456987,tuliogadelha,Túlio Gadêlha,,"Valorizar, defender e reconhecer a importância do professor é dever de todos nós cidadãos brasileiros. Como parlamentar, dignificar o exercício da profissão é nossa missão. Feliz dia, professor e professora! #diadoprofessor",pt,[],[],[],1,15,216,['diadoprofessor'],[],https://twitter.com/tuliogadelha/status/1316747898550472706,False,,0,,,,,,,,[],,,,
1316496424117338112,1316496424117338112,2020-10-14 18:49:41 -0300,2020-10-14,18:49:41,-300,71456987,tuliogadelha,Túlio Gadêlha,,Vamos caminhar juntos por uma Curitiba para todas as pessoas! #AgoraÉGoura #OndaGoura #AgoraÉ12,pt,[],[],[],2,3,47,"['agoraégoura', 'ondagoura', 'agoraé12']",[],https://twitter.com/tuliogadelha/status/1316496424117338112,False,https://twitter.com/goura_nataraj/status/1316494888259727362,0,,,,,,,,[],,,,
1316488345103593473,1316488345103593473,2020-10-14 18:17:35 -0300,2020-10-14,18:17:35,-300,71456987,tuliogadelha,Túlio Gadêlha,,"Após meses de mobilizações, vitória da pressão popular! O reitor eleito @eztourinho foi reconduzido na UFPA. Bolsonaro recuou graças a pressão e articulação de toda a comunidade acadêmica no Pará. #ReitorEleitoReitorEmpossado",pt,"[{'screen_name': 'eztourinho', 'name': 'emmanuel tourinho', 'id': '4907162793'}]",[],[],1,7,86,['reitoreleitoreitorempossado'],[],https://twitter.com/tuliogadelha/status/1316488345103593473,False,,0,,,,,,,,[],,,,
1316483489978613761,1316483489978613761,2020-10-14 17:58:17 -0300,2020-10-14,17:58:17,-300,71456987,tuliogadelha,Túlio Gadêlha,,"Quando mais precisamos de ônibus nas ruas em razão da pandemia, as empresas de transporte no Recife demitem cobradores, extinguem linhas e impõem dupla função aos motoristas. Os protestos são legítimos. É urgente cuidar da saúde desses trabalhadores que estão na linha de frente.",pt,[],[],[],4,1,77,[],[],https://twitter.com/tuliogadelha/status/1316483489978613761,False,https://twitter.com/folhape/status/1316448898165215232,0,,,,,,,,[],,,,
1316468883079991299,1316468883079991299,2020-10-14 17:00:15 -0300,2020-10-14,17:00:15,-300,71456987,tuliogadelha,Túlio Gadêlha,,"Hoje tem debate em Curitiba, acompanhem @goura_nataraj 22h30 na Band! #Goura12NaBand   https://t.co/IUjrj40KJf",pt,"[{'screen_name': 'goura_nataraj', 'name': 'goura', 'id': '821001145359409152'}]",['http://gazetadopovo.com.br/parana/breves/eleicoes-2020-segunda-rodada-de-debates-na-tv-reune-oito-candidatos-em-curitiba/'],[],5,22,144,['goura12naband'],[],https://twitter.com/tuliogadelha/status/1316468883079991299,False,,0,,,,,,,,[],,,,
1316467508518490112,1316467508518490112,2020-10-14 16:54:47 -0300,2020-10-14,16:54:47,-300,71456987,tuliogadelha,Túlio Gadêlha,,"Uma mulher de fibra e de uma biografia admirável, a ex ministra do Meio Ambiente @MarinaSilva ainda é vítima de um governo q nega o racismo e age para invisibilizar sua história. Sinta meu abraço solidário e a certeza q estamos juntos na luta por um país mais justo e igualitário.",pt,"[{'screen_name': 'marinasilva', 'name': 'marina silva', 'id': '105155795'}]",[],[],3,15,283,[],[],https://twitter.com/tuliogadelha/status/1316467508518490112,False,https://twitter.com/luisnassif/status/1316403225478811649,0,,,,,,,,[],,,,
1316421887145267203,1316421887145267203,2020-10-14 13:53:30 -0300,2020-10-14,13:53:30,-300,71456987,tuliogadelha,Túlio Gadêlha,,"Apresentamos, junto à deputada @dasilvabenedita e outros parlamentares, requerimento que pede explicação do governo sobre garantia da execução da lei Aldir Blanc. Auxílio de R$ 600 para socorrer profissionais da cultura afetados pela pandemia precisa ser cumprido até o fim.",pt,"[{'screen_name': 'dasilvabenedita', 'name': 'benedita da silva', 'id': '75060031'}]",[],[],1,3,97,[],[],https://twitter.com/tuliogadelha/status/1316421887145267203,False,,0,,,,,,,,[],,,,
1314261868731662339,1314261868731662339,2020-10-08 14:50:21 -0300,2020-10-08,14:50:21,-300,71456987,tuliogadelha,Túlio Gadêlha,,"O Nordeste vai além desse estereótipo da casa de taipa, da rapadura e do chapéu de couro. Nossa terra também tem sustentabilidade, desenvolvimento, tecnologia, ciência, gente acolhedora e inovação. Aqui temos o futuro. #DiaDoNordestino  https://t.co/idf0ZPXVjJ",pt,[],[],['https://pbs.twimg.com/media/Ej0yLrEXsAsw111.jpg'],16,33,550,['diadonordestino'],[],https://twitter.com/tuliogadelha/status/1314261868731662339,False,,1,https://pbs.twimg.com/media/Ej0yLrEXsAsw111.jpg,,,,,,,[],,,,
1314204068554788866,1314204068554788866,2020-10-08 11:00:41 -0300,2020-10-08,11:00:41,-300,71456987,tuliogadelha,Túlio Gadêlha,,"Antidemocrático, Bolsonaro tem legitimado reitores não eleitos pela comunidade acadêmica das universidades federais. As nomeações, que seguem processo de votação, estão sendo burladas por ele, que quer manter no cargo apoiadores do seu governo. #ReitorEleitoReitorEmpossado",pt,[],[],[],37,80,586,['reitoreleitoreitorempossado'],[],https://twitter.com/tuliogadelha/status/1314204068554788866,False,,0,,,,,,,,[],,,,
1314202102982414336,1314202101426188292,2020-10-08 10:52:52 -0300,2020-10-08,10:52:52,-300,71456987,tuliogadelha,Túlio Gadêlha,,"Na Câmara, continuamos empenhados na condução da Frente Parlamentar Mista de Combate ao Trabalho Infantil e de Estímulo à Aprendizagem. Em um país tão desigual, essa realidade acaba sendo silenciada e naturalizada. Nossa missão é fiscalizar e combater. #NaoaoTrabalhoInfantil",pt,[],[],[],1,4,30,['naoaotrabalhoinfantil'],[],https://twitter.com/tuliogadelha/status/1314202102982414336,False,,0,,,,,,,,[],,,,
1314202101426188292,1314202101426188292,2020-10-08 10:52:52 -0300,2020-10-08,10:52:52,-300,71456987,tuliogadelha,Túlio Gadêlha,,"Nesta quinta, ao invés das ruas, a 8ª Marcha Pernambuco Contra o Trabalho Infantil acontecerá pelas redes sociais do Fórum Estadual de Prevenção e Erradicação do Trabalho Infantil em PE (Fepetipe). É nossa responsabilidade proteger nossas crianças e sensibilizar a sociedade.",pt,[],[],[],1,6,63,[],[],https://twitter.com/tuliogadelha/status/1314202101426188292,False,,0,,,,,,,,[],,,,
1313968167979560961,1313968166704381953,2020-10-07 19:23:18 -0300,2020-10-07,19:23:18,-300,71456987,tuliogadelha,Túlio Gadêlha,,"Buscamos garantir o controle social sobre a presença das autoridades civis e militares nas aldeias, propondo que órgãos públicos fossem aos locais apropriados para receber denúncias. Há receio de que a MP possa significar militarização da área. Eles erram e a gente corrige.",pt,[],[],[],2,0,26,[],[],https://twitter.com/tuliogadelha/status/1313968167979560961,False,,0,,,,,,,,[],,,,
1313968166704381953,1313968166704381953,2020-10-07 19:23:17 -0300,2020-10-07,19:23:17,-300,71456987,tuliogadelha,Túlio Gadêlha,,"Em resposta às lacunas no Plano de Barreiras Sanitárias feito pelo governo Bolsonaro, apresentei emendas que introduzem medidas de contenção da disseminação da Covid19 nas aldeias indígenas e assistência aos infectados. A MP só impedia entrada e saída de pessoas dos territórios.",pt,[],[],[],2,4,80,[],[],https://twitter.com/tuliogadelha/status/1313968166704381953,False,,0,,,,,,,,[],,,,
1313964499821645825,1313964499821645825,2020-10-07 19:08:43 -0300,2020-10-07,19:08:43,-300,71456987,tuliogadelha,Túlio Gadêlha,,"A dois dias do #NobelDaPaz2020, o Cacique Raoni concorre à premiação. Um símbolo de #resistência e de #luta, seu ativismo pela preservação dos povos indígenas e da Amazônia deve ecoar em cada canto da nossa Mãe Terra e ser perpetuado através deste prêmio. #RaoniNobelDaPaz2020",pt,[],[],[],4,30,304,"['nobeldapaz2020', 'resistência', 'luta', 'raoninobeldapaz2020']",[],https://twitter.com/tuliogadelha/status/1313964499821645825,False,,0,,,,,,,,[],,,,
1313534417588170762,1313534417588170762,2020-10-06 14:39:44 -0300,2020-10-06,14:39:44,-300,71456987,tuliogadelha,Túlio Gadêlha,,"Apresentei junto com colegas deputados Projeto de Decreto Legislativo para anular decisões insanas do CONAMA, lideradas pelo ministro do Meio Ambiente, Ricardo Salles. A lógica de “passar a boiada” do ministro não terá rumo na Câmara. Vamos pressionar.  https://t.co/0FwU0yLh2i",pt,[],['https://veja.abril.com.br/blog/radar/deputado-apresentam-proposta-para-derrubar-revogaco-do-conama/'],[],2,13,146,[],[],https://twitter.com/tuliogadelha/status/1313534417588170762,False,,0,,,,,,,,[],,,,
1313167041218654208,1313167041218654208,2020-10-05 14:19:54 -0300,2020-10-05,14:19:54,-300,71456987,tuliogadelha,Túlio Gadêlha,,"Governo Bolsonaro estuda eliminar a declaração simplificada do IR com desconto padrão de 20%. Mais uma medida que atinge em cheio a classe trabalhadora, que não pode ter filho em escola particular ou plano de saúde para deduzir. Um presidente que só governa para ricos.",pt,[],[],[],27,138,1434,[],[],https://twitter.com/tuliogadelha/status/1313167041218654208,False,,0,,,,,,,,[],,,,
1311688079355281410,1311688079355281410,2020-10-01 12:23:02 -0300,2020-10-01,12:23:02,-300,71456987,tuliogadelha,Túlio Gadêlha,,"Bolsonaro impediu em março - auge da pandemia da Covid-19 - a compra de 100 mil testes rápidos da doença. Ele simplesmente desviou R$ 7,5 mi doados por uma empresa para este fim, repassando a verba para o programa da primeira-dama. Um claro desrespeito à vida do brasileiro.",pt,[],[],[],26,53,489,[],[],https://twitter.com/tuliogadelha/status/1311688079355281410,False,https://twitter.com/UOLNoticias/status/1311611997369372672,0,,,,,,,,[],,,,
1311076543641399298,1311076543641399298,2020-09-29 19:53:01 -0300,2020-09-29,19:53:01,-300,71456987,tuliogadelha,Túlio Gadêlha,,"Vitória do bom senso. Enxergando evidente risco de danos irrecuperáveis ao meio ambiente, juíza da 23ª Vara Federal Criminal do Rio suspendeu decisão do Conama que tirou proteção de manguezais e restingas.  https://t.co/QoUNvZ1bzI",pt,[],['https://g1.globo.com/rj/rio-de-janeiro/noticia/2020/09/29/justica-federal-do-rj-suspende-decisao-do-conama-que-tirou-protecao-de-manguezais-e-restingas.ghtml'],[],6,24,310,[],[],https://twitter.com/tuliogadelha/status/1311076543641399298,False,,0,,,,,,,,[],,,,
1311028626888982529,1311028626888982529,2020-09-29 16:42:37 -0300,2020-09-29,16:42:37,-300,71456987,tuliogadelha,Túlio Gadêlha,,"A procuradoria do Superior Tribunal de Justiça Desportiva (STJD) denunciou a jogadora Carol Solberg por gritar ""Fora Bolsonaro"" após ganhar a medalha de bronze na etapa de Saquarema. A perseguição aos que pensam diferente está clara. Toda solidariedade a Carol Solberg.",pt,[],[],[],15,50,744,[],[],https://twitter.com/tuliogadelha/status/1311028626888982529,False,,0,,,,,,,,[],,,,
1310970826255142915,1310970826255142915,2020-09-29 12:52:56 -0300,2020-09-29,12:52:56,-300,71456987,tuliogadelha,Túlio Gadêlha,,#CiroNoPanico no segundo lugar dos assuntos mais discutidos no Twitter. Bora nessa turma boa!? Rumo ao topo! Estou acompanhando aqui do Recife,pt,[],[],[],44,93,861,['cironopanico'],[],https://twitter.com/tuliogadelha/status/1310970826255142915,False,,0,,,,,,,,[],,,,
1310965645828390919,1310965645828390919,2020-09-29 12:32:21 -0300,2020-09-29,12:32:21,-300,71456987,tuliogadelha,Túlio Gadêlha,,Nova presepada de Bolsonaro: tentar desviar dinheiro do Fundeb pra bancar o seu programa Renda Cidadã. Querem usar os recursos q servem pra pagamento de professores e melhoria de condições de ensino pra driblar o teto de gastos. Pq não revogar o teto ou taxar grandes fortunas?,pt,[],[],[],26,85,821,[],[],https://twitter.com/tuliogadelha/status/1310965645828390919,False,,0,,,,,,,,[],,,,
1310630012668833793,1310630009938337799,2020-09-28 14:18:40 -0300,2020-09-28,14:18:40,-300,71456987,tuliogadelha,Túlio Gadêlha,,"Vale lembrar que em 2019 Salles desfigurou o conselho, diminuindo de 96 para 23 os participantes. A maioria dos votos hoje foi dada pelo próprio governo. A boiada anunciada, continua passando. #ForaSalles  #ForaBolsonaro",pt,[],[],[],3,9,139,"['forasalles', 'forabolsonaro']",[],https://twitter.com/tuliogadelha/status/1310630012668833793,False,,0,,,,,,,,[],,,,
1310630011314069504,1310630009938337799,2020-09-28 14:18:39 -0300,2020-09-28,14:18:39,-300,71456987,tuliogadelha,Túlio Gadêlha,,"O ministro Ricardo Salles privilegia a especulação imobiliária no litoral brasileiro, em detrimento de 1,6 milhão de hectares de áreas de proteção permanente, entre restingas e manguezais.",pt,[],[],[],4,14,132,[],[],https://twitter.com/tuliogadelha/status/1310630011314069504,False,,0,,,,,,,,[],,,,
1310630009938337799,1310630009938337799,2020-09-28 14:18:39 -0300,2020-09-28,14:18:39,-300,71456987,tuliogadelha,Túlio Gadêlha,,"Na pauta do CONAMA: nada das queimadas ou desmatamento que castigam o país, mas sim a revogação de normas ambientais protetivas. A resolução 303, que prevê a proteção de uma faixa mínima de 300 metros de restingas e dos manguezais, foi revogada hoje.",pt,[],[],[],15,40,406,[],[],https://twitter.com/tuliogadelha/status/1310630009938337799,False,,0,,,,,,,,[],,,,
1310018992782876673,1310018990828408832,2020-09-26 21:50:41 -0300,2020-09-26,21:50:41,-300,71456987,tuliogadelha,Túlio Gadêlha,,"A nossa emenda contribuirá para o avanço da pesquisa, desenvolvendo o projeto de ""pele artificial"" a partir da tilápia. Investir em ciência e tecnologia é cuidar de forma inteligente no tratamento a vítimas de queimaduras de terceiro grau e acidentes de trânsito.",pt,[],[],[],1,3,76,[],[],https://twitter.com/tuliogadelha/status/1310018992782876673,False,,0,,,,,,,,[],,,,
1310018990828408832,1310018990828408832,2020-09-26 21:50:41 -0300,2020-09-26,21:50:41,-300,71456987,tuliogadelha,Túlio Gadêlha,,"Pioneirismo de PE, a pesquisa com pele de tilápia para o tratamento de queimaduras venceu o Prêmio Euro Inovação em Saúde. Em 2019, apresentamos emenda parlamentar para fomentar o projeto. R$ 1,8 mi já está autorizado. Parabéns a turma de pesquisadores e ao prof Marcelo Borges.  https://t.co/vABtnlKulx",pt,[],[],['https://pbs.twimg.com/media/Ei4db1BXkAErztN.jpg'],13,19,436,[],[],https://twitter.com/tuliogadelha/status/1310018990828408832,False,,1,https://pbs.twimg.com/media/Ei4db1BXkAErztN.jpg,,,,,,,[],,,,
1309258832070217728,1309258832070217728,2020-09-24 19:30:05 -0300,2020-09-24,19:30:05,-300,71456987,tuliogadelha,Túlio Gadêlha,,A reforma de Paulo Guedes acaba com direitos trabalhistas dos servidores públicos e dá mais poderes ao presidente da República para extinguir órgãos e ministérios sem a necessidade de aprovação do Congresso Nacional. Um desrespeito com todos os brasileiros. #DesmontedoEstado,pt,[],[],[],187,529,1539,['desmontedoestado'],[],https://twitter.com/tuliogadelha/status/1309258832070217728,False,,0,,,,,,,,[],,,,
1309255151828570112,1309255151828570112,2020-09-24 19:15:27 -0300,2020-09-24,19:15:27,-300,71456987,tuliogadelha,Túlio Gadêlha,,"A Reforma Administrativa, além de desvalorizar o servidor público, põe em risco a continuidade dos serviços gratuitos à população. Um desserviço duplo. #DesmontedoEstado",pt,[],[],[],61,341,865,['desmontedoestado'],[],https://twitter.com/tuliogadelha/status/1309255151828570112,False,,0,,,,,,,,[],,,,
1309254116103815170,1309254116103815170,2020-09-24 19:11:20 -0300,2020-09-24,19:11:20,-300,71456987,tuliogadelha,Túlio Gadêlha,,Com a reforma administrativa serviços públicos gratuitos passam a ser cobrados. Não a reforma administrativa! #DesmontedoEstado,pt,[],[],[],46,270,1341,['desmontedoestado'],[],https://twitter.com/tuliogadelha/status/1309254116103815170,False,,0,,,,,,,,[],,,,
1309209061100052480,1309209061100052480,2020-09-24 16:12:18 -0300,2020-09-24,16:12:18,-300,71456987,tuliogadelha,Túlio Gadêlha,,"Um ministro da Educação homofóbico, que atribui a homossexualidade a “famílias desajustadas”. Um ataque preconceituoso, sem fundamento, que não podemos tolerar. Homofobia é crime. A conduta passou a ser punida pela lei do racismo, seguindo a determinação do STF.",pt,[],[],[],18,79,1113,[],[],https://twitter.com/tuliogadelha/status/1309209061100052480,False,,0,,,,,,,,[],,,,
1308788863666708484,1308788863666708484,2020-09-23 12:22:35 -0300,2020-09-23,12:22:35,-300,71456987,tuliogadelha,Túlio Gadêlha,,"Enquanto Bolsonaro culpa, de forma mentirosa, os índios pelas queimadas na Amazônia e no Pantanal, criamos a comissão externa da Câmara para acompanhar e promover estratégias de enfrentamento aos incêndios q vêm devastando os biomas. Essa é a nossa missão  https://t.co/i4C3ZA9CeU",pt,[],['http://cd.leg.br/acqxLv'],[],9,12,144,[],[],https://twitter.com/tuliogadelha/status/1308788863666708484,False,,0,,,,,,,,[],,,,
1308779577653723137,1308779576043229192,2020-09-23 11:45:41 -0300,2020-09-23,11:45:41,-300,71456987,tuliogadelha,Túlio Gadêlha,,"Agora, teremos a tarefa de derrubar mais um veto anti-trabalhador e anti-Educação. Nosso mandato ta comprometido com a luta dos professores e vamos trabalhar p garantir a vigência da futura Lei, especialmente em relação ao artigo 8º - a qual trata da subvinculação p o magistério.",pt,[],[],[],2,7,114,[],[],https://twitter.com/tuliogadelha/status/1308779577653723137,False,,0,,,,,,,,[],,,,
1308779576043229192,1308779576043229192,2020-09-23 11:45:41 -0300,2020-09-23,11:45:41,-300,71456987,tuliogadelha,Túlio Gadêlha,,"O Congresso aprovou o Projeto de Lei nº 1581/2020, destinando no mínimo 60% dos Precatórios do FUNDEF para o pagamento de professores ativos, inativos e pensionistas. Além disso, o PL também previa 40% para aquisição, manutenção e outros cuidados.   Bolsonaro vetou.",pt,[],[],[],5,15,208,[],[],https://twitter.com/tuliogadelha/status/1308779576043229192,False,,0,,,,,,,,[],,,,
1308487957649780737,1308487957649780737,2020-09-22 16:26:54 -0300,2020-09-22,16:26:54,-300,71456987,tuliogadelha,Túlio Gadêlha,,Alguém ai recebeu o Auxílio Emergencial de MIL DÓLARES? #BolsonaroMentiroso #BolsonaronaONU  https://t.co/V46xMnZEky,pt,[],[],['https://pbs.twimg.com/media/EiiuHLYXcAIDU6N.jpg'],173,321,2065,"['bolsonaromentiroso', 'bolsonaronaonu']",[],https://twitter.com/tuliogadelha/status/1308487957649780737,False,,1,https://pbs.twimg.com/media/EiiuHLYXcAIDU6N.jpg,,,,,,,[],,,,
1308415530785812484,1308415530785812484,2020-09-22 11:39:06 -0300,2020-09-22,11:39:06,-300,71456987,tuliogadelha,Túlio Gadêlha,,"Bolsonaro voltou a negar as queimadas, não assumiu suas responsabilidades na pandemia e ainda culpou governadores, STF e imprensa. O presidente envergonha o Brasil diante do mundo. #BolsonaroNaONU",pt,[],[],[],110,319,2783,['bolsonaronaonu'],[],https://twitter.com/tuliogadelha/status/1308415530785812484,False,,0,,,,,,,,[],,,,
1308064912711835649,1308064908542644226,2020-09-21 12:25:52 -0300,2020-09-21,12:25:52,-300,71456987,tuliogadelha,Túlio Gadêlha,,"O necessário e urgente combate a fome e a desnutrição passa por políticas públicas, incentivo ao pequeno agricultor familiar e assistência social.",pt,[],[],[],2,4,100,[],[],https://twitter.com/tuliogadelha/status/1308064912711835649,False,,0,,,,,,,,[],,,,
1308064911487098880,1308064908542644226,2020-09-21 12:25:52 -0300,2020-09-21,12:25:52,-300,71456987,tuliogadelha,Túlio Gadêlha,,"Em um contexto de pandemia e que o arroz está custando um absurdo, metade das crianças com até 5 anos tem restrição no acesso à alimentação de qualidade. Se isso não comove  esse governo, nada mais é passível de empatia, humanismo ou compaixão.",pt,[],[],[],4,4,111,[],[],https://twitter.com/tuliogadelha/status/1308064911487098880,False,,0,,,,,,,,[],,,,
1308064910199402496,1308064908542644226,2020-09-21 12:25:51 -0300,2020-09-21,12:25:51,-300,71456987,tuliogadelha,Túlio Gadêlha,,"Para se ter noção, o número de pessoas sem acesso regular à alimentação básica aumentou cerca de 3 milhões em cinco anos. No total, são aproximadamente 10,3 milhões de brasileiros nesta situação. É o que apontam os dados divulgados pelo IBGE.",pt,[],[],[],2,2,59,[],[],https://twitter.com/tuliogadelha/status/1308064910199402496,False,,0,,,,,,,,[],,,,
1308064908542644226,1308064908542644226,2020-09-21 12:25:51 -0300,2020-09-21,12:25:51,-300,71456987,tuliogadelha,Túlio Gadêlha,,"Em pleno século 21, deveríamos estar debatendo formas de saciar a fome de cultura, literatura, conhecimento e arte. No entanto, aqui estamos: depois de recuar em mais da metade em uma década, a fome voltou a se alastrar pelo Brasil - especialmente no Nordeste e em áreas rurais.",pt,[],[],[],14,25,500,[],[],https://twitter.com/tuliogadelha/status/1308064908542644226,False,,0,,,,,,,,[],,,,
1308048440434348033,1308048440434348033,2020-09-21 11:20:25 -0300,2020-09-21,11:20:25,-300,71456987,tuliogadelha,Túlio Gadêlha,,"A semana começou com uma cena triste. A estátua do escritor Ariano Suassuna, no Centro do Recife, foi alvo de vandalismo. A escultura, que integra o Circuito da Poesia, foi encontrada caída no chão. O retrato do desrespeito à nossa cultura. Que os reparos sejam feitos rapidamente",pt,[],[],[],24,59,614,[],[],https://twitter.com/tuliogadelha/status/1308048440434348033,False,https://twitter.com/jc_pe/status/1308035042032193537,0,,,,,,,,[],,,,
1306647064948994056,1306647064948994056,2020-09-17 14:31:51 -0300,2020-09-17,14:31:51,-300,71456987,tuliogadelha,Túlio Gadêlha,,"Oq falta para o governo olhar oq está acontecendo no Pantanal? As queimadas estão deixando um rastro de destruição. Milhares de animais, nossa flora e indígenas sendo ameaçados. Uma tragédia ambiental q mata nossa biodiversidade e transforma nosso patrimônio em cinzas.",pt,[],[],[],50,81,973,[],[],https://twitter.com/tuliogadelha/status/1306647064948994056,False,,0,,,,,,,,[],,,,
1306617782713319425,1306617782713319425,2020-09-17 12:35:29 -0300,2020-09-17,12:35:29,-300,71456987,tuliogadelha,Túlio Gadêlha,,Combater a desinformação é essencial nas eleições desse ano. Você sabe o que é Deep Fake? Não? O @oatila te ensina! #fakenews #deepfake,pt,"[{'screen_name': 'oatila', 'name': 'atila iamarino *ainda de licença paternidade', 'id': '13769472'}]",[],[],11,18,204,"['fakenews', 'deepfake']",[],https://twitter.com/tuliogadelha/status/1306617782713319425,False,https://twitter.com/TSEjusbr/status/1306260008225648640,0,,,,,,,,[],,,,
1306399465914413058,1306399465914413058,2020-09-16 22:07:59 -0300,2020-09-16,22:07:59,-300,71456987,tuliogadelha,Túlio Gadêlha,,Somos do tamanho dos nossos sonhos e somos maiores quando sonhamos e construímos coletivamente. Temos uma turma preparada para representar o recifense no legislativo. Vai vendo...  https://t.co/F978SJi4et,pt,[],['https://jc.ne10.uol.com.br/politica/2020/09/11974819-sem-disputar-a-corrida-majoritaria--tulio-gadelha-afirma-em-carta-aberta-que-seu-plano-de-governo-sera-defendido-pelos-candidatos-a-vereador-do-pdt-recife.html'],[],31,7,223,[],[],https://twitter.com/tuliogadelha/status/1306399465914413058,False,,0,,,,,,,,[],,,,
