id,conversation_id,created_at,date,time,timezone,user_id,username,name,place,tweet,language,mentions,urls,photos,replies_count,retweets_count,likes_count,hashtags,cashtags,link,retweet,quote_url,video,thumbnail,near,geo,source,user_rt_id,user_rt,retweet_id,reply_to,retweet_date,translate,trans_src,trans_dest
1390669370901336073,1390669370901336073,2021-05-07 11:06:30 -0300,2021-05-07,11:06:30,-300,71456987,tuliogadelha,Túlio Gadêlha,,"O depoimento de Queiroga na #CPIdaCovid foi constrangedor! Foi incapaz de se posicionar sobre a ineficácia da cloroquina, se esquivava da pergunta sobre o tratamento precoce defendido por Bolsonaro e, pasmem, não sabia ao certo qntas vacinas haviam sido contratadas pelo Governo.",pt,[],[],[],16,6,176,['cpidacovid'],[],https://twitter.com/tuliogadelha/status/1390669370901336073,False,,0,,,,,,,,[],,,,
1390662608219426824,1390662608219426824,2021-05-07 10:39:37 -0300,2021-05-07,10:39:37,-300,71456987,tuliogadelha,Túlio Gadêlha,,A única coisa em comum entre Biden e Bolsonaro é que ambos estão dispostos a entrar para a História.,pt,[],[],[],24,8,622,[],[],https://twitter.com/tuliogadelha/status/1390662608219426824,False,,0,,,,,,,,[],,,,
1390462122388344836,1390462122388344836,2021-05-06 21:22:58 -0300,2021-05-06,21:22:58,-300,71456987,tuliogadelha,Túlio Gadêlha,,"O Brasil desceu para 58º lugar no ranking global da aplicação da vacina contra a Covid-19, nesta quinta-feira (6) – caindo duas posições nas últimas 24 horas. Agora some a isso as declaração de Bolsonaro contra a China, que segundo o Butantan, já afetam liberação de insumos",pt,[],[],[],24,31,605,[],[],https://twitter.com/tuliogadelha/status/1390462122388344836,False,,0,,,,,,,,[],,,,
1390432440389341186,1390432440389341186,2021-05-06 19:25:01 -0300,2021-05-06,19:25:01,-300,71456987,tuliogadelha,Túlio Gadêlha,,"Vitória. O PL 5595, que pretendia forçar a reabertura de escolas e aulas de forma precipitada durante a pandemia, foi retirado da pauta no Senado. O PL será tema de uma sessão de debate. #EssencialÉaVida",pt,[],[],[],8,8,192,['essencialéavida'],[],https://twitter.com/tuliogadelha/status/1390432440389341186,False,,0,,,,,,,,[],,,,
1390399031399133185,1390399031399133185,2021-05-06 17:12:16 -0300,2021-05-06,17:12:16,-300,71456987,tuliogadelha,Túlio Gadêlha,,Governador @PauloCamara40 escute a ciência. Pernambuco apresenta estado crítico na rede de assistência para pacientes com covid-19. Só hoje registramos 3.074 novos casos. Número recorde desde o início da pandemia.   https://t.co/OrXylVGL2r,pt,"[{'screen_name': 'paulocamara40', 'name': 'paulo câmara 40', 'id': '2357026778'}]",['https://jc.ne10.uol.com.br/colunas/enem-e-educacao/2021/05/12121169-conselho-estadual-de-saude-de-pernambuco-recomenda-imediata-suspensao-de-aulas-presenciais-no-estado.html'],[],3,3,47,[],[],https://twitter.com/tuliogadelha/status/1390399031399133185,False,,0,,,,,,,,[],,,,
1390342585009512450,1390342585009512450,2021-05-06 13:27:58 -0300,2021-05-06,13:27:58,-300,71456987,tuliogadelha,Túlio Gadêlha,,"@BolsonaroSP o presidente democraticamente eleito precisa entender q não é dono do país. A CPI da Lei Rouanet encerrou as investigações em 2017 sem condenações. Já a política genocida do seu pai, que tb gerou CPI, deve levar meia dúzia pra cadeia. E a pena não será de 4 aninhos.",pt,[],[],[],3,0,4,[],[],https://twitter.com/tuliogadelha/status/1390342585009512450,False,https://twitter.com/BolsonaroSP/status/1390309708335046662,0,,,,,,,,[],,,,
1390305640996773898,1390305640996773898,2021-05-06 11:01:10 -0300,2021-05-06,11:01:10,-300,71456987,tuliogadelha,Túlio Gadêlha,,"Capitão @andreporci, Ação Popular é remédio que qq cidadão pode impetrar para defender o patrimônio cultural. Pq o senhor quer decidir sozinho, sem a Comissão Nacional de Incentivo à Cultura, quais projetos poderão captar recursos públicos? Tá errado. Vcs não nos intimidam.",pt,"[{'screen_name': 'andreporci', 'name': 'andré porciuncula', 'id': '67183252'}]",[],[],189,10,152,[],[],https://twitter.com/tuliogadelha/status/1390305640996773898,False,https://twitter.com/andreporci/status/1390274031929241600,0,,,,,,,,[],,,,
1390025317687959565,1390025317687959565,2021-05-05 16:27:15 -0300,2021-05-05,16:27:15,-300,71456987,tuliogadelha,Túlio Gadêlha,,Um desabafo necessário. Parabéns @fbbreal pela postura. ❤️🌷  https://t.co/GfCQ0az5u8,pt,"[{'screen_name': 'fbbreal', 'name': 'fatima bernardes', 'id': '468921945'}]",[],[],39,75,1059,[],[],https://twitter.com/tuliogadelha/status/1390025317687959565,False,,1,https://pbs.twimg.com/ext_tw_video_thumb/1390025270963408896/pu/img/doRo2d7mkNk3kBU9.jpg,,,,,,,[],,,,
1389945927369207808,1389945927369207808,2021-05-05 11:11:47 -0300,2021-05-05,11:11:47,-300,71456987,tuliogadelha,Túlio Gadêlha,,"Nunca irei conhecê-lo. Hoje acordei com isso na cabeça. Ele nunca saberá o quanto me fez rir, me trouxe felicidade, fez meu dia melhor. Nunca conseguirei agradecê-lo. Quantos fãs ele deve ter nessa mesma condição? Que tristeza.  https://t.co/LVIEMNKepu",pt,[],[],[],14,25,902,[],[],https://twitter.com/tuliogadelha/status/1389945927369207808,False,,1,https://pbs.twimg.com/ext_tw_video_thumb/1389945897123991553/pu/img/HgBmZu9gWMrgV5py.jpg,,,,,,,[],,,,
1389797207633707010,1389797207633707010,2021-05-05 01:20:50 -0300,2021-05-05,01:20:50,-300,71456987,tuliogadelha,Túlio Gadêlha,,"Antes de dormir queria agradecer ao #bbb21. O programa ajudou milhões de pessoas a permanecerem em casa nessa pandemia. E tb dizer que já estou #NoLimite com esse desgoverno Bolsonaro. Boa noite, turma. 🙏🏼",pt,[],[],[],113,188,4180,"['bbb21', 'nolimite']",[],https://twitter.com/tuliogadelha/status/1389797207633707010,False,,0,,,,,,,,[],,,,
1389793448035749894,1389793448035749894,2021-05-05 01:05:53 -0300,2021-05-05,01:05:53,-300,71456987,tuliogadelha,Túlio Gadêlha,,"O #bbb21 acabou hoje, mas hoje tb começou um outro paredão: o da #CPIdaCovid.  Lá os eliminados cometeram crimes, foram negligentes e podem ir para cadeia.  Vale a pena assistir. Agora vcs entendem o desespero de Bolsonaro?",pt,[],[],[],34,86,1157,"['bbb21', 'cpidacovid']",[],https://twitter.com/tuliogadelha/status/1389793448035749894,False,,0,,,,,,,,[],,,,
1389792884258484224,1389792884258484224,2021-05-05 01:03:39 -0300,2021-05-05,01:03:39,-300,71456987,tuliogadelha,Túlio Gadêlha,,"A culpa é sua, genocida!! Vc vai pagar pelos crimes que cometeu, Bolsonaro.",pt,[],[],[],121,157,2157,[],[],https://twitter.com/tuliogadelha/status/1389792884258484224,False,https://twitter.com/jairbolsonaro/status/1389782263810961408,0,,,,,,,,[],,,,
1389788031213789191,1389788031213789191,2021-05-05 00:44:22 -0300,2021-05-05,00:44:22,-300,71456987,tuliogadelha,Túlio Gadêlha,,"90,15% tais lascado Bolsonaro.",es,[],[],[],563,770,8402,[],[],https://twitter.com/tuliogadelha/status/1389788031213789191,False,,0,,,,,,,,[],,,,
1389785880718630914,1389785880718630914,2021-05-05 00:35:49 -0300,2021-05-05,00:35:49,-300,71456987,tuliogadelha,Túlio Gadêlha,,Que show! @Projota e @koka_lucas juntos foram imbatíveis. Que nem Ciro e Lula juntos contra Bolsonaro. Já pensou?,pt,"[{'screen_name': 'projota', 'name': 'projota 🎧', 'id': '41931380'}, {'screen_name': 'koka_lucas', 'name': 'lucas penteado', 'id': '1363078988197937153'}]",[],[],350,148,3002,[],[],https://twitter.com/tuliogadelha/status/1389785880718630914,False,,0,,,,,,,,[],,,,
1389784593440595969,1389784593440595969,2021-05-05 00:30:42 -0300,2021-05-05,00:30:42,-300,71456987,tuliogadelha,Túlio Gadêlha,,@koka_lucas e @Projota imbatíveis. Tipo Ciro e Lula juntos contra Bolsonaro.,pt,"[{'screen_name': 'projota', 'name': 'projota 🎧', 'id': '41931380'}]",[],[],250,164,1448,[],[],https://twitter.com/tuliogadelha/status/1389784593440595969,False,,0,,,,,,,,[],,,,
1389770443297595393,1389770443297595393,2021-05-04 23:34:29 -0300,2021-05-04,23:34:29,-300,71456987,tuliogadelha,Túlio Gadêlha,,"Rapaz, criticar @karolconka depois dela ter saído do jogo é que nem criticar Lula em pleno 2021. Foca em quem tá no jogo, meu irmão. Olha Bolsonaro aí matando o povo e destruindo país. #bbb21",pt,"[{'screen_name': 'karolconka', 'name': 'karol conká', 'id': '117275684'}]",[],[],506,276,4344,['bbb21'],[],https://twitter.com/tuliogadelha/status/1389770443297595393,False,,0,,,,,,,,[],,,,
1389713508447707138,1389713508447707138,2021-05-04 19:48:14 -0300,2021-05-04,19:48:14,-300,71456987,tuliogadelha,Túlio Gadêlha,,"A Câmara vota agora a revogação da Lei de Segurança Nacional. Hoje, a LSN está sendo utilizada para perseguir críticos ao Governo, colocando em risco movimentos sociais e a democracia. Por isso, somos a favor do PL 2462/91, q tipifica crimes contra o Estado Democrático de Direito",pt,[],[],[],2,13,281,[],[],https://twitter.com/tuliogadelha/status/1389713508447707138,False,,0,,,,,,,,[],,,,
1389696514797211651,1389696514797211651,2021-05-04 18:40:43 -0300,2021-05-04,18:40:43,-300,71456987,tuliogadelha,Túlio Gadêlha,,Derrubaríamos hoje o veto de Bolsonaro ao PL da Conectividade – que proporciona internet para alunos e professores da rede pública. Mas a sessão foi cancelada. Não desistiremos. Continuaremos pressionando. #DerrubaVetoPL3477 #ubes  https://t.co/MExBtnVzoE,pt,[],[],['https://pbs.twimg.com/media/E0kxm82WUAEGP-6.jpg'],12,7,270,"['derrubavetopl3477', 'ubes']",[],https://twitter.com/tuliogadelha/status/1389696514797211651,False,,1,https://pbs.twimg.com/media/E0kxm82WUAEGP-6.jpg,,,,,,,[],,,,
1389652666297499651,1389652666297499651,2021-05-04 15:46:28 -0300,2021-05-04,15:46:28,-300,71456987,tuliogadelha,Túlio Gadêlha,,"Ele sabia que não ia dar certo. Mesmo assim, resolveu fazer parte de um governo genocida. A #CPIdaCovid começou, Pazuello.  https://t.co/wgWxzYvtwM",pt,[],[],[],8,31,350,['cpidacovid'],[],https://twitter.com/tuliogadelha/status/1389652666297499651,False,,1,https://pbs.twimg.com/ext_tw_video_thumb/1389652599922696193/pu/img/5vMtJZjL8aBhRTxM.jpg,,,,,,,[],,,,
1389580927882366981,1389580927882366981,2021-05-04 11:01:25 -0300,2021-05-04,11:01:25,-300,71456987,tuliogadelha,Túlio Gadêlha,,"Como assim Pazuello fugiu?!?!  A CPI da Covid acabou de começar e o cidadão que, até ontem, estava passeando no shopping sem máscara, agora diz que está de quarentena?    https://t.co/iopse2EgNR",pt,[],['https://www.google.com.br/amp/s/oglobo.globo.com/brasil/alegando-suspeita-de-covid-pazuello-comunica-que-nao-vai-depor-em-cpi-1-25001781%3fversao=amp'],[],16,14,228,[],[],https://twitter.com/tuliogadelha/status/1389580927882366981,False,,0,,,,,,,,[],,,,
1389363819533701122,1389363819533701122,2021-05-03 20:38:42 -0300,2021-05-03,20:38:42,-300,71456987,tuliogadelha,Túlio Gadêlha,,"O Reino Unido levou a vacinação a sério, e hoje, registrou apenas uma morte por Covid.  O Brasil poderia estar assim. Não faltou recurso, laboratório, ou experiência em vacinação.  Faltou gestão. Sobrou negacionismo. A culpa é sua, Bolsonaro.     https://t.co/SNsrhC4klY",pt,[],['https://istoe.com.br/reino-unido-registra-apenas-uma-morte-por-covid-em-24h/'],[],6,33,356,[],[],https://twitter.com/tuliogadelha/status/1389363819533701122,False,,0,,,,,,,,[],,,,
1389277893507928066,1389277893507928066,2021-05-03 14:57:16 -0300,2021-05-03,14:57:16,-300,71456987,tuliogadelha,Túlio Gadêlha,,"Não é montagem. Aconteceu há pouco, em Goiás. Talvez Deus perdoe. Dizem que a bondade divina não tem limites. Mas a Justiça dos homens não poderá perdoar. Isso teria um nome: impunidade.  https://t.co/DeDGKgjVSm",pt,[],[],['https://pbs.twimg.com/media/E0e04PRXIAAhNNd.jpg'],19,26,415,[],[],https://twitter.com/tuliogadelha/status/1389277893507928066,False,,1,https://pbs.twimg.com/media/E0e04PRXIAAhNNd.jpg,,,,,,,[],,,,
1389053285345206285,1389053285345206285,2021-05-03 00:04:45 -0300,2021-05-03,00:04:45,-300,71456987,tuliogadelha,Túlio Gadêlha,,"Rapaz, o que foi essa defesa de 1min?#GilDoVigor acabou de sair e já deixou saudade.",pt,[],[],[],33,34,1207,['gildovigor'],[],https://twitter.com/tuliogadelha/status/1389053285345206285,False,,0,,,,,,,,[],,,,
1389051255142629389,1389051255142629389,2021-05-02 23:56:41 -0300,2021-05-02,23:56:41,-300,71456987,tuliogadelha,Túlio Gadêlha,,"Não gostei. Como assim a final sem Gil? O poder dos cactos é inquestionável. Mas usaram a força contra um aliado. Parece Lula e Ciro brigando. Se continuarmos assim, Brasil tá lascado.",pt,[],[],[],1593,1644,15910,[],[],https://twitter.com/tuliogadelha/status/1389051255142629389,False,,0,,,,,,,,[],,,,
1388985857525391371,1388985857525391371,2021-05-02 19:36:49 -0300,2021-05-02,19:36:49,-300,71456987,tuliogadelha,Túlio Gadêlha,,Existe uma diferença entre ser diferente e fazer a diferença. Acho que eles ainda não entenderam isso.  https://t.co/yKSrQQlChy,pt,[],[],['https://pbs.twimg.com/media/E0arRRnWQAMw0Vp.jpg'],35,22,663,[],[],https://twitter.com/tuliogadelha/status/1388985857525391371,False,,1,https://pbs.twimg.com/media/E0arRRnWQAMw0Vp.jpg,,,,,,,[],,,,
1387962030695632897,1387962030695632897,2021-04-29 23:48:29 -0300,2021-04-29,23:48:29,-300,71456987,tuliogadelha,Túlio Gadêlha,,Prova de resistência mesmo vivem os brasileiros nesse governo Bolsonaro. Rodar pendurado num batom gigante é fichinha. #bbb,pt,[],[],[],221,554,5238,['bbb'],[],https://twitter.com/tuliogadelha/status/1387962030695632897,False,,0,,,,,,,,[],,,,
1387814839742046209,1387814839742046209,2021-04-29 14:03:36 -0300,2021-04-29,14:03:36,-300,71456987,tuliogadelha,Túlio Gadêlha,,"Diante do momento que vivemos, a aprovação do PL 5.595/2020 (que torna a educação uma atividade essencial) foi uma atitude irresponsável. Votei contra. Agora é hora do Senado Federal rejeitar o projeto e preservar a vida de milhões de pessoas. #EssencialÉAVida",pt,[],[],[],6,11,134,['essencialéavida'],[],https://twitter.com/tuliogadelha/status/1387814839742046209,False,,0,,,,,,,,[],,,,
1387492349119434753,1387492349119434753,2021-04-28 16:42:09 -0300,2021-04-28,16:42:09,-300,71456987,tuliogadelha,Túlio Gadêlha,,"Quase 400 mil mortos, Brasil no Mapa da Fome, mais de 14 milhões de brasileiros desempregados. É inaceitável que o Senado esteja mais preocupado em passar a boiada do que em proteger os brasileiros! @rpsenador: #GrilagemÉCrime #PL510Não!   https://t.co/cZYq4LqNwl",pt,"[{'screen_name': 'rpsenador', 'name': 'rodrigo pacheco', 'id': '762786918086180864'}]",['https://www.google.com.br/amp/s/brasil.elpais.com/brasil/2021-04-28/senado-pauta-votacao-de-nova-versao-da-mp-da-grilagem-e-acende-alerta-sobre-boiada-antiambiental-preparada-pelo-congresso.html%3foutputType=amp'],[],8,23,137,"['grilagemécrime', 'pl510não']",[],https://twitter.com/tuliogadelha/status/1387492349119434753,False,,0,,,,,,,,[],,,,
1387456747053494274,1387456747053494274,2021-04-28 14:20:40 -0300,2021-04-28,14:20:40,-300,71456987,tuliogadelha,Túlio Gadêlha,,Quando vc pensa que já ouviu todos os possíveis absurdos do Governo Bolsonaro... Eles te surpreendem!  https://t.co/TzyzJZ7lAK,pt,[],[],['https://pbs.twimg.com/media/E0E8jgsWUAAKbx4.jpg'],19,25,279,[],[],https://twitter.com/tuliogadelha/status/1387456747053494274,False,,1,https://pbs.twimg.com/media/E0E8jgsWUAAKbx4.jpg,,,,,,,[],,,,
1387414660446572544,1387414660446572544,2021-04-28 11:33:26 -0300,2021-04-28,11:33:26,-300,71456987,tuliogadelha,Túlio Gadêlha,,"Diz aí! Que governo no mundo um Ministro precisa tomar vacina ""escondido""?!? Fala sério, gente.  https://t.co/QxjednSol8",pt,[],[],['https://pbs.twimg.com/media/E0EWRvJX0AEQnNQ.jpg'],19,63,565,[],[],https://twitter.com/tuliogadelha/status/1387414660446572544,False,,1,https://pbs.twimg.com/media/E0EWRvJX0AEQnNQ.jpg,,,,,,,[],,,,
1387380330315780101,1387380330315780101,2021-04-28 09:17:01 -0300,2021-04-28,09:17:01,-300,71456987,tuliogadelha,Túlio Gadêlha,,"Há um ano nós lutamos por Internet Pra Geral, por merenda para todos, por um Enem justo e seguro, por um plano para educação na pandemia. Nesse tempo, o governo Bolsonaro não fez absolutamente nada pelas redes públicas de ensino. #EducaçãoSimBolsonaroNão",pt,[],[],[],10,17,331,['educaçãosimbolsonaronão'],[],https://twitter.com/tuliogadelha/status/1387380330315780101,False,,0,,,,,,,,[],,,,
1387380057728077830,1387380057728077830,2021-04-28 09:15:56 -0300,2021-04-28,09:15:56,-300,71456987,tuliogadelha,Túlio Gadêlha,,#PL510Não #GrilagemNão,und,[],[],[],0,10,74,"['pl510não', 'grilagemnão']",[],https://twitter.com/tuliogadelha/status/1387380057728077830,False,https://twitter.com/fmei7777/status/1387207521463644169,0,,,,,,,,[],,,,
1387379909950156802,1387379909950156802,2021-04-28 09:15:21 -0300,2021-04-28,09:15:21,-300,71456987,tuliogadelha,Túlio Gadêlha,,"É 12 minha querida amiga, sempre 12! #VemPraMassa",pt,[],[],[],17,16,273,['vempramassa'],[],https://twitter.com/tuliogadelha/status/1387379909950156802,False,https://twitter.com/perpetua_acre/status/1387245055023398916,0,,,,,,,,[],,,,
1387244487026647040,1387244487026647040,2021-04-28 00:17:14 -0300,2021-04-28,00:17:14,-300,71456987,tuliogadelha,Túlio Gadêlha,,"É o destino, Juliette. 12. #ForaBolsonado  https://t.co/6l9YeWnrsi",pt,[],[],['https://pbs.twimg.com/media/E0B7gMYXMAIvS22.jpg'],371,122,2463,['forabolsonado'],[],https://twitter.com/tuliogadelha/status/1387244487026647040,False,,1,https://pbs.twimg.com/media/E0B7gMYXMAIvS22.jpg,,,,,,,[],,,,
1387242938795708419,1387242938795708419,2021-04-28 00:11:04 -0300,2021-04-28,00:11:04,-300,71456987,tuliogadelha,Túlio Gadêlha,,É 12 Juliette!!!,pt,[],[],[],196,483,7573,[],[],https://twitter.com/tuliogadelha/status/1387242938795708419,False,,0,,,,,,,,[],,,,
1387234548799492101,1387234548799492101,2021-04-27 23:37:44 -0300,2021-04-27,23:37:44,-300,71456987,tuliogadelha,Túlio Gadêlha,,Duas perguntas: 1.O que vcs acham de um romance de Juliette e Fiuk?  2.O que vcs acham Bolsonaro ser interditado por falta de condições mentais para exercício do cargo?,pt,[],[],[],586,255,5795,[],[],https://twitter.com/tuliogadelha/status/1387234548799492101,False,,0,,,,,,,,[],,,,
1387073958772625410,1387073958772625410,2021-04-27 12:59:37 -0300,2021-04-27,12:59:37,-300,71456987,tuliogadelha,Túlio Gadêlha,,"O Governo Federal recusou 11 vezes ofertas para compras de vacinas contra Covid. Foram 6 recusas documentadas da CoronaVac, 3 da Pfizer e 2 da Covax. Cloroquina não falta. CPI neles!   https://t.co/IBNR8kNGhb",pt,[],['https://www.google.com.br/amp/s/g1.globo.com/google/amp/politica/blog/octavio-guedes/post/2021/04/27/cpi-da-covid-governo-bolsonaro-recusou-11-vezes-ofertas-para-compras-de-vacina.ghtml'],[],15,25,290,[],[],https://twitter.com/tuliogadelha/status/1387073958772625410,False,,0,,,,,,,,[],,,,
1386826261926981637,1386826261926981637,2021-04-26 20:35:21 -0300,2021-04-26,20:35:21,-300,71456987,tuliogadelha,Túlio Gadêlha,,"""Onde compra isso?""  Foi o que Pazuello disse quando foi questionado por não usar máscara, enquanto passeava no shopping de Manaus. Sem máscara, Sem empatia,  Sem noção, Sem vergonha, Um ex-ministro da Saúde que desonra o Brasil. A gente se vê na #CPIdaCovid, general.  https://t.co/RFTZAmfNg6",pt,[],[],['https://pbs.twimg.com/media/Ez7_IeiX0AMhEhA.jpg'],24,30,629,['cpidacovid'],[],https://twitter.com/tuliogadelha/status/1386826261926981637,False,,1,https://pbs.twimg.com/media/Ez7_IeiX0AMhEhA.jpg,,,,,,,[],,,,
1386666002050605058,1386666002050605058,2021-04-26 09:58:32 -0300,2021-04-26,09:58:32,-300,71456987,tuliogadelha,Túlio Gadêlha,,"Enquanto o governo Bolsonaro se gaba pelos 5,3% da população imunizada, nosso vizinho, o Chile, se preocupa com o aumento de casos, mesmo com 32,6% da população vacinada.  Rapaz, 5,3%, no Brasil, são 11,2 mi de pessoas. Isso não é nem metade dos seguidores de @FreireJuliette",pt,"[{'screen_name': 'freirejuliette', 'name': 'bruna cansada de dançar', 'id': '1255196761418801154'}]",[],[],49,112,1240,[],[],https://twitter.com/tuliogadelha/status/1386666002050605058,False,,0,,,,,,,,[],,,,
1385430364236259328,1385430364236259328,2021-04-23 00:08:33 -0300,2021-04-23,00:08:33,-300,71456987,tuliogadelha,Túlio Gadêlha,,O Bolsonaro na cúpula do clima.  https://t.co/OA9GXxRqWt,pt,[],[],[],186,194,2264,[],[],https://twitter.com/tuliogadelha/status/1385430364236259328,False,,1,https://pbs.twimg.com/ext_tw_video_thumb/1385430306702909443/pu/img/0c25KCuRCNIxKpZN.jpg,,,,,,,[],,,,
1385424141575245825,1385424141575245825,2021-04-22 23:43:49 -0300,2021-04-22,23:43:49,-300,71456987,tuliogadelha,Túlio Gadêlha,,Deus ilumina a Pocah pra botar a Viih Tube no paredão e o Arthur Lira pra botar o impeachment na pauta. É pedir demais?,pt,[],[],[],244,311,4970,[],[],https://twitter.com/tuliogadelha/status/1385424141575245825,False,,0,,,,,,,,[],,,,
1385210649618305025,1385210649618305025,2021-04-22 09:35:29 -0300,2021-04-22,09:35:29,-300,71456987,tuliogadelha,Túlio Gadêlha,,É essa a relação que Bolsonaro e Salles querem construir com a comunidade internacional. Esse governo nunca se preocupou em preservar nossa biodiversidade. Eles querem apenas colocar a mão no dinheiro.  https://t.co/jpNZW6DKgZ,pt,[],[],['https://pbs.twimg.com/media/EzlBvYOXEAQ8FMs.jpg'],21,40,317,[],[],https://twitter.com/tuliogadelha/status/1385210649618305025,False,,1,https://pbs.twimg.com/media/EzlBvYOXEAQ8FMs.jpg,,,,,,,[],,,,
1384945905300869126,1384945905300869126,2021-04-21 16:03:29 -0300,2021-04-21,16:03:29,-300,71456987,tuliogadelha,Túlio Gadêlha,,Semana passada a intervenção na Polícia Federal p afastar o delegado que realizou a maior apreensão de madeira da história. Hoje a PF serve de instrumento para tentar intimidar @GuilhermeBoulos pela Lei de Segurança Nacional. Não é um governo.  É uma organização criminosa.,pt,"[{'screen_name': 'guilhermeboulos', 'name': 'guilherme boulos', 'id': '762402774260875265'}]",[],[],45,183,2542,[],[],https://twitter.com/tuliogadelha/status/1384945905300869126,False,,0,,,,,,,,[],,,,
1384887742941777921,1384887742941777921,2021-04-21 12:12:22 -0300,2021-04-21,12:12:22,-300,71456987,tuliogadelha,Túlio Gadêlha,,"Hoje é dia de #ForaSalles.  Há 1 ano, em reunião do Governo Bolsonaro, Salles sugeriu aproveitar o “momento de tranquilidade porque só se fala de Covid"" para ""ir passando a boiada"" na legislação ambiental. Esse não vale o que uma onça-pintada enterra.  https://t.co/VuuNzJahsi",pt,[],[],[],67,234,960,['forasalles'],[],https://twitter.com/tuliogadelha/status/1384887742941777921,False,,1,https://pbs.twimg.com/ext_tw_video_thumb/1384887704580759552/pu/img/45wsSSKf944mfGg6.jpg,,,,,,,[],,,,
1384719871087362048,1384719871087362048,2021-04-21 01:05:18 -0300,2021-04-21,01:05:18,-300,71456987,tuliogadelha,Túlio Gadêlha,,"Gente, desculpe a demora, a sessão só encerrou agora (1h04). Como assim Gil não votou na Viih Tube pro paredão?! Decepção maior só tive quando o PSB votou no impeachment de Dilma, em 2016.  Tudo começou ali. Temer a semente do Bolsonarismo.",pt,[],[],[],469,602,10763,[],[],https://twitter.com/tuliogadelha/status/1384719871087362048,False,,0,,,,,,,,[],,,,
1384718283996286980,1384718283996286980,2021-04-21 00:59:00 -0300,2021-04-21,00:59:00,-300,71456987,tuliogadelha,Túlio Gadêlha,,Aeee! Finalmente conseguimos aprovar a prorrogação da Lei Aldir Blanc na Câmara. Agora segue para sanção.  #LeiAldirBlanc,pt,[],[],[],26,13,547,['leialdirblanc'],[],https://twitter.com/tuliogadelha/status/1384718283996286980,False,,0,,,,,,,,[],,,,
1384543663020249089,1384543663020249089,2021-04-20 13:25:07 -0300,2021-04-20,13:25:07,-300,71456987,tuliogadelha,Túlio Gadêlha,,APROVA PL 795/2021 - Prorrogação da Lei Aldir Blanc para o Brasil! Pl na pauta de hoje na Comissão de Cultura e da CCJ da Câmara dos Deputados! #digasimaprorrogação #LabProrrogaPraValer #MaisTempoParaCultura #SOScultura,pt,[],[],[],2,4,99,"['digasimaprorrogação', 'labprorrogapravaler', 'maistempoparacultura', 'soscultura']",[],https://twitter.com/tuliogadelha/status/1384543663020249089,False,,0,,,,,,,,[],,,,
1384222582870708229,1384222582870708229,2021-04-19 16:09:16 -0300,2021-04-19,16:09:16,-300,71456987,tuliogadelha,Túlio Gadêlha,,"Hoje, às 20h, te convido pro nosso papo com o vereador do Recife @ivanmoraesfilho. Somos o epicentro da pandemia no mundo.  Como chegamos até aqui?  O que podemos fazer agora?  Ao vivo lá no insta.",pt,"[{'screen_name': 'ivanmoraesfilho', 'name': 'ivan moraes', 'id': '36046892'}]",[],[],8,1,68,[],[],https://twitter.com/tuliogadelha/status/1384222582870708229,False,,0,,,,,,,,[],,,,
1384221451255914502,1384221451255914502,2021-04-19 16:04:46 -0300,2021-04-19,16:04:46,-300,71456987,tuliogadelha,Túlio Gadêlha,,"Tablet e internet para alunos e professores do ensino público? Excelente iniciativa. Mas Bolsonaro vetou. Nenhuma surpresa, né? O Congresso Nacional pode derrubar esse veto. Pressione o seu deputado. Somos a favor do PL 3.477/2020.",pt,[],[],[],19,53,805,[],[],https://twitter.com/tuliogadelha/status/1384221451255914502,False,,0,,,,,,,,[],,,,
1383974273476272133,1383974273476272133,2021-04-18 23:42:34 -0300,2021-04-18,23:42:34,-300,71456987,tuliogadelha,Túlio Gadêlha,,"Se cada deputado pudesse votar duas vezes, já teríamos os 342 votos para o impeachment de Bolsonaro. #bbb 🤔",pt,[],[],[],560,428,6133,['bbb'],[],https://twitter.com/tuliogadelha/status/1383974273476272133,False,,0,,,,,,,,[],,,,
1383049712224378881,1383049712224378881,2021-04-16 10:28:41 -0300,2021-04-16,10:28:41,-300,71456987,tuliogadelha,Túlio Gadêlha,,"Os 12 estados com mais mortes por Covid_19 são os mesmos que mais votaram em Bolsonaro.  Ou seja, o negacionismo mata.    https://t.co/EpENEreRhC",pt,[],['https://congressoemfoco.uol.com.br/congresso-em-foco/estados-bolsonaristas-lideram-mortes-por-covid-19/'],[],29,29,221,[],[],https://twitter.com/tuliogadelha/status/1383049712224378881,False,,0,,,,,,,,[],,,,
