id,conversation_id,created_at,date,time,timezone,user_id,username,name,place,tweet,language,mentions,urls,photos,replies_count,retweets_count,likes_count,hashtags,cashtags,link,retweet,quote_url,video,thumbnail,near,geo,source,user_rt_id,user_rt,retweet_id,reply_to,retweet_date,translate,trans_src,trans_dest
1169664799145418752,1169664799145418752,2019-09-05 14:33:14 -0300,2019-09-05,14:33:14,-300,71456987,tuliogadelha,Túlio Gadêlha,,"O governo tentar impor um processo de revisionismo e negacionismo histórico. Por isso, a aprovamos ontem nosso requerimento de audiência pública para discutir as questões relacionadas à apologia a ditadura militar, à tortura e às comemorações do golpe militar de 1964.  https://t.co/Wne7e9xXvq",pt,[],[],[],87,111,1494,[],[],https://twitter.com/tuliogadelha/status/1169664799145418752,False,,1,https://pbs.twimg.com/ext_tw_video_thumb/1169664592542408707/pu/img/4s2ozRS1IGdiLAdo.jpg,,,,,,,[],,,,
1169395715472285696,1169395715472285696,2019-09-04 20:43:59 -0300,2019-09-04,20:43:59,-300,71456987,tuliogadelha,Túlio Gadêlha,"{'type': 'Point', 'coordinates': [-15.79847176, -47.86404499]}","Se liga Bolsonaro! Instalamos a CPMI das Fake News para investigar os ataques que atentam contra a verdade, a democracia e o debate público. . Sou titular da comissão e irei analisar a propagação da desinformação,…  https://t.co/0A7vFyKhS8",pt,[],['https://www.instagram.com/p/B2AhdrqH-TW/?igshid=jxdurdy5e760'],[],46,77,933,[],[],https://twitter.com/tuliogadelha/status/1169395715472285696,False,,0,,,,,,,,[],,,,
1169037560691273728,1169037560691273728,2019-09-03 21:00:48 -0300,2019-09-03,21:00:48,-300,71456987,tuliogadelha,Túlio Gadêlha,,"Hoje fomos até a presidência da Câmara com o objetivo de reverter a decisão absurda do governo Bolsonaro de cortar mais 5.613 bolsas de pós-graduação, mestrado, doutorado e pós-doutorado no país, que seriam ofertadas…  https://t.co/XIspbSBnd2",pt,[],['https://www.instagram.com/p/B19-l5LnmZy/?igshid=mifnyqvia939'],[],28,33,435,[],[],https://twitter.com/tuliogadelha/status/1169037560691273728,False,,0,,,,,,,,[],,,,
1168959900682215425,1168959900682215425,2019-09-03 15:52:13 -0300,2019-09-03,15:52:13,-300,71456987,tuliogadelha,Túlio Gadêlha,"{'type': 'Point', 'coordinates': [-15.7995279, -47.86541354]}","Não podemos permitir que Bolsonaro continue estimulando o desmatamento para fins de produção rural e mineral, cortando recursos dos órgãos de fiscalização e controle ambiental. . As consequências já são visíveis e…  https://t.co/i0G1qrSQHp",pt,[],['https://www.instagram.com/p/B19bRkZnvv3/?igshid=15vaoql866f8z'],[],24,13,208,[],[],https://twitter.com/tuliogadelha/status/1168959900682215425,False,,0,,,,,,,,[],,,,
1166698326760271872,1166698326760271872,2019-08-28 10:05:31 -0300,2019-08-28,10:05:31,-300,71456987,tuliogadelha,Túlio Gadêlha,,"Pessoal, quem não acompanhou a nossa participação no programa #Ocupação, da @tvcamara , debatendo sobre desemprego e profissões do futuro, pode assistir neste link:  https://t.co/dWLpxzuBvN  https://t.co/JWOwtoxczE",pt,"[{'screen_name': 'tvcamara', 'name': 'tv câmara', 'id': '39336282'}]",['https://youtu.be/cT8xJGwWlBg'],['https://pbs.twimg.com/media/EDDx8UuXsAINGMk.jpg'],21,7,91,['ocupação'],[],https://twitter.com/tuliogadelha/status/1166698326760271872,False,,1,https://pbs.twimg.com/media/EDDx8UuXsAINGMk.jpg,,,,,,,[],,,,
1166124869509156864,1166124869509156864,2019-08-26 20:06:49 -0300,2019-08-26,20:06:49,-300,71456987,tuliogadelha,Túlio Gadêlha,,"Bolsonaro é tão pequeno que não vale a pena comentar suas barbaridades. Apenas pedir desculpas em nome do povo brasileiro à primeira dama Brigitte, ao presidente Macron e dizê-los: sim, Bolsonaro nos envergonha diariamente!  https://t.co/tmSGNivx6u",pt,[],['https://g1.globo.com/mundo/noticia/2019/08/26/apos-comentario-de-bolsonaro-sobre-primeira-dama-francesa-macron-diz-esperar-que-brasileiros-tenham-presidente-que-se-comporte-a-altura.ghtml'],[],4630,797,6180,[],[],https://twitter.com/tuliogadelha/status/1166124869509156864,False,,0,,,,,,,,[],,,,
1166086566592356358,1166086566592356358,2019-08-26 17:34:36 -0300,2019-08-26,17:34:36,-300,71456987,tuliogadelha,Túlio Gadêlha,,"A rejeição de Bolsonaro foi de 28,2% em fevereiro para 53,7% em agosto; já a rejeição do governo saltou de 19% para 39,5%, segundo pesquisa da CNT/MDA. Qndo o projeto central de um governo é a destruição do Meio Ambiente e o desmonte da Educação, dá nisso!  https://t.co/8L655os12f",pt,[],['https://noticias.uol.com.br/politica/ultimas-noticias/2019/08/26/avaliacao-governo-bolsonaro-pesquisa-cntmda.htm'],[],1774,170,1588,[],[],https://twitter.com/tuliogadelha/status/1166086566592356358,False,,0,,,,,,,,[],,,,
1164708187393744897,1164708187393744897,2019-08-22 22:17:25 -0300,2019-08-22,22:17:25,-300,71456987,tuliogadelha,Túlio Gadêlha,"{'type': 'Point', 'coordinates': [-15.7995279, -47.86541354]}","Em uma das sessões mais tensas que vivi - muito por ter me tornado alvo de ataques da bancada da Bíblia, permaneci até o fim, enquanto escutava a todos e refletia sobre o que estava acontecendo. . Li, recentemente,…  https://t.co/LwzCsE0svY",pt,[],['https://www.instagram.com/p/B1fN0hInZMj/?igshid=2jj3lmsdwe3j'],[],102,9,278,[],[],https://twitter.com/tuliogadelha/status/1164708187393744897,False,,0,,,,,,,,[],,,,
1164364099469369344,1164364099469369344,2019-08-21 23:30:08 -0300,2019-08-21,23:30:08,-300,71456987,tuliogadelha,Túlio Gadêlha,,"Enquanto a Amazônia arde em chamas, os deputados de Bolsonaro acabam de aprovar projeto que permite posse de arma em toda a propriedade rural. Uma irresponsabilidade sem tamanho.  https://t.co/Y05AQndUhb",pt,[],['https://www.google.com.br/amp/s/g1.globo.com/google/amp/politica/noticia/2019/08/21/camara-aprova-texto-base-de-projeto-que-permite-posse-de-arma-em-toda-a-propriedade-rural.ghtml'],[],3080,667,3781,[],[],https://twitter.com/tuliogadelha/status/1164364099469369344,False,,0,,,,,,,,[],,,,
1164035153158639619,1164035153158639619,2019-08-21 01:43:01 -0300,2019-08-21,01:43:01,-300,71456987,tuliogadelha,Túlio Gadêlha,,"Frota revela o que todos nós já sabíamos. Existe uma fábrica de fake news no PSL moendo a todo vapor. E na sua opinião, vale tudo na política? #rodaviva #fakenews  https://t.co/d91YdI3llq",pt,[],['https://www.instagram.com/p/B1abpeEHTTc/?igshid=1fqbq94lu23ax'],[],848,55,632,"['rodaviva', 'fakenews']",[],https://twitter.com/tuliogadelha/status/1164035153158639619,False,,0,,,,,,,,[],,,,
1164030862670913537,1164030862670913537,2019-08-21 01:25:58 -0300,2019-08-21,01:25:58,-300,71456987,tuliogadelha,Túlio Gadêlha,,Hoje profissionais de enfermagem lotaram o salão nobre para pedir jornada semanal de 30 horas. E esse foi um dos compromissos que firmamos quando assumimos nosso mandato. . Já são 19 anos de luta por essa pauta e…  https://t.co/W5RIkko3dp,pt,[],['https://www.instagram.com/p/B1aZ0ABHGZQ/?igshid=wgxye4sc1vy8'],[],20,10,152,[],[],https://twitter.com/tuliogadelha/status/1164030862670913537,False,,0,,,,,,,,[],,,,
1163944775394963456,1163944775394963456,2019-08-20 19:43:54 -0300,2019-08-20,19:43:54,-300,71456987,tuliogadelha,Túlio Gadêlha,,Quantas famílias vcs conhecem que não são formadas a partir da união de um homem e uma mulher? Eu conheço várias. É sobre isso que quero legislar. Por isso solicitei a retirada do projeto de pauta para aprimoramento…  https://t.co/6qmjxGktqv,pt,[],['https://www.instagram.com/p/B1Zyqh-nANU/?igshid=wgr6qmxjbnas'],[],1525,40,690,[],[],https://twitter.com/tuliogadelha/status/1163944775394963456,False,,0,,,,,,,,[],,,,
1163540290801754113,1163540290801754113,2019-08-19 16:56:37 -0300,2019-08-19,16:56:37,-300,71456987,tuliogadelha,Túlio Gadêlha,,"Após a Oslo suspender repasses de recursos ao Brasil, o presidente divulgou um vídeo de caça às baleias nas Ilhas Faroé, da Dinamarca, como se fosse na Noruega. A campanha acabou, mas Bolsonaro continua usando fakenews para atacar quem critica seu governo.  https://t.co/Om02dJJHhW",pt,[],['https://exame.abril.com.br/brasil/fake-video-de-caca-as-baleias-que-bolsonaro-postou-nao-e-da-noruega/'],[],1299,332,2485,[],[],https://twitter.com/tuliogadelha/status/1163540290801754113,False,,0,,,,,,,,[],,,,
1160991767346450432,1160991767346450432,2019-08-12 16:09:42 -0300,2019-08-12,16:09:42,-300,71456987,tuliogadelha,Túlio Gadêlha,,"Um dia dpois da morte de Teori, a LJ já atuava nos bastidores p pressionar o STF e influenciar na escolha do substituto, usando movimentos de direita como laranjas. A cada dia fica mais evidente o caráter político dos coordenadores da operação. #VazaJato   https://t.co/9CHpaYBzaR",pt,[],['https://theintercept.com/2019/08/11/deltan-lava-jato-vemprarua-lobby-stf/'],[],54,57,411,['vazajato'],[],https://twitter.com/tuliogadelha/status/1160991767346450432,False,,0,,,,,,,,[],,,,
1159240518146166785,1159240518146166785,2019-08-07 20:10:51 -0300,2019-08-07,20:10:51,-300,71456987,tuliogadelha,Túlio Gadêlha,,A tentativa de transferência arbitrária do ex-presidente Lula para Tremembé em SP não tem cabimento até que o STF julgue a ação que questiona a atuação parcial de Sérgio Moro no processo que o condenou. Essa ofensiva não foi à toa. Todo bicho assustado ataca. Hoje vi o STF agir.,pt,[],[],[],175,112,1808,[],[],https://twitter.com/tuliogadelha/status/1159240518146166785,False,,0,,,,,,,,[],,,,
1159099671400333313,1159099671400333313,2019-08-07 10:51:11 -0300,2019-08-07,10:51:11,-300,71456987,tuliogadelha,Túlio Gadêlha,,Vivemos em um dos países mais desiguais do mundo e não cometerei a irresponsabilidade de votar a favor de uma reforma que irá agravar a desigualdade social no Brasil.  #naoareformadaprevidencia  https://t.co/z9DXrw4p2H,pt,[],[],[],1846,246,4056,['naoareformadaprevidencia'],[],https://twitter.com/tuliogadelha/status/1159099671400333313,False,,1,https://pbs.twimg.com/ext_tw_video_thumb/1159099585417097216/pu/img/dQorpoljm0gy054z.jpg,,,,,,,[],,,,
1158908695943757824,1158908695943757824,2019-08-06 22:12:19 -0300,2019-08-06,22:12:19,-300,71456987,tuliogadelha,Túlio Gadêlha,,"Após Bolsonaro atacar gratuitamente o presidente da OAB na semana passada, a Petrobras cancelou contratos o escritório do advogado. Além atacar a memória dos torturados e desaparecidos pela ditadura, Bolsonaro usa o Estado para perseguir seus familiares.  https://t.co/Plg5mT3BC0",pt,[],['https://www1.folha.uol.com.br/colunas/monicabergamo/2019/08/petrobras-cancela-contrato-com-presidente-da-oab.shtml'],[],63,107,919,[],[],https://twitter.com/tuliogadelha/status/1158908695943757824,False,,0,,,,,,,,[],,,,
1158398548322463744,1158398548322463744,2019-08-05 12:25:10 -0300,2019-08-05,12:25:10,-300,71456987,tuliogadelha,Túlio Gadêlha,,"O presidente se elegeu com o discurso de nova política, mas, durante os 28 anos em que esteve na Câmara, praticou a velha política de misturar o público com o privado, ou pior: com o familiar. As informações reveladas são graves e precisam ser investigadas  https://t.co/NVe4AN0X2H",pt,[],['https://oglobo.globo.com/brasil/em-28-anos-cla-bolsonaro-nomeou-102-pessoas-com-lacos-familiares-23837445'],[],65,95,720,[],[],https://twitter.com/tuliogadelha/status/1158398548322463744,False,,0,,,,,,,,[],,,,
1157041065616187398,1157041065616187398,2019-08-01 18:31:01 -0300,2019-08-01,18:31:01,-300,71456987,tuliogadelha,Túlio Gadêlha,,"Hoje nossa vitória pela defesa das terras indígenas foi no STF. Com atuação do PDT, Supremo suspende nova MP de Bolsonaro que transferia a Funai para o Ministério da Agricultura. Terra indígena é reparação histórica e fica no Ministério da Justiça.  https://t.co/H7yGCJf6ng",pt,[],[],['https://pbs.twimg.com/media/EA6itQKU4AAwscp.jpg'],28,51,551,[],[],https://twitter.com/tuliogadelha/status/1157041065616187398,False,,1,https://pbs.twimg.com/media/EA6itQKU4AAwscp.jpg,,,,,,,[],,,,
1155932646423142402,1155930640841187329,2019-07-29 17:06:33 -0300,2019-07-29,17:06:33,-300,71456987,tuliogadelha,Túlio Gadêlha,,"@dimacgarcia Bolsonaro mostra constantemente inabilidade de lidar com a condição humana. Seja nos seus projetos desmantelados, seja no trato de um assunto que fere gravemente à democracia.",pt,[],[],[],44,2,39,[],[],https://twitter.com/tuliogadelha/status/1155932646423142402,False,,0,,,,,,,,"[{'screen_name': 'dimacgarcia', 'name': 'Diego Garcia⚡🇧🇷', 'id': '835570202289012736'}]",,,,
1155930640841187329,1155930640841187329,2019-07-29 16:58:35 -0300,2019-07-29,16:58:35,-300,71456987,tuliogadelha,Túlio Gadêlha,,"O compromisso inarredável com a democracia e a solidariedade me unem a Felipe Santa Cruz. Com deboche, crueldade e falta de empatia, Bolsonaro reafirma sua incapacidade de governar, agride a dignidade humana e viola a Constituição do Brasil.  https://t.co/18ps5oCr07",pt,[],[],['https://pbs.twimg.com/media/EAqwyi1WkAAepuX.jpg'],744,95,1296,[],[],https://twitter.com/tuliogadelha/status/1155930640841187329,False,,1,https://pbs.twimg.com/media/EAqwyi1WkAAepuX.jpg,,,,,,,[],,,,
1154164249322774529,1154164249322774529,2019-07-24 19:59:35 -0300,2019-07-24,19:59:35,-300,71456987,tuliogadelha,Túlio Gadêlha,,"Acompanhem ao vivo o debate ""Quartas Trabalhistas"" sobre ""O desmonte do ensino superior"":   https://t.co/AWDfPi4Mtw  https://t.co/EbdW3vfnx1",pt,[],['https://www.facebook.com/flbap.pr/videos/654217868414521/'],['https://pbs.twimg.com/media/EARqQqrX4AAuX8p.jpg'],16,13,78,[],[],https://twitter.com/tuliogadelha/status/1154164249322774529,False,,1,https://pbs.twimg.com/media/EARqQqrX4AAuX8p.jpg,,,,,,,[],,,,
1154113996376682500,1154113996376682500,2019-07-24 16:39:53 -0300,2019-07-24,16:39:53,-300,71456987,tuliogadelha,Túlio Gadêlha,,"Pessoal, estamos hoje em Curitiba. Acompanhem a nossa entrevista ao vivo site Biarticulando:  https://t.co/orEKPtV4zO",pt,[],['https://www.facebook.com/biarticulando/videos/384487162201950/?__tn__=%2Cd%2CP-R&eid=ARB4dflLjFVt0zY-r2B3evTAPy3HMzm30MrW_Y7mOOSj8kaxemi1ls9YAQHqqZttguwUuT__V3TFptcF'],[],16,5,72,[],[],https://twitter.com/tuliogadelha/status/1154113996376682500,False,,0,,,,,,,,[],,,,
1153720208927920128,1153720208927920128,2019-07-23 14:35:07 -0300,2019-07-23,14:35:07,-300,71456987,tuliogadelha,Túlio Gadêlha,,"Seguimos em PoA. Depois de almoçar no Mercado Público Central e conversar com comerciantes locais, estamos ao vivo no programa Esfera Pública, da Rádio Guaíba. Acompanhem:  https://t.co/ExxcNCuxDP  https://t.co/HATtWTvb2I",pt,[],['https://www.facebook.com/radioguaibaoficial/videos/2329509860480901/'],['https://pbs.twimg.com/media/EALWaVQW4AA2sOO.jpg'],9,6,80,[],[],https://twitter.com/tuliogadelha/status/1153720208927920128,False,,1,https://pbs.twimg.com/media/EALWaVQW4AA2sOO.jpg,,,,,,,[],,,,
1153656927223734272,1153656927223734272,2019-07-23 10:23:40 -0300,2019-07-23,10:23:40,-300,71456987,tuliogadelha,Túlio Gadêlha,,"Pessoal, acompanhem nossa entrevista ao vivo ao programa Timeline, da Rádio Gaúcha (@GauchaZH):   https://t.co/e8jlYkAOba  https://t.co/l5ZNooC3AO",pt,[],['https://www.youtube.com/watch?v=UbgnOgCQu0A&list=PLMGSJ-QZmFXjxBGNduPcShI8VVL8-rcZt'],['https://pbs.twimg.com/media/EAKc219XYAQUCbX.jpg'],8,3,54,[],[],https://twitter.com/tuliogadelha/status/1153656927223734272,False,,1,https://pbs.twimg.com/media/EAKc219XYAQUCbX.jpg,,,,,,,[],,,,
1152587821225521157,1152587821225521157,2019-07-20 11:35:25 -0300,2019-07-20,11:35:25,-300,71456987,tuliogadelha,Túlio Gadêlha,,"A fome de mais de 5 milhões de pessoas no Brasil não incomoda Bolsonaro. Cada medida desse governo só aumenta a desigualdade, a fome. Bolsonaro não conhece o Brasil.    https://t.co/ab6nCL0X5M",pt,[],['https://bit.ly/2Z5Yq2Y'],[],2719,276,2010,[],[],https://twitter.com/tuliogadelha/status/1152587821225521157,False,,0,,,,,,,,[],,,,
1151169130537598977,1151169130537598977,2019-07-16 13:38:03 -0300,2019-07-16,13:38:03,-300,71456987,tuliogadelha,Túlio Gadêlha,,"Cachê extra e férias no Beach Park por uma palestra. A cada revelação da #VazaJato, fica mais insustentável essa conversa do suposto “hacker”, que, aliás, não exclui o comportamento antiético e imoral dessas autoridades.   https://t.co/zKLjxLWL6V",pt,[],['https://www1.folha.uol.com.br/amp/colunas/monicabergamo/2019/07/dallagnol-pede-passagem-e-hotel-para-ferias-da-familia-no-beach-park.shtml'],[],83,42,427,['vazajato'],[],https://twitter.com/tuliogadelha/status/1151169130537598977,False,,0,,,,,,,,[],,,,
1150784278013403136,1150784278013403136,2019-07-15 12:08:47 -0300,2019-07-15,12:08:47,-300,71456987,tuliogadelha,Túlio Gadêlha,,"Depois de liberar emendas parlamentares ($) para aprovar a reforma da Previdência, o governo entra na segunda fase do toma lá dá cá: a distribuição de cargos. Essa é a nova política de Bolsonaro.  https://t.co/AXBqz2OPsK",pt,[],"['https://politica.estadao.com.br/noticias/geral,governo-vai-destravar-distribuicao-de-cargos,70002922073']",[],44,97,521,[],[],https://twitter.com/tuliogadelha/status/1150784278013403136,False,,0,,,,,,,,[],,,,
1149444553449136130,1149444553449136130,2019-07-11 19:25:11 -0300,2019-07-11,19:25:11,-300,71456987,tuliogadelha,Túlio Gadêlha,,"Bolsonaro disse que escolheria um ministro do STF “terrivelmente evangélico”. Fui ao dicionário. Terrivelmente: advérbio de modo. De maneira terrível; de forma horrível, cruel ou desalmada; de modo perverso, severo ou desumano. #medo",pt,[],[],[],4833,271,1697,['medo'],[],https://twitter.com/tuliogadelha/status/1149444553449136130,False,,0,,,,,,,,[],,,,
1149435047541432321,1149435047541432321,2019-07-11 18:47:25 -0300,2019-07-11,18:47:25,-300,71456987,tuliogadelha,Túlio Gadêlha,,"Mônica, 55 anos, é professora e mãe de Nati. Ela se aposentaria aos 62, com R$ 2.000 (valor integral) - mesmo valor da pensão de Nati. Com a “Nova Previdência”, se Mônica se aposentar aos 62, terá R$ 1.120. A pensão de Nati será de R$ 672. Para Bolsonaro, elas são privilegiadas.",pt,[],[],[],131,510,1710,[],[],https://twitter.com/tuliogadelha/status/1149435047541432321,False,,0,,,,,,,,[],,,,
1148945830625366016,1148945830625366016,2019-07-10 10:23:27 -0300,2019-07-10,10:23:27,-300,71456987,tuliogadelha,Túlio Gadêlha,,Que notícia triste. Vivemos em tempos sombrios e a morte do jornalista Paulo Henrique Amorim nos deixa órfão de uma das vozes mais ácidas e inquietas do jornalismo brasileiro. Toda solidariedade aos amigos e familiares. “Nosso amigo navegante” fará falta.,pt,[],[],[],154,308,4785,[],[],https://twitter.com/tuliogadelha/status/1148945830625366016,False,,0,,,,,,,,[],,,,
1148656424425271296,1148656424425271296,2019-07-09 15:13:27 -0300,2019-07-09,15:13:27,-300,71456987,tuliogadelha,Túlio Gadêlha,,O Brasil não gerou empregos depois da Reforma Trabalhista. A economia não cresceu com a PEC do Teto. Agora vamos ver o que eles dizem que vai melhorar com essa Reforma da Previdência... #ConversaMole #EssaReformaNão,pt,[],[],[],3179,300,1904,"['conversamole', 'essareformanão']",[],https://twitter.com/tuliogadelha/status/1148656424425271296,False,,0,,,,,,,,[],,,,
1148254249161302016,1148254249161302016,2019-07-08 12:35:21 -0300,2019-07-08,12:35:21,-300,71456987,tuliogadelha,Túlio Gadêlha,,"Em meio à #VazaJato, o ministro da Justiça vai tirar licença para “tratar de assuntos particulares”. Estamos de olho para que o recesso não seja uma coincidente senha aos subordinados para ofensivas contra jornalistas.",pt,[],[],[],1157,174,1781,['vazajato'],[],https://twitter.com/tuliogadelha/status/1148254249161302016,False,,0,,,,,,,,[],,,,
1146262313802092544,1146262313802092544,2019-07-03 00:40:06 -0300,2019-07-03,00:40:06,-300,71456987,tuliogadelha,Túlio Gadêlha,,Um debate personalista e uma confusão. Era tudo que Moro queria. Moro aproveitou e vazou. #vazajato #sergiomoro #justiça  https://t.co/R3Oy2T4sK5,pt,[],['https://www.instagram.com/p/BzcI553HpKB/?igshid=xxidbo3mdhqq'],[],1130,50,826,"['vazajato', 'sergiomoro', 'justiça']",[],https://twitter.com/tuliogadelha/status/1146262313802092544,False,,0,,,,,,,,[],,,,
1146075546008391681,1146075546008391681,2019-07-02 12:17:57 -0300,2019-07-02,12:17:57,-300,71456987,tuliogadelha,Túlio Gadêlha,,"E se tivéssemos aulas de história nas ruas, parques e praças em todas as cidades do Brasil? Parabéns historiaaoarlivre Revolução em forma de aula.  https://t.co/9G2KxN2OIC",pt,[],['https://www.instagram.com/p/Bza0rVKnEbl/?igshid=1h09fwyro9ue0'],[],79,60,1391,[],[],https://twitter.com/tuliogadelha/status/1146075546008391681,False,,0,,,,,,,,[],,,,
1146056699129679877,1146056699129679877,2019-07-02 11:03:04 -0300,2019-07-02,11:03:04,-300,71456987,tuliogadelha,Túlio Gadêlha,,Acompanhem ao vivo a análise de @cirogomes #ObservatórioTrabalhista   https://t.co/JrMIvzxU5f,pt,"[{'screen_name': 'cirogomes', 'name': 'ciro gomes', 'id': '33374761'}]",['https://www.facebook.com/pdt.org.br/videos/389916041637586/'],[],16,9,51,['observatóriotrabalhista'],[],https://twitter.com/tuliogadelha/status/1146056699129679877,False,,0,,,,,,,,[],,,,
1145739929869258754,1145739929869258754,2019-07-01 14:04:20 -0300,2019-07-01,14:04:20,-300,71456987,tuliogadelha,Túlio Gadêlha,,Seis meses de governo Bolsonaro. E os feitos foram:  - propôs o fim da tomada de 3 pinos; - acabou com o horário de verão; - liberou 239 agrotóxicos; - propôs o fim da multa para quem não usa cadeirinhas; - 7 decretos de armas; - propôs tirar a demarcação de terras da Funai.,pt,[],[],[],7338,13646,51424,[],[],https://twitter.com/tuliogadelha/status/1145739929869258754,False,,0,,,,,,,,[],,,,
1144948076794253312,1144948076794253312,2019-06-29 09:37:48 -0300,2019-06-29,09:37:48,-300,71456987,tuliogadelha,Túlio Gadêlha,,"Pasmem! Até os promotores da Lava Jato não compactuavam com as transgressões éticas de Moro, um juiz contaminado por interesses políticos. Se nem quem estava do lado de Moro na acusação não confiava nele, quem confiará?  https://t.co/4qKmK3Rd4P",pt,[],[],['https://pbs.twimg.com/media/D-OsLoyWsAAfIme.jpg'],224,182,1476,[],[],https://twitter.com/tuliogadelha/status/1144948076794253312,False,,1,https://pbs.twimg.com/media/D-OsLoyWsAAfIme.jpg,,,,,,,[],,,,
1144937100674052098,1144937100674052098,2019-06-29 08:54:11 -0300,2019-06-29,08:54:11,-300,71456987,tuliogadelha,Túlio Gadêlha,,"Pasmem! Até os promotores da Lava Jato não compactuavam com as transgressões éticas de Moro, um juiz contaminado por interesses políticos. Se nem quem estava do lado de Moro na acusação não confiava nele, quem…  https://t.co/5WAZ0GAWWw",pt,[],['https://www.instagram.com/p/BzSu-TGnDAF/?igshid=dgresuk9uke8'],[],65,62,781,[],[],https://twitter.com/tuliogadelha/status/1144937100674052098,False,,0,,,,,,,,[],,,,
1144701863486545922,1144701863486545922,2019-06-28 17:19:26 -0300,2019-06-28,17:19:26,-300,71456987,tuliogadelha,Túlio Gadêlha,"{'type': 'Point', 'coordinates': [-8.0605, -34.9257]}","Fomentar inovação e empreendedorismo através de soluções criativas e impacto social! .  Hoje estive como jurado no Estação Hack edição Recife, promovido pelo Facebook. Eu, João Campos e mais 4 jurados tivemos a…  https://t.co/J0WBitrDgN",pt,[],['https://www.instagram.com/p/BzRD_xfHxIM/?igshid=kuv6d1ncn0s8'],[],14,3,63,[],[],https://twitter.com/tuliogadelha/status/1144701863486545922,False,,0,,,,,,,,[],,,,
1144338999584206856,1144338999584206856,2019-06-27 17:17:32 -0300,2019-06-27,17:17:32,-300,71456987,tuliogadelha,Túlio Gadêlha,,"Segundo o Ibope, 51% dos entrevistados disseram não confiar em Bolsonaro e 48% desaprovam sua forma de governar. Esses números são o retrato de um desgoverno, da inversão de prioridades e da falta de projetos.   https://t.co/7jquoX9Qrs",pt,[],['https://oglobo.globo.com/brasil/avaliacao-negativa-do-governo-bolsonaro-sobe-cinco-pontos-vai-de-27-para-32-aponta-ibope-23768180'],[],1750,85,774,[],[],https://twitter.com/tuliogadelha/status/1144338999584206856,False,,0,,,,,,,,[],,,,
1144263645075054593,1144263645075054593,2019-06-27 12:18:07 -0300,2019-06-27,12:18:07,-300,71456987,tuliogadelha,Túlio Gadêlha,,"O ministro Weintraub mostra, mais uma vez, que não tem Educação e nem respeito. Faz piada com um fato gravíssimo: um avião presidencial transportando drogas para outro país, o que significa tráfico internacional de drogas. Piada sem graça, sem respeito, sem noção.",pt,[],[],[],78,214,2641,[],[],https://twitter.com/tuliogadelha/status/1144263645075054593,False,,0,,,,,,,,[],,,,
1144005031794028545,1144005031794028545,2019-06-26 19:10:28 -0300,2019-06-26,19:10:28,-300,71456987,tuliogadelha,Túlio Gadêlha,,Nem Pablo Escobar... #39kg,pt,[],[],[],81,139,1440,['39kg'],[],https://twitter.com/tuliogadelha/status/1144005031794028545,False,,0,,,,,,,,[],,,,
1143605380595036161,1143605380595036161,2019-06-25 16:42:24 -0300,2019-06-25,16:42:24,-300,71456987,tuliogadelha,Túlio Gadêlha,,Acompanhem ao vivo a audiência pública com o jornalista Glenn Greenwald na Comissão de Direitos Humanos e Minorias sobre a #VazaJato   https://t.co/VvkOyDKnit,pt,[],['https://www.facebook.com/TulioGadelhaOficial/videos/309495439931263/'],[],43,8,125,['vazajato'],[],https://twitter.com/tuliogadelha/status/1143605380595036161,False,,0,,,,,,,,[],,,,
1143565847321088000,1143565847321088000,2019-06-25 14:05:19 -0300,2019-06-25,14:05:19,-300,71456987,tuliogadelha,Túlio Gadêlha,,"Hoje o programa dela completa 7 anos. E não faltam grandes histórias de superação, de ousadia, de empoderamento, de alerta, de amor, de representatividade. . Tenho muito orgulho dela não só pelas escolhas que fez e…  https://t.co/tz4LyjHW2x",pt,[],['https://www.instagram.com/p/BzI_ZkDHE4R/?igshid=16q60xpf0mv65'],[],26,9,245,[],[],https://twitter.com/tuliogadelha/status/1143565847321088000,False,,0,,,,,,,,[],,,,
