id,conversation_id,created_at,date,time,timezone,user_id,username,name,place,tweet,language,mentions,urls,photos,replies_count,retweets_count,likes_count,hashtags,cashtags,link,retweet,quote_url,video,thumbnail,near,geo,source,user_rt_id,user_rt,retweet_id,reply_to,retweet_date,translate,trans_src,trans_dest
1524044503467835393,1524044503467835393,2022-05-10 12:11:39 -03,2022-05-10,12:11:39,-300,71456987,tuliogadelha,Túlio Gadêlha,,"R$ 6.754 é o mínimo necessário para uma família de quatro pessoas viver com dignidade. Despesas com saúde, moradia, transporte, educação, alimentação, higiene, lazer, vestuário, etc. Isso mesmo, no Brasil atual, o salário mínimo deveria ser o quíntuplo.  https://t.co/GObD424r54",pt,[],['https://www.metropoles.com/brasil/salario-minimo-ideal-para-abril-seria-de-r-6-75433-diz-dieese?amp'],[],0,8,50,[],[],https://twitter.com/tuliogadelha/status/1524044503467835393,False,,0,,,,,,,,[],,,,
1521563707788169217,1521563707788169217,2022-05-03 15:53:51 -03,2022-05-03,15:53:51,-300,71456987,tuliogadelha,Túlio Gadêlha,,"Em 10 anos, triplicou o tempo de espera p INSS liberar benefícios. Aposentadorias, demissões, falta de novos concursos. Só nos últimos 6 anos, se foram, mais de 20 mil servidores, caindo de 38 para 18 mil na ativa. Precarizar para privatizar. Essa é a lógica de Bolsonaro",pt,[],[],[],30,16,218,[],[],https://twitter.com/tuliogadelha/status/1521563707788169217,False,,0,,,,,,,,[],,,,
1519868822789967872,1519868822789967872,2022-04-28 23:38:59 -03,2022-04-28,23:38:59,-300,71456987,tuliogadelha,Túlio Gadêlha,,Uma terapia ajuda. Vai por mim. O jogo acabou e o povo tá triste e brigado. Não dá né. Vai pro Congresso fiscalizar Bolsonaro e debater com bolsonarista todo dia pra tu ver. Isso sim acaba com a sanidade mental de qualquer um! rsrs Valeu #bbb22 #foraBolsonaro,pt,[],[],[],43,38,764,"['bbb22', 'forabolsonaro']",[],https://twitter.com/tuliogadelha/status/1519868822789967872,False,,0,,,,,,,,[],,,,
1519768383738322946,1519768383738322946,2022-04-28 16:59:53 -03,2022-04-28,16:59:53,-300,71456987,tuliogadelha,Túlio Gadêlha,,Caiu na Rede é Lula! Somos o primeiro partido fora da federação do PT à formalizar apoio à Lula. Hoje entregamos algumas de nossas propostas centrais para o futuro programa de governo. Vamos unir forças para vencer Bolsonaro e o bolsonarismo no Brasil.  https://t.co/zJWTqcUn5o,pt,[],[],"['https://pbs.twimg.com/media/FRdNSatXsAQp0Vv.jpg', 'https://pbs.twimg.com/media/FRdNSalWYAAe-36.jpg', 'https://pbs.twimg.com/media/FRdNSalXEAE5Z83.jpg', 'https://pbs.twimg.com/media/FRdNSajXoAMrrA3.jpg']",696,943,10758,[],[],https://twitter.com/tuliogadelha/status/1519768383738322946,False,,1,https://pbs.twimg.com/media/FRdNSatXsAQp0Vv.jpg,,,,,,,[],,,,
1519173091628306433,1519173091628306433,2022-04-27 01:34:24 -03,2022-04-27,01:34:24,-300,71456987,tuliogadelha,Túlio Gadêlha,,"Arthur jogou o jogo. Ganhou sem robôs ou fake news. Diferente de Bolsonaro, que vendeu a alma ao capeta para ganhar as eleições. Mas em 2022 vai ser diferente. O TSE tá de olho. Não vai ter esquema. É o teu fim, Bolsonaro. #bbb22 #ForaBolsonaro",pt,[],[],[],330,79,1156,"['bbb22', 'forabolsonaro']",[],https://twitter.com/tuliogadelha/status/1519173091628306433,False,,0,,,,,,,,[],,,,
1518430958537654272,1518430958537654272,2022-04-25 00:25:26 -03,2022-04-25,00:25:26,-300,71456987,tuliogadelha,Túlio Gadêlha,,"Rapaz, P.A. e D.G. são caras humanos, sensíveis, que choram, abraçam, acreditam nas relações que constroem. Homens modernos que se entregam aos sentimentos. Até metade da edição torci para o Arthur, agora, já não sei mais. Só sei que #BolsonaroNuncaMais #bbb22",pt,[],[],[],87,50,1601,"['bolsonaronuncamais', 'bbb22']",[],https://twitter.com/tuliogadelha/status/1518430958537654272,False,,0,,,,,,,,[],,,,
1518327826906333185,1518327826906333185,2022-04-24 17:35:37 -03,2022-04-24,17:35:37,-300,71456987,tuliogadelha,Túlio Gadêlha,,"Macron será reeleito na França. É o que apontam as projeções. A extrema direita perderá com diferença de 16%. Bons ventos sopram no ocidente. Que assim seja, em outubro, no Brasil. #foraBolsonaro    https://t.co/EPDCpnsLmb",pt,[],['https://www.lemonde.fr/politique/live/2022/04/24/election-presidentielle-2022-en-direct-la-france-n-est-pas-ideale-mais-on-y-vit-quand-meme-pas-mal_6123433_823448.html'],[],9,8,183,['forabolsonaro'],[],https://twitter.com/tuliogadelha/status/1518327826906333185,False,,0,,,,,,,,[],,,,
1516607051765534726,1516607051765534726,2022-04-19 23:37:52 -03,2022-04-19,23:37:52,-300,71456987,tuliogadelha,Túlio Gadêlha,,"Gustavo chegou causando polêmica e foi eliminado com 81,5% dos votos. Conheço alguém parecido no governo federal. Esse ano ele vaza! #foraBolsonaro #BBB22",pt,[],[],[],63,25,898,"['forabolsonaro', 'bbb22']",[],https://twitter.com/tuliogadelha/status/1516607051765534726,False,,0,,,,,,,,[],,,,
1516453980959920129,1516453980959920129,2022-04-19 13:29:38 -03,2022-04-19,13:29:38,-300,71456987,tuliogadelha,Túlio Gadêlha,,"Já pensou se o Brasil tivesse na presidência da Câmara uma mulher indígena? Esse dia chegará! A foto é da sessão solene de hoje, ao lado de @JoeniaWapichana em homenagem ao Dia Dos Povos Indígenas. #19abril  https://t.co/XcER316i5M",pt,"[{'screen_name': 'joeniawapichana', 'name': 'joenia wapichana', 'id': '1091313179152576512'}]",[],['https://pbs.twimg.com/media/FQuG21vWYAAZyRV.jpg'],6,9,140,['19abril'],[],https://twitter.com/tuliogadelha/status/1516453980959920129,False,,1,https://pbs.twimg.com/media/FQuG21vWYAAZyRV.jpg,,,,,,,[],,,,
1515095110454812673,1515095110454812673,2022-04-15 19:29:58 -03,2022-04-15,19:29:58,-300,71456987,tuliogadelha,Túlio Gadêlha,,"Melhor definição para um governo inábil, desastrado, confuso e que não respeita regras. #ForaBolsonaro  https://t.co/nGFjr5jwqm",pt,[],[],[],7,2,41,['forabolsonaro'],[],https://twitter.com/tuliogadelha/status/1515095110454812673,False,,1,https://pbs.twimg.com/ext_tw_video_thumb/1515095063080185867/pu/img/sLeHqMS79__R7ftS.jpg,,,,,,,[],,,,
1514077487931834370,1514077487931834370,2022-04-13 00:06:17 -03,2022-04-13,00:06:17,-300,71456987,tuliogadelha,Túlio Gadêlha,,"Nath sempre protegeu o Eli e no fim ele vira as costas pra ela por uma cabeça de polvo. Criou polêmica e se afastou qndo ela mais precisava: quando estava no paredão. Na política tem muita figura querendo colar em Lula, mas que apoiou o golpe em 2016. O mundo dá voltas. #bbb22",pt,[],[],[],72,30,801,['bbb22'],[],https://twitter.com/tuliogadelha/status/1514077487931834370,False,,0,,,,,,,,[],,,,
1513346608846487552,1513346608846487552,2022-04-10 23:42:02 -03,2022-04-10,23:42:02,-300,71456987,tuliogadelha,Túlio Gadêlha,,"Torci por Lina nesse paredão. Não foi dessa vez. Lina sai e deixa um legado. De respeito, de solidariedade, de força.  Já Bolsonaro só deixou ódio, ignorância e intolerância. Vem pra cá Lina! Vamos construir um Brasil melhor! #bbb22 #ForaBolsonaro",pt,[],[],[],61,36,1176,"['bbb22', 'forabolsonaro']",[],https://twitter.com/tuliogadelha/status/1513346608846487552,False,,0,,,,,,,,[],,,,
1511682676679393289,1511682676679393289,2022-04-06 09:30:10 -03,2022-04-06,09:30:10,-300,71456987,tuliogadelha,Túlio Gadêlha,,"Bolsonaro vetou  a Lei Paulo Gustavo que destinaria R$ 3,8 bilhões ao setor cultural, um dos mais afetados com a pandemia. Parece que esse governo só tem dinheiro para orçamento secreto, superfaturamento de ônibus e pagamento de propina para pastores. Derrubaremos esse veto!",pt,[],[],[],27,26,349,[],[],https://twitter.com/tuliogadelha/status/1511682676679393289,False,,0,,,,,,,,[],,,,
1511538606397087746,1511538606397087746,2022-04-05 23:57:41 -03,2022-04-05,23:57:41,-300,71456987,tuliogadelha,Túlio Gadêlha,,Arthur no quarto secreto será o grande acontecimento da temporada.  Dia mais esperado só Bolsonaro na cadeia. #bbb22 #forabolsonaro,pt,[],[],[],44,40,810,"['bbb22', 'forabolsonaro']",[],https://twitter.com/tuliogadelha/status/1511538606397087746,False,,0,,,,,,,,[],,,,
1511386672113623043,1511386670616268804,2022-04-05 13:53:57 -03,2022-04-05,13:53:57,-300,71456987,tuliogadelha,Túlio Gadêlha,,"O pregão prevê o pagamento de até R$ 480 mil por veículo, apesar de os técnicos do FNDE terem definido um valor máximo de R$ 270,6 mil. A quem interessa o sobrepreço dos ônibus escolares?",pt,[],[],[],1,3,49,[],[],https://twitter.com/tuliogadelha/status/1511386672113623043,False,,0,,,,,,,,[],,,,
1511386670616268804,1511386670616268804,2022-04-05 13:53:57 -03,2022-04-05,13:53:57,-300,71456987,tuliogadelha,Túlio Gadêlha,,Corrupção no governo Bolsonaro! TCU suspende licitação do FNDE para compra de ônibus escolares por suspeita de superfaturamento. Cabe lembrar: o ex-chefe de gabinete do Ministro Ciro Nogueira (PP) é o atual presidente do FNDE.,pt,[],[],[],6,9,124,[],[],https://twitter.com/tuliogadelha/status/1511386670616268804,False,,0,,,,,,,,[],,,,
1510698869025296387,1510698869025296387,2022-04-03 16:20:52 -03,2022-04-03,16:20:52,-300,71456987,tuliogadelha,Túlio Gadêlha,,"Há 50 anos, ela canta e encanta Petrolina e região com sua arte. Agora, conquistou o Brasil e venceu o #thevoicemais. Parabéns @vera_de_maria_maga! Orgulho de Pernambuco e do Brasil. Valeu @tonigarrido!  https://t.co/wSJR1DspF3",pt,"[{'screen_name': 'tonigarrido', 'name': 'toni garrido 💣', 'id': '176590203'}]",[],"['https://pbs.twimg.com/media/FPcUnOOXIAcTWyQ.jpg', 'https://pbs.twimg.com/media/FPcUnOEXEAEwprp.jpg']",2,5,183,['thevoicemais'],[],https://twitter.com/tuliogadelha/status/1510698869025296387,False,,1,https://pbs.twimg.com/media/FPcUnOOXIAcTWyQ.jpg,,,,,,,[],,,,
1509538752246558720,1509538752246558720,2022-03-31 11:30:59 -03,2022-03-31,11:30:59,-300,71456987,tuliogadelha,Túlio Gadêlha,,"Agora é oficial! Somos da @Rede_18 Simbora! Só em Pernambuco já temos 50 bons candidatos p as eleições deste ano. Bora crescer a bancada, fazer a boa política, com causas, com luta e sem Bolsonaro! Obg pelo acolhimento @randolfeap @MarinaSilva @JoeniaWapichana @_Heloisa_Helena  https://t.co/ALf6Emt69a",pt,"[{'screen_name': 'rede_18', 'name': 'rede 18', 'id': '1151011908'}, {'screen_name': 'randolfeap', 'name': 'randolfe rodrigues 💉👓', 'id': '85327394'}, {'screen_name': 'marinasilva', 'name': 'marina silva', 'id': '105155795'}, {'screen_name': 'joeniawapichana', 'name': 'joenia wapichana', 'id': '1091313179152576512'}, {'screen_name': '_heloisa_helena', 'name': 'heloisa helena', 'id': '165499618'}]",[],['https://pbs.twimg.com/media/FPL1farX0Agmkxx.jpg'],86,33,913,[],[],https://twitter.com/tuliogadelha/status/1509538752246558720,False,,1,https://pbs.twimg.com/media/FPL1farX0Agmkxx.jpg,,,,,,,[],,,,
1509525817637814277,1509525817637814277,2022-03-31 10:39:35 -03,2022-03-31,10:39:35,-300,71456987,tuliogadelha,Túlio Gadêlha,,"Há 58 anos acontecia o golpe militar no Brasil. Congresso tomado, imprensa censurada, inocentes mortos, mtos desaparecidos até hoje. Ainda há quem celebre a didatura. Infelizmente ainda precisamos estar atentos àqueles que ainda flertam com tempos tão sombrios. #didaturanuncamais",pt,[],[],[],13,28,222,['didaturanuncamais'],[],https://twitter.com/tuliogadelha/status/1509525817637814277,False,,0,,,,,,,,[],,,,
1506464697880612871,1506464697880612871,2022-03-22 23:55:47 -03,2022-03-22,23:55:47,-300,71456987,tuliogadelha,Túlio Gadêlha,,"Laís saiu. Alguma surpresa? Em outubro é a vez de Bolsonaro surpreender zero pessoas, descendo a rampa do planalto.  Obrigado Laís, por nos entreter. Já Bolsonaro, só nos trouxe coisa ruim. Não quero ver nem pintado com 1kg de ouro do pastor. #ForaBolsonaro  #BBB22",pt,[],[],[],95,96,1534,"['forabolsonaro', 'bbb22']",[],https://twitter.com/tuliogadelha/status/1506464697880612871,False,,0,,,,,,,,[],,,,
1506274709847134209,1506274709847134209,2022-03-22 11:20:50 -03,2022-03-22,11:20:50,-300,71456987,tuliogadelha,Túlio Gadêlha,,"Acabamos de protocolar a convocação do Ministro da Educação para responder sobre as graves revelações dos áudios que evidenciam favorecimento ilícito a pastores que atuam no MEC. Além disso, também acionamos a PGR. É estarrecedor! Provas não faltam. Vamos tirar esses caras daí!  https://t.co/mucgA21o48",pt,[],[],[],21,16,173,[],[],https://twitter.com/tuliogadelha/status/1506274709847134209,False,,1,https://pbs.twimg.com/ext_tw_video_thumb/1506274672022855694/pu/img/27xzfq4u-ukiXgCa.jpg,,,,,,,[],,,,
1505745200962019328,1505745200962019328,2022-03-21 00:16:45 -03,2022-03-21,00:16:45,-300,71456987,tuliogadelha,Túlio Gadêlha,,"Essa prova de bate e volta tá parecendo o governo Bolsonaro. Erro atrás de erro, nada avança. Parece que não tem fim. #bbb22 #ForaBolsonaro",pt,[],[],[],61,52,1009,"['bbb22', 'forabolsonaro']",[],https://twitter.com/tuliogadelha/status/1505745200962019328,False,,0,,,,,,,,[],,,,
1504660329048989702,1504660329048989702,2022-03-18 00:25:52 -03,2022-03-18,00:25:52,-300,71456987,tuliogadelha,Túlio Gadêlha,,Arthur com colar de líder. O cara é forte e tá no comando. É que nem Lula com a caneta de presidente. Já pensou? #BoraArthur #ForaBolsonaro,pt,[],[],[],252,83,1608,"['boraarthur', 'forabolsonaro']",[],https://twitter.com/tuliogadelha/status/1504660329048989702,False,,0,,,,,,,,[],,,,
1503927888332087297,1503927888332087297,2022-03-15 23:55:24 -03,2022-03-15,23:55:24,-300,71456987,tuliogadelha,Túlio Gadêlha,,Em outubro vai ser assim:  https://t.co/eOGveDrKce,pt,[],[],['https://pbs.twimg.com/media/FN8GcRpWYAMVeAO.jpg'],359,1394,9695,[],[],https://twitter.com/tuliogadelha/status/1503927888332087297,False,,1,https://pbs.twimg.com/media/FN8GcRpWYAMVeAO.jpg,,,,,,,[],,,,
1503203267584704514,1503203267584704514,2022-03-13 23:56:01 -03,2022-03-13,23:56:01,-300,71456987,tuliogadelha,Túlio Gadêlha,,"Arthur sugeriu, mas Scooby não quis combinar o jogo. Resolveu votar com o coração. Resultado: o grupo se dividiu, desperdiçou o voto e foi parar no paredão. Lula e Ciro precisam combinar o jogo. Aí a vitória vem no primeiro turno. #ForaBolsonaro #bbb22",pt,[],[],[],346,163,2917,"['forabolsonaro', 'bbb22']",[],https://twitter.com/tuliogadelha/status/1503203267584704514,False,,0,,,,,,,,[],,,,
1501399592029589511,1501399592029589511,2022-03-09 00:28:52 -03,2022-03-09,00:28:52,-300,71456987,tuliogadelha,Túlio Gadêlha,,Jadeu. #ForaBolsonaro,pt,[],[],[],90,157,1332,['forabolsonaro'],[],https://twitter.com/tuliogadelha/status/1501399592029589511,False,,0,,,,,,,,[],,,,
1501381117953331202,1501381117953331202,2022-03-08 23:15:27 -03,2022-03-08,23:15:27,-300,71456987,tuliogadelha,Túlio Gadêlha,,"Olha Laís se acertando com Arthur. Tá preparando o terreno pra saída de Jade. Não quer ficar isolada. Parece até o centrão se chegando em Lula, certo do fim de Bolsonaro.  https://t.co/lNe6D09ze5",pt,[],[],['https://pbs.twimg.com/media/FNX6KtxXsAIaJD0.jpg'],116,97,1583,[],[],https://twitter.com/tuliogadelha/status/1501381117953331202,False,,1,https://pbs.twimg.com/media/FNX6KtxXsAIaJD0.jpg,,,,,,,[],,,,
1501307454562484225,1501307454562484225,2022-03-08 18:22:44 -03,2022-03-08,18:22:44,-300,71456987,tuliogadelha,Túlio Gadêlha,,"Bolsonaro, q vetou o programa de distribuição de absorventes, hj resolveu assinar decreto sobre a mesma proposta, reduzindo o alcance do projeto. Acha q nos engana. Quinta vamos derrubar o veto 59 e garantir absorventes p + de 5 milhões de mulheres em situação de vulnerabilidade.",pt,[],[],[],39,18,382,[],[],https://twitter.com/tuliogadelha/status/1501307454562484225,False,,0,,,,,,,,[],,,,
1501298974002532353,1501298974002532353,2022-03-08 17:49:02 -03,2022-03-08,17:49:02,-300,71456987,tuliogadelha,Túlio Gadêlha,,"Aqui no Recife foi massa! A Av. Conde da Boa Vista foi tomada por profissionais da enfermagem no ato pela aprovação do #PL2564. Está na hora de pautar o projeto, @ArthurLira_ . Mais de 1 milhão de brasileiras e brasileiros estão na luta por um piso salarial digno! #AprovaPL2564  https://t.co/GDvilSIS75",pt,"[{'screen_name': 'arthurlira_', 'name': 'arthur lira', 'id': '1086390169970884613'}]",[],['https://pbs.twimg.com/media/FNWvdI6XIAspfbC.jpg'],16,18,119,"['pl2564', 'aprovapl2564']",[],https://twitter.com/tuliogadelha/status/1501298974002532353,False,,1,https://pbs.twimg.com/media/FNWvdI6XIAspfbC.jpg,,,,,,,[],,,,
1500678371558277120,1500678371558277120,2022-03-07 00:42:59 -03,2022-03-07,00:42:59,-300,71456987,tuliogadelha,Túlio Gadêlha,,"Rapaz, se Jade for embora acaba a polarização e Arthur perde a força. Assim como, se Bolsonaro desistir da disputa em outubro, a terceira via crescerá. #bbb22 #forabolsonaro",pt,[],[],[],310,36,1093,"['bbb22', 'forabolsonaro']",[],https://twitter.com/tuliogadelha/status/1500678371558277120,False,,0,,,,,,,,[],,,,
1500296896488820740,1500296896488820740,2022-03-05 23:27:08 -03,2022-03-05,23:27:08,-300,71456987,tuliogadelha,Túlio Gadêlha,,"Jade teve coragem, resolveu enfrentar Arthur. Diferente de Bolsonaro, frouxo, fugiu dos debates, arregou. Com essas duas potências no paredão, deu até pena da terceira via. #forabolsonaro #bbb22",pt,[],[],[],148,63,1487,"['forabolsonaro', 'bbb22']",[],https://twitter.com/tuliogadelha/status/1500296896488820740,False,,0,,,,,,,,[],,,,
1500150011446931462,1500150011446931462,2022-03-05 13:43:28 -03,2022-03-05,13:43:28,-300,71456987,tuliogadelha,Túlio Gadêlha,,"É degradante e desonroso. É de uma profunda vergonha ouvir os áudios sexistas e machistas vazados do Dep Arthur do Val – Mamãe Falei, com comentários absurdos sobre as mulheres na Ucrânia. É de perder a esperança na humanidade Que o conselho de ética casse o mandato desse cidadão",pt,[],[],[],16,16,427,[],[],https://twitter.com/tuliogadelha/status/1500150011446931462,False,,0,,,,,,,,[],,,,
1498855930829680645,1498855930829680645,2022-03-02 00:01:15 -03,2022-03-02,00:01:15,-300,71456987,tuliogadelha,Túlio Gadêlha,,"Larissa saiu. Ela pode até ser atrapalhada, ansiosa e ter feito as alianças erradas. Mas é um ser humano de verdade. Jogou com o coração. Já Bolsonaro é ignorante, insensível, incompetente, covarde e desequilibrado. Um ser humano desprezível. #bbb22 #forabolsonaro",pt,[],[],[],207,125,1972,"['bbb22', 'forabolsonaro']",[],https://twitter.com/tuliogadelha/status/1498855930829680645,False,,0,,,,,,,,[],,,,
1498126778350637059,1498126778350637059,2022-02-27 23:43:52 -03,2022-02-27,23:43:52,-300,71456987,tuliogadelha,Túlio Gadêlha,,"Abravanel foi inteligente. Percebeu que não sabia jogar, que ia pro paredão e pediu pra sair. Com Bolsonaro não é diferente. Não sabe governar e vai ser eliminado em outubro. Podia fazer o mesmo. Né não? #ForaBolsonaro",pt,[],[],[],1351,131,2082,['forabolsonaro'],[],https://twitter.com/tuliogadelha/status/1498126778350637059,False,,0,,,,,,,,[],,,,
1496688356910063634,1496688356910063634,2022-02-24 00:28:06 -03,2022-02-24,00:28:06,-300,71456987,tuliogadelha,Túlio Gadêlha,,"Enquanto o Brasil das ""safras recordes"" enfrenta a fome e a inflação, deputados empresários se empenham em defender projeto para legalizar dos jogos de azar. Dá pra acreditar?! Com 246 votos favoráveis, vamos aos destaque para debater bingos e cassinos. Surreal!  https://t.co/cZfqNW90vs",pt,[],[],['https://pbs.twimg.com/media/FMVOIBFWUAUnA91.jpg'],27,9,104,[],[],https://twitter.com/tuliogadelha/status/1496688356910063634,False,,1,https://pbs.twimg.com/media/FMVOIBFWUAUnA91.jpg,,,,,,,[],,,,
1496152239823589383,1496152239823589383,2022-02-22 12:57:45 -03,2022-02-22,12:57:45,-300,71456987,tuliogadelha,Túlio Gadêlha,,"Bora pressionar! Precisamos aprovar a #LeiPauloGustavo que está na pauta de hoje da Câmara. Em Pernambuco, serão injetados quase R$ 100 milhões para reaquecer o setor cultural, hoje, estafado pela pandemia e pelo desgoverno Bolsonaro. #AprovaLeiPauloGustavo",pt,[],[],[],17,7,147,"['leipaulogustavo', 'aprovaleipaulogustavo']",[],https://twitter.com/tuliogadelha/status/1496152239823589383,False,,0,,,,,,,,[],,,,
1495952297012125706,1495952297012125706,2022-02-21 23:43:15 -03,2022-02-21,23:43:15,-300,71456987,tuliogadelha,Túlio Gadêlha,,"O BBB é um jogo político e Arthur sabe jogar. É coerente, tem argumentos. Não leva pro lado pessoal. As vezes, até, lembra Lula: é perseguido por alguns, mas adorado por muitos outros. Ambos constroem alianças só para exterminar adversários. E isso deixa muita gente incomodada..",pt,[],[],[],363,134,1860,[],[],https://twitter.com/tuliogadelha/status/1495952297012125706,False,,0,,,,,,,,[],,,,
1495610133463932933,1495610133463932933,2022-02-21 01:03:37 -03,2022-02-21,01:03:37,-300,71456987,tuliogadelha,Túlio Gadêlha,,"Gustavo tem que sair. Por causa dele, Laís escapou do paredão. Assim como Sérgio Moro tem que ser responsabilizado, juíz ladrão, parcial, por causa dele, Bolsonaro foi eleito. Agora o ex-juíz quer ser presidente. Dá pra acreditar? #bbb22 #forabolsonaro",pt,[],[],[],278,230,2109,"['bbb22', 'forabolsonaro']",[],https://twitter.com/tuliogadelha/status/1495610133463932933,False,,0,,,,,,,,[],,,,
1493786178822164485,1493786178822164485,2022-02-16 00:15:52 -03,2022-02-16,00:15:52,-300,71456987,tuliogadelha,Túlio Gadêlha,,"Não é vovozinha, é lobo mau. Colocou o Arthur no paredão e eliminou uma aliada. É cilada, Bino. Feito votar em Bolsonaro achando que vai acabar a mamata e assistir ele sancionar um orçamento secreto de R$ 16,48 bilhões pro centrão.  https://t.co/NcTd6d7cmy",pt,[],[],['https://pbs.twimg.com/media/FLr-m9eXMAMwdU3.jpg'],95,99,1596,[],[],https://twitter.com/tuliogadelha/status/1493786178822164485,False,,1,https://pbs.twimg.com/media/FLr-m9eXMAMwdU3.jpg,,,,,,,[],,,,
1493416431899320320,1493416431899320320,2022-02-14 23:46:38 -03,2022-02-14,23:46:38,-300,71456987,tuliogadelha,Túlio Gadêlha,,"Pegaram a Naty para Cristo, feito fizeram com Lula. Se liga que ela vai voltar muito mais forte!",pt,[],[],[],431,398,4395,[],[],https://twitter.com/tuliogadelha/status/1493416431899320320,False,,0,,,,,,,,[],,,,
1524044503467835393,1524044503467835393,2022-05-10 12:11:39 -0300,2022-05-10,12:11:39,-300,71456987,tuliogadelha,Túlio Gadêlha,,"R$ 6.754 é o mínimo necessário para uma família de quatro pessoas viver com dignidade. Despesas com saúde, moradia, transporte, educação, alimentação, higiene, lazer, vestuário, etc. Isso mesmo, no Brasil atual, o salário mínimo deveria ser o quíntuplo.  https://t.co/GObD424r54",pt,[],['https://www.metropoles.com/brasil/salario-minimo-ideal-para-abril-seria-de-r-6-75433-diz-dieese?amp'],[],0,11,60,[],[],https://twitter.com/tuliogadelha/status/1524044503467835393,False,,0,,,,,,,,[],,,,
1521563707788169217,1521563707788169217,2022-05-03 15:53:51 -0300,2022-05-03,15:53:51,-300,71456987,tuliogadelha,Túlio Gadêlha,,"Em 10 anos, triplicou o tempo de espera p INSS liberar benefícios. Aposentadorias, demissões, falta de novos concursos. Só nos últimos 6 anos, se foram, mais de 20 mil servidores, caindo de 38 para 18 mil na ativa. Precarizar para privatizar. Essa é a lógica de Bolsonaro",pt,[],[],[],30,17,221,[],[],https://twitter.com/tuliogadelha/status/1521563707788169217,False,,0,,,,,,,,[],,,,
1519868822789967872,1519868822789967872,2022-04-28 23:38:59 -0300,2022-04-28,23:38:59,-300,71456987,tuliogadelha,Túlio Gadêlha,,Uma terapia ajuda. Vai por mim. O jogo acabou e o povo tá triste e brigado. Não dá né. Vai pro Congresso fiscalizar Bolsonaro e debater com bolsonarista todo dia pra tu ver. Isso sim acaba com a sanidade mental de qualquer um! rsrs Valeu #bbb22 #foraBolsonaro,pt,[],[],[],44,38,767,"['bbb22', 'forabolsonaro']",[],https://twitter.com/tuliogadelha/status/1519868822789967872,False,,0,,,,,,,,[],,,,
1519768383738322946,1519768383738322946,2022-04-28 16:59:53 -0300,2022-04-28,16:59:53,-300,71456987,tuliogadelha,Túlio Gadêlha,,Caiu na Rede é Lula! Somos o primeiro partido fora da federação do PT à formalizar apoio à Lula. Hoje entregamos algumas de nossas propostas centrais para o futuro programa de governo. Vamos unir forças para vencer Bolsonaro e o bolsonarismo no Brasil.  https://t.co/zJWTqcUn5o,pt,[],[],"['https://pbs.twimg.com/media/FRdNSatXsAQp0Vv.jpg', 'https://pbs.twimg.com/media/FRdNSalWYAAe-36.jpg', 'https://pbs.twimg.com/media/FRdNSalXEAE5Z83.jpg', 'https://pbs.twimg.com/media/FRdNSajXoAMrrA3.jpg']",696,943,10759,[],[],https://twitter.com/tuliogadelha/status/1519768383738322946,False,,1,https://pbs.twimg.com/media/FRdNSatXsAQp0Vv.jpg,,,,,,,[],,,,
1519173091628306433,1519173091628306433,2022-04-27 01:34:24 -0300,2022-04-27,01:34:24,-300,71456987,tuliogadelha,Túlio Gadêlha,,"Arthur jogou o jogo. Ganhou sem robôs ou fake news. Diferente de Bolsonaro, que vendeu a alma ao capeta para ganhar as eleições. Mas em 2022 vai ser diferente. O TSE tá de olho. Não vai ter esquema. É o teu fim, Bolsonaro. #bbb22 #ForaBolsonaro",pt,[],[],[],330,79,1157,"['bbb22', 'forabolsonaro']",[],https://twitter.com/tuliogadelha/status/1519173091628306433,False,,0,,,,,,,,[],,,,
1518430958537654272,1518430958537654272,2022-04-25 00:25:26 -0300,2022-04-25,00:25:26,-300,71456987,tuliogadelha,Túlio Gadêlha,,"Rapaz, P.A. e D.G. são caras humanos, sensíveis, que choram, abraçam, acreditam nas relações que constroem. Homens modernos que se entregam aos sentimentos. Até metade da edição torci para o Arthur, agora, já não sei mais. Só sei que #BolsonaroNuncaMais #bbb22",pt,[],[],[],87,50,1602,"['bolsonaronuncamais', 'bbb22']",[],https://twitter.com/tuliogadelha/status/1518430958537654272,False,,0,,,,,,,,[],,,,
